GENE PRODUCT DB	GENE PRODUCT ID	SYMBOL	QUALIFIER	GO TERM	GO NAME	GO ASPECT	ECO ID	GO EVIDENCE CODE	REFERENCE	WITH/FROM	TAXON ID	TAXON NAME	ASSIGNED BY	GENE NAME	DATE
UniProtKB	P10727	spoIIAA	enables	GO:0043856	anti-sigma factor antagonist activity	molecular_function	ECO:0000318	IBA	GO_REF:0000033	PANTHER:PTN002127014|UniProtKB:P9WGE1|UniProtKB:P9WGE3	224308	Bacillus subtilis (strain 168)	GO_Central	Anti-sigma F factor antagonist	20170413
UniProtKB	P10727	spoIIAA	involved_in	GO:0045893	positive regulation of DNA-templated transcription	biological_process	ECO:0000366	IEA	GO_REF:0000108	GO:0043856	224308	Bacillus subtilis (strain 168)	GOC	Anti-sigma F factor antagonist	20260106
UniProtKB	P10727	spoIIAA	involved_in	GO:0006355	regulation of DNA-templated transcription	biological_process	ECO:0000256	IEA	GO_REF:0000002	InterPro:IPR003658|InterPro:IPR014237	224308	Bacillus subtilis (strain 168)	InterPro	Anti-sigma F factor antagonist	20260105
UniProtKB	P10727	spoIIAA	involved_in	GO:0030435	sporulation resulting in formation of a cellular spore	biological_process	ECO:0000501	IEA	GO_REF:0000120	InterPro:IPR014237|UniProtKB-KW:KW-0749	224308	Bacillus subtilis (strain 168)	UniProt	Anti-sigma F factor antagonist	20260105
UniProtKB	P10727	spoIIAA	enables	GO:0043856	anti-sigma factor antagonist activity	molecular_function	ECO:0000256	IEA	GO_REF:0000002	InterPro:IPR003658	224308	Bacillus subtilis (strain 168)	InterPro	Anti-sigma F factor antagonist	20260105
UniProtKB	P10727	spoIIAA	enables	GO:0045152	antisigma factor binding	molecular_function	ECO:0000256	IEA	GO_REF:0000002	InterPro:IPR014237	224308	Bacillus subtilis (strain 168)	InterPro	Anti-sigma F factor antagonist	20260105
