id,name,entry_type,source_tax_id,source_tax_name,full_tax_name,gene,length,subfamily,subfamily_name,in_alphafold
Q0SQL7,Phosphoglucosamine mutase,protein,289380,Clostridium perfringens (strain SM101 / Type A),Clostridium perfringens (strain SM101 / Type A),glmM,448,PTHR42946:SF1,"PHOSPHOGLUCOMUTASE (ALPHA-D-GLUCOSE-1,6-BISPHOSPHATE-DEPENDENT)",True
Q0T0A8,Phosphoglucosamine mutase,protein,373384,Shigella flexneri serotype 5b (strain 8401),Shigella flexneri serotype 5b (strain 8401),glmM,445,PTHR42946:SF1,"PHOSPHOGLUCOMUTASE (ALPHA-D-GLUCOSE-1,6-BISPHOSPHATE-DEPENDENT)",True
Q0TCT4,Phosphoglucosamine mutase,protein,362663,Escherichia coli O6:K15:H31 (strain 536 / UPEC),Escherichia coli O6:K15:H31 (strain 536 / UPEC),glmM,445,PTHR42946:SF1,"PHOSPHOGLUCOMUTASE (ALPHA-D-GLUCOSE-1,6-BISPHOSPHATE-DEPENDENT)",True
Q0TMX1,Phosphoglucosamine mutase,protein,195103,Clostridium perfringens (strain ATCC 13124 / DSM 756 / JCM 1290 / NCIMB 6125 / NCTC 8237 / Type A),Clostridium perfringens (strain ATCC 13124 / DSM 756 / JCM 1290 / NCIMB 6125 / NCTC 8237 / Type A),glmM,448,PTHR42946:SF1,"PHOSPHOGLUCOMUTASE (ALPHA-D-GLUCOSE-1,6-BISPHOSPHATE-DEPENDENT)",True
Q0VSS6,Phosphoglucosamine mutase,protein,393595,Alcanivorax borkumensis (strain ATCC 700651 / DSM 11573 / NCIMB 13689 / SK2),Alcanivorax borkumensis (strain ATCC 700651 / DSM 11573 / NCIMB 13689 / SK2),glmM,444,PTHR42946:SF1,"PHOSPHOGLUCOMUTASE (ALPHA-D-GLUCOSE-1,6-BISPHOSPHATE-DEPENDENT)",True
Q116W4,Phosphoglucosamine mutase,protein,203124,Trichodesmium erythraeum (strain IMS101),Trichodesmium erythraeum (strain IMS101),glmM,489,PTHR42946:SF1,"PHOSPHOGLUCOMUTASE (ALPHA-D-GLUCOSE-1,6-BISPHOSPHATE-DEPENDENT)",True
Q11DI7,Phosphoglucosamine mutase,protein,266779,Chelativorans sp. (strain BNC1),Chelativorans sp. (strain BNC1),glmM,451,PTHR42946:SF1,"PHOSPHOGLUCOMUTASE (ALPHA-D-GLUCOSE-1,6-BISPHOSPHATE-DEPENDENT)",True
Q129M7,Phosphoglucosamine mutase,protein,296591,Polaromonas sp. (strain JS666 / ATCC BAA-500),Polaromonas sp. (strain JS666 / ATCC BAA-500),glmM,443,PTHR42946:SF1,"PHOSPHOGLUCOMUTASE (ALPHA-D-GLUCOSE-1,6-BISPHOSPHATE-DEPENDENT)",True
Q12QI6,Phosphoglucosamine mutase,protein,318161,Shewanella denitrificans (strain OS217 / ATCC BAA-1090 / DSM 15013),Shewanella denitrificans (strain OS217 / ATCC BAA-1090 / DSM 15013),glmM,445,PTHR42946:SF1,"PHOSPHOGLUCOMUTASE (ALPHA-D-GLUCOSE-1,6-BISPHOSPHATE-DEPENDENT)",True
Q131V4,Phosphoglucosamine mutase,protein,316057,Rhodopseudomonas palustris (strain BisB5),Rhodopseudomonas palustris (strain BisB5),glmM,450,PTHR42946:SF1,"PHOSPHOGLUCOMUTASE (ALPHA-D-GLUCOSE-1,6-BISPHOSPHATE-DEPENDENT)",True
Q13W50,Phosphoglucosamine mutase,protein,266265,Paraburkholderia xenovorans (strain LB400),Paraburkholderia xenovorans (strain LB400),glmM,452,PTHR42946:SF1,"PHOSPHOGLUCOMUTASE (ALPHA-D-GLUCOSE-1,6-BISPHOSPHATE-DEPENDENT)",True
Q14JZ1,Phosphoglucosamine mutase,protein,393115,Francisella tularensis subsp. tularensis (strain FSC 198),Francisella tularensis subsp. tularensis (strain FSC 198),glmM,443,PTHR42946:SF1,"PHOSPHOGLUCOMUTASE (ALPHA-D-GLUCOSE-1,6-BISPHOSPHATE-DEPENDENT)",True
Q15VJ3,Phosphoglucosamine mutase,protein,3042615,Pseudoalteromonas atlantica (strain T6c / ATCC BAA-1087),Pseudoalteromonas atlantica (strain T6c / ATCC BAA-1087),glmM,447,PTHR42946:SF1,"PHOSPHOGLUCOMUTASE (ALPHA-D-GLUCOSE-1,6-BISPHOSPHATE-DEPENDENT)",True
Q168N3,Phosphoglucosamine mutase,protein,375451,Roseobacter denitrificans (strain ATCC 33942 / OCh 114),Roseobacter denitrificans (strain ATCC 33942 / OCh 114) (Erythrobacter sp. (strain OCh 114)),glmM,449,PTHR42946:SF1,"PHOSPHOGLUCOMUTASE (ALPHA-D-GLUCOSE-1,6-BISPHOSPHATE-DEPENDENT)",True
Q17VS9,Phosphoglucosamine mutase,protein,382638,Helicobacter acinonychis (strain Sheeba),Helicobacter acinonychis (strain Sheeba),glmM,445,PTHR42946:SF1,"PHOSPHOGLUCOMUTASE (ALPHA-D-GLUCOSE-1,6-BISPHOSPHATE-DEPENDENT)",True
Q18CL0,Phosphoglucosamine mutase,protein,272563,Clostridioides difficile (strain 630),Clostridioides difficile (strain 630),glmM,448,PTHR42946:SF1,"PHOSPHOGLUCOMUTASE (ALPHA-D-GLUCOSE-1,6-BISPHOSPHATE-DEPENDENT)",True
Q1AU65,Phosphoglucosamine mutase,protein,266117,Rubrobacter xylanophilus (strain DSM 9941 / JCM 11954 / NBRC 16129 / PRD-1),Rubrobacter xylanophilus (strain DSM 9941 / JCM 11954 / NBRC 16129 / PRD-1),glmM,444,PTHR42946:SF1,"PHOSPHOGLUCOMUTASE (ALPHA-D-GLUCOSE-1,6-BISPHOSPHATE-DEPENDENT)",True
Q1BCY7,Phosphoglucosamine mutase,protein,164756,Mycobacterium sp. (strain MCS),Mycobacterium sp. (strain MCS),glmM,445,PTHR42946:SF1,"PHOSPHOGLUCOMUTASE (ALPHA-D-GLUCOSE-1,6-BISPHOSPHATE-DEPENDENT)",True
Q1BXC7,Phosphoglucosamine mutase,protein,331271,Burkholderia orbicola (strain AU 1054),Burkholderia orbicola (strain AU 1054),glmM,451,PTHR42946:SF1,"PHOSPHOGLUCOMUTASE (ALPHA-D-GLUCOSE-1,6-BISPHOSPHATE-DEPENDENT)",True
Q1CC03,Phosphoglucosamine mutase,protein,360102,Yersinia pestis bv. Antiqua (strain Antiqua),Yersinia pestis bv. Antiqua (strain Antiqua),glmM,446,PTHR42946:SF1,"PHOSPHOGLUCOMUTASE (ALPHA-D-GLUCOSE-1,6-BISPHOSPHATE-DEPENDENT)",True
Q1CEK9,Phosphoglucosamine mutase,protein,377628,Yersinia pestis bv. Antiqua (strain Nepal516),Yersinia pestis bv. Antiqua (strain Nepal516),glmM,446,PTHR42946:SF1,"PHOSPHOGLUCOMUTASE (ALPHA-D-GLUCOSE-1,6-BISPHOSPHATE-DEPENDENT)",True
Q1CV79,Phosphoglucosamine mutase,protein,357544,Helicobacter pylori (strain HPAG1),Helicobacter pylori (strain HPAG1),glmM,445,PTHR42946:SF1,"PHOSPHOGLUCOMUTASE (ALPHA-D-GLUCOSE-1,6-BISPHOSPHATE-DEPENDENT)",True
Q1D498,Phosphoglucosamine mutase,protein,246197,Myxococcus xanthus (strain DK1622),Myxococcus xanthus (strain DK1622),glmM,458,PTHR42946:SF1,"PHOSPHOGLUCOMUTASE (ALPHA-D-GLUCOSE-1,6-BISPHOSPHATE-DEPENDENT)",True
Q1GB12,Phosphoglucosamine mutase,protein,390333,Lactobacillus delbrueckii subsp. bulgaricus (strain ATCC 11842 / DSM 20081 / BCRC 10696 / JCM 1002 / NBRC 13953 / NCIMB 11778 / NCTC 12712 / WDCM 00102 / Lb 14),Lactobacillus delbrueckii subsp. bulgaricus (strain ATCC 11842 / DSM 20081 / BCRC 10696 / JCM 1002 / NBRC 13953 / NCIMB 11778 / NCTC 12712 / WDCM 00102 / Lb 14),glmM,450,PTHR42946:SF1,"PHOSPHOGLUCOMUTASE (ALPHA-D-GLUCOSE-1,6-BISPHOSPHATE-DEPENDENT)",True
Q1GE79,Phosphoglucosamine mutase,protein,292414,Ruegeria sp. (strain TM1040),Ruegeria sp. (strain TM1040),glmM,447,PTHR42946:SF1,"PHOSPHOGLUCOMUTASE (ALPHA-D-GLUCOSE-1,6-BISPHOSPHATE-DEPENDENT)",True
Q1GUJ4,Phosphoglucosamine mutase,protein,317655,Sphingopyxis alaskensis (strain DSM 13593 / LMG 18877 / RB2256),Sphingopyxis alaskensis (strain DSM 13593 / LMG 18877 / RB2256),glmM,444,PTHR42946:SF1,"PHOSPHOGLUCOMUTASE (ALPHA-D-GLUCOSE-1,6-BISPHOSPHATE-DEPENDENT)",True
Q1H384,Phosphoglucosamine mutase,protein,265072,Methylobacillus flagellatus (strain ATCC 51484 / DSM 6875 / VKM B-1610 / KT),Methylobacillus flagellatus (strain ATCC 51484 / DSM 6875 / VKM B-1610 / KT),glmM,453,PTHR42946:SF1,"PHOSPHOGLUCOMUTASE (ALPHA-D-GLUCOSE-1,6-BISPHOSPHATE-DEPENDENT)",True
Q1IF48,Phosphoglucosamine mutase,protein,384676,Pseudomonas entomophila (strain L48),Pseudomonas entomophila (strain L48),glmM,446,PTHR42946:SF1,"PHOSPHOGLUCOMUTASE (ALPHA-D-GLUCOSE-1,6-BISPHOSPHATE-DEPENDENT)",True
Q1IV19,Phosphoglucosamine mutase,protein,204669,Koribacter versatilis (strain Ellin345),Koribacter versatilis (strain Ellin345),glmM,463,PTHR42946:SF1,"PHOSPHOGLUCOMUTASE (ALPHA-D-GLUCOSE-1,6-BISPHOSPHATE-DEPENDENT)",True
Q1IXS5,Phosphoglucosamine mutase,protein,319795,Deinococcus geothermalis (strain DSM 11300 / CIP 105573 / AG-3a),Deinococcus geothermalis (strain DSM 11300 / CIP 105573 / AG-3a),glmM,444,PTHR42946:SF1,"PHOSPHOGLUCOMUTASE (ALPHA-D-GLUCOSE-1,6-BISPHOSPHATE-DEPENDENT)",True
Q1J6W8,Phosphoglucosamine mutase,protein,370554,Streptococcus pyogenes serotype M4 (strain MGAS10750),Streptococcus pyogenes serotype M4 (strain MGAS10750),glmM,451,PTHR42946:SF1,"PHOSPHOGLUCOMUTASE (ALPHA-D-GLUCOSE-1,6-BISPHOSPHATE-DEPENDENT)",True
Q1JC19,Phosphoglucosamine mutase,protein,370553,Streptococcus pyogenes serotype M12 (strain MGAS2096),Streptococcus pyogenes serotype M12 (strain MGAS2096),glmM,451,PTHR42946:SF1,"PHOSPHOGLUCOMUTASE (ALPHA-D-GLUCOSE-1,6-BISPHOSPHATE-DEPENDENT)",True
Q1JH49,Phosphoglucosamine mutase,protein,370552,Streptococcus pyogenes serotype M2 (strain MGAS10270),Streptococcus pyogenes serotype M2 (strain MGAS10270),glmM,451,PTHR42946:SF1,"PHOSPHOGLUCOMUTASE (ALPHA-D-GLUCOSE-1,6-BISPHOSPHATE-DEPENDENT)",True
Q1JM03,Phosphoglucosamine mutase,protein,370551,Streptococcus pyogenes serotype M12 (strain MGAS9429),Streptococcus pyogenes serotype M12 (strain MGAS9429),glmM,451,PTHR42946:SF1,"PHOSPHOGLUCOMUTASE (ALPHA-D-GLUCOSE-1,6-BISPHOSPHATE-DEPENDENT)",True
Q1LLB1,Phosphoglucosamine mutase,protein,266264,Cupriavidus metallidurans (strain ATCC 43123 / DSM 2839 / NBRC 102507 / CH34),Cupriavidus metallidurans (strain ATCC 43123 / DSM 2839 / NBRC 102507 / CH34),glmM,447,PTHR42946:SF1,"PHOSPHOGLUCOMUTASE (ALPHA-D-GLUCOSE-1,6-BISPHOSPHATE-DEPENDENT)",True
Q1LSK5,Phosphoglucosamine mutase,protein,374463,Baumannia cicadellinicola subsp. Homalodisca coagulata,Baumannia cicadellinicola subsp. Homalodisca coagulata,glmM,445,PTHR42946:SF1,"PHOSPHOGLUCOMUTASE (ALPHA-D-GLUCOSE-1,6-BISPHOSPHATE-DEPENDENT)",True
Q1MC77,Phosphoglucosamine mutase,protein,216596,Rhizobium johnstonii (strain DSM 114642 / LMG 32736 / 3841),Rhizobium johnstonii (strain DSM 114642 / LMG 32736 / 3841),glmM,450,PTHR42946:SF1,"PHOSPHOGLUCOMUTASE (ALPHA-D-GLUCOSE-1,6-BISPHOSPHATE-DEPENDENT)",True
Q1MRX8,Phosphoglucosamine mutase,protein,363253,Lawsonia intracellularis (strain PHE/MN1-00),Lawsonia intracellularis (strain PHE/MN1-00),glmM,451,PTHR42946:SF1,"PHOSPHOGLUCOMUTASE (ALPHA-D-GLUCOSE-1,6-BISPHOSPHATE-DEPENDENT)",True
Q1QC16,Phosphoglucosamine mutase,protein,335284,Psychrobacter cryohalolentis (strain ATCC BAA-1226 / DSM 17306 / VKM B-2378 / K5),Psychrobacter cryohalolentis (strain ATCC BAA-1226 / DSM 17306 / VKM B-2378 / K5),glmM,455,PTHR42946:SF1,"PHOSPHOGLUCOMUTASE (ALPHA-D-GLUCOSE-1,6-BISPHOSPHATE-DEPENDENT)",True
Q1QP86,Phosphoglucosamine mutase,protein,323097,Nitrobacter hamburgensis (strain DSM 10229 / NCIMB 13809 / X14),Nitrobacter hamburgensis (strain DSM 10229 / NCIMB 13809 / X14),glmM,448,PTHR42946:SF1,"PHOSPHOGLUCOMUTASE (ALPHA-D-GLUCOSE-1,6-BISPHOSPHATE-DEPENDENT)",True
Q1QSY5,Phosphoglucosamine mutase,protein,290398,Chromohalobacter israelensis (strain ATCC BAA-138 / DSM 3043 / CIP 106854 / NCIMB 13768 / 1H11),Chromohalobacter israelensis (strain ATCC BAA-138 / DSM 3043 / CIP 106854 / NCIMB 13768 / 1H11),glmM,453,PTHR42946:SF1,"PHOSPHOGLUCOMUTASE (ALPHA-D-GLUCOSE-1,6-BISPHOSPHATE-DEPENDENT)",True
Q1R6G2,Phosphoglucosamine mutase,protein,364106,Escherichia coli (strain UTI89 / UPEC),Escherichia coli (strain UTI89 / UPEC),glmM,445,PTHR42946:SF1,"PHOSPHOGLUCOMUTASE (ALPHA-D-GLUCOSE-1,6-BISPHOSPHATE-DEPENDENT)",True
Q1WSZ9,Phosphoglucosamine mutase,protein,362948,Ligilactobacillus salivarius (strain UCC118),Ligilactobacillus salivarius (strain UCC118),glmM,450,PTHR42946:SF1,"PHOSPHOGLUCOMUTASE (ALPHA-D-GLUCOSE-1,6-BISPHOSPHATE-DEPENDENT)",True
Q20YZ7,Phosphoglucosamine mutase,protein,316056,Rhodopseudomonas palustris (strain BisB18),Rhodopseudomonas palustris (strain BisB18),glmM,450,PTHR42946:SF1,"PHOSPHOGLUCOMUTASE (ALPHA-D-GLUCOSE-1,6-BISPHOSPHATE-DEPENDENT)",True
Q21H51,Phosphoglucosamine mutase,protein,203122,Saccharophagus degradans (strain 2-40 / ATCC 43961 / DSM 17024),Saccharophagus degradans (strain 2-40 / ATCC 43961 / DSM 17024),glmM,446,PTHR42946:SF1,"PHOSPHOGLUCOMUTASE (ALPHA-D-GLUCOSE-1,6-BISPHOSPHATE-DEPENDENT)",True
Q21WW5,Phosphoglucosamine mutase,protein,338969,Albidiferax ferrireducens (strain ATCC BAA-621 / DSM 15236 / T118),Albidiferax ferrireducens (strain ATCC BAA-621 / DSM 15236 / T118),glmM,443,PTHR42946:SF1,"PHOSPHOGLUCOMUTASE (ALPHA-D-GLUCOSE-1,6-BISPHOSPHATE-DEPENDENT)",True
Q24NW7,Phosphoglucosamine mutase,protein,138119,Desulfitobacterium hafniense (strain Y51),Desulfitobacterium hafniense (strain Y51),glmM,445,PTHR42946:SF1,"PHOSPHOGLUCOMUTASE (ALPHA-D-GLUCOSE-1,6-BISPHOSPHATE-DEPENDENT)",True
Q255P2,Phosphoglucosamine mutase,protein,264202,Chlamydia felis (strain Fe/C-56),Chlamydia felis (strain Fe/C-56),glmM,458,PTHR42946:SF1,"PHOSPHOGLUCOMUTASE (ALPHA-D-GLUCOSE-1,6-BISPHOSPHATE-DEPENDENT)",True
Q28NS0,Phosphoglucosamine mutase,protein,290400,Jannaschia sp. (strain CCS1),Jannaschia sp. (strain CCS1),glmM,447,PTHR42946:SF1,"PHOSPHOGLUCOMUTASE (ALPHA-D-GLUCOSE-1,6-BISPHOSPHATE-DEPENDENT)",True
Q2A1J6,Phosphoglucosamine mutase,protein,376619,Francisella tularensis subsp. holarctica (strain LVS),Francisella tularensis subsp. holarctica (strain LVS),glmM,443,PTHR42946:SF1,"PHOSPHOGLUCOMUTASE (ALPHA-D-GLUCOSE-1,6-BISPHOSPHATE-DEPENDENT)",True
Q2FEX1,Phosphoglucosamine mutase,protein,367830,Staphylococcus aureus (strain USA300),Staphylococcus aureus (strain USA300),glmM,451,PTHR42946:SF1,"PHOSPHOGLUCOMUTASE (ALPHA-D-GLUCOSE-1,6-BISPHOSPHATE-DEPENDENT)",True
Q2GB44,Phosphoglucosamine mutase,protein,279238,Novosphingobium aromaticivorans (strain ATCC 700278 / DSM 12444 / CCUG 56034 / CIP 105152 / NBRC 16084 / F199),Novosphingobium aromaticivorans (strain ATCC 700278 / DSM 12444 / CCUG 56034 / CIP 105152 / NBRC 16084 / F199),glmM,445,PTHR42946:SF1,"PHOSPHOGLUCOMUTASE (ALPHA-D-GLUCOSE-1,6-BISPHOSPHATE-DEPENDENT)",True
Q2IHZ5,Phosphoglucosamine mutase,protein,290397,Anaeromyxobacter dehalogenans (strain 2CP-C),Anaeromyxobacter dehalogenans (strain 2CP-C),glmM,458,PTHR42946:SF1,"PHOSPHOGLUCOMUTASE (ALPHA-D-GLUCOSE-1,6-BISPHOSPHATE-DEPENDENT)",True
Q2J0J3,Phosphoglucosamine mutase,protein,316058,Rhodopseudomonas palustris (strain HaA2),Rhodopseudomonas palustris (strain HaA2),glmM,450,PTHR42946:SF1,"PHOSPHOGLUCOMUTASE (ALPHA-D-GLUCOSE-1,6-BISPHOSPHATE-DEPENDENT)",True
Q2JFE2,Phosphoglucosamine mutase,protein,106370,Frankia casuarinae (strain DSM 45818 / CECT 9043 / HFP020203 / CcI3),Frankia casuarinae (strain DSM 45818 / CECT 9043 / HFP020203 / CcI3),glmM,455,PTHR42946:SF1,"PHOSPHOGLUCOMUTASE (ALPHA-D-GLUCOSE-1,6-BISPHOSPHATE-DEPENDENT)",True
Q2K4M3,Phosphoglucosamine mutase,protein,347834,Rhizobium etli (strain ATCC 51251 / DSM 11541 / JCM 21823 / NBRC 15573 / CFN 42),Rhizobium etli (strain ATCC 51251 / DSM 11541 / JCM 21823 / NBRC 15573 / CFN 42),glmM,450,PTHR42946:SF1,"PHOSPHOGLUCOMUTASE (ALPHA-D-GLUCOSE-1,6-BISPHOSPHATE-DEPENDENT)",True
Q2KVQ6,Phosphoglucosamine mutase,protein,360910,Bordetella avium (strain 197N),Bordetella avium (strain 197N),glmM,447,PTHR42946:SF1,"PHOSPHOGLUCOMUTASE (ALPHA-D-GLUCOSE-1,6-BISPHOSPHATE-DEPENDENT)",True
Q2LRC1,Phosphoglucosamine mutase,protein,56780,Syntrophus aciditrophicus (strain SB),Syntrophus aciditrophicus (strain SB),glmM,449,PTHR42946:SF1,"PHOSPHOGLUCOMUTASE (ALPHA-D-GLUCOSE-1,6-BISPHOSPHATE-DEPENDENT)",True
Q2N850,Phosphoglucosamine mutase,protein,314225,Erythrobacter litoralis (strain HTCC2594),Erythrobacter litoralis (strain HTCC2594),glmM,452,PTHR42946:SF1,"PHOSPHOGLUCOMUTASE (ALPHA-D-GLUCOSE-1,6-BISPHOSPHATE-DEPENDENT)",True
Q2NW27,Phosphoglucosamine mutase,protein,343509,Sodalis glossinidius (strain morsitans),Sodalis glossinidius (strain morsitans),glmM,445,PTHR42946:SF1,"PHOSPHOGLUCOMUTASE (ALPHA-D-GLUCOSE-1,6-BISPHOSPHATE-DEPENDENT)",True
Q2P0U5,Phosphoglucosamine mutase,protein,342109,Xanthomonas oryzae pv. oryzae (strain MAFF 311018),Xanthomonas oryzae pv. oryzae (strain MAFF 311018),glmM,449,PTHR42946:SF1,"PHOSPHOGLUCOMUTASE (ALPHA-D-GLUCOSE-1,6-BISPHOSPHATE-DEPENDENT)",True
Q2RGA6,Phosphoglucosamine mutase,protein,264732,Moorella thermoacetica (strain ATCC 39073 / JCM 9320),Moorella thermoacetica (strain ATCC 39073 / JCM 9320),glmM,444,PTHR42946:SF1,"PHOSPHOGLUCOMUTASE (ALPHA-D-GLUCOSE-1,6-BISPHOSPHATE-DEPENDENT)",True
Q2RVE4,Phosphoglucosamine mutase,protein,269796,Rhodospirillum rubrum (strain ATCC 11170 / ATH 1.1.1 / DSM 467 / LMG 4362 / NCIMB 8255 / S1),Rhodospirillum rubrum (strain ATCC 11170 / ATH 1.1.1 / DSM 467 / LMG 4362 / NCIMB 8255 / S1),glmM,452,PTHR42946:SF1,"PHOSPHOGLUCOMUTASE (ALPHA-D-GLUCOSE-1,6-BISPHOSPHATE-DEPENDENT)",True
Q2SML8,Phosphoglucosamine mutase,protein,349521,Hahella chejuensis (strain KCTC 2396),Hahella chejuensis (strain KCTC 2396),glmM,445,PTHR42946:SF1,"PHOSPHOGLUCOMUTASE (ALPHA-D-GLUCOSE-1,6-BISPHOSPHATE-DEPENDENT)",True
Q2SUW3,Phosphoglucosamine mutase,protein,271848,Burkholderia thailandensis (strain ATCC 700388 / DSM 13276 / CCUG 48851 / CIP 106301 / E264),Burkholderia thailandensis (strain ATCC 700388 / DSM 13276 / CCUG 48851 / CIP 106301 / E264),glmM,452,PTHR42946:SF1,"PHOSPHOGLUCOMUTASE (ALPHA-D-GLUCOSE-1,6-BISPHOSPHATE-DEPENDENT)",True
Q2W2C2,Phosphoglucosamine mutase,protein,342108,Paramagnetospirillum magneticum (strain ATCC 700264 / AMB-1),Paramagnetospirillum magneticum (strain ATCC 700264 / AMB-1),glmM,451,PTHR42946:SF1,"PHOSPHOGLUCOMUTASE (ALPHA-D-GLUCOSE-1,6-BISPHOSPHATE-DEPENDENT)",True
Q2YBS8,Phosphoglucosamine mutase,protein,323848,Nitrosospira multiformis (strain ATCC 25196 / NCIMB 11849 / C 71),Nitrosospira multiformis (strain ATCC 25196 / NCIMB 11849 / C 71),glmM,463,PTHR42946:SF1,"PHOSPHOGLUCOMUTASE (ALPHA-D-GLUCOSE-1,6-BISPHOSPHATE-DEPENDENT)",True
Q2YQH8,Phosphoglucosamine mutase,protein,359391,Brucella abortus (strain 2308),Brucella abortus (strain 2308),glmM,451,PTHR42946:SF1,"PHOSPHOGLUCOMUTASE (ALPHA-D-GLUCOSE-1,6-BISPHOSPHATE-DEPENDENT)",True
Q2YYE6,Phosphoglucosamine mutase,protein,273036,Staphylococcus aureus (strain bovine RF122 / ET3-1),Staphylococcus aureus (strain bovine RF122 / ET3-1),glmM,451,PTHR42946:SF1,"PHOSPHOGLUCOMUTASE (ALPHA-D-GLUCOSE-1,6-BISPHOSPHATE-DEPENDENT)",True
Q30NW8,Phosphoglucosamine mutase,protein,326298,Sulfurimonas denitrificans (strain ATCC 33889 / DSM 1251),Sulfurimonas denitrificans (strain ATCC 33889 / DSM 1251),glmM,446,PTHR42946:SF1,"PHOSPHOGLUCOMUTASE (ALPHA-D-GLUCOSE-1,6-BISPHOSPHATE-DEPENDENT)",True
Q311T0,Phosphoglucosamine mutase,protein,207559,Oleidesulfovibrio alaskensis (strain ATCC BAA-1058 / DSM 17464 / G20),Oleidesulfovibrio alaskensis (strain ATCC BAA-1058 / DSM 17464 / G20),glmM,450,PTHR42946:SF1,"PHOSPHOGLUCOMUTASE (ALPHA-D-GLUCOSE-1,6-BISPHOSPHATE-DEPENDENT)",True
Q31CU1,Phosphoglucosamine mutase,protein,74546,Prochlorococcus marinus (strain MIT 9312),Prochlorococcus marinus (strain MIT 9312),glmM,450,PTHR42946:SF1,"PHOSPHOGLUCOMUTASE (ALPHA-D-GLUCOSE-1,6-BISPHOSPHATE-DEPENDENT)",True
Q31HG3,Phosphoglucosamine mutase,protein,317025,Hydrogenovibrio crunogenus (strain DSM 25203 / XCL-2),Hydrogenovibrio crunogenus (strain DSM 25203 / XCL-2),glmM,444,PTHR42946:SF1,"PHOSPHOGLUCOMUTASE (ALPHA-D-GLUCOSE-1,6-BISPHOSPHATE-DEPENDENT)",True
Q31LA7,Phosphoglucosamine mutase,protein,1140,Synechococcus elongatus (strain ATCC 33912 / PCC 7942 / FACHB-805),Synechococcus elongatus (strain ATCC 33912 / PCC 7942 / FACHB-805),glmM,472,PTHR42946:SF1,"PHOSPHOGLUCOMUTASE (ALPHA-D-GLUCOSE-1,6-BISPHOSPHATE-DEPENDENT)",True
Q31W53,Phosphoglucosamine mutase,protein,300268,Shigella boydii serotype 4 (strain Sb227),Shigella boydii serotype 4 (strain Sb227),glmM,445,PTHR42946:SF1,"PHOSPHOGLUCOMUTASE (ALPHA-D-GLUCOSE-1,6-BISPHOSPHATE-DEPENDENT)",True
Q32BF7,Phosphoglucosamine mutase,protein,300267,Shigella dysenteriae serotype 1 (strain Sd197),Shigella dysenteriae serotype 1 (strain Sd197),glmM,445,PTHR42946:SF1,"PHOSPHOGLUCOMUTASE (ALPHA-D-GLUCOSE-1,6-BISPHOSPHATE-DEPENDENT)",True
Q38VX2,Phosphoglucosamine mutase,protein,314315,Latilactobacillus sakei subsp. sakei (strain 23K),Latilactobacillus sakei subsp. sakei (strain 23K),glmM,450,PTHR42946:SF1,"PHOSPHOGLUCOMUTASE (ALPHA-D-GLUCOSE-1,6-BISPHOSPHATE-DEPENDENT)",True
Q39HM9,Phosphoglucosamine mutase,protein,482957,Burkholderia lata (strain ATCC 17760 / DSM 23089 / LMG 22485 / NCIMB 9086 / R18194 / 383),Burkholderia lata (strain ATCC 17760 / DSM 23089 / LMG 22485 / NCIMB 9086 / R18194 / 383),glmM,451,PTHR42946:SF1,"PHOSPHOGLUCOMUTASE (ALPHA-D-GLUCOSE-1,6-BISPHOSPHATE-DEPENDENT)",True
Q39UF9,Phosphoglucosamine mutase,protein,269799,Geobacter metallireducens (strain ATCC 53774 / DSM 7210 / GS-15),Geobacter metallireducens (strain ATCC 53774 / DSM 7210 / GS-15),glmM,451,PTHR42946:SF1,"PHOSPHOGLUCOMUTASE (ALPHA-D-GLUCOSE-1,6-BISPHOSPHATE-DEPENDENT)",True
Q3A5V5,Phosphoglucosamine mutase,protein,338963,Syntrophotalea carbinolica (strain DSM 2380 / NBRC 103641 / GraBd1),Syntrophotalea carbinolica (strain DSM 2380 / NBRC 103641 / GraBd1),glmM,457,PTHR42946:SF1,"PHOSPHOGLUCOMUTASE (ALPHA-D-GLUCOSE-1,6-BISPHOSPHATE-DEPENDENT)",True
Q3AAK3,Phosphoglucosamine mutase,protein,246194,Carboxydothermus hydrogenoformans (strain ATCC BAA-161 / DSM 6008 / Z-2901),Carboxydothermus hydrogenoformans (strain ATCC BAA-161 / DSM 6008 / Z-2901),glmM,443,PTHR42946:SF1,"PHOSPHOGLUCOMUTASE (ALPHA-D-GLUCOSE-1,6-BISPHOSPHATE-DEPENDENT)",True
Q3AMX9,Phosphoglucosamine mutase,protein,110662,Synechococcus sp. (strain CC9605),Synechococcus sp. (strain CC9605),glmM,464,PTHR42946:SF1,"PHOSPHOGLUCOMUTASE (ALPHA-D-GLUCOSE-1,6-BISPHOSPHATE-DEPENDENT)",True
Q3AW32,Phosphoglucosamine mutase,protein,316279,Synechococcus sp. (strain CC9902),Synechococcus sp. (strain CC9902),glmM,464,PTHR42946:SF1,"PHOSPHOGLUCOMUTASE (ALPHA-D-GLUCOSE-1,6-BISPHOSPHATE-DEPENDENT)",True
Q3BRL9,Phosphoglucosamine mutase,protein,316273,Xanthomonas euvesicatoria pv. vesicatoria (strain 85-10),Xanthomonas euvesicatoria pv. vesicatoria (strain 85-10),glmM,449,PTHR42946:SF1,"PHOSPHOGLUCOMUTASE (ALPHA-D-GLUCOSE-1,6-BISPHOSPHATE-DEPENDENT)",True
Q3IE61,Phosphoglucosamine mutase,protein,326442,Pseudoalteromonas translucida (strain TAC 125),Pseudoalteromonas translucida (strain TAC 125),glmM,449,PTHR42946:SF1,"PHOSPHOGLUCOMUTASE (ALPHA-D-GLUCOSE-1,6-BISPHOSPHATE-DEPENDENT)",True
Q3J5C2,Phosphoglucosamine mutase,protein,272943,Cereibacter sphaeroides (strain ATCC 17023 / DSM 158 / JCM 6121 / CCUG 31486 / LMG 2827 / NBRC 12203 / NCIMB 8253 / ATH 2.4.1.),Cereibacter sphaeroides (strain ATCC 17023 / DSM 158 / JCM 6121 / CCUG 31486 / LMG 2827 / NBRC 12203 / NCIMB 8253 / ATH 2.4.1.),glmM,447,PTHR42946:SF1,"PHOSPHOGLUCOMUTASE (ALPHA-D-GLUCOSE-1,6-BISPHOSPHATE-DEPENDENT)",True
Q3J826,Phosphoglucosamine mutase,protein,323261,Nitrosococcus oceani (strain ATCC 19707 / BCRC 17464 / JCM 30415 / NCIMB 11848 / C-107),Nitrosococcus oceani (strain ATCC 19707 / BCRC 17464 / JCM 30415 / NCIMB 11848 / C-107),glmM,451,PTHR42946:SF1,"PHOSPHOGLUCOMUTASE (ALPHA-D-GLUCOSE-1,6-BISPHOSPHATE-DEPENDENT)",True
Q3JTT2,Phosphoglucosamine mutase,protein,320372,Burkholderia pseudomallei (strain 1710b),Burkholderia pseudomallei (strain 1710b),glmM,452,PTHR42946:SF1,"PHOSPHOGLUCOMUTASE (ALPHA-D-GLUCOSE-1,6-BISPHOSPHATE-DEPENDENT)",True
Q3K1H1,Phosphoglucosamine mutase,protein,205921,Streptococcus agalactiae serotype Ia (strain ATCC 27591 / A909 / CDC SS700),Streptococcus agalactiae serotype Ia (strain ATCC 27591 / A909 / CDC SS700),glmM,450,PTHR42946:SF1,"PHOSPHOGLUCOMUTASE (ALPHA-D-GLUCOSE-1,6-BISPHOSPHATE-DEPENDENT)",True
Q3KI89,Phosphoglucosamine mutase,protein,205922,Pseudomonas fluorescens (strain Pf0-1),Pseudomonas fluorescens (strain Pf0-1),glmM,445,PTHR42946:SF1,"PHOSPHOGLUCOMUTASE (ALPHA-D-GLUCOSE-1,6-BISPHOSPHATE-DEPENDENT)",True
Q3KKM5,Phosphoglucosamine mutase,protein,315277,Chlamydia trachomatis serovar A (strain ATCC VR-571B / DSM 19440 / HAR-13),Chlamydia trachomatis serovar A (strain ATCC VR-571B / DSM 19440 / HAR-13),glmM,458,PTHR42946:SF1,"PHOSPHOGLUCOMUTASE (ALPHA-D-GLUCOSE-1,6-BISPHOSPHATE-DEPENDENT)",True
Q3M6L2,Phosphoglucosamine mutase,protein,240292,Trichormus variabilis (strain ATCC 29413 / PCC 7937),Trichormus variabilis (strain ATCC 29413 / PCC 7937),glmM,490,PTHR42946:SF1,"PHOSPHOGLUCOMUTASE (ALPHA-D-GLUCOSE-1,6-BISPHOSPHATE-DEPENDENT)",True
Q3SJR2,Phosphoglucosamine mutase,protein,292415,Thiobacillus denitrificans (strain ATCC 25259 / T1),Thiobacillus denitrificans (strain ATCC 25259 / T1),glmM,458,PTHR42946:SF1,"PHOSPHOGLUCOMUTASE (ALPHA-D-GLUCOSE-1,6-BISPHOSPHATE-DEPENDENT)",True
Q3SNB8,Phosphoglucosamine mutase,protein,323098,Nitrobacter winogradskyi (strain ATCC 25391 / DSM 10237 / CIP 104748 / NCIMB 11846 / Nb-255),Nitrobacter winogradskyi (strain ATCC 25391 / DSM 10237 / CIP 104748 / NCIMB 11846 / Nb-255),glmM,448,PTHR42946:SF1,"PHOSPHOGLUCOMUTASE (ALPHA-D-GLUCOSE-1,6-BISPHOSPHATE-DEPENDENT)",True
Q3YX65,Phosphoglucosamine mutase,protein,300269,Shigella sonnei (strain Ss046),Shigella sonnei (strain Ss046),glmM,445,PTHR42946:SF1,"PHOSPHOGLUCOMUTASE (ALPHA-D-GLUCOSE-1,6-BISPHOSPHATE-DEPENDENT)",True
Q46ZA1,Phosphoglucosamine mutase,protein,264198,Cupriavidus pinatubonensis (strain JMP 134 / LMG 1197),Cupriavidus pinatubonensis (strain JMP 134 / LMG 1197),glmM,447,PTHR42946:SF1,"PHOSPHOGLUCOMUTASE (ALPHA-D-GLUCOSE-1,6-BISPHOSPHATE-DEPENDENT)",True
Q47HH9,Phosphoglucosamine mutase,protein,159087,Dechloromonas aromatica (strain RCB),Dechloromonas aromatica (strain RCB),glmM,450,PTHR42946:SF1,"PHOSPHOGLUCOMUTASE (ALPHA-D-GLUCOSE-1,6-BISPHOSPHATE-DEPENDENT)",True
Q47LM7,Phosphoglucosamine mutase,protein,269800,Thermobifida fusca (strain YX),Thermobifida fusca (strain YX),glmM,449,PTHR42946:SF1,"PHOSPHOGLUCOMUTASE (ALPHA-D-GLUCOSE-1,6-BISPHOSPHATE-DEPENDENT)",True
Q47YJ7,Phosphoglucosamine mutase,protein,167879,Colwellia psychrerythraea (strain 34H / ATCC BAA-681),Colwellia psychrerythraea (strain 34H / ATCC BAA-681),glmM,445,PTHR42946:SF1,"PHOSPHOGLUCOMUTASE (ALPHA-D-GLUCOSE-1,6-BISPHOSPHATE-DEPENDENT)",True
Q48E72,Phosphoglucosamine mutase,protein,264730,Pseudomonas savastanoi pv. phaseolicola (strain 1448A / Race 6),Pseudomonas savastanoi pv. phaseolicola (strain 1448A / Race 6),glmM,447,PTHR42946:SF1,"PHOSPHOGLUCOMUTASE (ALPHA-D-GLUCOSE-1,6-BISPHOSPHATE-DEPENDENT)",True
Q48TV1,Phosphoglucosamine mutase,protein,319701,Streptococcus pyogenes serotype M28 (strain MGAS6180),Streptococcus pyogenes serotype M28 (strain MGAS6180),glmM,451,PTHR42946:SF1,"PHOSPHOGLUCOMUTASE (ALPHA-D-GLUCOSE-1,6-BISPHOSPHATE-DEPENDENT)",True
