id,name,entry_type,source_tax_id,source_tax_name,full_tax_name,gene,length,subfamily,subfamily_name,in_alphafold
B1N017,Phosphoglucosamine mutase,protein,349519,Leuconostoc citreum (strain KM20),Leuconostoc citreum (strain KM20),glmM,455,PTHR42946:SF1,"PHOSPHOGLUCOMUTASE (ALPHA-D-GLUCOSE-1,6-BISPHOSPHATE-DEPENDENT)",True
B1VEZ9,Phosphoglucosamine mutase,protein,504474,Corynebacterium urealyticum (strain ATCC 43042 / DSM 7109),Corynebacterium urealyticum (strain ATCC 43042 / DSM 7109),glmM,446,PTHR42946:SF1,"PHOSPHOGLUCOMUTASE (ALPHA-D-GLUCOSE-1,6-BISPHOSPHATE-DEPENDENT)",True
B1W3X3,Phosphoglucosamine mutase,protein,455632,Streptomyces griseus subsp. griseus (strain JCM 4626 / CBS 651.72 / NBRC 13350 / KCC S-0626 / ISP 5235),Streptomyces griseus subsp. griseus (strain JCM 4626 / CBS 651.72 / NBRC 13350 / KCC S-0626 / ISP 5235),glmM,452,PTHR42946:SF1,"PHOSPHOGLUCOMUTASE (ALPHA-D-GLUCOSE-1,6-BISPHOSPHATE-DEPENDENT)",True
B1WR00,Phosphoglucosamine mutase,protein,43989,Crocosphaera subtropica (strain ATCC 51142 / BH68),Crocosphaera subtropica (strain ATCC 51142 / BH68),glmM,485,PTHR42946:SF1,"PHOSPHOGLUCOMUTASE (ALPHA-D-GLUCOSE-1,6-BISPHOSPHATE-DEPENDENT)",True
B1XGY6,Phosphoglucosamine mutase,protein,316385,Escherichia coli (strain K12 / DH10B),Escherichia coli (strain K12 / DH10B),glmM,445,PTHR42946:SF1,"PHOSPHOGLUCOMUTASE (ALPHA-D-GLUCOSE-1,6-BISPHOSPHATE-DEPENDENT)",True
B1XP15,Phosphoglucosamine mutase,protein,32049,Picosynechococcus sp. (strain ATCC 27264 / PCC 7002 / PR-6),Picosynechococcus sp. (strain ATCC 27264 / PCC 7002 / PR-6),glmM,481,PTHR42946:SF1,"PHOSPHOGLUCOMUTASE (ALPHA-D-GLUCOSE-1,6-BISPHOSPHATE-DEPENDENT)",True
B1XXG0,Phosphoglucosamine mutase,protein,395495,Leptothrix cholodnii (strain ATCC 51168 / LMG 8142 / SP-6),Leptothrix cholodnii (strain ATCC 51168 / LMG 8142 / SP-6),glmM,444,PTHR42946:SF1,"PHOSPHOGLUCOMUTASE (ALPHA-D-GLUCOSE-1,6-BISPHOSPHATE-DEPENDENT)",True
B1YH95,Phosphoglucosamine mutase,protein,262543,Exiguobacterium sibiricum (strain DSM 17290 / CCUG 55495 / CIP 109462 / JCM 13490 / 255-15),Exiguobacterium sibiricum (strain DSM 17290 / CCUG 55495 / CIP 109462 / JCM 13490 / 255-15),glmM,451,PTHR42946:SF1,"PHOSPHOGLUCOMUTASE (ALPHA-D-GLUCOSE-1,6-BISPHOSPHATE-DEPENDENT)",True
B1YMW5,Phosphoglucosamine mutase,protein,398577,Burkholderia ambifaria (strain MC40-6),Burkholderia ambifaria (strain MC40-6),glmM,451,PTHR42946:SF1,"PHOSPHOGLUCOMUTASE (ALPHA-D-GLUCOSE-1,6-BISPHOSPHATE-DEPENDENT)",True
B1ZBR8,Phosphoglucosamine mutase,protein,441620,Methylorubrum populi (strain ATCC BAA-705 / NCIMB 13946 / BJ001),Methylorubrum populi (strain ATCC BAA-705 / NCIMB 13946 / BJ001),glmM,446,PTHR42946:SF1,"PHOSPHOGLUCOMUTASE (ALPHA-D-GLUCOSE-1,6-BISPHOSPHATE-DEPENDENT)",True
B2A4R9,Phosphoglucosamine mutase,protein,457570,Natranaerobius thermophilus (strain ATCC BAA-1301 / DSM 18059 / JW/NM-WN-LF),Natranaerobius thermophilus (strain ATCC BAA-1301 / DSM 18059 / JW/NM-WN-LF),glmM,442,PTHR42946:SF1,"PHOSPHOGLUCOMUTASE (ALPHA-D-GLUCOSE-1,6-BISPHOSPHATE-DEPENDENT)",True
B2FNY7,Phosphoglucosamine mutase,protein,522373,Stenotrophomonas maltophilia (strain K279a),Stenotrophomonas maltophilia (strain K279a),glmM,453,PTHR42946:SF1,"PHOSPHOGLUCOMUTASE (ALPHA-D-GLUCOSE-1,6-BISPHOSPHATE-DEPENDENT)",True
B2G638,Phosphoglucosamine mutase,protein,557433,Limosilactobacillus reuteri subsp. reuteri (strain JCM 1112),Limosilactobacillus reuteri subsp. reuteri (strain JCM 1112),glmM,451,PTHR42946:SF1,"PHOSPHOGLUCOMUTASE (ALPHA-D-GLUCOSE-1,6-BISPHOSPHATE-DEPENDENT)",True
B2GAN5,Phosphoglucosamine mutase,protein,334390,Limosilactobacillus fermentum (strain NBRC 3956 / LMG 18251),Limosilactobacillus fermentum (strain NBRC 3956 / LMG 18251),glmM,452,PTHR42946:SF1,"PHOSPHOGLUCOMUTASE (ALPHA-D-GLUCOSE-1,6-BISPHOSPHATE-DEPENDENT)",True
B2GJ26,Phosphoglucosamine mutase,protein,378753,Kocuria rhizophila (strain ATCC 9341 / DSM 348 / NBRC 103217 / DC2201),Kocuria rhizophila (strain ATCC 9341 / DSM 348 / NBRC 103217 / DC2201),glmM,451,PTHR42946:SF1,"PHOSPHOGLUCOMUTASE (ALPHA-D-GLUCOSE-1,6-BISPHOSPHATE-DEPENDENT)",True
B2HCZ2,Phosphoglucosamine mutase,protein,216594,Mycobacterium marinum (strain ATCC BAA-535 / M),Mycobacterium marinum (strain ATCC BAA-535 / M),glmM,445,PTHR42946:SF1,"PHOSPHOGLUCOMUTASE (ALPHA-D-GLUCOSE-1,6-BISPHOSPHATE-DEPENDENT)",True
B2I1H8,Phosphoglucosamine mutase,protein,405416,Acinetobacter baumannii (strain ACICU),Acinetobacter baumannii (strain ACICU),glmM,445,PTHR42946:SF1,"PHOSPHOGLUCOMUTASE (ALPHA-D-GLUCOSE-1,6-BISPHOSPHATE-DEPENDENT)",True
B2IA03,Phosphoglucosamine mutase,protein,405441,Xylella fastidiosa (strain M23),Xylella fastidiosa (strain M23),glmM,446,PTHR42946:SF1,"PHOSPHOGLUCOMUTASE (ALPHA-D-GLUCOSE-1,6-BISPHOSPHATE-DEPENDENT)",True
B2IGB3,Phosphoglucosamine mutase,protein,395963,Beijerinckia indica subsp. indica (strain ATCC 9039 / DSM 1715 / NCIMB 8712),Beijerinckia indica subsp. indica (strain ATCC 9039 / DSM 1715 / NCIMB 8712),glmM,451,PTHR42946:SF1,"PHOSPHOGLUCOMUTASE (ALPHA-D-GLUCOSE-1,6-BISPHOSPHATE-DEPENDENT)",True
B2IR78,Phosphoglucosamine mutase,protein,516950,Streptococcus pneumoniae (strain CGSP14),Streptococcus pneumoniae (strain CGSP14),glmM,450,PTHR42946:SF1,"PHOSPHOGLUCOMUTASE (ALPHA-D-GLUCOSE-1,6-BISPHOSPHATE-DEPENDENT)",True
B2J997,Phosphoglucosamine mutase,protein,63737,Nostoc punctiforme (strain ATCC 29133 / PCC 73102),Nostoc punctiforme (strain ATCC 29133 / PCC 73102),glmM,490,PTHR42946:SF1,"PHOSPHOGLUCOMUTASE (ALPHA-D-GLUCOSE-1,6-BISPHOSPHATE-DEPENDENT)",True
B2JFP2,Phosphoglucosamine mutase,protein,391038,Paraburkholderia phymatum (strain DSM 17167 / CIP 108236 / LMG 21445 / STM815),Paraburkholderia phymatum (strain DSM 17167 / CIP 108236 / LMG 21445 / STM815),glmM,452,PTHR42946:SF1,"PHOSPHOGLUCOMUTASE (ALPHA-D-GLUCOSE-1,6-BISPHOSPHATE-DEPENDENT)",True
B2K2Q1,Phosphoglucosamine mutase,protein,502801,Yersinia pseudotuberculosis serotype IB (strain PB1/+),Yersinia pseudotuberculosis serotype IB (strain PB1/+),glmM,446,PTHR42946:SF1,"PHOSPHOGLUCOMUTASE (ALPHA-D-GLUCOSE-1,6-BISPHOSPHATE-DEPENDENT)",True
B2SEZ6,Phosphoglucosamine mutase,protein,441952,Francisella tularensis subsp. mediasiatica (strain FSC147),Francisella tularensis subsp. mediasiatica (strain FSC147),glmM,443,PTHR42946:SF1,"PHOSPHOGLUCOMUTASE (ALPHA-D-GLUCOSE-1,6-BISPHOSPHATE-DEPENDENT)",True
B2SVN3,Phosphoglucosamine mutase,protein,360094,Xanthomonas oryzae pv. oryzae (strain PXO99A),Xanthomonas oryzae pv. oryzae (strain PXO99A),glmM,449,PTHR42946:SF1,"PHOSPHOGLUCOMUTASE (ALPHA-D-GLUCOSE-1,6-BISPHOSPHATE-DEPENDENT)",True
B2SZR6,Phosphoglucosamine mutase,protein,398527,Paraburkholderia phytofirmans (strain DSM 17436 / LMG 22146 / PsJN),Paraburkholderia phytofirmans (strain DSM 17436 / LMG 22146 / PsJN),glmM,452,PTHR42946:SF1,"PHOSPHOGLUCOMUTASE (ALPHA-D-GLUCOSE-1,6-BISPHOSPHATE-DEPENDENT)",True
B2TIN7,Phosphoglucosamine mutase,protein,935198,Clostridium botulinum (strain Eklund 17B / Type B),Clostridium botulinum (strain Eklund 17B / Type B),glmM,447,PTHR42946:SF1,"PHOSPHOGLUCOMUTASE (ALPHA-D-GLUCOSE-1,6-BISPHOSPHATE-DEPENDENT)",True
B2U201,Phosphoglucosamine mutase,protein,344609,Shigella boydii serotype 18 (strain CDC 3083-94 / BS512),Shigella boydii serotype 18 (strain CDC 3083-94 / BS512),glmM,445,PTHR42946:SF1,"PHOSPHOGLUCOMUTASE (ALPHA-D-GLUCOSE-1,6-BISPHOSPHATE-DEPENDENT)",True
B2UGP7,Phosphoglucosamine mutase,protein,402626,Ralstonia pickettii (strain 12J),Ralstonia pickettii (strain 12J),glmM,447,PTHR42946:SF1,"PHOSPHOGLUCOMUTASE (ALPHA-D-GLUCOSE-1,6-BISPHOSPHATE-DEPENDENT)",True
B2UW73,Phosphoglucosamine mutase,protein,512562,Helicobacter pylori (strain Shi470),Helicobacter pylori (strain Shi470),glmM,445,PTHR42946:SF1,"PHOSPHOGLUCOMUTASE (ALPHA-D-GLUCOSE-1,6-BISPHOSPHATE-DEPENDENT)",True
B2UYH3,Phosphoglucosamine mutase,protein,508767,Clostridium botulinum (strain Alaska E43 / Type E3),Clostridium botulinum (strain Alaska E43 / Type E3),glmM,447,PTHR42946:SF1,"PHOSPHOGLUCOMUTASE (ALPHA-D-GLUCOSE-1,6-BISPHOSPHATE-DEPENDENT)",True
B2VGT8,Phosphoglucosamine mutase,protein,465817,Erwinia tasmaniensis (strain DSM 17950 / CFBP 7177 / CIP 109463 / NCPPB 4357 / Et1/99),Erwinia tasmaniensis (strain DSM 17950 / CFBP 7177 / CIP 109463 / NCPPB 4357 / Et1/99),glmM,444,PTHR42946:SF1,"PHOSPHOGLUCOMUTASE (ALPHA-D-GLUCOSE-1,6-BISPHOSPHATE-DEPENDENT)",True
B3DTC2,Phosphoglucosamine mutase,protein,205913,Bifidobacterium longum (strain DJO10A),Bifidobacterium longum (strain DJO10A),glmM,461,PTHR42946:SF1,"PHOSPHOGLUCOMUTASE (ALPHA-D-GLUCOSE-1,6-BISPHOSPHATE-DEPENDENT)",True
B3E692,Phosphoglucosamine mutase,protein,398767,Trichlorobacter lovleyi (strain ATCC BAA-1151 / DSM 17278 / SZ),Trichlorobacter lovleyi (strain ATCC BAA-1151 / DSM 17278 / SZ),glmM,452,PTHR42946:SF1,"PHOSPHOGLUCOMUTASE (ALPHA-D-GLUCOSE-1,6-BISPHOSPHATE-DEPENDENT)",True
B3H286,Phosphoglucosamine mutase,protein,537457,Actinobacillus pleuropneumoniae serotype 7 (strain AP76),Actinobacillus pleuropneumoniae serotype 7 (strain AP76),glmM,444,PTHR42946:SF1,"PHOSPHOGLUCOMUTASE (ALPHA-D-GLUCOSE-1,6-BISPHOSPHATE-DEPENDENT)",True
B3PLQ1,Phosphoglucosamine mutase,protein,498211,Cellvibrio japonicus (strain Ueda107),Cellvibrio japonicus (strain Ueda107),glmM,445,PTHR42946:SF1,"PHOSPHOGLUCOMUTASE (ALPHA-D-GLUCOSE-1,6-BISPHOSPHATE-DEPENDENT)",True
B3PYX0,Phosphoglucosamine mutase,protein,491916,Rhizobium etli (strain CIAT 652),Rhizobium etli (strain CIAT 652),glmM,450,PTHR42946:SF1,"PHOSPHOGLUCOMUTASE (ALPHA-D-GLUCOSE-1,6-BISPHOSPHATE-DEPENDENT)",True
B3Q6Y9,Phosphoglucosamine mutase,protein,395960,Rhodopseudomonas palustris (strain TIE-1),Rhodopseudomonas palustris (strain TIE-1),glmM,450,PTHR42946:SF1,"PHOSPHOGLUCOMUTASE (ALPHA-D-GLUCOSE-1,6-BISPHOSPHATE-DEPENDENT)",True
B3R1R9,Phosphoglucosamine mutase,protein,977880,Cupriavidus taiwanensis (strain DSM 17343 / BCRC 17206 / CCUG 44338 / CIP 107171 / LMG 19424 / R1),Cupriavidus taiwanensis (strain DSM 17343 / BCRC 17206 / CCUG 44338 / CIP 107171 / LMG 19424 / R1),glmM,447,PTHR42946:SF1,"PHOSPHOGLUCOMUTASE (ALPHA-D-GLUCOSE-1,6-BISPHOSPHATE-DEPENDENT)",True
B3WD16,Phosphoglucosamine mutase,protein,543734,Lacticaseibacillus casei (strain BL23),Lacticaseibacillus casei (strain BL23),glmM,454,PTHR42946:SF1,"PHOSPHOGLUCOMUTASE (ALPHA-D-GLUCOSE-1,6-BISPHOSPHATE-DEPENDENT)",True
B4E5F6,Phosphoglucosamine mutase,protein,216591,Burkholderia cenocepacia (strain ATCC BAA-245 / DSM 16553 / LMG 16656 / NCTC 13227 / J2315 / CF5610),Burkholderia cenocepacia (strain ATCC BAA-245 / DSM 16553 / LMG 16656 / NCTC 13227 / J2315 / CF5610),glmM,451,PTHR42946:SF1,"PHOSPHOGLUCOMUTASE (ALPHA-D-GLUCOSE-1,6-BISPHOSPHATE-DEPENDENT)",True
B4F2B5,Phosphoglucosamine mutase,protein,529507,Proteus mirabilis (strain HI4320),Proteus mirabilis (strain HI4320),glmM,445,PTHR42946:SF1,"PHOSPHOGLUCOMUTASE (ALPHA-D-GLUCOSE-1,6-BISPHOSPHATE-DEPENDENT)",True
B4R906,Phosphoglucosamine mutase,protein,450851,Phenylobacterium zucineum (strain HLK1),Phenylobacterium zucineum (strain HLK1),glmM,450,PTHR42946:SF1,"PHOSPHOGLUCOMUTASE (ALPHA-D-GLUCOSE-1,6-BISPHOSPHATE-DEPENDENT)",True
B4SQU4,Phosphoglucosamine mutase,protein,391008,Stenotrophomonas maltophilia (strain R551-3),Stenotrophomonas maltophilia (strain R551-3),glmM,453,PTHR42946:SF1,"PHOSPHOGLUCOMUTASE (ALPHA-D-GLUCOSE-1,6-BISPHOSPHATE-DEPENDENT)",True
B4T705,Phosphoglucosamine mutase,protein,423368,Salmonella newport (strain SL254),Salmonella newport (strain SL254),glmM,445,PTHR42946:SF1,"PHOSPHOGLUCOMUTASE (ALPHA-D-GLUCOSE-1,6-BISPHOSPHATE-DEPENDENT)",True
B4TJ12,Phosphoglucosamine mutase,protein,454169,Salmonella heidelberg (strain SL476),Salmonella heidelberg (strain SL476),glmM,445,PTHR42946:SF1,"PHOSPHOGLUCOMUTASE (ALPHA-D-GLUCOSE-1,6-BISPHOSPHATE-DEPENDENT)",True
B4TWE3,Phosphoglucosamine mutase,protein,439843,Salmonella schwarzengrund (strain CVM19633),Salmonella schwarzengrund (strain CVM19633),glmM,445,PTHR42946:SF1,"PHOSPHOGLUCOMUTASE (ALPHA-D-GLUCOSE-1,6-BISPHOSPHATE-DEPENDENT)",True
B4U3I6,Phosphoglucosamine mutase,protein,552526,Streptococcus equi subsp. zooepidemicus (strain MGCS10565),Streptococcus equi subsp. zooepidemicus (strain MGCS10565),glmM,450,PTHR42946:SF1,"PHOSPHOGLUCOMUTASE (ALPHA-D-GLUCOSE-1,6-BISPHOSPHATE-DEPENDENT)",True
B5BGK0,Phosphoglucosamine mutase,protein,554290,Salmonella paratyphi A (strain AKU_12601),Salmonella paratyphi A (strain AKU_12601),glmM,445,PTHR42946:SF1,"PHOSPHOGLUCOMUTASE (ALPHA-D-GLUCOSE-1,6-BISPHOSPHATE-DEPENDENT)",True
B5E6K3,Phosphoglucosamine mutase,protein,512566,Streptococcus pneumoniae serotype 19F (strain G54),Streptococcus pneumoniae serotype 19F (strain G54),glmM,450,PTHR42946:SF1,"PHOSPHOGLUCOMUTASE (ALPHA-D-GLUCOSE-1,6-BISPHOSPHATE-DEPENDENT)",False
B5EHA7,Phosphoglucosamine mutase,protein,404380,Citrifermentans bemidjiense (strain ATCC BAA-1014 / DSM 16622 / JCM 12645 / Bem),Citrifermentans bemidjiense (strain ATCC BAA-1014 / DSM 16622 / JCM 12645 / Bem),glmM,454,PTHR42946:SF1,"PHOSPHOGLUCOMUTASE (ALPHA-D-GLUCOSE-1,6-BISPHOSPHATE-DEPENDENT)",True
B5F6U4,Phosphoglucosamine mutase,protein,454166,Salmonella agona (strain SL483),Salmonella agona (strain SL483),glmM,445,PTHR42946:SF1,"PHOSPHOGLUCOMUTASE (ALPHA-D-GLUCOSE-1,6-BISPHOSPHATE-DEPENDENT)",True
B5FA75,Phosphoglucosamine mutase,protein,388396,Aliivibrio fischeri (strain MJ11),Aliivibrio fischeri (strain MJ11),glmM,445,PTHR42946:SF1,"PHOSPHOGLUCOMUTASE (ALPHA-D-GLUCOSE-1,6-BISPHOSPHATE-DEPENDENT)",True
B5FI19,Phosphoglucosamine mutase,protein,439851,Salmonella dublin (strain CT_02021853),Salmonella dublin (strain CT_02021853),glmM,445,PTHR42946:SF1,"PHOSPHOGLUCOMUTASE (ALPHA-D-GLUCOSE-1,6-BISPHOSPHATE-DEPENDENT)",True
B5QZW4,Phosphoglucosamine mutase,protein,550537,Salmonella enteritidis PT4 (strain P125109),Salmonella enteritidis PT4 (strain P125109),glmM,445,PTHR42946:SF1,"PHOSPHOGLUCOMUTASE (ALPHA-D-GLUCOSE-1,6-BISPHOSPHATE-DEPENDENT)",True
B5REP2,Phosphoglucosamine mutase,protein,550538,Salmonella gallinarum (strain 287/91 / NCTC 13346),Salmonella gallinarum (strain 287/91 / NCTC 13346),glmM,445,PTHR42946:SF1,"PHOSPHOGLUCOMUTASE (ALPHA-D-GLUCOSE-1,6-BISPHOSPHATE-DEPENDENT)",True
B5XSW5,Phosphoglucosamine mutase,protein,507522,Klebsiella variicola (strain 342),Klebsiella variicola (strain 342),glmM,445,PTHR42946:SF1,"PHOSPHOGLUCOMUTASE (ALPHA-D-GLUCOSE-1,6-BISPHOSPHATE-DEPENDENT)",True
B5YDY1,Phosphoglucosamine mutase,protein,309799,Dictyoglomus thermophilum (strain ATCC 35947 / DSM 3960 / H-6-12),Dictyoglomus thermophilum (strain ATCC 35947 / DSM 3960 / H-6-12),glmM,458,PTHR42946:SF1,"PHOSPHOGLUCOMUTASE (ALPHA-D-GLUCOSE-1,6-BISPHOSPHATE-DEPENDENT)",True
B5YGX0,Phosphoglucosamine mutase,protein,289376,Thermodesulfovibrio yellowstonii (strain ATCC 51303 / DSM 11347 / YP87),Thermodesulfovibrio yellowstonii (strain ATCC 51303 / DSM 11347 / YP87),glmM,451,PTHR42946:SF1,"PHOSPHOGLUCOMUTASE (ALPHA-D-GLUCOSE-1,6-BISPHOSPHATE-DEPENDENT)",True
B5YS65,Phosphoglucosamine mutase,protein,444450,Escherichia coli O157:H7 (strain EC4115 / EHEC),Escherichia coli O157:H7 (strain EC4115 / EHEC),glmM,445,PTHR42946:SF1,"PHOSPHOGLUCOMUTASE (ALPHA-D-GLUCOSE-1,6-BISPHOSPHATE-DEPENDENT)",True
B5Z677,Phosphoglucosamine mutase,protein,563041,Helicobacter pylori (strain G27),Helicobacter pylori (strain G27),glmM,445,PTHR42946:SF1,"PHOSPHOGLUCOMUTASE (ALPHA-D-GLUCOSE-1,6-BISPHOSPHATE-DEPENDENT)",True
B5ZNL4,Phosphoglucosamine mutase,protein,395492,Rhizobium leguminosarum bv. trifolii (strain WSM2304),Rhizobium leguminosarum bv. trifolii (strain WSM2304),glmM,450,PTHR42946:SF1,"PHOSPHOGLUCOMUTASE (ALPHA-D-GLUCOSE-1,6-BISPHOSPHATE-DEPENDENT)",True
B6END8,Phosphoglucosamine mutase,protein,316275,Aliivibrio salmonicida (strain LFI1238),Aliivibrio salmonicida (strain LFI1238),glmM,445,PTHR42946:SF1,"PHOSPHOGLUCOMUTASE (ALPHA-D-GLUCOSE-1,6-BISPHOSPHATE-DEPENDENT)",True
B6I1P9,Phosphoglucosamine mutase,protein,409438,Escherichia coli (strain SE11),Escherichia coli (strain SE11),glmM,445,PTHR42946:SF1,"PHOSPHOGLUCOMUTASE (ALPHA-D-GLUCOSE-1,6-BISPHOSPHATE-DEPENDENT)",True
B6ITH3,Phosphoglucosamine mutase,protein,414684,Rhodospirillum centenum (strain ATCC 51521 / SW),Rhodospirillum centenum (strain ATCC 51521 / SW),glmM,473,PTHR42946:SF1,"PHOSPHOGLUCOMUTASE (ALPHA-D-GLUCOSE-1,6-BISPHOSPHATE-DEPENDENT)",True
B6IZD8,Phosphoglucosamine mutase,protein,434923,Coxiella burnetii (strain CbuG_Q212),Coxiella burnetii (strain CbuG_Q212),glmM,446,PTHR42946:SF1,"PHOSPHOGLUCOMUTASE (ALPHA-D-GLUCOSE-1,6-BISPHOSPHATE-DEPENDENT)",True
B6J7Z9,Phosphoglucosamine mutase,protein,434924,Coxiella burnetii (strain CbuK_Q154),Coxiella burnetii (strain CbuK_Q154),glmM,446,PTHR42946:SF1,"PHOSPHOGLUCOMUTASE (ALPHA-D-GLUCOSE-1,6-BISPHOSPHATE-DEPENDENT)",True
B6JIL2,Phosphoglucosamine mutase,protein,504832,Afipia carboxidovorans (strain ATCC 49405 / DSM 1227 / KCTC 32145 / OM5),Afipia carboxidovorans (strain ATCC 49405 / DSM 1227 / KCTC 32145 / OM5),glmM,448,PTHR42946:SF1,"PHOSPHOGLUCOMUTASE (ALPHA-D-GLUCOSE-1,6-BISPHOSPHATE-DEPENDENT)",True
B6JPH8,Phosphoglucosamine mutase,protein,570508,Helicobacter pylori (strain P12),Helicobacter pylori (strain P12),glmM,445,PTHR42946:SF1,"PHOSPHOGLUCOMUTASE (ALPHA-D-GLUCOSE-1,6-BISPHOSPHATE-DEPENDENT)",True
B7GIY9,Phosphoglucosamine mutase,protein,491915,Anoxybacillus flavithermus (strain DSM 21510 / WK1),Anoxybacillus flavithermus (strain DSM 21510 / WK1),glmM,447,PTHR42946:SF1,"PHOSPHOGLUCOMUTASE (ALPHA-D-GLUCOSE-1,6-BISPHOSPHATE-DEPENDENT)",True
B7GUF2,Phosphoglucosamine mutase,protein,391904,Bifidobacterium longum subsp. infantis (strain ATCC 15697 / DSM 20088 / JCM 1222 / NCTC 11817 / S12),Bifidobacterium longum subsp. infantis (strain ATCC 15697 / DSM 20088 / JCM 1222 / NCTC 11817 / S12),glmM,461,PTHR42946:SF1,"PHOSPHOGLUCOMUTASE (ALPHA-D-GLUCOSE-1,6-BISPHOSPHATE-DEPENDENT)",True
B7GV90,Phosphoglucosamine mutase,protein,557600,Acinetobacter baumannii (strain AB307-0294),Acinetobacter baumannii (strain AB307-0294),glmM,445,PTHR42946:SF1,"PHOSPHOGLUCOMUTASE (ALPHA-D-GLUCOSE-1,6-BISPHOSPHATE-DEPENDENT)",True
B7HJK3,Phosphoglucosamine mutase,protein,405532,Bacillus cereus (strain B4264),Bacillus cereus (strain B4264),glmM,448,PTHR42946:SF1,"PHOSPHOGLUCOMUTASE (ALPHA-D-GLUCOSE-1,6-BISPHOSPHATE-DEPENDENT)",True
B7HQZ0,Phosphoglucosamine mutase,protein,405534,Bacillus cereus (strain AH187),Bacillus cereus (strain AH187),glmM,448,PTHR42946:SF1,"PHOSPHOGLUCOMUTASE (ALPHA-D-GLUCOSE-1,6-BISPHOSPHATE-DEPENDENT)",True
B7ICC7,Phosphoglucosamine mutase,protein,480119,Acinetobacter baumannii (strain AB0057),Acinetobacter baumannii (strain AB0057),glmM,445,PTHR42946:SF1,"PHOSPHOGLUCOMUTASE (ALPHA-D-GLUCOSE-1,6-BISPHOSPHATE-DEPENDENT)",True
B7IDU4,Phosphoglucosamine mutase,protein,484019,Thermosipho africanus (strain TCF52B),Thermosipho africanus (strain TCF52B),glmM,430,PTHR42946:SF1,"PHOSPHOGLUCOMUTASE (ALPHA-D-GLUCOSE-1,6-BISPHOSPHATE-DEPENDENT)",True
B7ITV9,Phosphoglucosamine mutase,protein,405531,Bacillus cereus (strain G9842),Bacillus cereus (strain G9842),glmM,448,PTHR42946:SF1,"PHOSPHOGLUCOMUTASE (ALPHA-D-GLUCOSE-1,6-BISPHOSPHATE-DEPENDENT)",True
B7JL64,Phosphoglucosamine mutase,protein,405535,Bacillus cereus (strain AH820),Bacillus cereus (strain AH820),glmM,448,PTHR42946:SF1,"PHOSPHOGLUCOMUTASE (ALPHA-D-GLUCOSE-1,6-BISPHOSPHATE-DEPENDENT)",True
B7JYN0,Phosphoglucosamine mutase,protein,41431,Rippkaea orientalis (strain PCC 8801 / RF-1),Rippkaea orientalis (strain PCC 8801 / RF-1),glmM,485,PTHR42946:SF1,"PHOSPHOGLUCOMUTASE (ALPHA-D-GLUCOSE-1,6-BISPHOSPHATE-DEPENDENT)",True
B7KL75,Phosphoglucosamine mutase,protein,65393,Gloeothece citriformis (strain PCC 7424),Gloeothece citriformis (strain PCC 7424),glmM,487,PTHR42946:SF1,"PHOSPHOGLUCOMUTASE (ALPHA-D-GLUCOSE-1,6-BISPHOSPHATE-DEPENDENT)",True
B7KWJ1,Phosphoglucosamine mutase,protein,440085,Methylorubrum extorquens (strain CM4 / NCIMB 13688),Methylorubrum extorquens (strain CM4 / NCIMB 13688),glmM,446,PTHR42946:SF1,"PHOSPHOGLUCOMUTASE (ALPHA-D-GLUCOSE-1,6-BISPHOSPHATE-DEPENDENT)",True
B7LHN9,Phosphoglucosamine mutase,protein,585055,Escherichia coli (strain 55989 / EAEC),Escherichia coli (strain 55989 / EAEC),glmM,445,PTHR42946:SF1,"PHOSPHOGLUCOMUTASE (ALPHA-D-GLUCOSE-1,6-BISPHOSPHATE-DEPENDENT)",True
B7LR43,Phosphoglucosamine mutase,protein,585054,Escherichia fergusonii (strain ATCC 35469 / DSM 13698 / CCUG 18766 / IAM 14443 / JCM 21226 / LMG 7866 / NBRC 102419 / NCTC 12128 / CDC 0568-73),Escherichia fergusonii (strain ATCC 35469 / DSM 13698 / CCUG 18766 / IAM 14443 / JCM 21226 / LMG 7866 / NBRC 102419 / NCTC 12128 / CDC 0568-73),glmM,445,PTHR42946:SF1,"PHOSPHOGLUCOMUTASE (ALPHA-D-GLUCOSE-1,6-BISPHOSPHATE-DEPENDENT)",True
B7M082,Phosphoglucosamine mutase,protein,585034,Escherichia coli O8 (strain IAI1),Escherichia coli O8 (strain IAI1),glmM,445,PTHR42946:SF1,"PHOSPHOGLUCOMUTASE (ALPHA-D-GLUCOSE-1,6-BISPHOSPHATE-DEPENDENT)",True
B7MB95,Phosphoglucosamine mutase,protein,585035,Escherichia coli O45:K1 (strain S88 / ExPEC),Escherichia coli O45:K1 (strain S88 / ExPEC),glmM,445,PTHR42946:SF1,"PHOSPHOGLUCOMUTASE (ALPHA-D-GLUCOSE-1,6-BISPHOSPHATE-DEPENDENT)",True
B7N0V9,Phosphoglucosamine mutase,protein,585397,Escherichia coli O81 (strain ED1a),Escherichia coli O81 (strain ED1a),glmM,445,PTHR42946:SF1,"PHOSPHOGLUCOMUTASE (ALPHA-D-GLUCOSE-1,6-BISPHOSPHATE-DEPENDENT)",True
B7NDG0,Phosphoglucosamine mutase,protein,585056,Escherichia coli O17:K52:H18 (strain UMN026 / ExPEC),Escherichia coli O17:K52:H18 (strain UMN026 / ExPEC),glmM,445,PTHR42946:SF1,"PHOSPHOGLUCOMUTASE (ALPHA-D-GLUCOSE-1,6-BISPHOSPHATE-DEPENDENT)",True
B7NKP3,Phosphoglucosamine mutase,protein,585057,Escherichia coli O7:K1 (strain IAI39 / ExPEC),Escherichia coli O7:K1 (strain IAI39 / ExPEC),glmM,445,PTHR42946:SF1,"PHOSPHOGLUCOMUTASE (ALPHA-D-GLUCOSE-1,6-BISPHOSPHATE-DEPENDENT)",True
B7UJ69,Phosphoglucosamine mutase,protein,574521,Escherichia coli O127:H6 (strain E2348/69 / EPEC),Escherichia coli O127:H6 (strain E2348/69 / EPEC),glmM,445,PTHR42946:SF1,"PHOSPHOGLUCOMUTASE (ALPHA-D-GLUCOSE-1,6-BISPHOSPHATE-DEPENDENT)",True
B7V1G1,Phosphoglucosamine mutase,protein,557722,Pseudomonas aeruginosa (strain LESB58),Pseudomonas aeruginosa (strain LESB58),glmM,445,PTHR42946:SF1,"PHOSPHOGLUCOMUTASE (ALPHA-D-GLUCOSE-1,6-BISPHOSPHATE-DEPENDENT)",True
B7VJI1,Phosphoglucosamine mutase,protein,575788,Vibrio atlanticus (strain LGP32),Vibrio atlanticus (strain LGP32),glmM,446,PTHR42946:SF1,"PHOSPHOGLUCOMUTASE (ALPHA-D-GLUCOSE-1,6-BISPHOSPHATE-DEPENDENT)",True
B8CKG8,Phosphoglucosamine mutase,protein,225849,Shewanella piezotolerans (strain WP3 / JCM 13877),Shewanella piezotolerans (strain WP3 / JCM 13877),glmM,445,PTHR42946:SF1,"PHOSPHOGLUCOMUTASE (ALPHA-D-GLUCOSE-1,6-BISPHOSPHATE-DEPENDENT)",True
B8D0U9,Phosphoglucosamine mutase,protein,373903,Halothermothrix orenii (strain H 168 / OCM 544 / DSM 9562),Halothermothrix orenii (strain H 168 / OCM 544 / DSM 9562),glmM,449,PTHR42946:SF1,"PHOSPHOGLUCOMUTASE (ALPHA-D-GLUCOSE-1,6-BISPHOSPHATE-DEPENDENT)",True
B8D7R7,Phosphoglucosamine mutase,protein,561501,Buchnera aphidicola subsp. Acyrthosiphon pisum (strain Tuc7),Buchnera aphidicola subsp. Acyrthosiphon pisum (strain Tuc7),glmM,444,PTHR42946:SF1,"PHOSPHOGLUCOMUTASE (ALPHA-D-GLUCOSE-1,6-BISPHOSPHATE-DEPENDENT)",True
B8D9G5,Phosphoglucosamine mutase,protein,563178,Buchnera aphidicola subsp. Acyrthosiphon pisum (strain 5A),Buchnera aphidicola subsp. Acyrthosiphon pisum (strain 5A),glmM,444,PTHR42946:SF1,"PHOSPHOGLUCOMUTASE (ALPHA-D-GLUCOSE-1,6-BISPHOSPHATE-DEPENDENT)",True
B8DN76,Phosphoglucosamine mutase,protein,883,Nitratidesulfovibrio vulgaris (strain DSM 19637 / Miyazaki F),Nitratidesulfovibrio vulgaris (strain DSM 19637 / Miyazaki F),glmM,450,PTHR42946:SF1,"PHOSPHOGLUCOMUTASE (ALPHA-D-GLUCOSE-1,6-BISPHOSPHATE-DEPENDENT)",True
B8DWH9,Phosphoglucosamine mutase,protein,442563,Bifidobacterium animalis subsp. lactis (strain AD011),Bifidobacterium animalis subsp. lactis (strain AD011),glmM,454,PTHR42946:SF1,"PHOSPHOGLUCOMUTASE (ALPHA-D-GLUCOSE-1,6-BISPHOSPHATE-DEPENDENT)",True
B8E222,Phosphoglucosamine mutase,protein,515635,Dictyoglomus turgidum (strain DSM 6724 / Z-1310),Dictyoglomus turgidum (strain DSM 6724 / Z-1310),glmM,447,PTHR42946:SF1,"PHOSPHOGLUCOMUTASE (ALPHA-D-GLUCOSE-1,6-BISPHOSPHATE-DEPENDENT)",True
B8ER03,Phosphoglucosamine mutase,protein,395965,Methylocella silvestris (strain DSM 15510 / CIP 108128 / LMG 27833 / NCIMB 13906 / BL2),Methylocella silvestris (strain DSM 15510 / CIP 108128 / LMG 27833 / NCIMB 13906 / BL2),glmM,449,PTHR42946:SF1,"PHOSPHOGLUCOMUTASE (ALPHA-D-GLUCOSE-1,6-BISPHOSPHATE-DEPENDENT)",True
B8F5R2,Phosphoglucosamine mutase,protein,557723,Glaesserella parasuis serovar 5 (strain SH0165),Glaesserella parasuis serovar 5 (strain SH0165),glmM,444,PTHR42946:SF1,"PHOSPHOGLUCOMUTASE (ALPHA-D-GLUCOSE-1,6-BISPHOSPHATE-DEPENDENT)",True
B8GNY2,Phosphoglucosamine mutase,protein,396588,Thioalkalivibrio sulfidiphilus (strain HL-EbGR7),Thioalkalivibrio sulfidiphilus (strain HL-EbGR7),glmM,451,PTHR42946:SF1,"PHOSPHOGLUCOMUTASE (ALPHA-D-GLUCOSE-1,6-BISPHOSPHATE-DEPENDENT)",True
B8GXK7,Phosphoglucosamine mutase,protein,565050,Caulobacter vibrioides (strain NA1000 / CB15N),Caulobacter vibrioides (strain NA1000 / CB15N),glmM,448,PTHR42946:SF1,"PHOSPHOGLUCOMUTASE (ALPHA-D-GLUCOSE-1,6-BISPHOSPHATE-DEPENDENT)",True
B8HCH4,Phosphoglucosamine mutase,protein,452863,Pseudarthrobacter chlorophenolicus (strain ATCC 700700 / DSM 12829 / CIP 107037 / JCM 12360 / KCTC 9906 / NCIMB 13794 / A6),Pseudarthrobacter chlorophenolicus (strain ATCC 700700 / DSM 12829 / CIP 107037 / JCM 12360 / KCTC 9906 / NCIMB 13794 / A6),glmM,453,PTHR42946:SF1,"PHOSPHOGLUCOMUTASE (ALPHA-D-GLUCOSE-1,6-BISPHOSPHATE-DEPENDENT)",True
B8I0I6,Phosphoglucosamine mutase,protein,394503,Ruminiclostridium cellulolyticum (strain ATCC 35319 / DSM 5812 / JCM 6584 / H10),Ruminiclostridium cellulolyticum (strain ATCC 35319 / DSM 5812 / JCM 6584 / H10),glmM,449,PTHR42946:SF1,"PHOSPHOGLUCOMUTASE (ALPHA-D-GLUCOSE-1,6-BISPHOSPHATE-DEPENDENT)",True
