id,name,entry_type,source_tax_id,source_tax_name,full_tax_name,gene,length,subfamily,subfamily_name,in_alphafold
B8ID24,Phosphoglucosamine mutase,protein,460265,Methylobacterium nodulans (strain LMG 21967 / CNCM I-2342 / ORS 2060),Methylobacterium nodulans (strain LMG 21967 / CNCM I-2342 / ORS 2060),glmM,446,PTHR42946:SF1,"PHOSPHOGLUCOMUTASE (ALPHA-D-GLUCOSE-1,6-BISPHOSPHATE-DEPENDENT)",True
B8J1K3,Phosphoglucosamine mutase,protein,525146,Desulfovibrio desulfuricans (strain ATCC 27774 / DSM 6949 / MB),Desulfovibrio desulfuricans (strain ATCC 27774 / DSM 6949 / MB),glmM,450,PTHR42946:SF1,"PHOSPHOGLUCOMUTASE (ALPHA-D-GLUCOSE-1,6-BISPHOSPHATE-DEPENDENT)",True
B8ZLM2,Phosphoglucosamine mutase,protein,561276,Streptococcus pneumoniae (strain ATCC 700669 / Spain 23F-1),Streptococcus pneumoniae (strain ATCC 700669 / Spain 23F-1),glmM,450,PTHR42946:SF1,"PHOSPHOGLUCOMUTASE (ALPHA-D-GLUCOSE-1,6-BISPHOSPHATE-DEPENDENT)",True
B8ZUC1,Phosphoglucosamine mutase,protein,561304,Mycobacterium leprae (strain Br4923),Mycobacterium leprae (strain Br4923),glmM,463,PTHR42946:SF1,"PHOSPHOGLUCOMUTASE (ALPHA-D-GLUCOSE-1,6-BISPHOSPHATE-DEPENDENT)",True
B9DM98,Phosphoglucosamine mutase,protein,396513,Staphylococcus carnosus (strain TM300),Staphylococcus carnosus (strain TM300),glmM,451,PTHR42946:SF1,"PHOSPHOGLUCOMUTASE (ALPHA-D-GLUCOSE-1,6-BISPHOSPHATE-DEPENDENT)",True
B9DSE8,Phosphoglucosamine mutase,protein,218495,Streptococcus uberis (strain ATCC BAA-854 / 0140J),Streptococcus uberis (strain ATCC BAA-854 / 0140J),glmM,450,PTHR42946:SF1,"PHOSPHOGLUCOMUTASE (ALPHA-D-GLUCOSE-1,6-BISPHOSPHATE-DEPENDENT)",True
B9DYJ3,Phosphoglucosamine mutase,protein,583346,Clostridium kluyveri (strain NBRC 12016),Clostridium kluyveri (strain NBRC 12016),glmM,449,PTHR42946:SF1,"PHOSPHOGLUCOMUTASE (ALPHA-D-GLUCOSE-1,6-BISPHOSPHATE-DEPENDENT)",True
B9E9W9,Phosphoglucosamine mutase,protein,458233,Macrococcoides caseolyticum (strain JCSC5402),Macrococcoides caseolyticum (strain JCSC5402),glmM,448,PTHR42946:SF1,"PHOSPHOGLUCOMUTASE (ALPHA-D-GLUCOSE-1,6-BISPHOSPHATE-DEPENDENT)",True
B9J0F1,Phosphoglucosamine mutase,protein,361100,Bacillus cereus (strain Q1),Bacillus cereus (strain Q1),glmM,448,PTHR42946:SF1,"PHOSPHOGLUCOMUTASE (ALPHA-D-GLUCOSE-1,6-BISPHOSPHATE-DEPENDENT)",True
B9J9H0,Phosphoglucosamine mutase,protein,311403,Rhizobium rhizogenes (strain K84 / ATCC BAA-868),Rhizobium rhizogenes (strain K84 / ATCC BAA-868),glmM,450,PTHR42946:SF1,"PHOSPHOGLUCOMUTASE (ALPHA-D-GLUCOSE-1,6-BISPHOSPHATE-DEPENDENT)",True
B9JRY5,Phosphoglucosamine mutase,protein,311402,Allorhizobium ampelinum (strain ATCC BAA-846 / DSM 112012 / S4),Allorhizobium ampelinum (strain ATCC BAA-846 / DSM 112012 / S4),glmM,450,PTHR42946:SF1,"PHOSPHOGLUCOMUTASE (ALPHA-D-GLUCOSE-1,6-BISPHOSPHATE-DEPENDENT)",True
B9K6U6,Phosphoglucosamine mutase,protein,309803,Thermotoga neapolitana (strain ATCC 49049 / DSM 4359 / NBRC 107923 / NS-E),Thermotoga neapolitana (strain ATCC 49049 / DSM 4359 / NBRC 107923 / NS-E),glmM,428,PTHR42946:SF1,"PHOSPHOGLUCOMUTASE (ALPHA-D-GLUCOSE-1,6-BISPHOSPHATE-DEPENDENT)",True
B9KE78,Phosphoglucosamine mutase,protein,306263,Campylobacter lari (strain RM2100 / D67 / ATCC BAA-1060),Campylobacter lari (strain RM2100 / D67 / ATCC BAA-1060),glmM,445,PTHR42946:SF1,"PHOSPHOGLUCOMUTASE (ALPHA-D-GLUCOSE-1,6-BISPHOSPHATE-DEPENDENT)",True
B9KJ94,Phosphoglucosamine mutase,protein,320483,Anaplasma marginale (strain Florida),Anaplasma marginale (strain Florida),glmM,452,PTHR42946:SF1,"PHOSPHOGLUCOMUTASE (ALPHA-D-GLUCOSE-1,6-BISPHOSPHATE-DEPENDENT)",True
B9KM35,Phosphoglucosamine mutase,protein,557760,Cereibacter sphaeroides (strain KD131 / KCTC 12085),Cereibacter sphaeroides (strain KD131 / KCTC 12085),glmM,447,PTHR42946:SF1,"PHOSPHOGLUCOMUTASE (ALPHA-D-GLUCOSE-1,6-BISPHOSPHATE-DEPENDENT)",True
B9L5Z7,Phosphoglucosamine mutase,protein,598659,Nautilia profundicola (strain ATCC BAA-1463 / DSM 18972 / AmH),Nautilia profundicola (strain ATCC BAA-1463 / DSM 18972 / AmH),glmM,440,PTHR42946:SF1,"PHOSPHOGLUCOMUTASE (ALPHA-D-GLUCOSE-1,6-BISPHOSPHATE-DEPENDENT)",True
B9M5K3,Phosphoglucosamine mutase,protein,316067,Geotalea daltonii (strain DSM 22248 / JCM 15807 / FRC-32),Geotalea daltonii (strain DSM 22248 / JCM 15807 / FRC-32),glmM,454,PTHR42946:SF1,"PHOSPHOGLUCOMUTASE (ALPHA-D-GLUCOSE-1,6-BISPHOSPHATE-DEPENDENT)",True
B9MI07,Phosphoglucosamine mutase,protein,535289,Acidovorax ebreus (strain TPSY),Acidovorax ebreus (strain TPSY),glmM,444,PTHR42946:SF1,"PHOSPHOGLUCOMUTASE (ALPHA-D-GLUCOSE-1,6-BISPHOSPHATE-DEPENDENT)",True
B9MMU5,Phosphoglucosamine mutase,protein,521460,Caldicellulosiruptor bescii (strain ATCC BAA-1888 / DSM 6725 / KCTC 15123 / Z-1320),Caldicellulosiruptor bescii (strain ATCC BAA-1888 / DSM 6725 / KCTC 15123 / Z-1320),glmM,449,PTHR42946:SF1,"PHOSPHOGLUCOMUTASE (ALPHA-D-GLUCOSE-1,6-BISPHOSPHATE-DEPENDENT)",True
C0M9C4,Phosphoglucosamine mutase,protein,553482,Streptococcus equi subsp. equi (strain 4047),Streptococcus equi subsp. equi (strain 4047),glmM,450,PTHR42946:SF1,"PHOSPHOGLUCOMUTASE (ALPHA-D-GLUCOSE-1,6-BISPHOSPHATE-DEPENDENT)",True
C0MDT1,Phosphoglucosamine mutase,protein,553483,Streptococcus equi subsp. zooepidemicus (strain H70),Streptococcus equi subsp. zooepidemicus (strain H70),glmM,450,PTHR42946:SF1,"PHOSPHOGLUCOMUTASE (ALPHA-D-GLUCOSE-1,6-BISPHOSPHATE-DEPENDENT)",True
C0PZ59,Phosphoglucosamine mutase,protein,476213,Salmonella paratyphi C (strain RKS4594),Salmonella paratyphi C (strain RKS4594),glmM,445,PTHR42946:SF1,"PHOSPHOGLUCOMUTASE (ALPHA-D-GLUCOSE-1,6-BISPHOSPHATE-DEPENDENT)",True
C0QGV9,Phosphoglucosamine mutase,protein,177437,Desulforapulum autotrophicum (strain ATCC 43914 / DSM 3382 / VKM B-1955 / HRM2),Desulforapulum autotrophicum (strain ATCC 43914 / DSM 3382 / VKM B-1955 / HRM2),glmM,463,PTHR42946:SF1,"PHOSPHOGLUCOMUTASE (ALPHA-D-GLUCOSE-1,6-BISPHOSPHATE-DEPENDENT)",True
C0ZIM8,Phosphoglucosamine mutase,protein,358681,Brevibacillus brevis (strain 47 / JCM 6285 / NBRC 100599),Brevibacillus brevis (strain 47 / JCM 6285 / NBRC 100599),glmM,448,PTHR42946:SF1,"PHOSPHOGLUCOMUTASE (ALPHA-D-GLUCOSE-1,6-BISPHOSPHATE-DEPENDENT)",True
C0ZW79,Phosphoglucosamine mutase,protein,234621,Rhodococcus erythropolis (strain PR4 / NBRC 100887),Rhodococcus erythropolis (strain PR4 / NBRC 100887),glmM,445,PTHR42946:SF1,"PHOSPHOGLUCOMUTASE (ALPHA-D-GLUCOSE-1,6-BISPHOSPHATE-DEPENDENT)",True
C1AHQ0,Phosphoglucosamine mutase,protein,561275,Mycobacterium bovis (strain BCG / Tokyo 172 / ATCC 35737 / TMC 1019),Mycobacterium bovis (strain BCG / Tokyo 172 / ATCC 35737 / TMC 1019),glmM,448,PTHR42946:SF1,"PHOSPHOGLUCOMUTASE (ALPHA-D-GLUCOSE-1,6-BISPHOSPHATE-DEPENDENT)",True
C1B058,Phosphoglucosamine mutase,protein,632772,Rhodococcus opacus (strain B4),Rhodococcus opacus (strain B4),glmM,445,PTHR42946:SF1,"PHOSPHOGLUCOMUTASE (ALPHA-D-GLUCOSE-1,6-BISPHOSPHATE-DEPENDENT)",True
C1C8F1,Phosphoglucosamine mutase,protein,488221,Streptococcus pneumoniae (strain 70585),Streptococcus pneumoniae (strain 70585),glmM,450,PTHR42946:SF1,"PHOSPHOGLUCOMUTASE (ALPHA-D-GLUCOSE-1,6-BISPHOSPHATE-DEPENDENT)",True
C1CFE3,Phosphoglucosamine mutase,protein,488222,Streptococcus pneumoniae (strain JJA),Streptococcus pneumoniae (strain JJA),glmM,450,PTHR42946:SF1,"PHOSPHOGLUCOMUTASE (ALPHA-D-GLUCOSE-1,6-BISPHOSPHATE-DEPENDENT)",True
C1CLQ9,Phosphoglucosamine mutase,protein,488223,Streptococcus pneumoniae (strain P1031),Streptococcus pneumoniae (strain P1031),glmM,450,PTHR42946:SF1,"PHOSPHOGLUCOMUTASE (ALPHA-D-GLUCOSE-1,6-BISPHOSPHATE-DEPENDENT)",True
C1CSI0,Phosphoglucosamine mutase,protein,487213,Streptococcus pneumoniae (strain Taiwan19F-14),Streptococcus pneumoniae (strain Taiwan19F-14),glmM,450,PTHR42946:SF1,"PHOSPHOGLUCOMUTASE (ALPHA-D-GLUCOSE-1,6-BISPHOSPHATE-DEPENDENT)",True
C1CWA3,Phosphoglucosamine mutase,protein,546414,Deinococcus deserti (strain DSM 17065 / CIP 109153 / LMG 22923 / VCD115),Deinococcus deserti (strain DSM 17065 / CIP 109153 / LMG 22923 / VCD115),glmM,442,PTHR42946:SF1,"PHOSPHOGLUCOMUTASE (ALPHA-D-GLUCOSE-1,6-BISPHOSPHATE-DEPENDENT)",True
C1DFL3,Phosphoglucosamine mutase,protein,322710,Azotobacter vinelandii (strain DJ / ATCC BAA-1303),Azotobacter vinelandii (strain DJ / ATCC BAA-1303),glmM,445,PTHR42946:SF1,"PHOSPHOGLUCOMUTASE (ALPHA-D-GLUCOSE-1,6-BISPHOSPHATE-DEPENDENT)",True
C1EU11,Phosphoglucosamine mutase,protein,572264,Bacillus cereus (strain 03BB102),Bacillus cereus (strain 03BB102),glmM,448,PTHR42946:SF1,"PHOSPHOGLUCOMUTASE (ALPHA-D-GLUCOSE-1,6-BISPHOSPHATE-DEPENDENT)",True
C1FMP0,Phosphoglucosamine mutase,protein,536232,Clostridium botulinum (strain Kyoto / Type A2),Clostridium botulinum (strain Kyoto / Type A2),glmM,449,PTHR42946:SF1,"PHOSPHOGLUCOMUTASE (ALPHA-D-GLUCOSE-1,6-BISPHOSPHATE-DEPENDENT)",True
C3K264,Phosphoglucosamine mutase,protein,216595,Pseudomonas fluorescens (strain SBW25),Pseudomonas fluorescens (strain SBW25),glmM,445,PTHR42946:SF1,"PHOSPHOGLUCOMUTASE (ALPHA-D-GLUCOSE-1,6-BISPHOSPHATE-DEPENDENT)",True
C3KVJ0,Phosphoglucosamine mutase,protein,515621,Clostridium botulinum (strain 657 / Type Ba4),Clostridium botulinum (strain 657 / Type Ba4),glmM,449,PTHR42946:SF1,"PHOSPHOGLUCOMUTASE (ALPHA-D-GLUCOSE-1,6-BISPHOSPHATE-DEPENDENT)",True
C3LJZ1,Phosphoglucosamine mutase,protein,568206,Bacillus anthracis (strain CDC 684 / NRRL 3495),Bacillus anthracis (strain CDC 684 / NRRL 3495),glmM,448,PTHR42946:SF1,"PHOSPHOGLUCOMUTASE (ALPHA-D-GLUCOSE-1,6-BISPHOSPHATE-DEPENDENT)",True
C3LSP4,Phosphoglucosamine mutase,protein,579112,Vibrio cholerae serotype O1 (strain M66-2),Vibrio cholerae serotype O1 (strain M66-2),glmM,446,PTHR42946:SF1,"PHOSPHOGLUCOMUTASE (ALPHA-D-GLUCOSE-1,6-BISPHOSPHATE-DEPENDENT)",True
C3PAL5,Phosphoglucosamine mutase,protein,592021,Bacillus anthracis (strain A0248),Bacillus anthracis (strain A0248),glmM,448,PTHR42946:SF1,"PHOSPHOGLUCOMUTASE (ALPHA-D-GLUCOSE-1,6-BISPHOSPHATE-DEPENDENT)",True
C3PL50,Phosphoglucosamine mutase,protein,548476,Corynebacterium aurimucosum (strain ATCC 700975 / DSM 44827 / CIP 107346 / CN-1),Corynebacterium aurimucosum (strain ATCC 700975 / DSM 44827 / CIP 107346 / CN-1),glmM,447,PTHR42946:SF1,"PHOSPHOGLUCOMUTASE (ALPHA-D-GLUCOSE-1,6-BISPHOSPHATE-DEPENDENT)",True
C4K7K5,Phosphoglucosamine mutase,protein,572265,Hamiltonella defensa subsp. Acyrthosiphon pisum (strain 5AT),Hamiltonella defensa subsp. Acyrthosiphon pisum (strain 5AT),glmM,447,PTHR42946:SF1,"PHOSPHOGLUCOMUTASE (ALPHA-D-GLUCOSE-1,6-BISPHOSPHATE-DEPENDENT)",True
C4KZK4,Phosphoglucosamine mutase,protein,360911,Exiguobacterium sp. (strain ATCC BAA-1283 / AT1b),Exiguobacterium sp. (strain ATCC BAA-1283 / AT1b),glmM,452,PTHR42946:SF1,"PHOSPHOGLUCOMUTASE (ALPHA-D-GLUCOSE-1,6-BISPHOSPHATE-DEPENDENT)",True
C4XU39,Phosphoglucosamine mutase,protein,573370,Solidesulfovibrio magneticus (strain ATCC 700980 / DSM 13731 / RS-1),Solidesulfovibrio magneticus (strain ATCC 700980 / DSM 13731 / RS-1),glmM,450,PTHR42946:SF1,"PHOSPHOGLUCOMUTASE (ALPHA-D-GLUCOSE-1,6-BISPHOSPHATE-DEPENDENT)",True
C4Z1Z8,Phosphoglucosamine mutase,protein,515620,Lachnospira eligens (strain ATCC 27750 / DSM 3376 / VPI C15-48 / C15-B4),Lachnospira eligens (strain ATCC 27750 / DSM 3376 / VPI C15-48 / C15-B4),glmM,450,PTHR42946:SF1,"PHOSPHOGLUCOMUTASE (ALPHA-D-GLUCOSE-1,6-BISPHOSPHATE-DEPENDENT)",True
C4ZSR5,Phosphoglucosamine mutase,protein,595496,Escherichia coli (strain K12 / MC4100 / BW2952),Escherichia coli (strain K12 / MC4100 / BW2952),glmM,445,PTHR42946:SF1,"PHOSPHOGLUCOMUTASE (ALPHA-D-GLUCOSE-1,6-BISPHOSPHATE-DEPENDENT)",True
C5BFB3,Phosphoglucosamine mutase,protein,634503,Edwardsiella ictaluri (strain 93-146),Edwardsiella ictaluri (strain 93-146),glmM,445,PTHR42946:SF1,"PHOSPHOGLUCOMUTASE (ALPHA-D-GLUCOSE-1,6-BISPHOSPHATE-DEPENDENT)",True
C5BQ00,Phosphoglucosamine mutase,protein,377629,Teredinibacter turnerae (strain ATCC 39867 / T7901),Teredinibacter turnerae (strain ATCC 39867 / T7901),glmM,446,PTHR42946:SF1,"PHOSPHOGLUCOMUTASE (ALPHA-D-GLUCOSE-1,6-BISPHOSPHATE-DEPENDENT)",True
C5CKU7,Phosphoglucosamine mutase,protein,543728,Variovorax paradoxus (strain S110),Variovorax paradoxus (strain S110),glmM,445,PTHR42946:SF1,"PHOSPHOGLUCOMUTASE (ALPHA-D-GLUCOSE-1,6-BISPHOSPHATE-DEPENDENT)",True
C6BTS9,Phosphoglucosamine mutase,protein,526222,Maridesulfovibrio salexigens (strain ATCC 14822 / DSM 2638 / NCIMB 8403 / VKM B-1763),Maridesulfovibrio salexigens (strain ATCC 14822 / DSM 2638 / NCIMB 8403 / VKM B-1763),glmM,449,PTHR42946:SF1,"PHOSPHOGLUCOMUTASE (ALPHA-D-GLUCOSE-1,6-BISPHOSPHATE-DEPENDENT)",True
C6DKI6,Phosphoglucosamine mutase,protein,561230,Pectobacterium carotovorum subsp. carotovorum (strain PC1),Pectobacterium carotovorum subsp. carotovorum (strain PC1),glmM,445,PTHR42946:SF1,"PHOSPHOGLUCOMUTASE (ALPHA-D-GLUCOSE-1,6-BISPHOSPHATE-DEPENDENT)",True
C6E5P5,Phosphoglucosamine mutase,protein,443144,Geobacter sp. (strain M21),Geobacter sp. (strain M21),glmM,454,PTHR42946:SF1,"PHOSPHOGLUCOMUTASE (ALPHA-D-GLUCOSE-1,6-BISPHOSPHATE-DEPENDENT)",True
O34824,Phosphoglucosamine mutase,protein,224308,Bacillus subtilis (strain 168),Bacillus subtilis (strain 168),glmM,448,PTHR42946:SF1,"PHOSPHOGLUCOMUTASE (ALPHA-D-GLUCOSE-1,6-BISPHOSPHATE-DEPENDENT)",True
O84822,Phosphoglucosamine mutase,protein,272561,Chlamydia trachomatis serovar D (strain ATCC VR-885 / DSM 19411 / UW-3/Cx),Chlamydia trachomatis serovar D (strain ATCC VR-885 / DSM 19411 / UW-3/Cx),glmM,458,PTHR42946:SF1,"PHOSPHOGLUCOMUTASE (ALPHA-D-GLUCOSE-1,6-BISPHOSPHATE-DEPENDENT)",True
P0C0V7,Phosphoglucosamine mutase,protein,93061,Staphylococcus aureus (strain NCTC 8325 / PS 47),Staphylococcus aureus (strain NCTC 8325 / PS 47),glmM,451,PTHR42946:SF1,"PHOSPHOGLUCOMUTASE (ALPHA-D-GLUCOSE-1,6-BISPHOSPHATE-DEPENDENT)",True
P0DB38,Phosphoglucosamine mutase,protein,198466,Streptococcus pyogenes serotype M3 (strain ATCC BAA-595 / MGAS315),Streptococcus pyogenes serotype M3 (strain ATCC BAA-595 / MGAS315),glmM,451,PTHR42946:SF1,"PHOSPHOGLUCOMUTASE (ALPHA-D-GLUCOSE-1,6-BISPHOSPHATE-DEPENDENT)",True
P0DB39,Phosphoglucosamine mutase,protein,193567,Streptococcus pyogenes serotype M3 (strain SSI-1),Streptococcus pyogenes serotype M3 (strain SSI-1),glmM,451,PTHR42946:SF1,"PHOSPHOGLUCOMUTASE (ALPHA-D-GLUCOSE-1,6-BISPHOSPHATE-DEPENDENT)",True
P25177,Phosphoglucosamine mutase,protein,85962,Helicobacter pylori (strain ATCC 700392 / 26695),Helicobacter pylori (strain ATCC 700392 / 26695),glmM,445,PTHR42946:SF1,"PHOSPHOGLUCOMUTASE (ALPHA-D-GLUCOSE-1,6-BISPHOSPHATE-DEPENDENT)",True
P26405,Phosphomannomutase,protein,99287,Salmonella typhimurium (strain LT2 / SGSC1412 / ATCC 700720),Salmonella typhimurium (strain LT2 / SGSC1412 / ATCC 700720),rfbK,477,PTHR42946:SF1,"PHOSPHOGLUCOMUTASE (ALPHA-D-GLUCOSE-1,6-BISPHOSPHATE-DEPENDENT)",True
P31120,Phosphoglucosamine mutase,protein,83333,Escherichia coli (strain K12),Escherichia coli (strain K12),glmM,445,PTHR42946:SF1,"PHOSPHOGLUCOMUTASE (ALPHA-D-GLUCOSE-1,6-BISPHOSPHATE-DEPENDENT)",True
P45164,Phosphoglucosamine mutase,protein,71421,Haemophilus influenzae (strain ATCC 51907 / DSM 11121 / KW20 / Rd),Haemophilus influenzae (strain ATCC 51907 / DSM 11121 / KW20 / Rd),glmM2,445,PTHR42946:SF1,"PHOSPHOGLUCOMUTASE (ALPHA-D-GLUCOSE-1,6-BISPHOSPHATE-DEPENDENT)",True
P55356,Phosphomannomutase,protein,394,Sinorhizobium fredii (strain NBRC 101917 / NGR234),Sinorhizobium fredii (strain NBRC 101917 / NGR234),noeK,474,PTHR42946:SF1,"PHOSPHOGLUCOMUTASE (ALPHA-D-GLUCOSE-1,6-BISPHOSPHATE-DEPENDENT)",True
P57461,Phosphoglucosamine mutase,protein,107806,Buchnera aphidicola subsp. Acyrthosiphon pisum (strain APS),Buchnera aphidicola subsp. Acyrthosiphon pisum (strain APS),glmM,444,PTHR42946:SF1,"PHOSPHOGLUCOMUTASE (ALPHA-D-GLUCOSE-1,6-BISPHOSPHATE-DEPENDENT)",True
P65704,Phosphoglucosamine mutase,protein,158878,Staphylococcus aureus (strain Mu50 / ATCC 700699),Staphylococcus aureus (strain Mu50 / ATCC 700699),glmM,451,PTHR42946:SF1,"PHOSPHOGLUCOMUTASE (ALPHA-D-GLUCOSE-1,6-BISPHOSPHATE-DEPENDENT)",True
P65705,Phosphoglucosamine mutase,protein,196620,Staphylococcus aureus (strain MW2),Staphylococcus aureus (strain MW2),glmM,451,PTHR42946:SF1,"PHOSPHOGLUCOMUTASE (ALPHA-D-GLUCOSE-1,6-BISPHOSPHATE-DEPENDENT)",True
P73648,Phosphoglucosamine mutase,protein,1111708,Synechocystis sp. (strain ATCC 27184 / PCC 6803 / Kazusa),Synechocystis sp. (strain ATCC 27184 / PCC 6803 / Kazusa),glmM,481,PTHR42946:SF1,"PHOSPHOGLUCOMUTASE (ALPHA-D-GLUCOSE-1,6-BISPHOSPHATE-DEPENDENT)",True
P95575,Phosphoglucosamine mutase,protein,205918,Pseudomonas syringae pv. syringae (strain B728a),Pseudomonas syringae pv. syringae (strain B728a),glmM,447,PTHR42946:SF1,"PHOSPHOGLUCOMUTASE (ALPHA-D-GLUCOSE-1,6-BISPHOSPHATE-DEPENDENT)",True
P99087,Phosphoglucosamine mutase,protein,158879,Staphylococcus aureus (strain N315),Staphylococcus aureus (strain N315),glmM,451,PTHR42946:SF1,"PHOSPHOGLUCOMUTASE (ALPHA-D-GLUCOSE-1,6-BISPHOSPHATE-DEPENDENT)",True
P9WN40,Phosphoglucosamine mutase,protein,83331,Mycobacterium tuberculosis (strain CDC 1551 / Oshkosh),Mycobacterium tuberculosis (strain CDC 1551 / Oshkosh),glmM,448,PTHR42946:SF1,"PHOSPHOGLUCOMUTASE (ALPHA-D-GLUCOSE-1,6-BISPHOSPHATE-DEPENDENT)",True
P9WN41,Phosphoglucosamine mutase,protein,83332,Mycobacterium tuberculosis (strain ATCC 25618 / H37Rv),Mycobacterium tuberculosis (strain ATCC 25618 / H37Rv),glmM,448,PTHR42946:SF1,"PHOSPHOGLUCOMUTASE (ALPHA-D-GLUCOSE-1,6-BISPHOSPHATE-DEPENDENT)",True
Q00330,Phosphomannomutase,protein,596,Salmonella muenchen,Salmonella muenchen,manB,478,PTHR42946:SF1,"PHOSPHOGLUCOMUTASE (ALPHA-D-GLUCOSE-1,6-BISPHOSPHATE-DEPENDENT)",True
Q027B2,Phosphoglucosamine mutase,protein,234267,Solibacter usitatus (strain Ellin6076),Solibacter usitatus (strain Ellin6076),glmM,446,PTHR42946:SF1,"PHOSPHOGLUCOMUTASE (ALPHA-D-GLUCOSE-1,6-BISPHOSPHATE-DEPENDENT)",True
Q02FS3,Phosphoglucosamine mutase,protein,208963,Pseudomonas aeruginosa (strain UCBPP-PA14),Pseudomonas aeruginosa (strain UCBPP-PA14),glmM,445,PTHR42946:SF1,"PHOSPHOGLUCOMUTASE (ALPHA-D-GLUCOSE-1,6-BISPHOSPHATE-DEPENDENT)",True
Q031P2,Phosphoglucosamine mutase,protein,272622,Lactococcus lactis subsp. cremoris (strain SK11),Lactococcus lactis subsp. cremoris (strain SK11),glmM,452,PTHR42946:SF1,"PHOSPHOGLUCOMUTASE (ALPHA-D-GLUCOSE-1,6-BISPHOSPHATE-DEPENDENT)",True
Q03AF8,Phosphoglucosamine mutase,protein,321967,Lacticaseibacillus paracasei (strain ATCC 334 / BCRC 17002 / CCUG 31169 / CIP 107868 / KCTC 3260 / NRRL B-441),Lacticaseibacillus paracasei (strain ATCC 334 / BCRC 17002 / CCUG 31169 / CIP 107868 / KCTC 3260 / NRRL B-441),glmM,454,PTHR42946:SF1,"PHOSPHOGLUCOMUTASE (ALPHA-D-GLUCOSE-1,6-BISPHOSPHATE-DEPENDENT)",True
Q03GV0,Phosphoglucosamine mutase,protein,278197,Pediococcus pentosaceus (strain ATCC 25745 / CCUG 21536 / LMG 10740 / 183-1w),Pediococcus pentosaceus (strain ATCC 25745 / CCUG 21536 / LMG 10740 / 183-1w),glmM,452,PTHR42946:SF1,"PHOSPHOGLUCOMUTASE (ALPHA-D-GLUCOSE-1,6-BISPHOSPHATE-DEPENDENT)",True
Q03K54,Phosphoglucosamine mutase,protein,322159,Streptococcus thermophilus (strain ATCC BAA-491 / LMD-9),Streptococcus thermophilus (strain ATCC BAA-491 / LMD-9),glmM,450,PTHR42946:SF1,"PHOSPHOGLUCOMUTASE (ALPHA-D-GLUCOSE-1,6-BISPHOSPHATE-DEPENDENT)",True
Q03SJ3,Phosphoglucosamine mutase,protein,387344,Levilactobacillus brevis (strain ATCC 367 / BCRC 12310 / CIP 105137 / JCM 1170 / LMG 11437 / NCIMB 947 / NCTC 947),Levilactobacillus brevis (strain ATCC 367 / BCRC 12310 / CIP 105137 / JCM 1170 / LMG 11437 / NCIMB 947 / NCTC 947),glmM,451,PTHR42946:SF1,"PHOSPHOGLUCOMUTASE (ALPHA-D-GLUCOSE-1,6-BISPHOSPHATE-DEPENDENT)",True
Q03VW4,Phosphoglucosamine mutase,protein,203120,Leuconostoc mesenteroides subsp. mesenteroides (strain ATCC 8293 / DSM 20343 / BCRC 11652 / CCM 1803 / JCM 6124 / NCDO 523 / NBRC 100496 / NCIMB 8023 / NCTC 12954 / NRRL B-1118 / 37Y),Leuconostoc mesenteroides subsp. mesenteroides (strain ATCC 8293 / DSM 20343 / BCRC 11652 / CCM 1803 / JCM 6124 / NCDO 523 / NBRC 100496 / NCIMB 8023 / NCTC 12954 / NRRL B-1118 / 37Y),glmM,455,PTHR42946:SF1,"PHOSPHOGLUCOMUTASE (ALPHA-D-GLUCOSE-1,6-BISPHOSPHATE-DEPENDENT)",True
Q042H3,Phosphoglucosamine mutase,protein,324831,Lactobacillus gasseri (strain ATCC 33323 / DSM 20243 / BCRC 14619 / CIP 102991 / JCM 1131 / KCTC 3163 / NCIMB 11718 / NCTC 13722 / AM63),Lactobacillus gasseri (strain ATCC 33323 / DSM 20243 / BCRC 14619 / CIP 102991 / JCM 1131 / KCTC 3163 / NCIMB 11718 / NCTC 13722 / AM63),glmM,451,PTHR42946:SF1,"PHOSPHOGLUCOMUTASE (ALPHA-D-GLUCOSE-1,6-BISPHOSPHATE-DEPENDENT)",True
Q04BF6,Phosphoglucosamine mutase,protein,321956,Lactobacillus delbrueckii subsp. bulgaricus (strain ATCC BAA-365 / Lb-18),Lactobacillus delbrueckii subsp. bulgaricus (strain ATCC BAA-365 / Lb-18),glmM,450,PTHR42946:SF1,"PHOSPHOGLUCOMUTASE (ALPHA-D-GLUCOSE-1,6-BISPHOSPHATE-DEPENDENT)",True
Q04JI8,Phosphoglucosamine mutase,protein,373153,Streptococcus pneumoniae serotype 2 (strain D39 / NCTC 7466),Streptococcus pneumoniae serotype 2 (strain D39 / NCTC 7466),glmM,450,PTHR42946:SF1,"PHOSPHOGLUCOMUTASE (ALPHA-D-GLUCOSE-1,6-BISPHOSPHATE-DEPENDENT)",True
Q07IZ1,Phosphoglucosamine mutase,protein,316055,Rhodopseudomonas palustris (strain BisA53),Rhodopseudomonas palustris (strain BisA53),glmM,450,PTHR42946:SF1,"PHOSPHOGLUCOMUTASE (ALPHA-D-GLUCOSE-1,6-BISPHOSPHATE-DEPENDENT)",True
Q07ZA3,Phosphoglucosamine mutase 2,protein,318167,Shewanella frigidimarina (strain NCIMB 400),Shewanella frigidimarina (strain NCIMB 400),glmM2,450,PTHR42946:SF1,"PHOSPHOGLUCOMUTASE (ALPHA-D-GLUCOSE-1,6-BISPHOSPHATE-DEPENDENT)",True
Q086H7,Phosphoglucosamine mutase 1,protein,318167,Shewanella frigidimarina (strain NCIMB 400),Shewanella frigidimarina (strain NCIMB 400),glmM1,445,PTHR42946:SF1,"PHOSPHOGLUCOMUTASE (ALPHA-D-GLUCOSE-1,6-BISPHOSPHATE-DEPENDENT)",True
Q0A772,Phosphoglucosamine mutase,protein,187272,Alkalilimnicola ehrlichii (strain ATCC BAA-1101 / DSM 17681 / MLHE-1),Alkalilimnicola ehrlichii (strain ATCC BAA-1101 / DSM 17681 / MLHE-1),glmM,451,PTHR42946:SF1,"PHOSPHOGLUCOMUTASE (ALPHA-D-GLUCOSE-1,6-BISPHOSPHATE-DEPENDENT)",True
Q0AHC3,Phosphoglucosamine mutase,protein,335283,Nitrosomonas eutropha (strain DSM 101675 / C91 / Nm57),Nitrosomonas eutropha (strain DSM 101675 / C91 / Nm57),glmM,458,PTHR42946:SF1,"PHOSPHOGLUCOMUTASE (ALPHA-D-GLUCOSE-1,6-BISPHOSPHATE-DEPENDENT)",True
Q0ALR7,Phosphoglucosamine mutase,protein,394221,Maricaulis maris (strain MCS10),Maricaulis maris (strain MCS10),glmM,449,PTHR42946:SF1,"PHOSPHOGLUCOMUTASE (ALPHA-D-GLUCOSE-1,6-BISPHOSPHATE-DEPENDENT)",True
Q0AV62,Phosphoglucosamine mutase,protein,335541,Syntrophomonas wolfei subsp. wolfei (strain DSM 2245B / Goettingen),Syntrophomonas wolfei subsp. wolfei (strain DSM 2245B / Goettingen),glmM,450,PTHR42946:SF1,"PHOSPHOGLUCOMUTASE (ALPHA-D-GLUCOSE-1,6-BISPHOSPHATE-DEPENDENT)",True
Q0BGI9,Phosphoglucosamine mutase,protein,339670,Burkholderia ambifaria (strain ATCC BAA-244 / DSM 16087 / CCUG 44356 / LMG 19182 / AMMD),Burkholderia ambifaria (strain ATCC BAA-244 / DSM 16087 / CCUG 44356 / LMG 19182 / AMMD),glmM,451,PTHR42946:SF1,"PHOSPHOGLUCOMUTASE (ALPHA-D-GLUCOSE-1,6-BISPHOSPHATE-DEPENDENT)",True
Q0BK99,Phosphoglucosamine mutase,protein,393011,Francisella tularensis subsp. holarctica (strain OSU18),Francisella tularensis subsp. holarctica (strain OSU18),glmM,443,PTHR42946:SF1,"PHOSPHOGLUCOMUTASE (ALPHA-D-GLUCOSE-1,6-BISPHOSPHATE-DEPENDENT)",True
Q0BT42,Phosphoglucosamine mutase,protein,391165,Granulibacter bethesdensis (strain ATCC BAA-1260 / CGDNIH1),Granulibacter bethesdensis (strain ATCC BAA-1260 / CGDNIH1),glmM,457,PTHR42946:SF1,"PHOSPHOGLUCOMUTASE (ALPHA-D-GLUCOSE-1,6-BISPHOSPHATE-DEPENDENT)",True
Q0C5U1,Phosphoglucosamine mutase,protein,228405,Hyphomonas neptunium (strain ATCC 15444),Hyphomonas neptunium (strain ATCC 15444),glmM,449,PTHR42946:SF1,"PHOSPHOGLUCOMUTASE (ALPHA-D-GLUCOSE-1,6-BISPHOSPHATE-DEPENDENT)",True
Q0HKK5,Phosphoglucosamine mutase 2,protein,60480,Shewanella sp. (strain MR-4),Shewanella sp. (strain MR-4),glmM2,450,PTHR42946:SF1,"PHOSPHOGLUCOMUTASE (ALPHA-D-GLUCOSE-1,6-BISPHOSPHATE-DEPENDENT)",True
Q0HLG6,Phosphoglucosamine mutase 1,protein,60480,Shewanella sp. (strain MR-4),Shewanella sp. (strain MR-4),glmM1,445,PTHR42946:SF1,"PHOSPHOGLUCOMUTASE (ALPHA-D-GLUCOSE-1,6-BISPHOSPHATE-DEPENDENT)",True
Q0HWV8,Phosphoglucosamine mutase 2,protein,60481,Shewanella sp. (strain MR-7),Shewanella sp. (strain MR-7),glmM2,450,PTHR42946:SF1,"PHOSPHOGLUCOMUTASE (ALPHA-D-GLUCOSE-1,6-BISPHOSPHATE-DEPENDENT)",True
Q0HXS0,Phosphoglucosamine mutase 1,protein,60481,Shewanella sp. (strain MR-7),Shewanella sp. (strain MR-7),glmM1,445,PTHR42946:SF1,"PHOSPHOGLUCOMUTASE (ALPHA-D-GLUCOSE-1,6-BISPHOSPHATE-DEPENDENT)",True
Q0I2Q5,Phosphoglucosamine mutase,protein,205914,Histophilus somni (strain 129Pt),Histophilus somni (strain 129Pt),glmM,444,PTHR42946:SF1,"PHOSPHOGLUCOMUTASE (ALPHA-D-GLUCOSE-1,6-BISPHOSPHATE-DEPENDENT)",True
Q0IDB3,Phosphoglucosamine mutase,protein,64471,Synechococcus sp. (strain CC9311),Synechococcus sp. (strain CC9311),glmM,455,PTHR42946:SF1,"PHOSPHOGLUCOMUTASE (ALPHA-D-GLUCOSE-1,6-BISPHOSPHATE-DEPENDENT)",True
Q0K8Y7,Phosphoglucosamine mutase,protein,381666,Cupriavidus necator (strain ATCC 17699 / DSM 428 / KCTC 22496 / NCIMB 10442 / H16 / Stanier 337),Cupriavidus necator (strain ATCC 17699 / DSM 428 / KCTC 22496 / NCIMB 10442 / H16 / Stanier 337),glmM,447,PTHR42946:SF1,"PHOSPHOGLUCOMUTASE (ALPHA-D-GLUCOSE-1,6-BISPHOSPHATE-DEPENDENT)",True
Q0RRN7,Phosphoglucosamine mutase,protein,326424,Frankia alni (strain DSM 45986 / CECT 9034 / ACN14a),Frankia alni (strain DSM 45986 / CECT 9034 / ACN14a),glmM,455,PTHR42946:SF1,"PHOSPHOGLUCOMUTASE (ALPHA-D-GLUCOSE-1,6-BISPHOSPHATE-DEPENDENT)",True
Q0S3D6,Phosphoglucosamine mutase,protein,101510,Rhodococcus jostii (strain RHA1),Rhodococcus jostii (strain RHA1),glmM,445,PTHR42946:SF1,"PHOSPHOGLUCOMUTASE (ALPHA-D-GLUCOSE-1,6-BISPHOSPHATE-DEPENDENT)",True
