id,name,entry_type,source_tax_id,source_tax_name,full_tax_name,gene,length,subfamily,subfamily_name,in_alphafold
A0AKM3,Phosphoglucosamine mutase,protein,386043,Listeria welshimeri serovar 6b (strain ATCC 35897 / DSM 20650 / CCUG 15529 / CIP 8149 / NCTC 11857 / SLCC 5334 / V8),Listeria welshimeri serovar 6b (strain ATCC 35897 / DSM 20650 / CCUG 15529 / CIP 8149 / NCTC 11857 / SLCC 5334 / V8),glmM,450,PTHR42946:SF1,"PHOSPHOGLUCOMUTASE (ALPHA-D-GLUCOSE-1,6-BISPHOSPHATE-DEPENDENT)",True
A0JZ25,Phosphoglucosamine mutase,protein,290399,Arthrobacter sp. (strain FB24),Arthrobacter sp. (strain FB24),glmM,452,PTHR42946:SF1,"PHOSPHOGLUCOMUTASE (ALPHA-D-GLUCOSE-1,6-BISPHOSPHATE-DEPENDENT)",True
A0K6C4,Phosphoglucosamine mutase,protein,331272,Burkholderia cenocepacia (strain HI2424),Burkholderia cenocepacia (strain HI2424),glmM,451,PTHR42946:SF1,"PHOSPHOGLUCOMUTASE (ALPHA-D-GLUCOSE-1,6-BISPHOSPHATE-DEPENDENT)",True
A0KNE8,Phosphoglucosamine mutase,protein,380703,Aeromonas hydrophila subsp. hydrophila (strain ATCC 7966 / DSM 30187 / BCRC 13018 / CCUG 14551 / JCM 1027 / KCTC 2358 / NCIMB 9240 / NCTC 8049),Aeromonas hydrophila subsp. hydrophila (strain ATCC 7966 / DSM 30187 / BCRC 13018 / CCUG 14551 / JCM 1027 / KCTC 2358 / NCIMB 9240 / NCTC 8049),glmM,444,PTHR42946:SF1,"PHOSPHOGLUCOMUTASE (ALPHA-D-GLUCOSE-1,6-BISPHOSPHATE-DEPENDENT)",True
A0KTZ1,Phosphoglucosamine mutase,protein,94122,Shewanella sp. (strain ANA-3),Shewanella sp. (strain ANA-3),glmM,445,PTHR42946:SF1,"PHOSPHOGLUCOMUTASE (ALPHA-D-GLUCOSE-1,6-BISPHOSPHATE-DEPENDENT)",True
A0L4J3,Phosphoglucosamine mutase,protein,156889,Magnetococcus marinus (strain ATCC BAA-1437 / JCM 17883 / MC-1),Magnetococcus marinus (strain ATCC BAA-1437 / JCM 17883 / MC-1),glmM,483,PTHR42946:SF1,"PHOSPHOGLUCOMUTASE (ALPHA-D-GLUCOSE-1,6-BISPHOSPHATE-DEPENDENT)",True
A0LMD8,Phosphoglucosamine mutase,protein,335543,Syntrophobacter fumaroxidans (strain DSM 10017 / MPOB),Syntrophobacter fumaroxidans (strain DSM 10017 / MPOB),glmM,449,PTHR42946:SF1,"PHOSPHOGLUCOMUTASE (ALPHA-D-GLUCOSE-1,6-BISPHOSPHATE-DEPENDENT)",True
A0LRQ7,Phosphoglucosamine mutase,protein,351607,Acidothermus cellulolyticus (strain ATCC 43068 / DSM 8971 / 11B),Acidothermus cellulolyticus (strain ATCC 43068 / DSM 8971 / 11B),glmM,461,PTHR42946:SF1,"PHOSPHOGLUCOMUTASE (ALPHA-D-GLUCOSE-1,6-BISPHOSPHATE-DEPENDENT)",True
A0PMD3,Phosphoglucosamine mutase,protein,362242,Mycobacterium ulcerans (strain Agy99),Mycobacterium ulcerans (strain Agy99),glmM,445,PTHR42946:SF1,"PHOSPHOGLUCOMUTASE (ALPHA-D-GLUCOSE-1,6-BISPHOSPHATE-DEPENDENT)",True
A0PXZ6,Phosphoglucosamine mutase,protein,386415,Clostridium novyi (strain NT),Clostridium novyi (strain NT),glmM,449,PTHR42946:SF1,"PHOSPHOGLUCOMUTASE (ALPHA-D-GLUCOSE-1,6-BISPHOSPHATE-DEPENDENT)",True
A0Q8C5,Phosphoglucosamine mutase,protein,401614,Francisella tularensis subsp. novicida (strain ATCC 15482 / CCUG 33449 / U112),Francisella tularensis subsp. novicida (strain ATCC 15482 / CCUG 33449 / U112),glmM,443,PTHR42946:SF1,"PHOSPHOGLUCOMUTASE (ALPHA-D-GLUCOSE-1,6-BISPHOSPHATE-DEPENDENT)",True
A0QKT1,Phosphoglucosamine mutase,protein,243243,Mycobacterium avium (strain 104),Mycobacterium avium (strain 104),glmM,444,PTHR42946:SF1,"PHOSPHOGLUCOMUTASE (ALPHA-D-GLUCOSE-1,6-BISPHOSPHATE-DEPENDENT)",True
A0QSQ1,Phosphoglucosamine mutase,protein,246196,Mycolicibacterium smegmatis (strain ATCC 700084 / mc(2)155),Mycolicibacterium smegmatis (strain ATCC 700084 / mc(2)155),glmM,453,PTHR42946:SF1,"PHOSPHOGLUCOMUTASE (ALPHA-D-GLUCOSE-1,6-BISPHOSPHATE-DEPENDENT)",True
A0R8M4,Phosphoglucosamine mutase,protein,412694,Bacillus thuringiensis (strain Al Hakam),Bacillus thuringiensis (strain Al Hakam),glmM,448,PTHR42946:SF1,"PHOSPHOGLUCOMUTASE (ALPHA-D-GLUCOSE-1,6-BISPHOSPHATE-DEPENDENT)",True
A0RRK2,Phosphoglucosamine mutase,protein,360106,Campylobacter fetus subsp. fetus (strain 82-40),Campylobacter fetus subsp. fetus (strain 82-40),glmM,446,PTHR42946:SF1,"PHOSPHOGLUCOMUTASE (ALPHA-D-GLUCOSE-1,6-BISPHOSPHATE-DEPENDENT)",True
A1A2Z2,Phosphoglucosamine mutase,protein,367928,Bifidobacterium adolescentis (strain ATCC 15703 / DSM 20083 / NCTC 11814 / E194a),Bifidobacterium adolescentis (strain ATCC 15703 / DSM 20083 / NCTC 11814 / E194a),glmM,459,PTHR42946:SF1,"PHOSPHOGLUCOMUTASE (ALPHA-D-GLUCOSE-1,6-BISPHOSPHATE-DEPENDENT)",True
A1AG79,Phosphoglucosamine mutase,protein,405955,Escherichia coli O1:K1 / APEC,Escherichia coli O1:K1 / APEC,glmM,445,PTHR42946:SF1,"PHOSPHOGLUCOMUTASE (ALPHA-D-GLUCOSE-1,6-BISPHOSPHATE-DEPENDENT)",True
A1AR93,Phosphoglucosamine mutase,protein,338966,Pelobacter propionicus (strain DSM 2379 / NBRC 103807 / OttBd1),Pelobacter propionicus (strain DSM 2379 / NBRC 103807 / OttBd1),glmM,453,PTHR42946:SF1,"PHOSPHOGLUCOMUTASE (ALPHA-D-GLUCOSE-1,6-BISPHOSPHATE-DEPENDENT)",True
A1AVH5,Phosphoglucosamine mutase,protein,413404,Ruthia magnifica subsp. Calyptogena magnifica,Ruthia magnifica subsp. Calyptogena magnifica,glmM,441,PTHR42946:SF1,"PHOSPHOGLUCOMUTASE (ALPHA-D-GLUCOSE-1,6-BISPHOSPHATE-DEPENDENT)",True
A1AZG3,Phosphoglucosamine mutase,protein,318586,Paracoccus denitrificans (strain Pd 1222),Paracoccus denitrificans (strain Pd 1222),glmM,447,PTHR42946:SF1,"PHOSPHOGLUCOMUTASE (ALPHA-D-GLUCOSE-1,6-BISPHOSPHATE-DEPENDENT)",True
A1JIW5,Phosphoglucosamine mutase,protein,393305,Yersinia enterocolitica serotype O:8 / biotype 1B (strain NCTC 13174 / 8081),Yersinia enterocolitica serotype O:8 / biotype 1B (strain NCTC 13174 / 8081),glmM,446,PTHR42946:SF1,"PHOSPHOGLUCOMUTASE (ALPHA-D-GLUCOSE-1,6-BISPHOSPHATE-DEPENDENT)",True
A1K5A1,Phosphoglucosamine mutase,protein,418699,Azoarcus sp. (strain BH72),Azoarcus sp. (strain BH72),glmM,451,PTHR42946:SF1,"PHOSPHOGLUCOMUTASE (ALPHA-D-GLUCOSE-1,6-BISPHOSPHATE-DEPENDENT)",True
A1KPC8,Phosphoglucosamine mutase,protein,410289,Mycobacterium bovis (strain BCG / Pasteur 1173P2),Mycobacterium bovis (strain BCG / Pasteur 1173P2),glmM,448,PTHR42946:SF1,"PHOSPHOGLUCOMUTASE (ALPHA-D-GLUCOSE-1,6-BISPHOSPHATE-DEPENDENT)",True
A1KV99,Phosphoglucosamine mutase,protein,272831,Neisseria meningitidis serogroup C / serotype 2a (strain ATCC 700532 / DSM 15464 / FAM18),Neisseria meningitidis serogroup C / serotype 2a (strain ATCC 700532 / DSM 15464 / FAM18),glmM,444,PTHR42946:SF1,"PHOSPHOGLUCOMUTASE (ALPHA-D-GLUCOSE-1,6-BISPHOSPHATE-DEPENDENT)",True
A1R8Q0,Phosphoglucosamine mutase,protein,290340,Paenarthrobacter aurescens (strain TC1),Paenarthrobacter aurescens (strain TC1),glmM,454,PTHR42946:SF1,"PHOSPHOGLUCOMUTASE (ALPHA-D-GLUCOSE-1,6-BISPHOSPHATE-DEPENDENT)",True
A1RGX0,Phosphoglucosamine mutase,protein,351745,Shewanella sp. (strain W3-18-1),Shewanella sp. (strain W3-18-1),glmM,445,PTHR42946:SF1,"PHOSPHOGLUCOMUTASE (ALPHA-D-GLUCOSE-1,6-BISPHOSPHATE-DEPENDENT)",True
A1S457,Phosphoglucosamine mutase 1,protein,326297,Shewanella amazonensis (strain ATCC BAA-1098 / SB2B),Shewanella amazonensis (strain ATCC BAA-1098 / SB2B),glmM1,445,PTHR42946:SF1,"PHOSPHOGLUCOMUTASE (ALPHA-D-GLUCOSE-1,6-BISPHOSPHATE-DEPENDENT)",True
A1S7U2,Phosphoglucosamine mutase 2,protein,326297,Shewanella amazonensis (strain ATCC BAA-1098 / SB2B),Shewanella amazonensis (strain ATCC BAA-1098 / SB2B),glmM2,452,PTHR42946:SF1,"PHOSPHOGLUCOMUTASE (ALPHA-D-GLUCOSE-1,6-BISPHOSPHATE-DEPENDENT)",True
A1SF29,Phosphoglucosamine mutase,protein,196162,Nocardioides sp. (strain ATCC BAA-499 / JS614),Nocardioides sp. (strain ATCC BAA-499 / JS614),glmM,448,PTHR42946:SF1,"PHOSPHOGLUCOMUTASE (ALPHA-D-GLUCOSE-1,6-BISPHOSPHATE-DEPENDENT)",True
A1ST41,Phosphoglucosamine mutase,protein,357804,Psychromonas ingrahamii (strain DSM 17664 / CCUG 51855 / 37),Psychromonas ingrahamii (strain DSM 17664 / CCUG 51855 / 37),glmM,443,PTHR42946:SF1,"PHOSPHOGLUCOMUTASE (ALPHA-D-GLUCOSE-1,6-BISPHOSPHATE-DEPENDENT)",True
A1T554,Phosphoglucosamine mutase,protein,350058,Mycolicibacterium vanbaalenii (strain DSM 7251 / JCM 13017 / BCRC 16820 / KCTC 9966 / NRRL B-24157 / PYR-1),Mycolicibacterium vanbaalenii (strain DSM 7251 / JCM 13017 / BCRC 16820 / KCTC 9966 / NRRL B-24157 / PYR-1),glmM,445,PTHR42946:SF1,"PHOSPHOGLUCOMUTASE (ALPHA-D-GLUCOSE-1,6-BISPHOSPHATE-DEPENDENT)",True
A1TQF3,Phosphoglucosamine mutase,protein,397945,Paracidovorax citrulli (strain AAC00-1),Paracidovorax citrulli (strain AAC00-1),glmM,444,PTHR42946:SF1,"PHOSPHOGLUCOMUTASE (ALPHA-D-GLUCOSE-1,6-BISPHOSPHATE-DEPENDENT)",True
A1U605,Phosphoglucosamine mutase,protein,351348,Marinobacter nauticus (strain ATCC 700491 / DSM 11845 / VT8),Marinobacter nauticus (strain ATCC 700491 / DSM 11845 / VT8),glmM,447,PTHR42946:SF1,"PHOSPHOGLUCOMUTASE (ALPHA-D-GLUCOSE-1,6-BISPHOSPHATE-DEPENDENT)",True
A1UC06,Phosphoglucosamine mutase,protein,189918,Mycobacterium sp. (strain KMS),Mycobacterium sp. (strain KMS),glmM,445,PTHR42946:SF1,"PHOSPHOGLUCOMUTASE (ALPHA-D-GLUCOSE-1,6-BISPHOSPHATE-DEPENDENT)",True
A1URA6,Phosphoglucosamine mutase,protein,360095,"Bartonella bacilliformis (strain ATCC 35685 / KC583 / Herrer 020/F12,63)","Bartonella bacilliformis (strain ATCC 35685 / KC583 / Herrer 020/F12,63)",glmM,450,PTHR42946:SF1,"PHOSPHOGLUCOMUTASE (ALPHA-D-GLUCOSE-1,6-BISPHOSPHATE-DEPENDENT)",True
A1V322,Phosphoglucosamine mutase,protein,320388,Burkholderia mallei (strain SAVP1),Burkholderia mallei (strain SAVP1),glmM,452,PTHR42946:SF1,"PHOSPHOGLUCOMUTASE (ALPHA-D-GLUCOSE-1,6-BISPHOSPHATE-DEPENDENT)",True
A1VED4,Phosphoglucosamine mutase,protein,391774,Nitratidesulfovibrio vulgaris (strain DP4),Nitratidesulfovibrio vulgaris (strain DP4),glmM,450,PTHR42946:SF1,"PHOSPHOGLUCOMUTASE (ALPHA-D-GLUCOSE-1,6-BISPHOSPHATE-DEPENDENT)",True
A1VQI3,Phosphoglucosamine mutase,protein,365044,Polaromonas naphthalenivorans (strain CJ2),Polaromonas naphthalenivorans (strain CJ2),glmM,443,PTHR42946:SF1,"PHOSPHOGLUCOMUTASE (ALPHA-D-GLUCOSE-1,6-BISPHOSPHATE-DEPENDENT)",True
A1VY80,Phosphoglucosamine mutase,protein,354242,Campylobacter jejuni subsp. jejuni serotype O:23/36 (strain 81-176),Campylobacter jejuni subsp. jejuni serotype O:23/36 (strain 81-176),glmM,445,PTHR42946:SF1,"PHOSPHOGLUCOMUTASE (ALPHA-D-GLUCOSE-1,6-BISPHOSPHATE-DEPENDENT)",True
A1W8G7,Phosphoglucosamine mutase,protein,232721,Acidovorax sp. (strain JS42),Acidovorax sp. (strain JS42),glmM,444,PTHR42946:SF1,"PHOSPHOGLUCOMUTASE (ALPHA-D-GLUCOSE-1,6-BISPHOSPHATE-DEPENDENT)",True
A1WEE4,Phosphoglucosamine mutase,protein,391735,Verminephrobacter eiseniae (strain EF01-2),Verminephrobacter eiseniae (strain EF01-2),glmM,460,PTHR42946:SF1,"PHOSPHOGLUCOMUTASE (ALPHA-D-GLUCOSE-1,6-BISPHOSPHATE-DEPENDENT)",True
A1WXX0,Phosphoglucosamine mutase,protein,349124,Halorhodospira halophila (strain DSM 244 / SL1),Halorhodospira halophila (strain DSM 244 / SL1),glmM,455,PTHR42946:SF1,"PHOSPHOGLUCOMUTASE (ALPHA-D-GLUCOSE-1,6-BISPHOSPHATE-DEPENDENT)",True
A2BP40,Phosphoglucosamine mutase,protein,146891,Prochlorococcus marinus (strain AS9601),Prochlorococcus marinus (strain AS9601),glmM,450,PTHR42946:SF1,"PHOSPHOGLUCOMUTASE (ALPHA-D-GLUCOSE-1,6-BISPHOSPHATE-DEPENDENT)",True
A2BUM2,Phosphoglucosamine mutase,protein,167542,Prochlorococcus marinus (strain MIT 9515),Prochlorococcus marinus (strain MIT 9515),glmM,452,PTHR42946:SF1,"PHOSPHOGLUCOMUTASE (ALPHA-D-GLUCOSE-1,6-BISPHOSPHATE-DEPENDENT)",True
A2CCG3,Phosphoglucosamine mutase,protein,59922,Prochlorococcus marinus (strain MIT 9303),Prochlorococcus marinus (strain MIT 9303),glmM,468,PTHR42946:SF1,"PHOSPHOGLUCOMUTASE (ALPHA-D-GLUCOSE-1,6-BISPHOSPHATE-DEPENDENT)",True
A2REP8,Phosphoglucosamine mutase,protein,160491,Streptococcus pyogenes serotype M5 (strain Manfredo),Streptococcus pyogenes serotype M5 (strain Manfredo),glmM,451,PTHR42946:SF1,"PHOSPHOGLUCOMUTASE (ALPHA-D-GLUCOSE-1,6-BISPHOSPHATE-DEPENDENT)",True
A2RIG0,Phosphoglucosamine mutase,protein,416870,Lactococcus lactis subsp. cremoris (strain MG1363),Lactococcus lactis subsp. cremoris (strain MG1363),glmM,452,PTHR42946:SF1,"PHOSPHOGLUCOMUTASE (ALPHA-D-GLUCOSE-1,6-BISPHOSPHATE-DEPENDENT)",True
A2S3Q4,Phosphoglucosamine mutase,protein,412022,Burkholderia mallei (strain NCTC 10229),Burkholderia mallei (strain NCTC 10229),glmM,452,PTHR42946:SF1,"PHOSPHOGLUCOMUTASE (ALPHA-D-GLUCOSE-1,6-BISPHOSPHATE-DEPENDENT)",True
A2SF93,Phosphoglucosamine mutase,protein,420662,Methylibium petroleiphilum (strain ATCC BAA-1232 / LMG 22953 / PM1),Methylibium petroleiphilum (strain ATCC BAA-1232 / LMG 22953 / PM1),glmM,457,PTHR42946:SF1,"PHOSPHOGLUCOMUTASE (ALPHA-D-GLUCOSE-1,6-BISPHOSPHATE-DEPENDENT)",True
A3CM30,Phosphoglucosamine mutase,protein,388919,Streptococcus sanguinis (strain SK36),Streptococcus sanguinis (strain SK36),glmM,450,PTHR42946:SF1,"PHOSPHOGLUCOMUTASE (ALPHA-D-GLUCOSE-1,6-BISPHOSPHATE-DEPENDENT)",True
A3D7L1,Phosphoglucosamine mutase,protein,325240,Shewanella baltica (strain OS155 / ATCC BAA-1091),Shewanella baltica (strain OS155 / ATCC BAA-1091),glmM,445,PTHR42946:SF1,"PHOSPHOGLUCOMUTASE (ALPHA-D-GLUCOSE-1,6-BISPHOSPHATE-DEPENDENT)",True
A3DEL6,Phosphoglucosamine mutase,protein,203119,Acetivibrio thermocellus (strain ATCC 27405 / DSM 1237 / JCM 9322 / NBRC 103400 / NCIMB 10682 / NRRL B-4536 / VPI 7372),Acetivibrio thermocellus (strain ATCC 27405 / DSM 1237 / JCM 9322 / NBRC 103400 / NCIMB 10682 / NRRL B-4536 / VPI 7372),glmM,449,PTHR42946:SF1,"PHOSPHOGLUCOMUTASE (ALPHA-D-GLUCOSE-1,6-BISPHOSPHATE-DEPENDENT)",True
A3M9W5,Phosphoglucosamine mutase,protein,400667,Acinetobacter baumannii (strain ATCC 17978 / DSM 105126 / CIP 53.77 / LMG 1025 / NCDC KC755 / 5377),Acinetobacter baumannii (strain ATCC 17978 / DSM 105126 / CIP 53.77 / LMG 1025 / NCDC KC755 / 5377),glmM,445,PTHR42946:SF1,"PHOSPHOGLUCOMUTASE (ALPHA-D-GLUCOSE-1,6-BISPHOSPHATE-DEPENDENT)",True
A3MIQ6,Phosphoglucosamine mutase,protein,320389,Burkholderia mallei (strain NCTC 10247),Burkholderia mallei (strain NCTC 10247),glmM,452,PTHR42946:SF1,"PHOSPHOGLUCOMUTASE (ALPHA-D-GLUCOSE-1,6-BISPHOSPHATE-DEPENDENT)",True
A3N2A2,Phosphoglucosamine mutase,protein,416269,Actinobacillus pleuropneumoniae serotype 5b (strain L20),Actinobacillus pleuropneumoniae serotype 5b (strain L20),glmM,444,PTHR42946:SF1,"PHOSPHOGLUCOMUTASE (ALPHA-D-GLUCOSE-1,6-BISPHOSPHATE-DEPENDENT)",True
A3N856,Phosphoglucosamine mutase,protein,320373,Burkholderia pseudomallei (strain 668),Burkholderia pseudomallei (strain 668),glmM,452,PTHR42946:SF1,"PHOSPHOGLUCOMUTASE (ALPHA-D-GLUCOSE-1,6-BISPHOSPHATE-DEPENDENT)",True
A3NTW6,Phosphoglucosamine mutase,protein,357348,Burkholderia pseudomallei (strain 1106a),Burkholderia pseudomallei (strain 1106a),glmM,452,PTHR42946:SF1,"PHOSPHOGLUCOMUTASE (ALPHA-D-GLUCOSE-1,6-BISPHOSPHATE-DEPENDENT)",True
A3PAW2,Phosphoglucosamine mutase,protein,167546,Prochlorococcus marinus (strain MIT 9301),Prochlorococcus marinus (strain MIT 9301),glmM,450,PTHR42946:SF1,"PHOSPHOGLUCOMUTASE (ALPHA-D-GLUCOSE-1,6-BISPHOSPHATE-DEPENDENT)",True
A3PH12,Phosphoglucosamine mutase,protein,349101,Cereibacter sphaeroides (strain ATCC 17029 / ATH 2.4.9),Cereibacter sphaeroides (strain ATCC 17029 / ATH 2.4.9),glmM,447,PTHR42946:SF1,"PHOSPHOGLUCOMUTASE (ALPHA-D-GLUCOSE-1,6-BISPHOSPHATE-DEPENDENT)",True
A3PVN7,Phosphoglucosamine mutase,protein,164757,Mycobacterium sp. (strain JLS),Mycobacterium sp. (strain JLS),glmM,445,PTHR42946:SF1,"PHOSPHOGLUCOMUTASE (ALPHA-D-GLUCOSE-1,6-BISPHOSPHATE-DEPENDENT)",True
A3QGV0,Phosphoglucosamine mutase,protein,323850,Shewanella loihica (strain ATCC BAA-1088 / PV-4),Shewanella loihica (strain ATCC BAA-1088 / PV-4),glmM,443,PTHR42946:SF1,"PHOSPHOGLUCOMUTASE (ALPHA-D-GLUCOSE-1,6-BISPHOSPHATE-DEPENDENT)",True
A4FPG9,Phosphoglucosamine mutase,protein,405948,Saccharopolyspora erythraea (strain ATCC 11635 / DSM 40517 / JCM 4748 / NBRC 13426 / NCIMB 8594 / NRRL 2338),Saccharopolyspora erythraea (strain ATCC 11635 / DSM 40517 / JCM 4748 / NBRC 13426 / NCIMB 8594 / NRRL 2338),glmM,444,PTHR42946:SF1,"PHOSPHOGLUCOMUTASE (ALPHA-D-GLUCOSE-1,6-BISPHOSPHATE-DEPENDENT)",True
A4G4B3,Phosphoglucosamine mutase,protein,204773,Herminiimonas arsenicoxydans,Herminiimonas arsenicoxydans,glmM,448,PTHR42946:SF1,"PHOSPHOGLUCOMUTASE (ALPHA-D-GLUCOSE-1,6-BISPHOSPHATE-DEPENDENT)",True
A4IJN4,Phosphoglucosamine mutase,protein,420246,Geobacillus thermodenitrificans (strain NG80-2),Geobacillus thermodenitrificans (strain NG80-2),glmM,448,PTHR42946:SF1,"PHOSPHOGLUCOMUTASE (ALPHA-D-GLUCOSE-1,6-BISPHOSPHATE-DEPENDENT)",True
A4IW39,Phosphoglucosamine mutase,protein,418136,Francisella tularensis subsp. tularensis (strain WY96-3418),Francisella tularensis subsp. tularensis (strain WY96-3418),glmM,443,PTHR42946:SF1,"PHOSPHOGLUCOMUTASE (ALPHA-D-GLUCOSE-1,6-BISPHOSPHATE-DEPENDENT)",True
A4J190,Phosphoglucosamine mutase,protein,349161,Desulforamulus reducens (strain ATCC BAA-1160 / DSM 100696 / MI-1),Desulforamulus reducens (strain ATCC BAA-1160 / DSM 100696 / MI-1),glmM,444,PTHR42946:SF1,"PHOSPHOGLUCOMUTASE (ALPHA-D-GLUCOSE-1,6-BISPHOSPHATE-DEPENDENT)",True
A4JDA9,Phosphoglucosamine mutase,protein,269482,Burkholderia vietnamiensis (strain G4 / LMG 22486),Burkholderia vietnamiensis (strain G4 / LMG 22486),glmM,451,PTHR42946:SF1,"PHOSPHOGLUCOMUTASE (ALPHA-D-GLUCOSE-1,6-BISPHOSPHATE-DEPENDENT)",True
A4QBS5,Phosphoglucosamine mutase,protein,340322,Corynebacterium glutamicum (strain R),Corynebacterium glutamicum (strain R),glmM,447,PTHR42946:SF1,"PHOSPHOGLUCOMUTASE (ALPHA-D-GLUCOSE-1,6-BISPHOSPHATE-DEPENDENT)",True
A4SJR0,Phosphoglucosamine mutase,protein,382245,Aeromonas salmonicida (strain A449),Aeromonas salmonicida (strain A449),glmM,444,PTHR42946:SF1,"PHOSPHOGLUCOMUTASE (ALPHA-D-GLUCOSE-1,6-BISPHOSPHATE-DEPENDENT)",True
A4SXL3,Phosphoglucosamine mutase,protein,312153,Polynucleobacter asymbioticus (strain DSM 18221 / CIP 109841 / QLW-P1DMWA-1),Polynucleobacter asymbioticus (strain DSM 18221 / CIP 109841 / QLW-P1DMWA-1),glmM,447,PTHR42946:SF1,"PHOSPHOGLUCOMUTASE (ALPHA-D-GLUCOSE-1,6-BISPHOSPHATE-DEPENDENT)",True
A4TEL0,Phosphoglucosamine mutase,protein,350054,Mycolicibacterium gilvum (strain PYR-GCK),Mycolicibacterium gilvum (strain PYR-GCK),glmM,445,PTHR42946:SF1,"PHOSPHOGLUCOMUTASE (ALPHA-D-GLUCOSE-1,6-BISPHOSPHATE-DEPENDENT)",True
A4TRI7,Phosphoglucosamine mutase,protein,386656,Yersinia pestis (strain Pestoides F),Yersinia pestis (strain Pestoides F),glmM,446,PTHR42946:SF1,"PHOSPHOGLUCOMUTASE (ALPHA-D-GLUCOSE-1,6-BISPHOSPHATE-DEPENDENT)",True
A4VPP5,Phosphoglucosamine mutase,protein,379731,Stutzerimonas stutzeri (strain A1501),Stutzerimonas stutzeri (strain A1501),glmM,445,PTHR42946:SF1,"PHOSPHOGLUCOMUTASE (ALPHA-D-GLUCOSE-1,6-BISPHOSPHATE-DEPENDENT)",True
A4VWE5,Phosphoglucosamine mutase,protein,391295,Streptococcus suis (strain 05ZYH33),Streptococcus suis (strain 05ZYH33),glmM,449,PTHR42946:SF1,"PHOSPHOGLUCOMUTASE (ALPHA-D-GLUCOSE-1,6-BISPHOSPHATE-DEPENDENT)",True
A4W2Q0,Phosphoglucosamine mutase,protein,391296,Streptococcus suis (strain 98HAH33),Streptococcus suis (strain 98HAH33),glmM,449,PTHR42946:SF1,"PHOSPHOGLUCOMUTASE (ALPHA-D-GLUCOSE-1,6-BISPHOSPHATE-DEPENDENT)",True
A4WEY7,Phosphoglucosamine mutase,protein,399742,Enterobacter sp. (strain 638),Enterobacter sp. (strain 638),glmM,445,PTHR42946:SF1,"PHOSPHOGLUCOMUTASE (ALPHA-D-GLUCOSE-1,6-BISPHOSPHATE-DEPENDENT)",True
A4WQ91,Phosphoglucosamine mutase,protein,349102,Cereibacter sphaeroides (strain ATCC 17025 / ATH 2.4.3),Cereibacter sphaeroides (strain ATCC 17025 / ATH 2.4.3),glmM,447,PTHR42946:SF1,"PHOSPHOGLUCOMUTASE (ALPHA-D-GLUCOSE-1,6-BISPHOSPHATE-DEPENDENT)",True
A4XBI5,Phosphoglucosamine mutase,protein,369723,Salinispora tropica (strain ATCC BAA-916 / DSM 44818 / JCM 13857 / NBRC 105044 / CNB-440),Salinispora tropica (strain ATCC BAA-916 / DSM 44818 / JCM 13857 / NBRC 105044 / CNB-440),glmM,451,PTHR42946:SF1,"PHOSPHOGLUCOMUTASE (ALPHA-D-GLUCOSE-1,6-BISPHOSPHATE-DEPENDENT)",True
A4XH45,Phosphoglucosamine mutase,protein,351627,Caldicellulosiruptor saccharolyticus (strain ATCC 43494 / DSM 8903 / Tp8T 6331),Caldicellulosiruptor saccharolyticus (strain ATCC 43494 / DSM 8903 / Tp8T 6331),glmM,449,PTHR42946:SF1,"PHOSPHOGLUCOMUTASE (ALPHA-D-GLUCOSE-1,6-BISPHOSPHATE-DEPENDENT)",True
A4XYE5,Phosphoglucosamine mutase,protein,399739,Ectopseudomonas mendocina (strain ymp),Ectopseudomonas mendocina (strain ymp),glmM,445,PTHR42946:SF1,"PHOSPHOGLUCOMUTASE (ALPHA-D-GLUCOSE-1,6-BISPHOSPHATE-DEPENDENT)",True
A4Y9C5,Phosphoglucosamine mutase,protein,319224,Shewanella putrefaciens (strain CN-32 / ATCC BAA-453),Shewanella putrefaciens (strain CN-32 / ATCC BAA-453),glmM,445,PTHR42946:SF1,"PHOSPHOGLUCOMUTASE (ALPHA-D-GLUCOSE-1,6-BISPHOSPHATE-DEPENDENT)",True
A4Z0D8,Phosphoglucosamine mutase,protein,114615,Bradyrhizobium sp. (strain ORS 278),Bradyrhizobium sp. (strain ORS 278),glmM,449,PTHR42946:SF1,"PHOSPHOGLUCOMUTASE (ALPHA-D-GLUCOSE-1,6-BISPHOSPHATE-DEPENDENT)",True
A5CU74,Phosphoglucosamine mutase,protein,443906,Clavibacter michiganensis subsp. michiganensis (strain NCPPB 382),Clavibacter michiganensis subsp. michiganensis (strain NCPPB 382),glmM,437,PTHR42946:SF1,"PHOSPHOGLUCOMUTASE (ALPHA-D-GLUCOSE-1,6-BISPHOSPHATE-DEPENDENT)",True
A5CXP9,Phosphoglucosamine mutase,protein,412965,Vesicomyosocius okutanii subsp. Calyptogena okutanii (strain HA),Vesicomyosocius okutanii subsp. Calyptogena okutanii (strain HA),glmM,441,PTHR42946:SF1,"PHOSPHOGLUCOMUTASE (ALPHA-D-GLUCOSE-1,6-BISPHOSPHATE-DEPENDENT)",True
A5D4W7,Phosphoglucosamine mutase,protein,370438,Pelotomaculum thermopropionicum (strain DSM 13744 / JCM 10971 / SI),Pelotomaculum thermopropionicum (strain DSM 13744 / JCM 10971 / SI),glmM,445,PTHR42946:SF1,"PHOSPHOGLUCOMUTASE (ALPHA-D-GLUCOSE-1,6-BISPHOSPHATE-DEPENDENT)",True
A5ECX6,Phosphoglucosamine mutase,protein,288000,Bradyrhizobium sp. (strain BTAi1 / ATCC BAA-1182),Bradyrhizobium sp. (strain BTAi1 / ATCC BAA-1182),glmM,449,PTHR42946:SF1,"PHOSPHOGLUCOMUTASE (ALPHA-D-GLUCOSE-1,6-BISPHOSPHATE-DEPENDENT)",True
A5EUT6,Phosphoglucosamine mutase,protein,246195,Dichelobacter nodosus (strain VCS1703A),Dichelobacter nodosus (strain VCS1703A),glmM,451,PTHR42946:SF1,"PHOSPHOGLUCOMUTASE (ALPHA-D-GLUCOSE-1,6-BISPHOSPHATE-DEPENDENT)",True
A5F930,Phosphoglucosamine mutase,protein,345073,Vibrio cholerae serotype O1 (strain ATCC 39541 / Classical Ogawa 395 / O395),Vibrio cholerae serotype O1 (strain ATCC 39541 / Classical Ogawa 395 / O395),glmM,446,PTHR42946:SF1,"PHOSPHOGLUCOMUTASE (ALPHA-D-GLUCOSE-1,6-BISPHOSPHATE-DEPENDENT)",True
A5FWQ4,Phosphoglucosamine mutase,protein,349163,Acidiphilium cryptum (strain JF-5),Acidiphilium cryptum (strain JF-5),glmM,456,PTHR42946:SF1,"PHOSPHOGLUCOMUTASE (ALPHA-D-GLUCOSE-1,6-BISPHOSPHATE-DEPENDENT)",True
A5G536,Phosphoglucosamine mutase,protein,351605,Geotalea uraniireducens (strain Rf4),Geotalea uraniireducens (strain Rf4),glmM,454,PTHR42946:SF1,"PHOSPHOGLUCOMUTASE (ALPHA-D-GLUCOSE-1,6-BISPHOSPHATE-DEPENDENT)",True
A5GII9,Phosphoglucosamine mutase,protein,32051,Synechococcus sp. (strain WH7803),Synechococcus sp. (strain WH7803),glmM,462,PTHR42946:SF1,"PHOSPHOGLUCOMUTASE (ALPHA-D-GLUCOSE-1,6-BISPHOSPHATE-DEPENDENT)",True
A5GW63,Phosphoglucosamine mutase,protein,316278,Synechococcus sp. (strain RCC307),Synechococcus sp. (strain RCC307),glmM,459,PTHR42946:SF1,"PHOSPHOGLUCOMUTASE (ALPHA-D-GLUCOSE-1,6-BISPHOSPHATE-DEPENDENT)",True
A5I7E5,Phosphoglucosamine mutase,protein,441771,Clostridium botulinum (strain Hall / ATCC 3502 / NCTC 13319 / Type A),Clostridium botulinum (strain Hall / ATCC 3502 / NCTC 13319 / Type A),glmM,449,PTHR42946:SF1,"PHOSPHOGLUCOMUTASE (ALPHA-D-GLUCOSE-1,6-BISPHOSPHATE-DEPENDENT)",True
A5IHW7,Phosphoglucosamine mutase,protein,400673,Legionella pneumophila (strain Corby),Legionella pneumophila (strain Corby),glmM,455,PTHR42946:SF1,"PHOSPHOGLUCOMUTASE (ALPHA-D-GLUCOSE-1,6-BISPHOSPHATE-DEPENDENT)",True
A5IKN6,Phosphoglucosamine mutase,protein,390874,Thermotoga petrophila (strain ATCC BAA-488 / DSM 13995 / JCM 10881 / RKU-1),Thermotoga petrophila (strain ATCC BAA-488 / DSM 13995 / JCM 10881 / RKU-1),glmM,429,PTHR42946:SF1,"PHOSPHOGLUCOMUTASE (ALPHA-D-GLUCOSE-1,6-BISPHOSPHATE-DEPENDENT)",True
A5IUV1,Phosphoglucosamine mutase,protein,359786,Staphylococcus aureus (strain JH9),Staphylococcus aureus (strain JH9),glmM,451,PTHR42946:SF1,"PHOSPHOGLUCOMUTASE (ALPHA-D-GLUCOSE-1,6-BISPHOSPHATE-DEPENDENT)",True
A5N4Y9,Phosphoglucosamine mutase,protein,431943,Clostridium kluyveri (strain ATCC 8527 / DSM 555 / NBRC 12016 / NCIMB 10680 / K1),Clostridium kluyveri (strain ATCC 8527 / DSM 555 / NBRC 12016 / NCIMB 10680 / K1),glmM,449,PTHR42946:SF1,"PHOSPHOGLUCOMUTASE (ALPHA-D-GLUCOSE-1,6-BISPHOSPHATE-DEPENDENT)",True
A5U8B7,Phosphoglucosamine mutase,protein,419947,Mycobacterium tuberculosis (strain ATCC 25177 / H37Ra),Mycobacterium tuberculosis (strain ATCC 25177 / H37Ra),glmM,448,PTHR42946:SF1,"PHOSPHOGLUCOMUTASE (ALPHA-D-GLUCOSE-1,6-BISPHOSPHATE-DEPENDENT)",True
A5UC76,Phosphoglucosamine mutase,protein,374930,Haemophilus influenzae (strain PittEE),Haemophilus influenzae (strain PittEE),glmM,445,PTHR42946:SF1,"PHOSPHOGLUCOMUTASE (ALPHA-D-GLUCOSE-1,6-BISPHOSPHATE-DEPENDENT)",True
A5V2D8,Phosphoglucosamine mutase,protein,392499,Rhizorhabdus wittichii (strain DSM 6014 / CCUG 31198 / JCM 15750 / NBRC 105917 / EY 4224 / RW1),Rhizorhabdus wittichii (strain DSM 6014 / CCUG 31198 / JCM 15750 / NBRC 105917 / EY 4224 / RW1),glmM,445,PTHR42946:SF1,"PHOSPHOGLUCOMUTASE (ALPHA-D-GLUCOSE-1,6-BISPHOSPHATE-DEPENDENT)",True
A5VIK4,Phosphoglucosamine mutase,protein,557436,Limosilactobacillus reuteri (strain DSM 20016),Limosilactobacillus reuteri (strain DSM 20016),glmM,451,PTHR42946:SF1,"PHOSPHOGLUCOMUTASE (ALPHA-D-GLUCOSE-1,6-BISPHOSPHATE-DEPENDENT)",True
A5VS47,Phosphoglucosamine mutase,protein,444178,Brucella ovis (strain ATCC 25840 / 63/290 / NCTC 10512),Brucella ovis (strain ATCC 25840 / 63/290 / NCTC 10512),glmM,451,PTHR42946:SF1,"PHOSPHOGLUCOMUTASE (ALPHA-D-GLUCOSE-1,6-BISPHOSPHATE-DEPENDENT)",True
A5W992,Phosphoglucosamine mutase,protein,351746,Pseudomonas putida (strain ATCC 700007 / DSM 6899 / JCM 31910 / BCRC 17059 / LMG 24140 / F1),Pseudomonas putida (strain ATCC 700007 / DSM 6899 / JCM 31910 / BCRC 17059 / LMG 24140 / F1),glmM,446,PTHR42946:SF1,"PHOSPHOGLUCOMUTASE (ALPHA-D-GLUCOSE-1,6-BISPHOSPHATE-DEPENDENT)",True
