id,name,entry_type,source_tax_id,source_tax_name,full_tax_name,gene,length,subfamily,subfamily_name,in_alphafold
A1ADX2,GDP-mannose pyrophosphatase,protein,405955,Escherichia coli O1:K1 / APEC,Escherichia coli O1:K1 / APEC,nudK,191,PTHR11839:SF18,NUDIX HYDROLASE DOMAIN-CONTAINING PROTEIN,True
A1B502,RNA pyrophosphohydrolase,protein,318586,Paracoccus denitrificans (strain Pd 1222),Paracoccus denitrificans (strain Pd 1222),rppH,163,PTHR11839:SF22,"NUDIX HYDROLASE 26, CHLOROPLASTIC",True
A1JL31,GDP-mannose pyrophosphatase,protein,393305,Yersinia enterocolitica serotype O:8 / biotype 1B (strain NCTC 13174 / 8081),Yersinia enterocolitica serotype O:8 / biotype 1B (strain NCTC 13174 / 8081),nudK,191,PTHR11839:SF18,NUDIX HYDROLASE DOMAIN-CONTAINING PROTEIN,True
A1TTD1,RNA pyrophosphohydrolase,protein,397945,Paracidovorax citrulli (strain AAC00-1),Paracidovorax citrulli (strain AAC00-1),rppH,226,PTHR11839:SF22,"NUDIX HYDROLASE 26, CHLOROPLASTIC",True
A3PMX6,RNA pyrophosphohydrolase,protein,349101,Cereibacter sphaeroides (strain ATCC 17029 / ATH 2.4.9),Cereibacter sphaeroides (strain ATCC 17029 / ATH 2.4.9),rppH,162,PTHR11839:SF22,"NUDIX HYDROLASE 26, CHLOROPLASTIC",True
A4TMK5,GDP-mannose pyrophosphatase,protein,386656,Yersinia pestis (strain Pestoides F),Yersinia pestis (strain Pestoides F),nudK,198,PTHR11839:SF18,NUDIX HYDROLASE DOMAIN-CONTAINING PROTEIN,True
A4WD46,GDP-mannose pyrophosphatase,protein,399742,Enterobacter sp. (strain 638),Enterobacter sp. (strain 638),nudK,191,PTHR11839:SF18,NUDIX HYDROLASE DOMAIN-CONTAINING PROTEIN,True
A4WWV6,RNA pyrophosphohydrolase,protein,349102,Cereibacter sphaeroides (strain ATCC 17025 / ATH 2.4.3),Cereibacter sphaeroides (strain ATCC 17025 / ATH 2.4.3),rppH,162,PTHR11839:SF22,"NUDIX HYDROLASE 26, CHLOROPLASTIC",True
A4YKE4,RNA pyrophosphohydrolase,protein,114615,Bradyrhizobium sp. (strain ORS 278),Bradyrhizobium sp. (strain ORS 278),rppH,168,PTHR11839:SF22,"NUDIX HYDROLASE 26, CHLOROPLASTIC",True
A5CD16,RNA pyrophosphohydrolase,protein,357244,Orientia tsutsugamushi (strain Boryong),Orientia tsutsugamushi (strain Boryong),rppH,161,PTHR11839:SF22,"NUDIX HYDROLASE 26, CHLOROPLASTIC",True
A5E954,RNA pyrophosphohydrolase,protein,288000,Bradyrhizobium sp. (strain BTAi1 / ATCC BAA-1182),Bradyrhizobium sp. (strain BTAi1 / ATCC BAA-1182),rppH,168,PTHR11839:SF22,"NUDIX HYDROLASE 26, CHLOROPLASTIC",True
A5FWY8,RNA pyrophosphohydrolase,protein,349163,Acidiphilium cryptum (strain JF-5),Acidiphilium cryptum (strain JF-5),rppH,164,PTHR11839:SF22,"NUDIX HYDROLASE 26, CHLOROPLASTIC",True
A5VSH6,RNA pyrophosphohydrolase,protein,444178,Brucella ovis (strain ATCC 25840 / 63/290 / NCTC 10512),Brucella ovis (strain ATCC 25840 / 63/290 / NCTC 10512),rppH,178,PTHR11839:SF22,"NUDIX HYDROLASE 26, CHLOROPLASTIC",True
A6Q441,RNA pyrophosphohydrolase,protein,387092,Nitratiruptor sp. (strain SB155-2),Nitratiruptor sp. (strain SB155-2),rppH,155,PTHR11839:SF22,"NUDIX HYDROLASE 26, CHLOROPLASTIC",True
A6Q7F6,RNA pyrophosphohydrolase,protein,387093,Sulfurovum sp. (strain NBC37-1),Sulfurovum sp. (strain NBC37-1),rppH,157,PTHR11839:SF22,"NUDIX HYDROLASE 26, CHLOROPLASTIC",True
A6TC90,GDP-mannose pyrophosphatase,protein,272620,Klebsiella pneumoniae subsp. pneumoniae (strain ATCC 700721 / MGH 78578),Klebsiella pneumoniae subsp. pneumoniae (strain ATCC 700721 / MGH 78578),nudK,198,PTHR11839:SF18,NUDIX HYDROLASE DOMAIN-CONTAINING PROTEIN,True
A6WXT0,RNA pyrophosphohydrolase,protein,439375,Brucella anthropi (strain ATCC 49188 / DSM 6882 / CCUG 24695 / JCM 21032 / LMG 3331 / NBRC 15819 / NCTC 12168 / Alc 37),Brucella anthropi (strain ATCC 49188 / DSM 6882 / CCUG 24695 / JCM 21032 / LMG 3331 / NBRC 15819 / NCTC 12168 / Alc 37),rppH,174,PTHR11839:SF22,"NUDIX HYDROLASE 26, CHLOROPLASTIC",True
A7FG78,GDP-mannose pyrophosphatase,protein,349747,Yersinia pseudotuberculosis serotype O:1b (strain IP 31758),Yersinia pseudotuberculosis serotype O:1b (strain IP 31758),nudK,198,PTHR11839:SF18,NUDIX HYDROLASE DOMAIN-CONTAINING PROTEIN,True
A7H3U9,RNA pyrophosphohydrolase,protein,360109,Campylobacter jejuni subsp. doylei (strain ATCC BAA-1458 / RM4099 / 269.97),Campylobacter jejuni subsp. doylei (strain ATCC BAA-1458 / RM4099 / 269.97),rppH,156,PTHR11839:SF22,"NUDIX HYDROLASE 26, CHLOROPLASTIC",True
A7ML00,GDP-mannose pyrophosphatase,protein,290339,Cronobacter sakazakii (strain ATCC BAA-894),Cronobacter sakazakii (strain ATCC BAA-894),nudK,191,PTHR11839:SF18,NUDIX HYDROLASE DOMAIN-CONTAINING PROTEIN,True
A7ZPR0,GDP-mannose pyrophosphatase,protein,331111,Escherichia coli O139:H28 (strain E24377A / ETEC),Escherichia coli O139:H28 (strain E24377A / ETEC),nudK,191,PTHR11839:SF18,NUDIX HYDROLASE DOMAIN-CONTAINING PROTEIN,True
A8A2V7,GDP-mannose pyrophosphatase,protein,331112,Escherichia coli O9:H4 (strain HS),Escherichia coli O9:H4 (strain HS),nudK,191,PTHR11839:SF18,NUDIX HYDROLASE DOMAIN-CONTAINING PROTEIN,True
A8ADC6,GDP-mannose pyrophosphatase,protein,290338,Citrobacter koseri (strain ATCC BAA-895 / CDC 4225-83 / SGSC4696),Citrobacter koseri (strain ATCC BAA-895 / CDC 4225-83 / SGSC4696),nudK,191,PTHR11839:SF18,NUDIX HYDROLASE DOMAIN-CONTAINING PROTEIN,True
A8GHJ1,GDP-mannose pyrophosphatase,protein,399741,Serratia proteamaculans (strain 568),Serratia proteamaculans (strain 568),nudK,191,PTHR11839:SF18,NUDIX HYDROLASE DOMAIN-CONTAINING PROTEIN,True
A8HRT0,RNA pyrophosphohydrolase,protein,438753,Azorhizobium caulinodans (strain ATCC 43989 / DSM 5975 / JCM 20966 / LMG 6465 / NBRC 14845 / NCIMB 13405 / ORS 571),Azorhizobium caulinodans (strain ATCC 43989 / DSM 5975 / JCM 20966 / LMG 6465 / NBRC 14845 / NCIMB 13405 / ORS 571),rppH,168,PTHR11839:SF22,"NUDIX HYDROLASE 26, CHLOROPLASTIC",True
A8LKJ8,RNA pyrophosphohydrolase,protein,398580,Dinoroseobacter shibae (strain DSM 16493 / NCIMB 14021 / DFL 12),Dinoroseobacter shibae (strain DSM 16493 / NCIMB 14021 / DFL 12),rppH,160,PTHR11839:SF22,"NUDIX HYDROLASE 26, CHLOROPLASTIC",True
A9H3A6,RNA pyrophosphohydrolase,protein,272568,Gluconacetobacter diazotrophicus (strain ATCC 49037 / DSM 5601 / CCUG 37298 / CIP 103539 / LMG 7603 / PAl5),Gluconacetobacter diazotrophicus (strain ATCC 49037 / DSM 5601 / CCUG 37298 / CIP 103539 / LMG 7603 / PAl5),rppH,167,PTHR11839:SF22,"NUDIX HYDROLASE 26, CHLOROPLASTIC",True
A9IMC9,RNA pyrophosphohydrolase,protein,382640,Bartonella tribocorum (strain DSM 28219 / CCUG 45778 / CIP 105476 / IBS 506),Bartonella tribocorum (strain DSM 28219 / CCUG 45778 / CIP 105476 / IBS 506),rppH,173,PTHR11839:SF22,"NUDIX HYDROLASE 26, CHLOROPLASTIC",True
A9M874,RNA pyrophosphohydrolase,protein,483179,Brucella canis (strain ATCC 23365 / NCTC 10854 / RM-666),Brucella canis (strain ATCC 23365 / NCTC 10854 / RM-666),rppH,178,PTHR11839:SF22,"NUDIX HYDROLASE 26, CHLOROPLASTIC",True
A9MHR4,GDP-mannose pyrophosphatase,protein,41514,Salmonella arizonae (strain ATCC BAA-731 / CDC346-86 / RSK2980),Salmonella arizonae (strain ATCC BAA-731 / CDC346-86 / RSK2980),nudK,191,PTHR11839:SF18,NUDIX HYDROLASE DOMAIN-CONTAINING PROTEIN,True
A9N308,GDP-mannose pyrophosphatase,protein,1016998,Salmonella paratyphi B (strain ATCC BAA-1250 / SPB7),Salmonella paratyphi B (strain ATCC BAA-1250 / SPB7),nudK,191,PTHR11839:SF18,NUDIX HYDROLASE DOMAIN-CONTAINING PROTEIN,True
A9WWW1,RNA pyrophosphohydrolase,protein,470137,Brucella suis (strain ATCC 23445 / NCTC 10510),Brucella suis (strain ATCC 23445 / NCTC 10510),rppH,178,PTHR11839:SF22,"NUDIX HYDROLASE 26, CHLOROPLASTIC",True
B1IWJ3,GDP-mannose pyrophosphatase,protein,481805,Escherichia coli (strain ATCC 8739 / DSM 1576 / NBRC 3972 / NCIMB 8545 / WDCM 00012 / Crooks),Escherichia coli (strain ATCC 8739 / DSM 1576 / NBRC 3972 / NCIMB 8545 / WDCM 00012 / Crooks),nudK,191,PTHR11839:SF18,NUDIX HYDROLASE DOMAIN-CONTAINING PROTEIN,True
B1JSJ3,GDP-mannose pyrophosphatase,protein,502800,Yersinia pseudotuberculosis serotype O:3 (strain YPIII),Yersinia pseudotuberculosis serotype O:3 (strain YPIII),nudK,198,PTHR11839:SF18,NUDIX HYDROLASE DOMAIN-CONTAINING PROTEIN,True
B1LNB6,GDP-mannose pyrophosphatase,protein,439855,Escherichia coli (strain SMS-3-5 / SECEC),Escherichia coli (strain SMS-3-5 / SECEC),nudK,191,PTHR11839:SF18,NUDIX HYDROLASE DOMAIN-CONTAINING PROTEIN,True
B1XAD8,GDP-mannose pyrophosphatase,protein,316385,Escherichia coli (strain K12 / DH10B),Escherichia coli (strain K12 / DH10B),nudK,191,PTHR11839:SF18,NUDIX HYDROLASE DOMAIN-CONTAINING PROTEIN,True
B2S7Z7,RNA pyrophosphohydrolase,protein,430066,Brucella abortus (strain S19),Brucella abortus (strain S19),rppH,178,PTHR11839:SF22,"NUDIX HYDROLASE 26, CHLOROPLASTIC",True
B2SFE8,RNA pyrophosphohydrolase,protein,441952,Francisella tularensis subsp. mediasiatica (strain FSC147),Francisella tularensis subsp. mediasiatica (strain FSC147),rppH,155,PTHR11839:SF22,"NUDIX HYDROLASE 26, CHLOROPLASTIC",True
B3CM46,RNA pyrophosphohydrolase,protein,570417,Wolbachia pipientis subsp. Culex pipiens (strain wPip),Wolbachia pipientis subsp. Culex pipiens (strain wPip),rppH,162,PTHR11839:SF22,"NUDIX HYDROLASE 26, CHLOROPLASTIC",True
B3CSR8,RNA pyrophosphohydrolase,protein,334380,Orientia tsutsugamushi (strain Ikeda),Orientia tsutsugamushi (strain Ikeda) (Rickettsia tsutsugamushi),rppH,161,PTHR11839:SF22,"NUDIX HYDROLASE 26, CHLOROPLASTIC",True
B6JD11,RNA pyrophosphohydrolase,protein,504832,Afipia carboxidovorans (strain ATCC 49405 / DSM 1227 / KCTC 32145 / OM5),Afipia carboxidovorans (strain ATCC 49405 / DSM 1227 / KCTC 32145 / OM5),rppH,166,PTHR11839:SF22,"NUDIX HYDROLASE 26, CHLOROPLASTIC",True
B8H5H3,RNA pyrophosphohydrolase,protein,565050,Caulobacter vibrioides (strain NA1000 / CB15N),Caulobacter vibrioides (strain NA1000 / CB15N),rppH,172,PTHR11839:SF22,"NUDIX HYDROLASE 26, CHLOROPLASTIC",True
B9KN59,RNA pyrophosphohydrolase,protein,557760,Cereibacter sphaeroides (strain KD131 / KCTC 12085),Cereibacter sphaeroides (strain KD131 / KCTC 12085),rppH,162,PTHR11839:SF22,"NUDIX HYDROLASE 26, CHLOROPLASTIC",True
C0R4X8,RNA pyrophosphohydrolase,protein,66084,Wolbachia sp. subsp. Drosophila simulans (strain wRi),Wolbachia sp. subsp. Drosophila simulans (strain wRi),rppH,162,PTHR11839:SF22,"NUDIX HYDROLASE 26, CHLOROPLASTIC",True
C0RF85,RNA pyrophosphohydrolase,protein,546272,Brucella melitensis biotype 2 (strain ATCC 23457),Brucella melitensis biotype 2 (strain ATCC 23457),rppH,178,PTHR11839:SF22,"NUDIX HYDROLASE 26, CHLOROPLASTIC",True
I6X235,ADP-ribose pyrophosphatase,protein,83332,Mycobacterium tuberculosis (strain ATCC 25618 / H37Rv),Mycobacterium tuberculosis (strain ATCC 25618 / H37Rv),Rv1700,207,PTHR11839:SF31,ADP-RIBOSE PYROPHOSPHATASE,True
O61902,Putative nudix hydrolase 2,protein,6239,Caenorhabditis elegans,Caenorhabditis elegans,ndx-2,223,PTHR11839:SF1,ADP-SUGAR PYROPHOSPHATASE,True
O95848,Uridine diphosphate glucose pyrophosphatase NUDT14,protein,9606,Homo sapiens,Homo sapiens (Human),NUDT14,222,PTHR11839:SF15,URIDINE DIPHOSPHATE GLUCOSE PYROPHOSPHATASE NUDT14,True
P35640,RNA pyrophosphohydrolase,protein,360095,"Bartonella bacilliformis (strain ATCC 35685 / KC583 / Herrer 020/F12,63)","Bartonella bacilliformis (strain ATCC 35685 / KC583 / Herrer 020/F12,63)",rppH,170,PTHR11839:SF22,"NUDIX HYDROLASE 26, CHLOROPLASTIC",True
P37128,GDP-mannose pyrophosphatase,protein,83333,Escherichia coli (strain K12),Escherichia coli (strain K12),nudK,191,PTHR11839:SF18,NUDIX HYDROLASE DOMAIN-CONTAINING PROTEIN,True
P44684,ADP-ribose pyrophosphatase,protein,71421,Haemophilus influenzae (strain ATCC 51907 / DSM 11121 / KW20 / Rd),Haemophilus influenzae (strain ATCC 51907 / DSM 11121 / KW20 / Rd),nudF,217,PTHR11839:SF5,ADP-RIBOSE PYROPHOSPHATASE,True
P45799,ADP compounds hydrolase NudE,protein,83333,Escherichia coli (strain K12),Escherichia coli (strain K12),nudE,186,PTHR11839:SF12,ADP COMPOUNDS HYDROLASE NUDE,True
P54570,ADP-ribose pyrophosphatase,protein,224308,Bacillus subtilis (strain 168),Bacillus subtilis (strain 168),nudF,185,PTHR11839:SF18,NUDIX HYDROLASE DOMAIN-CONTAINING PROTEIN,True
P61786,RNA pyrophosphohydrolase,protein,258594,Rhodopseudomonas palustris (strain ATCC BAA-98 / CGA009),Rhodopseudomonas palustris (strain ATCC BAA-98 / CGA009),rppH,168,PTHR11839:SF22,"NUDIX HYDROLASE 26, CHLOROPLASTIC",True
P61787,RNA pyrophosphohydrolase,protein,163164,Wolbachia pipientis wMel,Wolbachia pipientis wMel,rppH,162,PTHR11839:SF22,"NUDIX HYDROLASE 26, CHLOROPLASTIC",True
P83842,ADP-ribose pyrophosphatase,protein,199310,Escherichia coli O6:H1 (strain CFT073 / ATCC 700928 / UPEC),Escherichia coli O6:H1 (strain CFT073 / ATCC 700928 / UPEC),nudF,209,PTHR11839:SF5,ADP-RIBOSE PYROPHOSPHATASE,True
P83843,ADP-ribose pyrophosphatase,protein,83334,Escherichia coli O157:H7,Escherichia coli O157:H7,nudF,209,PTHR11839:SF5,ADP-RIBOSE PYROPHOSPHATASE,True
P83844,ADP-ribose pyrophosphatase,protein,623,Shigella flexneri,Shigella flexneri,nudF,209,PTHR11839:SF5,ADP-RIBOSE PYROPHOSPHATASE,True
Q01976,ADP-ribose pyrophosphatase,protein,559292,Saccharomyces cerevisiae (strain ATCC 204508 / S288c),Saccharomyces cerevisiae (strain ATCC 204508 / S288c) (Baker's yeast),YSA1,231,PTHR11839:SF1,ADP-SUGAR PYROPHOSPHATASE,True
Q05B60,Uridine diphosphate glucose pyrophosphatase NUDT14,protein,9913,Bos taurus,Bos taurus (Bovine),NUDT14,222,PTHR11839:SF15,URIDINE DIPHOSPHATE GLUCOSE PYROPHOSPHATASE NUDT14,True
Q07V02,RNA pyrophosphohydrolase,protein,316055,Rhodopseudomonas palustris (strain BisA53),Rhodopseudomonas palustris (strain BisA53),rppH,176,PTHR11839:SF22,"NUDIX HYDROLASE 26, CHLOROPLASTIC",True
Q0T250,GDP-mannose pyrophosphatase,protein,373384,Shigella flexneri serotype 5b (strain 8401),Shigella flexneri serotype 5b (strain 8401),nudK,191,PTHR11839:SF18,NUDIX HYDROLASE DOMAIN-CONTAINING PROTEIN,True
Q0TF11,GDP-mannose pyrophosphatase,protein,362663,Escherichia coli O6:K15:H31 (strain 536 / UPEC),Escherichia coli O6:K15:H31 (strain 536 / UPEC),nudK,191,PTHR11839:SF18,NUDIX HYDROLASE DOMAIN-CONTAINING PROTEIN,True
Q0ZQ40,CMP-5'-(N-acetyl-N-hydroxy-3-aminopropyl)phosphonate hydrolase,protein,359131,Streptomyces rubellomurinus (strain ATCC 31215),Streptomyces rubellomurinus (strain ATCC 31215),frbI,206,PTHR11839:SF18,NUDIX HYDROLASE DOMAIN-CONTAINING PROTEIN,True
Q13DN7,RNA pyrophosphohydrolase,protein,316057,Rhodopseudomonas palustris (strain BisB5),Rhodopseudomonas palustris (strain BisB5),rppH,167,PTHR11839:SF22,"NUDIX HYDROLASE 26, CHLOROPLASTIC",True
Q16BL5,RNA pyrophosphohydrolase,protein,375451,Roseobacter denitrificans (strain ATCC 33942 / OCh 114),Roseobacter denitrificans (strain ATCC 33942 / OCh 114) (Erythrobacter sp. (strain OCh 114)),rppH,160,PTHR11839:SF22,"NUDIX HYDROLASE 26, CHLOROPLASTIC",True
Q1CK00,GDP-mannose pyrophosphatase,protein,377628,Yersinia pestis bv. Antiqua (strain Nepal516),Yersinia pestis bv. Antiqua (strain Nepal516),nudK,198,PTHR11839:SF18,NUDIX HYDROLASE DOMAIN-CONTAINING PROTEIN,True
Q1GSV9,RNA pyrophosphohydrolase,protein,317655,Sphingopyxis alaskensis (strain DSM 13593 / LMG 18877 / RB2256),Sphingopyxis alaskensis (strain DSM 13593 / LMG 18877 / RB2256),rppH,158,PTHR11839:SF22,"NUDIX HYDROLASE 26, CHLOROPLASTIC",True
Q1R8R1,GDP-mannose pyrophosphatase,protein,364106,Escherichia coli (strain UTI89 / UPEC),Escherichia coli (strain UTI89 / UPEC),nudK,191,PTHR11839:SF18,NUDIX HYDROLASE DOMAIN-CONTAINING PROTEIN,True
Q21CZ3,RNA pyrophosphohydrolase,protein,316056,Rhodopseudomonas palustris (strain BisB18),Rhodopseudomonas palustris (strain BisB18),rppH,175,PTHR11839:SF22,"NUDIX HYDROLASE 26, CHLOROPLASTIC",True
Q2G7H8,RNA pyrophosphohydrolase,protein,279238,Novosphingobium aromaticivorans (strain ATCC 700278 / DSM 12444 / CCUG 56034 / CIP 105152 / NBRC 16084 / F199),Novosphingobium aromaticivorans (strain ATCC 700278 / DSM 12444 / CCUG 56034 / CIP 105152 / NBRC 16084 / F199),rppH,161,PTHR11839:SF22,"NUDIX HYDROLASE 26, CHLOROPLASTIC",True
Q2J3I9,RNA pyrophosphohydrolase,protein,316058,Rhodopseudomonas palustris (strain HaA2),Rhodopseudomonas palustris (strain HaA2),rppH,167,PTHR11839:SF22,"NUDIX HYDROLASE 26, CHLOROPLASTIC",True
Q2N9Y3,RNA pyrophosphohydrolase,protein,314225,Erythrobacter litoralis (strain HTCC2594),Erythrobacter litoralis (strain HTCC2594),rppH,164,PTHR11839:SF22,"NUDIX HYDROLASE 26, CHLOROPLASTIC",True
Q2RV14,RNA pyrophosphohydrolase,protein,269796,Rhodospirillum rubrum (strain ATCC 11170 / ATH 1.1.1 / DSM 467 / LMG 4362 / NCIMB 8255 / S1),Rhodospirillum rubrum (strain ATCC 11170 / ATH 1.1.1 / DSM 467 / LMG 4362 / NCIMB 8255 / S1),rppH,165,PTHR11839:SF22,"NUDIX HYDROLASE 26, CHLOROPLASTIC",True
Q2YLJ4,RNA pyrophosphohydrolase,protein,359391,Brucella abortus (strain 2308),Brucella abortus (strain 2308),rppH,178,PTHR11839:SF22,"NUDIX HYDROLASE 26, CHLOROPLASTIC",True
Q31Y24,GDP-mannose pyrophosphatase,protein,300268,Shigella boydii serotype 4 (strain Sb227),Shigella boydii serotype 4 (strain Sb227),nudK,191,PTHR11839:SF18,NUDIX HYDROLASE DOMAIN-CONTAINING PROTEIN,True
Q32DA4,GDP-mannose pyrophosphatase,protein,300267,Shigella dysenteriae serotype 1 (strain Sd197),Shigella dysenteriae serotype 1 (strain Sd197),nudK,191,PTHR11839:SF18,NUDIX HYDROLASE DOMAIN-CONTAINING PROTEIN,True
Q3IZC1,RNA pyrophosphohydrolase,protein,272943,Cereibacter sphaeroides (strain ATCC 17023 / DSM 158 / JCM 6121 / CCUG 31486 / LMG 2827 / NBRC 12203 / NCIMB 8253 / ATH 2.4.1.),Cereibacter sphaeroides (strain ATCC 17023 / DSM 158 / JCM 6121 / CCUG 31486 / LMG 2827 / NBRC 12203 / NCIMB 8253 / ATH 2.4.1.),rppH,162,PTHR11839:SF22,"NUDIX HYDROLASE 26, CHLOROPLASTIC",True
Q3SVH3,RNA pyrophosphohydrolase,protein,323098,Nitrobacter winogradskyi (strain ATCC 25391 / DSM 10237 / CIP 104748 / NCIMB 11846 / Nb-255),Nitrobacter winogradskyi (strain ATCC 25391 / DSM 10237 / CIP 104748 / NCIMB 11846 / Nb-255),rppH,170,PTHR11839:SF22,"NUDIX HYDROLASE 26, CHLOROPLASTIC",True
Q3YZ86,GDP-mannose pyrophosphatase,protein,300269,Shigella sonnei (strain Ss046),Shigella sonnei (strain Ss046),nudK,191,PTHR11839:SF18,NUDIX HYDROLASE DOMAIN-CONTAINING PROTEIN,True
Q4FP40,RNA pyrophosphohydrolase,protein,335992,Pelagibacter ubique (strain HTCC1062),Pelagibacter ubique (strain HTCC1062),rppH,158,PTHR11839:SF22,"NUDIX HYDROLASE 26, CHLOROPLASTIC",True
Q57B54,RNA pyrophosphohydrolase,protein,262698,Brucella abortus biovar 1 (strain 9-941),Brucella abortus biovar 1 (strain 9-941),rppH,178,PTHR11839:SF22,"NUDIX HYDROLASE 26, CHLOROPLASTIC",True
Q57LN3,GDP-mannose pyrophosphatase,protein,321314,Salmonella choleraesuis (strain SC-B67),Salmonella choleraesuis (strain SC-B67),nudK,191,PTHR11839:SF18,NUDIX HYDROLASE DOMAIN-CONTAINING PROTEIN,True
Q5FU29,RNA pyrophosphohydrolase,protein,290633,Gluconobacter oxydans (strain 621H),Gluconobacter oxydans (strain 621H),rppH,170,PTHR11839:SF30,NUDIX HYDROLASE 25,True
Q5GT39,RNA pyrophosphohydrolase,protein,292805,Wolbachia sp. subsp. Brugia malayi (strain TRS),Wolbachia sp. subsp. Brugia malayi (strain TRS),rppH,161,PTHR11839:SF22,"NUDIX HYDROLASE 26, CHLOROPLASTIC",True
Q5LMH8,RNA pyrophosphohydrolase,protein,246200,Ruegeria pomeroyi (strain ATCC 700808 / DSM 15171 / DSS-3),Ruegeria pomeroyi (strain ATCC 700808 / DSM 15171 / DSS-3),rppH,161,PTHR11839:SF22,"NUDIX HYDROLASE 26, CHLOROPLASTIC",True
Q5PCQ1,GDP-mannose pyrophosphatase,protein,295319,Salmonella paratyphi A (strain ATCC 9150 / SARB42),Salmonella paratyphi A (strain ATCC 9150 / SARB42),nudK,191,PTHR11839:SF18,NUDIX HYDROLASE DOMAIN-CONTAINING PROTEIN,True
Q5RCY2,ADP-sugar pyrophosphatase,protein,9601,Pongo abelii,Pongo abelii (Sumatran orangutan),NUDT5,216,PTHR11839:SF1,ADP-SUGAR PYROPHOSPHATASE,True
Q668I3,GDP-mannose pyrophosphatase,protein,273123,Yersinia pseudotuberculosis serotype I (strain IP32953),Yersinia pseudotuberculosis serotype I (strain IP32953),nudK,198,PTHR11839:SF18,NUDIX HYDROLASE DOMAIN-CONTAINING PROTEIN,True
Q6AY63,ADP-sugar pyrophosphatase,protein,10116,Rattus norvegicus,Rattus norvegicus (Rat),Nudt5,219,PTHR11839:SF1,ADP-SUGAR PYROPHOSPHATASE,True
Q6D8X4,GDP-mannose pyrophosphatase,protein,218491,Pectobacterium atrosepticum (strain SCRI 1043 / ATCC BAA-672),Pectobacterium atrosepticum (strain SCRI 1043 / ATCC BAA-672),nudK,193,PTHR11839:SF18,NUDIX HYDROLASE DOMAIN-CONTAINING PROTEIN,True
Q6G0S2,RNA pyrophosphohydrolase,protein,283165,Bartonella quintana (strain Toulouse),Bartonella quintana (strain Toulouse),rppH,173,PTHR11839:SF22,"NUDIX HYDROLASE 26, CHLOROPLASTIC",True
Q6G4Y4,RNA pyrophosphohydrolase,protein,283166,Bartonella henselae (strain ATCC 49882 / DSM 28221 / CCUG 30454 / Houston 1),Bartonella henselae (strain ATCC 49882 / DSM 28221 / CCUG 30454 / Houston 1),rppH,173,PTHR11839:SF22,"NUDIX HYDROLASE 26, CHLOROPLASTIC",True
Q74SF4,GDP-mannose pyrophosphatase,protein,632,Yersinia pestis,Yersinia pestis,nudK,198,PTHR11839:SF18,NUDIX HYDROLASE DOMAIN-CONTAINING PROTEIN,True
Q7CQ25,GDP-mannose pyrophosphatase,protein,99287,Salmonella typhimurium (strain LT2 / SGSC1412 / ATCC 700720),Salmonella typhimurium (strain LT2 / SGSC1412 / ATCC 700720),nudK,191,PTHR11839:SF18,NUDIX HYDROLASE DOMAIN-CONTAINING PROTEIN,True
Q83K58,GDP-mannose pyrophosphatase,protein,623,Shigella flexneri,Shigella flexneri,nudK,191,PTHR11839:SF18,NUDIX HYDROLASE DOMAIN-CONTAINING PROTEIN,True
Q865Y9,Uridine diphosphate glucose pyrophosphatase NUDT14,protein,9823,Sus scrofa,Sus scrofa (Pig),NUDT14,222,PTHR11839:SF15,URIDINE DIPHOSPHATE GLUCOSE PYROPHOSPHATASE NUDT14,True
Q89X78,RNA pyrophosphohydrolase,protein,224911,Bradyrhizobium diazoefficiens (strain JCM 10833 / BCRC 13528 / IAM 13628 / NBRC 14792 / USDA 110),Bradyrhizobium diazoefficiens (strain JCM 10833 / BCRC 13528 / IAM 13628 / NBRC 14792 / USDA 110),rppH,167,PTHR11839:SF22,"NUDIX HYDROLASE 26, CHLOROPLASTIC",True
Q8FF87,GDP-mannose pyrophosphatase,protein,199310,Escherichia coli O6:H1 (strain CFT073 / ATCC 700928 / UPEC),Escherichia coli O6:H1 (strain CFT073 / ATCC 700928 / UPEC),nudK,191,PTHR11839:SF18,NUDIX HYDROLASE DOMAIN-CONTAINING PROTEIN,True
Q8FYM9,RNA pyrophosphohydrolase,protein,204722,Brucella suis biovar 1 (strain 1330),Brucella suis biovar 1 (strain 1330),rppH,178,PTHR11839:SF22,"NUDIX HYDROLASE 26, CHLOROPLASTIC",True
Q8KP10,Methanol dehydrogenase activator,protein,1471,Bacillus methanolicus,Bacillus methanolicus,act,185,PTHR11839:SF18,NUDIX HYDROLASE DOMAIN-CONTAINING PROTEIN,True
Q8UBS8,RNA pyrophosphohydrolase,protein,176299,Agrobacterium fabrum (strain C58 / ATCC 33970),Agrobacterium fabrum (strain C58 / ATCC 33970),rppH,170,PTHR11839:SF22,"NUDIX HYDROLASE 26, CHLOROPLASTIC",True
Q8XBE7,GDP-mannose pyrophosphatase,protein,83334,Escherichia coli O157:H7,Escherichia coli O157:H7,nudK,191,PTHR11839:SF18,NUDIX HYDROLASE DOMAIN-CONTAINING PROTEIN,True
Q8XG64,GDP-mannose pyrophosphatase,protein,90370,Salmonella typhi,Salmonella typhi,nudK,191,PTHR11839:SF18,NUDIX HYDROLASE DOMAIN-CONTAINING PROTEIN,True
Q8YJ71,RNA pyrophosphohydrolase,protein,224914,Brucella melitensis biotype 1 (strain ATCC 23456 / CCUG 17765 / NCTC 10094 / 16M),Brucella melitensis biotype 1 (strain ATCC 23456 / CCUG 17765 / NCTC 10094 / 16M),rppH,178,PTHR11839:SF22,"NUDIX HYDROLASE 26, CHLOROPLASTIC",True
Q92LA8,RNA pyrophosphohydrolase,protein,266834,Rhizobium meliloti (strain 1021),Rhizobium meliloti (strain 1021) (Ensifer meliloti),rppH,167,PTHR11839:SF22,"NUDIX HYDROLASE 26, CHLOROPLASTIC",True
Q93K97,ADP-ribose pyrophosphatase,protein,83333,Escherichia coli (strain K12),Escherichia coli (strain K12),nudF,209,PTHR11839:SF5,ADP-RIBOSE PYROPHOSPHATASE,True
Q98F04,RNA pyrophosphohydrolase,protein,266835,Mesorhizobium japonicum (strain LMG 29417 / CECT 9101 / MAFF 303099),Mesorhizobium japonicum (strain LMG 29417 / CECT 9101 / MAFF 303099),rppH,173,PTHR11839:SF22,"NUDIX HYDROLASE 26, CHLOROPLASTIC",True
Q9A2W6,RNA pyrophosphohydrolase,protein,190650,Caulobacter vibrioides (strain ATCC 19089 / CIP 103742 / CB 15),Caulobacter vibrioides (strain ATCC 19089 / CIP 103742 / CB 15),rppH,172,PTHR11839:SF22,"NUDIX HYDROLASE 26, CHLOROPLASTIC",True
Q9C6Z2,Nudix hydrolase 25,protein,3702,Arabidopsis thaliana,Arabidopsis thaliana (Mouse-ear cress),NUDT25,175,PTHR11839:SF30,NUDIX HYDROLASE 25,True
Q9CAF2,"Nudix hydrolase 26, chloroplastic",protein,3702,Arabidopsis thaliana,Arabidopsis thaliana (Mouse-ear cress),NUDT26,216,PTHR11839:SF22,"NUDIX HYDROLASE 26, CHLOROPLASTIC",True
Q9D142,Uridine diphosphate glucose pyrophosphatase NUDT14,protein,10090,Mus musculus,Mus musculus (Mouse),Nudt14,222,PTHR11839:SF15,URIDINE DIPHOSPHATE GLUCOSE PYROPHOSPHATASE NUDT14,True
Q9FNH4,"Nudix hydrolase 27, chloroplastic",protein,3702,Arabidopsis thaliana,Arabidopsis thaliana (Mouse-ear cress),NUDT27,227,PTHR11839:SF21,"NUDIX HYDROLASE 27, CHLOROPLASTIC",True
Q9JKX6,ADP-sugar pyrophosphatase,protein,10090,Mus musculus,Mus musculus (Mouse),Nudt5,218,PTHR11839:SF1,ADP-SUGAR PYROPHOSPHATASE,True
Q9KK72,RNA pyrophosphohydrolase,protein,56426,Bartonella clarridgeiae,Bartonella clarridgeiae,rppH,173,PTHR11839:SF22,"NUDIX HYDROLASE 26, CHLOROPLASTIC",True
Q9P791,Uncharacterized Nudix hydrolase P35G2.12,protein,284812,Schizosaccharomyces pombe (strain 972 / ATCC 24843),Schizosaccharomyces pombe (strain 972 / ATCC 24843) (Fission yeast),SPBP35G2.12,205,PTHR11839:SF1,ADP-SUGAR PYROPHOSPHATASE,True
Q9RH11,RNA pyrophosphohydrolase,protein,264203,Zymomonas mobilis subsp. mobilis (strain ATCC 31821 / ZM4 / CP4),Zymomonas mobilis subsp. mobilis (strain ATCC 31821 / ZM4 / CP4),rppH,155,PTHR11839:SF22,"NUDIX HYDROLASE 26, CHLOROPLASTIC",True
Q9SZ63,"Nudix hydrolase 14, chloroplastic",protein,3702,Arabidopsis thaliana,Arabidopsis thaliana (Mouse-ear cress),NUDT14,309,PTHR11839:SF18,NUDIX HYDROLASE DOMAIN-CONTAINING PROTEIN,True
Q9UKK9,ADP-sugar pyrophosphatase,protein,9606,Homo sapiens,Homo sapiens (Human),NUDT5,219,PTHR11839:SF24,ADP-SUGAR PYROPHOSPHATASE,True
