id,name,entry_type,source_tax_id,source_tax_name,full_tax_name,gene,length,subfamily,subfamily_name,in_alphafold
Q4KKQ6,Threonylcarbamoyl-AMP synthase,protein,220664,Pseudomonas fluorescens (strain ATCC BAA-477 / NRRL B-23932 / Pf-5),Pseudomonas fluorescens (strain ATCC BAA-477 / NRRL B-23932 / Pf-5),tsaC,185,PTHR17490:SF18,THREONYLCARBAMOYL-AMP SYNTHASE,True
Q4QMR0,Threonylcarbamoyl-AMP synthase,protein,281310,Haemophilus influenzae (strain 86-028NP),Haemophilus influenzae (strain 86-028NP),tsaC,183,PTHR17490:SF18,THREONYLCARBAMOYL-AMP SYNTHASE,True
Q4UQ07,Threonylcarbamoyl-AMP synthase,protein,314565,Xanthomonas campestris pv. campestris (strain 8004),Xanthomonas campestris pv. campestris (strain 8004),tsaC,187,PTHR17490:SF18,THREONYLCARBAMOYL-AMP SYNTHASE,True
Q500S6,Threonylcarbamoyl-AMP synthase,protein,205918,Pseudomonas syringae pv. syringae (strain B728a),Pseudomonas syringae pv. syringae (strain B728a),tsaC,185,PTHR17490:SF18,THREONYLCARBAMOYL-AMP SYNTHASE,True
Q57J68,Threonylcarbamoyl-AMP synthase,protein,321314,Salmonella choleraesuis (strain SC-B67),Salmonella choleraesuis (strain SC-B67),tsaC,190,PTHR17490:SF18,THREONYLCARBAMOYL-AMP SYNTHASE,True
Q5E1R5,Threonylcarbamoyl-AMP synthase,protein,312309,Aliivibrio fischeri (strain ATCC 700601 / ES114),Aliivibrio fischeri (strain ATCC 700601 / ES114),tsaC,185,PTHR17490:SF18,THREONYLCARBAMOYL-AMP SYNTHASE,True
Q5F5I5,Threonylcarbamoyl-AMP synthase,protein,242231,Neisseria gonorrhoeae (strain ATCC 700825 / FA 1090),Neisseria gonorrhoeae (strain ATCC 700825 / FA 1090),tsaC,189,PTHR17490:SF18,THREONYLCARBAMOYL-AMP SYNTHASE,True
Q5H5D8,Threonylcarbamoyl-AMP synthase,protein,291331,Xanthomonas oryzae pv. oryzae (strain KACC10331 / KXO85),Xanthomonas oryzae pv. oryzae (strain KACC10331 / KXO85),tsaC,187,PTHR17490:SF18,THREONYLCARBAMOYL-AMP SYNTHASE,True
Q5PIS8,Threonylcarbamoyl-AMP synthase,protein,295319,Salmonella paratyphi A (strain ATCC 9150 / SARB42),Salmonella paratyphi A (strain ATCC 9150 / SARB42),tsaC,190,PTHR17490:SF18,THREONYLCARBAMOYL-AMP SYNTHASE,True
Q5QXJ5,Threonylcarbamoyl-AMP synthase,protein,283942,Idiomarina loihiensis (strain ATCC BAA-735 / DSM 15497 / L2-TR),Idiomarina loihiensis (strain ATCC BAA-735 / DSM 15497 / L2-TR),tsaC,186,PTHR17490:SF18,THREONYLCARBAMOYL-AMP SYNTHASE,True
Q60369,Putative threonylcarbamoyl-AMP synthase,protein,243232,Methanocaldococcus jannaschii (strain ATCC 43067 / DSM 2661 / JAL-1 / JCM 10045 / NBRC 100440),Methanocaldococcus jannaschii (strain ATCC 43067 / DSM 2661 / JAL-1 / JCM 10045 / NBRC 100440),MJ0062,207,PTHR17490:SF16,THREONYLCARBAMOYL-AMP SYNTHASE,True
Q603G8,Threonylcarbamoyl-AMP synthase,protein,243233,Methylococcus capsulatus (strain ATCC 33009 / NCIMB 11132 / Bath),Methylococcus capsulatus (strain ATCC 33009 / NCIMB 11132 / Bath),tsaC,186,PTHR17490:SF18,THREONYLCARBAMOYL-AMP SYNTHASE,True
Q65WC1,Threonylcarbamoyl-AMP synthase,protein,221988,Mannheimia succiniciproducens (strain KCTC 0769BP / MBEL55E),Mannheimia succiniciproducens (strain KCTC 0769BP / MBEL55E),tsaC,183,PTHR17490:SF18,THREONYLCARBAMOYL-AMP SYNTHASE,True
Q664V8,Threonylcarbamoyl-AMP synthase,protein,273123,Yersinia pseudotuberculosis serotype I (strain IP32953),Yersinia pseudotuberculosis serotype I (strain IP32953),tsaC,190,PTHR17490:SF18,THREONYLCARBAMOYL-AMP SYNTHASE,True
Q6FFH9,Threonylcarbamoyl-AMP synthase,protein,62977,Acinetobacter baylyi (strain ATCC 33305 / BD413 / ADP1),Acinetobacter baylyi (strain ATCC 33305 / BD413 / ADP1),tsaC,192,PTHR17490:SF18,THREONYLCARBAMOYL-AMP SYNTHASE,True
Q6LLJ9,Threonylcarbamoyl-AMP synthase,protein,298386,Photobacterium profundum (strain SS9),Photobacterium profundum (strain SS9),tsaC,185,PTHR17490:SF18,THREONYLCARBAMOYL-AMP SYNTHASE,True
Q74XX5,Threonylcarbamoyl-AMP synthase,protein,632,Yersinia pestis,Yersinia pestis,tsaC,190,PTHR17490:SF18,THREONYLCARBAMOYL-AMP SYNTHASE,True
Q7MGL3,Threonylcarbamoyl-AMP synthase,protein,196600,Vibrio vulnificus (strain YJ016),Vibrio vulnificus (strain YJ016),tsaC,186,PTHR17490:SF18,THREONYLCARBAMOYL-AMP SYNTHASE,True
Q7MYI5,Threonylcarbamoyl-AMP synthase,protein,243265,Photorhabdus laumondii subsp. laumondii (strain DSM 15139 / CIP 105565 / TT01),Photorhabdus laumondii subsp. laumondii (strain DSM 15139 / CIP 105565 / TT01),tsaC,189,PTHR17490:SF18,THREONYLCARBAMOYL-AMP SYNTHASE,True
Q7P0L7,Threonylcarbamoyl-AMP synthase,protein,243365,Chromobacterium violaceum (strain ATCC 12472 / DSM 30191 / JCM 1249 / CCUG 213 / NBRC 12614 / NCIMB 9131 / NCTC 9757 / MK),Chromobacterium violaceum (strain ATCC 12472 / DSM 30191 / JCM 1249 / CCUG 213 / NBRC 12614 / NCIMB 9131 / NCTC 9757 / MK),tsaC,193,PTHR17490:SF18,THREONYLCARBAMOYL-AMP SYNTHASE,True
Q7VNS3,Threonylcarbamoyl-AMP synthase,protein,233412,Haemophilus ducreyi (strain 35000HP / ATCC 700724),Haemophilus ducreyi (strain 35000HP / ATCC 700724),tsaC,184,PTHR17490:SF18,THREONYLCARBAMOYL-AMP SYNTHASE,True
Q7VQB9,Threonylcarbamoyl-AMP synthase,protein,203907,Blochmanniella floridana,Blochmanniella floridana,tsaC,189,PTHR17490:SF18,THREONYLCARBAMOYL-AMP SYNTHASE,True
Q83AA2,Threonylcarbamoyl-AMP synthase,protein,227377,Coxiella burnetii (strain RSA 493 / Nine Mile phase I),Coxiella burnetii (strain RSA 493 / Nine Mile phase I),tsaC,186,PTHR17490:SF18,THREONYLCARBAMOYL-AMP SYNTHASE,True
Q83JD1,Threonylcarbamoyl-AMP synthase,protein,623,Shigella flexneri,Shigella flexneri,tsaC,190,PTHR17490:SF18,THREONYLCARBAMOYL-AMP SYNTHASE,True
Q86U90,Threonylcarbamoyl-AMP synthase,protein,9606,Homo sapiens,Homo sapiens (Human),YRDC,279,PTHR17490:SF10,THREONYLCARBAMOYL-AMP SYNTHASE,True
Q87AQ5,Threonylcarbamoyl-AMP synthase,protein,183190,Xylella fastidiosa (strain Temecula1 / ATCC 700964),Xylella fastidiosa (strain Temecula1 / ATCC 700964),tsaC,187,PTHR17490:SF18,THREONYLCARBAMOYL-AMP SYNTHASE,True
Q87KE2,Threonylcarbamoyl-AMP synthase,protein,223926,Vibrio parahaemolyticus serotype O3:K6 (strain RIMD 2210633),Vibrio parahaemolyticus serotype O3:K6 (strain RIMD 2210633),tsaC,185,PTHR17490:SF18,THREONYLCARBAMOYL-AMP SYNTHASE,True
Q88B46,Threonylcarbamoyl-AMP synthase,protein,223283,Pseudomonas syringae pv. tomato (strain ATCC BAA-871 / DC3000),Pseudomonas syringae pv. tomato (strain ATCC BAA-871 / DC3000),tsaC,185,PTHR17490:SF18,THREONYLCARBAMOYL-AMP SYNTHASE,True
Q88RQ9,Threonylcarbamoyl-AMP synthase,protein,160488,Pseudomonas putida (strain ATCC 47054 / DSM 6125 / CFBP 8728 / NCIMB 11950 / KT2440),Pseudomonas putida (strain ATCC 47054 / DSM 6125 / CFBP 8728 / NCIMB 11950 / KT2440),tsaC,185,PTHR17490:SF18,THREONYLCARBAMOYL-AMP SYNTHASE,True
Q89A89,Threonylcarbamoyl-AMP synthase,protein,224915,Buchnera aphidicola subsp. Baizongia pistaciae (strain Bp),Buchnera aphidicola subsp. Baizongia pistaciae (strain Bp),tsaC,186,PTHR17490:SF18,THREONYLCARBAMOYL-AMP SYNTHASE,True
Q8D257,Threonylcarbamoyl-AMP synthase,protein,36870,Wigglesworthia glossinidia brevipalpis,Wigglesworthia glossinidia brevipalpis,tsaC,194,PTHR17490:SF18,THREONYLCARBAMOYL-AMP SYNTHASE,True
Q8DDD6,Threonylcarbamoyl-AMP synthase,protein,216895,Vibrio vulnificus (strain CMCP6),Vibrio vulnificus (strain CMCP6),tsaC,186,PTHR17490:SF18,THREONYLCARBAMOYL-AMP SYNTHASE,True
Q8EKQ3,Threonylcarbamoyl-AMP synthase,protein,211586,Shewanella oneidensis (strain ATCC 700550 / JCM 31522 / CIP 106686 / LMG 19005 / NCIMB 14063 / MR-1),Shewanella oneidensis (strain ATCC 700550 / JCM 31522 / CIP 106686 / LMG 19005 / NCIMB 14063 / MR-1),tsaC,188,PTHR17490:SF18,THREONYLCARBAMOYL-AMP SYNTHASE,True
Q8FD17,Threonylcarbamoyl-AMP synthase,protein,199310,Escherichia coli O6:H1 (strain CFT073 / ATCC 700928 / UPEC),Escherichia coli O6:H1 (strain CFT073 / ATCC 700928 / UPEC),tsaC,190,PTHR17490:SF18,THREONYLCARBAMOYL-AMP SYNTHASE,True
Q8K977,Threonylcarbamoyl-AMP synthase,protein,198804,Buchnera aphidicola subsp. Schizaphis graminum (strain Sg),Buchnera aphidicola subsp. Schizaphis graminum (strain Sg),tsaC,190,PTHR17490:SF18,THREONYLCARBAMOYL-AMP SYNTHASE,True
Q8P4F2,Threonylcarbamoyl-AMP synthase,protein,190485,Xanthomonas campestris pv. campestris (strain ATCC 33913 / DSM 3586 / NCPPB 528 / LMG 568 / P 25),Xanthomonas campestris pv. campestris (strain ATCC 33913 / DSM 3586 / NCPPB 528 / LMG 568 / P 25),tsaC,187,PTHR17490:SF18,THREONYLCARBAMOYL-AMP SYNTHASE,True
Q8PG13,Threonylcarbamoyl-AMP synthase,protein,190486,Xanthomonas citri pv. citri (strain 306),Xanthomonas citri pv. citri (strain 306),tsaC,187,PTHR17490:SF18,THREONYLCARBAMOYL-AMP SYNTHASE,True
Q8X8F8,Threonylcarbamoyl-AMP synthase,protein,83334,Escherichia coli O157:H7,Escherichia coli O157:H7,tsaC,190,PTHR17490:SF18,THREONYLCARBAMOYL-AMP SYNTHASE,True
Q8Z1W6,Threonylcarbamoyl-AMP synthase,protein,90370,Salmonella typhi,Salmonella typhi,tsaC,190,PTHR17490:SF18,THREONYLCARBAMOYL-AMP SYNTHASE,True
Q8ZLN0,Threonylcarbamoyl-AMP synthase,protein,99287,Salmonella typhimurium (strain LT2 / SGSC1412 / ATCC 700720),Salmonella typhimurium (strain LT2 / SGSC1412 / ATCC 700720),tsaC,190,PTHR17490:SF18,THREONYLCARBAMOYL-AMP SYNTHASE,True
Q970S6,Threonylcarbamoyl-AMP synthase,protein,273063,Sulfurisphaera tokodaii (strain DSM 16993 / JCM 10545 / NBRC 100140 / 7),Sulfurisphaera tokodaii (strain DSM 16993 / JCM 10545 / NBRC 100140 / 7),sua5,352,PTHR17490:SF16,THREONYLCARBAMOYL-AMP SYNTHASE,True
Q9CLG4,Threonylcarbamoyl-AMP synthase,protein,272843,Pasteurella multocida (strain Pm70),Pasteurella multocida (strain Pm70),tsaC,183,PTHR17490:SF18,THREONYLCARBAMOYL-AMP SYNTHASE,True
Q9I7A5,Threonylcarbamoyl-AMP synthase,protein,208964,Pseudomonas aeruginosa (strain ATCC 15692 / DSM 22644 / CIP 104116 / JCM 14847 / LMG 12228 / 1C / PRS 101 / PAO1),Pseudomonas aeruginosa (strain ATCC 15692 / DSM 22644 / CIP 104116 / JCM 14847 / LMG 12228 / 1C / PRS 101 / PAO1),tsaC,185,PTHR17490:SF18,THREONYLCARBAMOYL-AMP SYNTHASE,True
Q9JXA4,Threonylcarbamoyl-AMP synthase,protein,122586,Neisseria meningitidis serogroup B (strain ATCC BAA-335 / MC58),Neisseria meningitidis serogroup B (strain ATCC BAA-335 / MC58),tsaC,189,PTHR17490:SF18,THREONYLCARBAMOYL-AMP SYNTHASE,True
Q9KVT5,Threonylcarbamoyl-AMP synthase,protein,243277,Vibrio cholerae serotype O1 (strain ATCC 39315 / El Tor Inaba N16961),Vibrio cholerae serotype O1 (strain ATCC 39315 / El Tor Inaba N16961),tsaC,188,PTHR17490:SF18,THREONYLCARBAMOYL-AMP SYNTHASE,True
Q9PEV9,Threonylcarbamoyl-AMP synthase,protein,160492,Xylella fastidiosa (strain 9a5c),Xylella fastidiosa (strain 9a5c),tsaC,187,PTHR17490:SF18,THREONYLCARBAMOYL-AMP SYNTHASE,True
Q9UYB2,Threonylcarbamoyl-AMP synthase,protein,272844,Pyrococcus abyssi (strain GE5 / Orsay),Pyrococcus abyssi (strain GE5 / Orsay),sua5,340,PTHR17490:SF16,THREONYLCARBAMOYL-AMP SYNTHASE,True
