id,name,entry_type,source_tax_id,source_tax_name,full_tax_name,gene,length,subfamily,subfamily_name,in_alphafold
A0KEX6,Threonylcarbamoyl-AMP synthase,protein,380703,Aeromonas hydrophila subsp. hydrophila (strain ATCC 7966 / DSM 30187 / BCRC 13018 / CCUG 14551 / JCM 1027 / KCTC 2358 / NCIMB 9240 / NCTC 8049),Aeromonas hydrophila subsp. hydrophila (strain ATCC 7966 / DSM 30187 / BCRC 13018 / CCUG 14551 / JCM 1027 / KCTC 2358 / NCIMB 9240 / NCTC 8049),tsaC,186,PTHR17490:SF18,THREONYLCARBAMOYL-AMP SYNTHASE,True
A0KR66,Threonylcarbamoyl-AMP synthase,protein,94122,Shewanella sp. (strain ANA-3),Shewanella sp. (strain ANA-3),tsaC,188,PTHR17490:SF18,THREONYLCARBAMOYL-AMP SYNTHASE,True
A1AGH4,Threonylcarbamoyl-AMP synthase,protein,405955,Escherichia coli O1:K1 / APEC,Escherichia coli O1:K1 / APEC,tsaC,190,PTHR17490:SF18,THREONYLCARBAMOYL-AMP SYNTHASE,True
A1IP83,Threonylcarbamoyl-AMP synthase,protein,122587,Neisseria meningitidis serogroup A / serotype 4A (strain DSM 15465 / Z2491),Neisseria meningitidis serogroup A / serotype 4A (strain DSM 15465 / Z2491),tsaC,189,PTHR17490:SF18,THREONYLCARBAMOYL-AMP SYNTHASE,True
A1JRY6,Threonylcarbamoyl-AMP synthase,protein,393305,Yersinia enterocolitica serotype O:8 / biotype 1B (strain NCTC 13174 / 8081),Yersinia enterocolitica serotype O:8 / biotype 1B (strain NCTC 13174 / 8081),tsaC,190,PTHR17490:SF18,THREONYLCARBAMOYL-AMP SYNTHASE,True
A1KWL6,Threonylcarbamoyl-AMP synthase,protein,272831,Neisseria meningitidis serogroup C / serotype 2a (strain ATCC 700532 / DSM 15464 / FAM18),Neisseria meningitidis serogroup C / serotype 2a (strain ATCC 700532 / DSM 15464 / FAM18),tsaC,189,PTHR17490:SF18,THREONYLCARBAMOYL-AMP SYNTHASE,True
A1RDY7,Threonylcarbamoyl-AMP synthase,protein,351745,Shewanella sp. (strain W3-18-1),Shewanella sp. (strain W3-18-1),tsaC,188,PTHR17490:SF18,THREONYLCARBAMOYL-AMP SYNTHASE,True
A1S1K5,Threonylcarbamoyl-AMP synthase,protein,326297,Shewanella amazonensis (strain ATCC BAA-1098 / SB2B),Shewanella amazonensis (strain ATCC BAA-1098 / SB2B),tsaC,187,PTHR17490:SF18,THREONYLCARBAMOYL-AMP SYNTHASE,True
A1SR31,Threonylcarbamoyl-AMP synthase,protein,357804,Psychromonas ingrahamii (strain DSM 17664 / CCUG 51855 / 37),Psychromonas ingrahamii (strain DSM 17664 / CCUG 51855 / 37),tsaC,191,PTHR17490:SF18,THREONYLCARBAMOYL-AMP SYNTHASE,True
A1TWN4,Threonylcarbamoyl-AMP synthase,protein,351348,Marinobacter nauticus (strain ATCC 700491 / DSM 11845 / VT8),Marinobacter nauticus (strain ATCC 700491 / DSM 11845 / VT8),tsaC,190,PTHR17490:SF18,THREONYLCARBAMOYL-AMP SYNTHASE,True
A1WZH9,Threonylcarbamoyl-AMP synthase,protein,349124,Halorhodospira halophila (strain DSM 244 / SL1),Halorhodospira halophila (strain DSM 244 / SL1),tsaC,191,PTHR17490:SF18,THREONYLCARBAMOYL-AMP SYNTHASE,True
A3CYL0,Threonylcarbamoyl-AMP synthase,protein,325240,Shewanella baltica (strain OS155 / ATCC BAA-1091),Shewanella baltica (strain OS155 / ATCC BAA-1091),tsaC,188,PTHR17490:SF18,THREONYLCARBAMOYL-AMP SYNTHASE,True
A3M154,Threonylcarbamoyl-AMP synthase,protein,400667,Acinetobacter baumannii (strain ATCC 17978 / DSM 105126 / CIP 53.77 / LMG 1025 / NCDC KC755 / 5377),Acinetobacter baumannii (strain ATCC 17978 / DSM 105126 / CIP 53.77 / LMG 1025 / NCDC KC755 / 5377),tsaC,189,PTHR17490:SF18,THREONYLCARBAMOYL-AMP SYNTHASE,True
A3N1E4,Threonylcarbamoyl-AMP synthase,protein,416269,Actinobacillus pleuropneumoniae serotype 5b (strain L20),Actinobacillus pleuropneumoniae serotype 5b (strain L20),tsaC,184,PTHR17490:SF18,THREONYLCARBAMOYL-AMP SYNTHASE,True
A3QJE8,Threonylcarbamoyl-AMP synthase,protein,323850,Shewanella loihica (strain ATCC BAA-1088 / PV-4),Shewanella loihica (strain ATCC BAA-1088 / PV-4),tsaC,185,PTHR17490:SF18,THREONYLCARBAMOYL-AMP SYNTHASE,True
A4ST51,Threonylcarbamoyl-AMP synthase,protein,382245,Aeromonas salmonicida (strain A449),Aeromonas salmonicida (strain A449),tsaC,186,PTHR17490:SF18,THREONYLCARBAMOYL-AMP SYNTHASE,True
A4TH27,Threonylcarbamoyl-AMP synthase,protein,386656,Yersinia pestis (strain Pestoides F),Yersinia pestis (strain Pestoides F),tsaC,190,PTHR17490:SF18,THREONYLCARBAMOYL-AMP SYNTHASE,True
A4VFI1,Threonylcarbamoyl-AMP synthase,protein,379731,Stutzerimonas stutzeri (strain A1501),Stutzerimonas stutzeri (strain A1501),tsaC,185,PTHR17490:SF18,THREONYLCARBAMOYL-AMP SYNTHASE,True
A4WF91,Threonylcarbamoyl-AMP synthase,protein,399742,Enterobacter sp. (strain 638),Enterobacter sp. (strain 638),tsaC,190,PTHR17490:SF18,THREONYLCARBAMOYL-AMP SYNTHASE,True
A4XNB6,Threonylcarbamoyl-AMP synthase,protein,399739,Ectopseudomonas mendocina (strain ymp),Ectopseudomonas mendocina (strain ymp),tsaC,185,PTHR17490:SF18,THREONYLCARBAMOYL-AMP SYNTHASE,True
A4Y1D2,Threonylcarbamoyl-AMP synthase,protein,319224,Shewanella putrefaciens (strain CN-32 / ATCC BAA-453),Shewanella putrefaciens (strain CN-32 / ATCC BAA-453),tsaC,188,PTHR17490:SF18,THREONYLCARBAMOYL-AMP SYNTHASE,True
A5EW39,Threonylcarbamoyl-AMP synthase,protein,246195,Dichelobacter nodosus (strain VCS1703A),Dichelobacter nodosus (strain VCS1703A),tsaC,190,PTHR17490:SF18,THREONYLCARBAMOYL-AMP SYNTHASE,True
A5F4C5,Threonylcarbamoyl-AMP synthase,protein,345073,Vibrio cholerae serotype O1 (strain ATCC 39541 / Classical Ogawa 395 / O395),Vibrio cholerae serotype O1 (strain ATCC 39541 / Classical Ogawa 395 / O395),tsaC,188,PTHR17490:SF18,THREONYLCARBAMOYL-AMP SYNTHASE,True
A5UE77,Threonylcarbamoyl-AMP synthase,protein,374930,Haemophilus influenzae (strain PittEE),Haemophilus influenzae (strain PittEE),tsaC,183,PTHR17490:SF18,THREONYLCARBAMOYL-AMP SYNTHASE,True
A5UHE9,Threonylcarbamoyl-AMP synthase,protein,374931,Haemophilus influenzae (strain PittGG),Haemophilus influenzae (strain PittGG),tsaC,183,PTHR17490:SF18,THREONYLCARBAMOYL-AMP SYNTHASE,True
A5VWK1,Threonylcarbamoyl-AMP synthase,protein,351746,Pseudomonas putida (strain ATCC 700007 / DSM 6899 / JCM 31910 / BCRC 17059 / LMG 24140 / F1),Pseudomonas putida (strain ATCC 700007 / DSM 6899 / JCM 31910 / BCRC 17059 / LMG 24140 / F1),tsaC,185,PTHR17490:SF18,THREONYLCARBAMOYL-AMP SYNTHASE,True
A6TET6,Threonylcarbamoyl-AMP synthase,protein,272620,Klebsiella pneumoniae subsp. pneumoniae (strain ATCC 700721 / MGH 78578),Klebsiella pneumoniae subsp. pneumoniae (strain ATCC 700721 / MGH 78578),tsaC,190,PTHR17490:SF18,THREONYLCARBAMOYL-AMP SYNTHASE,True
A6UX84,Threonylcarbamoyl-AMP synthase,protein,381754,Pseudomonas paraeruginosa (strain DSM 24068 / PA7),Pseudomonas paraeruginosa (strain DSM 24068 / PA7),tsaC,185,PTHR17490:SF18,THREONYLCARBAMOYL-AMP SYNTHASE,True
A6VL69,Threonylcarbamoyl-AMP synthase,protein,339671,Actinobacillus succinogenes (strain ATCC 55618 / DSM 22257 / CCUG 43843 / 130Z),Actinobacillus succinogenes (strain ATCC 55618 / DSM 22257 / CCUG 43843 / 130Z),tsaC,183,PTHR17490:SF18,THREONYLCARBAMOYL-AMP SYNTHASE,True
A6VT87,Threonylcarbamoyl-AMP synthase,protein,400668,Marinomonas sp. (strain MWYL1),Marinomonas sp. (strain MWYL1),tsaC,185,PTHR17490:SF18,THREONYLCARBAMOYL-AMP SYNTHASE,True
A6WHB6,Threonylcarbamoyl-AMP synthase,protein,402882,Shewanella baltica (strain OS185),Shewanella baltica (strain OS185),tsaC,188,PTHR17490:SF18,THREONYLCARBAMOYL-AMP SYNTHASE,True
A7FNJ8,Threonylcarbamoyl-AMP synthase,protein,349747,Yersinia pseudotuberculosis serotype O:1b (strain IP 31758),Yersinia pseudotuberculosis serotype O:1b (strain IP 31758),tsaC,190,PTHR17490:SF18,THREONYLCARBAMOYL-AMP SYNTHASE,True
A7MPF3,Threonylcarbamoyl-AMP synthase,protein,290339,Cronobacter sakazakii (strain ATCC BAA-894),Cronobacter sakazakii (strain ATCC BAA-894),tsaC,190,PTHR17490:SF18,THREONYLCARBAMOYL-AMP SYNTHASE,True
A7N129,Threonylcarbamoyl-AMP synthase,protein,2902295,Vibrio campbellii (strain ATCC BAA-1116),Vibrio campbellii (strain ATCC BAA-1116),tsaC,185,PTHR17490:SF18,THREONYLCARBAMOYL-AMP SYNTHASE,True
A7ZSH1,Threonylcarbamoyl-AMP synthase,protein,331111,Escherichia coli O139:H28 (strain E24377A / ETEC),Escherichia coli O139:H28 (strain E24377A / ETEC),tsaC,190,PTHR17490:SF18,THREONYLCARBAMOYL-AMP SYNTHASE,True
A8A587,Threonylcarbamoyl-AMP synthase,protein,331112,Escherichia coli O9:H4 (strain HS),Escherichia coli O9:H4 (strain HS),tsaC,190,PTHR17490:SF18,THREONYLCARBAMOYL-AMP SYNTHASE,True
A8AQH7,Threonylcarbamoyl-AMP synthase,protein,290338,Citrobacter koseri (strain ATCC BAA-895 / CDC 4225-83 / SGSC4696),Citrobacter koseri (strain ATCC BAA-895 / CDC 4225-83 / SGSC4696),tsaC,190,PTHR17490:SF18,THREONYLCARBAMOYL-AMP SYNTHASE,True
A8FP81,Threonylcarbamoyl-AMP synthase,protein,425104,Shewanella sediminis (strain HAW-EB3),Shewanella sediminis (strain HAW-EB3),tsaC,185,PTHR17490:SF18,THREONYLCARBAMOYL-AMP SYNTHASE,True
A8GKG1,Threonylcarbamoyl-AMP synthase,protein,399741,Serratia proteamaculans (strain 568),Serratia proteamaculans (strain 568),tsaC,189,PTHR17490:SF18,THREONYLCARBAMOYL-AMP SYNTHASE,True
A8GYH9,Threonylcarbamoyl-AMP synthase,protein,398579,Shewanella pealeana (strain ATCC 700345 / ANG-SQ1),Shewanella pealeana (strain ATCC 700345 / ANG-SQ1),tsaC,187,PTHR17490:SF18,THREONYLCARBAMOYL-AMP SYNTHASE,True
A9KH21,Threonylcarbamoyl-AMP synthase,protein,434922,Coxiella burnetii (strain Dugway 5J108-111),Coxiella burnetii (strain Dugway 5J108-111),tsaC,186,PTHR17490:SF18,THREONYLCARBAMOYL-AMP SYNTHASE,True
A9KUA7,Threonylcarbamoyl-AMP synthase,protein,399599,Shewanella baltica (strain OS195),Shewanella baltica (strain OS195),tsaC,188,PTHR17490:SF18,THREONYLCARBAMOYL-AMP SYNTHASE,True
A9M4K6,Threonylcarbamoyl-AMP synthase,protein,374833,Neisseria meningitidis serogroup C (strain 053442),Neisseria meningitidis serogroup C (strain 053442),tsaC,189,PTHR17490:SF18,THREONYLCARBAMOYL-AMP SYNTHASE,True
A9MN84,Threonylcarbamoyl-AMP synthase,protein,41514,Salmonella arizonae (strain ATCC BAA-731 / CDC346-86 / RSK2980),Salmonella arizonae (strain ATCC BAA-731 / CDC346-86 / RSK2980),tsaC,190,PTHR17490:SF18,THREONYLCARBAMOYL-AMP SYNTHASE,True
A9N8A7,Threonylcarbamoyl-AMP synthase,protein,1016998,Salmonella paratyphi B (strain ATCC BAA-1250 / SPB7),Salmonella paratyphi B (strain ATCC BAA-1250 / SPB7),tsaC,190,PTHR17490:SF18,THREONYLCARBAMOYL-AMP SYNTHASE,True
A9N9G8,Threonylcarbamoyl-AMP synthase,protein,360115,Coxiella burnetii (strain RSA 331 / Henzerling II),Coxiella burnetii (strain RSA 331 / Henzerling II),tsaC,186,PTHR17490:SF18,THREONYLCARBAMOYL-AMP SYNTHASE,True
A9R933,Threonylcarbamoyl-AMP synthase,protein,349746,Yersinia pestis bv. Antiqua (strain Angola),Yersinia pestis bv. Antiqua (strain Angola),tsaC,190,PTHR17490:SF18,THREONYLCARBAMOYL-AMP SYNTHASE,True
B0BQ80,Threonylcarbamoyl-AMP synthase,protein,434271,Actinobacillus pleuropneumoniae serotype 3 (strain JL03),Actinobacillus pleuropneumoniae serotype 3 (strain JL03),tsaC,184,PTHR17490:SF18,THREONYLCARBAMOYL-AMP SYNTHASE,True
B0KF32,Threonylcarbamoyl-AMP synthase,protein,76869,Pseudomonas putida (strain GB-1),Pseudomonas putida (strain GB-1),tsaC,185,PTHR17490:SF18,THREONYLCARBAMOYL-AMP SYNTHASE,True
B0RWR5,Threonylcarbamoyl-AMP synthase,protein,509169,Xanthomonas campestris pv. campestris (strain B100),Xanthomonas campestris pv. campestris (strain B100),tsaC,187,PTHR17490:SF18,THREONYLCARBAMOYL-AMP SYNTHASE,True
B0TLD6,Threonylcarbamoyl-AMP synthase,protein,458817,Shewanella halifaxensis (strain HAW-EB4),Shewanella halifaxensis (strain HAW-EB4),tsaC,187,PTHR17490:SF18,THREONYLCARBAMOYL-AMP SYNTHASE,True
B0U4N0,Threonylcarbamoyl-AMP synthase,protein,405440,Xylella fastidiosa (strain M12),Xylella fastidiosa (strain M12),tsaC,187,PTHR17490:SF18,THREONYLCARBAMOYL-AMP SYNTHASE,True
B0UWV9,Threonylcarbamoyl-AMP synthase,protein,228400,Histophilus somni (strain 2336),Histophilus somni (strain 2336),tsaC,183,PTHR17490:SF18,THREONYLCARBAMOYL-AMP SYNTHASE,True
B0VCB7,Threonylcarbamoyl-AMP synthase,protein,509173,Acinetobacter baumannii (strain AYE),Acinetobacter baumannii (strain AYE),tsaC,189,PTHR17490:SF18,THREONYLCARBAMOYL-AMP SYNTHASE,True
B0VNL3,Threonylcarbamoyl-AMP synthase,protein,509170,Acinetobacter baumannii (strain SDF),Acinetobacter baumannii (strain SDF),tsaC,189,PTHR17490:SF18,THREONYLCARBAMOYL-AMP SYNTHASE,True
B1IQ17,Threonylcarbamoyl-AMP synthase,protein,481805,Escherichia coli (strain ATCC 8739 / DSM 1576 / NBRC 3972 / NCIMB 8545 / WDCM 00012 / Crooks),Escherichia coli (strain ATCC 8739 / DSM 1576 / NBRC 3972 / NCIMB 8545 / WDCM 00012 / Crooks),tsaC,190,PTHR17490:SF18,THREONYLCARBAMOYL-AMP SYNTHASE,True
B1J499,Threonylcarbamoyl-AMP synthase,protein,390235,Pseudomonas putida (strain W619),Pseudomonas putida (strain W619),tsaC,185,PTHR17490:SF18,THREONYLCARBAMOYL-AMP SYNTHASE,True
B1JJI2,Threonylcarbamoyl-AMP synthase,protein,502800,Yersinia pseudotuberculosis serotype O:3 (strain YPIII),Yersinia pseudotuberculosis serotype O:3 (strain YPIII),tsaC,190,PTHR17490:SF18,THREONYLCARBAMOYL-AMP SYNTHASE,True
B1KCX0,Threonylcarbamoyl-AMP synthase,protein,392500,Shewanella woodyi (strain ATCC 51908 / MS32),Shewanella woodyi (strain ATCC 51908 / MS32),tsaC,185,PTHR17490:SF18,THREONYLCARBAMOYL-AMP SYNTHASE,True
B1LGN9,Threonylcarbamoyl-AMP synthase,protein,439855,Escherichia coli (strain SMS-3-5 / SECEC),Escherichia coli (strain SMS-3-5 / SECEC),tsaC,190,PTHR17490:SF18,THREONYLCARBAMOYL-AMP SYNTHASE,True
B1X6D5,Threonylcarbamoyl-AMP synthase,protein,316385,Escherichia coli (strain K12 / DH10B),Escherichia coli (strain K12 / DH10B),tsaC,190,PTHR17490:SF18,THREONYLCARBAMOYL-AMP SYNTHASE,True
B2FIS1,Threonylcarbamoyl-AMP synthase,protein,522373,Stenotrophomonas maltophilia (strain K279a),Stenotrophomonas maltophilia (strain K279a),tsaC,186,PTHR17490:SF18,THREONYLCARBAMOYL-AMP SYNTHASE,True
B2I111,Threonylcarbamoyl-AMP synthase,protein,405416,Acinetobacter baumannii (strain ACICU),Acinetobacter baumannii (strain ACICU),tsaC,189,PTHR17490:SF18,THREONYLCARBAMOYL-AMP SYNTHASE,True
B2I8S9,Threonylcarbamoyl-AMP synthase,protein,405441,Xylella fastidiosa (strain M23),Xylella fastidiosa (strain M23),tsaC,187,PTHR17490:SF18,THREONYLCARBAMOYL-AMP SYNTHASE,True
B2K500,Threonylcarbamoyl-AMP synthase,protein,502801,Yersinia pseudotuberculosis serotype IB (strain PB1/+),Yersinia pseudotuberculosis serotype IB (strain PB1/+),tsaC,190,PTHR17490:SF18,THREONYLCARBAMOYL-AMP SYNTHASE,True
B2SL46,Threonylcarbamoyl-AMP synthase,protein,360094,Xanthomonas oryzae pv. oryzae (strain PXO99A),Xanthomonas oryzae pv. oryzae (strain PXO99A),tsaC,187,PTHR17490:SF18,THREONYLCARBAMOYL-AMP SYNTHASE,True
B2U2Q0,Threonylcarbamoyl-AMP synthase,protein,344609,Shigella boydii serotype 18 (strain CDC 3083-94 / BS512),Shigella boydii serotype 18 (strain CDC 3083-94 / BS512),tsaC,190,PTHR17490:SF18,THREONYLCARBAMOYL-AMP SYNTHASE,True
B3GY27,Threonylcarbamoyl-AMP synthase,protein,537457,Actinobacillus pleuropneumoniae serotype 7 (strain AP76),Actinobacillus pleuropneumoniae serotype 7 (strain AP76),tsaC,184,PTHR17490:SF18,THREONYLCARBAMOYL-AMP SYNTHASE,True
B3PGZ1,Threonylcarbamoyl-AMP synthase,protein,498211,Cellvibrio japonicus (strain Ueda107),Cellvibrio japonicus (strain Ueda107),tsaC,189,PTHR17490:SF18,THREONYLCARBAMOYL-AMP SYNTHASE,True
C1D9T5,Threonylcarbamoyl-AMP synthase,protein,557598,Laribacter hongkongensis (strain HLHK9),Laribacter hongkongensis (strain HLHK9),tsaC,185,PTHR17490:SF18,THREONYLCARBAMOYL-AMP SYNTHASE,True
D4G8K6,Threonylcarbamoyl-AMP synthase,protein,515618,Riesia pediculicola (strain USDA),Riesia pediculicola (strain USDA),tsaC,187,PTHR17490:SF18,THREONYLCARBAMOYL-AMP SYNTHASE,True
D5V9A9,Threonylcarbamoyl-AMP synthase,protein,1236608,Moraxella catarrhalis (strain BBH18),Moraxella catarrhalis (strain BBH18),tsaC,204,PTHR17490:SF18,THREONYLCARBAMOYL-AMP SYNTHASE,True
O94530,Threonylcarbamoyl-AMP synthase,protein,284812,Schizosaccharomyces pombe (strain 972 / ATCC 24843),Schizosaccharomyces pombe (strain 972 / ATCC 24843) (Fission yeast),sua5,408,PTHR17490:SF16,THREONYLCARBAMOYL-AMP SYNTHASE,True
P32579,Threonylcarbamoyl-AMP synthase,protein,559292,Saccharomyces cerevisiae (strain ATCC 204508 / S288c),Saccharomyces cerevisiae (strain ATCC 204508 / S288c) (Baker's yeast),SUA5,426,PTHR17490:SF16,THREONYLCARBAMOYL-AMP SYNTHASE,True
P39153,Threonylcarbamoyl-AMP synthase,protein,224308,Bacillus subtilis (strain 168),Bacillus subtilis (strain 168),ywlC,346,PTHR17490:SF16,THREONYLCARBAMOYL-AMP SYNTHASE,True
P44807,Threonylcarbamoyl-AMP synthase,protein,71421,Haemophilus influenzae (strain ATCC 51907 / DSM 11121 / KW20 / Rd),Haemophilus influenzae (strain ATCC 51907 / DSM 11121 / KW20 / Rd),tsaC,183,PTHR17490:SF18,THREONYLCARBAMOYL-AMP SYNTHASE,True
P45748,Threonylcarbamoyl-AMP synthase,protein,83333,Escherichia coli (strain K12),Escherichia coli (strain K12),tsaC,190,PTHR17490:SF18,THREONYLCARBAMOYL-AMP SYNTHASE,True
P45831,Putative threonylcarbamoyl-AMP synthase,protein,272631,Mycobacterium leprae (strain TN),Mycobacterium leprae (strain TN),ML1136,220,PTHR17490:SF16,THREONYLCARBAMOYL-AMP SYNTHASE,True
P57561,Threonylcarbamoyl-AMP synthase,protein,107806,Buchnera aphidicola subsp. Acyrthosiphon pisum (strain APS),Buchnera aphidicola subsp. Acyrthosiphon pisum (strain APS),tsaC,175,PTHR17490:SF18,THREONYLCARBAMOYL-AMP SYNTHASE,True
P9WGC8,Putative threonylcarbamoyl-AMP synthase,protein,83331,Mycobacterium tuberculosis (strain CDC 1551 / Oshkosh),Mycobacterium tuberculosis (strain CDC 1551 / Oshkosh),MT1340,217,PTHR17490:SF16,THREONYLCARBAMOYL-AMP SYNTHASE,True
P9WGC9,Putative threonylcarbamoyl-AMP synthase,protein,83332,Mycobacterium tuberculosis (strain ATCC 25618 / H37Rv),Mycobacterium tuberculosis (strain ATCC 25618 / H37Rv),Rv1301,217,PTHR17490:SF16,THREONYLCARBAMOYL-AMP SYNTHASE,True
Q02V59,Threonylcarbamoyl-AMP synthase,protein,208963,Pseudomonas aeruginosa (strain UCBPP-PA14),Pseudomonas aeruginosa (strain UCBPP-PA14),tsaC,185,PTHR17490:SF18,THREONYLCARBAMOYL-AMP SYNTHASE,True
Q08A23,Threonylcarbamoyl-AMP synthase,protein,318167,Shewanella frigidimarina (strain NCIMB 400),Shewanella frigidimarina (strain NCIMB 400),tsaC,188,PTHR17490:SF18,THREONYLCARBAMOYL-AMP SYNTHASE,True
Q0A5B4,Threonylcarbamoyl-AMP synthase,protein,187272,Alkalilimnicola ehrlichii (strain ATCC BAA-1101 / DSM 17681 / MLHE-1),Alkalilimnicola ehrlichii (strain ATCC BAA-1101 / DSM 17681 / MLHE-1),tsaC,190,PTHR17490:SF18,THREONYLCARBAMOYL-AMP SYNTHASE,True
Q0HPA1,Threonylcarbamoyl-AMP synthase,protein,60480,Shewanella sp. (strain MR-4),Shewanella sp. (strain MR-4),tsaC,188,PTHR17490:SF18,THREONYLCARBAMOYL-AMP SYNTHASE,True
Q0I0R7,Threonylcarbamoyl-AMP synthase,protein,60481,Shewanella sp. (strain MR-7),Shewanella sp. (strain MR-7),tsaC,188,PTHR17490:SF18,THREONYLCARBAMOYL-AMP SYNTHASE,True
Q0I1B6,Threonylcarbamoyl-AMP synthase,protein,205914,Histophilus somni (strain 129Pt),Histophilus somni (strain 129Pt),tsaC,183,PTHR17490:SF18,THREONYLCARBAMOYL-AMP SYNTHASE,True
Q0T019,Threonylcarbamoyl-AMP synthase,protein,373384,Shigella flexneri serotype 5b (strain 8401),Shigella flexneri serotype 5b (strain 8401),tsaC,190,PTHR17490:SF18,THREONYLCARBAMOYL-AMP SYNTHASE,True
Q0TCH9,Threonylcarbamoyl-AMP synthase,protein,362663,Escherichia coli O6:K15:H31 (strain 536 / UPEC),Escherichia coli O6:K15:H31 (strain 536 / UPEC),tsaC,190,PTHR17490:SF18,THREONYLCARBAMOYL-AMP SYNTHASE,True
Q0VC80,Threonylcarbamoyl-AMP synthase,protein,9913,Bos taurus,Bos taurus (Bovine),YRDC,276,PTHR17490:SF10,THREONYLCARBAMOYL-AMP SYNTHASE,True
Q0VTD8,Threonylcarbamoyl-AMP synthase,protein,393595,Alcanivorax borkumensis (strain ATCC 700651 / DSM 11573 / NCIMB 13689 / SK2),Alcanivorax borkumensis (strain ATCC 700651 / DSM 11573 / NCIMB 13689 / SK2),tsaC,182,PTHR17490:SF18,THREONYLCARBAMOYL-AMP SYNTHASE,True
Q12TA0,Threonylcarbamoyl-AMP synthase,protein,318161,Shewanella denitrificans (strain OS217 / ATCC BAA-1090 / DSM 15013),Shewanella denitrificans (strain OS217 / ATCC BAA-1090 / DSM 15013),tsaC,188,PTHR17490:SF18,THREONYLCARBAMOYL-AMP SYNTHASE,True
Q15ZX7,Threonylcarbamoyl-AMP synthase,protein,3042615,Pseudoalteromonas atlantica (strain T6c / ATCC BAA-1087),Pseudoalteromonas atlantica (strain T6c / ATCC BAA-1087),tsaC,187,PTHR17490:SF18,THREONYLCARBAMOYL-AMP SYNTHASE,True
Q1C2Y3,Threonylcarbamoyl-AMP synthase,protein,360102,Yersinia pestis bv. Antiqua (strain Antiqua),Yersinia pestis bv. Antiqua (strain Antiqua),tsaC,190,PTHR17490:SF18,THREONYLCARBAMOYL-AMP SYNTHASE,True
Q1CCY0,Threonylcarbamoyl-AMP synthase,protein,377628,Yersinia pestis bv. Antiqua (strain Nepal516),Yersinia pestis bv. Antiqua (strain Nepal516),tsaC,190,PTHR17490:SF18,THREONYLCARBAMOYL-AMP SYNTHASE,True
Q1H4G9,Threonylcarbamoyl-AMP synthase,protein,265072,Methylobacillus flagellatus (strain ATCC 51484 / DSM 6875 / VKM B-1610 / KT),Methylobacillus flagellatus (strain ATCC 51484 / DSM 6875 / VKM B-1610 / KT),tsaC,180,PTHR17490:SF18,THREONYLCARBAMOYL-AMP SYNTHASE,True
Q1I2G9,Threonylcarbamoyl-AMP synthase,protein,384676,Pseudomonas entomophila (strain L48),Pseudomonas entomophila (strain L48),tsaC,185,PTHR17490:SF18,THREONYLCARBAMOYL-AMP SYNTHASE,True
Q1LT55,Threonylcarbamoyl-AMP synthase,protein,374463,Baumannia cicadellinicola subsp. Homalodisca coagulata,Baumannia cicadellinicola subsp. Homalodisca coagulata,tsaC,198,PTHR17490:SF18,THREONYLCARBAMOYL-AMP SYNTHASE,True
Q1Q7W4,Threonylcarbamoyl-AMP synthase,protein,335284,Psychrobacter cryohalolentis (strain ATCC BAA-1226 / DSM 17306 / VKM B-2378 / K5),Psychrobacter cryohalolentis (strain ATCC BAA-1226 / DSM 17306 / VKM B-2378 / K5),tsaC,214,PTHR17490:SF18,THREONYLCARBAMOYL-AMP SYNTHASE,True
Q1QTJ8,Threonylcarbamoyl-AMP synthase,protein,290398,Chromohalobacter israelensis (strain ATCC BAA-138 / DSM 3043 / CIP 106854 / NCIMB 13768 / 1H11),Chromohalobacter israelensis (strain ATCC BAA-138 / DSM 3043 / CIP 106854 / NCIMB 13768 / 1H11),tsaC,185,PTHR17490:SF18,THREONYLCARBAMOYL-AMP SYNTHASE,True
Q1R650,Threonylcarbamoyl-AMP synthase,protein,364106,Escherichia coli (strain UTI89 / UPEC),Escherichia coli (strain UTI89 / UPEC),tsaC,190,PTHR17490:SF18,THREONYLCARBAMOYL-AMP SYNTHASE,True
Q21PU1,Threonylcarbamoyl-AMP synthase,protein,203122,Saccharophagus degradans (strain 2-40 / ATCC 43961 / DSM 17024),Saccharophagus degradans (strain 2-40 / ATCC 43961 / DSM 17024),tsaC,191,PTHR17490:SF18,THREONYLCARBAMOYL-AMP SYNTHASE,True
Q2NQQ7,Threonylcarbamoyl-AMP synthase,protein,343509,Sodalis glossinidius (strain morsitans),Sodalis glossinidius (strain morsitans),tsaC,190,PTHR17490:SF18,THREONYLCARBAMOYL-AMP SYNTHASE,True
Q2P833,Threonylcarbamoyl-AMP synthase,protein,342109,Xanthomonas oryzae pv. oryzae (strain MAFF 311018),Xanthomonas oryzae pv. oryzae (strain MAFF 311018),tsaC,187,PTHR17490:SF18,THREONYLCARBAMOYL-AMP SYNTHASE,True
Q2SQW8,Threonylcarbamoyl-AMP synthase,protein,349521,Hahella chejuensis (strain KCTC 2396),Hahella chejuensis (strain KCTC 2396),tsaC,184,PTHR17490:SF18,THREONYLCARBAMOYL-AMP SYNTHASE,True
Q31JQ7,Threonylcarbamoyl-AMP synthase,protein,317025,Hydrogenovibrio crunogenus (strain DSM 25203 / XCL-2),Hydrogenovibrio crunogenus (strain DSM 25203 / XCL-2),tsaC,186,PTHR17490:SF18,THREONYLCARBAMOYL-AMP SYNTHASE,True
Q31VZ4,Threonylcarbamoyl-AMP synthase,protein,300268,Shigella boydii serotype 4 (strain Sb227),Shigella boydii serotype 4 (strain Sb227),tsaC,190,PTHR17490:SF18,THREONYLCARBAMOYL-AMP SYNTHASE,True
Q32B67,Threonylcarbamoyl-AMP synthase,protein,300267,Shigella dysenteriae serotype 1 (strain Sd197),Shigella dysenteriae serotype 1 (strain Sd197),tsaC,190,PTHR17490:SF18,THREONYLCARBAMOYL-AMP SYNTHASE,True
Q3BNJ9,Threonylcarbamoyl-AMP synthase,protein,316273,Xanthomonas euvesicatoria pv. vesicatoria (strain 85-10),Xanthomonas euvesicatoria pv. vesicatoria (strain 85-10),tsaC,187,PTHR17490:SF18,THREONYLCARBAMOYL-AMP SYNTHASE,True
Q3IDH7,Threonylcarbamoyl-AMP synthase,protein,326442,Pseudoalteromonas translucida (strain TAC 125),Pseudoalteromonas translucida (strain TAC 125),tsaC,187,PTHR17490:SF18,THREONYLCARBAMOYL-AMP SYNTHASE,True
Q3J7C4,Threonylcarbamoyl-AMP synthase,protein,323261,Nitrosococcus oceani (strain ATCC 19707 / BCRC 17464 / JCM 30415 / NCIMB 11848 / C-107),Nitrosococcus oceani (strain ATCC 19707 / BCRC 17464 / JCM 30415 / NCIMB 11848 / C-107),tsaC,185,PTHR17490:SF18,THREONYLCARBAMOYL-AMP SYNTHASE,True
Q3KKE2,Threonylcarbamoyl-AMP synthase,protein,205922,Pseudomonas fluorescens (strain Pf0-1),Pseudomonas fluorescens (strain Pf0-1),tsaC,185,PTHR17490:SF18,THREONYLCARBAMOYL-AMP SYNTHASE,True
Q3SG43,Threonylcarbamoyl-AMP synthase,protein,292415,Thiobacillus denitrificans (strain ATCC 25259 / T1),Thiobacillus denitrificans (strain ATCC 25259 / T1),tsaC,188,PTHR17490:SF18,THREONYLCARBAMOYL-AMP SYNTHASE,True
Q3U5F4,Threonylcarbamoyl-AMP synthase,protein,10090,Mus musculus,Mus musculus (Mouse),Yrdc,280,PTHR17490:SF10,THREONYLCARBAMOYL-AMP SYNTHASE,True
Q3YWX6,Threonylcarbamoyl-AMP synthase,protein,300269,Shigella sonnei (strain Ss046),Shigella sonnei (strain Ss046),tsaC,190,PTHR17490:SF18,THREONYLCARBAMOYL-AMP SYNTHASE,True
Q48AU1,Threonylcarbamoyl-AMP synthase,protein,167879,Colwellia psychrerythraea (strain 34H / ATCC BAA-681),Colwellia psychrerythraea (strain 34H / ATCC BAA-681),tsaC,183,PTHR17490:SF18,THREONYLCARBAMOYL-AMP SYNTHASE,True
Q48QH8,Threonylcarbamoyl-AMP synthase,protein,264730,Pseudomonas savastanoi pv. phaseolicola (strain 1448A / Race 6),Pseudomonas savastanoi pv. phaseolicola (strain 1448A / Race 6),tsaC,185,PTHR17490:SF18,THREONYLCARBAMOYL-AMP SYNTHASE,True
Q493I0,Threonylcarbamoyl-AMP synthase,protein,291272,Blochmanniella pennsylvanica (strain BPEN),Blochmanniella pennsylvanica (strain BPEN),tsaC,194,PTHR17490:SF18,THREONYLCARBAMOYL-AMP SYNTHASE,True
Q499R4,Threonylcarbamoyl-AMP synthase,protein,10116,Rattus norvegicus,Rattus norvegicus (Rat),Yrdc,280,PTHR17490:SF10,THREONYLCARBAMOYL-AMP SYNTHASE,True
Q4FPS7,Threonylcarbamoyl-AMP synthase,protein,259536,Psychrobacter arcticus (strain DSM 17307 / VKM B-2377 / 273-4),Psychrobacter arcticus (strain DSM 17307 / VKM B-2377 / 273-4),tsaC,214,PTHR17490:SF18,THREONYLCARBAMOYL-AMP SYNTHASE,True
