id,name,entry_type,source_tax_id,source_tax_name,full_tax_name,gene,length,subfamily,subfamily_name,in_alphafold
B1ZGP5,UDP-N-acetylmuramate--L-alanine ligase,protein,441620,Methylorubrum populi (strain ATCC BAA-705 / NCIMB 13946 / BJ001),Methylorubrum populi (strain ATCC BAA-705 / NCIMB 13946 / BJ001),murC,468,PTHR43445:SF3,UDP-N-ACETYLMURAMATE--L-ALANINE LIGASE,True
B2FNN8,UDP-N-acetylmuramate--L-alanine ligase,protein,522373,Stenotrophomonas maltophilia (strain K279a),Stenotrophomonas maltophilia (strain K279a),murC,478,PTHR43445:SF3,UDP-N-ACETYLMURAMATE--L-ALANINE LIGASE,True
B2GDC4,UDP-N-acetylmuramate--L-alanine ligase,protein,334390,Limosilactobacillus fermentum (strain NBRC 3956 / LMG 18251),Limosilactobacillus fermentum (strain NBRC 3956 / LMG 18251),murC,437,PTHR43445:SF3,UDP-N-ACETYLMURAMATE--L-ALANINE LIGASE,True
B2HGR5,UDP-N-acetylmuramate--L-alanine ligase,protein,216594,Mycobacterium marinum (strain ATCC BAA-535 / M),Mycobacterium marinum (strain ATCC BAA-535 / M),murC,488,PTHR43445:SF3,UDP-N-ACETYLMURAMATE--L-ALANINE LIGASE,True
B2I1J4,UDP-N-acetylmuramate--L-alanine ligase,protein,405416,Acinetobacter baumannii (strain ACICU),Acinetobacter baumannii (strain ACICU),murC,482,PTHR43445:SF3,UDP-N-ACETYLMURAMATE--L-ALANINE LIGASE,True
B2I9B2,UDP-N-acetylmuramate--L-alanine ligase,protein,405441,Xylella fastidiosa (strain M23),Xylella fastidiosa (strain M23),murC,477,PTHR43445:SF3,UDP-N-ACETYLMURAMATE--L-ALANINE LIGASE,True
B2IGG1,UDP-N-acetylmuramate--L-alanine ligase,protein,395963,Beijerinckia indica subsp. indica (strain ATCC 9039 / DSM 1715 / NCIMB 8712),Beijerinckia indica subsp. indica (strain ATCC 9039 / DSM 1715 / NCIMB 8712),murC,476,PTHR43445:SF3,UDP-N-ACETYLMURAMATE--L-ALANINE LIGASE,True
B2IQY8,UDP-N-acetylmuramate--L-alanine ligase,protein,516950,Streptococcus pneumoniae (strain CGSP14),Streptococcus pneumoniae (strain CGSP14),murC,444,PTHR43445:SF3,UDP-N-ACETYLMURAMATE--L-ALANINE LIGASE,True
B2J717,UDP-N-acetylmuramate--L-alanine ligase,protein,63737,Nostoc punctiforme (strain ATCC 29133 / PCC 73102),Nostoc punctiforme (strain ATCC 29133 / PCC 73102),murC,481,PTHR43445:SF3,UDP-N-ACETYLMURAMATE--L-ALANINE LIGASE,True
B2JHF9,UDP-N-acetylmuramate--L-alanine ligase,protein,391038,Paraburkholderia phymatum (strain DSM 17167 / CIP 108236 / LMG 21445 / STM815),Paraburkholderia phymatum (strain DSM 17167 / CIP 108236 / LMG 21445 / STM815),murC,464,PTHR43445:SF3,UDP-N-ACETYLMURAMATE--L-ALANINE LIGASE,True
B2RIF2,UDP-N-acetylmuramate--L-alanine ligase,protein,431947,Porphyromonas gingivalis (strain ATCC 33277 / DSM 20709 / CIP 103683 / JCM 12257 / NCTC 11834 / 2561),Porphyromonas gingivalis (strain ATCC 33277 / DSM 20709 / CIP 103683 / JCM 12257 / NCTC 11834 / 2561),murC,456,PTHR43445:SF3,UDP-N-ACETYLMURAMATE--L-ALANINE LIGASE,True
B2S2T8,UDP-N-acetylmuramate--L-alanine ligase,protein,455434,Treponema pallidum subsp. pallidum (strain SS14),Treponema pallidum subsp. pallidum (strain SS14),murC,481,PTHR43445:SF3,UDP-N-ACETYLMURAMATE--L-ALANINE LIGASE,True
B2S6Q3,UDP-N-acetylmuramate--L-alanine ligase,protein,430066,Brucella abortus (strain S19),Brucella abortus (strain S19),murC,471,PTHR43445:SF3,UDP-N-ACETYLMURAMATE--L-ALANINE LIGASE,True
B2SE51,UDP-N-acetylmuramate--L-alanine ligase,protein,441952,Francisella tularensis subsp. mediasiatica (strain FSC147),Francisella tularensis subsp. mediasiatica (strain FSC147),murC,451,PTHR43445:SF3,UDP-N-ACETYLMURAMATE--L-ALANINE LIGASE,True
B2SNZ4,UDP-N-acetylmuramate--L-alanine ligase,protein,360094,Xanthomonas oryzae pv. oryzae (strain PXO99A),Xanthomonas oryzae pv. oryzae (strain PXO99A),murC,477,PTHR43445:SF3,UDP-N-ACETYLMURAMATE--L-ALANINE LIGASE,True
B2SYX4,UDP-N-acetylmuramate--L-alanine ligase,protein,398527,Paraburkholderia phytofirmans (strain DSM 17436 / LMG 22146 / PsJN),Paraburkholderia phytofirmans (strain DSM 17436 / LMG 22146 / PsJN),murC,467,PTHR43445:SF3,UDP-N-ACETYLMURAMATE--L-ALANINE LIGASE,True
B2TI04,UDP-N-acetylmuramate--L-alanine ligase,protein,935198,Clostridium botulinum (strain Eklund 17B / Type B),Clostridium botulinum (strain Eklund 17B / Type B),murC,460,PTHR43445:SF3,UDP-N-ACETYLMURAMATE--L-ALANINE LIGASE,True
B2U296,UDP-N-acetylmuramate--L-alanine ligase,protein,344609,Shigella boydii serotype 18 (strain CDC 3083-94 / BS512),Shigella boydii serotype 18 (strain CDC 3083-94 / BS512),murC,491,PTHR43445:SF3,UDP-N-ACETYLMURAMATE--L-ALANINE LIGASE,True
B2UCX6,UDP-N-acetylmuramate--L-alanine ligase,protein,402626,Ralstonia pickettii (strain 12J),Ralstonia pickettii (strain 12J),murC,483,PTHR43445:SF3,UDP-N-ACETYLMURAMATE--L-ALANINE LIGASE,True
B2UTK2,UDP-N-acetylmuramate--L-alanine ligase,protein,512562,Helicobacter pylori (strain Shi470),Helicobacter pylori (strain Shi470),murC,449,PTHR43445:SF3,UDP-N-ACETYLMURAMATE--L-ALANINE LIGASE,True
B2UXS3,UDP-N-acetylmuramate--L-alanine ligase,protein,508767,Clostridium botulinum (strain Alaska E43 / Type E3),Clostridium botulinum (strain Alaska E43 / Type E3),murC,460,PTHR43445:SF3,UDP-N-ACETYLMURAMATE--L-ALANINE LIGASE,True
B2VA52,UDP-N-acetylmuramate--L-alanine ligase,protein,436114,Sulfurihydrogenibium sp. (strain YO3AOP1),Sulfurihydrogenibium sp. (strain YO3AOP1),murC,454,PTHR43445:SF3,UDP-N-ACETYLMURAMATE--L-ALANINE LIGASE,True
B3DQN2,UDP-N-acetylmuramate--L-alanine ligase,protein,205913,Bifidobacterium longum (strain DJO10A),Bifidobacterium longum (strain DJO10A),murC,512,PTHR43445:SF3,UDP-N-ACETYLMURAMATE--L-ALANINE LIGASE,True
B3E3Y1,UDP-N-acetylmuramate--L-alanine ligase,protein,398767,Trichlorobacter lovleyi (strain ATCC BAA-1151 / DSM 17278 / SZ),Trichlorobacter lovleyi (strain ATCC BAA-1151 / DSM 17278 / SZ),murC,456,PTHR43445:SF3,UDP-N-ACETYLMURAMATE--L-ALANINE LIGASE,True
B3EIK7,UDP-N-acetylmuramate--L-alanine ligase,protein,290315,Chlorobium limicola (strain DSM 245 / NBRC 103803 / 6330),Chlorobium limicola (strain DSM 245 / NBRC 103803 / 6330),murC,466,PTHR43445:SF3,UDP-N-ACETYLMURAMATE--L-ALANINE LIGASE,True
B3EQB7,UDP-N-acetylmuramate--L-alanine ligase,protein,331678,Chlorobium phaeobacteroides (strain BS1),Chlorobium phaeobacteroides (strain BS1),murC,465,PTHR43445:SF3,UDP-N-ACETYLMURAMATE--L-ALANINE LIGASE,True
B3GZK9,UDP-N-acetylmuramate--L-alanine ligase,protein,537457,Actinobacillus pleuropneumoniae serotype 7 (strain AP76),Actinobacillus pleuropneumoniae serotype 7 (strain AP76),murC,475,PTHR43445:SF3,UDP-N-ACETYLMURAMATE--L-ALANINE LIGASE,True
B3QFN0,UDP-N-acetylmuramate--L-alanine ligase,protein,395960,Rhodopseudomonas palustris (strain TIE-1),Rhodopseudomonas palustris (strain TIE-1),murC,467,PTHR43445:SF3,UDP-N-ACETYLMURAMATE--L-ALANINE LIGASE,True
B3QLW3,UDP-N-acetylmuramate--L-alanine ligase,protein,517417,Chlorobaculum parvum (strain DSM 263 / NCIMB 8327),Chlorobaculum parvum (strain DSM 263 / NCIMB 8327),murC,471,PTHR43445:SF3,UDP-N-ACETYLMURAMATE--L-ALANINE LIGASE,True
B3R6V8,UDP-N-acetylmuramate--L-alanine ligase,protein,977880,Cupriavidus taiwanensis (strain DSM 17343 / BCRC 17206 / CCUG 44338 / CIP 107171 / LMG 19424 / R1),Cupriavidus taiwanensis (strain DSM 17343 / BCRC 17206 / CCUG 44338 / CIP 107171 / LMG 19424 / R1),murC,474,PTHR43445:SF3,UDP-N-ACETYLMURAMATE--L-ALANINE LIGASE,True
B3WF58,UDP-N-acetylmuramate--L-alanine ligase,protein,543734,Lacticaseibacillus casei (strain BL23),Lacticaseibacillus casei (strain BL23),murC,436,PTHR43445:SF3,UDP-N-ACETYLMURAMATE--L-ALANINE LIGASE,True
B4E6J1,UDP-N-acetylmuramate--L-alanine ligase,protein,216591,Burkholderia cenocepacia (strain ATCC BAA-245 / DSM 16553 / LMG 16656 / NCTC 13227 / J2315 / CF5610),Burkholderia cenocepacia (strain ATCC BAA-245 / DSM 16553 / LMG 16656 / NCTC 13227 / J2315 / CF5610),murC,465,PTHR43445:SF3,UDP-N-ACETYLMURAMATE--L-ALANINE LIGASE,True
B4F110,UDP-N-acetylmuramate--L-alanine ligase,protein,529507,Proteus mirabilis (strain HI4320),Proteus mirabilis (strain HI4320),murC,487,PTHR43445:SF3,UDP-N-ACETYLMURAMATE--L-ALANINE LIGASE,True
B4RFG2,UDP-N-acetylmuramate--L-alanine ligase,protein,450851,Phenylobacterium zucineum (strain HLK1),Phenylobacterium zucineum (strain HLK1),murC,477,PTHR43445:SF3,UDP-N-ACETYLMURAMATE--L-ALANINE LIGASE,True
B4S6Q8,UDP-N-acetylmuramate--L-alanine ligase,protein,290512,Prosthecochloris aestuarii (strain DSM 271 / SK 413),Prosthecochloris aestuarii (strain DSM 271 / SK 413),murC,464,PTHR43445:SF3,UDP-N-ACETYLMURAMATE--L-ALANINE LIGASE,True
B4SH48,UDP-N-acetylmuramate--L-alanine ligase,protein,324925,Pelodictyon phaeoclathratiforme (strain DSM 5477 / BU-1),Pelodictyon phaeoclathratiforme (strain DSM 5477 / BU-1),murC,479,PTHR43445:SF3,UDP-N-ACETYLMURAMATE--L-ALANINE LIGASE,True
B4SJX6,UDP-N-acetylmuramate--L-alanine ligase,protein,391008,Stenotrophomonas maltophilia (strain R551-3),Stenotrophomonas maltophilia (strain R551-3),murC,478,PTHR43445:SF3,UDP-N-ACETYLMURAMATE--L-ALANINE LIGASE,True
B4SU51,UDP-N-acetylmuramate--L-alanine ligase,protein,423368,Salmonella newport (strain SL254),Salmonella newport (strain SL254),murC,491,PTHR43445:SF3,UDP-N-ACETYLMURAMATE--L-ALANINE LIGASE,True
B4TJ88,UDP-N-acetylmuramate--L-alanine ligase,protein,454169,Salmonella heidelberg (strain SL476),Salmonella heidelberg (strain SL476),murC,491,PTHR43445:SF3,UDP-N-ACETYLMURAMATE--L-ALANINE LIGASE,True
B4TXH9,UDP-N-acetylmuramate--L-alanine ligase,protein,439843,Salmonella schwarzengrund (strain CVM19633),Salmonella schwarzengrund (strain CVM19633),murC,491,PTHR43445:SF3,UDP-N-ACETYLMURAMATE--L-ALANINE LIGASE,True
B4U4S2,UDP-N-acetylmuramate--L-alanine ligase,protein,552526,Streptococcus equi subsp. zooepidemicus (strain MGCS10565),Streptococcus equi subsp. zooepidemicus (strain MGCS10565),murC,443,PTHR43445:SF3,UDP-N-ACETYLMURAMATE--L-ALANINE LIGASE,True
B4U813,UDP-N-acetylmuramate--L-alanine ligase,protein,380749,Hydrogenobaculum sp. (strain Y04AAS1),Hydrogenobaculum sp. (strain Y04AAS1),murC,449,PTHR43445:SF3,UDP-N-ACETYLMURAMATE--L-ALANINE LIGASE,True
B4UES2,UDP-N-acetylmuramate--L-alanine ligase,protein,447217,Anaeromyxobacter sp. (strain K),Anaeromyxobacter sp. (strain K),murC,458,PTHR43445:SF3,UDP-N-ACETYLMURAMATE--L-ALANINE LIGASE,True
B5BLC3,UDP-N-acetylmuramate--L-alanine ligase,protein,554290,Salmonella paratyphi A (strain AKU_12601),Salmonella paratyphi A (strain AKU_12601),murC,491,PTHR43445:SF3,UDP-N-ACETYLMURAMATE--L-ALANINE LIGASE,True
B5E685,UDP-N-acetylmuramate--L-alanine ligase,protein,512566,Streptococcus pneumoniae serotype 19F (strain G54),Streptococcus pneumoniae serotype 19F (strain G54),murC,444,PTHR43445:SF3,UDP-N-ACETYLMURAMATE--L-ALANINE LIGASE,True
B5EBQ2,UDP-N-acetylmuramate--L-alanine ligase,protein,404380,Citrifermentans bemidjiense (strain ATCC BAA-1014 / DSM 16622 / JCM 12645 / Bem),Citrifermentans bemidjiense (strain ATCC BAA-1014 / DSM 16622 / JCM 12645 / Bem),murC,461,PTHR43445:SF3,UDP-N-ACETYLMURAMATE--L-ALANINE LIGASE,True
B5ELC2,UDP-N-acetylmuramate--L-alanine ligase,protein,380394,Acidithiobacillus ferrooxidans (strain ATCC 53993 / BNL-5-31),Acidithiobacillus ferrooxidans (strain ATCC 53993 / BNL-5-31),murC,464,PTHR43445:SF3,UDP-N-ACETYLMURAMATE--L-ALANINE LIGASE,True
B5F7W5,UDP-N-acetylmuramate--L-alanine ligase,protein,454166,Salmonella agona (strain SL483),Salmonella agona (strain SL483),murC,491,PTHR43445:SF3,UDP-N-ACETYLMURAMATE--L-ALANINE LIGASE,True
B5FB34,UDP-N-acetylmuramate--L-alanine ligase,protein,388396,Aliivibrio fischeri (strain MJ11),Aliivibrio fischeri (strain MJ11),murC,487,PTHR43445:SF3,UDP-N-ACETYLMURAMATE--L-ALANINE LIGASE,True
B5FI73,UDP-N-acetylmuramate--L-alanine ligase,protein,439851,Salmonella dublin (strain CT_02021853),Salmonella dublin (strain CT_02021853),murC,491,PTHR43445:SF3,UDP-N-ACETYLMURAMATE--L-ALANINE LIGASE,True
B5R2M5,UDP-N-acetylmuramate--L-alanine ligase,protein,550537,Salmonella enteritidis PT4 (strain P125109),Salmonella enteritidis PT4 (strain P125109),murC,491,PTHR43445:SF3,UDP-N-ACETYLMURAMATE--L-ALANINE LIGASE,True
B5RH65,UDP-N-acetylmuramate--L-alanine ligase,protein,550538,Salmonella gallinarum (strain 287/91 / NCTC 13346),Salmonella gallinarum (strain 287/91 / NCTC 13346),murC,491,PTHR43445:SF3,UDP-N-ACETYLMURAMATE--L-ALANINE LIGASE,True
B5XJW3,UDP-N-acetylmuramate--L-alanine ligase,protein,471876,Streptococcus pyogenes serotype M49 (strain NZ131),Streptococcus pyogenes serotype M49 (strain NZ131),murC,442,PTHR43445:SF3,UDP-N-ACETYLMURAMATE--L-ALANINE LIGASE,True
B5Y1U6,UDP-N-acetylmuramate--L-alanine ligase,protein,507522,Klebsiella variicola (strain 342),Klebsiella variicola (strain 342),murC,491,PTHR43445:SF3,UDP-N-ACETYLMURAMATE--L-ALANINE LIGASE,True
B5YEL2,UDP-N-acetylmuramate--L-alanine ligase,protein,309799,Dictyoglomus thermophilum (strain ATCC 35947 / DSM 3960 / H-6-12),Dictyoglomus thermophilum (strain ATCC 35947 / DSM 3960 / H-6-12),murC,464,PTHR43445:SF3,UDP-N-ACETYLMURAMATE--L-ALANINE LIGASE,True
B5YZC7,UDP-N-acetylmuramate--L-alanine ligase,protein,444450,Escherichia coli O157:H7 (strain EC4115 / EHEC),Escherichia coli O157:H7 (strain EC4115 / EHEC),murC,491,PTHR43445:SF3,UDP-N-ACETYLMURAMATE--L-ALANINE LIGASE,True
B6ELH4,UDP-N-acetylmuramate--L-alanine ligase,protein,316275,Aliivibrio salmonicida (strain LFI1238),Aliivibrio salmonicida (strain LFI1238),murC,487,PTHR43445:SF3,UDP-N-ACETYLMURAMATE--L-ALANINE LIGASE,True
B6HZ68,UDP-N-acetylmuramate--L-alanine ligase,protein,409438,Escherichia coli (strain SE11),Escherichia coli (strain SE11),murC,491,PTHR43445:SF3,UDP-N-ACETYLMURAMATE--L-ALANINE LIGASE,True
B6IRG1,UDP-N-acetylmuramate--L-alanine ligase,protein,414684,Rhodospirillum centenum (strain ATCC 51521 / SW),Rhodospirillum centenum (strain ATCC 51521 / SW),murC,482,PTHR43445:SF3,UDP-N-ACETYLMURAMATE--L-ALANINE LIGASE,True
B6J2Q2,UDP-N-acetylmuramate--L-alanine ligase,protein,434923,Coxiella burnetii (strain CbuG_Q212),Coxiella burnetii (strain CbuG_Q212),murC,465,PTHR43445:SF3,UDP-N-ACETYLMURAMATE--L-ALANINE LIGASE,True
B6J5K2,UDP-N-acetylmuramate--L-alanine ligase,protein,434924,Coxiella burnetii (strain CbuK_Q154),Coxiella burnetii (strain CbuK_Q154),murC,465,PTHR43445:SF3,UDP-N-ACETYLMURAMATE--L-ALANINE LIGASE,True
B6JLL1,UDP-N-acetylmuramate--L-alanine ligase,protein,570508,Helicobacter pylori (strain P12),Helicobacter pylori (strain P12),murC,449,PTHR43445:SF3,UDP-N-ACETYLMURAMATE--L-ALANINE LIGASE,True
B7GK78,UDP-N-acetylmuramate--L-alanine ligase,protein,491915,Anoxybacillus flavithermus (strain DSM 21510 / WK1),Anoxybacillus flavithermus (strain DSM 21510 / WK1),murC,433,PTHR43445:SF3,UDP-N-ACETYLMURAMATE--L-ALANINE LIGASE,True
B7GQ79,UDP-N-acetylmuramate--L-alanine ligase,protein,391904,Bifidobacterium longum subsp. infantis (strain ATCC 15697 / DSM 20088 / JCM 1222 / NCTC 11817 / S12),Bifidobacterium longum subsp. infantis (strain ATCC 15697 / DSM 20088 / JCM 1222 / NCTC 11817 / S12),murC,512,PTHR43445:SF3,UDP-N-ACETYLMURAMATE--L-ALANINE LIGASE,True
B7GV74,UDP-N-acetylmuramate--L-alanine ligase,protein,557600,Acinetobacter baumannii (strain AB307-0294),Acinetobacter baumannii (strain AB307-0294),murC,482,PTHR43445:SF3,UDP-N-ACETYLMURAMATE--L-ALANINE LIGASE,True
B7H746,UDP-N-acetylmuramate--L-alanine ligase,protein,405532,Bacillus cereus (strain B4264),Bacillus cereus (strain B4264),murC,436,PTHR43445:SF3,UDP-N-ACETYLMURAMATE--L-ALANINE LIGASE,True
B7HSM3,UDP-N-acetylmuramate--L-alanine ligase,protein,405534,Bacillus cereus (strain AH187),Bacillus cereus (strain AH187),murC,436,PTHR43445:SF3,UDP-N-ACETYLMURAMATE--L-ALANINE LIGASE,True
B7ICE4,UDP-N-acetylmuramate--L-alanine ligase,protein,480119,Acinetobacter baumannii (strain AB0057),Acinetobacter baumannii (strain AB0057),murC,482,PTHR43445:SF3,UDP-N-ACETYLMURAMATE--L-ALANINE LIGASE,True
B7IKV4,UDP-N-acetylmuramate--L-alanine ligase,protein,405531,Bacillus cereus (strain G9842),Bacillus cereus (strain G9842),murC,436,PTHR43445:SF3,UDP-N-ACETYLMURAMATE--L-ALANINE LIGASE,True
B7J3V1,UDP-N-acetylmuramate--L-alanine ligase,protein,243159,Acidithiobacillus ferrooxidans (strain ATCC 23270 / DSM 14882 / CIP 104768 / NCIMB 8455),Acidithiobacillus ferrooxidans (strain ATCC 23270 / DSM 14882 / CIP 104768 / NCIMB 8455),murC,464,PTHR43445:SF3,UDP-N-ACETYLMURAMATE--L-ALANINE LIGASE,True
B7JS63,UDP-N-acetylmuramate--L-alanine ligase,protein,405535,Bacillus cereus (strain AH820),Bacillus cereus (strain AH820),murC,436,PTHR43445:SF3,UDP-N-ACETYLMURAMATE--L-ALANINE LIGASE,True
B7KHE9,UDP-N-acetylmuramate--L-alanine ligase,protein,65393,Gloeothece citriformis (strain PCC 7424),Gloeothece citriformis (strain PCC 7424),murC,495,PTHR43445:SF3,UDP-N-ACETYLMURAMATE--L-ALANINE LIGASE,True
B7KSC2,UDP-N-acetylmuramate--L-alanine ligase,protein,440085,Methylorubrum extorquens (strain CM4 / NCIMB 13688),Methylorubrum extorquens (strain CM4 / NCIMB 13688),murC,468,PTHR43445:SF3,UDP-N-ACETYLMURAMATE--L-ALANINE LIGASE,True
B7LFW1,UDP-N-acetylmuramate--L-alanine ligase,protein,585055,Escherichia coli (strain 55989 / EAEC),Escherichia coli (strain 55989 / EAEC),murC,491,PTHR43445:SF3,UDP-N-ACETYLMURAMATE--L-ALANINE LIGASE,True
B7LWF7,UDP-N-acetylmuramate--L-alanine ligase,protein,585054,Escherichia fergusonii (strain ATCC 35469 / DSM 13698 / CCUG 18766 / IAM 14443 / JCM 21226 / LMG 7866 / NBRC 102419 / NCTC 12128 / CDC 0568-73),Escherichia fergusonii (strain ATCC 35469 / DSM 13698 / CCUG 18766 / IAM 14443 / JCM 21226 / LMG 7866 / NBRC 102419 / NCTC 12128 / CDC 0568-73),murC,491,PTHR43445:SF3,UDP-N-ACETYLMURAMATE--L-ALANINE LIGASE,True
B7M134,UDP-N-acetylmuramate--L-alanine ligase,protein,585034,Escherichia coli O8 (strain IAI1),Escherichia coli O8 (strain IAI1),murC,491,PTHR43445:SF3,UDP-N-ACETYLMURAMATE--L-ALANINE LIGASE,True
B7MAL4,UDP-N-acetylmuramate--L-alanine ligase,protein,585035,Escherichia coli O45:K1 (strain S88 / ExPEC),Escherichia coli O45:K1 (strain S88 / ExPEC),murC,491,PTHR43445:SF3,UDP-N-ACETYLMURAMATE--L-ALANINE LIGASE,True
B7MNV0,UDP-N-acetylmuramate--L-alanine ligase,protein,585397,Escherichia coli O81 (strain ED1a),Escherichia coli O81 (strain ED1a),murC,491,PTHR43445:SF3,UDP-N-ACETYLMURAMATE--L-ALANINE LIGASE,True
B7N7W4,UDP-N-acetylmuramate--L-alanine ligase,protein,585056,Escherichia coli O17:K52:H18 (strain UMN026 / ExPEC),Escherichia coli O17:K52:H18 (strain UMN026 / ExPEC),murC,491,PTHR43445:SF3,UDP-N-ACETYLMURAMATE--L-ALANINE LIGASE,True
B7NHJ7,UDP-N-acetylmuramate--L-alanine ligase,protein,585057,Escherichia coli O7:K1 (strain IAI39 / ExPEC),Escherichia coli O7:K1 (strain IAI39 / ExPEC),murC,491,PTHR43445:SF3,UDP-N-ACETYLMURAMATE--L-ALANINE LIGASE,True
B7UIE1,UDP-N-acetylmuramate--L-alanine ligase,protein,574521,Escherichia coli O127:H6 (strain E2348/69 / EPEC),Escherichia coli O127:H6 (strain E2348/69 / EPEC),murC,491,PTHR43445:SF3,UDP-N-ACETYLMURAMATE--L-ALANINE LIGASE,True
B7UZI9,UDP-N-acetylmuramate--L-alanine ligase,protein,557722,Pseudomonas aeruginosa (strain LESB58),Pseudomonas aeruginosa (strain LESB58),murC,480,PTHR43445:SF3,UDP-N-ACETYLMURAMATE--L-ALANINE LIGASE,True
B7VJ04,UDP-N-acetylmuramate--L-alanine ligase,protein,575788,Vibrio atlanticus (strain LGP32),Vibrio atlanticus (strain LGP32),murC,486,PTHR43445:SF3,UDP-N-ACETYLMURAMATE--L-ALANINE LIGASE,True
B8CNL2,UDP-N-acetylmuramate--L-alanine ligase,protein,225849,Shewanella piezotolerans (strain WP3 / JCM 13877),Shewanella piezotolerans (strain WP3 / JCM 13877),murC,489,PTHR43445:SF3,UDP-N-ACETYLMURAMATE--L-ALANINE LIGASE,True
B8D7B8,UDP-N-acetylmuramate--L-alanine ligase,protein,561501,Buchnera aphidicola subsp. Acyrthosiphon pisum (strain Tuc7),Buchnera aphidicola subsp. Acyrthosiphon pisum (strain Tuc7),murC,484,PTHR43445:SF3,UDP-N-ACETYLMURAMATE--L-ALANINE LIGASE,True
B8D913,UDP-N-acetylmuramate--L-alanine ligase,protein,563178,Buchnera aphidicola subsp. Acyrthosiphon pisum (strain 5A),Buchnera aphidicola subsp. Acyrthosiphon pisum (strain 5A),murC,484,PTHR43445:SF3,UDP-N-ACETYLMURAMATE--L-ALANINE LIGASE,True
B8DHD7,UDP-N-acetylmuramate--L-alanine ligase,protein,552536,Listeria monocytogenes serotype 4a (strain HCC23),Listeria monocytogenes serotype 4a (strain HCC23),murC,447,PTHR43445:SF3,UDP-N-ACETYLMURAMATE--L-ALANINE LIGASE,True
B8E324,UDP-N-acetylmuramate--L-alanine ligase,protein,515635,Dictyoglomus turgidum (strain DSM 6724 / Z-1310),Dictyoglomus turgidum (strain DSM 6724 / Z-1310),murC,464,PTHR43445:SF3,UDP-N-ACETYLMURAMATE--L-ALANINE LIGASE,True
B8E699,UDP-N-acetylmuramate--L-alanine ligase,protein,407976,Shewanella baltica (strain OS223),Shewanella baltica (strain OS223),murC,488,PTHR43445:SF3,UDP-N-ACETYLMURAMATE--L-ALANINE LIGASE,True
B8ETM5,UDP-N-acetylmuramate--L-alanine ligase,protein,395965,Methylocella silvestris (strain DSM 15510 / CIP 108128 / LMG 27833 / NCIMB 13906 / BL2),Methylocella silvestris (strain DSM 15510 / CIP 108128 / LMG 27833 / NCIMB 13906 / BL2),murC,468,PTHR43445:SF3,UDP-N-ACETYLMURAMATE--L-ALANINE LIGASE,True
B8F3B7,UDP-N-acetylmuramate--L-alanine ligase,protein,557723,Glaesserella parasuis serovar 5 (strain SH0165),Glaesserella parasuis serovar 5 (strain SH0165),murC,475,PTHR43445:SF3,UDP-N-ACETYLMURAMATE--L-ALANINE LIGASE,True
B8FBR7,UDP-N-acetylmuramate--L-alanine ligase,protein,218208,Desulfatibacillum aliphaticivorans,Desulfatibacillum aliphaticivorans,murC,456,PTHR43445:SF3,UDP-N-ACETYLMURAMATE--L-ALANINE LIGASE,True
B8G5Y3,UDP-N-acetylmuramate--L-alanine ligase,protein,326427,Chloroflexus aggregans (strain MD-66 / DSM 9485),Chloroflexus aggregans (strain MD-66 / DSM 9485),murC,474,PTHR43445:SF3,UDP-N-ACETYLMURAMATE--L-ALANINE LIGASE,True
B8H086,UDP-N-acetylmuramate--L-alanine ligase,protein,565050,Caulobacter vibrioides (strain NA1000 / CB15N),Caulobacter vibrioides (strain NA1000 / CB15N),murC,473,PTHR43445:SF3,UDP-N-ACETYLMURAMATE--L-ALANINE LIGASE,True
B8HWY0,UDP-N-acetylmuramate--L-alanine ligase,protein,395961,Cyanothece sp. (strain PCC 7425 / ATCC 29141),Cyanothece sp. (strain PCC 7425 / ATCC 29141),murC,482,PTHR43445:SF3,UDP-N-ACETYLMURAMATE--L-ALANINE LIGASE,True
B8IN63,UDP-N-acetylmuramate--L-alanine ligase,protein,460265,Methylobacterium nodulans (strain LMG 21967 / CNCM I-2342 / ORS 2060),Methylobacterium nodulans (strain LMG 21967 / CNCM I-2342 / ORS 2060),murC,471,PTHR43445:SF3,UDP-N-ACETYLMURAMATE--L-ALANINE LIGASE,True
B8IZU2,UDP-N-acetylmuramate--L-alanine ligase,protein,525146,Desulfovibrio desulfuricans (strain ATCC 27774 / DSM 6949 / MB),Desulfovibrio desulfuricans (strain ATCC 27774 / DSM 6949 / MB),murC,457,PTHR43445:SF3,UDP-N-ACETYLMURAMATE--L-ALANINE LIGASE,True
B8J8E9,UDP-N-acetylmuramate--L-alanine ligase,protein,455488,Anaeromyxobacter dehalogenans (strain ATCC BAA-258 / DSM 21875 / 2CP-1),Anaeromyxobacter dehalogenans (strain ATCC BAA-258 / DSM 21875 / 2CP-1),murC,458,PTHR43445:SF3,UDP-N-ACETYLMURAMATE--L-ALANINE LIGASE,True
B8ZLC2,UDP-N-acetylmuramate--L-alanine ligase,protein,561276,Streptococcus pneumoniae (strain ATCC 700669 / Spain 23F-1),Streptococcus pneumoniae (strain ATCC 700669 / Spain 23F-1),murC,444,PTHR43445:SF3,UDP-N-ACETYLMURAMATE--L-ALANINE LIGASE,True
B8ZQQ1,UDP-N-acetylmuramate--L-alanine ligase,protein,561304,Mycobacterium leprae (strain Br4923),Mycobacterium leprae (strain Br4923),murC,495,PTHR43445:SF3,UDP-N-ACETYLMURAMATE--L-ALANINE LIGASE,True
B9DN57,UDP-N-acetylmuramate--L-alanine ligase,protein,396513,Staphylococcus carnosus (strain TM300),Staphylococcus carnosus (strain TM300),murC,437,PTHR43445:SF3,UDP-N-ACETYLMURAMATE--L-ALANINE LIGASE,True
B9DY44,UDP-N-acetylmuramate--L-alanine ligase,protein,583346,Clostridium kluyveri (strain NBRC 12016),Clostridium kluyveri (strain NBRC 12016),murC,457,PTHR43445:SF3,UDP-N-ACETYLMURAMATE--L-ALANINE LIGASE,True
B9E7F6,UDP-N-acetylmuramate--L-alanine ligase,protein,458233,Macrococcoides caseolyticum (strain JCSC5402),Macrococcoides caseolyticum (strain JCSC5402),murC,431,PTHR43445:SF3,UDP-N-ACETYLMURAMATE--L-ALANINE LIGASE,True
B9J189,UDP-N-acetylmuramate--L-alanine ligase,protein,361100,Bacillus cereus (strain Q1),Bacillus cereus (strain Q1),murC,436,PTHR43445:SF3,UDP-N-ACETYLMURAMATE--L-ALANINE LIGASE,True
B9JY53,UDP-N-acetylmuramate--L-alanine ligase,protein,311402,Allorhizobium ampelinum (strain ATCC BAA-846 / DSM 112012 / S4),Allorhizobium ampelinum (strain ATCC BAA-846 / DSM 112012 / S4),murC,471,PTHR43445:SF3,UDP-N-ACETYLMURAMATE--L-ALANINE LIGASE,True
B9K6P8,UDP-N-acetylmuramate--L-alanine ligase,protein,309803,Thermotoga neapolitana (strain ATCC 49049 / DSM 4359 / NBRC 107923 / NS-E),Thermotoga neapolitana (strain ATCC 49049 / DSM 4359 / NBRC 107923 / NS-E),murC,457,PTHR43445:SF3,UDP-N-ACETYLMURAMATE--L-ALANINE LIGASE,True
B9KNK0,UDP-N-acetylmuramate--L-alanine ligase,protein,557760,Cereibacter sphaeroides (strain KD131 / KCTC 12085),Cereibacter sphaeroides (strain KD131 / KCTC 12085),murC,470,PTHR43445:SF3,UDP-N-ACETYLMURAMATE--L-ALANINE LIGASE,True
B9M173,UDP-N-acetylmuramate--L-alanine ligase,protein,316067,Geotalea daltonii (strain DSM 22248 / JCM 15807 / FRC-32),Geotalea daltonii (strain DSM 22248 / JCM 15807 / FRC-32),murC,458,PTHR43445:SF3,UDP-N-ACETYLMURAMATE--L-ALANINE LIGASE,True
B9MFR1,UDP-N-acetylmuramate--L-alanine ligase,protein,535289,Acidovorax ebreus (strain TPSY),Acidovorax ebreus (strain TPSY),murC,477,PTHR43445:SF3,UDP-N-ACETYLMURAMATE--L-ALANINE LIGASE,True
B9MND8,UDP-N-acetylmuramate--L-alanine ligase,protein,521460,Caldicellulosiruptor bescii (strain ATCC BAA-1888 / DSM 6725 / KCTC 15123 / Z-1320),Caldicellulosiruptor bescii (strain ATCC BAA-1888 / DSM 6725 / KCTC 15123 / Z-1320),murC,455,PTHR43445:SF3,UDP-N-ACETYLMURAMATE--L-ALANINE LIGASE,True
C0M809,UDP-N-acetylmuramate--L-alanine ligase,protein,553482,Streptococcus equi subsp. equi (strain 4047),Streptococcus equi subsp. equi (strain 4047),murC,443,PTHR43445:SF3,UDP-N-ACETYLMURAMATE--L-ALANINE LIGASE,True
C0MGF5,UDP-N-acetylmuramate--L-alanine ligase,protein,553483,Streptococcus equi subsp. zooepidemicus (strain H70),Streptococcus equi subsp. zooepidemicus (strain H70),murC,443,PTHR43445:SF3,UDP-N-ACETYLMURAMATE--L-ALANINE LIGASE,True
