id,name,entry_type,source_tax_id,source_tax_name,full_tax_name,gene,length,subfamily,subfamily_name,in_alphafold
C0Q5I7,UDP-N-acetylmuramate--L-alanine ligase,protein,476213,Salmonella paratyphi C (strain RKS4594),Salmonella paratyphi C (strain RKS4594),murC,491,PTHR43445:SF3,UDP-N-ACETYLMURAMATE--L-ALANINE LIGASE,True
C0Q8P4,UDP-N-acetylmuramate--L-alanine ligase,protein,177437,Desulforapulum autotrophicum (strain ATCC 43914 / DSM 3382 / VKM B-1955 / HRM2),Desulforapulum autotrophicum (strain ATCC 43914 / DSM 3382 / VKM B-1955 / HRM2),murC,456,PTHR43445:SF3,UDP-N-ACETYLMURAMATE--L-ALANINE LIGASE,True
C0QPY2,UDP-N-acetylmuramate--L-alanine ligase,protein,123214,Persephonella marina (strain DSM 14350 / EX-H1),Persephonella marina (strain DSM 14350 / EX-H1),murC,459,PTHR43445:SF3,UDP-N-ACETYLMURAMATE--L-ALANINE LIGASE,True
C0QXF2,UDP-N-acetylmuramate--L-alanine ligase,protein,565034,Brachyspira hyodysenteriae (strain ATCC 49526 / WA1),Brachyspira hyodysenteriae (strain ATCC 49526 / WA1),murC,462,PTHR43445:SF3,UDP-N-ACETYLMURAMATE--L-ALANINE LIGASE,True
C0R5N3,UDP-N-acetylmuramate--L-alanine ligase,protein,66084,Wolbachia sp. subsp. Drosophila simulans (strain wRi),Wolbachia sp. subsp. Drosophila simulans (strain wRi),murC,474,PTHR43445:SF3,UDP-N-ACETYLMURAMATE--L-ALANINE LIGASE,True
C0RE69,UDP-N-acetylmuramate--L-alanine ligase,protein,546272,Brucella melitensis biotype 2 (strain ATCC 23457),Brucella melitensis biotype 2 (strain ATCC 23457),murC,471,PTHR43445:SF3,UDP-N-ACETYLMURAMATE--L-ALANINE LIGASE,True
C0ZAJ4,UDP-N-acetylmuramate--L-alanine ligase,protein,358681,Brevibacillus brevis (strain 47 / JCM 6285 / NBRC 100599),Brevibacillus brevis (strain 47 / JCM 6285 / NBRC 100599),murC,460,PTHR43445:SF3,UDP-N-ACETYLMURAMATE--L-ALANINE LIGASE,True
C1A0X4,UDP-N-acetylmuramate--L-alanine ligase,protein,234621,Rhodococcus erythropolis (strain PR4 / NBRC 100887),Rhodococcus erythropolis (strain PR4 / NBRC 100887),murC,502,PTHR43445:SF3,UDP-N-ACETYLMURAMATE--L-ALANINE LIGASE,True
C1AQ68,UDP-N-acetylmuramate--L-alanine ligase,protein,561275,Mycobacterium bovis (strain BCG / Tokyo 172 / ATCC 35737 / TMC 1019),Mycobacterium bovis (strain BCG / Tokyo 172 / ATCC 35737 / TMC 1019),murC,494,PTHR43445:SF3,UDP-N-ACETYLMURAMATE--L-ALANINE LIGASE,True
C1AU54,UDP-N-acetylmuramate--L-alanine ligase,protein,632772,Rhodococcus opacus (strain B4),Rhodococcus opacus (strain B4),murC,503,PTHR43445:SF3,UDP-N-ACETYLMURAMATE--L-ALANINE LIGASE,True
C1C8B2,UDP-N-acetylmuramate--L-alanine ligase,protein,488221,Streptococcus pneumoniae (strain 70585),Streptococcus pneumoniae (strain 70585),murC,444,PTHR43445:SF3,UDP-N-ACETYLMURAMATE--L-ALANINE LIGASE,True
C1CFA5,UDP-N-acetylmuramate--L-alanine ligase,protein,488222,Streptococcus pneumoniae (strain JJA),Streptococcus pneumoniae (strain JJA),murC,444,PTHR43445:SF3,UDP-N-ACETYLMURAMATE--L-ALANINE LIGASE,True
C1CLL9,UDP-N-acetylmuramate--L-alanine ligase,protein,488223,Streptococcus pneumoniae (strain P1031),Streptococcus pneumoniae (strain P1031),murC,444,PTHR43445:SF3,UDP-N-ACETYLMURAMATE--L-ALANINE LIGASE,True
C1CSE1,UDP-N-acetylmuramate--L-alanine ligase,protein,487213,Streptococcus pneumoniae (strain Taiwan19F-14),Streptococcus pneumoniae (strain Taiwan19F-14),murC,444,PTHR43445:SF3,UDP-N-ACETYLMURAMATE--L-ALANINE LIGASE,True
C1D5L5,UDP-N-acetylmuramate--L-alanine ligase,protein,557598,Laribacter hongkongensis (strain HLHK9),Laribacter hongkongensis (strain HLHK9),murC,469,PTHR43445:SF3,UDP-N-ACETYLMURAMATE--L-ALANINE LIGASE,True
C1DQA0,UDP-N-acetylmuramate--L-alanine ligase,protein,322710,Azotobacter vinelandii (strain DJ / ATCC BAA-1303),Azotobacter vinelandii (strain DJ / ATCC BAA-1303),murC,488,PTHR43445:SF3,UDP-N-ACETYLMURAMATE--L-ALANINE LIGASE,True
C1EV43,UDP-N-acetylmuramate--L-alanine ligase,protein,572264,Bacillus cereus (strain 03BB102),Bacillus cereus (strain 03BB102),murC,436,PTHR43445:SF3,UDP-N-ACETYLMURAMATE--L-ALANINE LIGASE,True
C1F455,UDP-N-acetylmuramate--L-alanine ligase,protein,240015,Acidobacterium capsulatum (strain ATCC 51196 / DSM 11244 / BCRC 80197 / JCM 7670 / NBRC 15755 / NCIMB 13165 / 161),Acidobacterium capsulatum (strain ATCC 51196 / DSM 11244 / BCRC 80197 / JCM 7670 / NBRC 15755 / NCIMB 13165 / 161),murC,458,PTHR43445:SF3,UDP-N-ACETYLMURAMATE--L-ALANINE LIGASE,True
C1FNF4,UDP-N-acetylmuramate--L-alanine ligase,protein,536232,Clostridium botulinum (strain Kyoto / Type A2),Clostridium botulinum (strain Kyoto / Type A2),murC,458,PTHR43445:SF3,UDP-N-ACETYLMURAMATE--L-ALANINE LIGASE,True
C1KVQ2,UDP-N-acetylmuramate--L-alanine ligase,protein,568819,Listeria monocytogenes serotype 4b (strain CLIP80459),Listeria monocytogenes serotype 4b (strain CLIP80459),murC,447,PTHR43445:SF3,UDP-N-ACETYLMURAMATE--L-ALANINE LIGASE,True
C3KCT1,UDP-N-acetylmuramate--L-alanine ligase,protein,216595,Pseudomonas fluorescens (strain SBW25),Pseudomonas fluorescens (strain SBW25),murC,481,PTHR43445:SF3,UDP-N-ACETYLMURAMATE--L-ALANINE LIGASE,True
C3KWA4,UDP-N-acetylmuramate--L-alanine ligase,protein,515621,Clostridium botulinum (strain 657 / Type Ba4),Clostridium botulinum (strain 657 / Type Ba4),murC,458,PTHR43445:SF3,UDP-N-ACETYLMURAMATE--L-ALANINE LIGASE,True
C3L9Z3,UDP-N-acetylmuramate--L-alanine ligase,protein,568206,Bacillus anthracis (strain CDC 684 / NRRL 3495),Bacillus anthracis (strain CDC 684 / NRRL 3495),murC,436,PTHR43445:SF3,UDP-N-ACETYLMURAMATE--L-ALANINE LIGASE,True
C3MEM8,UDP-N-acetylmuramate--L-alanine ligase,protein,394,Sinorhizobium fredii (strain NBRC 101917 / NGR234),Sinorhizobium fredii (strain NBRC 101917 / NGR234),murC,469,PTHR43445:SF3,UDP-N-ACETYLMURAMATE--L-ALANINE LIGASE,True
C3PBF0,UDP-N-acetylmuramate--L-alanine ligase,protein,592021,Bacillus anthracis (strain A0248),Bacillus anthracis (strain A0248),murC,436,PTHR43445:SF3,UDP-N-ACETYLMURAMATE--L-ALANINE LIGASE,True
C3PHF5,UDP-N-acetylmuramate--L-alanine ligase,protein,548476,Corynebacterium aurimucosum (strain ATCC 700975 / DSM 44827 / CIP 107346 / CN-1),Corynebacterium aurimucosum (strain ATCC 700975 / DSM 44827 / CIP 107346 / CN-1),murC,496,PTHR43445:SF3,UDP-N-ACETYLMURAMATE--L-ALANINE LIGASE,True
C3PMU4,UDP-N-acetylmuramate--L-alanine ligase,protein,347255,Rickettsia africae (strain ESF-5),Rickettsia africae (strain ESF-5),murC,485,PTHR43445:SF3,UDP-N-ACETYLMURAMATE--L-ALANINE LIGASE,True
C4K124,UDP-N-acetylmuramate--L-alanine ligase,protein,562019,Rickettsia peacockii (strain Rustic),Rickettsia peacockii (strain Rustic),murC,485,PTHR43445:SF3,UDP-N-ACETYLMURAMATE--L-ALANINE LIGASE,True
C4K735,UDP-N-acetylmuramate--L-alanine ligase,protein,572265,Hamiltonella defensa subsp. Acyrthosiphon pisum (strain 5AT),Hamiltonella defensa subsp. Acyrthosiphon pisum (strain 5AT),murC,493,PTHR43445:SF3,UDP-N-ACETYLMURAMATE--L-ALANINE LIGASE,True
C4L4P1,UDP-N-acetylmuramate--L-alanine ligase,protein,360911,Exiguobacterium sp. (strain ATCC BAA-1283 / AT1b),Exiguobacterium sp. (strain ATCC BAA-1283 / AT1b),murC,435,PTHR43445:SF3,UDP-N-ACETYLMURAMATE--L-ALANINE LIGASE,True
C4LA26,UDP-N-acetylmuramate--L-alanine ligase,protein,595494,Tolumonas auensis (strain DSM 9187 / NBRC 110442 / TA 4),Tolumonas auensis (strain DSM 9187 / NBRC 110442 / TA 4),murC,484,PTHR43445:SF3,UDP-N-ACETYLMURAMATE--L-ALANINE LIGASE,True
C4XK68,UDP-N-acetylmuramate--L-alanine ligase,protein,573370,Solidesulfovibrio magneticus (strain ATCC 700980 / DSM 13731 / RS-1),Solidesulfovibrio magneticus (strain ATCC 700980 / DSM 13731 / RS-1),murC,457,PTHR43445:SF3,UDP-N-ACETYLMURAMATE--L-ALANINE LIGASE,True
C4Z4L9,UDP-N-acetylmuramate--L-alanine ligase,protein,515620,Lachnospira eligens (strain ATCC 27750 / DSM 3376 / VPI C15-48 / C15-B4),Lachnospira eligens (strain ATCC 27750 / DSM 3376 / VPI C15-48 / C15-B4),murC,459,PTHR43445:SF3,UDP-N-ACETYLMURAMATE--L-ALANINE LIGASE,True
C4ZBV1,UDP-N-acetylmuramate--L-alanine ligase,protein,515619,Agathobacter rectalis (strain ATCC 33656 / DSM 3377 / JCM 17463 / KCTC 5835 / VPI 0990),Agathobacter rectalis (strain ATCC 33656 / DSM 3377 / JCM 17463 / KCTC 5835 / VPI 0990),murC,459,PTHR43445:SF3,UDP-N-ACETYLMURAMATE--L-ALANINE LIGASE,True
C4ZRI6,UDP-N-acetylmuramate--L-alanine ligase,protein,595496,Escherichia coli (strain K12 / MC4100 / BW2952),Escherichia coli (strain K12 / MC4100 / BW2952),murC,491,PTHR43445:SF3,UDP-N-ACETYLMURAMATE--L-ALANINE LIGASE,True
C5BP33,UDP-N-acetylmuramate--L-alanine ligase,protein,377629,Teredinibacter turnerae (strain ATCC 39867 / T7901),Teredinibacter turnerae (strain ATCC 39867 / T7901),murC,473,PTHR43445:SF3,UDP-N-ACETYLMURAMATE--L-ALANINE LIGASE,True
C5CNF5,UDP-N-acetylmuramate--L-alanine ligase,protein,543728,Variovorax paradoxus (strain S110),Variovorax paradoxus (strain S110),murC,485,PTHR43445:SF3,UDP-N-ACETYLMURAMATE--L-ALANINE LIGASE,True
C5D6B2,UDP-N-acetylmuramate--L-alanine ligase,protein,471223,Geobacillus sp. (strain WCH70),Geobacillus sp. (strain WCH70),murC,433,PTHR43445:SF3,UDP-N-ACETYLMURAMATE--L-ALANINE LIGASE,True
C6BYG5,UDP-N-acetylmuramate--L-alanine ligase,protein,526222,Maridesulfovibrio salexigens (strain ATCC 14822 / DSM 2638 / NCIMB 8403 / VKM B-1763),Maridesulfovibrio salexigens (strain ATCC 14822 / DSM 2638 / NCIMB 8403 / VKM B-1763),murC,470,PTHR43445:SF3,UDP-N-ACETYLMURAMATE--L-ALANINE LIGASE,True
C6DEU2,UDP-N-acetylmuramate--L-alanine ligase,protein,561230,Pectobacterium carotovorum subsp. carotovorum (strain PC1),Pectobacterium carotovorum subsp. carotovorum (strain PC1),murC,486,PTHR43445:SF3,UDP-N-ACETYLMURAMATE--L-ALANINE LIGASE,True
C6DZK7,UDP-N-acetylmuramate--L-alanine ligase,protein,443144,Geobacter sp. (strain M21),Geobacter sp. (strain M21),murC,461,PTHR43445:SF3,UDP-N-ACETYLMURAMATE--L-ALANINE LIGASE,True
O25340,UDP-N-acetylmuramate--L-alanine ligase,protein,85962,Helicobacter pylori (strain ATCC 700392 / 26695),Helicobacter pylori (strain ATCC 700392 / 26695),murC,449,PTHR43445:SF3,UDP-N-ACETYLMURAMATE--L-ALANINE LIGASE,True
O31211,UDP-N-acetylmuramate--L-alanine ligase,protein,1280,Staphylococcus aureus,Staphylococcus aureus,murC,437,PTHR43445:SF3,UDP-N-ACETYLMURAMATE--L-ALANINE LIGASE,True
O51757,UDP-N-acetylmuramate--L-alanine ligase,protein,224326,Borreliella burgdorferi (strain ATCC 35210 / DSM 4680 / CIP 102532 / B31),Borreliella burgdorferi (strain ATCC 35210 / DSM 4680 / CIP 102532 / B31),murC,468,PTHR43445:SF3,UDP-N-ACETYLMURAMATE--L-ALANINE LIGASE,True
O51926,UDP-N-acetylmuramate--L-alanine ligase,protein,198804,Buchnera aphidicola subsp. Schizaphis graminum (strain Sg),Buchnera aphidicola subsp. Schizaphis graminum (strain Sg),murC,483,PTHR43445:SF3,UDP-N-ACETYLMURAMATE--L-ALANINE LIGASE,True
O67373,UDP-N-acetylmuramate--L-alanine ligase,protein,224324,Aquifex aeolicus (strain VF5),Aquifex aeolicus (strain VF5),murC,454,PTHR43445:SF3,UDP-N-ACETYLMURAMATE--L-ALANINE LIGASE,True
O83361,UDP-N-acetylmuramate--L-alanine ligase,protein,243276,Treponema pallidum (strain DSM 117211 / Nichols),Treponema pallidum (strain DSM 117211 / Nichols),murC,481,PTHR43445:SF3,UDP-N-ACETYLMURAMATE--L-ALANINE LIGASE,True
O84767,Bifunctional enzyme MurC/Ddl,protein,272561,Chlamydia trachomatis serovar D (strain ATCC VR-885 / DSM 19411 / UW-3/Cx),Chlamydia trachomatis serovar D (strain ATCC VR-885 / DSM 19411 / UW-3/Cx),murC/ddl,803,PTHR43445:SF3,UDP-N-ACETYLMURAMATE--L-ALANINE LIGASE,True
P0DC50,UDP-N-acetylmuramate--L-alanine ligase,protein,198466,Streptococcus pyogenes serotype M3 (strain ATCC BAA-595 / MGAS315),Streptococcus pyogenes serotype M3 (strain ATCC BAA-595 / MGAS315),murC,442,PTHR43445:SF3,UDP-N-ACETYLMURAMATE--L-ALANINE LIGASE,True
P0DC51,UDP-N-acetylmuramate--L-alanine ligase,protein,193567,Streptococcus pyogenes serotype M3 (strain SSI-1),Streptococcus pyogenes serotype M3 (strain SSI-1),murC,442,PTHR43445:SF3,UDP-N-ACETYLMURAMATE--L-ALANINE LIGASE,True
P17952,UDP-N-acetylmuramate--L-alanine ligase,protein,83333,Escherichia coli (strain K12),Escherichia coli (strain K12),murC,491,PTHR43445:SF3,UDP-N-ACETYLMURAMATE--L-ALANINE LIGASE,True
P19580,Capsule biosynthesis protein CapB,protein,1392,Bacillus anthracis,Bacillus anthracis (anthrax bacterium),capB,464,PTHR43445:SF1,PGA SYNTHASE CAPB,True
P37773,"UDP-N-acetylmuramate--L-alanyl-gamma-D-glutamyl-meso-2,6-diaminoheptandioate ligase",protein,83333,Escherichia coli (strain K12),Escherichia coli (strain K12),mpl,457,PTHR43445:SF5,"UDP-N-ACETYLMURAMATE--L-ALANYL-GAMMA-D-GLUTAMYL-MESO-2,6-DIAMINOHEPTANDIOATE LIGASE",True
P40778,UDP-N-acetylmuramate--L-alanine ligase,protein,224308,Bacillus subtilis (strain 168),Bacillus subtilis (strain 168),murC,432,PTHR43445:SF3,UDP-N-ACETYLMURAMATE--L-ALANINE LIGASE,True
P43948,"UDP-N-acetylmuramate--L-alanyl-gamma-D-glutamyl-meso-2,6-diaminoheptandioate ligase",protein,71421,Haemophilus influenzae (strain ATCC 51907 / DSM 11121 / KW20 / Rd),Haemophilus influenzae (strain ATCC 51907 / DSM 11121 / KW20 / Rd),mpl,453,PTHR43445:SF5,"UDP-N-ACETYLMURAMATE--L-ALANYL-GAMMA-D-GLUTAMYL-MESO-2,6-DIAMINOHEPTANDIOATE LIGASE",True
P45066,UDP-N-acetylmuramate--L-alanine ligase,protein,71421,Haemophilus influenzae (strain ATCC 51907 / DSM 11121 / KW20 / Rd),Haemophilus influenzae (strain ATCC 51907 / DSM 11121 / KW20 / Rd),murC,475,PTHR43445:SF3,UDP-N-ACETYLMURAMATE--L-ALANINE LIGASE,True
P57310,UDP-N-acetylmuramate--L-alanine ligase,protein,107806,Buchnera aphidicola subsp. Acyrthosiphon pisum (strain APS),Buchnera aphidicola subsp. Acyrthosiphon pisum (strain APS),murC,484,PTHR43445:SF3,UDP-N-ACETYLMURAMATE--L-ALANINE LIGASE,True
P57818,UDP-N-acetylmuramate--L-alanine ligase,protein,272843,Pasteurella multocida (strain Pm70),Pasteurella multocida (strain Pm70),murC,482,PTHR43445:SF3,UDP-N-ACETYLMURAMATE--L-ALANINE LIGASE,True
P57994,UDP-N-acetylmuramate--L-alanine ligase,protein,272631,Mycobacterium leprae (strain TN),Mycobacterium leprae (strain TN),murC,495,PTHR43445:SF3,UDP-N-ACETYLMURAMATE--L-ALANINE LIGASE,True
P59418,UDP-N-acetylmuramate--L-alanine ligase,protein,224915,Buchnera aphidicola subsp. Baizongia pistaciae (strain Bp),Buchnera aphidicola subsp. Baizongia pistaciae (strain Bp),murC,486,PTHR43445:SF3,UDP-N-ACETYLMURAMATE--L-ALANINE LIGASE,True
P61675,UDP-N-acetylmuramate--L-alanine ligase,protein,222523,Bacillus cereus (strain ATCC 10987 / NRS 248),Bacillus cereus (strain ATCC 10987 / NRS 248),murC,436,PTHR43445:SF3,UDP-N-ACETYLMURAMATE--L-ALANINE LIGASE,True
P61676,UDP-N-acetylmuramate--L-alanine ligase,protein,264462,Bdellovibrio bacteriovorus (strain ATCC 15356 / DSM 50701 / NCIMB 9529 / HD100),Bdellovibrio bacteriovorus (strain ATCC 15356 / DSM 50701 / NCIMB 9529 / HD100),murC,453,PTHR43445:SF3,UDP-N-ACETYLMURAMATE--L-ALANINE LIGASE,True
P61677,UDP-N-acetylmuramate--L-alanine ligase,protein,257309,Corynebacterium diphtheriae (strain ATCC 700971 / NCTC 13129 / Biotype gravis),Corynebacterium diphtheriae (strain ATCC 700971 / NCTC 13129 / Biotype gravis),murC,477,PTHR43445:SF3,UDP-N-ACETYLMURAMATE--L-ALANINE LIGASE,True
P61678,UDP-N-acetylmuramate--L-alanine ligase,protein,882,Nitratidesulfovibrio vulgaris (strain ATCC 29579 / DSM 644 / CCUG 34227 / NCIMB 8303 / VKM B-1760 / Hildenborough),Nitratidesulfovibrio vulgaris (strain ATCC 29579 / DSM 644 / CCUG 34227 / NCIMB 8303 / VKM B-1760 / Hildenborough),murC,454,PTHR43445:SF3,UDP-N-ACETYLMURAMATE--L-ALANINE LIGASE,True
P61679,UDP-N-acetylmuramate--L-alanine ligase,protein,243231,Geobacter sulfurreducens (strain ATCC 51573 / DSM 12127 / PCA),Geobacter sulfurreducens (strain ATCC 51573 / DSM 12127 / PCA),murC,462,PTHR43445:SF3,UDP-N-ACETYLMURAMATE--L-ALANINE LIGASE,True
P61680,UDP-N-acetylmuramate--L-alanine ligase,protein,257314,Lactobacillus johnsonii (strain CNCM I-12250 / La1 / NCC 533),Lactobacillus johnsonii (strain CNCM I-12250 / La1 / NCC 533),murC,437,PTHR43445:SF3,UDP-N-ACETYLMURAMATE--L-ALANINE LIGASE,True
P61681,UDP-N-acetylmuramate--L-alanine ligase,protein,262316,Mycolicibacterium paratuberculosis (strain ATCC BAA-968 / K-10),Mycolicibacterium paratuberculosis (strain ATCC BAA-968 / K-10),murC,496,PTHR43445:SF3,UDP-N-ACETYLMURAMATE--L-ALANINE LIGASE,True
P61682,UDP-N-acetylmuramate--L-alanine ligase,protein,258594,Rhodopseudomonas palustris (strain ATCC BAA-98 / CGA009),Rhodopseudomonas palustris (strain ATCC BAA-98 / CGA009),murC,467,PTHR43445:SF3,UDP-N-ACETYLMURAMATE--L-ALANINE LIGASE,True
P61683,UDP-N-acetylmuramate--L-alanine ligase,protein,163164,Wolbachia pipientis wMel,Wolbachia pipientis wMel,murC,498,PTHR43445:SF3,UDP-N-ACETYLMURAMATE--L-ALANINE LIGASE,True
P65468,UDP-N-acetylmuramate--L-alanine ligase,protein,224914,Brucella melitensis biotype 1 (strain ATCC 23456 / CCUG 17765 / NCTC 10094 / 16M),Brucella melitensis biotype 1 (strain ATCC 23456 / CCUG 17765 / NCTC 10094 / 16M),murC,471,PTHR43445:SF3,UDP-N-ACETYLMURAMATE--L-ALANINE LIGASE,True
P65469,UDP-N-acetylmuramate--L-alanine ligase,protein,204722,Brucella suis biovar 1 (strain 1330),Brucella suis biovar 1 (strain 1330),murC,471,PTHR43445:SF3,UDP-N-ACETYLMURAMATE--L-ALANINE LIGASE,True
P65470,UDP-N-acetylmuramate--L-alanine ligase,protein,199310,Escherichia coli O6:H1 (strain CFT073 / ATCC 700928 / UPEC),Escherichia coli O6:H1 (strain CFT073 / ATCC 700928 / UPEC),murC,491,PTHR43445:SF3,UDP-N-ACETYLMURAMATE--L-ALANINE LIGASE,True
P65471,UDP-N-acetylmuramate--L-alanine ligase,protein,83334,Escherichia coli O157:H7,Escherichia coli O157:H7,murC,491,PTHR43445:SF3,UDP-N-ACETYLMURAMATE--L-ALANINE LIGASE,True
P65473,UDP-N-acetylmuramate--L-alanine ligase,protein,233413,Mycobacterium bovis (strain ATCC BAA-935 / AF2122/97),Mycobacterium bovis (strain ATCC BAA-935 / AF2122/97),murC,494,PTHR43445:SF3,UDP-N-ACETYLMURAMATE--L-ALANINE LIGASE,True
P65474,UDP-N-acetylmuramate--L-alanine ligase,protein,158878,Staphylococcus aureus (strain Mu50 / ATCC 700699),Staphylococcus aureus (strain Mu50 / ATCC 700699),murC,437,PTHR43445:SF3,UDP-N-ACETYLMURAMATE--L-ALANINE LIGASE,True
P65475,UDP-N-acetylmuramate--L-alanine ligase,protein,158879,Staphylococcus aureus (strain N315),Staphylococcus aureus (strain N315),murC,437,PTHR43445:SF3,UDP-N-ACETYLMURAMATE--L-ALANINE LIGASE,True
P65476,UDP-N-acetylmuramate--L-alanine ligase,protein,196620,Staphylococcus aureus (strain MW2),Staphylococcus aureus (strain MW2),murC,437,PTHR43445:SF3,UDP-N-ACETYLMURAMATE--L-ALANINE LIGASE,True
P74528,UDP-N-acetylmuramate--L-alanine ligase,protein,1111708,Synechocystis sp. (strain ATCC 27184 / PCC 6803 / Kazusa),Synechocystis sp. (strain ATCC 27184 / PCC 6803 / Kazusa),murC,505,PTHR43445:SF3,UDP-N-ACETYLMURAMATE--L-ALANINE LIGASE,True
P94335,UDP-N-acetylmuramate--L-alanine ligase,protein,196627,Corynebacterium glutamicum (strain ATCC 13032 / DSM 20300 / JCM 1318 / BCRC 11384 / CCUG 27702 / LMG 3730 / NBRC 12168 / NCIMB 10025 / NRRL B-2784 / 534),Corynebacterium glutamicum (strain ATCC 13032 / DSM 20300 / JCM 1318 / BCRC 11384 / CCUG 27702 / LMG 3730 / NBRC 12168 / NCIMB 10025 / NRRL B-2784 / 534),murC,486,PTHR43445:SF3,UDP-N-ACETYLMURAMATE--L-ALANINE LIGASE,True
P95836,UDP-N-acetylmuramate--L-alanine ligase,protein,1140,Synechococcus elongatus (strain ATCC 33912 / PCC 7942 / FACHB-805),Synechococcus elongatus (strain ATCC 33912 / PCC 7942 / FACHB-805),murC,478,PTHR43445:SF3,UDP-N-ACETYLMURAMATE--L-ALANINE LIGASE,True
P96736,PGA synthase CapB,protein,224308,Bacillus subtilis (strain 168),Bacillus subtilis (strain 168),capB,393,PTHR43445:SF1,PGA SYNTHASE CAPB,True
P9WJL6,UDP-N-acetylmuramate--L-alanine ligase,protein,83331,Mycobacterium tuberculosis (strain CDC 1551 / Oshkosh),Mycobacterium tuberculosis (strain CDC 1551 / Oshkosh),murC,494,PTHR43445:SF3,UDP-N-ACETYLMURAMATE--L-ALANINE LIGASE,True
P9WJL7,UDP-N-acetylmuramate--L-alanine ligase,protein,83332,Mycobacterium tuberculosis (strain ATCC 25618 / H37Rv),Mycobacterium tuberculosis (strain ATCC 25618 / H37Rv),murC,494,PTHR43445:SF3,UDP-N-ACETYLMURAMATE--L-ALANINE LIGASE,True
Q01Q49,UDP-N-acetylmuramate--L-alanine ligase,protein,234267,Solibacter usitatus (strain Ellin6076),Solibacter usitatus (strain Ellin6076),murC,472,PTHR43445:SF3,UDP-N-ACETYLMURAMATE--L-ALANINE LIGASE,True
Q02H29,UDP-N-acetylmuramate--L-alanine ligase,protein,208963,Pseudomonas aeruginosa (strain UCBPP-PA14),Pseudomonas aeruginosa (strain UCBPP-PA14),murC,480,PTHR43445:SF3,UDP-N-ACETYLMURAMATE--L-ALANINE LIGASE,True
Q02W92,UDP-N-acetylmuramate--L-alanine ligase,protein,272622,Lactococcus lactis subsp. cremoris (strain SK11),Lactococcus lactis subsp. cremoris (strain SK11),murC,443,PTHR43445:SF3,UDP-N-ACETYLMURAMATE--L-ALANINE LIGASE,True
Q037Y8,UDP-N-acetylmuramate--L-alanine ligase,protein,321967,Lacticaseibacillus paracasei (strain ATCC 334 / BCRC 17002 / CCUG 31169 / CIP 107868 / KCTC 3260 / NRRL B-441),Lacticaseibacillus paracasei (strain ATCC 334 / BCRC 17002 / CCUG 31169 / CIP 107868 / KCTC 3260 / NRRL B-441),murC,436,PTHR43445:SF3,UDP-N-ACETYLMURAMATE--L-ALANINE LIGASE,True
Q03GC5,UDP-N-acetylmuramate--L-alanine ligase,protein,278197,Pediococcus pentosaceus (strain ATCC 25745 / CCUG 21536 / LMG 10740 / 183-1w),Pediococcus pentosaceus (strain ATCC 25745 / CCUG 21536 / LMG 10740 / 183-1w),murC,436,PTHR43445:SF3,UDP-N-ACETYLMURAMATE--L-ALANINE LIGASE,True
Q03MH6,UDP-N-acetylmuramate--L-alanine ligase,protein,322159,Streptococcus thermophilus (strain ATCC BAA-491 / LMD-9),Streptococcus thermophilus (strain ATCC BAA-491 / LMD-9),murC,442,PTHR43445:SF3,UDP-N-ACETYLMURAMATE--L-ALANINE LIGASE,True
Q03RJ2,UDP-N-acetylmuramate--L-alanine ligase,protein,387344,Levilactobacillus brevis (strain ATCC 367 / BCRC 12310 / CIP 105137 / JCM 1170 / LMG 11437 / NCIMB 947 / NCTC 947),Levilactobacillus brevis (strain ATCC 367 / BCRC 12310 / CIP 105137 / JCM 1170 / LMG 11437 / NCIMB 947 / NCTC 947),murC,443,PTHR43445:SF3,UDP-N-ACETYLMURAMATE--L-ALANINE LIGASE,True
Q03YA3,UDP-N-acetylmuramate--L-alanine ligase,protein,203120,Leuconostoc mesenteroides subsp. mesenteroides (strain ATCC 8293 / DSM 20343 / BCRC 11652 / CCM 1803 / JCM 6124 / NCDO 523 / NBRC 100496 / NCIMB 8023 / NCTC 12954 / NRRL B-1118 / 37Y),Leuconostoc mesenteroides subsp. mesenteroides (strain ATCC 8293 / DSM 20343 / BCRC 11652 / CCM 1803 / JCM 6124 / NCDO 523 / NBRC 100496 / NCIMB 8023 / NCTC 12954 / NRRL B-1118 / 37Y),murC,444,PTHR43445:SF3,UDP-N-ACETYLMURAMATE--L-ALANINE LIGASE,True
Q041T4,UDP-N-acetylmuramate--L-alanine ligase,protein,324831,Lactobacillus gasseri (strain ATCC 33323 / DSM 20243 / BCRC 14619 / CIP 102991 / JCM 1131 / KCTC 3163 / NCIMB 11718 / NCTC 13722 / AM63),Lactobacillus gasseri (strain ATCC 33323 / DSM 20243 / BCRC 14619 / CIP 102991 / JCM 1131 / KCTC 3163 / NCIMB 11718 / NCTC 13722 / AM63),murC,437,PTHR43445:SF3,UDP-N-ACETYLMURAMATE--L-ALANINE LIGASE,True
Q049E9,UDP-N-acetylmuramate--L-alanine ligase,protein,321956,Lactobacillus delbrueckii subsp. bulgaricus (strain ATCC BAA-365 / Lb-18),Lactobacillus delbrueckii subsp. bulgaricus (strain ATCC BAA-365 / Lb-18),murC,439,PTHR43445:SF3,UDP-N-ACETYLMURAMATE--L-ALANINE LIGASE,True
Q04EI0,UDP-N-acetylmuramate--L-alanine ligase,protein,203123,Oenococcus oeni (strain ATCC BAA-331 / PSU-1),Oenococcus oeni (strain ATCC BAA-331 / PSU-1),murC,435,PTHR43445:SF3,UDP-N-ACETYLMURAMATE--L-ALANINE LIGASE,True
Q04HS5,UDP-N-acetylmuramate--L-alanine ligase,protein,373153,Streptococcus pneumoniae serotype 2 (strain D39 / NCTC 7466),Streptococcus pneumoniae serotype 2 (strain D39 / NCTC 7466),murC,444,PTHR43445:SF3,UDP-N-ACETYLMURAMATE--L-ALANINE LIGASE,True
Q07PT2,UDP-N-acetylmuramate--L-alanine ligase,protein,316055,Rhodopseudomonas palustris (strain BisA53),Rhodopseudomonas palustris (strain BisA53),murC,467,PTHR43445:SF3,UDP-N-ACETYLMURAMATE--L-ALANINE LIGASE,True
Q07WI6,UDP-N-acetylmuramate--L-alanine ligase,protein,318167,Shewanella frigidimarina (strain NCIMB 400),Shewanella frigidimarina (strain NCIMB 400),murC,485,PTHR43445:SF3,UDP-N-ACETYLMURAMATE--L-ALANINE LIGASE,True
Q0A6K3,UDP-N-acetylmuramate--L-alanine ligase,protein,187272,Alkalilimnicola ehrlichii (strain ATCC BAA-1101 / DSM 17681 / MLHE-1),Alkalilimnicola ehrlichii (strain ATCC BAA-1101 / DSM 17681 / MLHE-1),murC,479,PTHR43445:SF3,UDP-N-ACETYLMURAMATE--L-ALANINE LIGASE,True
Q0AJE2,UDP-N-acetylmuramate--L-alanine ligase,protein,335283,Nitrosomonas eutropha (strain DSM 101675 / C91 / Nm57),Nitrosomonas eutropha (strain DSM 101675 / C91 / Nm57),murC,473,PTHR43445:SF3,UDP-N-ACETYLMURAMATE--L-ALANINE LIGASE,True
Q0AMW8,UDP-N-acetylmuramate--L-alanine ligase,protein,394221,Maricaulis maris (strain MCS10),Maricaulis maris (strain MCS10),murC,468,PTHR43445:SF3,UDP-N-ACETYLMURAMATE--L-ALANINE LIGASE,True
Q0AYQ7,UDP-N-acetylmuramate--L-alanine ligase,protein,335541,Syntrophomonas wolfei subsp. wolfei (strain DSM 2245B / Goettingen),Syntrophomonas wolfei subsp. wolfei (strain DSM 2245B / Goettingen),murC,465,PTHR43445:SF3,UDP-N-ACETYLMURAMATE--L-ALANINE LIGASE,True
Q0BIK0,UDP-N-acetylmuramate--L-alanine ligase,protein,339670,Burkholderia ambifaria (strain ATCC BAA-244 / DSM 16087 / CCUG 44356 / LMG 19182 / AMMD),Burkholderia ambifaria (strain ATCC BAA-244 / DSM 16087 / CCUG 44356 / LMG 19182 / AMMD),murC,465,PTHR43445:SF3,UDP-N-ACETYLMURAMATE--L-ALANINE LIGASE,True
Q0BV26,UDP-N-acetylmuramate--L-alanine ligase,protein,391165,Granulibacter bethesdensis (strain ATCC BAA-1260 / CGDNIH1),Granulibacter bethesdensis (strain ATCC BAA-1260 / CGDNIH1),murC,481,PTHR43445:SF3,UDP-N-ACETYLMURAMATE--L-ALANINE LIGASE,True
Q0BXU4,UDP-N-acetylmuramate--L-alanine ligase,protein,228405,Hyphomonas neptunium (strain ATCC 15444),Hyphomonas neptunium (strain ATCC 15444),murC,474,PTHR43445:SF3,UDP-N-ACETYLMURAMATE--L-ALANINE LIGASE,True
Q0HE84,UDP-N-acetylmuramate--L-alanine ligase,protein,60480,Shewanella sp. (strain MR-4),Shewanella sp. (strain MR-4),murC,488,PTHR43445:SF3,UDP-N-ACETYLMURAMATE--L-ALANINE LIGASE,True
Q0HZR5,UDP-N-acetylmuramate--L-alanine ligase,protein,60481,Shewanella sp. (strain MR-7),Shewanella sp. (strain MR-7),murC,488,PTHR43445:SF3,UDP-N-ACETYLMURAMATE--L-ALANINE LIGASE,True
