id,name,entry_type,source_tax_id,source_tax_name,full_tax_name,gene,length,subfamily,subfamily_name,in_alphafold
A0AJ57,UDP-N-acetylmuramate--L-alanine ligase,protein,386043,Listeria welshimeri serovar 6b (strain ATCC 35897 / DSM 20650 / CCUG 15529 / CIP 8149 / NCTC 11857 / SLCC 5334 / V8),Listeria welshimeri serovar 6b (strain ATCC 35897 / DSM 20650 / CCUG 15529 / CIP 8149 / NCTC 11857 / SLCC 5334 / V8),murC,447,PTHR43445:SF3,UDP-N-ACETYLMURAMATE--L-ALANINE LIGASE,True
A0JV95,UDP-N-acetylmuramate--L-alanine ligase,protein,290399,Arthrobacter sp. (strain FB24),Arthrobacter sp. (strain FB24),murC,467,PTHR43445:SF3,UDP-N-ACETYLMURAMATE--L-ALANINE LIGASE,True
A0K487,UDP-N-acetylmuramate--L-alanine ligase,protein,331272,Burkholderia cenocepacia (strain HI2424),Burkholderia cenocepacia (strain HI2424),murC,465,PTHR43445:SF3,UDP-N-ACETYLMURAMATE--L-ALANINE LIGASE,True
A0KPX1,UDP-N-acetylmuramate--L-alanine ligase,protein,380703,Aeromonas hydrophila subsp. hydrophila (strain ATCC 7966 / DSM 30187 / BCRC 13018 / CCUG 14551 / JCM 1027 / KCTC 2358 / NCIMB 9240 / NCTC 8049),Aeromonas hydrophila subsp. hydrophila (strain ATCC 7966 / DSM 30187 / BCRC 13018 / CCUG 14551 / JCM 1027 / KCTC 2358 / NCIMB 9240 / NCTC 8049),murC,484,PTHR43445:SF3,UDP-N-ACETYLMURAMATE--L-ALANINE LIGASE,True
A0L1P1,UDP-N-acetylmuramate--L-alanine ligase,protein,94122,Shewanella sp. (strain ANA-3),Shewanella sp. (strain ANA-3),murC,488,PTHR43445:SF3,UDP-N-ACETYLMURAMATE--L-ALANINE LIGASE,True
A0L5N0,UDP-N-acetylmuramate--L-alanine ligase,protein,156889,Magnetococcus marinus (strain ATCC BAA-1437 / JCM 17883 / MC-1),Magnetococcus marinus (strain ATCC BAA-1437 / JCM 17883 / MC-1),murC,476,PTHR43445:SF3,UDP-N-ACETYLMURAMATE--L-ALANINE LIGASE,True
A0LNY9,UDP-N-acetylmuramate--L-alanine ligase,protein,335543,Syntrophobacter fumaroxidans (strain DSM 10017 / MPOB),Syntrophobacter fumaroxidans (strain DSM 10017 / MPOB),murC,469,PTHR43445:SF3,UDP-N-ACETYLMURAMATE--L-ALANINE LIGASE,True
A0LTM4,UDP-N-acetylmuramate--L-alanine ligase,protein,351607,Acidothermus cellulolyticus (strain ATCC 43068 / DSM 8971 / 11B),Acidothermus cellulolyticus (strain ATCC 43068 / DSM 8971 / 11B),murC,477,PTHR43445:SF3,UDP-N-ACETYLMURAMATE--L-ALANINE LIGASE,True
A0M526,UDP-N-acetylmuramate--L-alanine ligase,protein,411154,Christiangramia forsetii (strain DSM 17595 / CGMCC 1.15422 / KT0803),Christiangramia forsetii (strain DSM 17595 / CGMCC 1.15422 / KT0803),murC,452,PTHR43445:SF3,UDP-N-ACETYLMURAMATE--L-ALANINE LIGASE,True
A0PTI6,UDP-N-acetylmuramate--L-alanine ligase,protein,362242,Mycobacterium ulcerans (strain Agy99),Mycobacterium ulcerans (strain Agy99),murC,488,PTHR43445:SF3,UDP-N-ACETYLMURAMATE--L-ALANINE LIGASE,True
A0PXK5,UDP-N-acetylmuramate--L-alanine ligase,protein,386415,Clostridium novyi (strain NT),Clostridium novyi (strain NT),murC,458,PTHR43445:SF3,UDP-N-ACETYLMURAMATE--L-ALANINE LIGASE,True
A0Q425,UDP-N-acetylmuramate--L-alanine ligase,protein,401614,Francisella tularensis subsp. novicida (strain ATCC 15482 / CCUG 33449 / U112),Francisella tularensis subsp. novicida (strain ATCC 15482 / CCUG 33449 / U112),murC,451,PTHR43445:SF3,UDP-N-ACETYLMURAMATE--L-ALANINE LIGASE,True
A0QF53,UDP-N-acetylmuramate--L-alanine ligase,protein,243243,Mycobacterium avium (strain 104),Mycobacterium avium (strain 104),murC,496,PTHR43445:SF3,UDP-N-ACETYLMURAMATE--L-ALANINE LIGASE,True
A0R015,UDP-N-acetylmuramate--L-alanine ligase,protein,246196,Mycolicibacterium smegmatis (strain ATCC 700084 / mc(2)155),Mycolicibacterium smegmatis (strain ATCC 700084 / mc(2)155),murC,482,PTHR43445:SF3,UDP-N-ACETYLMURAMATE--L-ALANINE LIGASE,True
A0RJS6,UDP-N-acetylmuramate--L-alanine ligase,protein,412694,Bacillus thuringiensis (strain Al Hakam),Bacillus thuringiensis (strain Al Hakam),murC,436,PTHR43445:SF3,UDP-N-ACETYLMURAMATE--L-ALANINE LIGASE,True
A1A2E8,UDP-N-acetylmuramate--L-alanine ligase,protein,367928,Bifidobacterium adolescentis (strain ATCC 15703 / DSM 20083 / NCTC 11814 / E194a),Bifidobacterium adolescentis (strain ATCC 15703 / DSM 20083 / NCTC 11814 / E194a),murC,521,PTHR43445:SF3,UDP-N-ACETYLMURAMATE--L-ALANINE LIGASE,True
A1A7D6,UDP-N-acetylmuramate--L-alanine ligase,protein,405955,Escherichia coli O1:K1 / APEC,Escherichia coli O1:K1 / APEC,murC,491,PTHR43445:SF3,UDP-N-ACETYLMURAMATE--L-ALANINE LIGASE,True
A1AU60,UDP-N-acetylmuramate--L-alanine ligase,protein,338966,Pelobacter propionicus (strain DSM 2379 / NBRC 103807 / OttBd1),Pelobacter propionicus (strain DSM 2379 / NBRC 103807 / OttBd1),murC,460,PTHR43445:SF3,UDP-N-ACETYLMURAMATE--L-ALANINE LIGASE,True
A1AX27,UDP-N-acetylmuramate--L-alanine ligase,protein,413404,Ruthia magnifica subsp. Calyptogena magnifica,Ruthia magnifica subsp. Calyptogena magnifica,murC,469,PTHR43445:SF3,UDP-N-ACETYLMURAMATE--L-ALANINE LIGASE,True
A1BAL4,UDP-N-acetylmuramate--L-alanine ligase,protein,318586,Paracoccus denitrificans (strain Pd 1222),Paracoccus denitrificans (strain Pd 1222),murC,475,PTHR43445:SF3,UDP-N-ACETYLMURAMATE--L-ALANINE LIGASE,True
A1BJX7,UDP-N-acetylmuramate--L-alanine ligase,protein,290317,Chlorobium phaeobacteroides (strain DSM 266 / SMG 266 / 2430),Chlorobium phaeobacteroides (strain DSM 266 / SMG 266 / 2430),murC,466,PTHR43445:SF3,UDP-N-ACETYLMURAMATE--L-ALANINE LIGASE,True
A1JJJ4,UDP-N-acetylmuramate--L-alanine ligase,protein,393305,Yersinia enterocolitica serotype O:8 / biotype 1B (strain NCTC 13174 / 8081),Yersinia enterocolitica serotype O:8 / biotype 1B (strain NCTC 13174 / 8081),murC,491,PTHR43445:SF3,UDP-N-ACETYLMURAMATE--L-ALANINE LIGASE,True
A1K3U7,UDP-N-acetylmuramate--L-alanine ligase,protein,418699,Azoarcus sp. (strain BH72),Azoarcus sp. (strain BH72),murC,467,PTHR43445:SF3,UDP-N-ACETYLMURAMATE--L-ALANINE LIGASE,True
A1KKJ5,UDP-N-acetylmuramate--L-alanine ligase,protein,410289,Mycobacterium bovis (strain BCG / Pasteur 1173P2),Mycobacterium bovis (strain BCG / Pasteur 1173P2),murC,494,PTHR43445:SF3,UDP-N-ACETYLMURAMATE--L-ALANINE LIGASE,True
A1KVL2,UDP-N-acetylmuramate--L-alanine ligase,protein,272831,Neisseria meningitidis serogroup C / serotype 2a (strain ATCC 700532 / DSM 15464 / FAM18),Neisseria meningitidis serogroup C / serotype 2a (strain ATCC 700532 / DSM 15464 / FAM18),murC,469,PTHR43445:SF3,UDP-N-ACETYLMURAMATE--L-ALANINE LIGASE,True
A1R5F9,UDP-N-acetylmuramate--L-alanine ligase,protein,290340,Paenarthrobacter aurescens (strain TC1),Paenarthrobacter aurescens (strain TC1),murC,456,PTHR43445:SF3,UDP-N-ACETYLMURAMATE--L-ALANINE LIGASE,True
A1REZ7,UDP-N-acetylmuramate--L-alanine ligase,protein,351745,Shewanella sp. (strain W3-18-1),Shewanella sp. (strain W3-18-1),murC,488,PTHR43445:SF3,UDP-N-ACETYLMURAMATE--L-ALANINE LIGASE,True
A1S2G0,UDP-N-acetylmuramate--L-alanine ligase,protein,326297,Shewanella amazonensis (strain ATCC BAA-1098 / SB2B),Shewanella amazonensis (strain ATCC BAA-1098 / SB2B),murC,484,PTHR43445:SF3,UDP-N-ACETYLMURAMATE--L-ALANINE LIGASE,True
A1SL79,UDP-N-acetylmuramate--L-alanine ligase,protein,196162,Nocardioides sp. (strain ATCC BAA-499 / JS614),Nocardioides sp. (strain ATCC BAA-499 / JS614),murC,446,PTHR43445:SF3,UDP-N-ACETYLMURAMATE--L-ALANINE LIGASE,True
A1SU20,UDP-N-acetylmuramate--L-alanine ligase,protein,357804,Psychromonas ingrahamii (strain DSM 17664 / CCUG 51855 / 37),Psychromonas ingrahamii (strain DSM 17664 / CCUG 51855 / 37),murC,487,PTHR43445:SF3,UDP-N-ACETYLMURAMATE--L-ALANINE LIGASE,True
A1TAW7,UDP-N-acetylmuramate--L-alanine ligase,protein,350058,Mycolicibacterium vanbaalenii (strain DSM 7251 / JCM 13017 / BCRC 16820 / KCTC 9966 / NRRL B-24157 / PYR-1),Mycolicibacterium vanbaalenii (strain DSM 7251 / JCM 13017 / BCRC 16820 / KCTC 9966 / NRRL B-24157 / PYR-1),murC,478,PTHR43445:SF3,UDP-N-ACETYLMURAMATE--L-ALANINE LIGASE,True
A1TKD2,UDP-N-acetylmuramate--L-alanine ligase,protein,397945,Paracidovorax citrulli (strain AAC00-1),Paracidovorax citrulli (strain AAC00-1),murC,475,PTHR43445:SF3,UDP-N-ACETYLMURAMATE--L-ALANINE LIGASE,True
A1U3F7,UDP-N-acetylmuramate--L-alanine ligase,protein,351348,Marinobacter nauticus (strain ATCC 700491 / DSM 11845 / VT8),Marinobacter nauticus (strain ATCC 700491 / DSM 11845 / VT8),murC,481,PTHR43445:SF3,UDP-N-ACETYLMURAMATE--L-ALANINE LIGASE,True
A1UI53,UDP-N-acetylmuramate--L-alanine ligase,protein,189918,Mycobacterium sp. (strain KMS),Mycobacterium sp. (strain KMS),murC,484,PTHR43445:SF3,UDP-N-ACETYLMURAMATE--L-ALANINE LIGASE,True
A1UTC4,UDP-N-acetylmuramate--L-alanine ligase,protein,360095,"Bartonella bacilliformis (strain ATCC 35685 / KC583 / Herrer 020/F12,63)","Bartonella bacilliformis (strain ATCC 35685 / KC583 / Herrer 020/F12,63)",murC,475,PTHR43445:SF3,UDP-N-ACETYLMURAMATE--L-ALANINE LIGASE,True
A1V0R7,UDP-N-acetylmuramate--L-alanine ligase,protein,320388,Burkholderia mallei (strain SAVP1),Burkholderia mallei (strain SAVP1),murC,465,PTHR43445:SF3,UDP-N-ACETYLMURAMATE--L-ALANINE LIGASE,True
A1VBE9,UDP-N-acetylmuramate--L-alanine ligase,protein,391774,Nitratidesulfovibrio vulgaris (strain DP4),Nitratidesulfovibrio vulgaris (strain DP4),murC,454,PTHR43445:SF3,UDP-N-ACETYLMURAMATE--L-ALANINE LIGASE,True
A1VST5,UDP-N-acetylmuramate--L-alanine ligase,protein,365044,Polaromonas naphthalenivorans (strain CJ2),Polaromonas naphthalenivorans (strain CJ2),murC,478,PTHR43445:SF3,UDP-N-ACETYLMURAMATE--L-ALANINE LIGASE,True
A1W043,UDP-N-acetylmuramate--L-alanine ligase,protein,354242,Campylobacter jejuni subsp. jejuni serotype O:23/36 (strain 81-176),Campylobacter jejuni subsp. jejuni serotype O:23/36 (strain 81-176),murC,431,PTHR43445:SF3,UDP-N-ACETYLMURAMATE--L-ALANINE LIGASE,True
A1WC05,UDP-N-acetylmuramate--L-alanine ligase,protein,232721,Acidovorax sp. (strain JS42),Acidovorax sp. (strain JS42),murC,477,PTHR43445:SF3,UDP-N-ACETYLMURAMATE--L-ALANINE LIGASE,True
A1WRL2,UDP-N-acetylmuramate--L-alanine ligase,protein,391735,Verminephrobacter eiseniae (strain EF01-2),Verminephrobacter eiseniae (strain EF01-2),murC,477,PTHR43445:SF3,UDP-N-ACETYLMURAMATE--L-ALANINE LIGASE,True
A1WYU2,UDP-N-acetylmuramate--L-alanine ligase,protein,349124,Halorhodospira halophila (strain DSM 244 / SL1),Halorhodospira halophila (strain DSM 244 / SL1),murC,486,PTHR43445:SF3,UDP-N-ACETYLMURAMATE--L-ALANINE LIGASE,True
A2BZC5,UDP-N-acetylmuramate--L-alanine ligase,protein,167555,Prochlorococcus marinus (strain NATL1A),Prochlorococcus marinus (strain NATL1A),murC,494,PTHR43445:SF3,UDP-N-ACETYLMURAMATE--L-ALANINE LIGASE,True
A2C5M3,UDP-N-acetylmuramate--L-alanine ligase,protein,59922,Prochlorococcus marinus (strain MIT 9303),Prochlorococcus marinus (strain MIT 9303),murC,488,PTHR43445:SF3,UDP-N-ACETYLMURAMATE--L-ALANINE LIGASE,True
A2RGA7,UDP-N-acetylmuramate--L-alanine ligase,protein,160491,Streptococcus pyogenes serotype M5 (strain Manfredo),Streptococcus pyogenes serotype M5 (strain Manfredo),murC,442,PTHR43445:SF3,UDP-N-ACETYLMURAMATE--L-ALANINE LIGASE,True
A2RNJ0,UDP-N-acetylmuramate--L-alanine ligase,protein,416870,Lactococcus lactis subsp. cremoris (strain MG1363),Lactococcus lactis subsp. cremoris (strain MG1363),murC,443,PTHR43445:SF3,UDP-N-ACETYLMURAMATE--L-ALANINE LIGASE,True
A2S5U4,UDP-N-acetylmuramate--L-alanine ligase,protein,412022,Burkholderia mallei (strain NCTC 10229),Burkholderia mallei (strain NCTC 10229),murC,465,PTHR43445:SF3,UDP-N-ACETYLMURAMATE--L-ALANINE LIGASE,True
A2SCY6,UDP-N-acetylmuramate--L-alanine ligase,protein,420662,Methylibium petroleiphilum (strain ATCC BAA-1232 / LMG 22953 / PM1),Methylibium petroleiphilum (strain ATCC BAA-1232 / LMG 22953 / PM1),murC,469,PTHR43445:SF3,UDP-N-ACETYLMURAMATE--L-ALANINE LIGASE,True
A3CPS7,UDP-N-acetylmuramate--L-alanine ligase,protein,388919,Streptococcus sanguinis (strain SK36),Streptococcus sanguinis (strain SK36),murC,444,PTHR43445:SF3,UDP-N-ACETYLMURAMATE--L-ALANINE LIGASE,True
A3CZM2,UDP-N-acetylmuramate--L-alanine ligase,protein,325240,Shewanella baltica (strain OS155 / ATCC BAA-1091),Shewanella baltica (strain OS155 / ATCC BAA-1091),murC,488,PTHR43445:SF3,UDP-N-ACETYLMURAMATE--L-ALANINE LIGASE,True
A3DIP6,UDP-N-acetylmuramate--L-alanine ligase,protein,203119,Acetivibrio thermocellus (strain ATCC 27405 / DSM 1237 / JCM 9322 / NBRC 103400 / NCIMB 10682 / NRRL B-4536 / VPI 7372),Acetivibrio thermocellus (strain ATCC 27405 / DSM 1237 / JCM 9322 / NBRC 103400 / NCIMB 10682 / NRRL B-4536 / VPI 7372),murC,469,PTHR43445:SF3,UDP-N-ACETYLMURAMATE--L-ALANINE LIGASE,True
A3M9Y0,UDP-N-acetylmuramate--L-alanine ligase,protein,400667,Acinetobacter baumannii (strain ATCC 17978 / DSM 105126 / CIP 53.77 / LMG 1025 / NCDC KC755 / 5377),Acinetobacter baumannii (strain ATCC 17978 / DSM 105126 / CIP 53.77 / LMG 1025 / NCDC KC755 / 5377),murC,482,PTHR43445:SF3,UDP-N-ACETYLMURAMATE--L-ALANINE LIGASE,True
A3MR64,UDP-N-acetylmuramate--L-alanine ligase,protein,320389,Burkholderia mallei (strain NCTC 10247),Burkholderia mallei (strain NCTC 10247),murC,465,PTHR43445:SF3,UDP-N-ACETYLMURAMATE--L-ALANINE LIGASE,True
A3MY91,UDP-N-acetylmuramate--L-alanine ligase,protein,416269,Actinobacillus pleuropneumoniae serotype 5b (strain L20),Actinobacillus pleuropneumoniae serotype 5b (strain L20),murC,475,PTHR43445:SF3,UDP-N-ACETYLMURAMATE--L-ALANINE LIGASE,True
A3NDW3,UDP-N-acetylmuramate--L-alanine ligase,protein,320373,Burkholderia pseudomallei (strain 668),Burkholderia pseudomallei (strain 668),murC,465,PTHR43445:SF3,UDP-N-ACETYLMURAMATE--L-ALANINE LIGASE,True
A3NZL4,UDP-N-acetylmuramate--L-alanine ligase,protein,357348,Burkholderia pseudomallei (strain 1106a),Burkholderia pseudomallei (strain 1106a),murC,465,PTHR43445:SF3,UDP-N-ACETYLMURAMATE--L-ALANINE LIGASE,True
A3PHS9,UDP-N-acetylmuramate--L-alanine ligase,protein,349101,Cereibacter sphaeroides (strain ATCC 17029 / ATH 2.4.9),Cereibacter sphaeroides (strain ATCC 17029 / ATH 2.4.9),murC,470,PTHR43445:SF3,UDP-N-ACETYLMURAMATE--L-ALANINE LIGASE,True
A3Q1L7,UDP-N-acetylmuramate--L-alanine ligase,protein,164757,Mycobacterium sp. (strain JLS),Mycobacterium sp. (strain JLS),murC,484,PTHR43445:SF3,UDP-N-ACETYLMURAMATE--L-ALANINE LIGASE,True
A3QIM0,UDP-N-acetylmuramate--L-alanine ligase,protein,323850,Shewanella loihica (strain ATCC BAA-1088 / PV-4),Shewanella loihica (strain ATCC BAA-1088 / PV-4),murC,484,PTHR43445:SF3,UDP-N-ACETYLMURAMATE--L-ALANINE LIGASE,True
A4FLV9,UDP-N-acetylmuramate--L-alanine ligase,protein,405948,Saccharopolyspora erythraea (strain ATCC 11635 / DSM 40517 / JCM 4748 / NBRC 13426 / NCIMB 8594 / NRRL 2338),Saccharopolyspora erythraea (strain ATCC 11635 / DSM 40517 / JCM 4748 / NBRC 13426 / NCIMB 8594 / NRRL 2338),murC,490,PTHR43445:SF3,UDP-N-ACETYLMURAMATE--L-ALANINE LIGASE,True
A4G8T7,UDP-N-acetylmuramate--L-alanine ligase,protein,204773,Herminiimonas arsenicoxydans,Herminiimonas arsenicoxydans,murC,469,PTHR43445:SF3,UDP-N-ACETYLMURAMATE--L-ALANINE LIGASE,True
A4IRW1,UDP-N-acetylmuramate--L-alanine ligase,protein,420246,Geobacillus thermodenitrificans (strain NG80-2),Geobacillus thermodenitrificans (strain NG80-2),murC,434,PTHR43445:SF3,UDP-N-ACETYLMURAMATE--L-ALANINE LIGASE,True
A4J011,UDP-N-acetylmuramate--L-alanine ligase,protein,418136,Francisella tularensis subsp. tularensis (strain WY96-3418),Francisella tularensis subsp. tularensis (strain WY96-3418),murC,451,PTHR43445:SF3,UDP-N-ACETYLMURAMATE--L-ALANINE LIGASE,True
A4J2B2,UDP-N-acetylmuramate--L-alanine ligase,protein,349161,Desulforamulus reducens (strain ATCC BAA-1160 / DSM 100696 / MI-1),Desulforamulus reducens (strain ATCC BAA-1160 / DSM 100696 / MI-1),murC,462,PTHR43445:SF3,UDP-N-ACETYLMURAMATE--L-ALANINE LIGASE,True
A4JB95,UDP-N-acetylmuramate--L-alanine ligase,protein,269482,Burkholderia vietnamiensis (strain G4 / LMG 22486),Burkholderia vietnamiensis (strain G4 / LMG 22486),murC,465,PTHR43445:SF3,UDP-N-ACETYLMURAMATE--L-ALANINE LIGASE,True
A4QFM2,UDP-N-acetylmuramate--L-alanine ligase,protein,340322,Corynebacterium glutamicum (strain R),Corynebacterium glutamicum (strain R),murC,486,PTHR43445:SF3,UDP-N-ACETYLMURAMATE--L-ALANINE LIGASE,True
A4SH01,UDP-N-acetylmuramate--L-alanine ligase,protein,290318,Chlorobium phaeovibrioides (strain DSM 265 / 1930),Chlorobium phaeovibrioides (strain DSM 265 / 1930),murC,469,PTHR43445:SF3,UDP-N-ACETYLMURAMATE--L-ALANINE LIGASE,True
A4SI57,UDP-N-acetylmuramate--L-alanine ligase,protein,382245,Aeromonas salmonicida (strain A449),Aeromonas salmonicida (strain A449),murC,484,PTHR43445:SF3,UDP-N-ACETYLMURAMATE--L-ALANINE LIGASE,True
A4SV75,UDP-N-acetylmuramate--L-alanine ligase,protein,312153,Polynucleobacter asymbioticus (strain DSM 18221 / CIP 109841 / QLW-P1DMWA-1),Polynucleobacter asymbioticus (strain DSM 18221 / CIP 109841 / QLW-P1DMWA-1),murC,478,PTHR43445:SF3,UDP-N-ACETYLMURAMATE--L-ALANINE LIGASE,True
A4TBE7,UDP-N-acetylmuramate--L-alanine ligase,protein,350054,Mycolicibacterium gilvum (strain PYR-GCK),Mycolicibacterium gilvum (strain PYR-GCK),murC,475,PTHR43445:SF3,UDP-N-ACETYLMURAMATE--L-ALANINE LIGASE,True
A4TQ82,UDP-N-acetylmuramate--L-alanine ligase,protein,386656,Yersinia pestis (strain Pestoides F),Yersinia pestis (strain Pestoides F),murC,491,PTHR43445:SF3,UDP-N-ACETYLMURAMATE--L-ALANINE LIGASE,True
A4VIH9,UDP-N-acetylmuramate--L-alanine ligase,protein,379731,Stutzerimonas stutzeri (strain A1501),Stutzerimonas stutzeri (strain A1501),murC,485,PTHR43445:SF3,UDP-N-ACETYLMURAMATE--L-ALANINE LIGASE,True
A4VX47,UDP-N-acetylmuramate--L-alanine ligase,protein,391295,Streptococcus suis (strain 05ZYH33),Streptococcus suis (strain 05ZYH33),murC,443,PTHR43445:SF3,UDP-N-ACETYLMURAMATE--L-ALANINE LIGASE,True
A4W3F1,UDP-N-acetylmuramate--L-alanine ligase,protein,391296,Streptococcus suis (strain 98HAH33),Streptococcus suis (strain 98HAH33),murC,443,PTHR43445:SF3,UDP-N-ACETYLMURAMATE--L-ALANINE LIGASE,True
A4W6J4,UDP-N-acetylmuramate--L-alanine ligase,protein,399742,Enterobacter sp. (strain 638),Enterobacter sp. (strain 638),murC,491,PTHR43445:SF3,UDP-N-ACETYLMURAMATE--L-ALANINE LIGASE,True
A4WQD6,UDP-N-acetylmuramate--L-alanine ligase,protein,349102,Cereibacter sphaeroides (strain ATCC 17025 / ATH 2.4.3),Cereibacter sphaeroides (strain ATCC 17025 / ATH 2.4.3),murC,470,PTHR43445:SF3,UDP-N-ACETYLMURAMATE--L-ALANINE LIGASE,True
A4X9R5,UDP-N-acetylmuramate--L-alanine ligase,protein,369723,Salinispora tropica (strain ATCC BAA-916 / DSM 44818 / JCM 13857 / NBRC 105044 / CNB-440),Salinispora tropica (strain ATCC BAA-916 / DSM 44818 / JCM 13857 / NBRC 105044 / CNB-440),murC,514,PTHR43445:SF3,UDP-N-ACETYLMURAMATE--L-ALANINE LIGASE,True
A4XGE5,UDP-N-acetylmuramate--L-alanine ligase,protein,351627,Caldicellulosiruptor saccharolyticus (strain ATCC 43494 / DSM 8903 / Tp8T 6331),Caldicellulosiruptor saccharolyticus (strain ATCC 43494 / DSM 8903 / Tp8T 6331),murC,455,PTHR43445:SF3,UDP-N-ACETYLMURAMATE--L-ALANINE LIGASE,True
A4XQS5,UDP-N-acetylmuramate--L-alanine ligase,protein,399739,Ectopseudomonas mendocina (strain ymp),Ectopseudomonas mendocina (strain ymp),murC,480,PTHR43445:SF3,UDP-N-ACETYLMURAMATE--L-ALANINE LIGASE,True
A4Y2N7,UDP-N-acetylmuramate--L-alanine ligase,protein,319224,Shewanella putrefaciens (strain CN-32 / ATCC BAA-453),Shewanella putrefaciens (strain CN-32 / ATCC BAA-453),murC,488,PTHR43445:SF3,UDP-N-ACETYLMURAMATE--L-ALANINE LIGASE,True
A4YZK2,UDP-N-acetylmuramate--L-alanine ligase,protein,114615,Bradyrhizobium sp. (strain ORS 278),Bradyrhizobium sp. (strain ORS 278),murC,467,PTHR43445:SF3,UDP-N-ACETYLMURAMATE--L-ALANINE LIGASE,True
A5CD22,UDP-N-acetylmuramate--L-alanine ligase,protein,357244,Orientia tsutsugamushi (strain Boryong),Orientia tsutsugamushi (strain Boryong),murC,490,PTHR43445:SF3,UDP-N-ACETYLMURAMATE--L-ALANINE LIGASE,True
A5CS50,UDP-N-acetylmuramate--L-alanine ligase,protein,443906,Clavibacter michiganensis subsp. michiganensis (strain NCPPB 382),Clavibacter michiganensis subsp. michiganensis (strain NCPPB 382),murC,476,PTHR43445:SF3,UDP-N-ACETYLMURAMATE--L-ALANINE LIGASE,True
A5CW53,UDP-N-acetylmuramate--L-alanine ligase,protein,412965,Vesicomyosocius okutanii subsp. Calyptogena okutanii (strain HA),Vesicomyosocius okutanii subsp. Calyptogena okutanii (strain HA),murC,469,PTHR43445:SF3,UDP-N-ACETYLMURAMATE--L-ALANINE LIGASE,True
A5D144,UDP-N-acetylmuramate--L-alanine ligase,protein,370438,Pelotomaculum thermopropionicum (strain DSM 13744 / JCM 10971 / SI),Pelotomaculum thermopropionicum (strain DSM 13744 / JCM 10971 / SI),murC,461,PTHR43445:SF3,UDP-N-ACETYLMURAMATE--L-ALANINE LIGASE,True
A5EPK1,UDP-N-acetylmuramate--L-alanine ligase,protein,288000,Bradyrhizobium sp. (strain BTAi1 / ATCC BAA-1182),Bradyrhizobium sp. (strain BTAi1 / ATCC BAA-1182),murC,467,PTHR43445:SF3,UDP-N-ACETYLMURAMATE--L-ALANINE LIGASE,True
A5EY22,UDP-N-acetylmuramate--L-alanine ligase,protein,246195,Dichelobacter nodosus (strain VCS1703A),Dichelobacter nodosus (strain VCS1703A),murC,478,PTHR43445:SF3,UDP-N-ACETYLMURAMATE--L-ALANINE LIGASE,True
A5F5M8,UDP-N-acetylmuramate--L-alanine ligase,protein,345073,Vibrio cholerae serotype O1 (strain ATCC 39541 / Classical Ogawa 395 / O395),Vibrio cholerae serotype O1 (strain ATCC 39541 / Classical Ogawa 395 / O395),murC,486,PTHR43445:SF3,UDP-N-ACETYLMURAMATE--L-ALANINE LIGASE,True
A5FIY4,UDP-N-acetylmuramate--L-alanine ligase,protein,376686,Flavobacterium johnsoniae (strain ATCC 17061 / DSM 2064 / JCM 8514 / BCRC 14874 / CCUG 350202 / NBRC 14942 / NCIMB 11054 / UW101),Flavobacterium johnsoniae (strain ATCC 17061 / DSM 2064 / JCM 8514 / BCRC 14874 / CCUG 350202 / NBRC 14942 / NCIMB 11054 / UW101),murC,449,PTHR43445:SF3,UDP-N-ACETYLMURAMATE--L-ALANINE LIGASE,True
A5FUL1,UDP-N-acetylmuramate--L-alanine ligase,protein,349163,Acidiphilium cryptum (strain JF-5),Acidiphilium cryptum (strain JF-5),murC,479,PTHR43445:SF3,UDP-N-ACETYLMURAMATE--L-ALANINE LIGASE,True
A5G8J9,UDP-N-acetylmuramate--L-alanine ligase,protein,351605,Geotalea uraniireducens (strain Rf4),Geotalea uraniireducens (strain Rf4),murC,458,PTHR43445:SF3,UDP-N-ACETYLMURAMATE--L-ALANINE LIGASE,True
A5GHN9,UDP-N-acetylmuramate--L-alanine ligase,protein,32051,Synechococcus sp. (strain WH7803),Synechococcus sp. (strain WH7803),murC,486,PTHR43445:SF3,UDP-N-ACETYLMURAMATE--L-ALANINE LIGASE,True
A5GPX1,UDP-N-acetylmuramate--L-alanine ligase,protein,316278,Synechococcus sp. (strain RCC307),Synechococcus sp. (strain RCC307),murC,479,PTHR43445:SF3,UDP-N-ACETYLMURAMATE--L-ALANINE LIGASE,True
A5I7S3,UDP-N-acetylmuramate--L-alanine ligase,protein,441771,Clostridium botulinum (strain Hall / ATCC 3502 / NCTC 13319 / Type A),Clostridium botulinum (strain Hall / ATCC 3502 / NCTC 13319 / Type A),murC,458,PTHR43445:SF3,UDP-N-ACETYLMURAMATE--L-ALANINE LIGASE,True
A5IAW2,UDP-N-acetylmuramate--L-alanine ligase,protein,400673,Legionella pneumophila (strain Corby),Legionella pneumophila (strain Corby),murC,469,PTHR43445:SF3,UDP-N-ACETYLMURAMATE--L-ALANINE LIGASE,True
A5IKJ0,UDP-N-acetylmuramate--L-alanine ligase,protein,390874,Thermotoga petrophila (strain ATCC BAA-488 / DSM 13995 / JCM 10881 / RKU-1),Thermotoga petrophila (strain ATCC BAA-488 / DSM 13995 / JCM 10881 / RKU-1),murC,457,PTHR43445:SF3,UDP-N-ACETYLMURAMATE--L-ALANINE LIGASE,True
A5ITR2,UDP-N-acetylmuramate--L-alanine ligase,protein,359786,Staphylococcus aureus (strain JH9),Staphylococcus aureus (strain JH9),murC,437,PTHR43445:SF3,UDP-N-ACETYLMURAMATE--L-ALANINE LIGASE,True
A5N4I2,UDP-N-acetylmuramate--L-alanine ligase,protein,431943,Clostridium kluyveri (strain ATCC 8527 / DSM 555 / NBRC 12016 / NCIMB 10680 / K1),Clostridium kluyveri (strain ATCC 8527 / DSM 555 / NBRC 12016 / NCIMB 10680 / K1),murC,457,PTHR43445:SF3,UDP-N-ACETYLMURAMATE--L-ALANINE LIGASE,True
A5U4H9,UDP-N-acetylmuramate--L-alanine ligase,protein,419947,Mycobacterium tuberculosis (strain ATCC 25177 / H37Ra),Mycobacterium tuberculosis (strain ATCC 25177 / H37Ra),murC,494,PTHR43445:SF3,UDP-N-ACETYLMURAMATE--L-ALANINE LIGASE,True
A5UCW7,UDP-N-acetylmuramate--L-alanine ligase,protein,374930,Haemophilus influenzae (strain PittEE),Haemophilus influenzae (strain PittEE),murC,475,PTHR43445:SF3,UDP-N-ACETYLMURAMATE--L-ALANINE LIGASE,True
A5UIR3,UDP-N-acetylmuramate--L-alanine ligase,protein,374931,Haemophilus influenzae (strain PittGG),Haemophilus influenzae (strain PittGG),murC,475,PTHR43445:SF3,UDP-N-ACETYLMURAMATE--L-ALANINE LIGASE,True
A5UZT9,UDP-N-acetylmuramate--L-alanine ligase,protein,357808,Roseiflexus sp. (strain RS-1),Roseiflexus sp. (strain RS-1),murC,468,PTHR43445:SF3,UDP-N-ACETYLMURAMATE--L-ALANINE LIGASE,True
A5VDC5,UDP-N-acetylmuramate--L-alanine ligase,protein,392499,Rhizorhabdus wittichii (strain DSM 6014 / CCUG 31198 / JCM 15750 / NBRC 105917 / EY 4224 / RW1),Rhizorhabdus wittichii (strain DSM 6014 / CCUG 31198 / JCM 15750 / NBRC 105917 / EY 4224 / RW1),murC,473,PTHR43445:SF3,UDP-N-ACETYLMURAMATE--L-ALANINE LIGASE,True
A5VKY3,UDP-N-acetylmuramate--L-alanine ligase,protein,557436,Limosilactobacillus reuteri (strain DSM 20016),Limosilactobacillus reuteri (strain DSM 20016),murC,434,PTHR43445:SF3,UDP-N-ACETYLMURAMATE--L-ALANINE LIGASE,True
A5VRH6,UDP-N-acetylmuramate--L-alanine ligase,protein,444178,Brucella ovis (strain ATCC 25840 / 63/290 / NCTC 10512),Brucella ovis (strain ATCC 25840 / 63/290 / NCTC 10512),murC,471,PTHR43445:SF3,UDP-N-ACETYLMURAMATE--L-ALANINE LIGASE,True
A5W8P9,UDP-N-acetylmuramate--L-alanine ligase,protein,351746,Pseudomonas putida (strain ATCC 700007 / DSM 6899 / JCM 31910 / BCRC 17059 / LMG 24140 / F1),Pseudomonas putida (strain ATCC 700007 / DSM 6899 / JCM 31910 / BCRC 17059 / LMG 24140 / F1),murC,482,PTHR43445:SF3,UDP-N-ACETYLMURAMATE--L-ALANINE LIGASE,True
A5WCT9,UDP-N-acetylmuramate--L-alanine ligase,protein,349106,Psychrobacter sp. (strain PRwf-1),Psychrobacter sp. (strain PRwf-1),murC,476,PTHR43445:SF3,UDP-N-ACETYLMURAMATE--L-ALANINE LIGASE,True
A6H194,UDP-N-acetylmuramate--L-alanine ligase,protein,402612,Flavobacterium psychrophilum (strain ATCC 49511 / DSM 21280 / CIP 103535 / JIP02/86),Flavobacterium psychrophilum (strain ATCC 49511 / DSM 21280 / CIP 103535 / JIP02/86),murC,448,PTHR43445:SF3,UDP-N-ACETYLMURAMATE--L-ALANINE LIGASE,True
