id,name,entry_type,source_tax_id,source_tax_name,full_tax_name,gene,length,subfamily,subfamily_name,in_alphafold
Q0I1D2,UDP-N-acetylmuramate--L-alanine ligase,protein,205914,Histophilus somni (strain 129Pt),Histophilus somni (strain 129Pt),murC,476,PTHR43445:SF3,UDP-N-ACETYLMURAMATE--L-ALANINE LIGASE,True
Q0IE55,UDP-N-acetylmuramate--L-alanine ligase,protein,64471,Synechococcus sp. (strain CC9311),Synechococcus sp. (strain CC9311),murC,483,PTHR43445:SF3,UDP-N-ACETYLMURAMATE--L-ALANINE LIGASE,True
Q0K6M5,UDP-N-acetylmuramate--L-alanine ligase,protein,381666,Cupriavidus necator (strain ATCC 17699 / DSM 428 / KCTC 22496 / NCIMB 10442 / H16 / Stanier 337),Cupriavidus necator (strain ATCC 17699 / DSM 428 / KCTC 22496 / NCIMB 10442 / H16 / Stanier 337),murC,477,PTHR43445:SF3,UDP-N-ACETYLMURAMATE--L-ALANINE LIGASE,True
Q0RNN9,UDP-N-acetylmuramate--L-alanine ligase,protein,326424,Frankia alni (strain DSM 45986 / CECT 9034 / ACN14a),Frankia alni (strain DSM 45986 / CECT 9034 / ACN14a),murC,588,PTHR43445:SF3,UDP-N-ACETYLMURAMATE--L-ALANINE LIGASE,True
Q0SHS2,UDP-N-acetylmuramate--L-alanine ligase,protein,101510,Rhodococcus jostii (strain RHA1),Rhodococcus jostii (strain RHA1),murC,503,PTHR43445:SF3,UDP-N-ACETYLMURAMATE--L-ALANINE LIGASE,True
Q0SM34,UDP-N-acetylmuramate--L-alanine ligase,protein,390236,Borreliella afzelii (strain PKo),Borreliella afzelii (strain PKo),murC,468,PTHR43445:SF3,UDP-N-ACETYLMURAMATE--L-ALANINE LIGASE,True
Q0SQ58,UDP-N-acetylmuramate--L-alanine ligase,protein,289380,Clostridium perfringens (strain SM101 / Type A),Clostridium perfringens (strain SM101 / Type A),murC,457,PTHR43445:SF3,UDP-N-ACETYLMURAMATE--L-ALANINE LIGASE,True
Q0T8A6,UDP-N-acetylmuramate--L-alanine ligase,protein,373384,Shigella flexneri serotype 5b (strain 8401),Shigella flexneri serotype 5b (strain 8401),murC,491,PTHR43445:SF3,UDP-N-ACETYLMURAMATE--L-ALANINE LIGASE,True
Q0TLP8,UDP-N-acetylmuramate--L-alanine ligase,protein,362663,Escherichia coli O6:K15:H31 (strain 536 / UPEC),Escherichia coli O6:K15:H31 (strain 536 / UPEC),murC,491,PTHR43445:SF3,UDP-N-ACETYLMURAMATE--L-ALANINE LIGASE,True
Q0TMG0,UDP-N-acetylmuramate--L-alanine ligase,protein,195103,Clostridium perfringens (strain ATCC 13124 / DSM 756 / JCM 1290 / NCIMB 6125 / NCTC 8237 / Type A),Clostridium perfringens (strain ATCC 13124 / DSM 756 / JCM 1290 / NCIMB 6125 / NCTC 8237 / Type A),murC,457,PTHR43445:SF3,UDP-N-ACETYLMURAMATE--L-ALANINE LIGASE,True
Q0VS01,UDP-N-acetylmuramate--L-alanine ligase,protein,393595,Alcanivorax borkumensis (strain ATCC 700651 / DSM 11573 / NCIMB 13689 / SK2),Alcanivorax borkumensis (strain ATCC 700651 / DSM 11573 / NCIMB 13689 / SK2),murC,474,PTHR43445:SF3,UDP-N-ACETYLMURAMATE--L-ALANINE LIGASE,True
Q10XH7,UDP-N-acetylmuramate--L-alanine ligase,protein,203124,Trichodesmium erythraeum (strain IMS101),Trichodesmium erythraeum (strain IMS101),murC,539,PTHR43445:SF3,UDP-N-ACETYLMURAMATE--L-ALANINE LIGASE,True
Q11GS6,UDP-N-acetylmuramate--L-alanine ligase,protein,266779,Chelativorans sp. (strain BNC1),Chelativorans sp. (strain BNC1),murC,465,PTHR43445:SF3,UDP-N-ACETYLMURAMATE--L-ALANINE LIGASE,True
Q11RH6,UDP-N-acetylmuramate--L-alanine ligase,protein,269798,Cytophaga hutchinsonii (strain ATCC 33406 / DSM 1761 / CIP 103989 / NBRC 15051 / NCIMB 9469 / D465),Cytophaga hutchinsonii (strain ATCC 33406 / DSM 1761 / CIP 103989 / NBRC 15051 / NCIMB 9469 / D465),murC,466,PTHR43445:SF3,UDP-N-ACETYLMURAMATE--L-ALANINE LIGASE,True
Q12EL4,UDP-N-acetylmuramate--L-alanine ligase,protein,296591,Polaromonas sp. (strain JS666 / ATCC BAA-500),Polaromonas sp. (strain JS666 / ATCC BAA-500),murC,467,PTHR43445:SF3,UDP-N-ACETYLMURAMATE--L-ALANINE LIGASE,True
Q12SC5,UDP-N-acetylmuramate--L-alanine ligase,protein,318161,Shewanella denitrificans (strain OS217 / ATCC BAA-1090 / DSM 15013),Shewanella denitrificans (strain OS217 / ATCC BAA-1090 / DSM 15013),murC,479,PTHR43445:SF3,UDP-N-ACETYLMURAMATE--L-ALANINE LIGASE,True
Q133X2,UDP-N-acetylmuramate--L-alanine ligase,protein,316057,Rhodopseudomonas palustris (strain BisB5),Rhodopseudomonas palustris (strain BisB5),murC,467,PTHR43445:SF3,UDP-N-ACETYLMURAMATE--L-ALANINE LIGASE,True
Q13TZ3,UDP-N-acetylmuramate--L-alanine ligase,protein,266265,Paraburkholderia xenovorans (strain LB400),Paraburkholderia xenovorans (strain LB400),murC,467,PTHR43445:SF3,UDP-N-ACETYLMURAMATE--L-ALANINE LIGASE,True
Q14JK2,UDP-N-acetylmuramate--L-alanine ligase,protein,393115,Francisella tularensis subsp. tularensis (strain FSC 198),Francisella tularensis subsp. tularensis (strain FSC 198),murC,451,PTHR43445:SF3,UDP-N-ACETYLMURAMATE--L-ALANINE LIGASE,True
Q15Q18,UDP-N-acetylmuramate--L-alanine ligase,protein,3042615,Pseudoalteromonas atlantica (strain T6c / ATCC BAA-1087),Pseudoalteromonas atlantica (strain T6c / ATCC BAA-1087),murC,484,PTHR43445:SF3,UDP-N-ACETYLMURAMATE--L-ALANINE LIGASE,True
Q163J1,UDP-N-acetylmuramate--L-alanine ligase,protein,375451,Roseobacter denitrificans (strain ATCC 33942 / OCh 114),Roseobacter denitrificans (strain ATCC 33942 / OCh 114) (Erythrobacter sp. (strain OCh 114)),murC,468,PTHR43445:SF3,UDP-N-ACETYLMURAMATE--L-ALANINE LIGASE,True
Q181B7,UDP-N-acetylmuramate--L-alanine ligase,protein,272563,Clostridioides difficile (strain 630),Clostridioides difficile (strain 630),murC,450,PTHR43445:SF3,UDP-N-ACETYLMURAMATE--L-ALANINE LIGASE,True
Q1AVX4,UDP-N-acetylmuramate--L-alanine ligase,protein,266117,Rubrobacter xylanophilus (strain DSM 9941 / JCM 11954 / NBRC 16129 / PRD-1),Rubrobacter xylanophilus (strain DSM 9941 / JCM 11954 / NBRC 16129 / PRD-1),murC,447,PTHR43445:SF3,UDP-N-ACETYLMURAMATE--L-ALANINE LIGASE,True
Q1B6X2,UDP-N-acetylmuramate--L-alanine ligase,protein,164756,Mycobacterium sp. (strain MCS),Mycobacterium sp. (strain MCS),murC,484,PTHR43445:SF3,UDP-N-ACETYLMURAMATE--L-ALANINE LIGASE,True
Q1BZG2,UDP-N-acetylmuramate--L-alanine ligase,protein,331271,Burkholderia orbicola (strain AU 1054),Burkholderia orbicola (strain AU 1054),murC,465,PTHR43445:SF3,UDP-N-ACETYLMURAMATE--L-ALANINE LIGASE,True
Q1C215,UDP-N-acetylmuramate--L-alanine ligase,protein,360102,Yersinia pestis bv. Antiqua (strain Antiqua),Yersinia pestis bv. Antiqua (strain Antiqua),murC,491,PTHR43445:SF3,UDP-N-ACETYLMURAMATE--L-ALANINE LIGASE,True
Q1CMM6,UDP-N-acetylmuramate--L-alanine ligase,protein,377628,Yersinia pestis bv. Antiqua (strain Nepal516),Yersinia pestis bv. Antiqua (strain Nepal516),murC,491,PTHR43445:SF3,UDP-N-ACETYLMURAMATE--L-ALANINE LIGASE,True
Q1CTP9,UDP-N-acetylmuramate--L-alanine ligase,protein,357544,Helicobacter pylori (strain HPAG1),Helicobacter pylori (strain HPAG1),murC,449,PTHR43445:SF3,UDP-N-ACETYLMURAMATE--L-ALANINE LIGASE,True
Q1D0T1,UDP-N-acetylmuramate--L-alanine ligase,protein,246197,Myxococcus xanthus (strain DK1622),Myxococcus xanthus (strain DK1622),murC,472,PTHR43445:SF3,UDP-N-ACETYLMURAMATE--L-ALANINE LIGASE,True
Q1G9A0,UDP-N-acetylmuramate--L-alanine ligase,protein,390333,Lactobacillus delbrueckii subsp. bulgaricus (strain ATCC 11842 / DSM 20081 / BCRC 10696 / JCM 1002 / NBRC 13953 / NCIMB 11778 / NCTC 12712 / WDCM 00102 / Lb 14),Lactobacillus delbrueckii subsp. bulgaricus (strain ATCC 11842 / DSM 20081 / BCRC 10696 / JCM 1002 / NBRC 13953 / NCIMB 11778 / NCTC 12712 / WDCM 00102 / Lb 14),murC,439,PTHR43445:SF3,UDP-N-ACETYLMURAMATE--L-ALANINE LIGASE,True
Q1GIV0,UDP-N-acetylmuramate--L-alanine ligase,protein,292414,Ruegeria sp. (strain TM1040),Ruegeria sp. (strain TM1040),murC,469,PTHR43445:SF3,UDP-N-ACETYLMURAMATE--L-ALANINE LIGASE,True
Q1GRY0,UDP-N-acetylmuramate--L-alanine ligase,protein,317655,Sphingopyxis alaskensis (strain DSM 13593 / LMG 18877 / RB2256),Sphingopyxis alaskensis (strain DSM 13593 / LMG 18877 / RB2256),murC,477,PTHR43445:SF3,UDP-N-ACETYLMURAMATE--L-ALANINE LIGASE,True
Q1GZ02,UDP-N-acetylmuramate--L-alanine ligase,protein,265072,Methylobacillus flagellatus (strain ATCC 51484 / DSM 6875 / VKM B-1610 / KT),Methylobacillus flagellatus (strain ATCC 51484 / DSM 6875 / VKM B-1610 / KT),murC,475,PTHR43445:SF3,UDP-N-ACETYLMURAMATE--L-ALANINE LIGASE,True
Q1I5B9,UDP-N-acetylmuramate--L-alanine ligase,protein,384676,Pseudomonas entomophila (strain L48),Pseudomonas entomophila (strain L48),murC,482,PTHR43445:SF3,UDP-N-ACETYLMURAMATE--L-ALANINE LIGASE,True
Q1IKH1,UDP-N-acetylmuramate--L-alanine ligase,protein,204669,Koribacter versatilis (strain Ellin345),Koribacter versatilis (strain Ellin345),murC,468,PTHR43445:SF3,UDP-N-ACETYLMURAMATE--L-ALANINE LIGASE,True
Q1IXV8,UDP-N-acetylmuramate--L-alanine ligase,protein,319795,Deinococcus geothermalis (strain DSM 11300 / CIP 105573 / AG-3a),Deinococcus geothermalis (strain DSM 11300 / CIP 105573 / AG-3a),murC,465,PTHR43445:SF3,UDP-N-ACETYLMURAMATE--L-ALANINE LIGASE,True
Q1J8C6,UDP-N-acetylmuramate--L-alanine ligase,protein,370554,Streptococcus pyogenes serotype M4 (strain MGAS10750),Streptococcus pyogenes serotype M4 (strain MGAS10750),murC,442,PTHR43445:SF3,UDP-N-ACETYLMURAMATE--L-ALANINE LIGASE,True
Q1JDE8,UDP-N-acetylmuramate--L-alanine ligase,protein,370553,Streptococcus pyogenes serotype M12 (strain MGAS2096),Streptococcus pyogenes serotype M12 (strain MGAS2096),murC,442,PTHR43445:SF3,UDP-N-ACETYLMURAMATE--L-ALANINE LIGASE,True
Q1JIH1,UDP-N-acetylmuramate--L-alanine ligase,protein,370552,Streptococcus pyogenes serotype M2 (strain MGAS10270),Streptococcus pyogenes serotype M2 (strain MGAS10270),murC,442,PTHR43445:SF3,UDP-N-ACETYLMURAMATE--L-ALANINE LIGASE,True
Q1JNC1,UDP-N-acetylmuramate--L-alanine ligase,protein,370551,Streptococcus pyogenes serotype M12 (strain MGAS9429),Streptococcus pyogenes serotype M12 (strain MGAS9429),murC,442,PTHR43445:SF3,UDP-N-ACETYLMURAMATE--L-ALANINE LIGASE,True
Q1LIM7,UDP-N-acetylmuramate--L-alanine ligase,protein,266264,Cupriavidus metallidurans (strain ATCC 43123 / DSM 2839 / NBRC 102507 / CH34),Cupriavidus metallidurans (strain ATCC 43123 / DSM 2839 / NBRC 102507 / CH34),murC,471,PTHR43445:SF3,UDP-N-ACETYLMURAMATE--L-ALANINE LIGASE,True
Q1LSW6,UDP-N-acetylmuramate--L-alanine ligase,protein,374463,Baumannia cicadellinicola subsp. Homalodisca coagulata,Baumannia cicadellinicola subsp. Homalodisca coagulata,murC,490,PTHR43445:SF3,UDP-N-ACETYLMURAMATE--L-ALANINE LIGASE,True
Q1ME34,UDP-N-acetylmuramate--L-alanine ligase,protein,216596,Rhizobium johnstonii (strain DSM 114642 / LMG 32736 / 3841),Rhizobium johnstonii (strain DSM 114642 / LMG 32736 / 3841),murC,471,PTHR43445:SF3,UDP-N-ACETYLMURAMATE--L-ALANINE LIGASE,True
Q1MPB8,UDP-N-acetylmuramate--L-alanine ligase,protein,363253,Lawsonia intracellularis (strain PHE/MN1-00),Lawsonia intracellularis (strain PHE/MN1-00),murC,453,PTHR43445:SF3,UDP-N-ACETYLMURAMATE--L-ALANINE LIGASE,True
Q1Q945,UDP-N-acetylmuramate--L-alanine ligase,protein,335284,Psychrobacter cryohalolentis (strain ATCC BAA-1226 / DSM 17306 / VKM B-2378 / K5),Psychrobacter cryohalolentis (strain ATCC BAA-1226 / DSM 17306 / VKM B-2378 / K5),murC,479,PTHR43445:SF3,UDP-N-ACETYLMURAMATE--L-ALANINE LIGASE,True
Q1QNU2,UDP-N-acetylmuramate--L-alanine ligase,protein,323097,Nitrobacter hamburgensis (strain DSM 10229 / NCIMB 13809 / X14),Nitrobacter hamburgensis (strain DSM 10229 / NCIMB 13809 / X14),murC,467,PTHR43445:SF3,UDP-N-ACETYLMURAMATE--L-ALANINE LIGASE,True
Q1QVG8,UDP-N-acetylmuramate--L-alanine ligase,protein,290398,Chromohalobacter israelensis (strain ATCC BAA-138 / DSM 3043 / CIP 106854 / NCIMB 13768 / 1H11),Chromohalobacter israelensis (strain ATCC BAA-138 / DSM 3043 / CIP 106854 / NCIMB 13768 / 1H11),murC,488,PTHR43445:SF3,UDP-N-ACETYLMURAMATE--L-ALANINE LIGASE,True
Q1RGA4,UDP-N-acetylmuramate--L-alanine ligase,protein,364106,Escherichia coli (strain UTI89 / UPEC),Escherichia coli (strain UTI89 / UPEC),murC,491,PTHR43445:SF3,UDP-N-ACETYLMURAMATE--L-ALANINE LIGASE,True
Q1RHX0,UDP-N-acetylmuramate--L-alanine ligase,protein,336407,Rickettsia bellii (strain RML369-C),Rickettsia bellii (strain RML369-C),murC,478,PTHR43445:SF3,UDP-N-ACETYLMURAMATE--L-ALANINE LIGASE,True
Q1WUP1,UDP-N-acetylmuramate--L-alanine ligase,protein,362948,Ligilactobacillus salivarius (strain UCC118),Ligilactobacillus salivarius (strain UCC118),murC,443,PTHR43445:SF3,UDP-N-ACETYLMURAMATE--L-ALANINE LIGASE,True
Q211T9,UDP-N-acetylmuramate--L-alanine ligase,protein,316056,Rhodopseudomonas palustris (strain BisB18),Rhodopseudomonas palustris (strain BisB18),murC,467,PTHR43445:SF3,UDP-N-ACETYLMURAMATE--L-ALANINE LIGASE,True
Q21MG8,UDP-N-acetylmuramate--L-alanine ligase,protein,203122,Saccharophagus degradans (strain 2-40 / ATCC 43961 / DSM 17024),Saccharophagus degradans (strain 2-40 / ATCC 43961 / DSM 17024),murC,474,PTHR43445:SF3,UDP-N-ACETYLMURAMATE--L-ALANINE LIGASE,True
Q21SX0,UDP-N-acetylmuramate--L-alanine ligase,protein,338969,Albidiferax ferrireducens (strain ATCC BAA-621 / DSM 15236 / T118),Albidiferax ferrireducens (strain ATCC BAA-621 / DSM 15236 / T118),murC,477,PTHR43445:SF3,UDP-N-ACETYLMURAMATE--L-ALANINE LIGASE,True
Q24ZG1,UDP-N-acetylmuramate--L-alanine ligase,protein,138119,Desulfitobacterium hafniense (strain Y51),Desulfitobacterium hafniense (strain Y51),murC,449,PTHR43445:SF3,UDP-N-ACETYLMURAMATE--L-ALANINE LIGASE,True
Q28NN6,UDP-N-acetylmuramate--L-alanine ligase,protein,290400,Jannaschia sp. (strain CCS1),Jannaschia sp. (strain CCS1),murC,474,PTHR43445:SF3,UDP-N-ACETYLMURAMATE--L-ALANINE LIGASE,True
Q2A5N4,UDP-N-acetylmuramate--L-alanine ligase,protein,376619,Francisella tularensis subsp. holarctica (strain LVS),Francisella tularensis subsp. holarctica (strain LVS),murC,451,PTHR43445:SF3,UDP-N-ACETYLMURAMATE--L-ALANINE LIGASE,True
Q2FFZ8,UDP-N-acetylmuramate--L-alanine ligase,protein,367830,Staphylococcus aureus (strain USA300),Staphylococcus aureus (strain USA300),murC,437,PTHR43445:SF3,UDP-N-ACETYLMURAMATE--L-ALANINE LIGASE,True
Q2FXJ0,UDP-N-acetylmuramate--L-alanine ligase,protein,93061,Staphylococcus aureus (strain NCTC 8325 / PS 47),Staphylococcus aureus (strain NCTC 8325 / PS 47),murC,437,PTHR43445:SF3,UDP-N-ACETYLMURAMATE--L-ALANINE LIGASE,True
Q2G994,UDP-N-acetylmuramate--L-alanine ligase,protein,279238,Novosphingobium aromaticivorans (strain ATCC 700278 / DSM 12444 / CCUG 56034 / CIP 105152 / NBRC 16084 / F199),Novosphingobium aromaticivorans (strain ATCC 700278 / DSM 12444 / CCUG 56034 / CIP 105152 / NBRC 16084 / F199),murC,474,PTHR43445:SF3,UDP-N-ACETYLMURAMATE--L-ALANINE LIGASE,True
Q2IG30,UDP-N-acetylmuramate--L-alanine ligase,protein,290397,Anaeromyxobacter dehalogenans (strain 2CP-C),Anaeromyxobacter dehalogenans (strain 2CP-C),murC,458,PTHR43445:SF3,UDP-N-ACETYLMURAMATE--L-ALANINE LIGASE,True
Q2IYK6,UDP-N-acetylmuramate--L-alanine ligase,protein,316058,Rhodopseudomonas palustris (strain HaA2),Rhodopseudomonas palustris (strain HaA2),murC,468,PTHR43445:SF3,UDP-N-ACETYLMURAMATE--L-ALANINE LIGASE,True
Q2JD48,UDP-N-acetylmuramate--L-alanine ligase,protein,106370,Frankia casuarinae (strain DSM 45818 / CECT 9043 / HFP020203 / CcI3),Frankia casuarinae (strain DSM 45818 / CECT 9043 / HFP020203 / CcI3),murC,502,PTHR43445:SF3,UDP-N-ACETYLMURAMATE--L-ALANINE LIGASE,True
Q2JL88,UDP-N-acetylmuramate--L-alanine ligase,protein,321332,Synechococcus sp. (strain JA-2-3B'a(2-13)),Synechococcus sp. (strain JA-2-3B'a(2-13)),murC,478,PTHR43445:SF3,UDP-N-ACETYLMURAMATE--L-ALANINE LIGASE,True
Q2JTH3,UDP-N-acetylmuramate--L-alanine ligase,protein,321327,Synechococcus sp. (strain JA-3-3Ab),Synechococcus sp. (strain JA-3-3Ab),murC,510,PTHR43445:SF3,UDP-N-ACETYLMURAMATE--L-ALANINE LIGASE,True
Q2K6C2,UDP-N-acetylmuramate--L-alanine ligase,protein,347834,Rhizobium etli (strain ATCC 51251 / DSM 11541 / JCM 21823 / NBRC 15573 / CFN 42),Rhizobium etli (strain ATCC 51251 / DSM 11541 / JCM 21823 / NBRC 15573 / CFN 42),murC,471,PTHR43445:SF3,UDP-N-ACETYLMURAMATE--L-ALANINE LIGASE,True
Q2KVG1,UDP-N-acetylmuramate--L-alanine ligase,protein,360910,Bordetella avium (strain 197N),Bordetella avium (strain 197N),murC,468,PTHR43445:SF3,UDP-N-ACETYLMURAMATE--L-ALANINE LIGASE,True
Q2LR47,UDP-N-acetylmuramate--L-alanine ligase,protein,56780,Syntrophus aciditrophicus (strain SB),Syntrophus aciditrophicus (strain SB),murC,480,PTHR43445:SF3,UDP-N-ACETYLMURAMATE--L-ALANINE LIGASE,True
Q2NCY9,UDP-N-acetylmuramate--L-alanine ligase,protein,314225,Erythrobacter litoralis (strain HTCC2594),Erythrobacter litoralis (strain HTCC2594),murC,474,PTHR43445:SF3,UDP-N-ACETYLMURAMATE--L-ALANINE LIGASE,True
Q2NVV0,UDP-N-acetylmuramate--L-alanine ligase,protein,343509,Sodalis glossinidius (strain morsitans),Sodalis glossinidius (strain morsitans),murC,490,PTHR43445:SF3,UDP-N-ACETYLMURAMATE--L-ALANINE LIGASE,True
Q2NZB9,UDP-N-acetylmuramate--L-alanine ligase,protein,342109,Xanthomonas oryzae pv. oryzae (strain MAFF 311018),Xanthomonas oryzae pv. oryzae (strain MAFF 311018),murC,477,PTHR43445:SF3,UDP-N-ACETYLMURAMATE--L-ALANINE LIGASE,True
Q2RK78,UDP-N-acetylmuramate--L-alanine ligase,protein,264732,Moorella thermoacetica (strain ATCC 39073 / JCM 9320),Moorella thermoacetica (strain ATCC 39073 / JCM 9320),murC,468,PTHR43445:SF3,UDP-N-ACETYLMURAMATE--L-ALANINE LIGASE,True
Q2RVU5,UDP-N-acetylmuramate--L-alanine ligase,protein,269796,Rhodospirillum rubrum (strain ATCC 11170 / ATH 1.1.1 / DSM 467 / LMG 4362 / NCIMB 8255 / S1),Rhodospirillum rubrum (strain ATCC 11170 / ATH 1.1.1 / DSM 467 / LMG 4362 / NCIMB 8255 / S1),murC,481,PTHR43445:SF3,UDP-N-ACETYLMURAMATE--L-ALANINE LIGASE,True
Q2S527,UDP-N-acetylmuramate--L-alanine ligase,protein,309807,Salinibacter ruber (strain DSM 13855 / M31),Salinibacter ruber (strain DSM 13855 / M31),murC,475,PTHR43445:SF3,UDP-N-ACETYLMURAMATE--L-ALANINE LIGASE,True
Q2S9Z3,UDP-N-acetylmuramate--L-alanine ligase,protein,349521,Hahella chejuensis (strain KCTC 2396),Hahella chejuensis (strain KCTC 2396),murC,472,PTHR43445:SF3,UDP-N-ACETYLMURAMATE--L-ALANINE LIGASE,True
Q2SZI2,UDP-N-acetylmuramate--L-alanine ligase,protein,271848,Burkholderia thailandensis (strain ATCC 700388 / DSM 13276 / CCUG 48851 / CIP 106301 / E264),Burkholderia thailandensis (strain ATCC 700388 / DSM 13276 / CCUG 48851 / CIP 106301 / E264),murC,465,PTHR43445:SF3,UDP-N-ACETYLMURAMATE--L-ALANINE LIGASE,True
Q2W0H2,UDP-N-acetylmuramate--L-alanine ligase,protein,342108,Paramagnetospirillum magneticum (strain ATCC 700264 / AMB-1),Paramagnetospirillum magneticum (strain ATCC 700264 / AMB-1),murC,476,PTHR43445:SF3,UDP-N-ACETYLMURAMATE--L-ALANINE LIGASE,True
Q2Y639,UDP-N-acetylmuramate--L-alanine ligase,protein,323848,Nitrosospira multiformis (strain ATCC 25196 / NCIMB 11849 / C 71),Nitrosospira multiformis (strain ATCC 25196 / NCIMB 11849 / C 71),murC,493,PTHR43445:SF3,UDP-N-ACETYLMURAMATE--L-ALANINE LIGASE,True
Q2YLY6,UDP-N-acetylmuramate--L-alanine ligase,protein,359391,Brucella abortus (strain 2308),Brucella abortus (strain 2308),murC,471,PTHR43445:SF3,UDP-N-ACETYLMURAMATE--L-ALANINE LIGASE,True
Q313Q2,UDP-N-acetylmuramate--L-alanine ligase,protein,207559,Oleidesulfovibrio alaskensis (strain ATCC BAA-1058 / DSM 17464 / G20),Oleidesulfovibrio alaskensis (strain ATCC BAA-1058 / DSM 17464 / G20),murC,454,PTHR43445:SF3,UDP-N-ACETYLMURAMATE--L-ALANINE LIGASE,True
Q31I43,UDP-N-acetylmuramate--L-alanine ligase,protein,317025,Hydrogenovibrio crunogenus (strain DSM 25203 / XCL-2),Hydrogenovibrio crunogenus (strain DSM 25203 / XCL-2),murC,461,PTHR43445:SF3,UDP-N-ACETYLMURAMATE--L-ALANINE LIGASE,True
Q326E4,UDP-N-acetylmuramate--L-alanine ligase,protein,300268,Shigella boydii serotype 4 (strain Sb227),Shigella boydii serotype 4 (strain Sb227),murC,491,PTHR43445:SF3,UDP-N-ACETYLMURAMATE--L-ALANINE LIGASE,True
Q32K01,UDP-N-acetylmuramate--L-alanine ligase,protein,300267,Shigella dysenteriae serotype 1 (strain Sd197),Shigella dysenteriae serotype 1 (strain Sd197),murC,491,PTHR43445:SF3,UDP-N-ACETYLMURAMATE--L-ALANINE LIGASE,True
Q38XY8,UDP-N-acetylmuramate--L-alanine ligase,protein,314315,Latilactobacillus sakei subsp. sakei (strain 23K),Latilactobacillus sakei subsp. sakei (strain 23K),murC,444,PTHR43445:SF3,UDP-N-ACETYLMURAMATE--L-ALANINE LIGASE,True
Q39JW9,UDP-N-acetylmuramate--L-alanine ligase,protein,482957,Burkholderia lata (strain ATCC 17760 / DSM 23089 / LMG 22485 / NCIMB 9086 / R18194 / 383),Burkholderia lata (strain ATCC 17760 / DSM 23089 / LMG 22485 / NCIMB 9086 / R18194 / 383),murC,465,PTHR43445:SF3,UDP-N-ACETYLMURAMATE--L-ALANINE LIGASE,True
Q39YL8,UDP-N-acetylmuramate--L-alanine ligase,protein,269799,Geobacter metallireducens (strain ATCC 53774 / DSM 7210 / GS-15),Geobacter metallireducens (strain ATCC 53774 / DSM 7210 / GS-15),murC,461,PTHR43445:SF3,UDP-N-ACETYLMURAMATE--L-ALANINE LIGASE,True
Q3A2G7,UDP-N-acetylmuramate--L-alanine ligase,protein,338963,Syntrophotalea carbinolica (strain DSM 2380 / NBRC 103641 / GraBd1),Syntrophotalea carbinolica (strain DSM 2380 / NBRC 103641 / GraBd1),murC,458,PTHR43445:SF3,UDP-N-ACETYLMURAMATE--L-ALANINE LIGASE,True
Q3AAE7,UDP-N-acetylmuramate--L-alanine ligase,protein,246194,Carboxydothermus hydrogenoformans (strain ATCC BAA-161 / DSM 6008 / Z-2901),Carboxydothermus hydrogenoformans (strain ATCC BAA-161 / DSM 6008 / Z-2901),murC,464,PTHR43445:SF3,UDP-N-ACETYLMURAMATE--L-ALANINE LIGASE,True
Q3ANM4,UDP-N-acetylmuramate--L-alanine ligase,protein,110662,Synechococcus sp. (strain CC9605),Synechococcus sp. (strain CC9605),murC,469,PTHR43445:SF3,UDP-N-ACETYLMURAMATE--L-ALANINE LIGASE,True
Q3ANV2,UDP-N-acetylmuramate--L-alanine ligase,protein,340177,Chlorobium chlorochromatii (strain CaD3),Chlorobium chlorochromatii (strain CaD3),murC,467,PTHR43445:SF3,UDP-N-ACETYLMURAMATE--L-ALANINE LIGASE,True
Q3B0X8,UDP-N-acetylmuramate--L-alanine ligase,protein,316279,Synechococcus sp. (strain CC9902),Synechococcus sp. (strain CC9902),murC,468,PTHR43445:SF3,UDP-N-ACETYLMURAMATE--L-ALANINE LIGASE,True
Q3B130,UDP-N-acetylmuramate--L-alanine ligase,protein,319225,Chlorobium luteolum (strain DSM 273 / BCRC 81028 / 2530),Chlorobium luteolum (strain DSM 273 / BCRC 81028 / 2530),murC,473,PTHR43445:SF3,UDP-N-ACETYLMURAMATE--L-ALANINE LIGASE,True
Q3BXF1,UDP-N-acetylmuramate--L-alanine ligase,protein,316273,Xanthomonas euvesicatoria pv. vesicatoria (strain 85-10),Xanthomonas euvesicatoria pv. vesicatoria (strain 85-10),murC,477,PTHR43445:SF3,UDP-N-ACETYLMURAMATE--L-ALANINE LIGASE,True
Q3IFY1,UDP-N-acetylmuramate--L-alanine ligase,protein,326442,Pseudoalteromonas translucida (strain TAC 125),Pseudoalteromonas translucida (strain TAC 125),murC,483,PTHR43445:SF3,UDP-N-ACETYLMURAMATE--L-ALANINE LIGASE,True
Q3J4M1,UDP-N-acetylmuramate--L-alanine ligase,protein,272943,Cereibacter sphaeroides (strain ATCC 17023 / DSM 158 / JCM 6121 / CCUG 31486 / LMG 2827 / NBRC 12203 / NCIMB 8253 / ATH 2.4.1.),Cereibacter sphaeroides (strain ATCC 17023 / DSM 158 / JCM 6121 / CCUG 31486 / LMG 2827 / NBRC 12203 / NCIMB 8253 / ATH 2.4.1.),murC,470,PTHR43445:SF3,UDP-N-ACETYLMURAMATE--L-ALANINE LIGASE,True
Q3J790,UDP-N-acetylmuramate--L-alanine ligase,protein,323261,Nitrosococcus oceani (strain ATCC 19707 / BCRC 17464 / JCM 30415 / NCIMB 11848 / C-107),Nitrosococcus oceani (strain ATCC 19707 / BCRC 17464 / JCM 30415 / NCIMB 11848 / C-107),murC,476,PTHR43445:SF3,UDP-N-ACETYLMURAMATE--L-ALANINE LIGASE,True
Q3JND9,UDP-N-acetylmuramate--L-alanine ligase,protein,320372,Burkholderia pseudomallei (strain 1710b),Burkholderia pseudomallei (strain 1710b),murC,465,PTHR43445:SF3,UDP-N-ACETYLMURAMATE--L-ALANINE LIGASE,True
Q3JZS0,UDP-N-acetylmuramate--L-alanine ligase,protein,205921,Streptococcus agalactiae serotype Ia (strain ATCC 27591 / A909 / CDC SS700),Streptococcus agalactiae serotype Ia (strain ATCC 27591 / A909 / CDC SS700),murC,443,PTHR43445:SF3,UDP-N-ACETYLMURAMATE--L-ALANINE LIGASE,True
Q3K745,UDP-N-acetylmuramate--L-alanine ligase,protein,205922,Pseudomonas fluorescens (strain Pf0-1),Pseudomonas fluorescens (strain Pf0-1),murC,486,PTHR43445:SF3,UDP-N-ACETYLMURAMATE--L-ALANINE LIGASE,True
Q3MAP8,UDP-N-acetylmuramate--L-alanine ligase,protein,240292,Trichormus variabilis (strain ATCC 29413 / PCC 7937),Trichormus variabilis (strain ATCC 29413 / PCC 7937),murC,494,PTHR43445:SF3,UDP-N-ACETYLMURAMATE--L-ALANINE LIGASE,True
Q3SMH2,UDP-N-acetylmuramate--L-alanine ligase,protein,292415,Thiobacillus denitrificans (strain ATCC 25259 / T1),Thiobacillus denitrificans (strain ATCC 25259 / T1),murC,463,PTHR43445:SF3,UDP-N-ACETYLMURAMATE--L-ALANINE LIGASE,True
Q3STS7,UDP-N-acetylmuramate--L-alanine ligase,protein,323098,Nitrobacter winogradskyi (strain ATCC 25391 / DSM 10237 / CIP 104748 / NCIMB 11846 / Nb-255),Nitrobacter winogradskyi (strain ATCC 25391 / DSM 10237 / CIP 104748 / NCIMB 11846 / Nb-255),murC,467,PTHR43445:SF3,UDP-N-ACETYLMURAMATE--L-ALANINE LIGASE,True
Q3Z5R8,UDP-N-acetylmuramate--L-alanine ligase,protein,300269,Shigella sonnei (strain Ss046),Shigella sonnei (strain Ss046),murC,491,PTHR43445:SF3,UDP-N-ACETYLMURAMATE--L-ALANINE LIGASE,True
Q46I40,UDP-N-acetylmuramate--L-alanine ligase,protein,59920,Prochlorococcus marinus (strain NATL2A),Prochlorococcus marinus (strain NATL2A),murC,494,PTHR43445:SF3,UDP-N-ACETYLMURAMATE--L-ALANINE LIGASE,True
Q46WZ5,UDP-N-acetylmuramate--L-alanine ligase,protein,264198,Cupriavidus pinatubonensis (strain JMP 134 / LMG 1197),Cupriavidus pinatubonensis (strain JMP 134 / LMG 1197),murC,475,PTHR43445:SF3,UDP-N-ACETYLMURAMATE--L-ALANINE LIGASE,True
Q47AA5,UDP-N-acetylmuramate--L-alanine ligase,protein,159087,Dechloromonas aromatica (strain RCB),Dechloromonas aromatica (strain RCB),murC,463,PTHR43445:SF3,UDP-N-ACETYLMURAMATE--L-ALANINE LIGASE,True
Q47QW8,UDP-N-acetylmuramate--L-alanine ligase,protein,269800,Thermobifida fusca (strain YX),Thermobifida fusca (strain YX),murC,472,PTHR43445:SF3,UDP-N-ACETYLMURAMATE--L-ALANINE LIGASE,True
Q47VR0,UDP-N-acetylmuramate--L-alanine ligase,protein,167879,Colwellia psychrerythraea (strain 34H / ATCC BAA-681),Colwellia psychrerythraea (strain 34H / ATCC BAA-681),murC,503,PTHR43445:SF3,UDP-N-ACETYLMURAMATE--L-ALANINE LIGASE,True
