id,name,entry_type,source_tax_id,source_tax_name,full_tax_name,gene,length,subfamily,subfamily_name,in_alphafold
P64429,Uncharacterized protein YpfJ,protein,83333,Escherichia coli (strain K12),Escherichia coli (strain K12),ypfJ,287,PTHR30168:SF0,INNER MEMBRANE PROTEIN,True
P64430,Uncharacterized protein YpfJ,protein,199310,Escherichia coli O6:H1 (strain CFT073 / ATCC 700928 / UPEC),Escherichia coli O6:H1 (strain CFT073 / ATCC 700928 / UPEC),ypfJ,287,PTHR30168:SF0,INNER MEMBRANE PROTEIN,True
P64431,Uncharacterized protein YpfJ,protein,83334,Escherichia coli O157:H7,Escherichia coli O157:H7,ypfJ,287,PTHR30168:SF0,INNER MEMBRANE PROTEIN,True
P65020,Uncharacterized protein Mb2605,protein,233413,Mycobacterium bovis (strain ATCC BAA-935 / AF2122/97),Mycobacterium bovis (strain ATCC BAA-935 / AF2122/97),BQ2027_MB2605,293,PTHR30168:SF0,INNER MEMBRANE PROTEIN,True
P9WL84,Uncharacterized protein MT2651,protein,83331,Mycobacterium tuberculosis (strain CDC 1551 / Oshkosh),Mycobacterium tuberculosis (strain CDC 1551 / Oshkosh),MT2651,293,PTHR30168:SF0,INNER MEMBRANE PROTEIN,True
P9WL85,Uncharacterized protein Rv2575,protein,83332,Mycobacterium tuberculosis (strain ATCC 25618 / H37Rv),Mycobacterium tuberculosis (strain ATCC 25618 / H37Rv),Rv2575,293,PTHR30168:SF0,INNER MEMBRANE PROTEIN,True
