id,name,entry_type,source_tax_id,source_tax_name,full_tax_name,gene,length,subfamily,subfamily_name,in_alphafold
A0A348AXY1,Delta-1-pyrroline-5-carboxylate reductase kk1I,protein,95742,Curvularia clavata,Curvularia clavata,kk1I,311,PTHR11645:SF0,PYRROLINE-5-CARBOXYLATE REDUCTASE 3,True
A0A411KUQ8,Pyrroline-5-carboxylate reductase ucsG,protein,2046025,Acremonium sp.,Acremonium sp.,ucsG,318,PTHR11645:SF0,PYRROLINE-5-CARBOXYLATE REDUCTASE 3,True
A0A8B0M9S9,Pyrroline-5-carboxylate reductase 2,protein,37994,Amphichorda felina,Amphichorda felina,p5cr2,313,PTHR11645:SF0,PYRROLINE-5-CARBOXYLATE REDUCTASE 3,True
A0A8B0M9T7,Pyrroline-5-carboxylate reductase 1,protein,37994,Amphichorda felina,Amphichorda felina,p5cr1,287,PTHR11645:SF65,HYPOTHETICAL PYRROLINE-5-CARBOXYLATE REDUCTASE (EUROFUNG),True
A0JM24,NADP-dependent oxidoreductase domain-containing protein 1,protein,8364,Xenopus tropicalis,Xenopus tropicalis (Western clawed frog),noxred1,344,PTHR11645:SF58,NADP-DEPENDENT OXIDOREDUCTASE DOMAIN-CONTAINING PROTEIN 1,True
A1L2Q8,Pyrroline-5-carboxylate reductase 3,protein,8355,Xenopus laevis,Xenopus laevis (African clawed frog),pycr3,274,PTHR11645:SF0,PYRROLINE-5-CARBOXYLATE REDUCTASE 3,True
A4G064,"5,10-methenyltetrahydromethanopterin hydrogenase",protein,402880,Methanococcus maripaludis (strain C5 / ATCC BAA-1333),Methanococcus maripaludis (strain C5 / ATCC BAA-1333),hmd,354,PTHR11645:SF0,PYRROLINE-5-CARBOXYLATE REDUCTASE 3,True
A6URB0,"5,10-methenyltetrahydromethanopterin hydrogenase",protein,406327,Methanococcus vannielii (strain ATCC 35089 / DSM 1224 / JCM 13029 / OCM 148 / SB),Methanococcus vannielii (strain ATCC 35089 / DSM 1224 / JCM 13029 / OCM 148 / SB),hmd,354,PTHR11645:SF0,PYRROLINE-5-CARBOXYLATE REDUCTASE 3,True
A6VIB6,"5,10-methenyltetrahydromethanopterin hydrogenase",protein,426368,Methanococcus maripaludis (strain C7 / ATCC BAA-1331),Methanococcus maripaludis (strain C7 / ATCC BAA-1331),hmd,354,PTHR11645:SF0,PYRROLINE-5-CARBOXYLATE REDUCTASE 3,True
E0TY11,Pyrroline-5-carboxylate reductase 1,protein,655816,Bacillus spizizenii (strain ATCC 23059 / NRRL B-14472 / W23),Bacillus spizizenii (strain ATCC 23059 / NRRL B-14472 / W23),proH,297,PTHR11645:SF49,PYRROLINE-5-CARBOXYLATE REDUCTASE 1,True
L0E163,Pyrroline-5-carboxylate reductase,protein,70095,Penicillium fellutanum,Penicillium fellutanum,phqD,322,PTHR11645:SF0,PYRROLINE-5-CARBOXYLATE REDUCTASE 3,True
O04016,Pyrroline-5-carboxylate reductase,protein,1590841,Actinidia chinensis var. chinensis,Actinidia chinensis var. chinensis (Chinese soft-hair kiwi),CEY00_Acc23110,278,PTHR11645:SF0,PYRROLINE-5-CARBOXYLATE REDUCTASE 3,True
O25773,Pyrroline-5-carboxylate reductase,protein,85962,Helicobacter pylori (strain ATCC 700392 / 26695),Helicobacter pylori (strain ATCC 700392 / 26695),proC,257,PTHR11645:SF0,PYRROLINE-5-CARBOXYLATE REDUCTASE 3,True
O66553,Pyrroline-5-carboxylate reductase,protein,224324,Aquifex aeolicus (strain VF5),Aquifex aeolicus (strain VF5),proC,265,PTHR11645:SF0,PYRROLINE-5-CARBOXYLATE REDUCTASE 3,True
P0A9L8,Pyrroline-5-carboxylate reductase,protein,83333,Escherichia coli (strain K12),Escherichia coli (strain K12),proC,269,PTHR11645:SF0,PYRROLINE-5-CARBOXYLATE REDUCTASE 3,True
P0A9L9,Pyrroline-5-carboxylate reductase,protein,623,Shigella flexneri,Shigella flexneri,proC,269,PTHR11645:SF0,PYRROLINE-5-CARBOXYLATE REDUCTASE 3,True
P0C1E4,Pyrroline-5-carboxylate reductase,protein,196627,Corynebacterium glutamicum (strain ATCC 13032 / DSM 20300 / JCM 1318 / BCRC 11384 / CCUG 27702 / LMG 3730 / NBRC 12168 / NCIMB 10025 / NRRL B-2784 / 534),Corynebacterium glutamicum (strain ATCC 13032 / DSM 20300 / JCM 1318 / BCRC 11384 / CCUG 27702 / LMG 3730 / NBRC 12168 / NCIMB 10025 / NRRL B-2784 / 534),proC,270,PTHR11645:SF0,PYRROLINE-5-CARBOXYLATE REDUCTASE 3,True
P0C1E5,Pyrroline-5-carboxylate reductase,protein,41643,Corynebacterium melassecola,Corynebacterium melassecola,proC,270,PTHR11645:SF0,PYRROLINE-5-CARBOXYLATE REDUCTASE 3,True
P0CI77,Pyrroline-5-carboxylate reductase 1,protein,224308,Bacillus subtilis (strain 168),Bacillus subtilis (strain 168),proH,297,PTHR11645:SF49,PYRROLINE-5-CARBOXYLATE REDUCTASE 1,True
P17817,Pyrroline-5-carboxylate reductase,protein,3847,Glycine max,Glycine max (Soybean),,274,PTHR11645:SF0,PYRROLINE-5-CARBOXYLATE REDUCTASE 3,True
P22008,Pyrroline-5-carboxylate reductase,protein,208964,Pseudomonas aeruginosa (strain ATCC 15692 / DSM 22644 / CIP 104116 / JCM 14847 / LMG 12228 / 1C / PRS 101 / PAO1),Pseudomonas aeruginosa (strain ATCC 15692 / DSM 22644 / CIP 104116 / JCM 14847 / LMG 12228 / 1C / PRS 101 / PAO1),proC,273,PTHR11645:SF0,PYRROLINE-5-CARBOXYLATE REDUCTASE 3,True
P22350,Pyrroline-5-carboxylate reductase,protein,2173,Methanobrevibacter smithii,Methanobrevibacter smithii,proC,251,PTHR11645:SF53,PYRROLINE-5-CARBOXYLATE REDUCTASE 3,True
P27771,Pyrroline-5-carboxylate reductase,protein,243276,Treponema pallidum (strain DSM 117211 / Nichols),Treponema pallidum (strain DSM 117211 / Nichols),proC,263,PTHR11645:SF0,PYRROLINE-5-CARBOXYLATE REDUCTASE 3,True
P32263,Pyrroline-5-carboxylate reductase,protein,559292,Saccharomyces cerevisiae (strain ATCC 204508 / S288c),Saccharomyces cerevisiae (strain ATCC 204508 / S288c) (Baker's yeast),PRO3,286,PTHR11645:SF0,PYRROLINE-5-CARBOXYLATE REDUCTASE 3,True
P32322,"Pyrroline-5-carboxylate reductase 1, mitochondrial",protein,9606,Homo sapiens,Homo sapiens (Human),PYCR1,319,PTHR11645:SF6,"PYRROLINE-5-CARBOXYLATE REDUCTASE 1, MITOCHONDRIAL",True
P39696,ComE operon protein 4,protein,224308,Bacillus subtilis (strain 168),Bacillus subtilis (strain 168),comER,273,PTHR11645:SF51,COME OPERON PROTEIN 4,True
P43869,Pyrroline-5-carboxylate reductase,protein,71421,Haemophilus influenzae (strain ATCC 51907 / DSM 11121 / KW20 / Rd),Haemophilus influenzae (strain ATCC 51907 / DSM 11121 / KW20 / Rd),proC,271,PTHR11645:SF0,PYRROLINE-5-CARBOXYLATE REDUCTASE 3,True
P46725,Pyrroline-5-carboxylate reductase,protein,272631,Mycobacterium leprae (strain TN),Mycobacterium leprae (strain TN),proC,294,PTHR11645:SF0,PYRROLINE-5-CARBOXYLATE REDUCTASE 3,True
P52053,Pyrroline-5-carboxylate reductase,protein,663,Vibrio alginolyticus,Vibrio alginolyticus,proC,272,PTHR11645:SF0,PYRROLINE-5-CARBOXYLATE REDUCTASE 3,True
P54552,Pyrroline-5-carboxylate reductase 2,protein,224308,Bacillus subtilis (strain 168),Bacillus subtilis (strain 168),proI,278,PTHR11645:SF49,PYRROLINE-5-CARBOXYLATE REDUCTASE 1,True
P54893,Pyrroline-5-carboxylate reductase,protein,262724,Thermus thermophilus (strain ATCC BAA-163 / DSM 7039 / HB27),Thermus thermophilus (strain ATCC BAA-163 / DSM 7039 / HB27),proC,261,PTHR11645:SF0,PYRROLINE-5-CARBOXYLATE REDUCTASE 3,True
P54904,Pyrroline-5-carboxylate reductase,protein,3702,Arabidopsis thaliana,Arabidopsis thaliana (Mouse-ear cress),PROC1,276,PTHR11645:SF0,PYRROLINE-5-CARBOXYLATE REDUCTASE 3,True
P74572,Pyrroline-5-carboxylate reductase,protein,1111708,Synechocystis sp. (strain ATCC 27184 / PCC 6803 / Kazusa),Synechocystis sp. (strain ATCC 27184 / PCC 6803 / Kazusa),proC,267,PTHR11645:SF0,PYRROLINE-5-CARBOXYLATE REDUCTASE 3,True
P9WHU6,Pyrroline-5-carboxylate reductase,protein,83331,Mycobacterium tuberculosis (strain CDC 1551 / Oshkosh),Mycobacterium tuberculosis (strain CDC 1551 / Oshkosh),proC,295,PTHR11645:SF0,PYRROLINE-5-CARBOXYLATE REDUCTASE 3,True
P9WHU7,Pyrroline-5-carboxylate reductase,protein,83332,Mycobacterium tuberculosis (strain ATCC 25618 / H37Rv),Mycobacterium tuberculosis (strain ATCC 25618 / H37Rv),proC,295,PTHR11645:SF0,PYRROLINE-5-CARBOXYLATE REDUCTASE 3,True
Q00777,Pyrroline-5-carboxylate reductase 3,protein,224308,Bacillus subtilis (strain 168),Bacillus subtilis (strain 168),proG,272,PTHR11645:SF53,PYRROLINE-5-CARBOXYLATE REDUCTASE 3,True
Q04708,Pyrroline-5-carboxylate reductase,protein,3888,Pisum sativum,Pisum sativum (Garden pea),PROC,273,PTHR11645:SF0,PYRROLINE-5-CARBOXYLATE REDUCTASE 3,True
Q12641,Pyrroline-5-carboxylate reductase,protein,367110,Neurospora crassa (strain ATCC 24698 / 74-OR23-1A / CBS 708.71 / DSM 1257 / FGSC 987),Neurospora crassa (strain ATCC 24698 / 74-OR23-1A / CBS 708.71 / DSM 1257 / FGSC 987),pro-1,332,PTHR11645:SF0,PYRROLINE-5-CARBOXYLATE REDUCTASE 3,True
Q12740,Pyrroline-5-carboxylate reductase,protein,42465,Lophium arboricola,Lophium arboricola,P5CR,320,PTHR11645:SF0,PYRROLINE-5-CARBOXYLATE REDUCTASE 3,True
Q17QJ7,Pyrroline-5-carboxylate reductase 2,protein,9913,Bos taurus,Bos taurus (Bovine),PYCR2,320,PTHR11645:SF61,PYRROLINE-5-CARBOXYLATE REDUCTASE 2,True
Q20848,Putative pyrroline-5-carboxylate reductase 4,protein,6239,Caenorhabditis elegans,Caenorhabditis elegans,pycr-4,299,PTHR11645:SF64,PYRROLINE-5-CARBOXYLATE REDUCTASE-RELATED,True
Q49XV0,Pyrroline-5-carboxylate reductase,protein,342451,Staphylococcus saprophyticus subsp. saprophyticus (strain ATCC 15305 / DSM 20229 / NCIMB 8711 / NCTC 7292 / S-41),Staphylococcus saprophyticus subsp. saprophyticus (strain ATCC 15305 / DSM 20229 / NCIMB 8711 / NCTC 7292 / S-41),proC,271,PTHR11645:SF0,PYRROLINE-5-CARBOXYLATE REDUCTASE 3,True
Q4L6K3,Pyrroline-5-carboxylate reductase,protein,279808,Staphylococcus haemolyticus (strain JCSC1435),Staphylococcus haemolyticus (strain JCSC1435),proC,271,PTHR11645:SF0,PYRROLINE-5-CARBOXYLATE REDUCTASE 3,True
Q4R531,Pyrroline-5-carboxylate reductase 3,protein,9541,Macaca fascicularis,Macaca fascicularis (Crab-eating macaque),PYCR3,274,PTHR11645:SF0,PYRROLINE-5-CARBOXYLATE REDUCTASE 3,True
Q4R6W7,Pyrroline-5-carboxylate reductase 2,protein,9541,Macaca fascicularis,Macaca fascicularis (Crab-eating macaque),PYCR2,320,PTHR11645:SF61,PYRROLINE-5-CARBOXYLATE REDUCTASE 2,True
Q50759,"5,10-methenyltetrahydromethanopterin hydrogenase",protein,2186,Methanothermococcus thermolithotrophicus,Methanothermococcus thermolithotrophicus,hmd,353,PTHR11645:SF0,PYRROLINE-5-CARBOXYLATE REDUCTASE 3,True
Q53H96,Pyrroline-5-carboxylate reductase 3,protein,9606,Homo sapiens,Homo sapiens (Human),PYCR3,274,PTHR11645:SF0,PYRROLINE-5-CARBOXYLATE REDUCTASE 3,True
Q54IL7,Pyrroline-5-carboxylate reductase 1,protein,44689,Dictyostelium discoideum,Dictyostelium discoideum (Social amoeba),pycr1,551,PTHR11645:SF0,PYRROLINE-5-CARBOXYLATE REDUCTASE 3,True
Q55E34,Pyrroline-5-carboxylate reductase 2,protein,44689,Dictyostelium discoideum,Dictyostelium discoideum (Social amoeba),pycr2,299,PTHR11645:SF70,PYRROLINE-5-CARBOXYLATE REDUCTASE 2,True
Q58194,"5,10-methenyltetrahydromethanopterin hydrogenase",protein,243232,Methanocaldococcus jannaschii (strain ATCC 43067 / DSM 2661 / JAL-1 / JCM 10045 / NBRC 100440),Methanocaldococcus jannaschii (strain ATCC 43067 / DSM 2661 / JAL-1 / JCM 10045 / NBRC 100440),hmd,358,PTHR11645:SF0,PYRROLINE-5-CARBOXYLATE REDUCTASE 3,True
Q58D08,Pyrroline-5-carboxylate reductase 3,protein,9913,Bos taurus,Bos taurus (Bovine),PYCR3,308,PTHR11645:SF0,PYRROLINE-5-CARBOXYLATE REDUCTASE 3,True
Q58DT4,"Pyrroline-5-carboxylate reductase 1, mitochondrial",protein,9913,Bos taurus,Bos taurus (Bovine),PYCR1,320,PTHR11645:SF6,"PYRROLINE-5-CARBOXYLATE REDUCTASE 1, MITOCHONDRIAL",True
Q5HFR9,Pyrroline-5-carboxylate reductase,protein,93062,Staphylococcus aureus (strain COL),Staphylococcus aureus (strain COL),proC,271,PTHR11645:SF0,PYRROLINE-5-CARBOXYLATE REDUCTASE 3,True
Q5HP48,Pyrroline-5-carboxylate reductase,protein,176279,Staphylococcus epidermidis (strain ATCC 35984 / DSM 28319 / BCRC 17069 / CCUG 31568 / BM 3577 / RP62A),Staphylococcus epidermidis (strain ATCC 35984 / DSM 28319 / BCRC 17069 / CCUG 31568 / BM 3577 / RP62A),proC,271,PTHR11645:SF0,PYRROLINE-5-CARBOXYLATE REDUCTASE 3,True
Q5PQJ6,Pyrroline-5-carboxylate reductase 3,protein,10116,Rattus norvegicus,Rattus norvegicus (Rat),Pycr3,274,PTHR11645:SF0,PYRROLINE-5-CARBOXYLATE REDUCTASE 3,True
Q5R9X6,"Pyrroline-5-carboxylate reductase 1, mitochondrial",protein,9601,Pongo abelii,Pongo abelii (Sumatran orangutan),PYCR1,319,PTHR11645:SF6,"PYRROLINE-5-CARBOXYLATE REDUCTASE 1, MITOCHONDRIAL",True
Q5RAQ3,Pyrroline-5-carboxylate reductase 2,protein,9601,Pongo abelii,Pongo abelii (Sumatran orangutan),PYCR2,320,PTHR11645:SF61,PYRROLINE-5-CARBOXYLATE REDUCTASE 2,True
Q5SPD7,Pyrroline-5-carboxylate reductase 3,protein,7955,Danio rerio,Danio rerio (Zebrafish),pycr3,288,PTHR11645:SF0,PYRROLINE-5-CARBOXYLATE REDUCTASE 3,True
Q6AY23,Pyrroline-5-carboxylate reductase 2,protein,10116,Rattus norvegicus,Rattus norvegicus (Rat),Pycr2,320,PTHR11645:SF61,PYRROLINE-5-CARBOXYLATE REDUCTASE 2,True
Q6CR99,Pyrroline-5-carboxylate reductase,protein,284590,Kluyveromyces lactis (strain ATCC 8585 / CBS 2359 / DSM 70799 / NBRC 1267 / NRRL Y-1140 / WM37),Kluyveromyces lactis (strain ATCC 8585 / CBS 2359 / DSM 70799 / NBRC 1267 / NRRL Y-1140 / WM37) (Yeast),PRO3,285,PTHR11645:SF0,PYRROLINE-5-CARBOXYLATE REDUCTASE 3,True
Q6G961,Pyrroline-5-carboxylate reductase,protein,282459,Staphylococcus aureus (strain MSSA476),Staphylococcus aureus (strain MSSA476),proC,271,PTHR11645:SF0,PYRROLINE-5-CARBOXYLATE REDUCTASE 3,True
Q6GGJ5,Pyrroline-5-carboxylate reductase,protein,282458,Staphylococcus aureus (strain MRSA252),Staphylococcus aureus (strain MRSA252),proC,271,PTHR11645:SF0,PYRROLINE-5-CARBOXYLATE REDUCTASE 3,True
Q6M0Z1,"5,10-methenyltetrahydromethanopterin hydrogenase",protein,267377,Methanococcus maripaludis (strain DSM 14266 / JCM 13030 / NBRC 101832 / S2 / LL),Methanococcus maripaludis (strain DSM 14266 / JCM 13030 / NBRC 101832 / S2 / LL),hmd,354,PTHR11645:SF0,PYRROLINE-5-CARBOXYLATE REDUCTASE 3,True
Q6NXP6,NADP-dependent oxidoreductase domain-containing protein 1,protein,9606,Homo sapiens,Homo sapiens (Human),NOXRED1,359,PTHR11645:SF58,NADP-DEPENDENT OXIDOREDUCTASE DOMAIN-CONTAINING PROTEIN 1,True
Q7A0U1,Pyrroline-5-carboxylate reductase,protein,196620,Staphylococcus aureus (strain MW2),Staphylococcus aureus (strain MW2),proC,271,PTHR11645:SF0,PYRROLINE-5-CARBOXYLATE REDUCTASE 3,True
Q7A5G8,Pyrroline-5-carboxylate reductase,protein,158879,Staphylococcus aureus (strain N315),Staphylococcus aureus (strain N315),proC,271,PTHR11645:SF0,PYRROLINE-5-CARBOXYLATE REDUCTASE 3,True
Q8CP51,Pyrroline-5-carboxylate reductase,protein,176280,Staphylococcus epidermidis (strain ATCC 12228 / FDA PCI 1200),Staphylococcus epidermidis (strain ATCC 12228 / FDA PCI 1200),proC,271,PTHR11645:SF0,PYRROLINE-5-CARBOXYLATE REDUCTASE 3,True
Q922Q4,Pyrroline-5-carboxylate reductase 2,protein,10090,Mus musculus,Mus musculus (Mouse),Pycr2,320,PTHR11645:SF61,PYRROLINE-5-CARBOXYLATE REDUCTASE 2,True
Q922W5,"Pyrroline-5-carboxylate reductase 1, mitochondrial",protein,10090,Mus musculus,Mus musculus (Mouse),Pycr1,309,PTHR11645:SF6,"PYRROLINE-5-CARBOXYLATE REDUCTASE 1, MITOCHONDRIAL",True
Q96C36,Pyrroline-5-carboxylate reductase 2,protein,9606,Homo sapiens,Homo sapiens (Human),PYCR2,320,PTHR11645:SF61,PYRROLINE-5-CARBOXYLATE REDUCTASE 2,True
Q99TZ0,Pyrroline-5-carboxylate reductase,protein,158878,Staphylococcus aureus (strain Mu50 / ATCC 700699),Staphylococcus aureus (strain Mu50 / ATCC 700699),proC,271,PTHR11645:SF0,PYRROLINE-5-CARBOXYLATE REDUCTASE 3,True
Q9CPE8,Pyrroline-5-carboxylate reductase,protein,272843,Pasteurella multocida (strain Pm70),Pasteurella multocida (strain Pm70),proC,275,PTHR11645:SF0,PYRROLINE-5-CARBOXYLATE REDUCTASE 3,True
Q9D3S5,NADP-dependent oxidoreductase domain-containing protein 1,protein,10090,Mus musculus,Mus musculus (Mouse),Noxred1,366,PTHR11645:SF58,NADP-DEPENDENT OXIDOREDUCTASE DOMAIN-CONTAINING PROTEIN 1,True
Q9DCC4,Pyrroline-5-carboxylate reductase 3,protein,10090,Mus musculus,Mus musculus (Mouse),Pycr3,274,PTHR11645:SF0,PYRROLINE-5-CARBOXYLATE REDUCTASE 3,True
Q9HH99,Pyrroline-5-carboxylate reductase,protein,188937,Methanosarcina acetivorans (strain ATCC 35395 / DSM 2834 / JCM 12185 / C2A),Methanosarcina acetivorans (strain ATCC 35395 / DSM 2834 / JCM 12185 / C2A),proC,270,PTHR11645:SF0,PYRROLINE-5-CARBOXYLATE REDUCTASE 3,True
Q9P7Y7,Pyrroline-5-carboxylate reductase,protein,284812,Schizosaccharomyces pombe (strain 972 / ATCC 24843),Schizosaccharomyces pombe (strain 972 / ATCC 24843) (Fission yeast),pro3,282,PTHR11645:SF0,PYRROLINE-5-CARBOXYLATE REDUCTASE 3,True
Q9ZK56,Pyrroline-5-carboxylate reductase,protein,85963,Helicobacter pylori (strain J99 / ATCC 700824),Helicobacter pylori (strain J99 / ATCC 700824),proC,257,PTHR11645:SF0,PYRROLINE-5-CARBOXYLATE REDUCTASE 3,True
S0DLN5,Delta-1-pyrroline-5-carboxylate reductase apf3,protein,1279085,Gibberella fujikuroi (strain CBS 195.34 / IMI 58289 / NRRL A-6831),Gibberella fujikuroi (strain CBS 195.34 / IMI 58289 / NRRL A-6831) (Bakanae and foot rot disease fungus),apf3,295,PTHR11645:SF0,PYRROLINE-5-CARBOXYLATE REDUCTASE 3,True
