id,name,entry_type,source_tax_id,source_tax_name,full_tax_name,gene,length,subfamily,subfamily_name,in_alphafold
Q31FR9,SsrA-binding protein,protein,317025,Hydrogenovibrio crunogenus (strain DSM 25203 / XCL-2),Hydrogenovibrio crunogenus (strain DSM 25203 / XCL-2),smpB,158,PTHR30308:SF2,SSRA-BINDING PROTEIN,True
Q31M94,SsrA-binding protein,protein,1140,Synechococcus elongatus (strain ATCC 33912 / PCC 7942 / FACHB-805),Synechococcus elongatus (strain ATCC 33912 / PCC 7942 / FACHB-805),smpB,154,PTHR30308:SF2,SSRA-BINDING PROTEIN,True
Q31XC6,SsrA-binding protein,protein,300268,Shigella boydii serotype 4 (strain Sb227),Shigella boydii serotype 4 (strain Sb227),smpB,160,PTHR30308:SF2,SSRA-BINDING PROTEIN,True
Q32CW9,SsrA-binding protein,protein,300267,Shigella dysenteriae serotype 1 (strain Sd197),Shigella dysenteriae serotype 1 (strain Sd197),smpB,160,PTHR30308:SF2,SSRA-BINDING PROTEIN,True
Q38VS0,SsrA-binding protein,protein,314315,Latilactobacillus sakei subsp. sakei (strain 23K),Latilactobacillus sakei subsp. sakei (strain 23K),smpB,156,PTHR30308:SF2,SSRA-BINDING PROTEIN,True
Q39F63,SsrA-binding protein,protein,482957,Burkholderia lata (strain ATCC 17760 / DSM 23089 / LMG 22485 / NCIMB 9086 / R18194 / 383),Burkholderia lata (strain ATCC 17760 / DSM 23089 / LMG 22485 / NCIMB 9086 / R18194 / 383),smpB,148,PTHR30308:SF2,SSRA-BINDING PROTEIN,True
Q39V47,SsrA-binding protein,protein,269799,Geobacter metallireducens (strain ATCC 53774 / DSM 7210 / GS-15),Geobacter metallireducens (strain ATCC 53774 / DSM 7210 / GS-15),smpB,153,PTHR30308:SF2,SSRA-BINDING PROTEIN,True
Q3A3J2,SsrA-binding protein,protein,338963,Syntrophotalea carbinolica (strain DSM 2380 / NBRC 103641 / GraBd1),Syntrophotalea carbinolica (strain DSM 2380 / NBRC 103641 / GraBd1),smpB,150,PTHR30308:SF2,SSRA-BINDING PROTEIN,True
Q3AFC2,SsrA-binding protein,protein,246194,Carboxydothermus hydrogenoformans (strain ATCC BAA-161 / DSM 6008 / Z-2901),Carboxydothermus hydrogenoformans (strain ATCC BAA-161 / DSM 6008 / Z-2901),smpB,149,PTHR30308:SF2,SSRA-BINDING PROTEIN,True
Q3AND9,SsrA-binding protein,protein,110662,Synechococcus sp. (strain CC9605),Synechococcus sp. (strain CC9605),smpB,166,PTHR30308:SF2,SSRA-BINDING PROTEIN,True
Q3ARF1,SsrA-binding protein,protein,340177,Chlorobium chlorochromatii (strain CaD3),Chlorobium chlorochromatii (strain CaD3),smpB,157,PTHR30308:SF2,SSRA-BINDING PROTEIN,True
Q3B0J2,SsrA-binding protein,protein,316279,Synechococcus sp. (strain CC9902),Synechococcus sp. (strain CC9902),smpB,167,PTHR30308:SF2,SSRA-BINDING PROTEIN,True
Q3B5C9,SsrA-binding protein,protein,319225,Chlorobium luteolum (strain DSM 273 / BCRC 81028 / 2530),Chlorobium luteolum (strain DSM 273 / BCRC 81028 / 2530),smpB,157,PTHR30308:SF2,SSRA-BINDING PROTEIN,True
Q3BVC6,SsrA-binding protein,protein,316273,Xanthomonas euvesicatoria pv. vesicatoria (strain 85-10),Xanthomonas euvesicatoria pv. vesicatoria (strain 85-10),smpB,167,PTHR30308:SF2,SSRA-BINDING PROTEIN,True
Q3IE36,SsrA-binding protein,protein,326442,Pseudoalteromonas translucida (strain TAC 125),Pseudoalteromonas translucida (strain TAC 125),smpB,159,PTHR30308:SF2,SSRA-BINDING PROTEIN,True
Q3IZG8,SsrA-binding protein,protein,272943,Cereibacter sphaeroides (strain ATCC 17023 / DSM 158 / JCM 6121 / CCUG 31486 / LMG 2827 / NBRC 12203 / NCIMB 8253 / ATH 2.4.1.),Cereibacter sphaeroides (strain ATCC 17023 / DSM 158 / JCM 6121 / CCUG 31486 / LMG 2827 / NBRC 12203 / NCIMB 8253 / ATH 2.4.1.),smpB,157,PTHR30308:SF2,SSRA-BINDING PROTEIN,True
Q3JBU6,SsrA-binding protein,protein,323261,Nitrosococcus oceani (strain ATCC 19707 / BCRC 17464 / JCM 30415 / NCIMB 11848 / C-107),Nitrosococcus oceani (strain ATCC 19707 / BCRC 17464 / JCM 30415 / NCIMB 11848 / C-107),smpB,189,PTHR30308:SF2,SSRA-BINDING PROTEIN,True
Q3JR53,SsrA-binding protein,protein,320372,Burkholderia pseudomallei (strain 1710b),Burkholderia pseudomallei (strain 1710b),smpB,148,PTHR30308:SF2,SSRA-BINDING PROTEIN,True
Q3K035,SsrA-binding protein,protein,205921,Streptococcus agalactiae serotype Ia (strain ATCC 27591 / A909 / CDC SS700),Streptococcus agalactiae serotype Ia (strain ATCC 27591 / A909 / CDC SS700),smpB,155,PTHR30308:SF2,SSRA-BINDING PROTEIN,True
Q3KIA8,SsrA-binding protein,protein,205922,Pseudomonas fluorescens (strain Pf0-1),Pseudomonas fluorescens (strain Pf0-1),smpB,160,PTHR30308:SF2,SSRA-BINDING PROTEIN,True
Q3KMU5,SsrA-binding protein,protein,315277,Chlamydia trachomatis serovar A (strain ATCC VR-571B / DSM 19440 / HAR-13),Chlamydia trachomatis serovar A (strain ATCC VR-571B / DSM 19440 / HAR-13),smpB,151,PTHR30308:SF2,SSRA-BINDING PROTEIN,True
Q3MAP3,SsrA-binding protein,protein,240292,Trichormus variabilis (strain ATCC 29413 / PCC 7937),Trichormus variabilis (strain ATCC 29413 / PCC 7937),smpB,155,PTHR30308:SF2,SSRA-BINDING PROTEIN,True
Q3SI24,SsrA-binding protein,protein,292415,Thiobacillus denitrificans (strain ATCC 25259 / T1),Thiobacillus denitrificans (strain ATCC 25259 / T1),smpB,149,PTHR30308:SF2,SSRA-BINDING PROTEIN,True
Q3SRA4,SsrA-binding protein,protein,323098,Nitrobacter winogradskyi (strain ATCC 25391 / DSM 10237 / CIP 104748 / NCIMB 11846 / Nb-255),Nitrobacter winogradskyi (strain ATCC 25391 / DSM 10237 / CIP 104748 / NCIMB 11846 / Nb-255),smpB,157,PTHR30308:SF2,SSRA-BINDING PROTEIN,True
Q3YT18,SsrA-binding protein,protein,269484,Ehrlichia canis (strain Jake),Ehrlichia canis (strain Jake),smpB,148,PTHR30308:SF2,SSRA-BINDING PROTEIN,True
Q3YYQ2,SsrA-binding protein,protein,300269,Shigella sonnei (strain Ss046),Shigella sonnei (strain Ss046),smpB,160,PTHR30308:SF2,SSRA-BINDING PROTEIN,True
Q3Z6E3,SsrA-binding protein,protein,243164,Dehalococcoides mccartyi (strain ATCC BAA-2266 / KCTC 15142 / 195),Dehalococcoides mccartyi (strain ATCC BAA-2266 / KCTC 15142 / 195),smpB,172,PTHR30308:SF2,SSRA-BINDING PROTEIN,True
Q3ZZ31,SsrA-binding protein,protein,255470,Dehalococcoides mccartyi (strain CBDB1),Dehalococcoides mccartyi (strain CBDB1),smpB,172,PTHR30308:SF2,SSRA-BINDING PROTEIN,True
Q46IJ5,SsrA-binding protein,protein,59920,Prochlorococcus marinus (strain NATL2A),Prochlorococcus marinus (strain NATL2A),smpB,165,PTHR30308:SF2,SSRA-BINDING PROTEIN,True
Q470F7,SsrA-binding protein,protein,264198,Cupriavidus pinatubonensis (strain JMP 134 / LMG 1197),Cupriavidus pinatubonensis (strain JMP 134 / LMG 1197),smpB,150,PTHR30308:SF2,SSRA-BINDING PROTEIN,True
Q47DK3,SsrA-binding protein,protein,159087,Dechloromonas aromatica (strain RCB),Dechloromonas aromatica (strain RCB),smpB,149,PTHR30308:SF2,SSRA-BINDING PROTEIN,True
Q47M13,SsrA-binding protein,protein,269800,Thermobifida fusca (strain YX),Thermobifida fusca (strain YX),smpB,160,PTHR30308:SF2,SSRA-BINDING PROTEIN,True
Q47XH8,SsrA-binding protein,protein,167879,Colwellia psychrerythraea (strain 34H / ATCC BAA-681),Colwellia psychrerythraea (strain 34H / ATCC BAA-681),smpB,162,PTHR30308:SF2,SSRA-BINDING PROTEIN,True
Q48E54,SsrA-binding protein,protein,264730,Pseudomonas savastanoi pv. phaseolicola (strain 1448A / Race 6),Pseudomonas savastanoi pv. phaseolicola (strain 1448A / Race 6),smpB,160,PTHR30308:SF2,SSRA-BINDING PROTEIN,True
Q48UT9,SsrA-binding protein,protein,319701,Streptococcus pyogenes serotype M28 (strain MGAS6180),Streptococcus pyogenes serotype M28 (strain MGAS6180),smpB,155,PTHR30308:SF2,SSRA-BINDING PROTEIN,True
Q49W09,SsrA-binding protein,protein,342451,Staphylococcus saprophyticus subsp. saprophyticus (strain ATCC 15305 / DSM 20229 / NCIMB 8711 / NCTC 7292 / S-41),Staphylococcus saprophyticus subsp. saprophyticus (strain ATCC 15305 / DSM 20229 / NCIMB 8711 / NCTC 7292 / S-41),smpB,154,PTHR30308:SF2,SSRA-BINDING PROTEIN,True
Q4A5T2,SsrA-binding protein,protein,262723,Mycoplasmopsis synoviae (strain 53),Mycoplasmopsis synoviae (strain 53),smpB,143,PTHR30308:SF2,SSRA-BINDING PROTEIN,True
Q4FLS2,SsrA-binding protein,protein,335992,Pelagibacter ubique (strain HTCC1062),Pelagibacter ubique (strain HTCC1062),smpB,156,PTHR30308:SF2,SSRA-BINDING PROTEIN,True
Q4FUW4,SsrA-binding protein,protein,259536,Psychrobacter arcticus (strain DSM 17307 / VKM B-2377 / 273-4),Psychrobacter arcticus (strain DSM 17307 / VKM B-2377 / 273-4),smpB,158,PTHR30308:SF2,SSRA-BINDING PROTEIN,True
Q4JX42,SsrA-binding protein,protein,306537,Corynebacterium jeikeium (strain K411),Corynebacterium jeikeium (strain K411),smpB,184,PTHR30308:SF2,SSRA-BINDING PROTEIN,True
Q4KIH9,SsrA-binding protein,protein,220664,Pseudomonas fluorescens (strain ATCC BAA-477 / NRRL B-23932 / Pf-5),Pseudomonas fluorescens (strain ATCC BAA-477 / NRRL B-23932 / Pf-5),smpB,160,PTHR30308:SF2,SSRA-BINDING PROTEIN,True
Q4L4L2,SsrA-binding protein,protein,279808,Staphylococcus haemolyticus (strain JCSC1435),Staphylococcus haemolyticus (strain JCSC1435),smpB,156,PTHR30308:SF2,SSRA-BINDING PROTEIN,True
Q4QLS9,SsrA-binding protein,protein,281310,Haemophilus influenzae (strain 86-028NP),Haemophilus influenzae (strain 86-028NP),smpB,161,PTHR30308:SF2,SSRA-BINDING PROTEIN,True
Q4ULR1,SsrA-binding protein,protein,315456,Rickettsia felis (strain ATCC VR-1525 / URRWXCal2),Rickettsia felis (strain ATCC VR-1525 / URRWXCal2),smpB,152,PTHR30308:SF2,SSRA-BINDING PROTEIN,True
Q4UT03,SsrA-binding protein,protein,314565,Xanthomonas campestris pv. campestris (strain 8004),Xanthomonas campestris pv. campestris (strain 8004),smpB,167,PTHR30308:SF2,SSRA-BINDING PROTEIN,True
Q4ZNN9,SsrA-binding protein,protein,205918,Pseudomonas syringae pv. syringae (strain B728a),Pseudomonas syringae pv. syringae (strain B728a),smpB,160,PTHR30308:SF2,SSRA-BINDING PROTEIN,True
Q57E95,SsrA-binding protein,protein,262698,Brucella abortus biovar 1 (strain 9-941),Brucella abortus biovar 1 (strain 9-941),smpB,158,PTHR30308:SF2,SSRA-BINDING PROTEIN,True
Q57L18,SsrA-binding protein,protein,321314,Salmonella choleraesuis (strain SC-B67),Salmonella choleraesuis (strain SC-B67),smpB,160,PTHR30308:SF2,SSRA-BINDING PROTEIN,True
Q5E399,SsrA-binding protein,protein,312309,Aliivibrio fischeri (strain ATCC 700601 / ES114),Aliivibrio fischeri (strain ATCC 700601 / ES114),smpB,161,PTHR30308:SF2,SSRA-BINDING PROTEIN,True
Q5F816,SsrA-binding protein,protein,242231,Neisseria gonorrhoeae (strain ATCC 700825 / FA 1090),Neisseria gonorrhoeae (strain ATCC 700825 / FA 1090),smpB,148,PTHR30308:SF2,SSRA-BINDING PROTEIN,True
Q5FF69,SsrA-binding protein,protein,302409,Ehrlichia ruminantium (strain Gardel),Ehrlichia ruminantium (strain Gardel),smpB,148,PTHR30308:SF2,SSRA-BINDING PROTEIN,True
Q5FLT4,SsrA-binding protein,protein,272621,Lactobacillus acidophilus (strain ATCC 700396 / NCK56 / N2 / NCFM),Lactobacillus acidophilus (strain ATCC 700396 / NCK56 / N2 / NCFM),smpB,151,PTHR30308:SF2,SSRA-BINDING PROTEIN,True
Q5FUX0,SsrA-binding protein,protein,290633,Gluconobacter oxydans (strain 621H),Gluconobacter oxydans (strain 621H),smpB,164,PTHR30308:SF2,SSRA-BINDING PROTEIN,True
Q5GTK2,SsrA-binding protein,protein,292805,Wolbachia sp. subsp. Brugia malayi (strain TRS),Wolbachia sp. subsp. Brugia malayi (strain TRS),smpB,149,PTHR30308:SF2,SSRA-BINDING PROTEIN,True
Q5H194,SsrA-binding protein,protein,291331,Xanthomonas oryzae pv. oryzae (strain KACC10331 / KXO85),Xanthomonas oryzae pv. oryzae (strain KACC10331 / KXO85),smpB,167,PTHR30308:SF2,SSRA-BINDING PROTEIN,True
Q5HC98,SsrA-binding protein,protein,254945,Ehrlichia ruminantium (strain Welgevonden),Ehrlichia ruminantium (strain Welgevonden),smpB,148,PTHR30308:SF2,SSRA-BINDING PROTEIN,True
Q5HHN6,SsrA-binding protein,protein,93062,Staphylococcus aureus (strain COL),Staphylococcus aureus (strain COL),smpB,154,PTHR30308:SF2,SSRA-BINDING PROTEIN,True
Q5HQU5,SsrA-binding protein,protein,176279,Staphylococcus epidermidis (strain ATCC 35984 / DSM 28319 / BCRC 17069 / CCUG 31568 / BM 3577 / RP62A),Staphylococcus epidermidis (strain ATCC 35984 / DSM 28319 / BCRC 17069 / CCUG 31568 / BM 3577 / RP62A),smpB,156,PTHR30308:SF2,SSRA-BINDING PROTEIN,True
Q5HTZ9,SsrA-binding protein,protein,195099,Campylobacter jejuni (strain RM1221),Campylobacter jejuni (strain RM1221),smpB,150,PTHR30308:SF2,SSRA-BINDING PROTEIN,True
Q5KVF8,SsrA-binding protein,protein,235909,Geobacillus kaustophilus (strain HTA426),Geobacillus kaustophilus (strain HTA426),smpB,155,PTHR30308:SF2,SSRA-BINDING PROTEIN,True
Q5L646,SsrA-binding protein,protein,218497,Chlamydia abortus (strain DSM 27085 / S26/3),Chlamydia abortus (strain DSM 27085 / S26/3),smpB,150,PTHR30308:SF2,SSRA-BINDING PROTEIN,True
Q5LAY7,SsrA-binding protein,protein,272559,Bacteroides fragilis (strain ATCC 25285 / DSM 2151 / CCUG 4856 / JCM 11019 / LMG 10263 / NCTC 9343 / Onslow / VPI 2553 / EN-2),Bacteroides fragilis (strain ATCC 25285 / DSM 2151 / CCUG 4856 / JCM 11019 / LMG 10263 / NCTC 9343 / Onslow / VPI 2553 / EN-2),smpB,150,PTHR30308:SF2,SSRA-BINDING PROTEIN,True
Q5LLW5,SsrA-binding protein,protein,246200,Ruegeria pomeroyi (strain ATCC 700808 / DSM 15171 / DSS-3),Ruegeria pomeroyi (strain ATCC 700808 / DSM 15171 / DSS-3),smpB,158,PTHR30308:SF2,SSRA-BINDING PROTEIN,True
Q5M0N4,SsrA-binding protein,protein,299768,Streptococcus thermophilus (strain CNRZ 1066),Streptococcus thermophilus (strain CNRZ 1066),smpB,154,PTHR30308:SF2,SSRA-BINDING PROTEIN,True
Q5M570,SsrA-binding protein,protein,264199,Streptococcus thermophilus (strain ATCC BAA-250 / LMG 18311),Streptococcus thermophilus (strain ATCC BAA-250 / LMG 18311),smpB,154,PTHR30308:SF2,SSRA-BINDING PROTEIN,True
Q5MZN2,SsrA-binding protein,protein,269084,Synechococcus sp. (strain ATCC 27144 / PCC 6301 / SAUG 1402/1),Synechococcus sp. (strain ATCC 27144 / PCC 6301 / SAUG 1402/1),smpB,154,PTHR30308:SF2,SSRA-BINDING PROTEIN,True
Q5NFP4,SsrA-binding protein,protein,177416,Francisella tularensis subsp. tularensis (strain SCHU S4 / Schu 4),Francisella tularensis subsp. tularensis (strain SCHU S4 / Schu 4),smpB,157,PTHR30308:SF2,SSRA-BINDING PROTEIN,True
Q5NPL5,SsrA-binding protein,protein,264203,Zymomonas mobilis subsp. mobilis (strain ATCC 31821 / ZM4 / CP4),Zymomonas mobilis subsp. mobilis (strain ATCC 31821 / ZM4 / CP4),smpB,160,PTHR30308:SF2,SSRA-BINDING PROTEIN,True
Q5NYE0,SsrA-binding protein,protein,76114,Aromatoleum aromaticum (strain DSM 19018 / LMG 30748 / EbN1),Aromatoleum aromaticum (strain DSM 19018 / LMG 30748 / EbN1),smpB,148,PTHR30308:SF2,SSRA-BINDING PROTEIN,True
Q5P9M7,SsrA-binding protein,protein,234826,Anaplasma marginale (strain St. Maries),Anaplasma marginale (strain St. Maries),smpB,149,PTHR30308:SF2,SSRA-BINDING PROTEIN,True
Q5PFG2,SsrA-binding protein,protein,295319,Salmonella paratyphi A (strain ATCC 9150 / SARB42),Salmonella paratyphi A (strain ATCC 9150 / SARB42),smpB,160,PTHR30308:SF2,SSRA-BINDING PROTEIN,True
Q5QW47,SsrA-binding protein,protein,283942,Idiomarina loihiensis (strain ATCC BAA-735 / DSM 15497 / L2-TR),Idiomarina loihiensis (strain ATCC BAA-735 / DSM 15497 / L2-TR),smpB,159,PTHR30308:SF2,SSRA-BINDING PROTEIN,True
Q5WDM4,SsrA-binding protein,protein,66692,Shouchella clausii (strain KSM-K16),Shouchella clausii (strain KSM-K16),smpB,156,PTHR30308:SF2,SSRA-BINDING PROTEIN,True
Q5WSX5,SsrA-binding protein,protein,297245,Legionella pneumophila (strain Lens),Legionella pneumophila (strain Lens),smpB,156,PTHR30308:SF2,SSRA-BINDING PROTEIN,True
Q5X148,SsrA-binding protein,protein,297246,Legionella pneumophila (strain Paris),Legionella pneumophila (strain Paris),smpB,156,PTHR30308:SF2,SSRA-BINDING PROTEIN,True
Q5XDD6,SsrA-binding protein,protein,286636,Streptococcus pyogenes serotype M6 (strain ATCC BAA-946 / MGAS10394),Streptococcus pyogenes serotype M6 (strain ATCC BAA-946 / MGAS10394),smpB,155,PTHR30308:SF2,SSRA-BINDING PROTEIN,True
Q5YR60,SsrA-binding protein,protein,247156,Nocardia farcinica (strain IFM 10152),Nocardia farcinica (strain IFM 10152),smpB,160,PTHR30308:SF2,SSRA-BINDING PROTEIN,True
Q5ZRP1,SsrA-binding protein,protein,272624,Legionella pneumophila subsp. pneumophila (strain Philadelphia 1 / ATCC 33152 / DSM 7513),Legionella pneumophila subsp. pneumophila (strain Philadelphia 1 / ATCC 33152 / DSM 7513),smpB,156,PTHR30308:SF2,SSRA-BINDING PROTEIN,True
Q601U1,SsrA-binding protein,protein,295358,Mesomycoplasma hyopneumoniae (strain 232),Mesomycoplasma hyopneumoniae (strain 232),smpB,145,PTHR30308:SF2,SSRA-BINDING PROTEIN,True
Q604C6,SsrA-binding protein,protein,243233,Methylococcus capsulatus (strain ATCC 33009 / NCIMB 11132 / Bath),Methylococcus capsulatus (strain ATCC 33009 / NCIMB 11132 / Bath),smpB,157,PTHR30308:SF2,SSRA-BINDING PROTEIN,True
Q62JE7,SsrA-binding protein,protein,243160,Burkholderia mallei (strain ATCC 23344),Burkholderia mallei (strain ATCC 23344),smpB,148,PTHR30308:SF2,SSRA-BINDING PROTEIN,True
Q631M9,SsrA-binding protein,protein,288681,Bacillus cereus (strain ZK / E33L),Bacillus cereus (strain ZK / E33L),smpB,155,PTHR30308:SF2,SSRA-BINDING PROTEIN,True
Q63T34,SsrA-binding protein,protein,272560,Burkholderia pseudomallei (strain K96243),Burkholderia pseudomallei (strain K96243),smpB,148,PTHR30308:SF2,SSRA-BINDING PROTEIN,True
Q64RD6,SsrA-binding protein,protein,295405,Bacteroides fragilis (strain YCH46),Bacteroides fragilis (strain YCH46),smpB,150,PTHR30308:SF2,SSRA-BINDING PROTEIN,True
Q65EQ3,SsrA-binding protein,protein,279010,Bacillus licheniformis (strain ATCC 14580 / DSM 13 / JCM 2505 / CCUG 7422 / NBRC 12200 / NCIMB 9375 / NCTC 10341 / NRRL NRS-1264 / Gibson 46),Bacillus licheniformis (strain ATCC 14580 / DSM 13 / JCM 2505 / CCUG 7422 / NBRC 12200 / NCIMB 9375 / NCTC 10341 / NRRL NRS-1264 / Gibson 46),smpB,157,PTHR30308:SF2,SSRA-BINDING PROTEIN,True
Q65SE8,SsrA-binding protein,protein,221988,Mannheimia succiniciproducens (strain KCTC 0769BP / MBEL55E),Mannheimia succiniciproducens (strain KCTC 0769BP / MBEL55E),smpB,160,PTHR30308:SF2,SSRA-BINDING PROTEIN,True
Q662X9,SsrA-binding protein,protein,290434,Borrelia garinii subsp. bavariensis (strain ATCC BAA-2496 / DSM 23469 / PBi),Borrelia garinii subsp. bavariensis (strain ATCC BAA-2496 / DSM 23469 / PBi),smpB,150,PTHR30308:SF2,SSRA-BINDING PROTEIN,True
Q66DB4,SsrA-binding protein,protein,273123,Yersinia pseudotuberculosis serotype I (strain IP32953),Yersinia pseudotuberculosis serotype I (strain IP32953),smpB,160,PTHR30308:SF2,SSRA-BINDING PROTEIN,True
Q67SL8,SsrA-binding protein,protein,292459,Symbiobacterium thermophilum (strain DSM 24528 / JCM 14929 / IAM 14863 / T),Symbiobacterium thermophilum (strain DSM 24528 / JCM 14929 / IAM 14863 / T),smpB,158,PTHR30308:SF2,SSRA-BINDING PROTEIN,True
Q6A811,SsrA-binding protein,protein,267747,Cutibacterium acnes (strain DSM 16379 / KPA171202),Cutibacterium acnes (strain DSM 16379 / KPA171202),smpB,160,PTHR30308:SF2,SSRA-BINDING PROTEIN,True
Q6AEL7,SsrA-binding protein,protein,281090,Leifsonia xyli subsp. xyli (strain CTCB07),Leifsonia xyli subsp. xyli (strain CTCB07),smpB,158,PTHR30308:SF2,SSRA-BINDING PROTEIN,True
Q6AQX3,SsrA-binding protein,protein,177439,Desulfotalea psychrophila (strain LSv54 / DSM 12343),Desulfotalea psychrophila (strain LSv54 / DSM 12343),smpB,151,PTHR30308:SF2,SSRA-BINDING PROTEIN,True
Q6D8Y5,SsrA-binding protein,protein,218491,Pectobacterium atrosepticum (strain SCRI 1043 / ATCC BAA-672),Pectobacterium atrosepticum (strain SCRI 1043 / ATCC BAA-672),smpB,160,PTHR30308:SF2,SSRA-BINDING PROTEIN,True
Q6F1Q6,SsrA-binding protein,protein,265311,Mesoplasma florum (strain ATCC 33453 / NBRC 100688 / NCTC 11704 / L1),Mesoplasma florum (strain ATCC 33453 / NBRC 100688 / NCTC 11704 / L1),smpB,149,PTHR30308:SF2,SSRA-BINDING PROTEIN,True
Q6F8J9,SsrA-binding protein,protein,62977,Acinetobacter baylyi (strain ATCC 33305 / BD413 / ADP1),Acinetobacter baylyi (strain ATCC 33305 / BD413 / ADP1),smpB,158,PTHR30308:SF2,SSRA-BINDING PROTEIN,True
Q6G090,SsrA-binding protein,protein,283165,Bartonella quintana (strain Toulouse),Bartonella quintana (strain Toulouse),smpB,158,PTHR30308:SF2,SSRA-BINDING PROTEIN,True
Q6G467,SsrA-binding protein,protein,283166,Bartonella henselae (strain ATCC 49882 / DSM 28221 / CCUG 30454 / Houston 1),Bartonella henselae (strain ATCC 49882 / DSM 28221 / CCUG 30454 / Houston 1),smpB,158,PTHR30308:SF2,SSRA-BINDING PROTEIN,True
Q6GB49,SsrA-binding protein,protein,282459,Staphylococcus aureus (strain MSSA476),Staphylococcus aureus (strain MSSA476),smpB,154,PTHR30308:SF2,SSRA-BINDING PROTEIN,True
Q6GIK9,SsrA-binding protein,protein,282458,Staphylococcus aureus (strain MRSA252),Staphylococcus aureus (strain MRSA252),smpB,154,PTHR30308:SF2,SSRA-BINDING PROTEIN,True
Q6HBG1,SsrA-binding protein,protein,281309,Bacillus thuringiensis subsp. konkukian (strain 97-27),Bacillus thuringiensis subsp. konkukian (strain 97-27),smpB,155,PTHR30308:SF2,SSRA-BINDING PROTEIN,True
Q6KI26,SsrA-binding protein,protein,267748,Mycoplasma mobile (strain ATCC 43663 / 163K / NCTC 11711),Mycoplasma mobile (strain ATCC 43663 / 163K / NCTC 11711),smpB,142,PTHR30308:SF2,SSRA-BINDING PROTEIN,True
Q6LUB4,SsrA-binding protein,protein,298386,Photobacterium profundum (strain SS9),Photobacterium profundum (strain SS9),smpB,158,PTHR30308:SF2,SSRA-BINDING PROTEIN,True
Q6MAG8,SsrA-binding protein,protein,264201,Protochlamydia amoebophila (strain UWE25),Protochlamydia amoebophila (strain UWE25),smpB,153,PTHR30308:SF2,SSRA-BINDING PROTEIN,True
Q6MQ46,SsrA-binding protein,protein,264462,Bdellovibrio bacteriovorus (strain ATCC 15356 / DSM 50701 / NCIMB 9529 / HD100),Bdellovibrio bacteriovorus (strain ATCC 15356 / DSM 50701 / NCIMB 9529 / HD100),smpB,152,PTHR30308:SF2,SSRA-BINDING PROTEIN,True
Q6MSC1,SsrA-binding protein,protein,272632,Mycoplasma mycoides subsp. mycoides SC (strain CCUG 32753 / NCTC 10114 / PG1),Mycoplasma mycoides subsp. mycoides SC (strain CCUG 32753 / NCTC 10114 / PG1),smpB,148,PTHR30308:SF2,SSRA-BINDING PROTEIN,True
Q6N6C9,SsrA-binding protein,protein,258594,Rhodopseudomonas palustris (strain ATCC BAA-98 / CGA009),Rhodopseudomonas palustris (strain ATCC BAA-98 / CGA009),smpB,157,PTHR30308:SF2,SSRA-BINDING PROTEIN,True
Q6NIL8,SsrA-binding protein,protein,257309,Corynebacterium diphtheriae (strain ATCC 700971 / NCTC 13129 / Biotype gravis),Corynebacterium diphtheriae (strain ATCC 700971 / NCTC 13129 / Biotype gravis),smpB,163,PTHR30308:SF2,SSRA-BINDING PROTEIN,True
Q6YR70,SsrA-binding protein,protein,262768,Onion yellows phytoplasma (strain OY-M),Onion yellows phytoplasma (strain OY-M),smpB,152,PTHR30308:SF2,SSRA-BINDING PROTEIN,True
Q71WX8,SsrA-binding protein,protein,265669,Listeria monocytogenes serotype 4b (strain F2365),Listeria monocytogenes serotype 4b (strain F2365),smpB,154,PTHR30308:SF2,SSRA-BINDING PROTEIN,True
Q72DV1,SsrA-binding protein,protein,882,Nitratidesulfovibrio vulgaris (strain ATCC 29579 / DSM 644 / CCUG 34227 / NCIMB 8303 / VKM B-1760 / Hildenborough),Nitratidesulfovibrio vulgaris (strain ATCC 29579 / DSM 644 / CCUG 34227 / NCIMB 8303 / VKM B-1760 / Hildenborough),smpB,154,PTHR30308:SF2,SSRA-BINDING PROTEIN,True
Q72KA1,SsrA-binding protein,protein,262724,Thermus thermophilus (strain ATCC BAA-163 / DSM 7039 / HB27),Thermus thermophilus (strain ATCC BAA-163 / DSM 7039 / HB27),smpB,144,PTHR30308:SF2,SSRA-BINDING PROTEIN,True
Q72PQ0,SsrA-binding protein,protein,267671,Leptospira interrogans serogroup Icterohaemorrhagiae serovar copenhageni (strain Fiocruz L1-130),Leptospira interrogans serogroup Icterohaemorrhagiae serovar copenhageni (strain Fiocruz L1-130),smpB,160,PTHR30308:SF2,SSRA-BINDING PROTEIN,True
Q72XZ2,SsrA-binding protein,protein,222523,Bacillus cereus (strain ATCC 10987 / NRS 248),Bacillus cereus (strain ATCC 10987 / NRS 248),smpB,155,PTHR30308:SF2,SSRA-BINDING PROTEIN,True
Q73H09,SsrA-binding protein,protein,163164,Wolbachia pipientis wMel,Wolbachia pipientis wMel,smpB,149,PTHR30308:SF2,SSRA-BINDING PROTEIN,True
Q73MP4,SsrA-binding protein,protein,243275,Treponema denticola (strain ATCC 35405 / DSM 14222 / CIP 103919 / JCM 8153 / KCTC 15104),Treponema denticola (strain ATCC 35405 / DSM 14222 / CIP 103919 / JCM 8153 / KCTC 15104),smpB,154,PTHR30308:SF2,SSRA-BINDING PROTEIN,True
Q73V46,SsrA-binding protein,protein,262316,Mycolicibacterium paratuberculosis (strain ATCC BAA-968 / K-10),Mycolicibacterium paratuberculosis (strain ATCC BAA-968 / K-10),smpB,169,PTHR30308:SF2,SSRA-BINDING PROTEIN,True
Q74CG4,SsrA-binding protein,protein,243231,Geobacter sulfurreducens (strain ATCC 51573 / DSM 12127 / PCA),Geobacter sulfurreducens (strain ATCC 51573 / DSM 12127 / PCA),smpB,153,PTHR30308:SF2,SSRA-BINDING PROTEIN,True
Q74K75,SsrA-binding protein,protein,257314,Lactobacillus johnsonii (strain CNCM I-12250 / La1 / NCC 533),Lactobacillus johnsonii (strain CNCM I-12250 / La1 / NCC 533),smpB,151,PTHR30308:SF2,SSRA-BINDING PROTEIN,True
Q7M9J0,SsrA-binding protein,protein,273121,Wolinella succinogenes (strain ATCC 29543 / DSM 1740 / CCUG 13145 / JCM 31913 / LMG 7466 / NCTC 11488 / FDC 602W),Wolinella succinogenes (strain ATCC 29543 / DSM 1740 / CCUG 13145 / JCM 31913 / LMG 7466 / NCTC 11488 / FDC 602W),smpB,151,PTHR30308:SF2,SSRA-BINDING PROTEIN,True
Q7MN99,SsrA-binding protein,protein,196600,Vibrio vulnificus (strain YJ016),Vibrio vulnificus (strain YJ016),smpB,161,PTHR30308:SF2,SSRA-BINDING PROTEIN,True
Q7MWT5,SsrA-binding protein,protein,242619,Porphyromonas gingivalis (strain ATCC BAA-308 / W83),Porphyromonas gingivalis (strain ATCC BAA-308 / W83),smpB,153,PTHR30308:SF2,SSRA-BINDING PROTEIN,True
Q7N1U1,SsrA-binding protein,protein,243265,Photorhabdus laumondii subsp. laumondii (strain DSM 15139 / CIP 105565 / TT01),Photorhabdus laumondii subsp. laumondii (strain DSM 15139 / CIP 105565 / TT01),smpB,160,PTHR30308:SF2,SSRA-BINDING PROTEIN,True
Q7NB37,SsrA-binding protein,protein,710127,Mycoplasmoides gallisepticum (strain R(low / passage 15 / clone 2)),Mycoplasmoides gallisepticum (strain R(low / passage 15 / clone 2)),smpB,143,PTHR30308:SF2,SSRA-BINDING PROTEIN,True
Q7NKI3,SsrA-binding protein,protein,251221,Gloeobacter violaceus (strain ATCC 29082 / PCC 7421),Gloeobacter violaceus (strain ATCC 29082 / PCC 7421),smpB,152,PTHR30308:SF2,SSRA-BINDING PROTEIN,True
