id,name,entry_type,source_tax_id,source_tax_name,full_tax_name,gene,length,subfamily,subfamily_name,in_alphafold
A6X299,SsrA-binding protein,protein,439375,Brucella anthropi (strain ATCC 49188 / DSM 6882 / CCUG 24695 / JCM 21032 / LMG 3331 / NBRC 15819 / NCTC 12168 / Alc 37),Brucella anthropi (strain ATCC 49188 / DSM 6882 / CCUG 24695 / JCM 21032 / LMG 3331 / NBRC 15819 / NCTC 12168 / Alc 37),smpB,158,PTHR30308:SF2,SSRA-BINDING PROTEIN,True
A7FKS8,SsrA-binding protein,protein,349747,Yersinia pseudotuberculosis serotype O:1b (strain IP 31758),Yersinia pseudotuberculosis serotype O:1b (strain IP 31758),smpB,160,PTHR30308:SF2,SSRA-BINDING PROTEIN,True
A7FQP4,SsrA-binding protein,protein,441770,Clostridium botulinum (strain ATCC 19397 / Type A),Clostridium botulinum (strain ATCC 19397 / Type A),smpB,156,PTHR30308:SF2,SSRA-BINDING PROTEIN,True
A7G9Y7,SsrA-binding protein,protein,441772,Clostridium botulinum (strain Langeland / NCTC 10281 / Type F),Clostridium botulinum (strain Langeland / NCTC 10281 / Type F),smpB,156,PTHR30308:SF2,SSRA-BINDING PROTEIN,True
A7GUR1,SsrA-binding protein,protein,315749,Bacillus cytotoxicus (strain DSM 22905 / CIP 110041 / 391-98 / NVH 391-98),Bacillus cytotoxicus (strain DSM 22905 / CIP 110041 / 391-98 / NVH 391-98),smpB,155,PTHR30308:SF2,SSRA-BINDING PROTEIN,True
A7GZ96,SsrA-binding protein,protein,360105,Campylobacter curvus (strain 525.92),Campylobacter curvus (strain 525.92),smpB,150,PTHR30308:SF2,SSRA-BINDING PROTEIN,True
A7H2Q2,SsrA-binding protein,protein,360109,Campylobacter jejuni subsp. doylei (strain ATCC BAA-1458 / RM4099 / 269.97),Campylobacter jejuni subsp. doylei (strain ATCC BAA-1458 / RM4099 / 269.97),smpB,150,PTHR30308:SF2,SSRA-BINDING PROTEIN,True
A7HGZ0,SsrA-binding protein,protein,404589,Anaeromyxobacter sp. (strain Fw109-5),Anaeromyxobacter sp. (strain Fw109-5),smpB,165,PTHR30308:SF2,SSRA-BINDING PROTEIN,True
A7HN68,SsrA-binding protein,protein,381764,Fervidobacterium nodosum (strain ATCC 35602 / DSM 5306 / Rt17-B1),Fervidobacterium nodosum (strain ATCC 35602 / DSM 5306 / Rt17-B1),smpB,149,PTHR30308:SF2,SSRA-BINDING PROTEIN,True
A7HX37,SsrA-binding protein,protein,402881,Parvibaculum lavamentivorans (strain DS-1 / DSM 13023 / NCIMB 13966),Parvibaculum lavamentivorans (strain DS-1 / DSM 13023 / NCIMB 13966),smpB,165,PTHR30308:SF2,SSRA-BINDING PROTEIN,True
A7I2C6,SsrA-binding protein,protein,360107,Campylobacter hominis (strain ATCC BAA-381 / DSM 21671 / CCUG 45161 / LMG 19568 / NCTC 13146 / CH001A),Campylobacter hominis (strain ATCC BAA-381 / DSM 21671 / CCUG 45161 / LMG 19568 / NCTC 13146 / CH001A),smpB,153,PTHR30308:SF2,SSRA-BINDING PROTEIN,True
A7IM13,SsrA-binding protein,protein,78245,Xanthobacter autotrophicus (strain ATCC BAA-1158 / Py2),Xanthobacter autotrophicus (strain ATCC BAA-1158 / Py2),smpB,158,PTHR30308:SF2,SSRA-BINDING PROTEIN,True
A7MHX6,SsrA-binding protein,protein,290339,Cronobacter sakazakii (strain ATCC BAA-894),Cronobacter sakazakii (strain ATCC BAA-894),smpB,160,PTHR30308:SF2,SSRA-BINDING PROTEIN,True
A7MWX4,SsrA-binding protein,protein,2902295,Vibrio campbellii (strain ATCC BAA-1116),Vibrio campbellii (strain ATCC BAA-1116),smpB,161,PTHR30308:SF2,SSRA-BINDING PROTEIN,True
A7NBC7,SsrA-binding protein,protein,458234,Francisella tularensis subsp. holarctica (strain FTNF002-00 / FTA),Francisella tularensis subsp. holarctica (strain FTNF002-00 / FTA),smpB,157,PTHR30308:SF2,SSRA-BINDING PROTEIN,True
A7NS28,SsrA-binding protein,protein,383372,Roseiflexus castenholzii (strain DSM 13941 / HLO8),Roseiflexus castenholzii (strain DSM 13941 / HLO8),smpB,158,PTHR30308:SF2,SSRA-BINDING PROTEIN,True
A7WZT9,SsrA-binding protein,protein,418127,Staphylococcus aureus (strain Mu3 / ATCC 700698),Staphylococcus aureus (strain Mu3 / ATCC 700698),smpB,154,PTHR30308:SF2,SSRA-BINDING PROTEIN,True
A7Z8U4,SsrA-binding protein,protein,326423,Bacillus velezensis (strain DSM 23117 / BGSC 10A6 / LMG 26770 / FZB42),Bacillus velezensis (strain DSM 23117 / BGSC 10A6 / LMG 26770 / FZB42),smpB,156,PTHR30308:SF2,SSRA-BINDING PROTEIN,True
A7ZE53,SsrA-binding protein,protein,360104,Campylobacter concisus (strain 13826),Campylobacter concisus (strain 13826),smpB,151,PTHR30308:SF2,SSRA-BINDING PROTEIN,True
A7ZQ60,SsrA-binding protein,protein,331111,Escherichia coli O139:H28 (strain E24377A / ETEC),Escherichia coli O139:H28 (strain E24377A / ETEC),smpB,160,PTHR30308:SF2,SSRA-BINDING PROTEIN,True
A8A3C6,SsrA-binding protein,protein,331112,Escherichia coli O9:H4 (strain HS),Escherichia coli O9:H4 (strain HS),smpB,160,PTHR30308:SF2,SSRA-BINDING PROTEIN,True
A8ANF2,SsrA-binding protein,protein,290338,Citrobacter koseri (strain ATCC BAA-895 / CDC 4225-83 / SGSC4696),Citrobacter koseri (strain ATCC BAA-895 / CDC 4225-83 / SGSC4696),smpB,160,PTHR30308:SF2,SSRA-BINDING PROTEIN,True
A8AW61,SsrA-binding protein,protein,467705,Streptococcus gordonii (strain Challis / ATCC 35105 / BCRC 15272 / CH1 / DL1 / V288),Streptococcus gordonii (strain Challis / ATCC 35105 / BCRC 15272 / CH1 / DL1 / V288),smpB,155,PTHR30308:SF2,SSRA-BINDING PROTEIN,True
A8EWH6,SsrA-binding protein,protein,367737,Aliarcobacter butzleri (strain RM4018),Aliarcobacter butzleri (strain RM4018),smpB,158,PTHR30308:SF2,SSRA-BINDING PROTEIN,True
A8EYZ3,SsrA-binding protein,protein,293613,Rickettsia canadensis (strain McKiel),Rickettsia canadensis (strain McKiel),smpB,152,PTHR30308:SF2,SSRA-BINDING PROTEIN,True
A8F1K4,SsrA-binding protein,protein,416276,Rickettsia massiliae (strain Mtu5),Rickettsia massiliae (strain Mtu5),smpB,152,PTHR30308:SF2,SSRA-BINDING PROTEIN,True
A8F4Z8,SsrA-binding protein,protein,416591,Pseudothermotoga lettingae (strain ATCC BAA-301 / DSM 14385 / NBRC 107922 / TMO),Pseudothermotoga lettingae (strain ATCC BAA-301 / DSM 14385 / NBRC 107922 / TMO),smpB,148,PTHR30308:SF2,SSRA-BINDING PROTEIN,True
A8FHG7,SsrA-binding protein,protein,315750,Bacillus pumilus (strain SAFR-032),Bacillus pumilus (strain SAFR-032),smpB,156,PTHR30308:SF2,SSRA-BINDING PROTEIN,True
A8FMF8,SsrA-binding protein,protein,407148,Campylobacter jejuni subsp. jejuni serotype O:6 (strain 81116 / NCTC 11828),Campylobacter jejuni subsp. jejuni serotype O:6 (strain 81116 / NCTC 11828),smpB,150,PTHR30308:SF2,SSRA-BINDING PROTEIN,True
A8FT45,SsrA-binding protein,protein,425104,Shewanella sediminis (strain HAW-EB3),Shewanella sediminis (strain HAW-EB3),smpB,164,PTHR30308:SF2,SSRA-BINDING PROTEIN,True
A8G7C2,SsrA-binding protein,protein,93060,Prochlorococcus marinus (strain MIT 9215),Prochlorococcus marinus (strain MIT 9215),smpB,164,PTHR30308:SF2,SSRA-BINDING PROTEIN,True
A8GI46,SsrA-binding protein,protein,399741,Serratia proteamaculans (strain 568),Serratia proteamaculans (strain 568),smpB,160,PTHR30308:SF2,SSRA-BINDING PROTEIN,True
A8GNF2,SsrA-binding protein,protein,293614,Rickettsia akari (strain Hartford),Rickettsia akari (strain Hartford),smpB,152,PTHR30308:SF2,SSRA-BINDING PROTEIN,True
A8GS26,SsrA-binding protein,protein,392021,Rickettsia rickettsii (strain Sheila Smith),Rickettsia rickettsii (strain Sheila Smith),smpB,152,PTHR30308:SF2,SSRA-BINDING PROTEIN,True
A8GWS0,SsrA-binding protein,protein,391896,Rickettsia bellii (strain OSU 85-389),Rickettsia bellii (strain OSU 85-389),smpB,151,PTHR30308:SF2,SSRA-BINDING PROTEIN,True
A8H222,SsrA-binding protein,protein,398579,Shewanella pealeana (strain ATCC 700345 / ANG-SQ1),Shewanella pealeana (strain ATCC 700345 / ANG-SQ1),smpB,164,PTHR30308:SF2,SSRA-BINDING PROTEIN,True
A8I0D5,SsrA-binding protein,protein,438753,Azorhizobium caulinodans (strain ATCC 43989 / DSM 5975 / JCM 20966 / LMG 6465 / NBRC 14845 / NCIMB 13405 / ORS 571),Azorhizobium caulinodans (strain ATCC 43989 / DSM 5975 / JCM 20966 / LMG 6465 / NBRC 14845 / NCIMB 13405 / ORS 571),smpB,160,PTHR30308:SF2,SSRA-BINDING PROTEIN,True
A8L8M0,SsrA-binding protein,protein,298653,Parafrankia sp. (strain EAN1pec),Parafrankia sp. (strain EAN1pec),smpB,158,PTHR30308:SF2,SSRA-BINDING PROTEIN,True
A8LKQ3,SsrA-binding protein,protein,398580,Dinoroseobacter shibae (strain DSM 16493 / NCIMB 14021 / DFL 12),Dinoroseobacter shibae (strain DSM 16493 / NCIMB 14021 / DFL 12),smpB,160,PTHR30308:SF2,SSRA-BINDING PROTEIN,True
A8M3R4,SsrA-binding protein,protein,391037,Salinispora arenicola (strain CNS-205),Salinispora arenicola (strain CNS-205),smpB,159,PTHR30308:SF2,SSRA-BINDING PROTEIN,True
A8MFY7,SsrA-binding protein,protein,350688,Alkaliphilus oremlandii (strain OhILAs),Alkaliphilus oremlandii (strain OhILAs),smpB,155,PTHR30308:SF2,SSRA-BINDING PROTEIN,True
A8YTT9,SsrA-binding protein,protein,405566,Lactobacillus helveticus (strain DPC 4571),Lactobacillus helveticus (strain DPC 4571),smpB,152,PTHR30308:SF2,SSRA-BINDING PROTEIN,True
A8Z1A9,SsrA-binding protein,protein,451516,Staphylococcus aureus (strain USA300 / TCH1516),Staphylococcus aureus (strain USA300 / TCH1516),smpB,154,PTHR30308:SF2,SSRA-BINDING PROTEIN,True
A9BD59,SsrA-binding protein,protein,93059,Prochlorococcus marinus (strain MIT 9211),Prochlorococcus marinus (strain MIT 9211),smpB,166,PTHR30308:SF2,SSRA-BINDING PROTEIN,True
A9BF44,SsrA-binding protein,protein,403833,Petrotoga mobilis (strain DSM 10674 / SJ95),Petrotoga mobilis (strain DSM 10674 / SJ95),smpB,150,PTHR30308:SF2,SSRA-BINDING PROTEIN,True
A9G109,SsrA-binding protein,protein,448385,Sorangium cellulosum (strain So ce56),Sorangium cellulosum (strain So ce56),smpB,162,PTHR30308:SF2,SSRA-BINDING PROTEIN,True
A9HIW5,SsrA-binding protein,protein,272568,Gluconacetobacter diazotrophicus (strain ATCC 49037 / DSM 5601 / CCUG 37298 / CIP 103539 / LMG 7603 / PAl5),Gluconacetobacter diazotrophicus (strain ATCC 49037 / DSM 5601 / CCUG 37298 / CIP 103539 / LMG 7603 / PAl5),smpB,154,PTHR30308:SF2,SSRA-BINDING PROTEIN,True
A9IRK6,SsrA-binding protein,protein,382640,Bartonella tribocorum (strain DSM 28219 / CCUG 45778 / CIP 105476 / IBS 506),Bartonella tribocorum (strain DSM 28219 / CCUG 45778 / CIP 105476 / IBS 506),smpB,158,PTHR30308:SF2,SSRA-BINDING PROTEIN,True
A9KGA3,SsrA-binding protein,protein,434922,Coxiella burnetii (strain Dugway 5J108-111),Coxiella burnetii (strain Dugway 5J108-111),smpB,159,PTHR30308:SF2,SSRA-BINDING PROTEIN,True
A9KPF1,SsrA-binding protein,protein,357809,Lachnoclostridium phytofermentans (strain ATCC 700394 / DSM 18823 / ISDg),Lachnoclostridium phytofermentans (strain ATCC 700394 / DSM 18823 / ISDg),smpB,154,PTHR30308:SF2,SSRA-BINDING PROTEIN,True
A9KTG8,SsrA-binding protein,protein,399599,Shewanella baltica (strain OS195),Shewanella baltica (strain OS195),smpB,163,PTHR30308:SF2,SSRA-BINDING PROTEIN,True
A9M0W1,SsrA-binding protein,protein,374833,Neisseria meningitidis serogroup C (strain 053442),Neisseria meningitidis serogroup C (strain 053442),smpB,148,PTHR30308:SF2,SSRA-BINDING PROTEIN,True
A9MA22,SsrA-binding protein,protein,483179,Brucella canis (strain ATCC 23365 / NCTC 10854 / RM-666),Brucella canis (strain ATCC 23365 / NCTC 10854 / RM-666),smpB,158,PTHR30308:SF2,SSRA-BINDING PROTEIN,True
A9MGS5,SsrA-binding protein,protein,41514,Salmonella arizonae (strain ATCC BAA-731 / CDC346-86 / RSK2980),Salmonella arizonae (strain ATCC BAA-731 / CDC346-86 / RSK2980),smpB,160,PTHR30308:SF2,SSRA-BINDING PROTEIN,True
A9MZ63,SsrA-binding protein,protein,1016998,Salmonella paratyphi B (strain ATCC BAA-1250 / SPB7),Salmonella paratyphi B (strain ATCC BAA-1250 / SPB7),smpB,160,PTHR30308:SF2,SSRA-BINDING PROTEIN,True
A9N8I5,SsrA-binding protein,protein,360115,Coxiella burnetii (strain RSA 331 / Henzerling II),Coxiella burnetii (strain RSA 331 / Henzerling II),smpB,159,PTHR30308:SF2,SSRA-BINDING PROTEIN,True
A9NF97,SsrA-binding protein,protein,441768,Acholeplasma laidlawii (strain PG-8A),Acholeplasma laidlawii (strain PG-8A),smpB,149,PTHR30308:SF2,SSRA-BINDING PROTEIN,True
A9VQ41,SsrA-binding protein,protein,315730,Bacillus mycoides (strain KBAB4),Bacillus mycoides (strain KBAB4),smpB,155,PTHR30308:SF2,SSRA-BINDING PROTEIN,True
A9VYY7,SsrA-binding protein,protein,419610,Methylorubrum extorquens (strain PA1),Methylorubrum extorquens (strain PA1),smpB,157,PTHR30308:SF2,SSRA-BINDING PROTEIN,True
A9WJ45,SsrA-binding protein,protein,324602,Chloroflexus aurantiacus (strain ATCC 29366 / DSM 635 / J-10-fl),Chloroflexus aurantiacus (strain ATCC 29366 / DSM 635 / J-10-fl),smpB,160,PTHR30308:SF2,SSRA-BINDING PROTEIN,True
A9WPU0,SsrA-binding protein,protein,288705,Renibacterium salmoninarum (strain ATCC 33209 / DSM 20767 / JCM 11484 / NBRC 15589 / NCIMB 2235),Renibacterium salmoninarum (strain ATCC 33209 / DSM 20767 / JCM 11484 / NBRC 15589 / NCIMB 2235),smpB,156,PTHR30308:SF2,SSRA-BINDING PROTEIN,True
B0BXJ2,SsrA-binding protein,protein,452659,Rickettsia rickettsii (strain Iowa),Rickettsia rickettsii (strain Iowa),smpB,152,PTHR30308:SF2,SSRA-BINDING PROTEIN,True
B0BZP2,SsrA-binding protein,protein,329726,Acaryochloris marina (strain MBIC 11017),Acaryochloris marina (strain MBIC 11017),smpB,154,PTHR30308:SF2,SSRA-BINDING PROTEIN,True
B0CKX3,SsrA-binding protein,protein,470137,Brucella suis (strain ATCC 23445 / NCTC 10510),Brucella suis (strain ATCC 23445 / NCTC 10510),smpB,158,PTHR30308:SF2,SSRA-BINDING PROTEIN,True
B0JTG1,SsrA-binding protein,protein,449447,Microcystis aeruginosa (strain NIES-843 / IAM M-2473),Microcystis aeruginosa (strain NIES-843 / IAM M-2473),smpB,154,PTHR30308:SF2,SSRA-BINDING PROTEIN,True
B0K718,SsrA-binding protein,protein,399726,Thermoanaerobacter sp. (strain X514),Thermoanaerobacter sp. (strain X514),smpB,156,PTHR30308:SF2,SSRA-BINDING PROTEIN,True
B0KA44,SsrA-binding protein,protein,340099,Thermoanaerobacter pseudethanolicus (strain ATCC 33223 / 39E),Thermoanaerobacter pseudethanolicus (strain ATCC 33223 / 39E),smpB,156,PTHR30308:SF2,SSRA-BINDING PROTEIN,True
B0KIT1,SsrA-binding protein,protein,76869,Pseudomonas putida (strain GB-1),Pseudomonas putida (strain GB-1),smpB,160,PTHR30308:SF2,SSRA-BINDING PROTEIN,True
B0RF94,SsrA-binding protein,protein,31964,Clavibacter sepedonicus,Clavibacter sepedonicus,smpB,158,PTHR30308:SF2,SSRA-BINDING PROTEIN,True
B0RVV0,SsrA-binding protein,protein,509169,Xanthomonas campestris pv. campestris (strain B100),Xanthomonas campestris pv. campestris (strain B100),smpB,167,PTHR30308:SF2,SSRA-BINDING PROTEIN,True
B0T1M3,SsrA-binding protein,protein,366602,Caulobacter sp. (strain K31),Caulobacter sp. (strain K31),smpB,152,PTHR30308:SF2,SSRA-BINDING PROTEIN,True
B0TLG2,SsrA-binding protein,protein,458817,Shewanella halifaxensis (strain HAW-EB4),Shewanella halifaxensis (strain HAW-EB4),smpB,164,PTHR30308:SF2,SSRA-BINDING PROTEIN,True
B0TY34,SsrA-binding protein,protein,484022,Francisella philomiragia subsp. philomiragia (strain ATCC 25017 / CCUG 19701 / FSC 153 / O#319-036),Francisella philomiragia subsp. philomiragia (strain ATCC 25017 / CCUG 19701 / FSC 153 / O#319-036),smpB,157,PTHR30308:SF2,SSRA-BINDING PROTEIN,True
B0U3K6,SsrA-binding protein,protein,405440,Xylella fastidiosa (strain M12),Xylella fastidiosa (strain M12),smpB,167,PTHR30308:SF2,SSRA-BINDING PROTEIN,True
B0U7H1,SsrA-binding protein,protein,426117,Methylobacterium sp. (strain 4-46),Methylobacterium sp. (strain 4-46),smpB,157,PTHR30308:SF2,SSRA-BINDING PROTEIN,True
B0USL1,SsrA-binding protein,protein,228400,Histophilus somni (strain 2336),Histophilus somni (strain 2336),smpB,160,PTHR30308:SF2,SSRA-BINDING PROTEIN,True
B0V8G6,SsrA-binding protein,protein,509173,Acinetobacter baumannii (strain AYE),Acinetobacter baumannii (strain AYE),smpB,158,PTHR30308:SF2,SSRA-BINDING PROTEIN,True
B1AI43,SsrA-binding protein,protein,505682,Ureaplasma parvum serovar 3 (strain ATCC 27815 / 27 / NCTC 11736),Ureaplasma parvum serovar 3 (strain ATCC 27815 / 27 / NCTC 11736),smpB,141,PTHR30308:SF2,SSRA-BINDING PROTEIN,True
B1HWE9,SsrA-binding protein,protein,444177,Lysinibacillus sphaericus (strain C3-41),Lysinibacillus sphaericus (strain C3-41),smpB,155,PTHR30308:SF2,SSRA-BINDING PROTEIN,True
B1I1B6,SsrA-binding protein,protein,477974,Desulforudis audaxviator (strain MP104C),Desulforudis audaxviator (strain MP104C),smpB,153,PTHR30308:SF2,SSRA-BINDING PROTEIN,True
B1IBD6,SsrA-binding protein,protein,487214,Streptococcus pneumoniae (strain Hungary19A-6),Streptococcus pneumoniae (strain Hungary19A-6),smpB,155,PTHR30308:SF2,SSRA-BINDING PROTEIN,True
B1IDC3,SsrA-binding protein,protein,498213,Clostridium botulinum (strain Okra / Type B1),Clostridium botulinum (strain Okra / Type B1),smpB,156,PTHR30308:SF2,SSRA-BINDING PROTEIN,True
B1IVL4,SsrA-binding protein,protein,481805,Escherichia coli (strain ATCC 8739 / DSM 1576 / NBRC 3972 / NCIMB 8545 / WDCM 00012 / Crooks),Escherichia coli (strain ATCC 8739 / DSM 1576 / NBRC 3972 / NCIMB 8545 / WDCM 00012 / Crooks),smpB,160,PTHR30308:SF2,SSRA-BINDING PROTEIN,True
B1J247,SsrA-binding protein,protein,390235,Pseudomonas putida (strain W619),Pseudomonas putida (strain W619),smpB,160,PTHR30308:SF2,SSRA-BINDING PROTEIN,True
B1KKG8,SsrA-binding protein,protein,392500,Shewanella woodyi (strain ATCC 51908 / MS32),Shewanella woodyi (strain ATCC 51908 / MS32),smpB,164,PTHR30308:SF2,SSRA-BINDING PROTEIN,True
B1KTK2,SsrA-binding protein,protein,498214,Clostridium botulinum (strain Loch Maree / Type A3),Clostridium botulinum (strain Loch Maree / Type A3),smpB,156,PTHR30308:SF2,SSRA-BINDING PROTEIN,True
B1L9P9,SsrA-binding protein,protein,126740,Thermotoga sp. (strain RQ2),Thermotoga sp. (strain RQ2),smpB,150,PTHR30308:SF2,SSRA-BINDING PROTEIN,True
B1LPC7,SsrA-binding protein,protein,439855,Escherichia coli (strain SMS-3-5 / SECEC),Escherichia coli (strain SMS-3-5 / SECEC),smpB,160,PTHR30308:SF2,SSRA-BINDING PROTEIN,True
B1LTE0,SsrA-binding protein,protein,426355,Methylobacterium radiotolerans (strain ATCC 27329 / DSM 1819 / JCM 2831 / NBRC 15690 / NCIMB 10815 / 0-1),Methylobacterium radiotolerans (strain ATCC 27329 / DSM 1819 / JCM 2831 / NBRC 15690 / NCIMB 10815 / 0-1),smpB,157,PTHR30308:SF2,SSRA-BINDING PROTEIN,True
B1MEU3,SsrA-binding protein,protein,561007,Mycobacteroides abscessus (strain ATCC 19977 / DSM 44196 / CCUG 20993 / CIP 104536 / JCM 13569 / NCTC 13031 / TMC 1543 / L948),Mycobacteroides abscessus (strain ATCC 19977 / DSM 44196 / CCUG 20993 / CIP 104536 / JCM 13569 / NCTC 13031 / TMC 1543 / L948),smpB,159,PTHR30308:SF2,SSRA-BINDING PROTEIN,True
B1VI76,SsrA-binding protein,protein,504474,Corynebacterium urealyticum (strain ATCC 43042 / DSM 7109),Corynebacterium urealyticum (strain ATCC 43042 / DSM 7109),smpB,178,PTHR30308:SF2,SSRA-BINDING PROTEIN,True
B1XBU0,SsrA-binding protein,protein,316385,Escherichia coli (strain K12 / DH10B),Escherichia coli (strain K12 / DH10B),smpB,160,PTHR30308:SF2,SSRA-BINDING PROTEIN,True
B1Y225,SsrA-binding protein,protein,395495,Leptothrix cholodnii (strain ATCC 51168 / LMG 8142 / SP-6),Leptothrix cholodnii (strain ATCC 51168 / LMG 8142 / SP-6),smpB,154,PTHR30308:SF2,SSRA-BINDING PROTEIN,True
B1YL27,SsrA-binding protein,protein,262543,Exiguobacterium sibiricum (strain DSM 17290 / CCUG 55495 / CIP 109462 / JCM 13490 / 255-15),Exiguobacterium sibiricum (strain DSM 17290 / CCUG 55495 / CIP 109462 / JCM 13490 / 255-15),smpB,156,PTHR30308:SF2,SSRA-BINDING PROTEIN,True
B1ZJQ3,SsrA-binding protein,protein,441620,Methylorubrum populi (strain ATCC BAA-705 / NCIMB 13946 / BJ001),Methylorubrum populi (strain ATCC BAA-705 / NCIMB 13946 / BJ001),smpB,157,PTHR30308:SF2,SSRA-BINDING PROTEIN,True
B2FMX5,SsrA-binding protein,protein,522373,Stenotrophomonas maltophilia (strain K279a),Stenotrophomonas maltophilia (strain K279a),smpB,167,PTHR30308:SF2,SSRA-BINDING PROTEIN,True
B2G624,SsrA-binding protein,protein,557433,Limosilactobacillus reuteri subsp. reuteri (strain JCM 1112),Limosilactobacillus reuteri subsp. reuteri (strain JCM 1112),smpB,157,PTHR30308:SF2,SSRA-BINDING PROTEIN,True
B2GAM5,SsrA-binding protein,protein,334390,Limosilactobacillus fermentum (strain NBRC 3956 / LMG 18251),Limosilactobacillus fermentum (strain NBRC 3956 / LMG 18251),smpB,157,PTHR30308:SF2,SSRA-BINDING PROTEIN,True
B2HUN4,SsrA-binding protein,protein,405416,Acinetobacter baumannii (strain ACICU),Acinetobacter baumannii (strain ACICU),smpB,158,PTHR30308:SF2,SSRA-BINDING PROTEIN,True
B2I6G4,SsrA-binding protein,protein,405441,Xylella fastidiosa (strain M23),Xylella fastidiosa (strain M23),smpB,167,PTHR30308:SF2,SSRA-BINDING PROTEIN,True
B2IDQ9,SsrA-binding protein,protein,395963,Beijerinckia indica subsp. indica (strain ATCC 9039 / DSM 1715 / NCIMB 8712),Beijerinckia indica subsp. indica (strain ATCC 9039 / DSM 1715 / NCIMB 8712),smpB,158,PTHR30308:SF2,SSRA-BINDING PROTEIN,True
B2IPC9,SsrA-binding protein,protein,516950,Streptococcus pneumoniae (strain CGSP14),Streptococcus pneumoniae (strain CGSP14),smpB,155,PTHR30308:SF2,SSRA-BINDING PROTEIN,True
B2J722,SsrA-binding protein,protein,63737,Nostoc punctiforme (strain ATCC 29133 / PCC 73102),Nostoc punctiforme (strain ATCC 29133 / PCC 73102),smpB,155,PTHR30308:SF2,SSRA-BINDING PROTEIN,True
B2KCF8,SsrA-binding protein,protein,445932,Elusimicrobium minutum (strain Pei191),Elusimicrobium minutum (strain Pei191),smpB,157,PTHR30308:SF2,SSRA-BINDING PROTEIN,True
B2S2D1,SsrA-binding protein,protein,455434,Treponema pallidum subsp. pallidum (strain SS14),Treponema pallidum subsp. pallidum (strain SS14),smpB,154,PTHR30308:SF2,SSRA-BINDING PROTEIN,True
B2SAC5,SsrA-binding protein,protein,430066,Brucella abortus (strain S19),Brucella abortus (strain S19),smpB,158,PTHR30308:SF2,SSRA-BINDING PROTEIN,True
B2SGA3,SsrA-binding protein,protein,441952,Francisella tularensis subsp. mediasiatica (strain FSC147),Francisella tularensis subsp. mediasiatica (strain FSC147),smpB,157,PTHR30308:SF2,SSRA-BINDING PROTEIN,True
B2SQV2,SsrA-binding protein,protein,360094,Xanthomonas oryzae pv. oryzae (strain PXO99A),Xanthomonas oryzae pv. oryzae (strain PXO99A),smpB,167,PTHR30308:SF2,SSRA-BINDING PROTEIN,True
B2TPV9,SsrA-binding protein,protein,935198,Clostridium botulinum (strain Eklund 17B / Type B),Clostridium botulinum (strain Eklund 17B / Type B),smpB,156,PTHR30308:SF2,SSRA-BINDING PROTEIN,True
B2TYP2,SsrA-binding protein,protein,344609,Shigella boydii serotype 18 (strain CDC 3083-94 / BS512),Shigella boydii serotype 18 (strain CDC 3083-94 / BS512),smpB,160,PTHR30308:SF2,SSRA-BINDING PROTEIN,True
B2UBC4,SsrA-binding protein,protein,402626,Ralstonia pickettii (strain 12J),Ralstonia pickettii (strain 12J),smpB,148,PTHR30308:SF2,SSRA-BINDING PROTEIN,True
B2UVI9,SsrA-binding protein,protein,512562,Helicobacter pylori (strain Shi470),Helicobacter pylori (strain Shi470),smpB,152,PTHR30308:SF2,SSRA-BINDING PROTEIN,True
B2UY12,SsrA-binding protein,protein,508767,Clostridium botulinum (strain Alaska E43 / Type E3),Clostridium botulinum (strain Alaska E43 / Type E3),smpB,156,PTHR30308:SF2,SSRA-BINDING PROTEIN,True
B2V9T6,SsrA-binding protein,protein,436114,Sulfurihydrogenibium sp. (strain YO3AOP1),Sulfurihydrogenibium sp. (strain YO3AOP1),smpB,152,PTHR30308:SF2,SSRA-BINDING PROTEIN,True
B2VEC0,SsrA-binding protein,protein,465817,Erwinia tasmaniensis (strain DSM 17950 / CFBP 7177 / CIP 109463 / NCPPB 4357 / Et1/99),Erwinia tasmaniensis (strain DSM 17950 / CFBP 7177 / CIP 109463 / NCPPB 4357 / Et1/99),smpB,160,PTHR30308:SF2,SSRA-BINDING PROTEIN,True
B3CPW2,SsrA-binding protein,protein,570417,Wolbachia pipientis subsp. Culex pipiens (strain wPip),Wolbachia pipientis subsp. Culex pipiens (strain wPip),smpB,149,PTHR30308:SF2,SSRA-BINDING PROTEIN,True
B3CQP3,SsrA-binding protein,protein,334380,Orientia tsutsugamushi (strain Ikeda),Orientia tsutsugamushi (strain Ikeda) (Rickettsia tsutsugamushi),smpB,153,PTHR30308:SF2,SSRA-BINDING PROTEIN,True
B3DTB5,SsrA-binding protein,protein,205913,Bifidobacterium longum (strain DJO10A),Bifidobacterium longum (strain DJO10A),smpB,158,PTHR30308:SF2,SSRA-BINDING PROTEIN,True
B3H1K6,SsrA-binding protein,protein,537457,Actinobacillus pleuropneumoniae serotype 7 (strain AP76),Actinobacillus pleuropneumoniae serotype 7 (strain AP76),smpB,159,PTHR30308:SF2,SSRA-BINDING PROTEIN,True
B3PF48,SsrA-binding protein,protein,498211,Cellvibrio japonicus (strain Ueda107),Cellvibrio japonicus (strain Ueda107),smpB,159,PTHR30308:SF2,SSRA-BINDING PROTEIN,True
B3PUN0,SsrA-binding protein,protein,491916,Rhizobium etli (strain CIAT 652),Rhizobium etli (strain CIAT 652),smpB,159,PTHR30308:SF2,SSRA-BINDING PROTEIN,True
B3QJG5,SsrA-binding protein,protein,395960,Rhodopseudomonas palustris (strain TIE-1),Rhodopseudomonas palustris (strain TIE-1),smpB,157,PTHR30308:SF2,SSRA-BINDING PROTEIN,True
B3R297,SsrA-binding protein,protein,977880,Cupriavidus taiwanensis (strain DSM 17343 / BCRC 17206 / CCUG 44338 / CIP 107171 / LMG 19424 / R1),Cupriavidus taiwanensis (strain DSM 17343 / BCRC 17206 / CCUG 44338 / CIP 107171 / LMG 19424 / R1),smpB,149,PTHR30308:SF2,SSRA-BINDING PROTEIN,True
B3WCX4,SsrA-binding protein,protein,543734,Lacticaseibacillus casei (strain BL23),Lacticaseibacillus casei (strain BL23),smpB,157,PTHR30308:SF2,SSRA-BINDING PROTEIN,True
B4F065,SsrA-binding protein,protein,529507,Proteus mirabilis (strain HI4320),Proteus mirabilis (strain HI4320),smpB,160,PTHR30308:SF2,SSRA-BINDING PROTEIN,True
B4RXY7,SsrA-binding protein,protein,1774373,Alteromonas mediterranea (strain DSM 17117 / CIP 110805 / LMG 28347 / Deep ecotype),Alteromonas mediterranea (strain DSM 17117 / CIP 110805 / LMG 28347 / Deep ecotype),smpB,159,PTHR30308:SF2,SSRA-BINDING PROTEIN,True
B4SS56,SsrA-binding protein,protein,391008,Stenotrophomonas maltophilia (strain R551-3),Stenotrophomonas maltophilia (strain R551-3),smpB,167,PTHR30308:SF2,SSRA-BINDING PROTEIN,True
B4T2C5,SsrA-binding protein,protein,423368,Salmonella newport (strain SL254),Salmonella newport (strain SL254),smpB,160,PTHR30308:SF2,SSRA-BINDING PROTEIN,True
B4TE63,SsrA-binding protein,protein,454169,Salmonella heidelberg (strain SL476),Salmonella heidelberg (strain SL476),smpB,160,PTHR30308:SF2,SSRA-BINDING PROTEIN,True
B4TS67,SsrA-binding protein,protein,439843,Salmonella schwarzengrund (strain CVM19633),Salmonella schwarzengrund (strain CVM19633),smpB,160,PTHR30308:SF2,SSRA-BINDING PROTEIN,True
