id,name,entry_type,source_tax_id,source_tax_name,full_tax_name,gene,length,subfamily,subfamily_name,in_alphafold
B4U434,SsrA-binding protein,protein,552526,Streptococcus equi subsp. zooepidemicus (strain MGCS10565),Streptococcus equi subsp. zooepidemicus (strain MGCS10565),smpB,155,PTHR30308:SF2,SSRA-BINDING PROTEIN,True
B4UDZ1,SsrA-binding protein,protein,447217,Anaeromyxobacter sp. (strain K),Anaeromyxobacter sp. (strain K),smpB,163,PTHR30308:SF2,SSRA-BINDING PROTEIN,True
B5BEA6,SsrA-binding protein,protein,554290,Salmonella paratyphi A (strain AKU_12601),Salmonella paratyphi A (strain AKU_12601),smpB,160,PTHR30308:SF2,SSRA-BINDING PROTEIN,True
B5E494,SsrA-binding protein,protein,512566,Streptococcus pneumoniae serotype 19F (strain G54),Streptococcus pneumoniae serotype 19F (strain G54),smpB,155,PTHR30308:SF2,SSRA-BINDING PROTEIN,True
B5F2A0,SsrA-binding protein,protein,454166,Salmonella agona (strain SL483),Salmonella agona (strain SL483),smpB,160,PTHR30308:SF2,SSRA-BINDING PROTEIN,True
B5FA19,SsrA-binding protein,protein,388396,Aliivibrio fischeri (strain MJ11),Aliivibrio fischeri (strain MJ11),smpB,161,PTHR30308:SF2,SSRA-BINDING PROTEIN,True
B5QUH5,SsrA-binding protein,protein,550537,Salmonella enteritidis PT4 (strain P125109),Salmonella enteritidis PT4 (strain P125109),smpB,160,PTHR30308:SF2,SSRA-BINDING PROTEIN,True
B5RD96,SsrA-binding protein,protein,550538,Salmonella gallinarum (strain 287/91 / NCTC 13346),Salmonella gallinarum (strain 287/91 / NCTC 13346),smpB,160,PTHR30308:SF2,SSRA-BINDING PROTEIN,True
B5XK94,SsrA-binding protein,protein,471876,Streptococcus pyogenes serotype M49 (strain NZ131),Streptococcus pyogenes serotype M49 (strain NZ131),smpB,155,PTHR30308:SF2,SSRA-BINDING PROTEIN,True
B5XVJ3,SsrA-binding protein,protein,507522,Klebsiella variicola (strain 342),Klebsiella variicola (strain 342),smpB,160,PTHR30308:SF2,SSRA-BINDING PROTEIN,True
B5Y7T1,SsrA-binding protein,protein,309798,Coprothermobacter proteolyticus (strain ATCC 35245 / DSM 5265 / OCM 4 / BT),Coprothermobacter proteolyticus (strain ATCC 35245 / DSM 5265 / OCM 4 / BT),smpB,150,PTHR30308:SF2,SSRA-BINDING PROTEIN,True
B5Z237,SsrA-binding protein,protein,444450,Escherichia coli O157:H7 (strain EC4115 / EHEC),Escherichia coli O157:H7 (strain EC4115 / EHEC),smpB,160,PTHR30308:SF2,SSRA-BINDING PROTEIN,True
B5Z963,SsrA-binding protein,protein,563041,Helicobacter pylori (strain G27),Helicobacter pylori (strain G27),smpB,152,PTHR30308:SF2,SSRA-BINDING PROTEIN,True
B5ZW65,SsrA-binding protein,protein,395492,Rhizobium leguminosarum bv. trifolii (strain WSM2304),Rhizobium leguminosarum bv. trifolii (strain WSM2304),smpB,159,PTHR30308:SF2,SSRA-BINDING PROTEIN,True
B6EKA9,SsrA-binding protein,protein,316275,Aliivibrio salmonicida (strain LFI1238),Aliivibrio salmonicida (strain LFI1238),smpB,161,PTHR30308:SF2,SSRA-BINDING PROTEIN,True
B6I641,SsrA-binding protein,protein,409438,Escherichia coli (strain SE11),Escherichia coli (strain SE11),smpB,160,PTHR30308:SF2,SSRA-BINDING PROTEIN,True
B6IZH7,SsrA-binding protein,protein,434923,Coxiella burnetii (strain CbuG_Q212),Coxiella burnetii (strain CbuG_Q212),smpB,159,PTHR30308:SF2,SSRA-BINDING PROTEIN,True
B6J7W1,SsrA-binding protein,protein,434924,Coxiella burnetii (strain CbuK_Q154),Coxiella burnetii (strain CbuK_Q154),smpB,159,PTHR30308:SF2,SSRA-BINDING PROTEIN,True
B6JGA6,SsrA-binding protein,protein,504832,Afipia carboxidovorans (strain ATCC 49405 / DSM 1227 / KCTC 32145 / OM5),Afipia carboxidovorans (strain ATCC 49405 / DSM 1227 / KCTC 32145 / OM5),smpB,157,PTHR30308:SF2,SSRA-BINDING PROTEIN,True
B6JNU2,SsrA-binding protein,protein,570508,Helicobacter pylori (strain P12),Helicobacter pylori (strain P12),smpB,152,PTHR30308:SF2,SSRA-BINDING PROTEIN,True
B7GLX3,SsrA-binding protein,protein,491915,Anoxybacillus flavithermus (strain DSM 21510 / WK1),Anoxybacillus flavithermus (strain DSM 21510 / WK1),smpB,154,PTHR30308:SF2,SSRA-BINDING PROTEIN,True
B7GUE4,SsrA-binding protein,protein,391904,Bifidobacterium longum subsp. infantis (strain ATCC 15697 / DSM 20088 / JCM 1222 / NCTC 11817 / S12),Bifidobacterium longum subsp. infantis (strain ATCC 15697 / DSM 20088 / JCM 1222 / NCTC 11817 / S12),smpB,158,PTHR30308:SF2,SSRA-BINDING PROTEIN,True
B7GYP8,SsrA-binding protein,protein,557600,Acinetobacter baumannii (strain AB307-0294),Acinetobacter baumannii (strain AB307-0294),smpB,158,PTHR30308:SF2,SSRA-BINDING PROTEIN,True
B7HEC5,SsrA-binding protein,protein,405532,Bacillus cereus (strain B4264),Bacillus cereus (strain B4264),smpB,155,PTHR30308:SF2,SSRA-BINDING PROTEIN,True
B7HW45,SsrA-binding protein,protein,405534,Bacillus cereus (strain AH187),Bacillus cereus (strain AH187),smpB,155,PTHR30308:SF2,SSRA-BINDING PROTEIN,True
B7I7Q2,SsrA-binding protein,protein,480119,Acinetobacter baumannii (strain AB0057),Acinetobacter baumannii (strain AB0057),smpB,158,PTHR30308:SF2,SSRA-BINDING PROTEIN,True
B7IFV5,SsrA-binding protein,protein,484019,Thermosipho africanus (strain TCF52B),Thermosipho africanus (strain TCF52B),smpB,149,PTHR30308:SF2,SSRA-BINDING PROTEIN,True
B7IP12,SsrA-binding protein,protein,405531,Bacillus cereus (strain G9842),Bacillus cereus (strain G9842),smpB,155,PTHR30308:SF2,SSRA-BINDING PROTEIN,True
B7JFF5,SsrA-binding protein,protein,405535,Bacillus cereus (strain AH820),Bacillus cereus (strain AH820),smpB,155,PTHR30308:SF2,SSRA-BINDING PROTEIN,True
B7KF17,SsrA-binding protein,protein,65393,Gloeothece citriformis (strain PCC 7424),Gloeothece citriformis (strain PCC 7424),smpB,155,PTHR30308:SF2,SSRA-BINDING PROTEIN,True
B7KVC8,SsrA-binding protein,protein,440085,Methylorubrum extorquens (strain CM4 / NCIMB 13688),Methylorubrum extorquens (strain CM4 / NCIMB 13688),smpB,157,PTHR30308:SF2,SSRA-BINDING PROTEIN,True
B7LDK8,SsrA-binding protein,protein,585055,Escherichia coli (strain 55989 / EAEC),Escherichia coli (strain 55989 / EAEC),smpB,160,PTHR30308:SF2,SSRA-BINDING PROTEIN,True
B7LUV4,SsrA-binding protein,protein,585054,Escherichia fergusonii (strain ATCC 35469 / DSM 13698 / CCUG 18766 / IAM 14443 / JCM 21226 / LMG 7866 / NBRC 102419 / NCTC 12128 / CDC 0568-73),Escherichia fergusonii (strain ATCC 35469 / DSM 13698 / CCUG 18766 / IAM 14443 / JCM 21226 / LMG 7866 / NBRC 102419 / NCTC 12128 / CDC 0568-73),smpB,160,PTHR30308:SF2,SSRA-BINDING PROTEIN,True
B7M989,SsrA-binding protein,protein,585034,Escherichia coli O8 (strain IAI1),Escherichia coli O8 (strain IAI1),smpB,160,PTHR30308:SF2,SSRA-BINDING PROTEIN,True
B7MIV7,SsrA-binding protein,protein,585035,Escherichia coli O45:K1 (strain S88 / ExPEC),Escherichia coli O45:K1 (strain S88 / ExPEC),smpB,160,PTHR30308:SF2,SSRA-BINDING PROTEIN,True
B7MYQ8,SsrA-binding protein,protein,585397,Escherichia coli O81 (strain ED1a),Escherichia coli O81 (strain ED1a),smpB,160,PTHR30308:SF2,SSRA-BINDING PROTEIN,True
B7N6K5,SsrA-binding protein,protein,585056,Escherichia coli O17:K52:H18 (strain UMN026 / ExPEC),Escherichia coli O17:K52:H18 (strain UMN026 / ExPEC),smpB,160,PTHR30308:SF2,SSRA-BINDING PROTEIN,True
B7NSB8,SsrA-binding protein,protein,585057,Escherichia coli O7:K1 (strain IAI39 / ExPEC),Escherichia coli O7:K1 (strain IAI39 / ExPEC),smpB,160,PTHR30308:SF2,SSRA-BINDING PROTEIN,True
B7UH68,SsrA-binding protein,protein,574521,Escherichia coli O127:H6 (strain E2348/69 / EPEC),Escherichia coli O127:H6 (strain E2348/69 / EPEC),smpB,160,PTHR30308:SF2,SSRA-BINDING PROTEIN,True
B7V1I0,SsrA-binding protein,protein,557722,Pseudomonas aeruginosa (strain LESB58),Pseudomonas aeruginosa (strain LESB58),smpB,159,PTHR30308:SF2,SSRA-BINDING PROTEIN,True
B8CYF2,SsrA-binding protein,protein,373903,Halothermothrix orenii (strain H 168 / OCM 544 / DSM 9562),Halothermothrix orenii (strain H 168 / OCM 544 / DSM 9562),smpB,155,PTHR30308:SF2,SSRA-BINDING PROTEIN,True
B8D7F1,SsrA-binding protein,protein,561501,Buchnera aphidicola subsp. Acyrthosiphon pisum (strain Tuc7),Buchnera aphidicola subsp. Acyrthosiphon pisum (strain Tuc7),smpB,162,PTHR30308:SF2,SSRA-BINDING PROTEIN,True
B8D947,SsrA-binding protein,protein,563178,Buchnera aphidicola subsp. Acyrthosiphon pisum (strain 5A),Buchnera aphidicola subsp. Acyrthosiphon pisum (strain 5A),smpB,162,PTHR30308:SF2,SSRA-BINDING PROTEIN,True
B8DDA8,SsrA-binding protein,protein,552536,Listeria monocytogenes serotype 4a (strain HCC23),Listeria monocytogenes serotype 4a (strain HCC23),smpB,154,PTHR30308:SF2,SSRA-BINDING PROTEIN,True
B8EAZ5,SsrA-binding protein,protein,407976,Shewanella baltica (strain OS223),Shewanella baltica (strain OS223),smpB,163,PTHR30308:SF2,SSRA-BINDING PROTEIN,True
B8ESC7,SsrA-binding protein,protein,395965,Methylocella silvestris (strain DSM 15510 / CIP 108128 / LMG 27833 / NCIMB 13906 / BL2),Methylocella silvestris (strain DSM 15510 / CIP 108128 / LMG 27833 / NCIMB 13906 / BL2),smpB,158,PTHR30308:SF2,SSRA-BINDING PROTEIN,True
B8F4Q7,SsrA-binding protein,protein,557723,Glaesserella parasuis serovar 5 (strain SH0165),Glaesserella parasuis serovar 5 (strain SH0165),smpB,158,PTHR30308:SF2,SSRA-BINDING PROTEIN,True
B8FXV6,SsrA-binding protein,protein,272564,Desulfitobacterium hafniense (strain DSM 10664 / DCB-2),Desulfitobacterium hafniense (strain DSM 10664 / DCB-2),smpB,156,PTHR30308:SF2,SSRA-BINDING PROTEIN,True
B8G4V8,SsrA-binding protein,protein,326427,Chloroflexus aggregans (strain MD-66 / DSM 9485),Chloroflexus aggregans (strain MD-66 / DSM 9485),smpB,158,PTHR30308:SF2,SSRA-BINDING PROTEIN,True
B8H482,SsrA-binding protein,protein,565050,Caulobacter vibrioides (strain NA1000 / CB15N),Caulobacter vibrioides (strain NA1000 / CB15N),smpB,152,PTHR30308:SF2,SSRA-BINDING PROTEIN,True
B8HBH4,SsrA-binding protein,protein,452863,Pseudarthrobacter chlorophenolicus (strain ATCC 700700 / DSM 12829 / CIP 107037 / JCM 12360 / KCTC 9906 / NCIMB 13794 / A6),Pseudarthrobacter chlorophenolicus (strain ATCC 700700 / DSM 12829 / CIP 107037 / JCM 12360 / KCTC 9906 / NCIMB 13794 / A6),smpB,158,PTHR30308:SF2,SSRA-BINDING PROTEIN,True
B8I8G4,SsrA-binding protein,protein,394503,Ruminiclostridium cellulolyticum (strain ATCC 35319 / DSM 5812 / JCM 6584 / H10),Ruminiclostridium cellulolyticum (strain ATCC 35319 / DSM 5812 / JCM 6584 / H10),smpB,154,PTHR30308:SF2,SSRA-BINDING PROTEIN,True
B8INF1,SsrA-binding protein,protein,460265,Methylobacterium nodulans (strain LMG 21967 / CNCM I-2342 / ORS 2060),Methylobacterium nodulans (strain LMG 21967 / CNCM I-2342 / ORS 2060),smpB,157,PTHR30308:SF2,SSRA-BINDING PROTEIN,True
B8J7G5,SsrA-binding protein,protein,455488,Anaeromyxobacter dehalogenans (strain ATCC BAA-258 / DSM 21875 / 2CP-1),Anaeromyxobacter dehalogenans (strain ATCC BAA-258 / DSM 21875 / 2CP-1),smpB,163,PTHR30308:SF2,SSRA-BINDING PROTEIN,True
B8ZPD4,SsrA-binding protein,protein,561276,Streptococcus pneumoniae (strain ATCC 700669 / Spain 23F-1),Streptococcus pneumoniae (strain ATCC 700669 / Spain 23F-1),smpB,155,PTHR30308:SF2,SSRA-BINDING PROTEIN,True
B8ZUV3,SsrA-binding protein,protein,561304,Mycobacterium leprae (strain Br4923),Mycobacterium leprae (strain Br4923),smpB,160,PTHR30308:SF2,SSRA-BINDING PROTEIN,True
B9DJK4,SsrA-binding protein,protein,396513,Staphylococcus carnosus (strain TM300),Staphylococcus carnosus (strain TM300),smpB,156,PTHR30308:SF2,SSRA-BINDING PROTEIN,True
B9DTZ7,SsrA-binding protein,protein,218495,Streptococcus uberis (strain ATCC BAA-854 / 0140J),Streptococcus uberis (strain ATCC BAA-854 / 0140J),smpB,155,PTHR30308:SF2,SSRA-BINDING PROTEIN,True
B9E6A8,SsrA-binding protein,protein,583346,Clostridium kluyveri (strain NBRC 12016),Clostridium kluyveri (strain NBRC 12016),smpB,157,PTHR30308:SF2,SSRA-BINDING PROTEIN,True
B9EAH5,SsrA-binding protein,protein,458233,Macrococcoides caseolyticum (strain JCSC5402),Macrococcoides caseolyticum (strain JCSC5402),smpB,153,PTHR30308:SF2,SSRA-BINDING PROTEIN,True
B9J4L7,SsrA-binding protein,protein,361100,Bacillus cereus (strain Q1),Bacillus cereus (strain Q1),smpB,155,PTHR30308:SF2,SSRA-BINDING PROTEIN,True
B9JC66,SsrA-binding protein,protein,311403,Rhizobium rhizogenes (strain K84 / ATCC BAA-868),Rhizobium rhizogenes (strain K84 / ATCC BAA-868),smpB,159,PTHR30308:SF2,SSRA-BINDING PROTEIN,True
B9JUM9,SsrA-binding protein,protein,311402,Allorhizobium ampelinum (strain ATCC BAA-846 / DSM 112012 / S4),Allorhizobium ampelinum (strain ATCC BAA-846 / DSM 112012 / S4),smpB,158,PTHR30308:SF2,SSRA-BINDING PROTEIN,True
B9KH06,SsrA-binding protein,protein,320483,Anaplasma marginale (strain Florida),Anaplasma marginale (strain Florida),smpB,149,PTHR30308:SF2,SSRA-BINDING PROTEIN,True
B9KMM4,SsrA-binding protein,protein,557760,Cereibacter sphaeroides (strain KD131 / KCTC 12085),Cereibacter sphaeroides (strain KD131 / KCTC 12085),smpB,157,PTHR30308:SF2,SSRA-BINDING PROTEIN,True
B9L603,SsrA-binding protein,protein,598659,Nautilia profundicola (strain ATCC BAA-1463 / DSM 18972 / AmH),Nautilia profundicola (strain ATCC BAA-1463 / DSM 18972 / AmH),smpB,151,PTHR30308:SF2,SSRA-BINDING PROTEIN,True
B9LD60,SsrA-binding protein,protein,480224,Chloroflexus aurantiacus (strain ATCC 29364 / DSM 637 / Y-400-fl),Chloroflexus aurantiacus (strain ATCC 29364 / DSM 637 / Y-400-fl),smpB,160,PTHR30308:SF2,SSRA-BINDING PROTEIN,True
B9MGQ0,SsrA-binding protein,protein,535289,Acidovorax ebreus (strain TPSY),Acidovorax ebreus (strain TPSY),smpB,157,PTHR30308:SF2,SSRA-BINDING PROTEIN,True
B9MNR6,SsrA-binding protein,protein,521460,Caldicellulosiruptor bescii (strain ATCC BAA-1888 / DSM 6725 / KCTC 15123 / Z-1320),Caldicellulosiruptor bescii (strain ATCC BAA-1888 / DSM 6725 / KCTC 15123 / Z-1320),smpB,158,PTHR30308:SF2,SSRA-BINDING PROTEIN,True
C0MAA1,SsrA-binding protein,protein,553482,Streptococcus equi subsp. equi (strain 4047),Streptococcus equi subsp. equi (strain 4047),smpB,155,PTHR30308:SF2,SSRA-BINDING PROTEIN,True
C0MCH3,SsrA-binding protein,protein,553483,Streptococcus equi subsp. zooepidemicus (strain H70),Streptococcus equi subsp. zooepidemicus (strain H70),smpB,155,PTHR30308:SF2,SSRA-BINDING PROTEIN,True
C0PW29,SsrA-binding protein,protein,476213,Salmonella paratyphi C (strain RKS4594),Salmonella paratyphi C (strain RKS4594),smpB,160,PTHR30308:SF2,SSRA-BINDING PROTEIN,True
C0QUM8,SsrA-binding protein,protein,123214,Persephonella marina (strain DSM 14350 / EX-H1),Persephonella marina (strain DSM 14350 / EX-H1),smpB,152,PTHR30308:SF2,SSRA-BINDING PROTEIN,True
C0R392,SsrA-binding protein,protein,66084,Wolbachia sp. subsp. Drosophila simulans (strain wRi),Wolbachia sp. subsp. Drosophila simulans (strain wRi),smpB,149,PTHR30308:SF2,SSRA-BINDING PROTEIN,True
C0RHY9,SsrA-binding protein,protein,546272,Brucella melitensis biotype 2 (strain ATCC 23457),Brucella melitensis biotype 2 (strain ATCC 23457),smpB,158,PTHR30308:SF2,SSRA-BINDING PROTEIN,True
C1AGL9,SsrA-binding protein,protein,561275,Mycobacterium bovis (strain BCG / Tokyo 172 / ATCC 35737 / TMC 1019),Mycobacterium bovis (strain BCG / Tokyo 172 / ATCC 35737 / TMC 1019),smpB,160,PTHR30308:SF2,SSRA-BINDING PROTEIN,True
C1C6V3,SsrA-binding protein,protein,488221,Streptococcus pneumoniae (strain 70585),Streptococcus pneumoniae (strain 70585),smpB,155,PTHR30308:SF2,SSRA-BINDING PROTEIN,True
C1CDX1,SsrA-binding protein,protein,488222,Streptococcus pneumoniae (strain JJA),Streptococcus pneumoniae (strain JJA),smpB,155,PTHR30308:SF2,SSRA-BINDING PROTEIN,True
C1CK57,SsrA-binding protein,protein,488223,Streptococcus pneumoniae (strain P1031),Streptococcus pneumoniae (strain P1031),smpB,155,PTHR30308:SF2,SSRA-BINDING PROTEIN,True
C1CRS4,SsrA-binding protein,protein,487213,Streptococcus pneumoniae (strain Taiwan19F-14),Streptococcus pneumoniae (strain Taiwan19F-14),smpB,155,PTHR30308:SF2,SSRA-BINDING PROTEIN,True
C1DFN0,SsrA-binding protein,protein,322710,Azotobacter vinelandii (strain DJ / ATCC BAA-1303),Azotobacter vinelandii (strain DJ / ATCC BAA-1303),smpB,160,PTHR30308:SF2,SSRA-BINDING PROTEIN,True
C1EZ92,SsrA-binding protein,protein,572264,Bacillus cereus (strain 03BB102),Bacillus cereus (strain 03BB102),smpB,155,PTHR30308:SF2,SSRA-BINDING PROTEIN,True
C1FQX0,SsrA-binding protein,protein,536232,Clostridium botulinum (strain Kyoto / Type A2),Clostridium botulinum (strain Kyoto / Type A2),smpB,156,PTHR30308:SF2,SSRA-BINDING PROTEIN,True
C1KY87,SsrA-binding protein,protein,568819,Listeria monocytogenes serotype 4b (strain CLIP80459),Listeria monocytogenes serotype 4b (strain CLIP80459),smpB,154,PTHR30308:SF2,SSRA-BINDING PROTEIN,True
C3K282,SsrA-binding protein,protein,216595,Pseudomonas fluorescens (strain SBW25),Pseudomonas fluorescens (strain SBW25),smpB,160,PTHR30308:SF2,SSRA-BINDING PROTEIN,True
C3KZ53,SsrA-binding protein,protein,515621,Clostridium botulinum (strain 657 / Type Ba4),Clostridium botulinum (strain 657 / Type Ba4),smpB,156,PTHR30308:SF2,SSRA-BINDING PROTEIN,True
C3LDE9,SsrA-binding protein,protein,568206,Bacillus anthracis (strain CDC 684 / NRRL 3495),Bacillus anthracis (strain CDC 684 / NRRL 3495),smpB,155,PTHR30308:SF2,SSRA-BINDING PROTEIN,True
C3LT98,SsrA-binding protein,protein,579112,Vibrio cholerae serotype O1 (strain M66-2),Vibrio cholerae serotype O1 (strain M66-2),smpB,161,PTHR30308:SF2,SSRA-BINDING PROTEIN,True
C3M8R6,SsrA-binding protein,protein,394,Sinorhizobium fredii (strain NBRC 101917 / NGR234),Sinorhizobium fredii (strain NBRC 101917 / NGR234),smpB,159,PTHR30308:SF2,SSRA-BINDING PROTEIN,True
C3P072,SsrA-binding protein,protein,592021,Bacillus anthracis (strain A0248),Bacillus anthracis (strain A0248),smpB,155,PTHR30308:SF2,SSRA-BINDING PROTEIN,True
C3PNF6,SsrA-binding protein,protein,347255,Rickettsia africae (strain ESF-5),Rickettsia africae (strain ESF-5),smpB,152,PTHR30308:SF2,SSRA-BINDING PROTEIN,True
C4K287,SsrA-binding protein,protein,562019,Rickettsia peacockii (strain Rustic),Rickettsia peacockii (strain Rustic),smpB,152,PTHR30308:SF2,SSRA-BINDING PROTEIN,True
C4K4E2,SsrA-binding protein,protein,572265,Hamiltonella defensa subsp. Acyrthosiphon pisum (strain 5AT),Hamiltonella defensa subsp. Acyrthosiphon pisum (strain 5AT),smpB,160,PTHR30308:SF2,SSRA-BINDING PROTEIN,True
C4L5G5,SsrA-binding protein,protein,360911,Exiguobacterium sp. (strain ATCC BAA-1283 / AT1b),Exiguobacterium sp. (strain ATCC BAA-1283 / AT1b),smpB,156,PTHR30308:SF2,SSRA-BINDING PROTEIN,True
C4L8Z2,SsrA-binding protein,protein,595494,Tolumonas auensis (strain DSM 9187 / NBRC 110442 / TA 4),Tolumonas auensis (strain DSM 9187 / NBRC 110442 / TA 4),smpB,160,PTHR30308:SF2,SSRA-BINDING PROTEIN,True
C4LK22,SsrA-binding protein,protein,645127,Corynebacterium kroppenstedtii (strain DSM 44385 / JCM 11950 / CIP 105744 / CCUG 35717),Corynebacterium kroppenstedtii (strain DSM 44385 / JCM 11950 / CIP 105744 / CCUG 35717),smpB,183,PTHR30308:SF2,SSRA-BINDING PROTEIN,True
C4XJ76,SsrA-binding protein,protein,573370,Solidesulfovibrio magneticus (strain ATCC 700980 / DSM 13731 / RS-1),Solidesulfovibrio magneticus (strain ATCC 700980 / DSM 13731 / RS-1),smpB,154,PTHR30308:SF2,SSRA-BINDING PROTEIN,True
C4ZYN7,SsrA-binding protein,protein,595496,Escherichia coli (strain K12 / MC4100 / BW2952),Escherichia coli (strain K12 / MC4100 / BW2952),smpB,160,PTHR30308:SF2,SSRA-BINDING PROTEIN,True
C5BAL3,SsrA-binding protein,protein,634503,Edwardsiella ictaluri (strain 93-146),Edwardsiella ictaluri (strain 93-146),smpB,160,PTHR30308:SF2,SSRA-BINDING PROTEIN,True
C5BQH7,SsrA-binding protein,protein,377629,Teredinibacter turnerae (strain ATCC 39867 / T7901),Teredinibacter turnerae (strain ATCC 39867 / T7901),smpB,158,PTHR30308:SF2,SSRA-BINDING PROTEIN,True
C5D7L7,SsrA-binding protein,protein,471223,Geobacillus sp. (strain WCH70),Geobacillus sp. (strain WCH70),smpB,155,PTHR30308:SF2,SSRA-BINDING PROTEIN,True
C6BVR1,SsrA-binding protein,protein,526222,Maridesulfovibrio salexigens (strain ATCC 14822 / DSM 2638 / NCIMB 8403 / VKM B-1763),Maridesulfovibrio salexigens (strain ATCC 14822 / DSM 2638 / NCIMB 8403 / VKM B-1763),smpB,155,PTHR30308:SF2,SSRA-BINDING PROTEIN,True
C6D970,SsrA-binding protein,protein,561230,Pectobacterium carotovorum subsp. carotovorum (strain PC1),Pectobacterium carotovorum subsp. carotovorum (strain PC1),smpB,160,PTHR30308:SF2,SSRA-BINDING PROTEIN,True
O05968,SsrA-binding protein,protein,272947,Rickettsia prowazekii (strain Madrid E),Rickettsia prowazekii (strain Madrid E),smpB,152,PTHR30308:SF2,SSRA-BINDING PROTEIN,True
O25985,SsrA-binding protein,protein,85962,Helicobacter pylori (strain ATCC 700392 / 26695),Helicobacter pylori (strain ATCC 700392 / 26695),smpB,152,PTHR30308:SF2,SSRA-BINDING PROTEIN,True
O32230,SsrA-binding protein,protein,224308,Bacillus subtilis (strain 168),Bacillus subtilis (strain 168),smpB,156,PTHR30308:SF2,SSRA-BINDING PROTEIN,True
O32881,SsrA-binding protein,protein,272631,Mycobacterium leprae (strain TN),Mycobacterium leprae (strain TN),smpB,160,PTHR30308:SF2,SSRA-BINDING PROTEIN,True
O51064,SsrA-binding protein,protein,224326,Borreliella burgdorferi (strain ATCC 35210 / DSM 4680 / CIP 102532 / B31),Borreliella burgdorferi (strain ATCC 35210 / DSM 4680 / CIP 102532 / B31),smpB,150,PTHR30308:SF2,SSRA-BINDING PROTEIN,True
O66640,SsrA-binding protein,protein,224324,Aquifex aeolicus (strain VF5),Aquifex aeolicus (strain VF5),smpB,157,PTHR30308:SF2,SSRA-BINDING PROTEIN,True
O83214,SsrA-binding protein,protein,243276,Treponema pallidum (strain DSM 117211 / Nichols),Treponema pallidum (strain DSM 117211 / Nichols),smpB,154,PTHR30308:SF2,SSRA-BINDING PROTEIN,True
O84079,SsrA-binding protein,protein,272561,Chlamydia trachomatis serovar D (strain ATCC VR-885 / DSM 19411 / UW-3/Cx),Chlamydia trachomatis serovar D (strain ATCC VR-885 / DSM 19411 / UW-3/Cx),smpB,151,PTHR30308:SF2,SSRA-BINDING PROTEIN,True
P0A0Y7,SsrA-binding protein,protein,122587,Neisseria meningitidis serogroup A / serotype 4A (strain DSM 15465 / Z2491),Neisseria meningitidis serogroup A / serotype 4A (strain DSM 15465 / Z2491),smpB,148,PTHR30308:SF2,SSRA-BINDING PROTEIN,True
P0A0Y8,SsrA-binding protein,protein,122586,Neisseria meningitidis serogroup B (strain ATCC BAA-335 / MC58),Neisseria meningitidis serogroup B (strain ATCC BAA-335 / MC58),smpB,148,PTHR30308:SF2,SSRA-BINDING PROTEIN,True
P0A2G1,SsrA-binding protein,protein,99287,Salmonella typhimurium (strain LT2 / SGSC1412 / ATCC 700720),Salmonella typhimurium (strain LT2 / SGSC1412 / ATCC 700720),smpB,160,PTHR30308:SF2,SSRA-BINDING PROTEIN,True
P0A2G2,SsrA-binding protein,protein,90370,Salmonella typhi,Salmonella typhi,smpB,160,PTHR30308:SF2,SSRA-BINDING PROTEIN,True
P0A613,SsrA-binding protein,protein,233413,Mycobacterium bovis (strain ATCC BAA-935 / AF2122/97),Mycobacterium bovis (strain ATCC BAA-935 / AF2122/97),smpB,160,PTHR30308:SF2,SSRA-BINDING PROTEIN,True
P0A832,SsrA-binding protein,protein,83333,Escherichia coli (strain K12),Escherichia coli (strain K12),smpB,160,PTHR30308:SF2,SSRA-BINDING PROTEIN,True
P0A833,SsrA-binding protein,protein,199310,Escherichia coli O6:H1 (strain CFT073 / ATCC 700928 / UPEC),Escherichia coli O6:H1 (strain CFT073 / ATCC 700928 / UPEC),smpB,160,PTHR30308:SF2,SSRA-BINDING PROTEIN,True
P0A834,SsrA-binding protein,protein,83334,Escherichia coli O157:H7,Escherichia coli O157:H7,smpB,160,PTHR30308:SF2,SSRA-BINDING PROTEIN,True
P0A835,SsrA-binding protein,protein,623,Shigella flexneri,Shigella flexneri,smpB,160,PTHR30308:SF2,SSRA-BINDING PROTEIN,True
P0DF80,SsrA-binding protein,protein,198466,Streptococcus pyogenes serotype M3 (strain ATCC BAA-595 / MGAS315),Streptococcus pyogenes serotype M3 (strain ATCC BAA-595 / MGAS315),smpB,155,PTHR30308:SF2,SSRA-BINDING PROTEIN,True
P0DF81,SsrA-binding protein,protein,193567,Streptococcus pyogenes serotype M3 (strain SSI-1),Streptococcus pyogenes serotype M3 (strain SSI-1),smpB,155,PTHR30308:SF2,SSRA-BINDING PROTEIN,True
P43659,SsrA-binding protein,protein,768486,Enterococcus hirae (strain ATCC 9790 / DSM 20160 / JCM 8729 / LMG 6399 / NBRC 3181 / NCIMB 6459 / NCDO 1258 / NCTC 12367 / WDCM 00089 / R),Enterococcus hirae (strain ATCC 9790 / DSM 20160 / JCM 8729 / LMG 6399 / NBRC 3181 / NCIMB 6459 / NCDO 1258 / NCTC 12367 / WDCM 00089 / R),smpB,154,PTHR30308:SF2,SSRA-BINDING PROTEIN,True
P44967,SsrA-binding protein,protein,71421,Haemophilus influenzae (strain ATCC 51907 / DSM 11121 / KW20 / Rd),Haemophilus influenzae (strain ATCC 51907 / DSM 11121 / KW20 / Rd),smpB,161,PTHR30308:SF2,SSRA-BINDING PROTEIN,True
P47305,SsrA-binding protein,protein,243273,Mycoplasmoides genitalium (strain ATCC 33530 / DSM 19775 / NCTC 10195 / G37),Mycoplasmoides genitalium (strain ATCC 33530 / DSM 19775 / NCTC 10195 / G37),smpB,145,PTHR30308:SF2,SSRA-BINDING PROTEIN,True
P52116,SsrA-binding protein,protein,243277,Vibrio cholerae serotype O1 (strain ATCC 39315 / El Tor Inaba N16961),Vibrio cholerae serotype O1 (strain ATCC 39315 / El Tor Inaba N16961),smpB,161,PTHR30308:SF2,SSRA-BINDING PROTEIN,True
P56944,SsrA-binding protein,protein,243274,Thermotoga maritima (strain ATCC 43589 / DSM 3109 / JCM 10099 / NBRC 100826 / MSB8),Thermotoga maritima (strain ATCC 43589 / DSM 3109 / JCM 10099 / NBRC 100826 / MSB8),smpB,150,PTHR30308:SF2,SSRA-BINDING PROTEIN,True
P57342,SsrA-binding protein,protein,107806,Buchnera aphidicola subsp. Acyrthosiphon pisum (strain APS),Buchnera aphidicola subsp. Acyrthosiphon pisum (strain APS),smpB,162,PTHR30308:SF2,SSRA-BINDING PROTEIN,True
P57827,SsrA-binding protein,protein,272843,Pasteurella multocida (strain Pm70),Pasteurella multocida (strain Pm70),smpB,160,PTHR30308:SF2,SSRA-BINDING PROTEIN,True
P59630,SsrA-binding protein,protein,226185,Enterococcus faecalis (strain ATCC 700802 / V583),Enterococcus faecalis (strain ATCC 700802 / V583),smpB,154,PTHR30308:SF2,SSRA-BINDING PROTEIN,True
P66858,SsrA-binding protein,protein,224914,Brucella melitensis biotype 1 (strain ATCC 23456 / CCUG 17765 / NCTC 10094 / 16M),Brucella melitensis biotype 1 (strain ATCC 23456 / CCUG 17765 / NCTC 10094 / 16M),smpB,158,PTHR30308:SF2,SSRA-BINDING PROTEIN,True
P66859,SsrA-binding protein,protein,204722,Brucella suis biovar 1 (strain 1330),Brucella suis biovar 1 (strain 1330),smpB,158,PTHR30308:SF2,SSRA-BINDING PROTEIN,True
