id,name,entry_type,source_tax_id,source_tax_name,full_tax_name,gene,length,subfamily,subfamily_name,in_alphafold
A0ALD2,SsrA-binding protein,protein,386043,Listeria welshimeri serovar 6b (strain ATCC 35897 / DSM 20650 / CCUG 15529 / CIP 8149 / NCTC 11857 / SLCC 5334 / V8),Listeria welshimeri serovar 6b (strain ATCC 35897 / DSM 20650 / CCUG 15529 / CIP 8149 / NCTC 11857 / SLCC 5334 / V8),smpB,154,PTHR30308:SF2,SSRA-BINDING PROTEIN,True
A0JYC1,SsrA-binding protein,protein,290399,Arthrobacter sp. (strain FB24),Arthrobacter sp. (strain FB24),smpB,156,PTHR30308:SF2,SSRA-BINDING PROTEIN,True
A0K8C3,SsrA-binding protein,protein,331272,Burkholderia cenocepacia (strain HI2424),Burkholderia cenocepacia (strain HI2424),smpB,148,PTHR30308:SF2,SSRA-BINDING PROTEIN,True
A0KI80,SsrA-binding protein,protein,380703,Aeromonas hydrophila subsp. hydrophila (strain ATCC 7966 / DSM 30187 / BCRC 13018 / CCUG 14551 / JCM 1027 / KCTC 2358 / NCIMB 9240 / NCTC 8049),Aeromonas hydrophila subsp. hydrophila (strain ATCC 7966 / DSM 30187 / BCRC 13018 / CCUG 14551 / JCM 1027 / KCTC 2358 / NCIMB 9240 / NCTC 8049),smpB,162,PTHR30308:SF2,SSRA-BINDING PROTEIN,True
A0KZF9,SsrA-binding protein,protein,94122,Shewanella sp. (strain ANA-3),Shewanella sp. (strain ANA-3),smpB,163,PTHR30308:SF2,SSRA-BINDING PROTEIN,True
A0LDB8,SsrA-binding protein,protein,156889,Magnetococcus marinus (strain ATCC BAA-1437 / JCM 17883 / MC-1),Magnetococcus marinus (strain ATCC BAA-1437 / JCM 17883 / MC-1),smpB,150,PTHR30308:SF2,SSRA-BINDING PROTEIN,True
A0LGB7,SsrA-binding protein,protein,335543,Syntrophobacter fumaroxidans (strain DSM 10017 / MPOB),Syntrophobacter fumaroxidans (strain DSM 10017 / MPOB),smpB,161,PTHR30308:SF2,SSRA-BINDING PROTEIN,True
A0LVP0,SsrA-binding protein,protein,351607,Acidothermus cellulolyticus (strain ATCC 43068 / DSM 8971 / 11B),Acidothermus cellulolyticus (strain ATCC 43068 / DSM 8971 / 11B),smpB,159,PTHR30308:SF2,SSRA-BINDING PROTEIN,True
A0M3P0,SsrA-binding protein,protein,411154,Christiangramia forsetii (strain DSM 17595 / CGMCC 1.15422 / KT0803),Christiangramia forsetii (strain DSM 17595 / CGMCC 1.15422 / KT0803),smpB,157,PTHR30308:SF2,SSRA-BINDING PROTEIN,True
A0PQZ1,SsrA-binding protein,protein,362242,Mycobacterium ulcerans (strain Agy99),Mycobacterium ulcerans (strain Agy99),smpB,168,PTHR30308:SF2,SSRA-BINDING PROTEIN,True
A0PYP8,SsrA-binding protein,protein,386415,Clostridium novyi (strain NT),Clostridium novyi (strain NT),smpB,157,PTHR30308:SF2,SSRA-BINDING PROTEIN,True
A0Q735,SsrA-binding protein,protein,401614,Francisella tularensis subsp. novicida (strain ATCC 15482 / CCUG 33449 / U112),Francisella tularensis subsp. novicida (strain ATCC 15482 / CCUG 33449 / U112),smpB,157,PTHR30308:SF2,SSRA-BINDING PROTEIN,True
A0QU63,SsrA-binding protein,protein,246196,Mycolicibacterium smegmatis (strain ATCC 700084 / mc(2)155),Mycolicibacterium smegmatis (strain ATCC 700084 / mc(2)155),smpB,161,PTHR30308:SF2,SSRA-BINDING PROTEIN,True
A0RKR7,SsrA-binding protein,protein,412694,Bacillus thuringiensis (strain Al Hakam),Bacillus thuringiensis (strain Al Hakam),smpB,155,PTHR30308:SF2,SSRA-BINDING PROTEIN,True
A0RNV4,SsrA-binding protein,protein,360106,Campylobacter fetus subsp. fetus (strain 82-40),Campylobacter fetus subsp. fetus (strain 82-40),smpB,151,PTHR30308:SF2,SSRA-BINDING PROTEIN,True
A1A0L5,SsrA-binding protein,protein,367928,Bifidobacterium adolescentis (strain ATCC 15703 / DSM 20083 / NCTC 11814 / E194a),Bifidobacterium adolescentis (strain ATCC 15703 / DSM 20083 / NCTC 11814 / E194a),smpB,159,PTHR30308:SF2,SSRA-BINDING PROTEIN,True
A1AEE9,SsrA-binding protein,protein,405955,Escherichia coli O1:K1 / APEC,Escherichia coli O1:K1 / APEC,smpB,160,PTHR30308:SF2,SSRA-BINDING PROTEIN,True
A1ANL4,SsrA-binding protein,protein,338966,Pelobacter propionicus (strain DSM 2379 / NBRC 103807 / OttBd1),Pelobacter propionicus (strain DSM 2379 / NBRC 103807 / OttBd1),smpB,152,PTHR30308:SF2,SSRA-BINDING PROTEIN,True
A1AW41,SsrA-binding protein,protein,413404,Ruthia magnifica subsp. Calyptogena magnifica,Ruthia magnifica subsp. Calyptogena magnifica,smpB,165,PTHR30308:SF2,SSRA-BINDING PROTEIN,True
A1AZQ0,SsrA-binding protein,protein,318586,Paracoccus denitrificans (strain Pd 1222),Paracoccus denitrificans (strain Pd 1222),smpB,156,PTHR30308:SF2,SSRA-BINDING PROTEIN,True
A1BEN9,SsrA-binding protein,protein,290317,Chlorobium phaeobacteroides (strain DSM 266 / SMG 266 / 2430),Chlorobium phaeobacteroides (strain DSM 266 / SMG 266 / 2430),smpB,157,PTHR30308:SF2,SSRA-BINDING PROTEIN,True
A1JKI0,SsrA-binding protein,protein,393305,Yersinia enterocolitica serotype O:8 / biotype 1B (strain NCTC 13174 / 8081),Yersinia enterocolitica serotype O:8 / biotype 1B (strain NCTC 13174 / 8081),smpB,160,PTHR30308:SF2,SSRA-BINDING PROTEIN,True
A1K5T8,SsrA-binding protein,protein,418699,Azoarcus sp. (strain BH72),Azoarcus sp. (strain BH72),smpB,148,PTHR30308:SF2,SSRA-BINDING PROTEIN,True
A1KN98,SsrA-binding protein,protein,410289,Mycobacterium bovis (strain BCG / Pasteur 1173P2),Mycobacterium bovis (strain BCG / Pasteur 1173P2),smpB,160,PTHR30308:SF2,SSRA-BINDING PROTEIN,True
A1KUW3,SsrA-binding protein,protein,272831,Neisseria meningitidis serogroup C / serotype 2a (strain ATCC 700532 / DSM 15464 / FAM18),Neisseria meningitidis serogroup C / serotype 2a (strain ATCC 700532 / DSM 15464 / FAM18),smpB,148,PTHR30308:SF2,SSRA-BINDING PROTEIN,True
A1R807,SsrA-binding protein,protein,290340,Paenarthrobacter aurescens (strain TC1),Paenarthrobacter aurescens (strain TC1),smpB,156,PTHR30308:SF2,SSRA-BINDING PROTEIN,True
A1RLZ8,SsrA-binding protein,protein,351745,Shewanella sp. (strain W3-18-1),Shewanella sp. (strain W3-18-1),smpB,163,PTHR30308:SF2,SSRA-BINDING PROTEIN,True
A1S886,SsrA-binding protein,protein,326297,Shewanella amazonensis (strain ATCC BAA-1098 / SB2B),Shewanella amazonensis (strain ATCC BAA-1098 / SB2B),smpB,160,PTHR30308:SF2,SSRA-BINDING PROTEIN,True
A1SG51,SsrA-binding protein,protein,196162,Nocardioides sp. (strain ATCC BAA-499 / JS614),Nocardioides sp. (strain ATCC BAA-499 / JS614),smpB,159,PTHR30308:SF2,SSRA-BINDING PROTEIN,True
A1SV84,SsrA-binding protein,protein,357804,Psychromonas ingrahamii (strain DSM 17664 / CCUG 51855 / 37),Psychromonas ingrahamii (strain DSM 17664 / CCUG 51855 / 37),smpB,161,PTHR30308:SF2,SSRA-BINDING PROTEIN,True
A1T6D6,SsrA-binding protein,protein,350058,Mycolicibacterium vanbaalenii (strain DSM 7251 / JCM 13017 / BCRC 16820 / KCTC 9966 / NRRL B-24157 / PYR-1),Mycolicibacterium vanbaalenii (strain DSM 7251 / JCM 13017 / BCRC 16820 / KCTC 9966 / NRRL B-24157 / PYR-1),smpB,165,PTHR30308:SF2,SSRA-BINDING PROTEIN,True
A1TSJ4,SsrA-binding protein,protein,397945,Paracidovorax citrulli (strain AAC00-1),Paracidovorax citrulli (strain AAC00-1),smpB,157,PTHR30308:SF2,SSRA-BINDING PROTEIN,True
A1U622,SsrA-binding protein,protein,351348,Marinobacter nauticus (strain ATCC 700491 / DSM 11845 / VT8),Marinobacter nauticus (strain ATCC 700491 / DSM 11845 / VT8),smpB,160,PTHR30308:SF2,SSRA-BINDING PROTEIN,True
A1UDD7,SsrA-binding protein,protein,189918,Mycobacterium sp. (strain KMS),Mycobacterium sp. (strain KMS),smpB,168,PTHR30308:SF2,SSRA-BINDING PROTEIN,True
A1US28,SsrA-binding protein,protein,360095,"Bartonella bacilliformis (strain ATCC 35685 / KC583 / Herrer 020/F12,63)","Bartonella bacilliformis (strain ATCC 35685 / KC583 / Herrer 020/F12,63)",smpB,158,PTHR30308:SF2,SSRA-BINDING PROTEIN,True
A1V545,SsrA-binding protein,protein,320388,Burkholderia mallei (strain SAVP1),Burkholderia mallei (strain SAVP1),smpB,148,PTHR30308:SF2,SSRA-BINDING PROTEIN,True
A1VFF3,SsrA-binding protein,protein,391774,Nitratidesulfovibrio vulgaris (strain DP4),Nitratidesulfovibrio vulgaris (strain DP4),smpB,154,PTHR30308:SF2,SSRA-BINDING PROTEIN,True
A1W092,SsrA-binding protein,protein,354242,Campylobacter jejuni subsp. jejuni serotype O:23/36 (strain 81-176),Campylobacter jejuni subsp. jejuni serotype O:23/36 (strain 81-176),smpB,150,PTHR30308:SF2,SSRA-BINDING PROTEIN,True
A1W8Y5,SsrA-binding protein,protein,232721,Acidovorax sp. (strain JS42),Acidovorax sp. (strain JS42),smpB,157,PTHR30308:SF2,SSRA-BINDING PROTEIN,True
A1WPQ3,SsrA-binding protein,protein,391735,Verminephrobacter eiseniae (strain EF01-2),Verminephrobacter eiseniae (strain EF01-2),smpB,157,PTHR30308:SF2,SSRA-BINDING PROTEIN,True
A1WX40,SsrA-binding protein,protein,349124,Halorhodospira halophila (strain DSM 244 / SL1),Halorhodospira halophila (strain DSM 244 / SL1),smpB,165,PTHR30308:SF2,SSRA-BINDING PROTEIN,True
A2BTJ8,SsrA-binding protein,protein,146891,Prochlorococcus marinus (strain AS9601),Prochlorococcus marinus (strain AS9601),smpB,164,PTHR30308:SF2,SSRA-BINDING PROTEIN,True
A2BZ01,SsrA-binding protein,protein,167542,Prochlorococcus marinus (strain MIT 9515),Prochlorococcus marinus (strain MIT 9515),smpB,165,PTHR30308:SF2,SSRA-BINDING PROTEIN,True
A2C564,SsrA-binding protein,protein,167555,Prochlorococcus marinus (strain NATL1A),Prochlorococcus marinus (strain NATL1A),smpB,165,PTHR30308:SF2,SSRA-BINDING PROTEIN,True
A2C637,SsrA-binding protein,protein,59922,Prochlorococcus marinus (strain MIT 9303),Prochlorococcus marinus (strain MIT 9303),smpB,165,PTHR30308:SF2,SSRA-BINDING PROTEIN,True
A2RFZ7,SsrA-binding protein,protein,160491,Streptococcus pyogenes serotype M5 (strain Manfredo),Streptococcus pyogenes serotype M5 (strain Manfredo),smpB,155,PTHR30308:SF2,SSRA-BINDING PROTEIN,True
A2RME2,SsrA-binding protein,protein,416870,Lactococcus lactis subsp. cremoris (strain MG1363),Lactococcus lactis subsp. cremoris (strain MG1363),smpB,155,PTHR30308:SF2,SSRA-BINDING PROTEIN,True
A2SB97,SsrA-binding protein,protein,412022,Burkholderia mallei (strain NCTC 10229),Burkholderia mallei (strain NCTC 10229),smpB,148,PTHR30308:SF2,SSRA-BINDING PROTEIN,True
A2SG89,SsrA-binding protein,protein,420662,Methylibium petroleiphilum (strain ATCC BAA-1232 / LMG 22953 / PM1),Methylibium petroleiphilum (strain ATCC BAA-1232 / LMG 22953 / PM1),smpB,155,PTHR30308:SF2,SSRA-BINDING PROTEIN,True
A3CP85,SsrA-binding protein,protein,388919,Streptococcus sanguinis (strain SK36),Streptococcus sanguinis (strain SK36),smpB,155,PTHR30308:SF2,SSRA-BINDING PROTEIN,True
A3D262,SsrA-binding protein,protein,325240,Shewanella baltica (strain OS155 / ATCC BAA-1091),Shewanella baltica (strain OS155 / ATCC BAA-1091),smpB,163,PTHR30308:SF2,SSRA-BINDING PROTEIN,True
A3DJ18,SsrA-binding protein,protein,203119,Acetivibrio thermocellus (strain ATCC 27405 / DSM 1237 / JCM 9322 / NBRC 103400 / NCIMB 10682 / NRRL B-4536 / VPI 7372),Acetivibrio thermocellus (strain ATCC 27405 / DSM 1237 / JCM 9322 / NBRC 103400 / NCIMB 10682 / NRRL B-4536 / VPI 7372),smpB,154,PTHR30308:SF2,SSRA-BINDING PROTEIN,True
A3M2Y4,SsrA-binding protein,protein,400667,Acinetobacter baumannii (strain ATCC 17978 / DSM 105126 / CIP 53.77 / LMG 1025 / NCDC KC755 / 5377),Acinetobacter baumannii (strain ATCC 17978 / DSM 105126 / CIP 53.77 / LMG 1025 / NCDC KC755 / 5377),smpB,158,PTHR30308:SF2,SSRA-BINDING PROTEIN,True
A3MKR8,SsrA-binding protein,protein,320389,Burkholderia mallei (strain NCTC 10247),Burkholderia mallei (strain NCTC 10247),smpB,148,PTHR30308:SF2,SSRA-BINDING PROTEIN,True
A3N0M7,SsrA-binding protein,protein,416269,Actinobacillus pleuropneumoniae serotype 5b (strain L20),Actinobacillus pleuropneumoniae serotype 5b (strain L20),smpB,159,PTHR30308:SF2,SSRA-BINDING PROTEIN,True
A3NAS3,SsrA-binding protein,protein,320373,Burkholderia pseudomallei (strain 668),Burkholderia pseudomallei (strain 668),smpB,148,PTHR30308:SF2,SSRA-BINDING PROTEIN,True
A3NWK5,SsrA-binding protein,protein,357348,Burkholderia pseudomallei (strain 1106a),Burkholderia pseudomallei (strain 1106a),smpB,148,PTHR30308:SF2,SSRA-BINDING PROTEIN,True
A3PFA6,SsrA-binding protein,protein,167546,Prochlorococcus marinus (strain MIT 9301),Prochlorococcus marinus (strain MIT 9301),smpB,164,PTHR30308:SF2,SSRA-BINDING PROTEIN,True
A3PMS9,SsrA-binding protein,protein,349101,Cereibacter sphaeroides (strain ATCC 17029 / ATH 2.4.9),Cereibacter sphaeroides (strain ATCC 17029 / ATH 2.4.9),smpB,157,PTHR30308:SF2,SSRA-BINDING PROTEIN,True
A3PWV5,SsrA-binding protein,protein,164757,Mycobacterium sp. (strain JLS),Mycobacterium sp. (strain JLS),smpB,168,PTHR30308:SF2,SSRA-BINDING PROTEIN,True
A3QCE0,SsrA-binding protein,protein,323850,Shewanella loihica (strain ATCC BAA-1088 / PV-4),Shewanella loihica (strain ATCC BAA-1088 / PV-4),smpB,163,PTHR30308:SF2,SSRA-BINDING PROTEIN,True
A4F8R5,SsrA-binding protein,protein,405948,Saccharopolyspora erythraea (strain ATCC 11635 / DSM 40517 / JCM 4748 / NBRC 13426 / NCIMB 8594 / NRRL 2338),Saccharopolyspora erythraea (strain ATCC 11635 / DSM 40517 / JCM 4748 / NBRC 13426 / NCIMB 8594 / NRRL 2338),smpB,158,PTHR30308:SF2,SSRA-BINDING PROTEIN,True
A4ISN8,SsrA-binding protein,protein,420246,Geobacillus thermodenitrificans (strain NG80-2),Geobacillus thermodenitrificans (strain NG80-2),smpB,155,PTHR30308:SF2,SSRA-BINDING PROTEIN,True
A4IYL4,SsrA-binding protein,protein,418136,Francisella tularensis subsp. tularensis (strain WY96-3418),Francisella tularensis subsp. tularensis (strain WY96-3418),smpB,157,PTHR30308:SF2,SSRA-BINDING PROTEIN,True
A4J8T4,SsrA-binding protein,protein,349161,Desulforamulus reducens (strain ATCC BAA-1160 / DSM 100696 / MI-1),Desulforamulus reducens (strain ATCC BAA-1160 / DSM 100696 / MI-1),smpB,161,PTHR30308:SF2,SSRA-BINDING PROTEIN,True
A4JF55,SsrA-binding protein,protein,269482,Burkholderia vietnamiensis (strain G4 / LMG 22486),Burkholderia vietnamiensis (strain G4 / LMG 22486),smpB,148,PTHR30308:SF2,SSRA-BINDING PROTEIN,True
A4QCD6,SsrA-binding protein,protein,340322,Corynebacterium glutamicum (strain R),Corynebacterium glutamicum (strain R),smpB,164,PTHR30308:SF2,SSRA-BINDING PROTEIN,True
A4SFG0,SsrA-binding protein,protein,290318,Chlorobium phaeovibrioides (strain DSM 265 / 1930),Chlorobium phaeovibrioides (strain DSM 265 / 1930),smpB,157,PTHR30308:SF2,SSRA-BINDING PROTEIN,True
A4SPV7,SsrA-binding protein,protein,382245,Aeromonas salmonicida (strain A449),Aeromonas salmonicida (strain A449),smpB,162,PTHR30308:SF2,SSRA-BINDING PROTEIN,True
A4SYS6,SsrA-binding protein,protein,312153,Polynucleobacter asymbioticus (strain DSM 18221 / CIP 109841 / QLW-P1DMWA-1),Polynucleobacter asymbioticus (strain DSM 18221 / CIP 109841 / QLW-P1DMWA-1),smpB,150,PTHR30308:SF2,SSRA-BINDING PROTEIN,True
A4TDF4,SsrA-binding protein,protein,350054,Mycolicibacterium gilvum (strain PYR-GCK),Mycolicibacterium gilvum (strain PYR-GCK),smpB,165,PTHR30308:SF2,SSRA-BINDING PROTEIN,True
A4TNV2,SsrA-binding protein,protein,386656,Yersinia pestis (strain Pestoides F),Yersinia pestis (strain Pestoides F),smpB,160,PTHR30308:SF2,SSRA-BINDING PROTEIN,True
A4VPR2,SsrA-binding protein,protein,379731,Stutzerimonas stutzeri (strain A1501),Stutzerimonas stutzeri (strain A1501),smpB,160,PTHR30308:SF2,SSRA-BINDING PROTEIN,True
A4VW67,SsrA-binding protein,protein,391295,Streptococcus suis (strain 05ZYH33),Streptococcus suis (strain 05ZYH33),smpB,155,PTHR30308:SF2,SSRA-BINDING PROTEIN,True
A4W2H3,SsrA-binding protein,protein,391296,Streptococcus suis (strain 98HAH33),Streptococcus suis (strain 98HAH33),smpB,155,PTHR30308:SF2,SSRA-BINDING PROTEIN,True
A4WDI4,SsrA-binding protein,protein,399742,Enterobacter sp. (strain 638),Enterobacter sp. (strain 638),smpB,160,PTHR30308:SF2,SSRA-BINDING PROTEIN,True
A4WNS0,SsrA-binding protein,protein,349102,Cereibacter sphaeroides (strain ATCC 17025 / ATH 2.4.3),Cereibacter sphaeroides (strain ATCC 17025 / ATH 2.4.3),smpB,157,PTHR30308:SF2,SSRA-BINDING PROTEIN,True
A4X3K9,SsrA-binding protein,protein,369723,Salinispora tropica (strain ATCC BAA-916 / DSM 44818 / JCM 13857 / NBRC 105044 / CNB-440),Salinispora tropica (strain ATCC BAA-916 / DSM 44818 / JCM 13857 / NBRC 105044 / CNB-440),smpB,159,PTHR30308:SF2,SSRA-BINDING PROTEIN,True
A4XIH3,SsrA-binding protein,protein,351627,Caldicellulosiruptor saccharolyticus (strain ATCC 43494 / DSM 8903 / Tp8T 6331),Caldicellulosiruptor saccharolyticus (strain ATCC 43494 / DSM 8903 / Tp8T 6331),smpB,158,PTHR30308:SF2,SSRA-BINDING PROTEIN,True
A4XYG4,SsrA-binding protein,protein,399739,Ectopseudomonas mendocina (strain ymp),Ectopseudomonas mendocina (strain ymp),smpB,160,PTHR30308:SF2,SSRA-BINDING PROTEIN,True
A4Y4S4,SsrA-binding protein,protein,319224,Shewanella putrefaciens (strain CN-32 / ATCC BAA-453),Shewanella putrefaciens (strain CN-32 / ATCC BAA-453),smpB,163,PTHR30308:SF2,SSRA-BINDING PROTEIN,True
A4YWD7,SsrA-binding protein,protein,114615,Bradyrhizobium sp. (strain ORS 278),Bradyrhizobium sp. (strain ORS 278),smpB,157,PTHR30308:SF2,SSRA-BINDING PROTEIN,True
A5CCM6,SsrA-binding protein,protein,357244,Orientia tsutsugamushi (strain Boryong),Orientia tsutsugamushi (strain Boryong),smpB,153,PTHR30308:SF2,SSRA-BINDING PROTEIN,True
A5CQK2,SsrA-binding protein,protein,443906,Clavibacter michiganensis subsp. michiganensis (strain NCPPB 382),Clavibacter michiganensis subsp. michiganensis (strain NCPPB 382),smpB,158,PTHR30308:SF2,SSRA-BINDING PROTEIN,True
A5CX31,SsrA-binding protein,protein,412965,Vesicomyosocius okutanii subsp. Calyptogena okutanii (strain HA),Vesicomyosocius okutanii subsp. Calyptogena okutanii (strain HA),smpB,161,PTHR30308:SF2,SSRA-BINDING PROTEIN,True
A5CYM8,SsrA-binding protein,protein,370438,Pelotomaculum thermopropionicum (strain DSM 13744 / JCM 10971 / SI),Pelotomaculum thermopropionicum (strain DSM 13744 / JCM 10971 / SI),smpB,153,PTHR30308:SF2,SSRA-BINDING PROTEIN,True
A5EKM6,SsrA-binding protein,protein,288000,Bradyrhizobium sp. (strain BTAi1 / ATCC BAA-1182),Bradyrhizobium sp. (strain BTAi1 / ATCC BAA-1182),smpB,157,PTHR30308:SF2,SSRA-BINDING PROTEIN,True
A5EXZ5,SsrA-binding protein,protein,246195,Dichelobacter nodosus (strain VCS1703A),Dichelobacter nodosus (strain VCS1703A),smpB,159,PTHR30308:SF2,SSRA-BINDING PROTEIN,True
A5F375,SsrA-binding protein,protein,345073,Vibrio cholerae serotype O1 (strain ATCC 39541 / Classical Ogawa 395 / O395),Vibrio cholerae serotype O1 (strain ATCC 39541 / Classical Ogawa 395 / O395),smpB,161,PTHR30308:SF2,SSRA-BINDING PROTEIN,True
A5FEB8,SsrA-binding protein,protein,376686,Flavobacterium johnsoniae (strain ATCC 17061 / DSM 2064 / JCM 8514 / BCRC 14874 / CCUG 350202 / NBRC 14942 / NCIMB 11054 / UW101),Flavobacterium johnsoniae (strain ATCC 17061 / DSM 2064 / JCM 8514 / BCRC 14874 / CCUG 350202 / NBRC 14942 / NCIMB 11054 / UW101),smpB,151,PTHR30308:SF2,SSRA-BINDING PROTEIN,True
A5FPK5,SsrA-binding protein,protein,216389,Dehalococcoides mccartyi (strain ATCC BAA-2100 / JCM 16839 / KCTC 5957 / BAV1),Dehalococcoides mccartyi (strain ATCC BAA-2100 / JCM 16839 / KCTC 5957 / BAV1),smpB,172,PTHR30308:SF2,SSRA-BINDING PROTEIN,True
A5FZS6,SsrA-binding protein,protein,349163,Acidiphilium cryptum (strain JF-5),Acidiphilium cryptum (strain JF-5),smpB,159,PTHR30308:SF2,SSRA-BINDING PROTEIN,True
A5G3A5,SsrA-binding protein,protein,351605,Geotalea uraniireducens (strain Rf4),Geotalea uraniireducens (strain Rf4),smpB,151,PTHR30308:SF2,SSRA-BINDING PROTEIN,True
A5GI45,SsrA-binding protein,protein,32051,Synechococcus sp. (strain WH7803),Synechococcus sp. (strain WH7803),smpB,165,PTHR30308:SF2,SSRA-BINDING PROTEIN,True
A5GQ67,SsrA-binding protein,protein,316278,Synechococcus sp. (strain RCC307),Synechococcus sp. (strain RCC307),smpB,166,PTHR30308:SF2,SSRA-BINDING PROTEIN,True
A5HYC7,SsrA-binding protein,protein,441771,Clostridium botulinum (strain Hall / ATCC 3502 / NCTC 13319 / Type A),Clostridium botulinum (strain Hall / ATCC 3502 / NCTC 13319 / Type A),smpB,156,PTHR30308:SF2,SSRA-BINDING PROTEIN,True
A5II10,SsrA-binding protein,protein,400673,Legionella pneumophila (strain Corby),Legionella pneumophila (strain Corby),smpB,156,PTHR30308:SF2,SSRA-BINDING PROTEIN,True
A5IKG7,SsrA-binding protein,protein,390874,Thermotoga petrophila (strain ATCC BAA-488 / DSM 13995 / JCM 10881 / RKU-1),Thermotoga petrophila (strain ATCC BAA-488 / DSM 13995 / JCM 10881 / RKU-1),smpB,150,PTHR30308:SF2,SSRA-BINDING PROTEIN,True
A5IQY5,SsrA-binding protein,protein,359786,Staphylococcus aureus (strain JH9),Staphylococcus aureus (strain JH9),smpB,154,PTHR30308:SF2,SSRA-BINDING PROTEIN,True
A5IZI0,SsrA-binding protein,protein,347257,Mycoplasmopsis agalactiae (strain NCTC 10123 / CIP 59.7 / PG2),Mycoplasmopsis agalactiae (strain NCTC 10123 / CIP 59.7 / PG2),smpB,147,PTHR30308:SF2,SSRA-BINDING PROTEIN,True
A5N2N2,SsrA-binding protein,protein,431943,Clostridium kluyveri (strain ATCC 8527 / DSM 555 / NBRC 12016 / NCIMB 10680 / K1),Clostridium kluyveri (strain ATCC 8527 / DSM 555 / NBRC 12016 / NCIMB 10680 / K1),smpB,157,PTHR30308:SF2,SSRA-BINDING PROTEIN,True
A5U7B5,SsrA-binding protein,protein,419947,Mycobacterium tuberculosis (strain ATCC 25177 / H37Ra),Mycobacterium tuberculosis (strain ATCC 25177 / H37Ra),smpB,160,PTHR30308:SF2,SSRA-BINDING PROTEIN,True
A5UD90,SsrA-binding protein,protein,374930,Haemophilus influenzae (strain PittEE),Haemophilus influenzae (strain PittEE),smpB,161,PTHR30308:SF2,SSRA-BINDING PROTEIN,True
A5UIC0,SsrA-binding protein,protein,374931,Haemophilus influenzae (strain PittGG),Haemophilus influenzae (strain PittGG),smpB,161,PTHR30308:SF2,SSRA-BINDING PROTEIN,True
A5UPS2,SsrA-binding protein,protein,357808,Roseiflexus sp. (strain RS-1),Roseiflexus sp. (strain RS-1),smpB,158,PTHR30308:SF2,SSRA-BINDING PROTEIN,True
A5V3L8,SsrA-binding protein,protein,392499,Rhizorhabdus wittichii (strain DSM 6014 / CCUG 31198 / JCM 15750 / NBRC 105917 / EY 4224 / RW1),Rhizorhabdus wittichii (strain DSM 6014 / CCUG 31198 / JCM 15750 / NBRC 105917 / EY 4224 / RW1),smpB,160,PTHR30308:SF2,SSRA-BINDING PROTEIN,True
A5VIJ0,SsrA-binding protein,protein,557436,Limosilactobacillus reuteri (strain DSM 20016),Limosilactobacillus reuteri (strain DSM 20016),smpB,157,PTHR30308:SF2,SSRA-BINDING PROTEIN,True
A5VPI6,SsrA-binding protein,protein,444178,Brucella ovis (strain ATCC 25840 / 63/290 / NCTC 10512),Brucella ovis (strain ATCC 25840 / 63/290 / NCTC 10512),smpB,158,PTHR30308:SF2,SSRA-BINDING PROTEIN,True
A5W9A9,SsrA-binding protein,protein,351746,Pseudomonas putida (strain ATCC 700007 / DSM 6899 / JCM 31910 / BCRC 17059 / LMG 24140 / F1),Pseudomonas putida (strain ATCC 700007 / DSM 6899 / JCM 31910 / BCRC 17059 / LMG 24140 / F1),smpB,160,PTHR30308:SF2,SSRA-BINDING PROTEIN,True
A5WH04,SsrA-binding protein,protein,349106,Psychrobacter sp. (strain PRwf-1),Psychrobacter sp. (strain PRwf-1),smpB,158,PTHR30308:SF2,SSRA-BINDING PROTEIN,True
A6H0S6,SsrA-binding protein,protein,402612,Flavobacterium psychrophilum (strain ATCC 49511 / DSM 21280 / CIP 103535 / JIP02/86),Flavobacterium psychrophilum (strain ATCC 49511 / DSM 21280 / CIP 103535 / JIP02/86),smpB,150,PTHR30308:SF2,SSRA-BINDING PROTEIN,True
A6L3C0,SsrA-binding protein,protein,435590,Phocaeicola vulgatus (strain ATCC 8482 / DSM 1447 / JCM 5826 / CCUG 4940 / NBRC 14291 / NCTC 11154),Phocaeicola vulgatus (strain ATCC 8482 / DSM 1447 / JCM 5826 / CCUG 4940 / NBRC 14291 / NCTC 11154),smpB,150,PTHR30308:SF2,SSRA-BINDING PROTEIN,True
A6L927,SsrA-binding protein,protein,435591,Parabacteroides distasonis (strain ATCC 8503 / DSM 20701 / CIP 104284 / JCM 5825 / NCTC 11152),Parabacteroides distasonis (strain ATCC 8503 / DSM 20701 / CIP 104284 / JCM 5825 / NCTC 11152),smpB,153,PTHR30308:SF2,SSRA-BINDING PROTEIN,True
A6LJL7,SsrA-binding protein,protein,391009,Thermosipho melanesiensis (strain DSM 12029 / CIP 104789 / BI429),Thermosipho melanesiensis (strain DSM 12029 / CIP 104789 / BI429),smpB,147,PTHR30308:SF2,SSRA-BINDING PROTEIN,True
A6LR41,SsrA-binding protein,protein,290402,Clostridium beijerinckii (strain ATCC 51743 / NCIMB 8052),Clostridium beijerinckii (strain ATCC 51743 / NCIMB 8052),smpB,156,PTHR30308:SF2,SSRA-BINDING PROTEIN,True
A6Q524,SsrA-binding protein,protein,387092,Nitratiruptor sp. (strain SB155-2),Nitratiruptor sp. (strain SB155-2),smpB,150,PTHR30308:SF2,SSRA-BINDING PROTEIN,True
A6Q776,SsrA-binding protein,protein,387093,Sulfurovum sp. (strain NBC37-1),Sulfurovum sp. (strain NBC37-1),smpB,153,PTHR30308:SF2,SSRA-BINDING PROTEIN,True
A6QF90,SsrA-binding protein,protein,426430,Staphylococcus aureus (strain Newman),Staphylococcus aureus (strain Newman),smpB,154,PTHR30308:SF2,SSRA-BINDING PROTEIN,True
A6TCM7,SsrA-binding protein,protein,272620,Klebsiella pneumoniae subsp. pneumoniae (strain ATCC 700721 / MGH 78578),Klebsiella pneumoniae subsp. pneumoniae (strain ATCC 700721 / MGH 78578),smpB,160,PTHR30308:SF2,SSRA-BINDING PROTEIN,True
A6TU24,SsrA-binding protein,protein,293826,Alkaliphilus metalliredigens (strain QYMF),Alkaliphilus metalliredigens (strain QYMF),smpB,157,PTHR30308:SF2,SSRA-BINDING PROTEIN,True
A6TZR0,SsrA-binding protein,protein,359787,Staphylococcus aureus (strain JH1),Staphylococcus aureus (strain JH1),smpB,154,PTHR30308:SF2,SSRA-BINDING PROTEIN,True
A6U7A0,SsrA-binding protein,protein,366394,Sinorhizobium medicae (strain WSM419),Sinorhizobium medicae (strain WSM419),smpB,159,PTHR30308:SF2,SSRA-BINDING PROTEIN,True
A6VCM5,SsrA-binding protein,protein,381754,Pseudomonas paraeruginosa (strain DSM 24068 / PA7),Pseudomonas paraeruginosa (strain DSM 24068 / PA7),smpB,159,PTHR30308:SF2,SSRA-BINDING PROTEIN,True
A6VMQ1,SsrA-binding protein,protein,339671,Actinobacillus succinogenes (strain ATCC 55618 / DSM 22257 / CCUG 43843 / 130Z),Actinobacillus succinogenes (strain ATCC 55618 / DSM 22257 / CCUG 43843 / 130Z),smpB,160,PTHR30308:SF2,SSRA-BINDING PROTEIN,True
A6W2E0,SsrA-binding protein,protein,400668,Marinomonas sp. (strain MWYL1),Marinomonas sp. (strain MWYL1),smpB,159,PTHR30308:SF2,SSRA-BINDING PROTEIN,True
A6WEK3,SsrA-binding protein,protein,266940,Kineococcus radiotolerans (strain ATCC BAA-149 / DSM 14245 / SRS30216),Kineococcus radiotolerans (strain ATCC BAA-149 / DSM 14245 / SRS30216),smpB,156,PTHR30308:SF2,SSRA-BINDING PROTEIN,True
A6WKV9,SsrA-binding protein,protein,402882,Shewanella baltica (strain OS185),Shewanella baltica (strain OS185),smpB,163,PTHR30308:SF2,SSRA-BINDING PROTEIN,True
