id,name,entry_type,source_tax_id,source_tax_name,full_tax_name,gene,length,subfamily,subfamily_name,in_alphafold
A0KGY7,Undecaprenyl-phosphate 4-deoxy-4-formamido-L-arabinose transferase,protein,380703,Aeromonas hydrophila subsp. hydrophila (strain ATCC 7966 / DSM 30187 / BCRC 13018 / CCUG 14551 / JCM 1027 / KCTC 2358 / NCIMB 9240 / NCTC 8049),Aeromonas hydrophila subsp. hydrophila (strain ATCC 7966 / DSM 30187 / BCRC 13018 / CCUG 14551 / JCM 1027 / KCTC 2358 / NCIMB 9240 / NCTC 8049),arnC,326,PTHR48090:SF3,UNDECAPRENYL-PHOSPHATE 4-DEOXY-4-FORMAMIDO-L-ARABINOSE TRANSFERASE,True
A0R2E6,Glucosyl-3-phosphoglycerate synthase,protein,246196,Mycolicibacterium smegmatis (strain ATCC 700084 / mc(2)155),Mycolicibacterium smegmatis (strain ATCC 700084 / mc(2)155),gpgS,303,PTHR48090:SF10,GLUCOSYL-3-PHOSPHOGLYCERATE SYNTHASE,True
A1ADA6,Undecaprenyl-phosphate 4-deoxy-4-formamido-L-arabinose transferase,protein,405955,Escherichia coli O1:K1 / APEC,Escherichia coli O1:K1 / APEC,arnC,322,PTHR48090:SF3,UNDECAPRENYL-PHOSPHATE 4-DEOXY-4-FORMAMIDO-L-ARABINOSE TRANSFERASE,True
A1JPP5,Undecaprenyl-phosphate 4-deoxy-4-formamido-L-arabinose transferase,protein,393305,Yersinia enterocolitica serotype O:8 / biotype 1B (strain NCTC 13174 / 8081),Yersinia enterocolitica serotype O:8 / biotype 1B (strain NCTC 13174 / 8081),arnC,327,PTHR48090:SF3,UNDECAPRENYL-PHOSPHATE 4-DEOXY-4-FORMAMIDO-L-ARABINOSE TRANSFERASE,True
A4SQW8,Undecaprenyl-phosphate 4-deoxy-4-formamido-L-arabinose transferase,protein,382245,Aeromonas salmonicida (strain A449),Aeromonas salmonicida (strain A449),arnC,325,PTHR48090:SF3,UNDECAPRENYL-PHOSPHATE 4-DEOXY-4-FORMAMIDO-L-ARABINOSE TRANSFERASE,True
A4TIM3,Undecaprenyl-phosphate 4-deoxy-4-formamido-L-arabinose transferase,protein,386656,Yersinia pestis (strain Pestoides F),Yersinia pestis (strain Pestoides F),arnC,327,PTHR48090:SF3,UNDECAPRENYL-PHOSPHATE 4-DEOXY-4-FORMAMIDO-L-ARABINOSE TRANSFERASE,True
A4WAM4,Undecaprenyl-phosphate 4-deoxy-4-formamido-L-arabinose transferase,protein,399742,Enterobacter sp. (strain 638),Enterobacter sp. (strain 638),arnC,327,PTHR48090:SF3,UNDECAPRENYL-PHOSPHATE 4-DEOXY-4-FORMAMIDO-L-ARABINOSE TRANSFERASE,True
A6TF99,Undecaprenyl-phosphate 4-deoxy-4-formamido-L-arabinose transferase,protein,272620,Klebsiella pneumoniae subsp. pneumoniae (strain ATCC 700721 / MGH 78578),Klebsiella pneumoniae subsp. pneumoniae (strain ATCC 700721 / MGH 78578),arnC,327,PTHR48090:SF3,UNDECAPRENYL-PHOSPHATE 4-DEOXY-4-FORMAMIDO-L-ARABINOSE TRANSFERASE,True
A6V1P1,Undecaprenyl-phosphate 4-deoxy-4-formamido-L-arabinose transferase,protein,381754,Pseudomonas paraeruginosa (strain DSM 24068 / PA7),Pseudomonas paraeruginosa (strain DSM 24068 / PA7),arnC,339,PTHR48090:SF3,UNDECAPRENYL-PHOSPHATE 4-DEOXY-4-FORMAMIDO-L-ARABINOSE TRANSFERASE,True
A7ZP72,Undecaprenyl-phosphate 4-deoxy-4-formamido-L-arabinose transferase,protein,331111,Escherichia coli O139:H28 (strain E24377A / ETEC),Escherichia coli O139:H28 (strain E24377A / ETEC),arnC,322,PTHR48090:SF3,UNDECAPRENYL-PHOSPHATE 4-DEOXY-4-FORMAMIDO-L-ARABINOSE TRANSFERASE,True
A8A2C1,Undecaprenyl-phosphate 4-deoxy-4-formamido-L-arabinose transferase,protein,331112,Escherichia coli O9:H4 (strain HS),Escherichia coli O9:H4 (strain HS),arnC,322,PTHR48090:SF3,UNDECAPRENYL-PHOSPHATE 4-DEOXY-4-FORMAMIDO-L-ARABINOSE TRANSFERASE,True
A8FRR3,Undecaprenyl-phosphate 4-deoxy-4-formamido-L-arabinose transferase,protein,425104,Shewanella sediminis (strain HAW-EB3),Shewanella sediminis (strain HAW-EB3),arnC,331,PTHR48090:SF3,UNDECAPRENYL-PHOSPHATE 4-DEOXY-4-FORMAMIDO-L-ARABINOSE TRANSFERASE,True
A8GDR6,Undecaprenyl-phosphate 4-deoxy-4-formamido-L-arabinose transferase,protein,399741,Serratia proteamaculans (strain 568),Serratia proteamaculans (strain 568),arnC,326,PTHR48090:SF3,UNDECAPRENYL-PHOSPHATE 4-DEOXY-4-FORMAMIDO-L-ARABINOSE TRANSFERASE,True
A9BEU2,Glucosylglycerate synthase,protein,403833,Petrotoga mobilis (strain DSM 10674 / SJ95),Petrotoga mobilis (strain DSM 10674 / SJ95),ggs,393,PTHR48090:SF10,GLUCOSYL-3-PHOSPHOGLYCERATE SYNTHASE,True
A9BHI9,Glucosyl-3-phosphoglycerate synthase,protein,403833,Petrotoga mobilis (strain DSM 10674 / SJ95),Petrotoga mobilis (strain DSM 10674 / SJ95),gpgS,325,PTHR48090:SF10,GLUCOSYL-3-PHOSPHOGLYCERATE SYNTHASE,True
A9N5B3,Undecaprenyl-phosphate 4-deoxy-4-formamido-L-arabinose transferase,protein,1016998,Salmonella paratyphi B (strain ATCC BAA-1250 / SPB7),Salmonella paratyphi B (strain ATCC BAA-1250 / SPB7),arnC,327,PTHR48090:SF3,UNDECAPRENYL-PHOSPHATE 4-DEOXY-4-FORMAMIDO-L-ARABINOSE TRANSFERASE,True
A9R094,Undecaprenyl-phosphate 4-deoxy-4-formamido-L-arabinose transferase,protein,349746,Yersinia pestis bv. Antiqua (strain Angola),Yersinia pestis bv. Antiqua (strain Angola),arnC,327,PTHR48090:SF3,UNDECAPRENYL-PHOSPHATE 4-DEOXY-4-FORMAMIDO-L-ARABINOSE TRANSFERASE,True
B1IXT3,Undecaprenyl-phosphate 4-deoxy-4-formamido-L-arabinose transferase,protein,481805,Escherichia coli (strain ATCC 8739 / DSM 1576 / NBRC 3972 / NCIMB 8545 / WDCM 00012 / Crooks),Escherichia coli (strain ATCC 8739 / DSM 1576 / NBRC 3972 / NCIMB 8545 / WDCM 00012 / Crooks),arnC,322,PTHR48090:SF3,UNDECAPRENYL-PHOSPHATE 4-DEOXY-4-FORMAMIDO-L-ARABINOSE TRANSFERASE,True
B1JJ29,Undecaprenyl-phosphate 4-deoxy-4-formamido-L-arabinose transferase,protein,502800,Yersinia pseudotuberculosis serotype O:3 (strain YPIII),Yersinia pseudotuberculosis serotype O:3 (strain YPIII),arnC,327,PTHR48090:SF3,UNDECAPRENYL-PHOSPHATE 4-DEOXY-4-FORMAMIDO-L-ARABINOSE TRANSFERASE,True
B1LLK8,Undecaprenyl-phosphate 4-deoxy-4-formamido-L-arabinose transferase,protein,439855,Escherichia coli (strain SMS-3-5 / SECEC),Escherichia coli (strain SMS-3-5 / SECEC),arnC,322,PTHR48090:SF3,UNDECAPRENYL-PHOSPHATE 4-DEOXY-4-FORMAMIDO-L-ARABINOSE TRANSFERASE,True
B1X8W7,Undecaprenyl-phosphate 4-deoxy-4-formamido-L-arabinose transferase,protein,316385,Escherichia coli (strain K12 / DH10B),Escherichia coli (strain K12 / DH10B),arnC,322,PTHR48090:SF3,UNDECAPRENYL-PHOSPHATE 4-DEOXY-4-FORMAMIDO-L-ARABINOSE TRANSFERASE,True
B2K5L4,Undecaprenyl-phosphate 4-deoxy-4-formamido-L-arabinose transferase,protein,502801,Yersinia pseudotuberculosis serotype IB (strain PB1/+),Yersinia pseudotuberculosis serotype IB (strain PB1/+),arnC,327,PTHR48090:SF3,UNDECAPRENYL-PHOSPHATE 4-DEOXY-4-FORMAMIDO-L-ARABINOSE TRANSFERASE,True
B2VBJ0,Undecaprenyl-phosphate 4-deoxy-4-formamido-L-arabinose transferase,protein,465817,Erwinia tasmaniensis (strain DSM 17950 / CFBP 7177 / CIP 109463 / NCPPB 4357 / Et1/99),Erwinia tasmaniensis (strain DSM 17950 / CFBP 7177 / CIP 109463 / NCPPB 4357 / Et1/99),arnC,325,PTHR48090:SF3,UNDECAPRENYL-PHOSPHATE 4-DEOXY-4-FORMAMIDO-L-ARABINOSE TRANSFERASE,True
B4ETL6,Undecaprenyl-phosphate 4-deoxy-4-formamido-L-arabinose transferase,protein,529507,Proteus mirabilis (strain HI4320),Proteus mirabilis (strain HI4320),arnC,326,PTHR48090:SF3,UNDECAPRENYL-PHOSPHATE 4-DEOXY-4-FORMAMIDO-L-ARABINOSE TRANSFERASE,True
B4SYX0,Undecaprenyl-phosphate 4-deoxy-4-formamido-L-arabinose transferase,protein,423368,Salmonella newport (strain SL254),Salmonella newport (strain SL254),arnC,327,PTHR48090:SF3,UNDECAPRENYL-PHOSPHATE 4-DEOXY-4-FORMAMIDO-L-ARABINOSE TRANSFERASE,True
B4TBG5,Undecaprenyl-phosphate 4-deoxy-4-formamido-L-arabinose transferase,protein,454169,Salmonella heidelberg (strain SL476),Salmonella heidelberg (strain SL476),arnC,327,PTHR48090:SF3,UNDECAPRENYL-PHOSPHATE 4-DEOXY-4-FORMAMIDO-L-ARABINOSE TRANSFERASE,True
B4TPI1,Undecaprenyl-phosphate 4-deoxy-4-formamido-L-arabinose transferase,protein,439843,Salmonella schwarzengrund (strain CVM19633),Salmonella schwarzengrund (strain CVM19633),arnC,327,PTHR48090:SF3,UNDECAPRENYL-PHOSPHATE 4-DEOXY-4-FORMAMIDO-L-ARABINOSE TRANSFERASE,True
B5BCP7,Undecaprenyl-phosphate 4-deoxy-4-formamido-L-arabinose transferase,protein,554290,Salmonella paratyphi A (strain AKU_12601),Salmonella paratyphi A (strain AKU_12601),arnC,327,PTHR48090:SF3,UNDECAPRENYL-PHOSPHATE 4-DEOXY-4-FORMAMIDO-L-ARABINOSE TRANSFERASE,True
B5EZH7,Undecaprenyl-phosphate 4-deoxy-4-formamido-L-arabinose transferase,protein,454166,Salmonella agona (strain SL483),Salmonella agona (strain SL483),arnC,327,PTHR48090:SF3,UNDECAPRENYL-PHOSPHATE 4-DEOXY-4-FORMAMIDO-L-ARABINOSE TRANSFERASE,True
B5FNT8,Undecaprenyl-phosphate 4-deoxy-4-formamido-L-arabinose transferase,protein,439851,Salmonella dublin (strain CT_02021853),Salmonella dublin (strain CT_02021853),arnC,327,PTHR48090:SF3,UNDECAPRENYL-PHOSPHATE 4-DEOXY-4-FORMAMIDO-L-ARABINOSE TRANSFERASE,True
B5R271,Undecaprenyl-phosphate 4-deoxy-4-formamido-L-arabinose transferase,protein,550537,Salmonella enteritidis PT4 (strain P125109),Salmonella enteritidis PT4 (strain P125109),arnC,327,PTHR48090:SF3,UNDECAPRENYL-PHOSPHATE 4-DEOXY-4-FORMAMIDO-L-ARABINOSE TRANSFERASE,True
B5RCC3,Undecaprenyl-phosphate 4-deoxy-4-formamido-L-arabinose transferase,protein,550538,Salmonella gallinarum (strain 287/91 / NCTC 13346),Salmonella gallinarum (strain 287/91 / NCTC 13346),arnC,327,PTHR48090:SF3,UNDECAPRENYL-PHOSPHATE 4-DEOXY-4-FORMAMIDO-L-ARABINOSE TRANSFERASE,True
B5XTK8,Undecaprenyl-phosphate 4-deoxy-4-formamido-L-arabinose transferase,protein,507522,Klebsiella variicola (strain 342),Klebsiella variicola (strain 342),arnC,327,PTHR48090:SF3,UNDECAPRENYL-PHOSPHATE 4-DEOXY-4-FORMAMIDO-L-ARABINOSE TRANSFERASE,True
B5YX45,Undecaprenyl-phosphate 4-deoxy-4-formamido-L-arabinose transferase,protein,444450,Escherichia coli O157:H7 (strain EC4115 / EHEC),Escherichia coli O157:H7 (strain EC4115 / EHEC),arnC,322,PTHR48090:SF3,UNDECAPRENYL-PHOSPHATE 4-DEOXY-4-FORMAMIDO-L-ARABINOSE TRANSFERASE,True
B6I7J7,Undecaprenyl-phosphate 4-deoxy-4-formamido-L-arabinose transferase,protein,409438,Escherichia coli (strain SE11),Escherichia coli (strain SE11),arnC,322,PTHR48090:SF3,UNDECAPRENYL-PHOSPHATE 4-DEOXY-4-FORMAMIDO-L-ARABINOSE TRANSFERASE,True
B7LAR9,Undecaprenyl-phosphate 4-deoxy-4-formamido-L-arabinose transferase,protein,585055,Escherichia coli (strain 55989 / EAEC),Escherichia coli (strain 55989 / EAEC),arnC,322,PTHR48090:SF3,UNDECAPRENYL-PHOSPHATE 4-DEOXY-4-FORMAMIDO-L-ARABINOSE TRANSFERASE,True
B7LM77,Undecaprenyl-phosphate 4-deoxy-4-formamido-L-arabinose transferase,protein,585054,Escherichia fergusonii (strain ATCC 35469 / DSM 13698 / CCUG 18766 / IAM 14443 / JCM 21226 / LMG 7866 / NBRC 102419 / NCTC 12128 / CDC 0568-73),Escherichia fergusonii (strain ATCC 35469 / DSM 13698 / CCUG 18766 / IAM 14443 / JCM 21226 / LMG 7866 / NBRC 102419 / NCTC 12128 / CDC 0568-73),arnC,326,PTHR48090:SF3,UNDECAPRENYL-PHOSPHATE 4-DEOXY-4-FORMAMIDO-L-ARABINOSE TRANSFERASE,True
B7M5T6,Undecaprenyl-phosphate 4-deoxy-4-formamido-L-arabinose transferase,protein,585034,Escherichia coli O8 (strain IAI1),Escherichia coli O8 (strain IAI1),arnC,322,PTHR48090:SF3,UNDECAPRENYL-PHOSPHATE 4-DEOXY-4-FORMAMIDO-L-ARABINOSE TRANSFERASE,True
B7MG21,Undecaprenyl-phosphate 4-deoxy-4-formamido-L-arabinose transferase,protein,585035,Escherichia coli O45:K1 (strain S88 / ExPEC),Escherichia coli O45:K1 (strain S88 / ExPEC),arnC,322,PTHR48090:SF3,UNDECAPRENYL-PHOSPHATE 4-DEOXY-4-FORMAMIDO-L-ARABINOSE TRANSFERASE,True
B7MXT5,Undecaprenyl-phosphate 4-deoxy-4-formamido-L-arabinose transferase,protein,585397,Escherichia coli O81 (strain ED1a),Escherichia coli O81 (strain ED1a),arnC,322,PTHR48090:SF3,UNDECAPRENYL-PHOSPHATE 4-DEOXY-4-FORMAMIDO-L-ARABINOSE TRANSFERASE,True
B7N5L9,Undecaprenyl-phosphate 4-deoxy-4-formamido-L-arabinose transferase,protein,585056,Escherichia coli O17:K52:H18 (strain UMN026 / ExPEC),Escherichia coli O17:K52:H18 (strain UMN026 / ExPEC),arnC,322,PTHR48090:SF3,UNDECAPRENYL-PHOSPHATE 4-DEOXY-4-FORMAMIDO-L-ARABINOSE TRANSFERASE,True
B7NNT3,Undecaprenyl-phosphate 4-deoxy-4-formamido-L-arabinose transferase,protein,585057,Escherichia coli O7:K1 (strain IAI39 / ExPEC),Escherichia coli O7:K1 (strain IAI39 / ExPEC),arnC,322,PTHR48090:SF3,UNDECAPRENYL-PHOSPHATE 4-DEOXY-4-FORMAMIDO-L-ARABINOSE TRANSFERASE,True
B7UFR6,Undecaprenyl-phosphate 4-deoxy-4-formamido-L-arabinose transferase,protein,574521,Escherichia coli O127:H6 (strain E2348/69 / EPEC),Escherichia coli O127:H6 (strain E2348/69 / EPEC),arnC,322,PTHR48090:SF3,UNDECAPRENYL-PHOSPHATE 4-DEOXY-4-FORMAMIDO-L-ARABINOSE TRANSFERASE,True
B7VBN3,Undecaprenyl-phosphate 4-deoxy-4-formamido-L-arabinose transferase,protein,557722,Pseudomonas aeruginosa (strain LESB58),Pseudomonas aeruginosa (strain LESB58),arnC,339,PTHR48090:SF3,UNDECAPRENYL-PHOSPHATE 4-DEOXY-4-FORMAMIDO-L-ARABINOSE TRANSFERASE,True
C0Q070,Undecaprenyl-phosphate 4-deoxy-4-formamido-L-arabinose transferase,protein,476213,Salmonella paratyphi C (strain RKS4594),Salmonella paratyphi C (strain RKS4594),arnC,327,PTHR48090:SF3,UNDECAPRENYL-PHOSPHATE 4-DEOXY-4-FORMAMIDO-L-ARABINOSE TRANSFERASE,True
C3KAD3,Undecaprenyl-phosphate 4-deoxy-4-formamido-L-arabinose transferase,protein,216595,Pseudomonas fluorescens (strain SBW25),Pseudomonas fluorescens (strain SBW25),arnC,341,PTHR48090:SF3,UNDECAPRENYL-PHOSPHATE 4-DEOXY-4-FORMAMIDO-L-ARABINOSE TRANSFERASE,True
C4ZU96,Undecaprenyl-phosphate 4-deoxy-4-formamido-L-arabinose transferase,protein,595496,Escherichia coli (strain K12 / MC4100 / BW2952),Escherichia coli (strain K12 / MC4100 / BW2952),arnC,322,PTHR48090:SF3,UNDECAPRENYL-PHOSPHATE 4-DEOXY-4-FORMAMIDO-L-ARABINOSE TRANSFERASE,True
C5BDQ5,Undecaprenyl-phosphate 4-deoxy-4-formamido-L-arabinose transferase,protein,634503,Edwardsiella ictaluri (strain 93-146),Edwardsiella ictaluri (strain 93-146),arnC,325,PTHR48090:SF3,UNDECAPRENYL-PHOSPHATE 4-DEOXY-4-FORMAMIDO-L-ARABINOSE TRANSFERASE,True
C6DAW6,Undecaprenyl-phosphate 4-deoxy-4-formamido-L-arabinose transferase,protein,561230,Pectobacterium carotovorum subsp. carotovorum (strain PC1),Pectobacterium carotovorum subsp. carotovorum (strain PC1),arnC,327,PTHR48090:SF3,UNDECAPRENYL-PHOSPHATE 4-DEOXY-4-FORMAMIDO-L-ARABINOSE TRANSFERASE,True
D4GU74,Low-salt glycan biosynthesis hexosyltransferase Agl6,protein,309800,Haloferax volcanii (strain ATCC 29605 / DSM 3757 / JCM 8879 / NBRC 14742 / NCIMB 2012 / VKM B-1768 / DS2),Haloferax volcanii (strain ATCC 29605 / DSM 3757 / JCM 8879 / NBRC 14742 / NCIMB 2012 / VKM B-1768 / DS2),agl6,413,PTHR48090:SF7,RFBJ PROTEIN,True
D4GYG3,Glycosyltransferase AglJ,protein,309800,Haloferax volcanii (strain ATCC 29605 / DSM 3757 / JCM 8879 / NBRC 14742 / NCIMB 2012 / VKM B-1768 / DS2),Haloferax volcanii (strain ATCC 29605 / DSM 3757 / JCM 8879 / NBRC 14742 / NCIMB 2012 / VKM B-1768 / DS2),aglJ,303,PTHR48090:SF7,RFBJ PROTEIN,True
D4GZ42,Dolichyl-phosphate hexose transferase HVO_1613,protein,309800,Haloferax volcanii (strain ATCC 29605 / DSM 3757 / JCM 8879 / NBRC 14742 / NCIMB 2012 / VKM B-1768 / DS2),Haloferax volcanii (strain ATCC 29605 / DSM 3757 / JCM 8879 / NBRC 14742 / NCIMB 2012 / VKM B-1768 / DS2),HVO_1613,228,PTHR48090:SF7,RFBJ PROTEIN,True
O22007,Bactoprenol glucosyl transferase,protein,55884,Shigella phage SfV,Shigella phage SfV (Shigella flexneri bacteriophage V),gtrB,307,PTHR48090:SF1,PROPHAGE BACTOPRENOL GLUCOSYL TRANSFERASE HOMOLOG,False
O34319,Uncharacterized glycosyltransferase YkcC,protein,224308,Bacillus subtilis (strain 168),Bacillus subtilis (strain 168),ykcC,323,PTHR48090:SF1,PROPHAGE BACTOPRENOL GLUCOSYL TRANSFERASE HOMOLOG,True
O34755,Uncharacterized glycosyltransferase YkoT,protein,224308,Bacillus subtilis (strain 168),Bacillus subtilis (strain 168),ykoT,337,PTHR48090:SF1,PROPHAGE BACTOPRENOL GLUCOSYL TRANSFERASE HOMOLOG,True
O52324,Undecaprenyl-phosphate 4-deoxy-4-formamido-L-arabinose transferase,protein,99287,Salmonella typhimurium (strain LT2 / SGSC1412 / ATCC 700720),Salmonella typhimurium (strain LT2 / SGSC1412 / ATCC 700720),arnC,327,PTHR48090:SF3,UNDECAPRENYL-PHOSPHATE 4-DEOXY-4-FORMAMIDO-L-ARABINOSE TRANSFERASE,True
P0A598,Uncharacterized glycosyltransferase Mb0553,protein,233413,Mycobacterium bovis (strain ATCC BAA-935 / AF2122/97),Mycobacterium bovis (strain ATCC BAA-935 / AF2122/97),BQ2027_MB0553,218,PTHR48090:SF7,RFBJ PROTEIN,True
P37786,Protein RfbJ,protein,623,Shigella flexneri,Shigella flexneri,rfbJ,129,PTHR48090:SF7,RFBJ PROTEIN,True
P37787,Uncharacterized protein SF2094/S2216,protein,623,Shigella flexneri,Shigella flexneri,SF2094,163,PTHR48090:SF7,RFBJ PROTEIN,True
P57022,Bactoprenol glucosyl transferase,protein,10754,Salmonella phage P22,Salmonella phage P22,gtrB,310,PTHR48090:SF1,PROPHAGE BACTOPRENOL GLUCOSYL TRANSFERASE HOMOLOG,False
P68667,SfII prophage-derived bactoprenol glucosyl transferase,protein,623,Shigella flexneri,Shigella flexneri,gtrB,309,PTHR48090:SF1,PROPHAGE BACTOPRENOL GLUCOSYL TRANSFERASE HOMOLOG,True
P68668,Bactoprenol glucosyl transferase,protein,66284,Shigella phage SfII,Shigella phage SfII (Shigella flexneri bacteriophage II),gtrB,309,PTHR48090:SF1,PROPHAGE BACTOPRENOL GLUCOSYL TRANSFERASE HOMOLOG,False
P74505,Uncharacterized glycosyltransferase slr1943,protein,1111708,Synechocystis sp. (strain ATCC 27184 / PCC 6803 / Kazusa),Synechocystis sp. (strain ATCC 27184 / PCC 6803 / Kazusa),slr1943,331,PTHR48090:SF1,PROPHAGE BACTOPRENOL GLUCOSYL TRANSFERASE HOMOLOG,True
P77293,Prophage bactoprenol glucosyl transferase homolog,protein,83333,Escherichia coli (strain K12),Escherichia coli (strain K12),yfdH,306,PTHR48090:SF1,PROPHAGE BACTOPRENOL GLUCOSYL TRANSFERASE HOMOLOG,True
P77757,Undecaprenyl-phosphate 4-deoxy-4-formamido-L-arabinose transferase,protein,83333,Escherichia coli (strain K12),Escherichia coli (strain K12),arnC,322,PTHR48090:SF3,UNDECAPRENYL-PHOSPHATE 4-DEOXY-4-FORMAMIDO-L-ARABINOSE TRANSFERASE,True
P9WMW8,Glucosyl-3-phosphoglycerate synthase,protein,83331,Mycobacterium tuberculosis (strain CDC 1551 / Oshkosh),Mycobacterium tuberculosis (strain CDC 1551 / Oshkosh),gpgS,324,PTHR48090:SF10,GLUCOSYL-3-PHOSPHOGLYCERATE SYNTHASE,True
P9WMW9,Glucosyl-3-phosphoglycerate synthase,protein,83332,Mycobacterium tuberculosis (strain ATCC 25618 / H37Rv),Mycobacterium tuberculosis (strain ATCC 25618 / H37Rv),gpgS,324,PTHR48090:SF10,GLUCOSYL-3-PHOSPHOGLYCERATE SYNTHASE,True
P9WMX4,Putative glycosyltransferases,protein,83331,Mycobacterium tuberculosis (strain CDC 1551 / Oshkosh),Mycobacterium tuberculosis (strain CDC 1551 / Oshkosh),pimF,342,PTHR48090:SF1,PROPHAGE BACTOPRENOL GLUCOSYL TRANSFERASE HOMOLOG,True
P9WMX5,Putative glycosyltransferases,protein,83332,Mycobacterium tuberculosis (strain ATCC 25618 / H37Rv),Mycobacterium tuberculosis (strain ATCC 25618 / H37Rv),pimF,342,PTHR48090:SF1,PROPHAGE BACTOPRENOL GLUCOSYL TRANSFERASE HOMOLOG,True
P9WMY0,Uncharacterized glycosyltransferase MT0564,protein,83331,Mycobacterium tuberculosis (strain CDC 1551 / Oshkosh),Mycobacterium tuberculosis (strain CDC 1551 / Oshkosh),MT0564,218,PTHR48090:SF7,RFBJ PROTEIN,True
P9WMY1,Uncharacterized glycosyltransferase Rv0539,protein,83332,Mycobacterium tuberculosis (strain ATCC 25618 / H37Rv),Mycobacterium tuberculosis (strain ATCC 25618 / H37Rv),Rv0539,218,PTHR48090:SF7,RFBJ PROTEIN,True
Q02R24,Undecaprenyl-phosphate 4-deoxy-4-formamido-L-arabinose transferase,protein,208963,Pseudomonas aeruginosa (strain UCBPP-PA14),Pseudomonas aeruginosa (strain UCBPP-PA14),arnC,339,PTHR48090:SF3,UNDECAPRENYL-PHOSPHATE 4-DEOXY-4-FORMAMIDO-L-ARABINOSE TRANSFERASE,True
Q0T2M9,Undecaprenyl-phosphate 4-deoxy-4-formamido-L-arabinose transferase,protein,373384,Shigella flexneri serotype 5b (strain 8401),Shigella flexneri serotype 5b (strain 8401),arnC,322,PTHR48090:SF3,UNDECAPRENYL-PHOSPHATE 4-DEOXY-4-FORMAMIDO-L-ARABINOSE TRANSFERASE,True
Q0TFI8,Undecaprenyl-phosphate 4-deoxy-4-formamido-L-arabinose transferase,protein,362663,Escherichia coli O6:K15:H31 (strain 536 / UPEC),Escherichia coli O6:K15:H31 (strain 536 / UPEC),arnC,322,PTHR48090:SF3,UNDECAPRENYL-PHOSPHATE 4-DEOXY-4-FORMAMIDO-L-ARABINOSE TRANSFERASE,True
Q1C741,Undecaprenyl-phosphate 4-deoxy-4-formamido-L-arabinose transferase,protein,360102,Yersinia pestis bv. Antiqua (strain Antiqua),Yersinia pestis bv. Antiqua (strain Antiqua),arnC,327,PTHR48090:SF3,UNDECAPRENYL-PHOSPHATE 4-DEOXY-4-FORMAMIDO-L-ARABINOSE TRANSFERASE,True
Q1CIH6,Undecaprenyl-phosphate 4-deoxy-4-formamido-L-arabinose transferase,protein,377628,Yersinia pestis bv. Antiqua (strain Nepal516),Yersinia pestis bv. Antiqua (strain Nepal516),arnC,327,PTHR48090:SF3,UNDECAPRENYL-PHOSPHATE 4-DEOXY-4-FORMAMIDO-L-ARABINOSE TRANSFERASE,True
Q1MJ95,Dodecaprenyl-phosphate galacturonate synthase,protein,216596,Rhizobium johnstonii (strain DSM 114642 / LMG 32736 / 3841),Rhizobium johnstonii (strain DSM 114642 / LMG 32736 / 3841),rgtE,338,PTHR48090:SF3,UNDECAPRENYL-PHOSPHATE 4-DEOXY-4-FORMAMIDO-L-ARABINOSE TRANSFERASE,True
Q1R9G1,Undecaprenyl-phosphate 4-deoxy-4-formamido-L-arabinose transferase,protein,364106,Escherichia coli (strain UTI89 / UPEC),Escherichia coli (strain UTI89 / UPEC),arnC,322,PTHR48090:SF3,UNDECAPRENYL-PHOSPHATE 4-DEOXY-4-FORMAMIDO-L-ARABINOSE TRANSFERASE,True
Q2NRV6,Undecaprenyl-phosphate 4-deoxy-4-formamido-L-arabinose transferase,protein,343509,Sodalis glossinidius (strain morsitans),Sodalis glossinidius (strain morsitans),arnC,326,PTHR48090:SF3,UNDECAPRENYL-PHOSPHATE 4-DEOXY-4-FORMAMIDO-L-ARABINOSE TRANSFERASE,True
Q31YK3,Undecaprenyl-phosphate 4-deoxy-4-formamido-L-arabinose transferase,protein,300268,Shigella boydii serotype 4 (strain Sb227),Shigella boydii serotype 4 (strain Sb227),arnC,322,PTHR48090:SF3,UNDECAPRENYL-PHOSPHATE 4-DEOXY-4-FORMAMIDO-L-ARABINOSE TRANSFERASE,True
Q32DT4,Undecaprenyl-phosphate 4-deoxy-4-formamido-L-arabinose transferase,protein,300267,Shigella dysenteriae serotype 1 (strain Sd197),Shigella dysenteriae serotype 1 (strain Sd197),arnC,322,PTHR48090:SF3,UNDECAPRENYL-PHOSPHATE 4-DEOXY-4-FORMAMIDO-L-ARABINOSE TRANSFERASE,True
Q3KCC2,Undecaprenyl-phosphate 4-deoxy-4-formamido-L-arabinose transferase,protein,205922,Pseudomonas fluorescens (strain Pf0-1),Pseudomonas fluorescens (strain Pf0-1),arnC,340,PTHR48090:SF3,UNDECAPRENYL-PHOSPHATE 4-DEOXY-4-FORMAMIDO-L-ARABINOSE TRANSFERASE,True
Q3YZV2,Undecaprenyl-phosphate 4-deoxy-4-formamido-L-arabinose transferase,protein,300269,Shigella sonnei (strain Ss046),Shigella sonnei (strain Ss046),arnC,322,PTHR48090:SF3,UNDECAPRENYL-PHOSPHATE 4-DEOXY-4-FORMAMIDO-L-ARABINOSE TRANSFERASE,True
Q45539,Putative glycosyltransferase CsbB,protein,224308,Bacillus subtilis (strain 168),Bacillus subtilis (strain 168),csbB,329,PTHR48090:SF8,GLYCOSYLTRANSFERASE CSBB-RELATED,True
Q48HZ2,Undecaprenyl-phosphate 4-deoxy-4-formamido-L-arabinose transferase,protein,264730,Pseudomonas savastanoi pv. phaseolicola (strain 1448A / Race 6),Pseudomonas savastanoi pv. phaseolicola (strain 1448A / Race 6),arnC,337,PTHR48090:SF3,UNDECAPRENYL-PHOSPHATE 4-DEOXY-4-FORMAMIDO-L-ARABINOSE TRANSFERASE,True
Q4KC83,Undecaprenyl-phosphate 4-deoxy-4-formamido-L-arabinose transferase,protein,220664,Pseudomonas fluorescens (strain ATCC BAA-477 / NRRL B-23932 / Pf-5),Pseudomonas fluorescens (strain ATCC BAA-477 / NRRL B-23932 / Pf-5),arnC,339,PTHR48090:SF3,UNDECAPRENYL-PHOSPHATE 4-DEOXY-4-FORMAMIDO-L-ARABINOSE TRANSFERASE,True
Q4ZSZ3,Undecaprenyl-phosphate 4-deoxy-4-formamido-L-arabinose transferase,protein,205918,Pseudomonas syringae pv. syringae (strain B728a),Pseudomonas syringae pv. syringae (strain B728a),arnC,337,PTHR48090:SF3,UNDECAPRENYL-PHOSPHATE 4-DEOXY-4-FORMAMIDO-L-ARABINOSE TRANSFERASE,True
Q55487,Uncharacterized glycosyltransferase sll0501,protein,1111708,Synechocystis sp. (strain ATCC 27184 / PCC 6803 / Kazusa),Synechocystis sp. (strain ATCC 27184 / PCC 6803 / Kazusa),sll0501,318,PTHR48090:SF1,PROPHAGE BACTOPRENOL GLUCOSYL TRANSFERASE HOMOLOG,True
Q57964,Uncharacterized protein MJ0544,protein,243232,Methanocaldococcus jannaschii (strain ATCC 43067 / DSM 2661 / JAL-1 / JCM 10045 / NBRC 100440),Methanocaldococcus jannaschii (strain ATCC 43067 / DSM 2661 / JAL-1 / JCM 10045 / NBRC 100440),MJ0544,229,PTHR48090:SF7,RFBJ PROTEIN,True
Q57M56,Undecaprenyl-phosphate 4-deoxy-4-formamido-L-arabinose transferase,protein,321314,Salmonella choleraesuis (strain SC-B67),Salmonella choleraesuis (strain SC-B67),arnC,327,PTHR48090:SF3,UNDECAPRENYL-PHOSPHATE 4-DEOXY-4-FORMAMIDO-L-ARABINOSE TRANSFERASE,True
Q5PNA5,Undecaprenyl-phosphate 4-deoxy-4-formamido-L-arabinose transferase,protein,295319,Salmonella paratyphi A (strain ATCC 9150 / SARB42),Salmonella paratyphi A (strain ATCC 9150 / SARB42),arnC,327,PTHR48090:SF3,UNDECAPRENYL-PHOSPHATE 4-DEOXY-4-FORMAMIDO-L-ARABINOSE TRANSFERASE,True
Q6D2F0,Undecaprenyl-phosphate 4-deoxy-4-formamido-L-arabinose transferase,protein,218491,Pectobacterium atrosepticum (strain SCRI 1043 / ATCC BAA-672),Pectobacterium atrosepticum (strain SCRI 1043 / ATCC BAA-672),arnC,327,PTHR48090:SF3,UNDECAPRENYL-PHOSPHATE 4-DEOXY-4-FORMAMIDO-L-ARABINOSE TRANSFERASE,True
Q73WU1,Glucosyl-3-phosphoglycerate synthase,protein,262316,Mycolicibacterium paratuberculosis (strain ATCC BAA-968 / K-10),Mycolicibacterium paratuberculosis (strain ATCC BAA-968 / K-10),MAP_2569c,329,PTHR48090:SF10,GLUCOSYL-3-PHOSPHOGLYCERATE SYNTHASE,True
Q7N3Q6,Undecaprenyl-phosphate 4-deoxy-4-formamido-L-arabinose transferase,protein,243265,Photorhabdus laumondii subsp. laumondii (strain DSM 15139 / CIP 105565 / TT01),Photorhabdus laumondii subsp. laumondii (strain DSM 15139 / CIP 105565 / TT01),arnC,325,PTHR48090:SF3,UNDECAPRENYL-PHOSPHATE 4-DEOXY-4-FORMAMIDO-L-ARABINOSE TRANSFERASE,True
Q7U0E1,Glucosyl-3-phosphoglycerate synthase,protein,233413,Mycobacterium bovis (strain ATCC BAA-935 / AF2122/97),Mycobacterium bovis (strain ATCC BAA-935 / AF2122/97),gpgS,324,PTHR48090:SF10,GLUCOSYL-3-PHOSPHOGLYCERATE SYNTHASE,True
Q7UC63,Undecaprenyl-phosphate 4-deoxy-4-formamido-L-arabinose transferase,protein,623,Shigella flexneri,Shigella flexneri,arnC,322,PTHR48090:SF3,UNDECAPRENYL-PHOSPHATE 4-DEOXY-4-FORMAMIDO-L-ARABINOSE TRANSFERASE,True
Q8D342,Undecaprenyl-phosphate 4-deoxy-4-formamido-L-arabinose transferase,protein,36870,Wigglesworthia glossinidia brevipalpis,Wigglesworthia glossinidia brevipalpis,arnC,323,PTHR48090:SF3,UNDECAPRENYL-PHOSPHATE 4-DEOXY-4-FORMAMIDO-L-ARABINOSE TRANSFERASE,True
