id,name,entry_type,source_tax_id,source_tax_name,full_tax_name,gene,length,subfamily,subfamily_name,in_alphafold
C6LR75,Flavohemoprotein,protein,598745,Giardia intestinalis (strain ATCC 50581 / GS clone H7),Giardia intestinalis (strain ATCC 50581 / GS clone H7),hmpA,458,PTHR43396:SF3,FLAVOHEMOPROTEIN,True
E1F8H4,Flavohemoprotein-2,protein,658858,Giardia intestinalis (strain P15),Giardia intestinalis (strain P15),hmpA-2,457,PTHR43396:SF3,FLAVOHEMOPROTEIN,True
E1F8Q4,Flavohemoprotein-1,protein,658858,Giardia intestinalis (strain P15),Giardia intestinalis (strain P15),hmpA-1,457,PTHR43396:SF3,FLAVOHEMOPROTEIN,True
E2RTZ4,Flavohemoprotein,protein,184922,Giardia intestinalis (strain ATCC 50803 / WB clone C6),Giardia intestinalis (strain ATCC 50803 / WB clone C6),hmpA,458,PTHR43396:SF3,FLAVOHEMOPROTEIN,True
O66586,Uncharacterized globin-like protein aq_211,protein,224324,Aquifex aeolicus (strain VF5),Aquifex aeolicus (strain VF5),aq_211,139,PTHR43396:SF3,FLAVOHEMOPROTEIN,True
P04252,Bacterial hemoglobin,protein,61,Vitreoscilla stercoraria,Vitreoscilla stercoraria,vhb,146,PTHR43396:SF3,FLAVOHEMOPROTEIN,True
P24232,Flavohemoprotein,protein,83333,Escherichia coli (strain K12),Escherichia coli (strain K12),hmp,396,PTHR43396:SF3,FLAVOHEMOPROTEIN,True
P26353,Flavohemoprotein,protein,99287,Salmonella typhimurium (strain LT2 / SGSC1412 / ATCC 700720),Salmonella typhimurium (strain LT2 / SGSC1412 / ATCC 700720),hmp,396,PTHR43396:SF3,FLAVOHEMOPROTEIN,True
P39662,Flavohemoprotein,protein,381666,Cupriavidus necator (strain ATCC 17699 / DSM 428 / KCTC 22496 / NCIMB 10442 / H16 / Stanier 337),Cupriavidus necator (strain ATCC 17699 / DSM 428 / KCTC 22496 / NCIMB 10442 / H16 / Stanier 337),hmp,403,PTHR43396:SF3,FLAVOHEMOPROTEIN,True
P39676,Flavohemoprotein,protein,559292,Saccharomyces cerevisiae (strain ATCC 204508 / S288c),Saccharomyces cerevisiae (strain ATCC 204508 / S288c) (Baker's yeast),YHB1,399,PTHR43396:SF3,FLAVOHEMOPROTEIN,True
P40609,Flavohemoprotein,protein,223926,Vibrio parahaemolyticus serotype O3:K6 (strain RIMD 2210633),Vibrio parahaemolyticus serotype O3:K6 (strain RIMD 2210633),hmp,394,PTHR43396:SF3,FLAVOHEMOPROTEIN,True
P49852,Flavohemoprotein,protein,224308,Bacillus subtilis (strain 168),Bacillus subtilis (strain 168),hmp,399,PTHR43396:SF3,FLAVOHEMOPROTEIN,True
P53857,Uncharacterized globin-like protein YNL234W,protein,559292,Saccharomyces cerevisiae (strain ATCC 204508 / S288c),Saccharomyces cerevisiae (strain ATCC 204508 / S288c) (Baker's yeast),YNL234W,426,PTHR43396:SF6,ABL201WP,True
Q03331,Flavohemoprotein,protein,4921,Candida norvegensis,Candida norvegensis (Yeast),,390,PTHR43396:SF3,FLAVOHEMOPROTEIN,True
Q47266,Flavohemoprotein,protein,198628,Dickeya dadantii (strain 3937),Dickeya dadantii (strain 3937),hmp,395,PTHR43396:SF3,FLAVOHEMOPROTEIN,True
Q54D73,Flavohemoprotein B,protein,44689,Dictyostelium discoideum,Dictyostelium discoideum (Social amoeba),fhbB,423,PTHR43396:SF1,FLAVOHEMOPROTEIN B,True
Q57LF5,Flavohemoprotein,protein,321314,Salmonella choleraesuis (strain SC-B67),Salmonella choleraesuis (strain SC-B67),hmp,396,PTHR43396:SF3,FLAVOHEMOPROTEIN,True
Q59MV9,Flavohemoprotein,protein,237561,Candida albicans (strain SC5314 / ATCC MYA-2876),Candida albicans (strain SC5314 / ATCC MYA-2876) (Yeast),YHB1,398,PTHR43396:SF3,FLAVOHEMOPROTEIN,True
Q5PIH6,Flavohemoprotein,protein,295319,Salmonella paratyphi A (strain ATCC 9150 / SARB42),Salmonella paratyphi A (strain ATCC 9150 / SARB42),hmp,396,PTHR43396:SF3,FLAVOHEMOPROTEIN,True
Q6D245,Flavohemoprotein,protein,218491,Pectobacterium atrosepticum (strain SCRI 1043 / ATCC BAA-672),Pectobacterium atrosepticum (strain SCRI 1043 / ATCC BAA-672),hmp,396,PTHR43396:SF3,FLAVOHEMOPROTEIN,True
Q6HLA6,Flavohemoprotein,protein,281309,Bacillus thuringiensis subsp. konkukian (strain 97-27),Bacillus thuringiensis subsp. konkukian (strain 97-27),hmp,402,PTHR43396:SF3,FLAVOHEMOPROTEIN,True
Q6LM37,Flavohemoprotein,protein,298386,Photobacterium profundum (strain SS9),Photobacterium profundum (strain SS9),hmp,394,PTHR43396:SF3,FLAVOHEMOPROTEIN,True
Q73B49,Flavohemoprotein,protein,222523,Bacillus cereus (strain ATCC 10987 / NRS 248),Bacillus cereus (strain ATCC 10987 / NRS 248),hmp,402,PTHR43396:SF3,FLAVOHEMOPROTEIN,True
Q7ABK6,Flavohemoprotein,protein,83334,Escherichia coli O157:H7,Escherichia coli O157:H7,hmp,396,PTHR43396:SF3,FLAVOHEMOPROTEIN,True
Q7C0F9,Flavohemoprotein,protein,623,Shigella flexneri,Shigella flexneri,hmp,396,PTHR43396:SF3,FLAVOHEMOPROTEIN,True
Q7MH09,Flavohemoprotein,protein,196600,Vibrio vulnificus (strain YJ016),Vibrio vulnificus (strain YJ016),hmp,394,PTHR43396:SF3,FLAVOHEMOPROTEIN,True
Q7N215,Flavohemoprotein,protein,243265,Photorhabdus laumondii subsp. laumondii (strain DSM 15139 / CIP 105565 / TT01),Photorhabdus laumondii subsp. laumondii (strain DSM 15139 / CIP 105565 / TT01),hmp,396,PTHR43396:SF3,FLAVOHEMOPROTEIN,True
Q7NSD8,Flavohemoprotein,protein,243365,Chromobacterium violaceum (strain ATCC 12472 / DSM 30191 / JCM 1249 / CCUG 213 / NBRC 12614 / NCIMB 9131 / NCTC 9757 / MK),Chromobacterium violaceum (strain ATCC 12472 / DSM 30191 / JCM 1249 / CCUG 213 / NBRC 12614 / NCIMB 9131 / NCTC 9757 / MK),hmp,404,PTHR43396:SF3,FLAVOHEMOPROTEIN,True
Q7TTP0,Flavohemoprotein,protein,257313,Bordetella pertussis (strain Tohama I / ATCC BAA-589 / NCTC 13251),Bordetella pertussis (strain Tohama I / ATCC BAA-589 / NCTC 13251),hmp,402,PTHR43396:SF3,FLAVOHEMOPROTEIN,True
Q7TTP2,Flavohemoprotein,protein,257311,Bordetella parapertussis (strain 12822 / ATCC BAA-587 / NCTC 13253),Bordetella parapertussis (strain 12822 / ATCC BAA-587 / NCTC 13253),hmp,402,PTHR43396:SF3,FLAVOHEMOPROTEIN,True
Q7UIY1,Flavohemoprotein,protein,243090,Rhodopirellula baltica (strain DSM 10527 / NCIMB 13988 / SH1),Rhodopirellula baltica (strain DSM 10527 / NCIMB 13988 / SH1),hmp,408,PTHR43396:SF3,FLAVOHEMOPROTEIN,True
Q7WHW5,Flavohemoprotein,protein,257310,Bordetella bronchiseptica (strain ATCC BAA-588 / NCTC 13252 / RB50),Bordetella bronchiseptica (strain ATCC BAA-588 / NCTC 13252 / RB50),hmp,402,PTHR43396:SF3,FLAVOHEMOPROTEIN,True
Q7WUM8,Flavohemoprotein,protein,266834,Rhizobium meliloti (strain 1021),Rhizobium meliloti (strain 1021) (Ensifer meliloti),hmp,403,PTHR43396:SF3,FLAVOHEMOPROTEIN,True
Q81FW4,Flavohemoprotein,protein,226900,Bacillus cereus (strain ATCC 14579 / DSM 31 / CCUG 7414 / JCM 2152 / NBRC 15305 / NCIMB 9373 / NCTC 2599 / NRRL B-3711),Bacillus cereus (strain ATCC 14579 / DSM 31 / CCUG 7414 / JCM 2152 / NBRC 15305 / NCIMB 9373 / NCTC 2599 / NRRL B-3711),hmp,402,PTHR43396:SF3,FLAVOHEMOPROTEIN,True
Q81T23,Flavohemoprotein,protein,1392,Bacillus anthracis,Bacillus anthracis (anthrax bacterium),hmp,402,PTHR43396:SF3,FLAVOHEMOPROTEIN,True
Q87F90,Flavohemoprotein,protein,183190,Xylella fastidiosa (strain Temecula1 / ATCC 700964),Xylella fastidiosa (strain Temecula1 / ATCC 700964),hmp,397,PTHR43396:SF3,FLAVOHEMOPROTEIN,True
Q88PP0,Flavohemoprotein,protein,160488,Pseudomonas putida (strain ATCC 47054 / DSM 6125 / CFBP 8728 / NCIMB 11950 / KT2440),Pseudomonas putida (strain ATCC 47054 / DSM 6125 / CFBP 8728 / NCIMB 11950 / KT2440),hmp,392,PTHR43396:SF3,FLAVOHEMOPROTEIN,True
Q8DCU2,Flavohemoprotein,protein,216895,Vibrio vulnificus (strain CMCP6),Vibrio vulnificus (strain CMCP6),hmp,394,PTHR43396:SF3,FLAVOHEMOPROTEIN,True
Q8ETH0,Flavohemoprotein,protein,221109,Oceanobacillus iheyensis (strain DSM 14371 / CIP 107618 / JCM 11309 / KCTC 3954 / HTE831),Oceanobacillus iheyensis (strain DSM 14371 / CIP 107618 / JCM 11309 / KCTC 3954 / HTE831),hmp,406,PTHR43396:SF3,FLAVOHEMOPROTEIN,True
Q8FF30,Flavohemoprotein,protein,199310,Escherichia coli O6:H1 (strain CFT073 / ATCC 700928 / UPEC),Escherichia coli O6:H1 (strain CFT073 / ATCC 700928 / UPEC),hmp,396,PTHR43396:SF3,FLAVOHEMOPROTEIN,True
Q8GAZ4,Flavohemoprotein,protein,109791,Burkholderia sp. (strain TH2),Burkholderia sp. (strain TH2),hmp,393,PTHR43396:SF3,FLAVOHEMOPROTEIN,True
Q8Z4M3,Flavohemoprotein,protein,90370,Salmonella typhi,Salmonella typhi,hmp,396,PTHR43396:SF3,FLAVOHEMOPROTEIN,True
Q8ZCR0,Flavohemoprotein,protein,632,Yersinia pestis,Yersinia pestis,hmp,396,PTHR43396:SF3,FLAVOHEMOPROTEIN,True
Q9I0H4,Flavohemoprotein,protein,208964,Pseudomonas aeruginosa (strain ATCC 15692 / DSM 22644 / CIP 104116 / JCM 14847 / LMG 12228 / 1C / PRS 101 / PAO1),Pseudomonas aeruginosa (strain ATCC 15692 / DSM 22644 / CIP 104116 / JCM 14847 / LMG 12228 / 1C / PRS 101 / PAO1),hmp,393,PTHR43396:SF3,FLAVOHEMOPROTEIN,True
Q9KMY3,Flavohemoprotein,protein,243277,Vibrio cholerae serotype O1 (strain ATCC 39315 / El Tor Inaba N16961),Vibrio cholerae serotype O1 (strain ATCC 39315 / El Tor Inaba N16961),hmp,394,PTHR43396:SF3,FLAVOHEMOPROTEIN,True
Q9PH91,Flavohemoprotein,protein,160492,Xylella fastidiosa (strain 9a5c),Xylella fastidiosa (strain 9a5c),hmp,397,PTHR43396:SF3,FLAVOHEMOPROTEIN,True
Q9RC40,Flavohemoprotein,protein,272558,Halalkalibacterium halodurans (strain ATCC BAA-125 / DSM 18197 / FERM 7344 / JCM 9153 / C-125),Halalkalibacterium halodurans (strain ATCC BAA-125 / DSM 18197 / FERM 7344 / JCM 9153 / C-125),hmp,411,PTHR43396:SF3,FLAVOHEMOPROTEIN,True
Q9RYR5,Flavohemoprotein,protein,243230,Deinococcus radiodurans (strain ATCC 13939 / DSM 20539 / JCM 16871 / CCUG 27074 / LMG 4051 / NBRC 15346 / NCIMB 9279 / VKM B-1422 / R1),Deinococcus radiodurans (strain ATCC 13939 / DSM 20539 / JCM 16871 / CCUG 27074 / LMG 4051 / NBRC 15346 / NCIMB 9279 / VKM B-1422 / R1),hmp,403,PTHR43396:SF3,FLAVOHEMOPROTEIN,True
Q9UAG7,Flavohemoprotein A,protein,44689,Dictyostelium discoideum,Dictyostelium discoideum (Social amoeba),fhbA,397,PTHR43396:SF3,FLAVOHEMOPROTEIN,True
Q9URY5,Flavohemoprotein,protein,284812,Schizosaccharomyces pombe (strain 972 / ATCC 24843),Schizosaccharomyces pombe (strain 972 / ATCC 24843) (Fission yeast),SPAC869.02c,427,PTHR43396:SF3,FLAVOHEMOPROTEIN,True
