id,name,entry_type,source_tax_id,source_tax_name,full_tax_name,gene,length,subfamily,subfamily_name,in_alphafold
A1AHH8,DNA ligase B,protein,405955,Escherichia coli O1:K1 / APEC,Escherichia coli O1:K1 / APEC,ligB,560,PTHR47810:SF1,DNA LIGASE B,True
A1JHV9,DNA ligase B,protein,393305,Yersinia enterocolitica serotype O:8 / biotype 1B (strain NCTC 13174 / 8081),Yersinia enterocolitica serotype O:8 / biotype 1B (strain NCTC 13174 / 8081),ligB,565,PTHR47810:SF1,DNA LIGASE B,True
A4TSE5,DNA ligase B,protein,386656,Yersinia pestis (strain Pestoides F),Yersinia pestis (strain Pestoides F),ligB,567,PTHR47810:SF1,DNA LIGASE B,True
A4VRF3,DNA ligase B,protein,379731,Stutzerimonas stutzeri (strain A1501),Stutzerimonas stutzeri (strain A1501),ligB,556,PTHR47810:SF1,DNA LIGASE B,True
A4W502,DNA ligase B,protein,399742,Enterobacter sp. (strain 638),Enterobacter sp. (strain 638),ligB,556,PTHR47810:SF1,DNA LIGASE B,True
A4XPF7,DNA ligase B,protein,399739,Ectopseudomonas mendocina (strain ymp),Ectopseudomonas mendocina (strain ymp),ligB,562,PTHR47810:SF1,DNA LIGASE B,True
A5WA01,DNA ligase B,protein,351746,Pseudomonas putida (strain ATCC 700007 / DSM 6899 / JCM 31910 / BCRC 17059 / LMG 24140 / F1),Pseudomonas putida (strain ATCC 700007 / DSM 6899 / JCM 31910 / BCRC 17059 / LMG 24140 / F1),ligB,566,PTHR47810:SF1,DNA LIGASE B,True
A6TFP6,DNA ligase B,protein,272620,Klebsiella pneumoniae subsp. pneumoniae (strain ATCC 700721 / MGH 78578),Klebsiella pneumoniae subsp. pneumoniae (strain ATCC 700721 / MGH 78578),ligB,564,PTHR47810:SF1,DNA LIGASE B,True
A7FCR5,DNA ligase B,protein,349747,Yersinia pseudotuberculosis serotype O:1b (strain IP 31758),Yersinia pseudotuberculosis serotype O:1b (strain IP 31758),ligB,567,PTHR47810:SF1,DNA LIGASE B,True
A7MQB5,DNA ligase B,protein,290339,Cronobacter sakazakii (strain ATCC BAA-894),Cronobacter sakazakii (strain ATCC BAA-894),ligB,561,PTHR47810:SF1,DNA LIGASE B,True
A7ZTJ9,DNA ligase B,protein,331111,Escherichia coli O139:H28 (strain E24377A / ETEC),Escherichia coli O139:H28 (strain E24377A / ETEC),ligB,560,PTHR47810:SF1,DNA LIGASE B,True
A8A6A9,DNA ligase B,protein,331112,Escherichia coli O9:H4 (strain HS),Escherichia coli O9:H4 (strain HS),ligB,560,PTHR47810:SF1,DNA LIGASE B,True
A8ARN4,DNA ligase B,protein,290338,Citrobacter koseri (strain ATCC BAA-895 / CDC 4225-83 / SGSC4696),Citrobacter koseri (strain ATCC BAA-895 / CDC 4225-83 / SGSC4696),ligB,560,PTHR47810:SF1,DNA LIGASE B,True
A9MKM6,DNA ligase B,protein,41514,Salmonella arizonae (strain ATCC BAA-731 / CDC346-86 / RSK2980),Salmonella arizonae (strain ATCC BAA-731 / CDC346-86 / RSK2980),ligB,561,PTHR47810:SF1,DNA LIGASE B,True
A9MVP4,DNA ligase B,protein,1016998,Salmonella paratyphi B (strain ATCC BAA-1250 / SPB7),Salmonella paratyphi B (strain ATCC BAA-1250 / SPB7),ligB,561,PTHR47810:SF1,DNA LIGASE B,True
A9R666,DNA ligase B,protein,349746,Yersinia pestis bv. Antiqua (strain Angola),Yersinia pestis bv. Antiqua (strain Angola),ligB,567,PTHR47810:SF1,DNA LIGASE B,True
B0KLZ2,DNA ligase B,protein,76869,Pseudomonas putida (strain GB-1),Pseudomonas putida (strain GB-1),ligB,566,PTHR47810:SF1,DNA LIGASE B,True
B1IYV3,DNA ligase B,protein,481805,Escherichia coli (strain ATCC 8739 / DSM 1576 / NBRC 3972 / NCIMB 8545 / WDCM 00012 / Crooks),Escherichia coli (strain ATCC 8739 / DSM 1576 / NBRC 3972 / NCIMB 8545 / WDCM 00012 / Crooks),ligB,560,PTHR47810:SF1,DNA LIGASE B,True
B1J2Z7,DNA ligase B,protein,390235,Pseudomonas putida (strain W619),Pseudomonas putida (strain W619),ligB,567,PTHR47810:SF1,DNA LIGASE B,True
B1JQZ3,DNA ligase B,protein,502800,Yersinia pseudotuberculosis serotype O:3 (strain YPIII),Yersinia pseudotuberculosis serotype O:3 (strain YPIII),ligB,567,PTHR47810:SF1,DNA LIGASE B,True
B1LK84,DNA ligase B,protein,439855,Escherichia coli (strain SMS-3-5 / SECEC),Escherichia coli (strain SMS-3-5 / SECEC),ligB,560,PTHR47810:SF1,DNA LIGASE B,True
B1X980,DNA ligase B,protein,316385,Escherichia coli (strain K12 / DH10B),Escherichia coli (strain K12 / DH10B),ligB,560,PTHR47810:SF1,DNA LIGASE B,True
B2JYM4,DNA ligase B,protein,502801,Yersinia pseudotuberculosis serotype IB (strain PB1/+),Yersinia pseudotuberculosis serotype IB (strain PB1/+),ligB,567,PTHR47810:SF1,DNA LIGASE B,True
B4SXE9,DNA ligase B,protein,423368,Salmonella newport (strain SL254),Salmonella newport (strain SL254),ligB,561,PTHR47810:SF1,DNA LIGASE B,True
B4T9Z1,DNA ligase B,protein,454169,Salmonella heidelberg (strain SL476),Salmonella heidelberg (strain SL476),ligB,561,PTHR47810:SF1,DNA LIGASE B,True
B4TZZ8,DNA ligase B,protein,439843,Salmonella schwarzengrund (strain CVM19633),Salmonella schwarzengrund (strain CVM19633),ligB,561,PTHR47810:SF1,DNA LIGASE B,True
B5BI22,DNA ligase B,protein,554290,Salmonella paratyphi A (strain AKU_12601),Salmonella paratyphi A (strain AKU_12601),ligB,561,PTHR47810:SF1,DNA LIGASE B,True
B5EXF2,DNA ligase B,protein,454166,Salmonella agona (strain SL483),Salmonella agona (strain SL483),ligB,561,PTHR47810:SF1,DNA LIGASE B,True
B5FM71,DNA ligase B,protein,439851,Salmonella dublin (strain CT_02021853),Salmonella dublin (strain CT_02021853),ligB,561,PTHR47810:SF1,DNA LIGASE B,True
B5R5H2,DNA ligase B,protein,550537,Salmonella enteritidis PT4 (strain P125109),Salmonella enteritidis PT4 (strain P125109),ligB,561,PTHR47810:SF1,DNA LIGASE B,True
B5RG75,DNA ligase B,protein,550538,Salmonella gallinarum (strain 287/91 / NCTC 13346),Salmonella gallinarum (strain 287/91 / NCTC 13346),ligB,561,PTHR47810:SF1,DNA LIGASE B,True
B5XTF0,DNA ligase B,protein,507522,Klebsiella variicola (strain 342),Klebsiella variicola (strain 342),ligB,558,PTHR47810:SF1,DNA LIGASE B,True
B5YWE6,DNA ligase B,protein,444450,Escherichia coli O157:H7 (strain EC4115 / EHEC),Escherichia coli O157:H7 (strain EC4115 / EHEC),ligB,560,PTHR47810:SF1,DNA LIGASE B,True
B7L771,DNA ligase B,protein,585055,Escherichia coli (strain 55989 / EAEC),Escherichia coli (strain 55989 / EAEC),ligB,560,PTHR47810:SF1,DNA LIGASE B,True
B7M4D2,DNA ligase B,protein,585034,Escherichia coli O8 (strain IAI1),Escherichia coli O8 (strain IAI1),ligB,560,PTHR47810:SF1,DNA LIGASE B,True
B7MFK8,DNA ligase B,protein,585035,Escherichia coli O45:K1 (strain S88 / ExPEC),Escherichia coli O45:K1 (strain S88 / ExPEC),ligB,560,PTHR47810:SF1,DNA LIGASE B,True
B7N287,DNA ligase B,protein,585397,Escherichia coli O81 (strain ED1a),Escherichia coli O81 (strain ED1a),ligB,560,PTHR47810:SF1,DNA LIGASE B,True
B7NEV1,DNA ligase B,protein,585056,Escherichia coli O17:K52:H18 (strain UMN026 / ExPEC),Escherichia coli O17:K52:H18 (strain UMN026 / ExPEC),ligB,560,PTHR47810:SF1,DNA LIGASE B,True
B7NQ11,DNA ligase B,protein,585057,Escherichia coli O7:K1 (strain IAI39 / ExPEC),Escherichia coli O7:K1 (strain IAI39 / ExPEC),ligB,560,PTHR47810:SF1,DNA LIGASE B,True
B7UM69,DNA ligase B,protein,574521,Escherichia coli O127:H6 (strain E2348/69 / EPEC),Escherichia coli O127:H6 (strain E2348/69 / EPEC),ligB,561,PTHR47810:SF1,DNA LIGASE B,True
C0Q1X9,DNA ligase B,protein,476213,Salmonella paratyphi C (strain RKS4594),Salmonella paratyphi C (strain RKS4594),ligB,561,PTHR47810:SF1,DNA LIGASE B,True
C1DIC2,DNA ligase B,protein,322710,Azotobacter vinelandii (strain DJ / ATCC BAA-1303),Azotobacter vinelandii (strain DJ / ATCC BAA-1303),ligB,560,PTHR47810:SF1,DNA LIGASE B,True
C3K3F7,DNA ligase B,protein,216595,Pseudomonas fluorescens (strain SBW25),Pseudomonas fluorescens (strain SBW25),ligB,554,PTHR47810:SF1,DNA LIGASE B,True
C4ZXN9,DNA ligase B,protein,595496,Escherichia coli (strain K12 / MC4100 / BW2952),Escherichia coli (strain K12 / MC4100 / BW2952),ligB,560,PTHR47810:SF1,DNA LIGASE B,True
C6DJC3,DNA ligase B,protein,561230,Pectobacterium carotovorum subsp. carotovorum (strain PC1),Pectobacterium carotovorum subsp. carotovorum (strain PC1),ligB,562,PTHR47810:SF1,DNA LIGASE B,True
P00969,DNA ligase,protein,10760,Escherichia phage T7,Escherichia phage T7,1.3,359,PTHR47810:SF1,DNA LIGASE B,False
P00970,DNA ligase,protein,10665,Enterobacteria phage T4,Enterobacteria phage T4,30,487,PTHR47810:SF1,DNA LIGASE B,False
P07717,DNA ligase,protein,10759,Enterobacteria phage T3,Enterobacteria phage T3,1.3,346,PTHR47810:SF1,DNA LIGASE B,False
P0C990,DNA ligase,protein,561443,African swine fever virus (isolate Tick/South Africa/Pretoriuskop Pr4/1996),African swine fever virus (isolate Tick/South Africa/Pretoriuskop Pr4/1996) (ASFV),Pret-112,419,PTHR47810:SF5,"LIGASE, PUTATIVE-RELATED",False
P0C991,DNA ligase,protein,561444,African swine fever virus (isolate Warthog/Namibia/Wart80/1980),African swine fever virus (isolate Warthog/Namibia/Wart80/1980) (ASFV),War-110,419,PTHR47810:SF5,"LIGASE, PUTATIVE-RELATED",False
P0C992,DNA ligase,protein,561445,African swine fever virus (isolate Pig/Kenya/KEN-50/1950),African swine fever virus (isolate Pig/Kenya/KEN-50/1950) (ASFV),Ken-112,419,PTHR47810:SF5,"LIGASE, PUTATIVE-RELATED",False
P19088,DNA ligase,protein,10666,Enterobacteria phage T6,Enterobacteria phage T6,30,487,PTHR47810:SF1,DNA LIGASE B,False
P25772,DNA ligase B,protein,83333,Escherichia coli (strain K12),Escherichia coli (strain K12),ligB,560,PTHR47810:SF1,DNA LIGASE B,True
P26813,DNA ligase,protein,10500,African swine fever virus (isolate Tick/Malawi/Lil 20-1/1983),African swine fever virus (isolate Tick/Malawi/Lil 20-1/1983) (ASFV),LIG,419,PTHR47810:SF5,"LIGASE, PUTATIVE-RELATED",False
P35970,DNA ligase,protein,10498,African swine fever virus (strain Badajoz 1971 Vero-adapted),African swine fever virus (strain Badajoz 1971 Vero-adapted) (Ba71V),LIG,419,PTHR47810:SF5,"LIGASE, PUTATIVE-RELATED",True
P44121,DNA ligase,protein,71421,Haemophilus influenzae (strain ATCC 51907 / DSM 11121 / KW20 / Rd),Haemophilus influenzae (strain ATCC 51907 / DSM 11121 / KW20 / Rd),ligA,268,PTHR47810:SF1,DNA LIGASE B,True
Q0SYH4,DNA ligase B,protein,373384,Shigella flexneri serotype 5b (strain 8401),Shigella flexneri serotype 5b (strain 8401),ligB,560,PTHR47810:SF1,DNA LIGASE B,True
Q0TBG2,DNA ligase B,protein,362663,Escherichia coli O6:K15:H31 (strain 536 / UPEC),Escherichia coli O6:K15:H31 (strain 536 / UPEC),ligB,560,PTHR47810:SF1,DNA LIGASE B,True
Q1C259,DNA ligase B,protein,360102,Yersinia pestis bv. Antiqua (strain Antiqua),Yersinia pestis bv. Antiqua (strain Antiqua),ligB,567,PTHR47810:SF1,DNA LIGASE B,True
Q1CCZ4,DNA ligase B,protein,377628,Yersinia pestis bv. Antiqua (strain Nepal516),Yersinia pestis bv. Antiqua (strain Nepal516),ligB,567,PTHR47810:SF1,DNA LIGASE B,True
Q1I3X5,DNA ligase B,protein,384676,Pseudomonas entomophila (strain L48),Pseudomonas entomophila (strain L48),ligB,557,PTHR47810:SF1,DNA LIGASE B,True
Q1QXD7,DNA ligase B,protein,290398,Chromohalobacter israelensis (strain ATCC BAA-138 / DSM 3043 / CIP 106854 / NCIMB 13768 / 1H11),Chromohalobacter israelensis (strain ATCC BAA-138 / DSM 3043 / CIP 106854 / NCIMB 13768 / 1H11),ligB,629,PTHR47810:SF1,DNA LIGASE B,True
Q1R4U5,DNA ligase B,protein,364106,Escherichia coli (strain UTI89 / UPEC),Escherichia coli (strain UTI89 / UPEC),ligB,560,PTHR47810:SF1,DNA LIGASE B,True
Q3K5E7,DNA ligase B,protein,205922,Pseudomonas fluorescens (strain Pf0-1),Pseudomonas fluorescens (strain Pf0-1),ligB,558,PTHR47810:SF1,DNA LIGASE B,True
Q3YW09,DNA ligase B,protein,300269,Shigella sonnei (strain Ss046),Shigella sonnei (strain Ss046),ligB,560,PTHR47810:SF1,DNA LIGASE B,True
Q4K4I6,DNA ligase B,protein,220664,Pseudomonas fluorescens (strain ATCC BAA-477 / NRRL B-23932 / Pf-5),Pseudomonas fluorescens (strain ATCC BAA-477 / NRRL B-23932 / Pf-5),ligB,556,PTHR47810:SF1,DNA LIGASE B,True
Q4ZLZ9,DNA ligase B,protein,205918,Pseudomonas syringae pv. syringae (strain B728a),Pseudomonas syringae pv. syringae (strain B728a),ligB,561,PTHR47810:SF1,DNA LIGASE B,True
Q57I94,DNA ligase B,protein,321314,Salmonella choleraesuis (strain SC-B67),Salmonella choleraesuis (strain SC-B67),ligB,561,PTHR47810:SF1,DNA LIGASE B,True
Q5PC41,DNA ligase B,protein,295319,Salmonella paratyphi A (strain ATCC 9150 / SARB42),Salmonella paratyphi A (strain ATCC 9150 / SARB42),ligB,561,PTHR47810:SF1,DNA LIGASE B,True
Q66GE4,DNA ligase B,protein,273123,Yersinia pseudotuberculosis serotype I (strain IP32953),Yersinia pseudotuberculosis serotype I (strain IP32953),ligB,567,PTHR47810:SF1,DNA LIGASE B,True
Q6DB58,DNA ligase B,protein,218491,Pectobacterium atrosepticum (strain SCRI 1043 / ATCC BAA-672),Pectobacterium atrosepticum (strain SCRI 1043 / ATCC BAA-672),ligB,563,PTHR47810:SF1,DNA LIGASE B,True
Q7CLB2,DNA ligase B,protein,632,Yersinia pestis,Yersinia pestis,ligB,567,PTHR47810:SF1,DNA LIGASE B,True
Q7N9N4,DNA ligase B,protein,243265,Photorhabdus laumondii subsp. laumondii (strain DSM 15139 / CIP 105565 / TT01),Photorhabdus laumondii subsp. laumondii (strain DSM 15139 / CIP 105565 / TT01),ligB,580,PTHR47810:SF1,DNA LIGASE B,True
Q83PM9,DNA ligase B,protein,623,Shigella flexneri,Shigella flexneri,ligB,560,PTHR47810:SF1,DNA LIGASE B,True
Q88AK8,DNA ligase B,protein,223283,Pseudomonas syringae pv. tomato (strain ATCC BAA-871 / DC3000),Pseudomonas syringae pv. tomato (strain ATCC BAA-871 / DC3000),ligB,561,PTHR47810:SF1,DNA LIGASE B,True
Q88D59,DNA ligase B,protein,160488,Pseudomonas putida (strain ATCC 47054 / DSM 6125 / CFBP 8728 / NCIMB 11950 / KT2440),Pseudomonas putida (strain ATCC 47054 / DSM 6125 / CFBP 8728 / NCIMB 11950 / KT2440),ligB,566,PTHR47810:SF1,DNA LIGASE B,True
Q8FC83,DNA ligase B,protein,199310,Escherichia coli O6:H1 (strain CFT073 / ATCC 700928 / UPEC),Escherichia coli O6:H1 (strain CFT073 / ATCC 700928 / UPEC),ligB,560,PTHR47810:SF1,DNA LIGASE B,True
Q8XD89,DNA ligase B,protein,83334,Escherichia coli O157:H7,Escherichia coli O157:H7,ligB,560,PTHR47810:SF1,DNA LIGASE B,True
Q8ZL42,DNA ligase B,protein,99287,Salmonella typhimurium (strain LT2 / SGSC1412 / ATCC 700720),Salmonella typhimurium (strain LT2 / SGSC1412 / ATCC 700720),ligB,561,PTHR47810:SF1,DNA LIGASE B,True
