id,name,entry_type,source_tax_id,source_tax_name,full_tax_name,gene,length,subfamily,subfamily_name,in_alphafold
A0A120HYZ1,Lysine--tRNA ligase cla4,protein,29917,Cladosporium cladosporioides,Cladosporium cladosporioides,cla4,594,PTHR42918:SF9,LYSINE--TRNA LIGASE,True
A0AF28,Lysine--tRNA ligase,protein,386043,Listeria welshimeri serovar 6b (strain ATCC 35897 / DSM 20650 / CCUG 15529 / CIP 8149 / NCTC 11857 / SLCC 5334 / V8),Listeria welshimeri serovar 6b (strain ATCC 35897 / DSM 20650 / CCUG 15529 / CIP 8149 / NCTC 11857 / SLCC 5334 / V8),lysS,498,PTHR42918:SF15,"LYSINE--TRNA LIGASE, CHLOROPLASTIC_MITOCHONDRIAL",True
A0K8P2,Lysine--tRNA ligase,protein,331272,Burkholderia cenocepacia (strain HI2424),Burkholderia cenocepacia (strain HI2424),lysS,508,PTHR42918:SF15,"LYSINE--TRNA LIGASE, CHLOROPLASTIC_MITOCHONDRIAL",True
A0KNK7,Lysine--tRNA ligase,protein,380703,Aeromonas hydrophila subsp. hydrophila (strain ATCC 7966 / DSM 30187 / BCRC 13018 / CCUG 14551 / JCM 1027 / KCTC 2358 / NCIMB 9240 / NCTC 8049),Aeromonas hydrophila subsp. hydrophila (strain ATCC 7966 / DSM 30187 / BCRC 13018 / CCUG 14551 / JCM 1027 / KCTC 2358 / NCIMB 9240 / NCTC 8049),lysS,511,PTHR42918:SF15,"LYSINE--TRNA LIGASE, CHLOROPLASTIC_MITOCHONDRIAL",True
A0L0F1,Lysine--tRNA ligase,protein,94122,Shewanella sp. (strain ANA-3),Shewanella sp. (strain ANA-3),lysS,500,PTHR42918:SF15,"LYSINE--TRNA LIGASE, CHLOROPLASTIC_MITOCHONDRIAL",True
A0L6F7,Lysine--tRNA ligase,protein,156889,Magnetococcus marinus (strain ATCC BAA-1437 / JCM 17883 / MC-1),Magnetococcus marinus (strain ATCC BAA-1437 / JCM 17883 / MC-1),lysS,501,PTHR42918:SF15,"LYSINE--TRNA LIGASE, CHLOROPLASTIC_MITOCHONDRIAL",True
A0M5H8,Lysine--tRNA ligase,protein,411154,Christiangramia forsetii (strain DSM 17595 / CGMCC 1.15422 / KT0803),Christiangramia forsetii (strain DSM 17595 / CGMCC 1.15422 / KT0803),lysS,569,PTHR42918:SF15,"LYSINE--TRNA LIGASE, CHLOROPLASTIC_MITOCHONDRIAL",True
A0PP57,Lysylphosphatidylglycerol biosynthesis bifunctional protein LysX,protein,362242,Mycobacterium ulcerans (strain Agy99),Mycobacterium ulcerans (strain Agy99),lysX,1105,PTHR42918:SF15,"LYSINE--TRNA LIGASE, CHLOROPLASTIC_MITOCHONDRIAL",True
A0PXN4,Lysine--tRNA ligase,protein,386415,Clostridium novyi (strain NT),Clostridium novyi (strain NT),lysS,510,PTHR42918:SF15,"LYSINE--TRNA LIGASE, CHLOROPLASTIC_MITOCHONDRIAL",True
A0QHC4,Lysylphosphatidylglycerol biosynthesis bifunctional protein LysX,protein,243243,Mycobacterium avium (strain 104),Mycobacterium avium (strain 104),lysX,1177,PTHR42918:SF15,"LYSINE--TRNA LIGASE, CHLOROPLASTIC_MITOCHONDRIAL",True
A0QYV1,Lysylphosphatidylglycerol biosynthesis bifunctional protein LysX,protein,246196,Mycolicibacterium smegmatis (strain ATCC 700084 / mc(2)155),Mycolicibacterium smegmatis (strain ATCC 700084 / mc(2)155),lysX,1106,PTHR42918:SF15,"LYSINE--TRNA LIGASE, CHLOROPLASTIC_MITOCHONDRIAL",True
A0R8E9,Lysine--tRNA ligase,protein,412694,Bacillus thuringiensis (strain Al Hakam),Bacillus thuringiensis (strain Al Hakam),lysS,499,PTHR42918:SF15,"LYSINE--TRNA LIGASE, CHLOROPLASTIC_MITOCHONDRIAL",True
A1AWN8,Lysine--tRNA ligase,protein,413404,Ruthia magnifica subsp. Calyptogena magnifica,Ruthia magnifica subsp. Calyptogena magnifica,lysS,497,PTHR42918:SF15,"LYSINE--TRNA LIGASE, CHLOROPLASTIC_MITOCHONDRIAL",True
A1JIQ4,Elongation factor P--(R)-beta-lysine ligase,protein,393305,Yersinia enterocolitica serotype O:8 / biotype 1B (strain NCTC 13174 / 8081),Yersinia enterocolitica serotype O:8 / biotype 1B (strain NCTC 13174 / 8081),epmA,325,PTHR42918:SF6,ELONGATION FACTOR P--(R)-BETA-LYSINE LIGASE,True
A1JPL4,Lysine--tRNA ligase,protein,393305,Yersinia enterocolitica serotype O:8 / biotype 1B (strain NCTC 13174 / 8081),Yersinia enterocolitica serotype O:8 / biotype 1B (strain NCTC 13174 / 8081),lysS,505,PTHR42918:SF15,"LYSINE--TRNA LIGASE, CHLOROPLASTIC_MITOCHONDRIAL",True
A1K5J9,Lysine--tRNA ligase,protein,418699,Azoarcus sp. (strain BH72),Azoarcus sp. (strain BH72),lysS,500,PTHR42918:SF15,"LYSINE--TRNA LIGASE, CHLOROPLASTIC_MITOCHONDRIAL",True
A1KJ57,Lysylphosphatidylglycerol biosynthesis bifunctional protein LysX,protein,410289,Mycobacterium bovis (strain BCG / Pasteur 1173P2),Mycobacterium bovis (strain BCG / Pasteur 1173P2),lysX,1172,PTHR42918:SF15,"LYSINE--TRNA LIGASE, CHLOROPLASTIC_MITOCHONDRIAL",True
A1KPT4,Lysine--tRNA ligase,protein,410289,Mycobacterium bovis (strain BCG / Pasteur 1173P2),Mycobacterium bovis (strain BCG / Pasteur 1173P2),lysS,505,PTHR42918:SF15,"LYSINE--TRNA LIGASE, CHLOROPLASTIC_MITOCHONDRIAL",True
A1KUN1,Lysine--tRNA ligase,protein,272831,Neisseria meningitidis serogroup C / serotype 2a (strain ATCC 700532 / DSM 15464 / FAM18),Neisseria meningitidis serogroup C / serotype 2a (strain ATCC 700532 / DSM 15464 / FAM18),lysS,503,PTHR42918:SF15,"LYSINE--TRNA LIGASE, CHLOROPLASTIC_MITOCHONDRIAL",True
A1RGF1,Lysine--tRNA ligase,protein,351745,Shewanella sp. (strain W3-18-1),Shewanella sp. (strain W3-18-1),lysS,500,PTHR42918:SF15,"LYSINE--TRNA LIGASE, CHLOROPLASTIC_MITOCHONDRIAL",True
A1S9M3,Lysine--tRNA ligase,protein,326297,Shewanella amazonensis (strain ATCC BAA-1098 / SB2B),Shewanella amazonensis (strain ATCC BAA-1098 / SB2B),lysS,500,PTHR42918:SF15,"LYSINE--TRNA LIGASE, CHLOROPLASTIC_MITOCHONDRIAL",True
A1T047,Lysine--tRNA ligase,protein,357804,Psychromonas ingrahamii (strain DSM 17664 / CCUG 51855 / 37),Psychromonas ingrahamii (strain DSM 17664 / CCUG 51855 / 37),lysS,509,PTHR42918:SF15,"LYSINE--TRNA LIGASE, CHLOROPLASTIC_MITOCHONDRIAL",True
A1TAC7,Lysylphosphatidylglycerol biosynthesis bifunctional protein LysX,protein,350058,Mycolicibacterium vanbaalenii (strain DSM 7251 / JCM 13017 / BCRC 16820 / KCTC 9966 / NRRL B-24157 / PYR-1),Mycolicibacterium vanbaalenii (strain DSM 7251 / JCM 13017 / BCRC 16820 / KCTC 9966 / NRRL B-24157 / PYR-1),lysX,1100,PTHR42918:SF15,"LYSINE--TRNA LIGASE, CHLOROPLASTIC_MITOCHONDRIAL",True
A1UHB3,Lysylphosphatidylglycerol biosynthesis bifunctional protein LysX,protein,189918,Mycobacterium sp. (strain KMS),Mycobacterium sp. (strain KMS),lysX,1112,PTHR42918:SF15,"LYSINE--TRNA LIGASE, CHLOROPLASTIC_MITOCHONDRIAL",True
A1V5L6,Lysine--tRNA ligase,protein,320388,Burkholderia mallei (strain SAVP1),Burkholderia mallei (strain SAVP1),lysS,508,PTHR42918:SF15,"LYSINE--TRNA LIGASE, CHLOROPLASTIC_MITOCHONDRIAL",True
A1VYC1,Lysine--tRNA ligase,protein,354242,Campylobacter jejuni subsp. jejuni serotype O:23/36 (strain 81-176),Campylobacter jejuni subsp. jejuni serotype O:23/36 (strain 81-176),lysS,501,PTHR42918:SF15,"LYSINE--TRNA LIGASE, CHLOROPLASTIC_MITOCHONDRIAL",True
A2BZ03,Lysine--tRNA ligase,protein,167542,Prochlorococcus marinus (strain MIT 9515),Prochlorococcus marinus (strain MIT 9515),lysS,512,PTHR42918:SF15,"LYSINE--TRNA LIGASE, CHLOROPLASTIC_MITOCHONDRIAL",True
A2C629,Lysine--tRNA ligase,protein,59922,Prochlorococcus marinus (strain MIT 9303),Prochlorococcus marinus (strain MIT 9303),lysS,508,PTHR42918:SF15,"LYSINE--TRNA LIGASE, CHLOROPLASTIC_MITOCHONDRIAL",True
A2RFR7,Lysine--tRNA ligase,protein,160491,Streptococcus pyogenes serotype M5 (strain Manfredo),Streptococcus pyogenes serotype M5 (strain Manfredo),lysS,497,PTHR42918:SF15,"LYSINE--TRNA LIGASE, CHLOROPLASTIC_MITOCHONDRIAL",True
A2RIA0,Lysine--tRNA ligase,protein,416870,Lactococcus lactis subsp. cremoris (strain MG1363),Lactococcus lactis subsp. cremoris (strain MG1363),lysS,494,PTHR42918:SF15,"LYSINE--TRNA LIGASE, CHLOROPLASTIC_MITOCHONDRIAL",True
A2SAT3,Lysine--tRNA ligase,protein,412022,Burkholderia mallei (strain NCTC 10229),Burkholderia mallei (strain NCTC 10229),lysS,508,PTHR42918:SF15,"LYSINE--TRNA LIGASE, CHLOROPLASTIC_MITOCHONDRIAL",True
A2SDC3,Lysine--tRNA ligase,protein,420662,Methylibium petroleiphilum (strain ATCC BAA-1232 / LMG 22953 / PM1),Methylibium petroleiphilum (strain ATCC BAA-1232 / LMG 22953 / PM1),lysS,508,PTHR42918:SF15,"LYSINE--TRNA LIGASE, CHLOROPLASTIC_MITOCHONDRIAL",True
A3CP17,Lysine--tRNA ligase,protein,388919,Streptococcus sanguinis (strain SK36),Streptococcus sanguinis (strain SK36),lysS,496,PTHR42918:SF15,"LYSINE--TRNA LIGASE, CHLOROPLASTIC_MITOCHONDRIAL",True
A3CY14,Lysine--tRNA ligase,protein,368407,Methanoculleus marisnigri (strain ATCC 35101 / DSM 1498 / JR1),Methanoculleus marisnigri (strain ATCC 35101 / DSM 1498 / JR1),lysS,508,PTHR42918:SF15,"LYSINE--TRNA LIGASE, CHLOROPLASTIC_MITOCHONDRIAL",True
A3D0Y5,Lysine--tRNA ligase,protein,325240,Shewanella baltica (strain OS155 / ATCC BAA-1091),Shewanella baltica (strain OS155 / ATCC BAA-1091),lysS,500,PTHR42918:SF15,"LYSINE--TRNA LIGASE, CHLOROPLASTIC_MITOCHONDRIAL",True
A3M3D6,Lysine--tRNA ligase,protein,400667,Acinetobacter baumannii (strain ATCC 17978 / DSM 105126 / CIP 53.77 / LMG 1025 / NCDC KC755 / 5377),Acinetobacter baumannii (strain ATCC 17978 / DSM 105126 / CIP 53.77 / LMG 1025 / NCDC KC755 / 5377),lysS,509,PTHR42918:SF15,"LYSINE--TRNA LIGASE, CHLOROPLASTIC_MITOCHONDRIAL",True
A3ML91,Lysine--tRNA ligase,protein,320389,Burkholderia mallei (strain NCTC 10247),Burkholderia mallei (strain NCTC 10247),lysS,508,PTHR42918:SF15,"LYSINE--TRNA LIGASE, CHLOROPLASTIC_MITOCHONDRIAL",True
A3N0G9,Lysine--tRNA ligase,protein,416269,Actinobacillus pleuropneumoniae serotype 5b (strain L20),Actinobacillus pleuropneumoniae serotype 5b (strain L20),lysS,500,PTHR42918:SF15,"LYSINE--TRNA LIGASE, CHLOROPLASTIC_MITOCHONDRIAL",True
A3NB96,Lysine--tRNA ligase,protein,320373,Burkholderia pseudomallei (strain 668),Burkholderia pseudomallei (strain 668),lysS,508,PTHR42918:SF15,"LYSINE--TRNA LIGASE, CHLOROPLASTIC_MITOCHONDRIAL",True
A3NX27,Lysine--tRNA ligase,protein,357348,Burkholderia pseudomallei (strain 1106a),Burkholderia pseudomallei (strain 1106a),lysS,508,PTHR42918:SF15,"LYSINE--TRNA LIGASE, CHLOROPLASTIC_MITOCHONDRIAL",True
A3PFA8,Lysine--tRNA ligase,protein,167546,Prochlorococcus marinus (strain MIT 9301),Prochlorococcus marinus (strain MIT 9301),lysS,512,PTHR42918:SF15,"LYSINE--TRNA LIGASE, CHLOROPLASTIC_MITOCHONDRIAL",True
A3Q0V0,Lysylphosphatidylglycerol biosynthesis bifunctional protein LysX,protein,164757,Mycobacterium sp. (strain JLS),Mycobacterium sp. (strain JLS),lysX,1111,PTHR42918:SF15,"LYSINE--TRNA LIGASE, CHLOROPLASTIC_MITOCHONDRIAL",True
A3QB36,Lysine--tRNA ligase,protein,323850,Shewanella loihica (strain ATCC BAA-1088 / PV-4),Shewanella loihica (strain ATCC BAA-1088 / PV-4),lysS,500,PTHR42918:SF15,"LYSINE--TRNA LIGASE, CHLOROPLASTIC_MITOCHONDRIAL",True
A4G778,Lysine--tRNA ligase,protein,204773,Herminiimonas arsenicoxydans,Herminiimonas arsenicoxydans,lysS,511,PTHR42918:SF15,"LYSINE--TRNA LIGASE, CHLOROPLASTIC_MITOCHONDRIAL",True
A4JFZ6,Lysine--tRNA ligase,protein,269482,Burkholderia vietnamiensis (strain G4 / LMG 22486),Burkholderia vietnamiensis (strain G4 / LMG 22486),lysS,508,PTHR42918:SF15,"LYSINE--TRNA LIGASE, CHLOROPLASTIC_MITOCHONDRIAL",True
A4SJK0,Lysine--tRNA ligase,protein,382245,Aeromonas salmonicida (strain A449),Aeromonas salmonicida (strain A449),lysS,512,PTHR42918:SF15,"LYSINE--TRNA LIGASE, CHLOROPLASTIC_MITOCHONDRIAL",True
A4SYX2,Lysine--tRNA ligase,protein,312153,Polynucleobacter asymbioticus (strain DSM 18221 / CIP 109841 / QLW-P1DMWA-1),Polynucleobacter asymbioticus (strain DSM 18221 / CIP 109841 / QLW-P1DMWA-1),lysS,514,PTHR42918:SF15,"LYSINE--TRNA LIGASE, CHLOROPLASTIC_MITOCHONDRIAL",True
A4T5M9,Lysine--tRNA ligase,protein,350054,Mycolicibacterium gilvum (strain PYR-GCK),Mycolicibacterium gilvum (strain PYR-GCK),lysS,501,PTHR42918:SF15,"LYSINE--TRNA LIGASE, CHLOROPLASTIC_MITOCHONDRIAL",True
A4T9U2,Lysylphosphatidylglycerol biosynthesis bifunctional protein LysX,protein,350054,Mycolicibacterium gilvum (strain PYR-GCK),Mycolicibacterium gilvum (strain PYR-GCK),lysX,1101,PTHR42918:SF15,"LYSINE--TRNA LIGASE, CHLOROPLASTIC_MITOCHONDRIAL",True
A4TIC5,Lysine--tRNA ligase,protein,386656,Yersinia pestis (strain Pestoides F),Yersinia pestis (strain Pestoides F),lysS,505,PTHR42918:SF15,"LYSINE--TRNA LIGASE, CHLOROPLASTIC_MITOCHONDRIAL",True
A4TRQ1,Elongation factor P--(R)-beta-lysine ligase,protein,386656,Yersinia pestis (strain Pestoides F),Yersinia pestis (strain Pestoides F),epmA,325,PTHR42918:SF6,ELONGATION FACTOR P--(R)-BETA-LYSINE LIGASE,True
A4VTP6,Lysine--tRNA ligase,protein,391295,Streptococcus suis (strain 05ZYH33),Streptococcus suis (strain 05ZYH33),lysS,496,PTHR42918:SF15,"LYSINE--TRNA LIGASE, CHLOROPLASTIC_MITOCHONDRIAL",True
A4VZY0,Lysine--tRNA ligase,protein,391296,Streptococcus suis (strain 98HAH33),Streptococcus suis (strain 98HAH33),lysS,496,PTHR42918:SF15,"LYSINE--TRNA LIGASE, CHLOROPLASTIC_MITOCHONDRIAL",True
A4W5Q2,Elongation factor P--(R)-beta-lysine ligase,protein,399742,Enterobacter sp. (strain 638),Enterobacter sp. (strain 638),epmA,325,PTHR42918:SF6,ELONGATION FACTOR P--(R)-BETA-LYSINE LIGASE,True
A4WE42,Lysine--tRNA ligase,protein,399742,Enterobacter sp. (strain 638),Enterobacter sp. (strain 638),lysS,505,PTHR42918:SF15,"LYSINE--TRNA LIGASE, CHLOROPLASTIC_MITOCHONDRIAL",True
A4XXQ6,Lysine--tRNA ligase,protein,399739,Ectopseudomonas mendocina (strain ymp),Ectopseudomonas mendocina (strain ymp),lysS,505,PTHR42918:SF15,"LYSINE--TRNA LIGASE, CHLOROPLASTIC_MITOCHONDRIAL",True
A4Y9X9,Lysine--tRNA ligase,protein,319224,Shewanella putrefaciens (strain CN-32 / ATCC BAA-453),Shewanella putrefaciens (strain CN-32 / ATCC BAA-453),lysS,500,PTHR42918:SF15,"LYSINE--TRNA LIGASE, CHLOROPLASTIC_MITOCHONDRIAL",True
A5CWL4,Lysine--tRNA ligase,protein,412965,Vesicomyosocius okutanii subsp. Calyptogena okutanii (strain HA),Vesicomyosocius okutanii subsp. Calyptogena okutanii (strain HA),lysS,496,PTHR42918:SF15,"LYSINE--TRNA LIGASE, CHLOROPLASTIC_MITOCHONDRIAL",True
A5D5Q4,Lysine--tRNA ligase,protein,370438,Pelotomaculum thermopropionicum (strain DSM 13744 / JCM 10971 / SI),Pelotomaculum thermopropionicum (strain DSM 13744 / JCM 10971 / SI),lysS,506,PTHR42918:SF15,"LYSINE--TRNA LIGASE, CHLOROPLASTIC_MITOCHONDRIAL",True
A5EY50,Lysine--tRNA ligase,protein,246195,Dichelobacter nodosus (strain VCS1703A),Dichelobacter nodosus (strain VCS1703A),lysS,498,PTHR42918:SF15,"LYSINE--TRNA LIGASE, CHLOROPLASTIC_MITOCHONDRIAL",True
A5FRN5,Lysine--tRNA ligase,protein,216389,Dehalococcoides mccartyi (strain ATCC BAA-2100 / JCM 16839 / KCTC 5957 / BAV1),Dehalococcoides mccartyi (strain ATCC BAA-2100 / JCM 16839 / KCTC 5957 / BAV1),lysS,498,PTHR42918:SF15,"LYSINE--TRNA LIGASE, CHLOROPLASTIC_MITOCHONDRIAL",True
A5GI38,Lysine--tRNA ligase,protein,32051,Synechococcus sp. (strain WH7803),Synechococcus sp. (strain WH7803),lysS,489,PTHR42918:SF15,"LYSINE--TRNA LIGASE, CHLOROPLASTIC_MITOCHONDRIAL",True
A5GQ58,Lysine--tRNA ligase,protein,316278,Synechococcus sp. (strain RCC307),Synechococcus sp. (strain RCC307),lysS,502,PTHR42918:SF15,"LYSINE--TRNA LIGASE, CHLOROPLASTIC_MITOCHONDRIAL",True
A5I7P4,Lysine--tRNA ligase,protein,441771,Clostridium botulinum (strain Hall / ATCC 3502 / NCTC 13319 / Type A),Clostridium botulinum (strain Hall / ATCC 3502 / NCTC 13319 / Type A),lysS,504,PTHR42918:SF15,"LYSINE--TRNA LIGASE, CHLOROPLASTIC_MITOCHONDRIAL",True
A5ICT2,Lysine--tRNA ligase,protein,400673,Legionella pneumophila (strain Corby),Legionella pneumophila (strain Corby),lysS,496,PTHR42918:SF15,"LYSINE--TRNA LIGASE, CHLOROPLASTIC_MITOCHONDRIAL",True
A5ILE6,Lysine--tRNA ligase,protein,390874,Thermotoga petrophila (strain ATCC BAA-488 / DSM 13995 / JCM 10881 / RKU-1),Thermotoga petrophila (strain ATCC BAA-488 / DSM 13995 / JCM 10881 / RKU-1),lysS,502,PTHR42918:SF15,"LYSINE--TRNA LIGASE, CHLOROPLASTIC_MITOCHONDRIAL",True
A5N4L1,Lysine--tRNA ligase,protein,431943,Clostridium kluyveri (strain ATCC 8527 / DSM 555 / NBRC 12016 / NCIMB 10680 / K1),Clostridium kluyveri (strain ATCC 8527 / DSM 555 / NBRC 12016 / NCIMB 10680 / K1),lysS,502,PTHR42918:SF15,"LYSINE--TRNA LIGASE, CHLOROPLASTIC_MITOCHONDRIAL",True
A5U2Z7,Lysylphosphatidylglycerol biosynthesis bifunctional protein LysX,protein,419947,Mycobacterium tuberculosis (strain ATCC 25177 / H37Ra),Mycobacterium tuberculosis (strain ATCC 25177 / H37Ra),lysX,1172,PTHR42918:SF15,"LYSINE--TRNA LIGASE, CHLOROPLASTIC_MITOCHONDRIAL",True
A5U8S4,Lysine--tRNA ligase,protein,419947,Mycobacterium tuberculosis (strain ATCC 25177 / H37Ra),Mycobacterium tuberculosis (strain ATCC 25177 / H37Ra),lysS,505,PTHR42918:SF15,"LYSINE--TRNA LIGASE, CHLOROPLASTIC_MITOCHONDRIAL",True
A5UCQ0,Lysine--tRNA ligase,protein,374930,Haemophilus influenzae (strain PittEE),Haemophilus influenzae (strain PittEE),lysS,502,PTHR42918:SF15,"LYSINE--TRNA LIGASE, CHLOROPLASTIC_MITOCHONDRIAL",True
A5UDN8,Elongation factor P--(R)-beta-lysine ligase,protein,374930,Haemophilus influenzae (strain PittEE),Haemophilus influenzae (strain PittEE),epmA,323,PTHR42918:SF6,ELONGATION FACTOR P--(R)-BETA-LYSINE LIGASE,True
A5UHY5,Elongation factor P--(R)-beta-lysine ligase,protein,374931,Haemophilus influenzae (strain PittGG),Haemophilus influenzae (strain PittGG),epmA,323,PTHR42918:SF6,ELONGATION FACTOR P--(R)-BETA-LYSINE LIGASE,True
A5UIX4,Lysine--tRNA ligase,protein,374931,Haemophilus influenzae (strain PittGG),Haemophilus influenzae (strain PittGG),lysS,502,PTHR42918:SF15,"LYSINE--TRNA LIGASE, CHLOROPLASTIC_MITOCHONDRIAL",True
A5UPG6,Lysine--tRNA ligase,protein,357808,Roseiflexus sp. (strain RS-1),Roseiflexus sp. (strain RS-1),lysS,489,PTHR42918:SF15,"LYSINE--TRNA LIGASE, CHLOROPLASTIC_MITOCHONDRIAL",True
A5W890,Lysine--tRNA ligase,protein,351746,Pseudomonas putida (strain ATCC 700007 / DSM 6899 / JCM 31910 / BCRC 17059 / LMG 24140 / F1),Pseudomonas putida (strain ATCC 700007 / DSM 6899 / JCM 31910 / BCRC 17059 / LMG 24140 / F1),lysS,500,PTHR42918:SF15,"LYSINE--TRNA LIGASE, CHLOROPLASTIC_MITOCHONDRIAL",True
A5WFG0,Lysine--tRNA ligase,protein,349106,Psychrobacter sp. (strain PRwf-1),Psychrobacter sp. (strain PRwf-1),lysS,510,PTHR42918:SF15,"LYSINE--TRNA LIGASE, CHLOROPLASTIC_MITOCHONDRIAL",True
A5WMW1,Lysylphosphatidylglycerol biosynthesis bifunctional protein LysX,protein,336982,Mycobacterium tuberculosis (strain F11),Mycobacterium tuberculosis (strain F11),lysX,1172,PTHR42918:SF15,"LYSINE--TRNA LIGASE, CHLOROPLASTIC_MITOCHONDRIAL",True
A6L7P5,Lysine--tRNA ligase,protein,435590,Phocaeicola vulgatus (strain ATCC 8482 / DSM 1447 / JCM 5826 / CCUG 4940 / NBRC 14291 / NCTC 11154),Phocaeicola vulgatus (strain ATCC 8482 / DSM 1447 / JCM 5826 / CCUG 4940 / NBRC 14291 / NCTC 11154),lysS,576,PTHR42918:SF15,"LYSINE--TRNA LIGASE, CHLOROPLASTIC_MITOCHONDRIAL",True
A6L8C6,Lysine--tRNA ligase,protein,435591,Parabacteroides distasonis (strain ATCC 8503 / DSM 20701 / CIP 104284 / JCM 5825 / NCTC 11152),Parabacteroides distasonis (strain ATCC 8503 / DSM 20701 / CIP 104284 / JCM 5825 / NCTC 11152),lysS,576,PTHR42918:SF15,"LYSINE--TRNA LIGASE, CHLOROPLASTIC_MITOCHONDRIAL",True
A6LMS4,Lysine--tRNA ligase,protein,391009,Thermosipho melanesiensis (strain DSM 12029 / CIP 104789 / BI429),Thermosipho melanesiensis (strain DSM 12029 / CIP 104789 / BI429),lysS,502,PTHR42918:SF15,"LYSINE--TRNA LIGASE, CHLOROPLASTIC_MITOCHONDRIAL",True
A6SXF3,Lysine--tRNA ligase,protein,375286,Janthinobacterium sp. (strain Marseille),Janthinobacterium sp. (strain Marseille),lysS,511,PTHR42918:SF15,"LYSINE--TRNA LIGASE, CHLOROPLASTIC_MITOCHONDRIAL",True
A6TH74,Elongation factor P--(R)-beta-lysine ligase,protein,272620,Klebsiella pneumoniae subsp. pneumoniae (strain ATCC 700721 / MGH 78578),Klebsiella pneumoniae subsp. pneumoniae (strain ATCC 700721 / MGH 78578),epmA,325,PTHR42918:SF6,ELONGATION FACTOR P--(R)-BETA-LYSINE LIGASE,True
A6UDA0,Lysine--tRNA ligase,protein,366394,Sinorhizobium medicae (strain WSM419),Sinorhizobium medicae (strain WSM419),lysS,498,PTHR42918:SF15,"LYSINE--TRNA LIGASE, CHLOROPLASTIC_MITOCHONDRIAL",True
A6V187,Lysine--tRNA ligase,protein,381754,Pseudomonas paraeruginosa (strain DSM 24068 / PA7),Pseudomonas paraeruginosa (strain DSM 24068 / PA7),lysS,501,PTHR42918:SF15,"LYSINE--TRNA LIGASE, CHLOROPLASTIC_MITOCHONDRIAL",True
A6VPH6,Lysine--tRNA ligase,protein,339671,Actinobacillus succinogenes (strain ATCC 55618 / DSM 22257 / CCUG 43843 / 130Z),Actinobacillus succinogenes (strain ATCC 55618 / DSM 22257 / CCUG 43843 / 130Z),lysS,503,PTHR42918:SF15,"LYSINE--TRNA LIGASE, CHLOROPLASTIC_MITOCHONDRIAL",True
A6VQ84,Elongation factor P--(R)-beta-lysine ligase,protein,339671,Actinobacillus succinogenes (strain ATCC 55618 / DSM 22257 / CCUG 43843 / 130Z),Actinobacillus succinogenes (strain ATCC 55618 / DSM 22257 / CCUG 43843 / 130Z),epmA,323,PTHR42918:SF6,ELONGATION FACTOR P--(R)-BETA-LYSINE LIGASE,True
A6W5H6,Lysine--tRNA ligase,protein,266940,Kineococcus radiotolerans (strain ATCC BAA-149 / DSM 14245 / SRS30216),Kineococcus radiotolerans (strain ATCC BAA-149 / DSM 14245 / SRS30216),lysS,500,PTHR42918:SF15,"LYSINE--TRNA LIGASE, CHLOROPLASTIC_MITOCHONDRIAL",True
A6WS29,Lysine--tRNA ligase,protein,402882,Shewanella baltica (strain OS185),Shewanella baltica (strain OS185),lysS,500,PTHR42918:SF15,"LYSINE--TRNA LIGASE, CHLOROPLASTIC_MITOCHONDRIAL",True
A7FF39,Lysine--tRNA ligase,protein,349747,Yersinia pseudotuberculosis serotype O:1b (strain IP 31758),Yersinia pseudotuberculosis serotype O:1b (strain IP 31758),lysS,505,PTHR42918:SF15,"LYSINE--TRNA LIGASE, CHLOROPLASTIC_MITOCHONDRIAL",True
A7FMZ1,Elongation factor P--(R)-beta-lysine ligase,protein,349747,Yersinia pseudotuberculosis serotype O:1b (strain IP 31758),Yersinia pseudotuberculosis serotype O:1b (strain IP 31758),epmA,325,PTHR42918:SF6,ELONGATION FACTOR P--(R)-BETA-LYSINE LIGASE,True
A7FZA5,Lysine--tRNA ligase,protein,441770,Clostridium botulinum (strain ATCC 19397 / Type A),Clostridium botulinum (strain ATCC 19397 / Type A),lysS,504,PTHR42918:SF15,"LYSINE--TRNA LIGASE, CHLOROPLASTIC_MITOCHONDRIAL",True
A7GJB3,Lysine--tRNA ligase,protein,441772,Clostridium botulinum (strain Langeland / NCTC 10281 / Type F),Clostridium botulinum (strain Langeland / NCTC 10281 / Type F),lysS,504,PTHR42918:SF15,"LYSINE--TRNA LIGASE, CHLOROPLASTIC_MITOCHONDRIAL",True
A7GJY9,Lysine--tRNA ligase,protein,315749,Bacillus cytotoxicus (strain DSM 22905 / CIP 110041 / 391-98 / NVH 391-98),Bacillus cytotoxicus (strain DSM 22905 / CIP 110041 / 391-98 / NVH 391-98),lysS,499,PTHR42918:SF15,"LYSINE--TRNA LIGASE, CHLOROPLASTIC_MITOCHONDRIAL",True
A7H4X7,Lysine--tRNA ligase,protein,360109,Campylobacter jejuni subsp. doylei (strain ATCC BAA-1458 / RM4099 / 269.97),Campylobacter jejuni subsp. doylei (strain ATCC BAA-1458 / RM4099 / 269.97),lysS,501,PTHR42918:SF15,"LYSINE--TRNA LIGASE, CHLOROPLASTIC_MITOCHONDRIAL",True
A7HM68,Lysine--tRNA ligase,protein,381764,Fervidobacterium nodosum (strain ATCC 35602 / DSM 5306 / Rt17-B1),Fervidobacterium nodosum (strain ATCC 35602 / DSM 5306 / Rt17-B1),lysS,509,PTHR42918:SF15,"LYSINE--TRNA LIGASE, CHLOROPLASTIC_MITOCHONDRIAL",True
A7I3S8,Lysine--tRNA ligase,protein,360107,Campylobacter hominis (strain ATCC BAA-381 / DSM 21671 / CCUG 45161 / LMG 19568 / NCTC 13146 / CH001A),Campylobacter hominis (strain ATCC BAA-381 / DSM 21671 / CCUG 45161 / LMG 19568 / NCTC 13146 / CH001A),lysS,499,PTHR42918:SF15,"LYSINE--TRNA LIGASE, CHLOROPLASTIC_MITOCHONDRIAL",True
A7MR65,Lysine--tRNA ligase,protein,290339,Cronobacter sakazakii (strain ATCC BAA-894),Cronobacter sakazakii (strain ATCC BAA-894),lysS,505,PTHR42918:SF15,"LYSINE--TRNA LIGASE, CHLOROPLASTIC_MITOCHONDRIAL",True
A7MX66,Elongation factor P--(R)-beta-lysine ligase,protein,2902295,Vibrio campbellii (strain ATCC BAA-1116),Vibrio campbellii (strain ATCC BAA-1116),epmA,323,PTHR42918:SF6,ELONGATION FACTOR P--(R)-BETA-LYSINE LIGASE,True
A7MXL2,Lysine--tRNA ligase,protein,2902295,Vibrio campbellii (strain ATCC BAA-1116),Vibrio campbellii (strain ATCC BAA-1116),lysS,510,PTHR42918:SF15,"LYSINE--TRNA LIGASE, CHLOROPLASTIC_MITOCHONDRIAL",True
A7NFC6,Lysine--tRNA ligase,protein,383372,Roseiflexus castenholzii (strain DSM 13941 / HLO8),Roseiflexus castenholzii (strain DSM 13941 / HLO8),lysS,489,PTHR42918:SF15,"LYSINE--TRNA LIGASE, CHLOROPLASTIC_MITOCHONDRIAL",True
A7WYS8,Lysine--tRNA ligase,protein,418127,Staphylococcus aureus (strain Mu3 / ATCC 700698),Staphylococcus aureus (strain Mu3 / ATCC 700698),lysS,495,PTHR42918:SF15,"LYSINE--TRNA LIGASE, CHLOROPLASTIC_MITOCHONDRIAL",True
A7ZV28,Elongation factor P--(R)-beta-lysine ligase,protein,331111,Escherichia coli O139:H28 (strain E24377A / ETEC),Escherichia coli O139:H28 (strain E24377A / ETEC),epmA,325,PTHR42918:SF6,ELONGATION FACTOR P--(R)-BETA-LYSINE LIGASE,True
A8A7Q4,Elongation factor P--(R)-beta-lysine ligase,protein,331112,Escherichia coli O9:H4 (strain HS),Escherichia coli O9:H4 (strain HS),epmA,325,PTHR42918:SF6,ELONGATION FACTOR P--(R)-BETA-LYSINE LIGASE,True
A8AMP1,Elongation factor P--(R)-beta-lysine ligase,protein,290338,Citrobacter koseri (strain ATCC BAA-895 / CDC 4225-83 / SGSC4696),Citrobacter koseri (strain ATCC BAA-895 / CDC 4225-83 / SGSC4696),epmA,325,PTHR42918:SF6,ELONGATION FACTOR P--(R)-BETA-LYSINE LIGASE,True
A8AP96,Lysine--tRNA ligase,protein,290338,Citrobacter koseri (strain ATCC BAA-895 / CDC 4225-83 / SGSC4696),Citrobacter koseri (strain ATCC BAA-895 / CDC 4225-83 / SGSC4696),lysS,505,PTHR42918:SF15,"LYSINE--TRNA LIGASE, CHLOROPLASTIC_MITOCHONDRIAL",True
A8AW92,Lysine--tRNA ligase,protein,467705,Streptococcus gordonii (strain Challis / ATCC 35105 / BCRC 15272 / CH1 / DL1 / V288),Streptococcus gordonii (strain Challis / ATCC 35105 / BCRC 15272 / CH1 / DL1 / V288),lysS,496,PTHR42918:SF15,"LYSINE--TRNA LIGASE, CHLOROPLASTIC_MITOCHONDRIAL",True
A8ESJ5,Lysine--tRNA ligase,protein,367737,Aliarcobacter butzleri (strain RM4018),Aliarcobacter butzleri (strain RM4018),lysS,504,PTHR42918:SF15,"LYSINE--TRNA LIGASE, CHLOROPLASTIC_MITOCHONDRIAL",True
A8F4K1,Lysine--tRNA ligase,protein,416591,Pseudothermotoga lettingae (strain ATCC BAA-301 / DSM 14385 / NBRC 107922 / TMO),Pseudothermotoga lettingae (strain ATCC BAA-301 / DSM 14385 / NBRC 107922 / TMO),lysS,498,PTHR42918:SF15,"LYSINE--TRNA LIGASE, CHLOROPLASTIC_MITOCHONDRIAL",True
