id,name,entry_type,source_tax_id,source_tax_name,full_tax_name,gene,length,subfamily,subfamily_name,in_alphafold
B7ID87,Lysine--tRNA ligase,protein,484019,Thermosipho africanus (strain TCF52B),Thermosipho africanus (strain TCF52B),lysS,502,PTHR42918:SF15,"LYSINE--TRNA LIGASE, CHLOROPLASTIC_MITOCHONDRIAL",True
B7ISY7,Lysine--tRNA ligase,protein,405531,Bacillus cereus (strain G9842),Bacillus cereus (strain G9842),lysS,499,PTHR42918:SF15,"LYSINE--TRNA LIGASE, CHLOROPLASTIC_MITOCHONDRIAL",True
B7JK84,Lysine--tRNA ligase,protein,405535,Bacillus cereus (strain AH820),Bacillus cereus (strain AH820),lysS,499,PTHR42918:SF15,"LYSINE--TRNA LIGASE, CHLOROPLASTIC_MITOCHONDRIAL",True
B7LC16,Elongation factor P--(R)-beta-lysine ligase,protein,585055,Escherichia coli (strain 55989 / EAEC),Escherichia coli (strain 55989 / EAEC),epmA,325,PTHR42918:SF6,ELONGATION FACTOR P--(R)-BETA-LYSINE LIGASE,True
B7LLT9,Elongation factor P--(R)-beta-lysine ligase,protein,585054,Escherichia fergusonii (strain ATCC 35469 / DSM 13698 / CCUG 18766 / IAM 14443 / JCM 21226 / LMG 7866 / NBRC 102419 / NCTC 12128 / CDC 0568-73),Escherichia fergusonii (strain ATCC 35469 / DSM 13698 / CCUG 18766 / IAM 14443 / JCM 21226 / LMG 7866 / NBRC 102419 / NCTC 12128 / CDC 0568-73),epmA,325,PTHR42918:SF6,ELONGATION FACTOR P--(R)-BETA-LYSINE LIGASE,True
B7M8S0,Elongation factor P--(R)-beta-lysine ligase,protein,585034,Escherichia coli O8 (strain IAI1),Escherichia coli O8 (strain IAI1),epmA,325,PTHR42918:SF6,ELONGATION FACTOR P--(R)-BETA-LYSINE LIGASE,True
B7MKW2,Elongation factor P--(R)-beta-lysine ligase,protein,585035,Escherichia coli O45:K1 (strain S88 / ExPEC),Escherichia coli O45:K1 (strain S88 / ExPEC),epmA,325,PTHR42918:SF6,ELONGATION FACTOR P--(R)-BETA-LYSINE LIGASE,True
B7MSX2,Elongation factor P--(R)-beta-lysine ligase,protein,585397,Escherichia coli O81 (strain ED1a),Escherichia coli O81 (strain ED1a),epmA,325,PTHR42918:SF6,ELONGATION FACTOR P--(R)-BETA-LYSINE LIGASE,True
B7NG94,Elongation factor P--(R)-beta-lysine ligase,protein,585056,Escherichia coli O17:K52:H18 (strain UMN026 / ExPEC),Escherichia coli O17:K52:H18 (strain UMN026 / ExPEC),epmA,325,PTHR42918:SF6,ELONGATION FACTOR P--(R)-BETA-LYSINE LIGASE,True
B7NTL6,Elongation factor P--(R)-beta-lysine ligase,protein,585057,Escherichia coli O7:K1 (strain IAI39 / ExPEC),Escherichia coli O7:K1 (strain IAI39 / ExPEC),epmA,325,PTHR42918:SF6,ELONGATION FACTOR P--(R)-BETA-LYSINE LIGASE,True
B7UPX7,Elongation factor P--(R)-beta-lysine ligase,protein,574521,Escherichia coli O127:H6 (strain E2348/69 / EPEC),Escherichia coli O127:H6 (strain E2348/69 / EPEC),epmA,325,PTHR42918:SF6,ELONGATION FACTOR P--(R)-BETA-LYSINE LIGASE,True
B7V0Z5,Lysine--tRNA ligase,protein,557722,Pseudomonas aeruginosa (strain LESB58),Pseudomonas aeruginosa (strain LESB58),lysS,501,PTHR42918:SF15,"LYSINE--TRNA LIGASE, CHLOROPLASTIC_MITOCHONDRIAL",True
B7VHR8,Elongation factor P--(R)-beta-lysine ligase,protein,575788,Vibrio atlanticus (strain LGP32),Vibrio atlanticus (strain LGP32),epmA,323,PTHR42918:SF6,ELONGATION FACTOR P--(R)-BETA-LYSINE LIGASE,True
B8CU98,Lysine--tRNA ligase,protein,225849,Shewanella piezotolerans (strain WP3 / JCM 13877),Shewanella piezotolerans (strain WP3 / JCM 13877),lysS,500,PTHR42918:SF15,"LYSINE--TRNA LIGASE, CHLOROPLASTIC_MITOCHONDRIAL",True
B8D8A2,Elongation factor P--(R)-beta-lysine ligase,protein,561501,Buchnera aphidicola subsp. Acyrthosiphon pisum (strain Tuc7),Buchnera aphidicola subsp. Acyrthosiphon pisum (strain Tuc7),epmA,324,PTHR42918:SF6,ELONGATION FACTOR P--(R)-BETA-LYSINE LIGASE,True
B8D8E5,Elongation factor P--(R)-beta-lysine ligase,protein,563178,Buchnera aphidicola subsp. Acyrthosiphon pisum (strain 5A),Buchnera aphidicola subsp. Acyrthosiphon pisum (strain 5A),epmA,324,PTHR42918:SF6,ELONGATION FACTOR P--(R)-BETA-LYSINE LIGASE,True
B8GRJ2,Lysine--tRNA ligase,protein,396588,Thioalkalivibrio sulfidiphilus (strain HL-EbGR7),Thioalkalivibrio sulfidiphilus (strain HL-EbGR7),lysS,499,PTHR42918:SF15,"LYSINE--TRNA LIGASE, CHLOROPLASTIC_MITOCHONDRIAL",True
B8JFW2,Lysine--tRNA ligase,protein,455488,Anaeromyxobacter dehalogenans (strain ATCC BAA-258 / DSM 21875 / 2CP-1),Anaeromyxobacter dehalogenans (strain ATCC BAA-258 / DSM 21875 / 2CP-1),lysS,513,PTHR42918:SF15,"LYSINE--TRNA LIGASE, CHLOROPLASTIC_MITOCHONDRIAL",True
B8ZRJ4,Lysylphosphatidylglycerol biosynthesis bifunctional protein LysX,protein,561304,Mycobacterium leprae (strain Br4923),Mycobacterium leprae (strain Br4923),lysX,1133,PTHR42918:SF15,"LYSINE--TRNA LIGASE, CHLOROPLASTIC_MITOCHONDRIAL",True
C0PY12,Lysine--tRNA ligase,protein,476213,Salmonella paratyphi C (strain RKS4594),Salmonella paratyphi C (strain RKS4594),lysS,505,PTHR42918:SF15,"LYSINE--TRNA LIGASE, CHLOROPLASTIC_MITOCHONDRIAL",True
C0Q6B6,Elongation factor P--(R)-beta-lysine ligase,protein,476213,Salmonella paratyphi C (strain RKS4594),Salmonella paratyphi C (strain RKS4594),epmA,325,PTHR42918:SF6,ELONGATION FACTOR P--(R)-BETA-LYSINE LIGASE,True
C0ZL89,Lysylphosphatidylglycerol biosynthesis bifunctional protein LysX,protein,234621,Rhodococcus erythropolis (strain PR4 / NBRC 100887),Rhodococcus erythropolis (strain PR4 / NBRC 100887),lysX,1104,PTHR42918:SF15,"LYSINE--TRNA LIGASE, CHLOROPLASTIC_MITOCHONDRIAL",True
C1AI57,Lysine--tRNA ligase,protein,561275,Mycobacterium bovis (strain BCG / Tokyo 172 / ATCC 35737 / TMC 1019),Mycobacterium bovis (strain BCG / Tokyo 172 / ATCC 35737 / TMC 1019),lysS,505,PTHR42918:SF15,"LYSINE--TRNA LIGASE, CHLOROPLASTIC_MITOCHONDRIAL",True
C1ANR3,Lysylphosphatidylglycerol biosynthesis bifunctional protein LysX,protein,561275,Mycobacterium bovis (strain BCG / Tokyo 172 / ATCC 35737 / TMC 1019),Mycobacterium bovis (strain BCG / Tokyo 172 / ATCC 35737 / TMC 1019),lysX,1172,PTHR42918:SF15,"LYSINE--TRNA LIGASE, CHLOROPLASTIC_MITOCHONDRIAL",True
C1B7Z5,Lysylphosphatidylglycerol biosynthesis bifunctional protein LysX,protein,632772,Rhodococcus opacus (strain B4),Rhodococcus opacus (strain B4),lysX,1114,PTHR42918:SF15,"LYSINE--TRNA LIGASE, CHLOROPLASTIC_MITOCHONDRIAL",True
C1DB68,Lysine--tRNA ligase,protein,557598,Laribacter hongkongensis (strain HLHK9),Laribacter hongkongensis (strain HLHK9),lysS,503,PTHR42918:SF15,"LYSINE--TRNA LIGASE, CHLOROPLASTIC_MITOCHONDRIAL",True
C4K3U1,Elongation factor P--(R)-beta-lysine ligase,protein,572265,Hamiltonella defensa subsp. Acyrthosiphon pisum (strain 5AT),Hamiltonella defensa subsp. Acyrthosiphon pisum (strain 5AT),epmA,325,PTHR42918:SF6,ELONGATION FACTOR P--(R)-BETA-LYSINE LIGASE,True
C4LCP0,Lysine--tRNA ligase,protein,595494,Tolumonas auensis (strain DSM 9187 / NBRC 110442 / TA 4),Tolumonas auensis (strain DSM 9187 / NBRC 110442 / TA 4),lysS,513,PTHR42918:SF15,"LYSINE--TRNA LIGASE, CHLOROPLASTIC_MITOCHONDRIAL",True
C4V8R9,"Probable lysine--tRNA ligase, cytoplasmic",protein,578460,Vairimorpha ceranae (strain BRL01),Vairimorpha ceranae (strain BRL01) (Microsporidian parasite),NCER_100909,514,PTHR42918:SF9,LYSINE--TRNA LIGASE,True
C5A1E9,Elongation factor P--(R)-beta-lysine ligase,protein,595496,Escherichia coli (strain K12 / MC4100 / BW2952),Escherichia coli (strain K12 / MC4100 / BW2952),epmA,325,PTHR42918:SF6,ELONGATION FACTOR P--(R)-BETA-LYSINE LIGASE,True
C5BAR6,Lysine--tRNA ligase,protein,634503,Edwardsiella ictaluri (strain 93-146),Edwardsiella ictaluri (strain 93-146),lysS,505,PTHR42918:SF15,"LYSINE--TRNA LIGASE, CHLOROPLASTIC_MITOCHONDRIAL",True
C5BDL9,Elongation factor P--(R)-beta-lysine ligase,protein,634503,Edwardsiella ictaluri (strain 93-146),Edwardsiella ictaluri (strain 93-146),epmA,325,PTHR42918:SF6,ELONGATION FACTOR P--(R)-BETA-LYSINE LIGASE,True
C5BRM0,Lysine--tRNA ligase,protein,377629,Teredinibacter turnerae (strain ATCC 39867 / T7901),Teredinibacter turnerae (strain ATCC 39867 / T7901),lysS,498,PTHR42918:SF15,"LYSINE--TRNA LIGASE, CHLOROPLASTIC_MITOCHONDRIAL",True
C5CSG3,Lysine--tRNA ligase,protein,543728,Variovorax paradoxus (strain S110),Variovorax paradoxus (strain S110),lysS,520,PTHR42918:SF15,"LYSINE--TRNA LIGASE, CHLOROPLASTIC_MITOCHONDRIAL",True
C6D8Z6,Lysine--tRNA ligase,protein,561230,Pectobacterium carotovorum subsp. carotovorum (strain PC1),Pectobacterium carotovorum subsp. carotovorum (strain PC1),lysS,505,PTHR42918:SF15,"LYSINE--TRNA LIGASE, CHLOROPLASTIC_MITOCHONDRIAL",True
C6DFN3,Elongation factor P--(R)-beta-lysine ligase,protein,561230,Pectobacterium carotovorum subsp. carotovorum (strain PC1),Pectobacterium carotovorum subsp. carotovorum (strain PC1),epmA,325,PTHR42918:SF6,ELONGATION FACTOR P--(R)-BETA-LYSINE LIGASE,True
C6DS31,Lysylphosphatidylglycerol biosynthesis bifunctional protein LysX,protein,478434,Mycobacterium tuberculosis (strain KZN 1435 / MDR),Mycobacterium tuberculosis (strain KZN 1435 / MDR),lysX,1174,PTHR42918:SF15,"LYSINE--TRNA LIGASE, CHLOROPLASTIC_MITOCHONDRIAL",True
D0LB45,Lysylphosphatidylglycerol biosynthesis bifunctional protein LysX,protein,526226,Gordonia bronchialis (strain ATCC 25592 / DSM 43247 / BCRC 13721 / JCM 3198 / KCTC 3076 / NBRC 16047 / NCTC 10667),Gordonia bronchialis (strain ATCC 25592 / DSM 43247 / BCRC 13721 / JCM 3198 / KCTC 3076 / NBRC 16047 / NCTC 10667),lysX,1138,PTHR42918:SF15,"LYSINE--TRNA LIGASE, CHLOROPLASTIC_MITOCHONDRIAL",True
O66963,Elongation factor P--(R)-beta-lysine ligase homolog,protein,224324,Aquifex aeolicus (strain VF5),Aquifex aeolicus (strain VF5),genX,293,PTHR42918:SF6,ELONGATION FACTOR P--(R)-BETA-LYSINE LIGASE,True
O67258,Lysine--tRNA ligase,protein,224324,Aquifex aeolicus (strain VF5),Aquifex aeolicus (strain VF5),lysS,597,PTHR42918:SF15,"LYSINE--TRNA LIGASE, CHLOROPLASTIC_MITOCHONDRIAL",True
O74858,"Lysine--tRNA ligase, mitochondrial",protein,284812,Schizosaccharomyces pombe (strain 972 / ATCC 24843),Schizosaccharomyces pombe (strain 972 / ATCC 24843) (Fission yeast),msk1,531,PTHR42918:SF5,"LYSINE--TRNA LIGASE, MITOCHONDRIAL",True
O84786,Lysine--tRNA ligase,protein,272561,Chlamydia trachomatis serovar D (strain ATCC VR-885 / DSM 19411 / UW-3/Cx),Chlamydia trachomatis serovar D (strain ATCC VR-885 / DSM 19411 / UW-3/Cx),lysS,526,PTHR42918:SF15,"LYSINE--TRNA LIGASE, CHLOROPLASTIC_MITOCHONDRIAL",True
O87821,Lysine--tRNA ligase,protein,266834,Rhizobium meliloti (strain 1021),Rhizobium meliloti (strain 1021) (Ensifer meliloti),lysS,498,PTHR42918:SF15,"LYSINE--TRNA LIGASE, CHLOROPLASTIC_MITOCHONDRIAL",True
P0A8N3,Lysine--tRNA ligase,protein,83333,Escherichia coli (strain K12),Escherichia coli (strain K12),lysS,505,PTHR42918:SF15,"LYSINE--TRNA LIGASE, CHLOROPLASTIC_MITOCHONDRIAL",True
P0A8N4,Lysine--tRNA ligase,protein,199310,Escherichia coli O6:H1 (strain CFT073 / ATCC 700928 / UPEC),Escherichia coli O6:H1 (strain CFT073 / ATCC 700928 / UPEC),lysS,505,PTHR42918:SF15,"LYSINE--TRNA LIGASE, CHLOROPLASTIC_MITOCHONDRIAL",True
P0A8N5,"Lysine--tRNA ligase, heat inducible",protein,83333,Escherichia coli (strain K12),Escherichia coli (strain K12),lysU,505,PTHR42918:SF15,"LYSINE--TRNA LIGASE, CHLOROPLASTIC_MITOCHONDRIAL",True
P0A8N6,"Lysine--tRNA ligase, heat inducible",protein,83334,Escherichia coli O157:H7,Escherichia coli O157:H7,lysU,505,PTHR42918:SF15,"LYSINE--TRNA LIGASE, CHLOROPLASTIC_MITOCHONDRIAL",True
P0A8N7,Elongation factor P--(R)-beta-lysine ligase,protein,83333,Escherichia coli (strain K12),Escherichia coli (strain K12),epmA,325,PTHR42918:SF6,ELONGATION FACTOR P--(R)-BETA-LYSINE LIGASE,True
P0A8N8,Elongation factor P--(R)-beta-lysine ligase,protein,199310,Escherichia coli O6:H1 (strain CFT073 / ATCC 700928 / UPEC),Escherichia coli O6:H1 (strain CFT073 / ATCC 700928 / UPEC),epmA,325,PTHR42918:SF6,ELONGATION FACTOR P--(R)-BETA-LYSINE LIGASE,True
P0A8N9,Elongation factor P--(R)-beta-lysine ligase,protein,83334,Escherichia coli O157:H7,Escherichia coli O157:H7,epmA,325,PTHR42918:SF6,ELONGATION FACTOR P--(R)-BETA-LYSINE LIGASE,True
P0A8P0,Elongation factor P--(R)-beta-lysine ligase,protein,623,Shigella flexneri,Shigella flexneri,epmA,325,PTHR42918:SF6,ELONGATION FACTOR P--(R)-BETA-LYSINE LIGASE,True
P0DG46,Lysine--tRNA ligase,protein,198466,Streptococcus pyogenes serotype M3 (strain ATCC BAA-595 / MGAS315),Streptococcus pyogenes serotype M3 (strain ATCC BAA-595 / MGAS315),lysS,497,PTHR42918:SF15,"LYSINE--TRNA LIGASE, CHLOROPLASTIC_MITOCHONDRIAL",True
P0DG47,Lysine--tRNA ligase,protein,193567,Streptococcus pyogenes serotype M3 (strain SSI-1),Streptococcus pyogenes serotype M3 (strain SSI-1),lysS,497,PTHR42918:SF15,"LYSINE--TRNA LIGASE, CHLOROPLASTIC_MITOCHONDRIAL",True
P15180,"Lysine--tRNA ligase, cytoplasmic",protein,559292,Saccharomyces cerevisiae (strain ATCC 204508 / S288c),Saccharomyces cerevisiae (strain ATCC 204508 / S288c) (Baker's yeast),KRS1,591,PTHR42918:SF9,LYSINE--TRNA LIGASE,True
P28354,Lysine--tRNA ligase,protein,99287,Salmonella typhimurium (strain LT2 / SGSC1412 / ATCC 700720),Salmonella typhimurium (strain LT2 / SGSC1412 / ATCC 700720),lysS,505,PTHR42918:SF15,"LYSINE--TRNA LIGASE, CHLOROPLASTIC_MITOCHONDRIAL",True
P32048,"Lysine--tRNA ligase, mitochondrial",protein,559292,Saccharomyces cerevisiae (strain ATCC 204508 / S288c),Saccharomyces cerevisiae (strain ATCC 204508 / S288c) (Baker's yeast),MSK1,576,PTHR42918:SF5,"LYSINE--TRNA LIGASE, MITOCHONDRIAL",True
P37477,Lysine--tRNA ligase,protein,224308,Bacillus subtilis (strain 168),Bacillus subtilis (strain 168),lysS,499,PTHR42918:SF15,"LYSINE--TRNA LIGASE, CHLOROPLASTIC_MITOCHONDRIAL",True
P37879,Lysine--tRNA ligase,protein,10029,Cricetulus griseus,Cricetulus griseus (Chinese hamster),KARS1,597,PTHR42918:SF9,LYSINE--TRNA LIGASE,True
P41255,Lysine--tRNA ligase,protein,274,Thermus thermophilus,Thermus thermophilus,lysS,492,PTHR42918:SF15,"LYSINE--TRNA LIGASE, CHLOROPLASTIC_MITOCHONDRIAL",True
P41258,Lysine--tRNA ligase,protein,192222,Campylobacter jejuni subsp. jejuni serotype O:2 (strain ATCC 700819 / NCTC 11168),Campylobacter jejuni subsp. jejuni serotype O:2 (strain ATCC 700819 / NCTC 11168),lysS,501,PTHR42918:SF15,"LYSINE--TRNA LIGASE, CHLOROPLASTIC_MITOCHONDRIAL",True
P43151,Putative guanine nucleotide-binding protein subunit alpha,protein,5661,Leishmania donovani,Leishmania donovani,,464,PTHR42918:SF9,LYSINE--TRNA LIGASE,True
P43825,Lysine--tRNA ligase,protein,71421,Haemophilus influenzae (strain ATCC 51907 / DSM 11121 / KW20 / Rd),Haemophilus influenzae (strain ATCC 51907 / DSM 11121 / KW20 / Rd),lysS,502,PTHR42918:SF15,"LYSINE--TRNA LIGASE, CHLOROPLASTIC_MITOCHONDRIAL",True
P43826,Elongation factor P--(R)-beta-lysine ligase,protein,71421,Haemophilus influenzae (strain ATCC 51907 / DSM 11121 / KW20 / Rd),Haemophilus influenzae (strain ATCC 51907 / DSM 11121 / KW20 / Rd),epmA,323,PTHR42918:SF6,ELONGATION FACTOR P--(R)-BETA-LYSINE LIGASE,True
P46191,Lysine--tRNA ligase,protein,347256,Metamycoplasma hominis (strain ATCC 23114 / DSM 25592 / NBRC 14850 / NCTC 10111 / PG21),Metamycoplasma hominis (strain ATCC 23114 / DSM 25592 / NBRC 14850 / NCTC 10111 / PG21),lysS,488,PTHR42918:SF15,"LYSINE--TRNA LIGASE, CHLOROPLASTIC_MITOCHONDRIAL",True
P46861,Lysine--tRNA ligase,protein,272631,Mycobacterium leprae (strain TN),Mycobacterium leprae (strain TN),lysS,507,PTHR42918:SF15,"LYSINE--TRNA LIGASE, CHLOROPLASTIC_MITOCHONDRIAL",True
P47382,Lysine--tRNA ligase,protein,243273,Mycoplasmoides genitalium (strain ATCC 33530 / DSM 19775 / NCTC 10195 / G37),Mycoplasmoides genitalium (strain ATCC 33530 / DSM 19775 / NCTC 10195 / G37),lysS,490,PTHR42918:SF15,"LYSINE--TRNA LIGASE, CHLOROPLASTIC_MITOCHONDRIAL",True
P56126,Lysine--tRNA ligase,protein,85962,Helicobacter pylori (strain ATCC 700392 / 26695),Helicobacter pylori (strain ATCC 700392 / 26695),lysS,501,PTHR42918:SF15,"LYSINE--TRNA LIGASE, CHLOROPLASTIC_MITOCHONDRIAL",True
P57512,Lysine--tRNA ligase,protein,107806,Buchnera aphidicola subsp. Acyrthosiphon pisum (strain APS),Buchnera aphidicola subsp. Acyrthosiphon pisum (strain APS),lysS,506,PTHR42918:SF15,"LYSINE--TRNA LIGASE, CHLOROPLASTIC_MITOCHONDRIAL",True
P57642,Elongation factor P--(R)-beta-lysine ligase,protein,107806,Buchnera aphidicola subsp. Acyrthosiphon pisum (strain APS),Buchnera aphidicola subsp. Acyrthosiphon pisum (strain APS),epmA,324,PTHR42918:SF6,ELONGATION FACTOR P--(R)-BETA-LYSINE LIGASE,True
P57822,Lysine--tRNA ligase,protein,272843,Pasteurella multocida (strain Pm70),Pasteurella multocida (strain Pm70),lysS,501,PTHR42918:SF15,"LYSINE--TRNA LIGASE, CHLOROPLASTIC_MITOCHONDRIAL",True
P57824,Elongation factor P--(R)-beta-lysine ligase,protein,272843,Pasteurella multocida (strain Pm70),Pasteurella multocida (strain Pm70),epmA,323,PTHR42918:SF6,ELONGATION FACTOR P--(R)-BETA-LYSINE LIGASE,True
P67608,Lysine--tRNA ligase 1,protein,233413,Mycobacterium bovis (strain ATCC BAA-935 / AF2122/97),Mycobacterium bovis (strain ATCC BAA-935 / AF2122/97),lysS1,505,PTHR42918:SF15,"LYSINE--TRNA LIGASE, CHLOROPLASTIC_MITOCHONDRIAL",True
P67609,Lysine--tRNA ligase,protein,158878,Staphylococcus aureus (strain Mu50 / ATCC 700699),Staphylococcus aureus (strain Mu50 / ATCC 700699),lysS,495,PTHR42918:SF15,"LYSINE--TRNA LIGASE, CHLOROPLASTIC_MITOCHONDRIAL",True
P67610,Lysine--tRNA ligase,protein,158879,Staphylococcus aureus (strain N315),Staphylococcus aureus (strain N315),lysS,495,PTHR42918:SF15,"LYSINE--TRNA LIGASE, CHLOROPLASTIC_MITOCHONDRIAL",True
P73443,Lysine--tRNA ligase,protein,1111708,Synechocystis sp. (strain ATCC 27184 / PCC 6803 / Kazusa),Synechocystis sp. (strain ATCC 27184 / PCC 6803 / Kazusa),lysS,510,PTHR42918:SF15,"LYSINE--TRNA LIGASE, CHLOROPLASTIC_MITOCHONDRIAL",True
P75500,Lysine--tRNA ligase,protein,272634,Mycoplasmoides pneumoniae (strain ATCC 29342 / M129 / Subtype 1),Mycoplasmoides pneumoniae (strain ATCC 29342 / M129 / Subtype 1),lysS,489,PTHR42918:SF15,"LYSINE--TRNA LIGASE, CHLOROPLASTIC_MITOCHONDRIAL",True
P95970,Lysine--tRNA ligase,protein,273057,Saccharolobus solfataricus (strain ATCC 35092 / DSM 1617 / JCM 11322 / P2),Saccharolobus solfataricus (strain ATCC 35092 / DSM 1617 / JCM 11322 / P2),lysS,494,PTHR42918:SF15,"LYSINE--TRNA LIGASE, CHLOROPLASTIC_MITOCHONDRIAL",True
P9WFU6,Lysylphosphatidylglycerol biosynthesis bifunctional protein LysX,protein,83331,Mycobacterium tuberculosis (strain CDC 1551 / Oshkosh),Mycobacterium tuberculosis (strain CDC 1551 / Oshkosh),lysX,1172,PTHR42918:SF15,"LYSINE--TRNA LIGASE, CHLOROPLASTIC_MITOCHONDRIAL",True
P9WFU7,Lysylphosphatidylglycerol biosynthesis bifunctional protein LysX,protein,83332,Mycobacterium tuberculosis (strain ATCC 25618 / H37Rv),Mycobacterium tuberculosis (strain ATCC 25618 / H37Rv),lysX,1172,PTHR42918:SF15,"LYSINE--TRNA LIGASE, CHLOROPLASTIC_MITOCHONDRIAL",True
P9WFU8,Lysine--tRNA ligase 1,protein,83331,Mycobacterium tuberculosis (strain CDC 1551 / Oshkosh),Mycobacterium tuberculosis (strain CDC 1551 / Oshkosh),lysS1,505,PTHR42918:SF15,"LYSINE--TRNA LIGASE, CHLOROPLASTIC_MITOCHONDRIAL",True
P9WFU9,Lysine--tRNA ligase 1,protein,83332,Mycobacterium tuberculosis (strain ATCC 25618 / H37Rv),Mycobacterium tuberculosis (strain ATCC 25618 / H37Rv),lysS1,505,PTHR42918:SF15,"LYSINE--TRNA LIGASE, CHLOROPLASTIC_MITOCHONDRIAL",True
Q02RH2,Lysine--tRNA ligase,protein,208963,Pseudomonas aeruginosa (strain UCBPP-PA14),Pseudomonas aeruginosa (strain UCBPP-PA14),lysS,501,PTHR42918:SF15,"LYSINE--TRNA LIGASE, CHLOROPLASTIC_MITOCHONDRIAL",True
Q031U8,Lysine--tRNA ligase,protein,272622,Lactococcus lactis subsp. cremoris (strain SK11),Lactococcus lactis subsp. cremoris (strain SK11),lysS,494,PTHR42918:SF15,"LYSINE--TRNA LIGASE, CHLOROPLASTIC_MITOCHONDRIAL",True
Q03E09,Lysine--tRNA ligase,protein,278197,Pediococcus pentosaceus (strain ATCC 25745 / CCUG 21536 / LMG 10740 / 183-1w),Pediococcus pentosaceus (strain ATCC 25745 / CCUG 21536 / LMG 10740 / 183-1w),lysS,498,PTHR42918:SF15,"LYSINE--TRNA LIGASE, CHLOROPLASTIC_MITOCHONDRIAL",True
Q03LD3,Lysine--tRNA ligase,protein,322159,Streptococcus thermophilus (strain ATCC BAA-491 / LMD-9),Streptococcus thermophilus (strain ATCC BAA-491 / LMD-9),lysS,496,PTHR42918:SF15,"LYSINE--TRNA LIGASE, CHLOROPLASTIC_MITOCHONDRIAL",True
Q03Z44,Lysine--tRNA ligase,protein,203120,Leuconostoc mesenteroides subsp. mesenteroides (strain ATCC 8293 / DSM 20343 / BCRC 11652 / CCM 1803 / JCM 6124 / NCDO 523 / NBRC 100496 / NCIMB 8023 / NCTC 12954 / NRRL B-1118 / 37Y),Leuconostoc mesenteroides subsp. mesenteroides (strain ATCC 8293 / DSM 20343 / BCRC 11652 / CCM 1803 / JCM 6124 / NCDO 523 / NBRC 100496 / NCIMB 8023 / NCTC 12954 / NRRL B-1118 / 37Y),lysS,495,PTHR42918:SF15,"LYSINE--TRNA LIGASE, CHLOROPLASTIC_MITOCHONDRIAL",True
Q04LI2,Lysine--tRNA ligase,protein,373153,Streptococcus pneumoniae serotype 2 (strain D39 / NCTC 7466),Streptococcus pneumoniae serotype 2 (strain D39 / NCTC 7466),lysS,496,PTHR42918:SF15,"LYSINE--TRNA LIGASE, CHLOROPLASTIC_MITOCHONDRIAL",True
Q04SM4,Lysine--tRNA ligase,protein,355277,Leptospira borgpetersenii serovar Hardjo-bovis (strain JB197),Leptospira borgpetersenii serovar Hardjo-bovis (strain JB197),lysS,495,PTHR42918:SF15,"LYSINE--TRNA LIGASE, CHLOROPLASTIC_MITOCHONDRIAL",True
Q050Q1,Lysine--tRNA ligase,protein,355276,Leptospira borgpetersenii serovar Hardjo-bovis (strain L550),Leptospira borgpetersenii serovar Hardjo-bovis (strain L550),lysS,495,PTHR42918:SF15,"LYSINE--TRNA LIGASE, CHLOROPLASTIC_MITOCHONDRIAL",True
Q057G7,Lysine--tRNA ligase,protein,372461,Buchnera aphidicola subsp. Cinara cedri (strain Cc),Buchnera aphidicola subsp. Cinara cedri (strain Cc),lysS,502,PTHR42918:SF15,"LYSINE--TRNA LIGASE, CHLOROPLASTIC_MITOCHONDRIAL",True
Q087X1,Lysine--tRNA ligase,protein,318167,Shewanella frigidimarina (strain NCIMB 400),Shewanella frigidimarina (strain NCIMB 400),lysS,500,PTHR42918:SF15,"LYSINE--TRNA LIGASE, CHLOROPLASTIC_MITOCHONDRIAL",True
Q0B0N3,Lysine--tRNA ligase,protein,335541,Syntrophomonas wolfei subsp. wolfei (strain DSM 2245B / Goettingen),Syntrophomonas wolfei subsp. wolfei (strain DSM 2245B / Goettingen),lysS,493,PTHR42918:SF15,"LYSINE--TRNA LIGASE, CHLOROPLASTIC_MITOCHONDRIAL",True
Q0BDR2,Lysine--tRNA ligase,protein,339670,Burkholderia ambifaria (strain ATCC BAA-244 / DSM 16087 / CCUG 44356 / LMG 19182 / AMMD),Burkholderia ambifaria (strain ATCC BAA-244 / DSM 16087 / CCUG 44356 / LMG 19182 / AMMD),lysS,508,PTHR42918:SF15,"LYSINE--TRNA LIGASE, CHLOROPLASTIC_MITOCHONDRIAL",True
Q0HM10,Lysine--tRNA ligase,protein,60480,Shewanella sp. (strain MR-4),Shewanella sp. (strain MR-4),lysS,500,PTHR42918:SF15,"LYSINE--TRNA LIGASE, CHLOROPLASTIC_MITOCHONDRIAL",True
Q0HRS5,Lysine--tRNA ligase,protein,60481,Shewanella sp. (strain MR-7),Shewanella sp. (strain MR-7),lysS,500,PTHR42918:SF15,"LYSINE--TRNA LIGASE, CHLOROPLASTIC_MITOCHONDRIAL",True
Q0I4V7,Elongation factor P--(R)-beta-lysine ligase,protein,205914,Histophilus somni (strain 129Pt),Histophilus somni (strain 129Pt),epmA,323,PTHR42918:SF6,ELONGATION FACTOR P--(R)-BETA-LYSINE LIGASE,True
Q0IDW9,Lysine--tRNA ligase,protein,64471,Synechococcus sp. (strain CC9311),Synechococcus sp. (strain CC9311),lysS,489,PTHR42918:SF15,"LYSINE--TRNA LIGASE, CHLOROPLASTIC_MITOCHONDRIAL",True
Q0KCG3,Lysine--tRNA ligase,protein,381666,Cupriavidus necator (strain ATCC 17699 / DSM 428 / KCTC 22496 / NCIMB 10442 / H16 / Stanier 337),Cupriavidus necator (strain ATCC 17699 / DSM 428 / KCTC 22496 / NCIMB 10442 / H16 / Stanier 337),lysS,514,PTHR42918:SF15,"LYSINE--TRNA LIGASE, CHLOROPLASTIC_MITOCHONDRIAL",True
Q0SAA3,Lysylphosphatidylglycerol biosynthesis bifunctional protein LysX,protein,101510,Rhodococcus jostii (strain RHA1),Rhodococcus jostii (strain RHA1),lysX,1114,PTHR42918:SF15,"LYSINE--TRNA LIGASE, CHLOROPLASTIC_MITOCHONDRIAL",True
Q0SQ86,Lysine--tRNA ligase,protein,289380,Clostridium perfringens (strain SM101 / Type A),Clostridium perfringens (strain SM101 / Type A),lysS,501,PTHR42918:SF15,"LYSINE--TRNA LIGASE, CHLOROPLASTIC_MITOCHONDRIAL",True
Q0SXC1,Elongation factor P--(R)-beta-lysine ligase,protein,373384,Shigella flexneri serotype 5b (strain 8401),Shigella flexneri serotype 5b (strain 8401),epmA,325,PTHR42918:SF6,ELONGATION FACTOR P--(R)-BETA-LYSINE LIGASE,True
Q0T106,Lysine--tRNA ligase,protein,373384,Shigella flexneri serotype 5b (strain 8401),Shigella flexneri serotype 5b (strain 8401),lysS,505,PTHR42918:SF15,"LYSINE--TRNA LIGASE, CHLOROPLASTIC_MITOCHONDRIAL",True
Q0T9N4,Elongation factor P--(R)-beta-lysine ligase,protein,362663,Escherichia coli O6:K15:H31 (strain 536 / UPEC),Escherichia coli O6:K15:H31 (strain 536 / UPEC),epmA,325,PTHR42918:SF6,ELONGATION FACTOR P--(R)-BETA-LYSINE LIGASE,True
Q0TMI7,Lysine--tRNA ligase,protein,195103,Clostridium perfringens (strain ATCC 13124 / DSM 756 / JCM 1290 / NCIMB 6125 / NCTC 8237 / Type A),Clostridium perfringens (strain ATCC 13124 / DSM 756 / JCM 1290 / NCIMB 6125 / NCTC 8237 / Type A),lysS,501,PTHR42918:SF15,"LYSINE--TRNA LIGASE, CHLOROPLASTIC_MITOCHONDRIAL",True
Q12JH2,Lysine--tRNA ligase,protein,318161,Shewanella denitrificans (strain OS217 / ATCC BAA-1090 / DSM 15013),Shewanella denitrificans (strain OS217 / ATCC BAA-1090 / DSM 15013),lysS,500,PTHR42918:SF15,"LYSINE--TRNA LIGASE, CHLOROPLASTIC_MITOCHONDRIAL",True
Q13WZ5,Lysine--tRNA ligase,protein,266265,Paraburkholderia xenovorans (strain LB400),Paraburkholderia xenovorans (strain LB400),lysS,513,PTHR42918:SF15,"LYSINE--TRNA LIGASE, CHLOROPLASTIC_MITOCHONDRIAL",True
Q15046,Lysine--tRNA ligase,protein,9606,Homo sapiens,Homo sapiens (Human),KARS1,597,PTHR42918:SF9,LYSINE--TRNA LIGASE,True
Q17YS1,Lysine--tRNA ligase,protein,382638,Helicobacter acinonychis (strain Sheeba),Helicobacter acinonychis (strain Sheeba),lysS,501,PTHR42918:SF15,"LYSINE--TRNA LIGASE, CHLOROPLASTIC_MITOCHONDRIAL",True
Q1B7P4,Lysylphosphatidylglycerol biosynthesis bifunctional protein LysX,protein,164756,Mycobacterium sp. (strain MCS),Mycobacterium sp. (strain MCS),lysX,1112,PTHR42918:SF15,"LYSINE--TRNA LIGASE, CHLOROPLASTIC_MITOCHONDRIAL",True
Q1BHT1,Lysine--tRNA ligase,protein,331271,Burkholderia orbicola (strain AU 1054),Burkholderia orbicola (strain AU 1054),lysS,508,PTHR42918:SF15,"LYSINE--TRNA LIGASE, CHLOROPLASTIC_MITOCHONDRIAL",True
