id,name,entry_type,source_tax_id,source_tax_name,full_tax_name,gene,length,subfamily,subfamily_name,in_alphafold
Q72JT9,Lysine--tRNA ligase,protein,262724,Thermus thermophilus (strain ATCC BAA-163 / DSM 7039 / HB27),Thermus thermophilus (strain ATCC BAA-163 / DSM 7039 / HB27),lysS,492,PTHR42918:SF15,"LYSINE--TRNA LIGASE, CHLOROPLASTIC_MITOCHONDRIAL",True
Q72R38,Lysine--tRNA ligase,protein,267671,Leptospira interrogans serogroup Icterohaemorrhagiae serovar copenhageni (strain Fiocruz L1-130),Leptospira interrogans serogroup Icterohaemorrhagiae serovar copenhageni (strain Fiocruz L1-130),lysS,495,PTHR42918:SF15,"LYSINE--TRNA LIGASE, CHLOROPLASTIC_MITOCHONDRIAL",True
Q73FD1,Lysine--tRNA ligase,protein,222523,Bacillus cereus (strain ATCC 10987 / NRS 248),Bacillus cereus (strain ATCC 10987 / NRS 248),lysS,499,PTHR42918:SF15,"LYSINE--TRNA LIGASE, CHLOROPLASTIC_MITOCHONDRIAL",True
Q740J9,Lysylphosphatidylglycerol biosynthesis bifunctional protein LysX,protein,262316,Mycolicibacterium paratuberculosis (strain ATCC BAA-968 / K-10),Mycolicibacterium paratuberculosis (strain ATCC BAA-968 / K-10),lysX,1177,PTHR42918:SF15,"LYSINE--TRNA LIGASE, CHLOROPLASTIC_MITOCHONDRIAL",True
Q7MAR1,Lysine--tRNA ligase,protein,273121,Wolinella succinogenes (strain ATCC 29543 / DSM 1740 / CCUG 13145 / JCM 31913 / LMG 7466 / NCTC 11488 / FDC 602W),Wolinella succinogenes (strain ATCC 29543 / DSM 1740 / CCUG 13145 / JCM 31913 / LMG 7466 / NCTC 11488 / FDC 602W),lysS,507,PTHR42918:SF15,"LYSINE--TRNA LIGASE, CHLOROPLASTIC_MITOCHONDRIAL",True
Q7MGX9,Elongation factor P--(R)-beta-lysine ligase,protein,196600,Vibrio vulnificus (strain YJ016),Vibrio vulnificus (strain YJ016),epmA,323,PTHR42918:SF6,ELONGATION FACTOR P--(R)-BETA-LYSINE LIGASE,True
Q7MNP6,Lysine--tRNA ligase,protein,196600,Vibrio vulnificus (strain YJ016),Vibrio vulnificus (strain YJ016),lysS,510,PTHR42918:SF15,"LYSINE--TRNA LIGASE, CHLOROPLASTIC_MITOCHONDRIAL",True
Q7MUV7,Lysine--tRNA ligase,protein,242619,Porphyromonas gingivalis (strain ATCC BAA-308 / W83),Porphyromonas gingivalis (strain ATCC BAA-308 / W83),lysS,578,PTHR42918:SF15,"LYSINE--TRNA LIGASE, CHLOROPLASTIC_MITOCHONDRIAL",True
Q7MZY6,Elongation factor P--(R)-beta-lysine ligase,protein,243265,Photorhabdus laumondii subsp. laumondii (strain DSM 15139 / CIP 105565 / TT01),Photorhabdus laumondii subsp. laumondii (strain DSM 15139 / CIP 105565 / TT01),epmA,325,PTHR42918:SF6,ELONGATION FACTOR P--(R)-BETA-LYSINE LIGASE,True
Q7N1C8,Lysine--tRNA ligase,protein,243265,Photorhabdus laumondii subsp. laumondii (strain DSM 15139 / CIP 105565 / TT01),Photorhabdus laumondii subsp. laumondii (strain DSM 15139 / CIP 105565 / TT01),lysS,504,PTHR42918:SF15,"LYSINE--TRNA LIGASE, CHLOROPLASTIC_MITOCHONDRIAL",True
Q7NC34,Lysine--tRNA ligase,protein,710127,Mycoplasmoides gallisepticum (strain R(low / passage 15 / clone 2)),Mycoplasmoides gallisepticum (strain R(low / passage 15 / clone 2)),lysS,492,PTHR42918:SF15,"LYSINE--TRNA LIGASE, CHLOROPLASTIC_MITOCHONDRIAL",True
Q7NG18,Lysine--tRNA ligase,protein,251221,Gloeobacter violaceus (strain ATCC 29082 / PCC 7421),Gloeobacter violaceus (strain ATCC 29082 / PCC 7421),lysS,497,PTHR42918:SF15,"LYSINE--TRNA LIGASE, CHLOROPLASTIC_MITOCHONDRIAL",True
Q7NZ62,Lysine--tRNA ligase,protein,243365,Chromobacterium violaceum (strain ATCC 12472 / DSM 30191 / JCM 1249 / CCUG 213 / NBRC 12614 / NCIMB 9131 / NCTC 9757 / MK),Chromobacterium violaceum (strain ATCC 12472 / DSM 30191 / JCM 1249 / CCUG 213 / NBRC 12614 / NCIMB 9131 / NCTC 9757 / MK),lysS,502,PTHR42918:SF15,"LYSINE--TRNA LIGASE, CHLOROPLASTIC_MITOCHONDRIAL",True
Q7U3A4,Lysine--tRNA ligase,protein,74547,Prochlorococcus marinus (strain MIT 9313),Prochlorococcus marinus (strain MIT 9313),lysS,508,PTHR42918:SF15,"LYSINE--TRNA LIGASE, CHLOROPLASTIC_MITOCHONDRIAL",True
Q7U9X5,Lysine--tRNA ligase,protein,84588,Parasynechococcus marenigrum (strain WH8102),Parasynechococcus marenigrum (strain WH8102),lysS,502,PTHR42918:SF15,"LYSINE--TRNA LIGASE, CHLOROPLASTIC_MITOCHONDRIAL",True
Q7UZP0,Lysine--tRNA ligase,protein,59919,Prochlorococcus marinus subsp. pastoris (strain CCMP1986 / NIES-2087 / MED4),Prochlorococcus marinus subsp. pastoris (strain CCMP1986 / NIES-2087 / MED4),lysS,512,PTHR42918:SF15,"LYSINE--TRNA LIGASE, CHLOROPLASTIC_MITOCHONDRIAL",True
Q7V9Q0,Lysine--tRNA ligase,protein,167539,Prochlorococcus marinus (strain SARG / CCMP1375 / SS120),Prochlorococcus marinus (strain SARG / CCMP1375 / SS120),lysS,502,PTHR42918:SF15,"LYSINE--TRNA LIGASE, CHLOROPLASTIC_MITOCHONDRIAL",True
Q7VEV7,Lysylphosphatidylglycerol biosynthesis bifunctional protein LysX,protein,233413,Mycobacterium bovis (strain ATCC BAA-935 / AF2122/97),Mycobacterium bovis (strain ATCC BAA-935 / AF2122/97),lysX,1172,PTHR42918:SF15,"LYSINE--TRNA LIGASE, CHLOROPLASTIC_MITOCHONDRIAL",True
Q7VFL0,Lysine--tRNA ligase,protein,235279,Helicobacter hepaticus (strain ATCC 51449 / 3B1),Helicobacter hepaticus (strain ATCC 51449 / 3B1),lysS,518,PTHR42918:SF15,"LYSINE--TRNA LIGASE, CHLOROPLASTIC_MITOCHONDRIAL",True
Q7VLU5,Lysine--tRNA ligase,protein,233412,Haemophilus ducreyi (strain 35000HP / ATCC 700724),Haemophilus ducreyi (strain 35000HP / ATCC 700724),lysS,498,PTHR42918:SF15,"LYSINE--TRNA LIGASE, CHLOROPLASTIC_MITOCHONDRIAL",True
Q7VPM9,Elongation factor P--(R)-beta-lysine ligase,protein,233412,Haemophilus ducreyi (strain 35000HP / ATCC 700724),Haemophilus ducreyi (strain 35000HP / ATCC 700724),epmA,327,PTHR42918:SF6,ELONGATION FACTOR P--(R)-BETA-LYSINE LIGASE,True
Q7VRF5,Lysine--tRNA ligase,protein,203907,Blochmanniella floridana,Blochmanniella floridana,lysS,485,PTHR42918:SF15,"LYSINE--TRNA LIGASE, CHLOROPLASTIC_MITOCHONDRIAL",True
Q7VZ37,Lysine--tRNA ligase,protein,257313,Bordetella pertussis (strain Tohama I / ATCC BAA-589 / NCTC 13251),Bordetella pertussis (strain Tohama I / ATCC BAA-589 / NCTC 13251),lysS,506,PTHR42918:SF15,"LYSINE--TRNA LIGASE, CHLOROPLASTIC_MITOCHONDRIAL",True
Q7W8T6,Lysine--tRNA ligase,protein,257311,Bordetella parapertussis (strain 12822 / ATCC BAA-587 / NCTC 13253),Bordetella parapertussis (strain 12822 / ATCC BAA-587 / NCTC 13253),lysS,506,PTHR42918:SF15,"LYSINE--TRNA LIGASE, CHLOROPLASTIC_MITOCHONDRIAL",True
Q7WK46,Lysine--tRNA ligase,protein,257310,Bordetella bronchiseptica (strain ATCC BAA-588 / NCTC 13252 / RB50),Bordetella bronchiseptica (strain ATCC BAA-588 / NCTC 13252 / RB50),lysS,506,PTHR42918:SF15,"LYSINE--TRNA LIGASE, CHLOROPLASTIC_MITOCHONDRIAL",True
Q81J70,Lysine--tRNA ligase,protein,226900,Bacillus cereus (strain ATCC 14579 / DSM 31 / CCUG 7414 / JCM 2152 / NBRC 15305 / NCIMB 9373 / NCTC 2599 / NRRL B-3711),Bacillus cereus (strain ATCC 14579 / DSM 31 / CCUG 7414 / JCM 2152 / NBRC 15305 / NCIMB 9373 / NCTC 2599 / NRRL B-3711),lysS,499,PTHR42918:SF15,"LYSINE--TRNA LIGASE, CHLOROPLASTIC_MITOCHONDRIAL",True
Q81VW3,Lysine--tRNA ligase,protein,1392,Bacillus anthracis,Bacillus anthracis (anthrax bacterium),lysS,499,PTHR42918:SF15,"LYSINE--TRNA LIGASE, CHLOROPLASTIC_MITOCHONDRIAL",True
Q821U6,Lysine--tRNA ligase,protein,227941,Chlamydia caviae (strain ATCC VR-813 / DSM 19441 / 03DC25 / GPIC),Chlamydia caviae (strain ATCC VR-813 / DSM 19441 / 03DC25 / GPIC),lysS,525,PTHR42918:SF15,"LYSINE--TRNA LIGASE, CHLOROPLASTIC_MITOCHONDRIAL",True
Q82SH1,Lysine--tRNA ligase,protein,228410,Nitrosomonas europaea (strain ATCC 19718 / CIP 103999 / KCTC 2705 / NBRC 14298),Nitrosomonas europaea (strain ATCC 19718 / CIP 103999 / KCTC 2705 / NBRC 14298),lysS,502,PTHR42918:SF15,"LYSINE--TRNA LIGASE, CHLOROPLASTIC_MITOCHONDRIAL",True
Q839A8,Lysine--tRNA ligase,protein,226185,Enterococcus faecalis (strain ATCC 700802 / V583),Enterococcus faecalis (strain ATCC 700802 / V583),lysS,498,PTHR42918:SF15,"LYSINE--TRNA LIGASE, CHLOROPLASTIC_MITOCHONDRIAL",True
Q83E97,Lysine--tRNA ligase,protein,227377,Coxiella burnetii (strain RSA 493 / Nine Mile phase I),Coxiella burnetii (strain RSA 493 / Nine Mile phase I),lysS,498,PTHR42918:SF15,"LYSINE--TRNA LIGASE, CHLOROPLASTIC_MITOCHONDRIAL",True
Q83JU6,Lysine--tRNA ligase,protein,623,Shigella flexneri,Shigella flexneri,lysS,505,PTHR42918:SF15,"LYSINE--TRNA LIGASE, CHLOROPLASTIC_MITOCHONDRIAL",True
Q87EB3,Lysine--tRNA ligase,protein,183190,Xylella fastidiosa (strain Temecula1 / ATCC 700964),Xylella fastidiosa (strain Temecula1 / ATCC 700964),lysS,506,PTHR42918:SF15,"LYSINE--TRNA LIGASE, CHLOROPLASTIC_MITOCHONDRIAL",True
Q87KY6,Elongation factor P--(R)-beta-lysine ligase,protein,223926,Vibrio parahaemolyticus serotype O3:K6 (strain RIMD 2210633),Vibrio parahaemolyticus serotype O3:K6 (strain RIMD 2210633),epmA,323,PTHR42918:SF6,ELONGATION FACTOR P--(R)-BETA-LYSINE LIGASE,True
Q87SB1,Lysine--tRNA ligase,protein,223926,Vibrio parahaemolyticus serotype O3:K6 (strain RIMD 2210633),Vibrio parahaemolyticus serotype O3:K6 (strain RIMD 2210633),lysS,505,PTHR42918:SF15,"LYSINE--TRNA LIGASE, CHLOROPLASTIC_MITOCHONDRIAL",True
Q886S6,Lysine--tRNA ligase,protein,223283,Pseudomonas syringae pv. tomato (strain ATCC BAA-871 / DC3000),Pseudomonas syringae pv. tomato (strain ATCC BAA-871 / DC3000),lysS,500,PTHR42918:SF15,"LYSINE--TRNA LIGASE, CHLOROPLASTIC_MITOCHONDRIAL",True
Q88MS3,Lysine--tRNA ligase,protein,160488,Pseudomonas putida (strain ATCC 47054 / DSM 6125 / CFBP 8728 / NCIMB 11950 / KT2440),Pseudomonas putida (strain ATCC 47054 / DSM 6125 / CFBP 8728 / NCIMB 11950 / KT2440),lysS,500,PTHR42918:SF15,"LYSINE--TRNA LIGASE, CHLOROPLASTIC_MITOCHONDRIAL",True
Q88Z28,Lysine--tRNA ligase,protein,220668,Lactiplantibacillus plantarum (strain ATCC BAA-793 / NCIMB 8826 / WCFS1),Lactiplantibacillus plantarum (strain ATCC BAA-793 / NCIMB 8826 / WCFS1),lysS,499,PTHR42918:SF15,"LYSINE--TRNA LIGASE, CHLOROPLASTIC_MITOCHONDRIAL",True
Q899G7,Lysine--tRNA ligase,protein,212717,Clostridium tetani (strain Massachusetts / E88),Clostridium tetani (strain Massachusetts / E88),lysS,502,PTHR42918:SF15,"LYSINE--TRNA LIGASE, CHLOROPLASTIC_MITOCHONDRIAL",True
Q89A27,Elongation factor P--(R)-beta-lysine ligase,protein,224915,Buchnera aphidicola subsp. Baizongia pistaciae (strain Bp),Buchnera aphidicola subsp. Baizongia pistaciae (strain Bp),epmA,322,PTHR42918:SF6,ELONGATION FACTOR P--(R)-BETA-LYSINE LIGASE,True
Q89AC5,Lysine--tRNA ligase,protein,224915,Buchnera aphidicola subsp. Baizongia pistaciae (strain Bp),Buchnera aphidicola subsp. Baizongia pistaciae (strain Bp),lysS,500,PTHR42918:SF15,"LYSINE--TRNA LIGASE, CHLOROPLASTIC_MITOCHONDRIAL",True
Q8A5W4,Lysine--tRNA ligase,protein,226186,Bacteroides thetaiotaomicron (strain ATCC 29148 / DSM 2079 / JCM 5827 / CCUG 10774 / NCTC 10582 / VPI-5482 / E50),Bacteroides thetaiotaomicron (strain ATCC 29148 / DSM 2079 / JCM 5827 / CCUG 10774 / NCTC 10582 / VPI-5482 / E50),lysS,576,PTHR42918:SF15,"LYSINE--TRNA LIGASE, CHLOROPLASTIC_MITOCHONDRIAL",True
Q8CQV5,Lysine--tRNA ligase,protein,176280,Staphylococcus epidermidis (strain ATCC 12228 / FDA PCI 1200),Staphylococcus epidermidis (strain ATCC 12228 / FDA PCI 1200),lysS,495,PTHR42918:SF15,"LYSINE--TRNA LIGASE, CHLOROPLASTIC_MITOCHONDRIAL",True
Q8CWS5,Lysine--tRNA ligase,protein,171101,Streptococcus pneumoniae (strain ATCC BAA-255 / R6),Streptococcus pneumoniae (strain ATCC BAA-255 / R6),lysS,496,PTHR42918:SF15,"LYSINE--TRNA LIGASE, CHLOROPLASTIC_MITOCHONDRIAL",True
Q8D2B3,Lysine--tRNA ligase,protein,36870,Wigglesworthia glossinidia brevipalpis,Wigglesworthia glossinidia brevipalpis,lysS,493,PTHR42918:SF15,"LYSINE--TRNA LIGASE, CHLOROPLASTIC_MITOCHONDRIAL",True
Q8DCX0,Elongation factor P--(R)-beta-lysine ligase,protein,216895,Vibrio vulnificus (strain CMCP6),Vibrio vulnificus (strain CMCP6),epmA,323,PTHR42918:SF6,ELONGATION FACTOR P--(R)-BETA-LYSINE LIGASE,True
Q8DEQ9,Lysine--tRNA ligase,protein,216895,Vibrio vulnificus (strain CMCP6),Vibrio vulnificus (strain CMCP6),lysS,510,PTHR42918:SF15,"LYSINE--TRNA LIGASE, CHLOROPLASTIC_MITOCHONDRIAL",True
Q8DMA9,Lysine--tRNA ligase,protein,197221,Thermosynechococcus vestitus (strain NIES-2133 / IAM M-273 / BP-1),Thermosynechococcus vestitus (strain NIES-2133 / IAM M-273 / BP-1),lysS,506,PTHR42918:SF15,"LYSINE--TRNA LIGASE, CHLOROPLASTIC_MITOCHONDRIAL",True
Q8DUW8,Lysine--tRNA ligase,protein,210007,Streptococcus mutans serotype c (strain ATCC 700610 / UA159),Streptococcus mutans serotype c (strain ATCC 700610 / UA159),lysS,496,PTHR42918:SF15,"LYSINE--TRNA LIGASE, CHLOROPLASTIC_MITOCHONDRIAL",True
Q8E0I1,Lysine--tRNA ligase,protein,208435,Streptococcus agalactiae serotype V (strain ATCC BAA-611 / 2603 V/R),Streptococcus agalactiae serotype V (strain ATCC BAA-611 / 2603 V/R),lysS,496,PTHR42918:SF15,"LYSINE--TRNA LIGASE, CHLOROPLASTIC_MITOCHONDRIAL",True
Q8E656,Lysine--tRNA ligase,protein,211110,Streptococcus agalactiae serotype III (strain NEM316),Streptococcus agalactiae serotype III (strain NEM316),lysS,496,PTHR42918:SF15,"LYSINE--TRNA LIGASE, CHLOROPLASTIC_MITOCHONDRIAL",True
Q8EI58,Lysine--tRNA ligase,protein,211586,Shewanella oneidensis (strain ATCC 700550 / JCM 31522 / CIP 106686 / LMG 19005 / NCIMB 14063 / MR-1),Shewanella oneidensis (strain ATCC 700550 / JCM 31522 / CIP 106686 / LMG 19005 / NCIMB 14063 / MR-1),lysS,500,PTHR42918:SF15,"LYSINE--TRNA LIGASE, CHLOROPLASTIC_MITOCHONDRIAL",True
Q8EU10,Lysine--tRNA ligase,protein,221109,Oceanobacillus iheyensis (strain DSM 14371 / CIP 107618 / JCM 11309 / KCTC 3954 / HTE831),Oceanobacillus iheyensis (strain DSM 14371 / CIP 107618 / JCM 11309 / KCTC 3954 / HTE831),lysS,493,PTHR42918:SF15,"LYSINE--TRNA LIGASE, CHLOROPLASTIC_MITOCHONDRIAL",True
Q8EUS8,Lysine--tRNA ligase,protein,272633,Malacoplasma penetrans (strain HF-2),Malacoplasma penetrans (strain HF-2),lysS,489,PTHR42918:SF15,"LYSINE--TRNA LIGASE, CHLOROPLASTIC_MITOCHONDRIAL",True
Q8F4P5,Lysine--tRNA ligase,protein,189518,Leptospira interrogans serogroup Icterohaemorrhagiae serovar Lai (strain 56601),Leptospira interrogans serogroup Icterohaemorrhagiae serovar Lai (strain 56601),lysS,495,PTHR42918:SF15,"LYSINE--TRNA LIGASE, CHLOROPLASTIC_MITOCHONDRIAL",True
Q8FAT5,"Lysine--tRNA ligase, heat inducible",protein,199310,Escherichia coli O6:H1 (strain CFT073 / ATCC 700928 / UPEC),Escherichia coli O6:H1 (strain CFT073 / ATCC 700928 / UPEC),lysU,505,PTHR42918:SF15,"LYSINE--TRNA LIGASE, CHLOROPLASTIC_MITOCHONDRIAL",True
Q8K9C5,Lysine--tRNA ligase,protein,198804,Buchnera aphidicola subsp. Schizaphis graminum (strain Sg),Buchnera aphidicola subsp. Schizaphis graminum (strain Sg),lysS,503,PTHR42918:SF15,"LYSINE--TRNA LIGASE, CHLOROPLASTIC_MITOCHONDRIAL",True
Q8KCM7,Lysine--tRNA ligase,protein,194439,Chlorobaculum tepidum (strain ATCC 49652 / DSM 12025 / NBRC 103806 / TLS),Chlorobaculum tepidum (strain ATCC 49652 / DSM 12025 / NBRC 103806 / TLS),lysS,511,PTHR42918:SF15,"LYSINE--TRNA LIGASE, CHLOROPLASTIC_MITOCHONDRIAL",True
Q8NXZ0,Lysine--tRNA ligase,protein,196620,Staphylococcus aureus (strain MW2),Staphylococcus aureus (strain MW2),lysS,495,PTHR42918:SF15,"LYSINE--TRNA LIGASE, CHLOROPLASTIC_MITOCHONDRIAL",True
Q8P1X6,Lysine--tRNA ligase,protein,186103,Streptococcus pyogenes serotype M18 (strain MGAS8232),Streptococcus pyogenes serotype M18 (strain MGAS8232),lysS,497,PTHR42918:SF15,"LYSINE--TRNA LIGASE, CHLOROPLASTIC_MITOCHONDRIAL",True
Q8PLC6,Lysine--tRNA ligase,protein,190486,Xanthomonas citri pv. citri (strain 306),Xanthomonas citri pv. citri (strain 306),lysS,505,PTHR42918:SF15,"LYSINE--TRNA LIGASE, CHLOROPLASTIC_MITOCHONDRIAL",True
Q8PVP6,Lysine--tRNA ligase 2,protein,192952,Methanosarcina mazei (strain ATCC BAA-159 / DSM 3647 / Goe1 / Go1 / JCM 11833 / OCM 88),Methanosarcina mazei (strain ATCC BAA-159 / DSM 3647 / Goe1 / Go1 / JCM 11833 / OCM 88),lysS2,511,PTHR42918:SF15,"LYSINE--TRNA LIGASE, CHLOROPLASTIC_MITOCHONDRIAL",True
Q8R7N1,Lysine--tRNA ligase,protein,273068,Caldanaerobacter subterraneus subsp. tengcongensis (strain DSM 15242 / JCM 11007 / NBRC 100824 / MB4),Caldanaerobacter subterraneus subsp. tengcongensis (strain DSM 15242 / JCM 11007 / NBRC 100824 / MB4),lysS,499,PTHR42918:SF15,"LYSINE--TRNA LIGASE, CHLOROPLASTIC_MITOCHONDRIAL",True
Q8RG52,Lysine--tRNA ligase,protein,190304,Fusobacterium nucleatum subsp. nucleatum (strain ATCC 25586 / DSM 15643 / BCRC 10681 / CIP 101130 / JCM 8532 / KCTC 2640 / LMG 13131 / VPI 4355),Fusobacterium nucleatum subsp. nucleatum (strain ATCC 25586 / DSM 15643 / BCRC 10681 / CIP 101130 / JCM 8532 / KCTC 2640 / LMG 13131 / VPI 4355),lysS,493,PTHR42918:SF15,"LYSINE--TRNA LIGASE, CHLOROPLASTIC_MITOCHONDRIAL",True
Q8SS56,"Probable lysine--tRNA ligase, cytoplasmic",protein,284813,Encephalitozoon cuniculi (strain GB-M1),Encephalitozoon cuniculi (strain GB-M1) (Microsporidian parasite),ECU04_0580,510,PTHR42918:SF9,LYSINE--TRNA LIGASE,True
Q8TSN5,Lysine--tRNA ligase 2,protein,188937,Methanosarcina acetivorans (strain ATCC 35395 / DSM 2834 / JCM 12185 / C2A),Methanosarcina acetivorans (strain ATCC 35395 / DSM 2834 / JCM 12185 / C2A),lysS2,511,PTHR42918:SF15,"LYSINE--TRNA LIGASE, CHLOROPLASTIC_MITOCHONDRIAL",True
Q8U7H6,Lysine--tRNA ligase,protein,176299,Agrobacterium fabrum (strain C58 / ATCC 33970),Agrobacterium fabrum (strain C58 / ATCC 33970),lysS,499,PTHR42918:SF15,"LYSINE--TRNA LIGASE, CHLOROPLASTIC_MITOCHONDRIAL",True
Q8XD57,Lysine--tRNA ligase,protein,83334,Escherichia coli O157:H7,Escherichia coli O157:H7,lysS,505,PTHR42918:SF15,"LYSINE--TRNA LIGASE, CHLOROPLASTIC_MITOCHONDRIAL",True
Q8XHL8,Lysine--tRNA ligase,protein,195102,Clostridium perfringens (strain 13 / Type A),Clostridium perfringens (strain 13 / Type A),lysS,501,PTHR42918:SF15,"LYSINE--TRNA LIGASE, CHLOROPLASTIC_MITOCHONDRIAL",True
Q8Y0L5,Lysine--tRNA ligase,protein,267608,Ralstonia nicotianae (strain ATCC BAA-1114 / GMI1000),Ralstonia nicotianae (strain ATCC BAA-1114 / GMI1000),lysS,510,PTHR42918:SF15,"LYSINE--TRNA LIGASE, CHLOROPLASTIC_MITOCHONDRIAL",True
Q8YAB8,Lysine--tRNA ligase,protein,169963,Listeria monocytogenes serovar 1/2a (strain ATCC BAA-679 / EGD-e),Listeria monocytogenes serovar 1/2a (strain ATCC BAA-679 / EGD-e),lysS,498,PTHR42918:SF15,"LYSINE--TRNA LIGASE, CHLOROPLASTIC_MITOCHONDRIAL",True
Q8YPW9,Lysine--tRNA ligase,protein,103690,Nostoc sp. (strain PCC 7120 / SAG 25.82 / UTEX 2576),Nostoc sp. (strain PCC 7120 / SAG 25.82 / UTEX 2576),lysS,561,PTHR42918:SF15,"LYSINE--TRNA LIGASE, CHLOROPLASTIC_MITOCHONDRIAL",True
Q8Z197,Elongation factor P--(R)-beta-lysine ligase,protein,90370,Salmonella typhi,Salmonella typhi,epmA,325,PTHR42918:SF6,ELONGATION FACTOR P--(R)-BETA-LYSINE LIGASE,True
Q8Z3X8,Lysine--tRNA ligase,protein,90370,Salmonella typhi,Salmonella typhi,lysS,505,PTHR42918:SF15,"LYSINE--TRNA LIGASE, CHLOROPLASTIC_MITOCHONDRIAL",True
Q8ZHK5,Lysine--tRNA ligase,protein,632,Yersinia pestis,Yersinia pestis,lysS,505,PTHR42918:SF15,"LYSINE--TRNA LIGASE, CHLOROPLASTIC_MITOCHONDRIAL",True
Q8ZIX3,Elongation factor P--(R)-beta-lysine ligase,protein,632,Yersinia pestis,Yersinia pestis,epmA,325,PTHR42918:SF6,ELONGATION FACTOR P--(R)-BETA-LYSINE LIGASE,True
Q92F47,Lysine--tRNA ligase,protein,272626,Listeria innocua serovar 6a (strain ATCC BAA-680 / CLIP 11262),Listeria innocua serovar 6a (strain ATCC BAA-680 / CLIP 11262),lysS,498,PTHR42918:SF15,"LYSINE--TRNA LIGASE, CHLOROPLASTIC_MITOCHONDRIAL",True
Q97EB7,Lysine--tRNA ligase,protein,272562,Clostridium acetobutylicum (strain ATCC 824 / DSM 792 / JCM 1419 / IAM 19013 / LMG 5710 / NBRC 13948 / NRRL B-527 / VKM B-1787 / 2291 / W),Clostridium acetobutylicum (strain ATCC 824 / DSM 792 / JCM 1419 / IAM 19013 / LMG 5710 / NBRC 13948 / NRRL B-527 / VKM B-1787 / 2291 / W),lysS,515,PTHR42918:SF15,"LYSINE--TRNA LIGASE, CHLOROPLASTIC_MITOCHONDRIAL",True
Q97RS9,Lysine--tRNA ligase,protein,170187,Streptococcus pneumoniae serotype 4 (strain ATCC BAA-334 / TIGR4),Streptococcus pneumoniae serotype 4 (strain ATCC BAA-334 / TIGR4),lysS,496,PTHR42918:SF15,"LYSINE--TRNA LIGASE, CHLOROPLASTIC_MITOCHONDRIAL",True
Q98QG4,Lysine--tRNA ligase 2,protein,272635,Mycoplasmopsis pulmonis (strain UAB CTIP),Mycoplasmopsis pulmonis (strain UAB CTIP),lysS2,491,PTHR42918:SF15,"LYSINE--TRNA LIGASE, CHLOROPLASTIC_MITOCHONDRIAL",True
Q98QH1,Lysine--tRNA ligase 1,protein,272635,Mycoplasmopsis pulmonis (strain UAB CTIP),Mycoplasmopsis pulmonis (strain UAB CTIP),lysS1,491,PTHR42918:SF15,"LYSINE--TRNA LIGASE, CHLOROPLASTIC_MITOCHONDRIAL",True
Q99MN1,Lysine--tRNA ligase,protein,10090,Mus musculus,Mus musculus (Mouse),Kars1,595,PTHR42918:SF9,LYSINE--TRNA LIGASE,True
Q9A0V7,Lysine--tRNA ligase,protein,301447,Streptococcus pyogenes serotype M1,Streptococcus pyogenes serotype M1,lysS,497,PTHR42918:SF15,"LYSINE--TRNA LIGASE, CHLOROPLASTIC_MITOCHONDRIAL",True
Q9CC23,Lysylphosphatidylglycerol biosynthesis bifunctional protein LysX,protein,272631,Mycobacterium leprae (strain TN),Mycobacterium leprae (strain TN),lysX,1133,PTHR42918:SF15,"LYSINE--TRNA LIGASE, CHLOROPLASTIC_MITOCHONDRIAL",True
Q9CII7,Lysine--tRNA ligase,protein,272623,Lactococcus lactis subsp. lactis (strain IL1403),Lactococcus lactis subsp. lactis (strain IL1403),lysS,494,PTHR42918:SF15,"LYSINE--TRNA LIGASE, CHLOROPLASTIC_MITOCHONDRIAL",True
Q9HXU0,Lysine--tRNA ligase,protein,208964,Pseudomonas aeruginosa (strain ATCC 15692 / DSM 22644 / CIP 104116 / JCM 14847 / LMG 12228 / 1C / PRS 101 / PAO1),Pseudomonas aeruginosa (strain ATCC 15692 / DSM 22644 / CIP 104116 / JCM 14847 / LMG 12228 / 1C / PRS 101 / PAO1),lysS,501,PTHR42918:SF15,"LYSINE--TRNA LIGASE, CHLOROPLASTIC_MITOCHONDRIAL",True
Q9JTT7,Lysine--tRNA ligase,protein,122587,Neisseria meningitidis serogroup A / serotype 4A (strain DSM 15465 / Z2491),Neisseria meningitidis serogroup A / serotype 4A (strain DSM 15465 / Z2491),lysS,503,PTHR42918:SF15,"LYSINE--TRNA LIGASE, CHLOROPLASTIC_MITOCHONDRIAL",True
Q9JYU6,Lysine--tRNA ligase,protein,122586,Neisseria meningitidis serogroup B (strain ATCC BAA-335 / MC58),Neisseria meningitidis serogroup B (strain ATCC BAA-335 / MC58),lysS,503,PTHR42918:SF15,"LYSINE--TRNA LIGASE, CHLOROPLASTIC_MITOCHONDRIAL",True
Q9KGG4,Lysine--tRNA ligase,protein,272558,Halalkalibacterium halodurans (strain ATCC BAA-125 / DSM 18197 / FERM 7344 / JCM 9153 / C-125),Halalkalibacterium halodurans (strain ATCC BAA-125 / DSM 18197 / FERM 7344 / JCM 9153 / C-125),lysS,501,PTHR42918:SF15,"LYSINE--TRNA LIGASE, CHLOROPLASTIC_MITOCHONDRIAL",True
Q9KNS6,Elongation factor P--(R)-beta-lysine ligase,protein,243277,Vibrio cholerae serotype O1 (strain ATCC 39315 / El Tor Inaba N16961),Vibrio cholerae serotype O1 (strain ATCC 39315 / El Tor Inaba N16961),epmA,324,PTHR42918:SF6,ELONGATION FACTOR P--(R)-BETA-LYSINE LIGASE,True
Q9KU60,Lysine--tRNA ligase,protein,243277,Vibrio cholerae serotype O1 (strain ATCC 39315 / El Tor Inaba N16961),Vibrio cholerae serotype O1 (strain ATCC 39315 / El Tor Inaba N16961),lysS,510,PTHR42918:SF15,"LYSINE--TRNA LIGASE, CHLOROPLASTIC_MITOCHONDRIAL",True
Q9L3G6,Lysine--tRNA ligase,protein,190485,Xanthomonas campestris pv. campestris (strain ATCC 33913 / DSM 3586 / NCPPB 528 / LMG 568 / P 25),Xanthomonas campestris pv. campestris (strain ATCC 33913 / DSM 3586 / NCPPB 528 / LMG 568 / P 25),lysS,505,PTHR42918:SF15,"LYSINE--TRNA LIGASE, CHLOROPLASTIC_MITOCHONDRIAL",True
Q9LJE2,"Lysine--tRNA ligase, chloroplastic/mitochondrial",protein,3702,Arabidopsis thaliana,Arabidopsis thaliana (Mouse-ear cress),OVA5,602,PTHR42918:SF15,"LYSINE--TRNA LIGASE, CHLOROPLASTIC_MITOCHONDRIAL",True
Q9PEB6,Lysine--tRNA ligase,protein,160492,Xylella fastidiosa (strain 9a5c),Xylella fastidiosa (strain 9a5c),lysS,506,PTHR42918:SF15,"LYSINE--TRNA LIGASE, CHLOROPLASTIC_MITOCHONDRIAL",True
Q9PLE1,Lysine--tRNA ligase,protein,243161,Chlamydia muridarum (strain MoPn / Nigg),Chlamydia muridarum (strain MoPn / Nigg),lysS,524,PTHR42918:SF15,"LYSINE--TRNA LIGASE, CHLOROPLASTIC_MITOCHONDRIAL",True
Q9PR83,Lysine--tRNA ligase,protein,273119,Ureaplasma parvum serovar 3 (strain ATCC 700970),Ureaplasma parvum serovar 3 (strain ATCC 700970),lysS,493,PTHR42918:SF15,"LYSINE--TRNA LIGASE, CHLOROPLASTIC_MITOCHONDRIAL",True
Q9RHV9,Lysine--tRNA ligase,protein,1422,Geobacillus stearothermophilus,Geobacillus stearothermophilus,lysS,494,PTHR42918:SF15,"LYSINE--TRNA LIGASE, CHLOROPLASTIC_MITOCHONDRIAL",True
Q9RXE1,Lysine--tRNA ligase,protein,243230,Deinococcus radiodurans (strain ATCC 13939 / DSM 20539 / JCM 16871 / CCUG 27074 / LMG 4051 / NBRC 15346 / NCIMB 9279 / VKM B-1422 / R1),Deinococcus radiodurans (strain ATCC 13939 / DSM 20539 / JCM 16871 / CCUG 27074 / LMG 4051 / NBRC 15346 / NCIMB 9279 / VKM B-1422 / R1),lysS,525,PTHR42918:SF15,"LYSINE--TRNA LIGASE, CHLOROPLASTIC_MITOCHONDRIAL",True
Q9UUE6,"Lysine--tRNA ligase, cytoplasmic",protein,284812,Schizosaccharomyces pombe (strain 972 / ATCC 24843),Schizosaccharomyces pombe (strain 972 / ATCC 24843) (Fission yeast),krs1,591,PTHR42918:SF9,LYSINE--TRNA LIGASE,True
Q9X231,Lysine--tRNA ligase,protein,243274,Thermotoga maritima (strain ATCC 43589 / DSM 3109 / JCM 10099 / NBRC 100826 / MSB8),Thermotoga maritima (strain ATCC 43589 / DSM 3109 / JCM 10099 / NBRC 100826 / MSB8),lysS,502,PTHR42918:SF15,"LYSINE--TRNA LIGASE, CHLOROPLASTIC_MITOCHONDRIAL",True
Q9Z614,Elongation factor P--(R)-beta-lysine ligase,protein,198804,Buchnera aphidicola subsp. Schizaphis graminum (strain Sg),Buchnera aphidicola subsp. Schizaphis graminum (strain Sg),epmA,324,PTHR42918:SF6,ELONGATION FACTOR P--(R)-BETA-LYSINE LIGASE,True
Q9Z6X5,Lysine--tRNA ligase,protein,83558,Chlamydia pneumoniae,Chlamydia pneumoniae,lysS,527,PTHR42918:SF15,"LYSINE--TRNA LIGASE, CHLOROPLASTIC_MITOCHONDRIAL",True
Q9ZIY0,Elongation factor P--(R)-beta-lysine ligase,protein,728,Avibacterium paragallinarum,Avibacterium paragallinarum,epmA,322,PTHR42918:SF6,ELONGATION FACTOR P--(R)-BETA-LYSINE LIGASE,True
Q9ZJ12,Elongation factor P--(R)-beta-lysine ligase,protein,99287,Salmonella typhimurium (strain LT2 / SGSC1412 / ATCC 700720),Salmonella typhimurium (strain LT2 / SGSC1412 / ATCC 700720),epmA,325,PTHR42918:SF6,ELONGATION FACTOR P--(R)-BETA-LYSINE LIGASE,True
Q9ZMP8,Lysine--tRNA ligase,protein,85963,Helicobacter pylori (strain J99 / ATCC 700824),Helicobacter pylori (strain J99 / ATCC 700824),lysS,501,PTHR42918:SF15,"LYSINE--TRNA LIGASE, CHLOROPLASTIC_MITOCHONDRIAL",True
