id,name,entry_type,source_tax_id,source_tax_name,full_tax_name,gene,length,subfamily,subfamily_name,in_alphafold
A8FKI8,Lysine--tRNA ligase,protein,407148,Campylobacter jejuni subsp. jejuni serotype O:6 (strain 81116 / NCTC 11828),Campylobacter jejuni subsp. jejuni serotype O:6 (strain 81116 / NCTC 11828),lysS,501,PTHR42918:SF15,"LYSINE--TRNA LIGASE, CHLOROPLASTIC_MITOCHONDRIAL",True
A8FRH9,Lysine--tRNA ligase,protein,425104,Shewanella sediminis (strain HAW-EB3),Shewanella sediminis (strain HAW-EB3),lysS,500,PTHR42918:SF15,"LYSINE--TRNA LIGASE, CHLOROPLASTIC_MITOCHONDRIAL",True
A8G7C4,Lysine--tRNA ligase,protein,93060,Prochlorococcus marinus (strain MIT 9215),Prochlorococcus marinus (strain MIT 9215),lysS,512,PTHR42918:SF15,"LYSINE--TRNA LIGASE, CHLOROPLASTIC_MITOCHONDRIAL",True
A8G8T8,Elongation factor P--(R)-beta-lysine ligase,protein,399741,Serratia proteamaculans (strain 568),Serratia proteamaculans (strain 568),epmA,325,PTHR42918:SF6,ELONGATION FACTOR P--(R)-BETA-LYSINE LIGASE,True
A8GIP4,Lysine--tRNA ligase,protein,399741,Serratia proteamaculans (strain 568),Serratia proteamaculans (strain 568),lysS,505,PTHR42918:SF15,"LYSINE--TRNA LIGASE, CHLOROPLASTIC_MITOCHONDRIAL",True
A8H0J7,Lysine--tRNA ligase,protein,398579,Shewanella pealeana (strain ATCC 700345 / ANG-SQ1),Shewanella pealeana (strain ATCC 700345 / ANG-SQ1),lysS,501,PTHR42918:SF15,"LYSINE--TRNA LIGASE, CHLOROPLASTIC_MITOCHONDRIAL",True
A9AGV1,Lysine--tRNA ligase,protein,395019,Burkholderia multivorans (strain ATCC 17616 / 249),Burkholderia multivorans (strain ATCC 17616 / 249),lysS,508,PTHR42918:SF15,"LYSINE--TRNA LIGASE, CHLOROPLASTIC_MITOCHONDRIAL",True
A9B5T5,Lysine--tRNA ligase,protein,316274,Herpetosiphon aurantiacus (strain ATCC 23779 / DSM 785 / 114-95),Herpetosiphon aurantiacus (strain ATCC 23779 / DSM 785 / 114-95),lysS,492,PTHR42918:SF15,"LYSINE--TRNA LIGASE, CHLOROPLASTIC_MITOCHONDRIAL",True
A9BD62,Lysine--tRNA ligase,protein,93059,Prochlorococcus marinus (strain MIT 9211),Prochlorococcus marinus (strain MIT 9211),lysS,503,PTHR42918:SF15,"LYSINE--TRNA LIGASE, CHLOROPLASTIC_MITOCHONDRIAL",True
A9CS74,"Probable lysine--tRNA ligase, cytoplasmic",protein,481877,Enterocytozoon bieneusi (strain H348),Enterocytozoon bieneusi (strain H348) (Microsporidian parasite),EBI_25548,518,PTHR42918:SF9,LYSINE--TRNA LIGASE,True
A9IQY2,Lysine--tRNA ligase,protein,340100,Bordetella petrii (strain ATCC BAA-461 / DSM 12804 / CCUG 43448 / CIP 107267 / Se-1111R),Bordetella petrii (strain ATCC BAA-461 / DSM 12804 / CCUG 43448 / CIP 107267 / Se-1111R),lysS,506,PTHR42918:SF15,"LYSINE--TRNA LIGASE, CHLOROPLASTIC_MITOCHONDRIAL",True
A9KEG1,Lysine--tRNA ligase,protein,434922,Coxiella burnetii (strain Dugway 5J108-111),Coxiella burnetii (strain Dugway 5J108-111),lysS,498,PTHR42918:SF15,"LYSINE--TRNA LIGASE, CHLOROPLASTIC_MITOCHONDRIAL",True
A9L1I0,Lysine--tRNA ligase,protein,399599,Shewanella baltica (strain OS195),Shewanella baltica (strain OS195),lysS,500,PTHR42918:SF15,"LYSINE--TRNA LIGASE, CHLOROPLASTIC_MITOCHONDRIAL",True
A9MFQ6,Elongation factor P--(R)-beta-lysine ligase,protein,41514,Salmonella arizonae (strain ATCC BAA-731 / CDC346-86 / RSK2980),Salmonella arizonae (strain ATCC BAA-731 / CDC346-86 / RSK2980),epmA,325,PTHR42918:SF6,ELONGATION FACTOR P--(R)-BETA-LYSINE LIGASE,True
A9MRI4,Lysine--tRNA ligase,protein,41514,Salmonella arizonae (strain ATCC BAA-731 / CDC346-86 / RSK2980),Salmonella arizonae (strain ATCC BAA-731 / CDC346-86 / RSK2980),lysS,505,PTHR42918:SF15,"LYSINE--TRNA LIGASE, CHLOROPLASTIC_MITOCHONDRIAL",True
A9N3L6,Lysine--tRNA ligase,protein,1016998,Salmonella paratyphi B (strain ATCC BAA-1250 / SPB7),Salmonella paratyphi B (strain ATCC BAA-1250 / SPB7),lysS,505,PTHR42918:SF15,"LYSINE--TRNA LIGASE, CHLOROPLASTIC_MITOCHONDRIAL",True
A9N413,Elongation factor P--(R)-beta-lysine ligase,protein,1016998,Salmonella paratyphi B (strain ATCC BAA-1250 / SPB7),Salmonella paratyphi B (strain ATCC BAA-1250 / SPB7),epmA,325,PTHR42918:SF6,ELONGATION FACTOR P--(R)-BETA-LYSINE LIGASE,True
A9NBP7,Lysine--tRNA ligase,protein,360115,Coxiella burnetii (strain RSA 331 / Henzerling II),Coxiella burnetii (strain RSA 331 / Henzerling II),lysS,498,PTHR42918:SF15,"LYSINE--TRNA LIGASE, CHLOROPLASTIC_MITOCHONDRIAL",True
A9QYP2,Elongation factor P--(R)-beta-lysine ligase,protein,349746,Yersinia pestis bv. Antiqua (strain Angola),Yersinia pestis bv. Antiqua (strain Angola),epmA,325,PTHR42918:SF6,ELONGATION FACTOR P--(R)-BETA-LYSINE LIGASE,True
A9R4M4,Lysine--tRNA ligase,protein,349746,Yersinia pestis bv. Antiqua (strain Angola),Yersinia pestis bv. Antiqua (strain Angola),lysS,505,PTHR42918:SF15,"LYSINE--TRNA LIGASE, CHLOROPLASTIC_MITOCHONDRIAL",True
A9VN90,Lysine--tRNA ligase,protein,315730,Bacillus mycoides (strain KBAB4),Bacillus mycoides (strain KBAB4),lysS,499,PTHR42918:SF15,"LYSINE--TRNA LIGASE, CHLOROPLASTIC_MITOCHONDRIAL",True
A9WK04,Lysine--tRNA ligase,protein,324602,Chloroflexus aurantiacus (strain ATCC 29366 / DSM 635 / J-10-fl),Chloroflexus aurantiacus (strain ATCC 29366 / DSM 635 / J-10-fl),lysS,491,PTHR42918:SF15,"LYSINE--TRNA LIGASE, CHLOROPLASTIC_MITOCHONDRIAL",True
B0B907,Lysine--tRNA ligase,protein,471472,Chlamydia trachomatis serovar L2 (strain ATCC VR-902B / DSM 19102 / 434/Bu),Chlamydia trachomatis serovar L2 (strain ATCC VR-902B / DSM 19102 / 434/Bu),lysS,526,PTHR42918:SF15,"LYSINE--TRNA LIGASE, CHLOROPLASTIC_MITOCHONDRIAL",True
B0BAN6,Lysine--tRNA ligase,protein,471473,Chlamydia trachomatis serovar L2b (strain UCH-1/proctitis),Chlamydia trachomatis serovar L2b (strain UCH-1/proctitis),lysS,526,PTHR42918:SF15,"LYSINE--TRNA LIGASE, CHLOROPLASTIC_MITOCHONDRIAL",True
B0BP90,Lysine--tRNA ligase,protein,434271,Actinobacillus pleuropneumoniae serotype 3 (strain JL03),Actinobacillus pleuropneumoniae serotype 3 (strain JL03),lysS,500,PTHR42918:SF15,"LYSINE--TRNA LIGASE, CHLOROPLASTIC_MITOCHONDRIAL",True
B0K5C0,Lysine--tRNA ligase,protein,399726,Thermoanaerobacter sp. (strain X514),Thermoanaerobacter sp. (strain X514),lysS,499,PTHR42918:SF15,"LYSINE--TRNA LIGASE, CHLOROPLASTIC_MITOCHONDRIAL",True
B0KCE4,Lysine--tRNA ligase,protein,340099,Thermoanaerobacter pseudethanolicus (strain ATCC 33223 / 39E),Thermoanaerobacter pseudethanolicus (strain ATCC 33223 / 39E),lysS,499,PTHR42918:SF15,"LYSINE--TRNA LIGASE, CHLOROPLASTIC_MITOCHONDRIAL",True
B0KRL5,Lysine--tRNA ligase,protein,76869,Pseudomonas putida (strain GB-1),Pseudomonas putida (strain GB-1),lysS,500,PTHR42918:SF15,"LYSINE--TRNA LIGASE, CHLOROPLASTIC_MITOCHONDRIAL",True
B0RSQ8,Lysine--tRNA ligase,protein,509169,Xanthomonas campestris pv. campestris (strain B100),Xanthomonas campestris pv. campestris (strain B100),lysS,505,PTHR42918:SF15,"LYSINE--TRNA LIGASE, CHLOROPLASTIC_MITOCHONDRIAL",True
B0TTP2,Lysine--tRNA ligase,protein,458817,Shewanella halifaxensis (strain HAW-EB4),Shewanella halifaxensis (strain HAW-EB4),lysS,501,PTHR42918:SF15,"LYSINE--TRNA LIGASE, CHLOROPLASTIC_MITOCHONDRIAL",True
B0U572,Lysine--tRNA ligase,protein,405440,Xylella fastidiosa (strain M12),Xylella fastidiosa (strain M12),lysS,506,PTHR42918:SF15,"LYSINE--TRNA LIGASE, CHLOROPLASTIC_MITOCHONDRIAL",True
B0URW9,Lysine--tRNA ligase,protein,228400,Histophilus somni (strain 2336),Histophilus somni (strain 2336),lysS,502,PTHR42918:SF15,"LYSINE--TRNA LIGASE, CHLOROPLASTIC_MITOCHONDRIAL",True
B0USM2,Elongation factor P--(R)-beta-lysine ligase,protein,228400,Histophilus somni (strain 2336),Histophilus somni (strain 2336),epmA,323,PTHR42918:SF6,ELONGATION FACTOR P--(R)-BETA-LYSINE LIGASE,True
B0V9L5,Lysine--tRNA ligase,protein,509173,Acinetobacter baumannii (strain AYE),Acinetobacter baumannii (strain AYE),lysS,509,PTHR42918:SF15,"LYSINE--TRNA LIGASE, CHLOROPLASTIC_MITOCHONDRIAL",True
B0VSE0,Lysine--tRNA ligase,protein,509170,Acinetobacter baumannii (strain SDF),Acinetobacter baumannii (strain SDF),lysS,509,PTHR42918:SF15,"LYSINE--TRNA LIGASE, CHLOROPLASTIC_MITOCHONDRIAL",True
B1AI47,Lysine--tRNA ligase,protein,505682,Ureaplasma parvum serovar 3 (strain ATCC 27815 / 27 / NCTC 11736),Ureaplasma parvum serovar 3 (strain ATCC 27815 / 27 / NCTC 11736),lysS,493,PTHR42918:SF15,"LYSINE--TRNA LIGASE, CHLOROPLASTIC_MITOCHONDRIAL",True
B1HSY5,Lysine--tRNA ligase,protein,444177,Lysinibacillus sphaericus (strain C3-41),Lysinibacillus sphaericus (strain C3-41),lysS,500,PTHR42918:SF15,"LYSINE--TRNA LIGASE, CHLOROPLASTIC_MITOCHONDRIAL",True
B1IAN6,Lysine--tRNA ligase,protein,487214,Streptococcus pneumoniae (strain Hungary19A-6),Streptococcus pneumoniae (strain Hungary19A-6),lysS,496,PTHR42918:SF15,"LYSINE--TRNA LIGASE, CHLOROPLASTIC_MITOCHONDRIAL",True
B1IGJ2,Lysine--tRNA ligase,protein,498213,Clostridium botulinum (strain Okra / Type B1),Clostridium botulinum (strain Okra / Type B1),lysS,504,PTHR42918:SF15,"LYSINE--TRNA LIGASE, CHLOROPLASTIC_MITOCHONDRIAL",True
B1ITP1,Elongation factor P--(R)-beta-lysine ligase,protein,481805,Escherichia coli (strain ATCC 8739 / DSM 1576 / NBRC 3972 / NCIMB 8545 / WDCM 00012 / Crooks),Escherichia coli (strain ATCC 8739 / DSM 1576 / NBRC 3972 / NCIMB 8545 / WDCM 00012 / Crooks),epmA,325,PTHR42918:SF6,ELONGATION FACTOR P--(R)-BETA-LYSINE LIGASE,True
B1JD39,Lysine--tRNA ligase,protein,390235,Pseudomonas putida (strain W619),Pseudomonas putida (strain W619),lysS,500,PTHR42918:SF15,"LYSINE--TRNA LIGASE, CHLOROPLASTIC_MITOCHONDRIAL",True
B1JMQ1,Elongation factor P--(R)-beta-lysine ligase,protein,502800,Yersinia pseudotuberculosis serotype O:3 (strain YPIII),Yersinia pseudotuberculosis serotype O:3 (strain YPIII),epmA,325,PTHR42918:SF6,ELONGATION FACTOR P--(R)-BETA-LYSINE LIGASE,True
B1JPH6,Lysine--tRNA ligase,protein,502800,Yersinia pseudotuberculosis serotype O:3 (strain YPIII),Yersinia pseudotuberculosis serotype O:3 (strain YPIII),lysS,505,PTHR42918:SF15,"LYSINE--TRNA LIGASE, CHLOROPLASTIC_MITOCHONDRIAL",True
B1JUZ7,Lysine--tRNA ligase,protein,406425,Burkholderia orbicola (strain MC0-3),Burkholderia orbicola (strain MC0-3),lysS,508,PTHR42918:SF15,"LYSINE--TRNA LIGASE, CHLOROPLASTIC_MITOCHONDRIAL",True
B1KFR7,Lysine--tRNA ligase,protein,392500,Shewanella woodyi (strain ATCC 51908 / MS32),Shewanella woodyi (strain ATCC 51908 / MS32),lysS,501,PTHR42918:SF15,"LYSINE--TRNA LIGASE, CHLOROPLASTIC_MITOCHONDRIAL",True
B1KTC1,Lysine--tRNA ligase,protein,498214,Clostridium botulinum (strain Loch Maree / Type A3),Clostridium botulinum (strain Loch Maree / Type A3),lysS,504,PTHR42918:SF15,"LYSINE--TRNA LIGASE, CHLOROPLASTIC_MITOCHONDRIAL",True
B1LAX6,Lysine--tRNA ligase,protein,126740,Thermotoga sp. (strain RQ2),Thermotoga sp. (strain RQ2),lysS,502,PTHR42918:SF15,"LYSINE--TRNA LIGASE, CHLOROPLASTIC_MITOCHONDRIAL",True
B1LQH8,Elongation factor P--(R)-beta-lysine ligase,protein,439855,Escherichia coli (strain SMS-3-5 / SECEC),Escherichia coli (strain SMS-3-5 / SECEC),epmA,325,PTHR42918:SF6,ELONGATION FACTOR P--(R)-BETA-LYSINE LIGASE,True
B1MAX9,Lysylphosphatidylglycerol biosynthesis bifunctional protein LysX,protein,561007,Mycobacteroides abscessus (strain ATCC 19977 / DSM 44196 / CCUG 20993 / CIP 104536 / JCM 13569 / NCTC 13031 / TMC 1543 / L948),Mycobacteroides abscessus (strain ATCC 19977 / DSM 44196 / CCUG 20993 / CIP 104536 / JCM 13569 / NCTC 13031 / TMC 1543 / L948),lysX,1110,PTHR42918:SF15,"LYSINE--TRNA LIGASE, CHLOROPLASTIC_MITOCHONDRIAL",True
B1MVJ0,Lysine--tRNA ligase,protein,349519,Leuconostoc citreum (strain KM20),Leuconostoc citreum (strain KM20),lysS,493,PTHR42918:SF15,"LYSINE--TRNA LIGASE, CHLOROPLASTIC_MITOCHONDRIAL",True
B1VA97,Lysine--tRNA ligase,protein,59748,Phytoplasma australiense,Phytoplasma australiense,lysS,497,PTHR42918:SF15,"LYSINE--TRNA LIGASE, CHLOROPLASTIC_MITOCHONDRIAL",True
B1XDQ9,Elongation factor P--(R)-beta-lysine ligase,protein,316385,Escherichia coli (strain K12 / DH10B),Escherichia coli (strain K12 / DH10B),epmA,325,PTHR42918:SF6,ELONGATION FACTOR P--(R)-BETA-LYSINE LIGASE,True
B1XTS4,Lysine--tRNA ligase,protein,452638,Polynucleobacter necessarius subsp. necessarius (strain STIR1),Polynucleobacter necessarius subsp. necessarius (strain STIR1),lysS,514,PTHR42918:SF15,"LYSINE--TRNA LIGASE, CHLOROPLASTIC_MITOCHONDRIAL",True
B1YT20,Lysine--tRNA ligase,protein,398577,Burkholderia ambifaria (strain MC40-6),Burkholderia ambifaria (strain MC40-6),lysS,508,PTHR42918:SF15,"LYSINE--TRNA LIGASE, CHLOROPLASTIC_MITOCHONDRIAL",True
B2GA78,Lysine--tRNA ligase,protein,334390,Limosilactobacillus fermentum (strain NBRC 3956 / LMG 18251),Limosilactobacillus fermentum (strain NBRC 3956 / LMG 18251),lysS,497,PTHR42918:SF15,"LYSINE--TRNA LIGASE, CHLOROPLASTIC_MITOCHONDRIAL",True
B2HR11,Lysylphosphatidylglycerol biosynthesis bifunctional protein LysX,protein,216594,Mycobacterium marinum (strain ATCC BAA-535 / M),Mycobacterium marinum (strain ATCC BAA-535 / M),lysX,1105,PTHR42918:SF15,"LYSINE--TRNA LIGASE, CHLOROPLASTIC_MITOCHONDRIAL",True
B2I848,Lysine--tRNA ligase,protein,405441,Xylella fastidiosa (strain M23),Xylella fastidiosa (strain M23),lysS,506,PTHR42918:SF15,"LYSINE--TRNA LIGASE, CHLOROPLASTIC_MITOCHONDRIAL",True
B2IN95,Lysine--tRNA ligase,protein,516950,Streptococcus pneumoniae (strain CGSP14),Streptococcus pneumoniae (strain CGSP14),lysS,496,PTHR42918:SF15,"LYSINE--TRNA LIGASE, CHLOROPLASTIC_MITOCHONDRIAL",True
B2J384,Lysine--tRNA ligase,protein,63737,Nostoc punctiforme (strain ATCC 29133 / PCC 73102),Nostoc punctiforme (strain ATCC 29133 / PCC 73102),lysS,561,PTHR42918:SF15,"LYSINE--TRNA LIGASE, CHLOROPLASTIC_MITOCHONDRIAL",True
B2JIY1,Lysine--tRNA ligase,protein,391038,Paraburkholderia phymatum (strain DSM 17167 / CIP 108236 / LMG 21445 / STM815),Paraburkholderia phymatum (strain DSM 17167 / CIP 108236 / LMG 21445 / STM815),lysS,512,PTHR42918:SF15,"LYSINE--TRNA LIGASE, CHLOROPLASTIC_MITOCHONDRIAL",True
B2K0N6,Lysine--tRNA ligase,protein,502801,Yersinia pseudotuberculosis serotype IB (strain PB1/+),Yersinia pseudotuberculosis serotype IB (strain PB1/+),lysS,505,PTHR42918:SF15,"LYSINE--TRNA LIGASE, CHLOROPLASTIC_MITOCHONDRIAL",True
B2K1Z3,Elongation factor P--(R)-beta-lysine ligase,protein,502801,Yersinia pseudotuberculosis serotype IB (strain PB1/+),Yersinia pseudotuberculosis serotype IB (strain PB1/+),epmA,325,PTHR42918:SF6,ELONGATION FACTOR P--(R)-BETA-LYSINE LIGASE,True
B2RJY1,Lysine--tRNA ligase,protein,431947,Porphyromonas gingivalis (strain ATCC 33277 / DSM 20709 / CIP 103683 / JCM 12257 / NCTC 11834 / 2561),Porphyromonas gingivalis (strain ATCC 33277 / DSM 20709 / CIP 103683 / JCM 12257 / NCTC 11834 / 2561),lysS,578,PTHR42918:SF15,"LYSINE--TRNA LIGASE, CHLOROPLASTIC_MITOCHONDRIAL",True
B2SV97,Lysine--tRNA ligase,protein,360094,Xanthomonas oryzae pv. oryzae (strain PXO99A),Xanthomonas oryzae pv. oryzae (strain PXO99A),lysS,505,PTHR42918:SF15,"LYSINE--TRNA LIGASE, CHLOROPLASTIC_MITOCHONDRIAL",True
B2SXV7,Lysine--tRNA ligase,protein,398527,Paraburkholderia phytofirmans (strain DSM 17436 / LMG 22146 / PsJN),Paraburkholderia phytofirmans (strain DSM 17436 / LMG 22146 / PsJN),lysS,518,PTHR42918:SF15,"LYSINE--TRNA LIGASE, CHLOROPLASTIC_MITOCHONDRIAL",True
B2TY33,Elongation factor P--(R)-beta-lysine ligase,protein,344609,Shigella boydii serotype 18 (strain CDC 3083-94 / BS512),Shigella boydii serotype 18 (strain CDC 3083-94 / BS512),epmA,325,PTHR42918:SF6,ELONGATION FACTOR P--(R)-BETA-LYSINE LIGASE,True
B2U0Q7,Lysine--tRNA ligase,protein,344609,Shigella boydii serotype 18 (strain CDC 3083-94 / BS512),Shigella boydii serotype 18 (strain CDC 3083-94 / BS512),lysS,505,PTHR42918:SF15,"LYSINE--TRNA LIGASE, CHLOROPLASTIC_MITOCHONDRIAL",True
B2U8U9,Lysine--tRNA ligase,protein,402626,Ralstonia pickettii (strain 12J),Ralstonia pickettii (strain 12J),lysS,514,PTHR42918:SF15,"LYSINE--TRNA LIGASE, CHLOROPLASTIC_MITOCHONDRIAL",True
B2US13,Lysine--tRNA ligase,protein,512562,Helicobacter pylori (strain Shi470),Helicobacter pylori (strain Shi470),lysS,501,PTHR42918:SF15,"LYSINE--TRNA LIGASE, CHLOROPLASTIC_MITOCHONDRIAL",True
B2VCV6,Elongation factor P--(R)-beta-lysine ligase,protein,465817,Erwinia tasmaniensis (strain DSM 17950 / CFBP 7177 / CIP 109463 / NCPPB 4357 / Et1/99),Erwinia tasmaniensis (strain DSM 17950 / CFBP 7177 / CIP 109463 / NCPPB 4357 / Et1/99),epmA,325,PTHR42918:SF6,ELONGATION FACTOR P--(R)-BETA-LYSINE LIGASE,True
B2VF45,Lysine--tRNA ligase,protein,465817,Erwinia tasmaniensis (strain DSM 17950 / CFBP 7177 / CIP 109463 / NCPPB 4357 / Et1/99),Erwinia tasmaniensis (strain DSM 17950 / CFBP 7177 / CIP 109463 / NCPPB 4357 / Et1/99),lysS,506,PTHR42918:SF15,"LYSINE--TRNA LIGASE, CHLOROPLASTIC_MITOCHONDRIAL",True
B3H1E8,Lysine--tRNA ligase,protein,537457,Actinobacillus pleuropneumoniae serotype 7 (strain AP76),Actinobacillus pleuropneumoniae serotype 7 (strain AP76),lysS,500,PTHR42918:SF15,"LYSINE--TRNA LIGASE, CHLOROPLASTIC_MITOCHONDRIAL",True
B3PNH7,Lysine--tRNA ligase,protein,243272,Metamycoplasma arthritidis (strain 158L3-1),Metamycoplasma arthritidis (strain 158L3-1),lysS,490,PTHR42918:SF15,"LYSINE--TRNA LIGASE, CHLOROPLASTIC_MITOCHONDRIAL",True
B3Q0S4,Lysine--tRNA ligase,protein,491916,Rhizobium etli (strain CIAT 652),Rhizobium etli (strain CIAT 652),lysS,498,PTHR42918:SF15,"LYSINE--TRNA LIGASE, CHLOROPLASTIC_MITOCHONDRIAL",True
B3QMN9,Lysine--tRNA ligase,protein,517417,Chlorobaculum parvum (strain DSM 263 / NCIMB 8327),Chlorobaculum parvum (strain DSM 263 / NCIMB 8327),lysS,511,PTHR42918:SF15,"LYSINE--TRNA LIGASE, CHLOROPLASTIC_MITOCHONDRIAL",True
B3R478,Lysine--tRNA ligase,protein,977880,Cupriavidus taiwanensis (strain DSM 17343 / BCRC 17206 / CCUG 44338 / CIP 107171 / LMG 19424 / R1),Cupriavidus taiwanensis (strain DSM 17343 / BCRC 17206 / CCUG 44338 / CIP 107171 / LMG 19424 / R1),lysS,517,PTHR42918:SF15,"LYSINE--TRNA LIGASE, CHLOROPLASTIC_MITOCHONDRIAL",True
B4EDB2,Lysine--tRNA ligase,protein,216591,Burkholderia cenocepacia (strain ATCC BAA-245 / DSM 16553 / LMG 16656 / NCTC 13227 / J2315 / CF5610),Burkholderia cenocepacia (strain ATCC BAA-245 / DSM 16553 / LMG 16656 / NCTC 13227 / J2315 / CF5610),lysS,508,PTHR42918:SF15,"LYSINE--TRNA LIGASE, CHLOROPLASTIC_MITOCHONDRIAL",True
B4EWY8,Elongation factor P--(R)-beta-lysine ligase,protein,529507,Proteus mirabilis (strain HI4320),Proteus mirabilis (strain HI4320),epmA,325,PTHR42918:SF6,ELONGATION FACTOR P--(R)-BETA-LYSINE LIGASE,True
B4F0M6,Lysine--tRNA ligase,protein,529507,Proteus mirabilis (strain HI4320),Proteus mirabilis (strain HI4320),lysS,504,PTHR42918:SF15,"LYSINE--TRNA LIGASE, CHLOROPLASTIC_MITOCHONDRIAL",True
B4RP57,Lysine--tRNA ligase,protein,521006,Neisseria gonorrhoeae (strain NCCP11945),Neisseria gonorrhoeae (strain NCCP11945),lysS,503,PTHR42918:SF15,"LYSINE--TRNA LIGASE, CHLOROPLASTIC_MITOCHONDRIAL",True
B4SB22,Lysine--tRNA ligase,protein,324925,Pelodictyon phaeoclathratiforme (strain DSM 5477 / BU-1),Pelodictyon phaeoclathratiforme (strain DSM 5477 / BU-1),lysS,511,PTHR42918:SF15,"LYSINE--TRNA LIGASE, CHLOROPLASTIC_MITOCHONDRIAL",True
B4T2Q3,Elongation factor P--(R)-beta-lysine ligase,protein,423368,Salmonella newport (strain SL254),Salmonella newport (strain SL254),epmA,325,PTHR42918:SF6,ELONGATION FACTOR P--(R)-BETA-LYSINE LIGASE,True
B4T535,Lysine--tRNA ligase,protein,423368,Salmonella newport (strain SL254),Salmonella newport (strain SL254),lysS,505,PTHR42918:SF15,"LYSINE--TRNA LIGASE, CHLOROPLASTIC_MITOCHONDRIAL",True
B4TF92,Elongation factor P--(R)-beta-lysine ligase,protein,454169,Salmonella heidelberg (strain SL476),Salmonella heidelberg (strain SL476),epmA,325,PTHR42918:SF6,ELONGATION FACTOR P--(R)-BETA-LYSINE LIGASE,True
B4TGW0,Lysine--tRNA ligase,protein,454169,Salmonella heidelberg (strain SL476),Salmonella heidelberg (strain SL476),lysS,505,PTHR42918:SF15,"LYSINE--TRNA LIGASE, CHLOROPLASTIC_MITOCHONDRIAL",True
B4TSD9,Elongation factor P--(R)-beta-lysine ligase,protein,439843,Salmonella schwarzengrund (strain CVM19633),Salmonella schwarzengrund (strain CVM19633),epmA,325,PTHR42918:SF6,ELONGATION FACTOR P--(R)-BETA-LYSINE LIGASE,True
B4TUQ8,Lysine--tRNA ligase,protein,439843,Salmonella schwarzengrund (strain CVM19633),Salmonella schwarzengrund (strain CVM19633),lysS,505,PTHR42918:SF15,"LYSINE--TRNA LIGASE, CHLOROPLASTIC_MITOCHONDRIAL",True
B4UGU5,Lysine--tRNA ligase,protein,447217,Anaeromyxobacter sp. (strain K),Anaeromyxobacter sp. (strain K),lysS,513,PTHR42918:SF15,"LYSINE--TRNA LIGASE, CHLOROPLASTIC_MITOCHONDRIAL",True
B5BFK5,Lysine--tRNA ligase,protein,554290,Salmonella paratyphi A (strain AKU_12601),Salmonella paratyphi A (strain AKU_12601),lysS,505,PTHR42918:SF15,"LYSINE--TRNA LIGASE, CHLOROPLASTIC_MITOCHONDRIAL",True
B5BKG8,Elongation factor P--(R)-beta-lysine ligase,protein,554290,Salmonella paratyphi A (strain AKU_12601),Salmonella paratyphi A (strain AKU_12601),epmA,325,PTHR42918:SF6,ELONGATION FACTOR P--(R)-BETA-LYSINE LIGASE,True
B5E317,Lysine--tRNA ligase,protein,512566,Streptococcus pneumoniae serotype 19F (strain G54),Streptococcus pneumoniae serotype 19F (strain G54),lysS,496,PTHR42918:SF15,"LYSINE--TRNA LIGASE, CHLOROPLASTIC_MITOCHONDRIAL",True
B5F2M2,Elongation factor P--(R)-beta-lysine ligase,protein,454166,Salmonella agona (strain SL483),Salmonella agona (strain SL483),epmA,325,PTHR42918:SF6,ELONGATION FACTOR P--(R)-BETA-LYSINE LIGASE,True
B5F5G4,Lysine--tRNA ligase,protein,454166,Salmonella agona (strain SL483),Salmonella agona (strain SL483),lysS,505,PTHR42918:SF15,"LYSINE--TRNA LIGASE, CHLOROPLASTIC_MITOCHONDRIAL",True
B5F9U5,Lysine--tRNA ligase,protein,388396,Aliivibrio fischeri (strain MJ11),Aliivibrio fischeri (strain MJ11),lysS,501,PTHR42918:SF15,"LYSINE--TRNA LIGASE, CHLOROPLASTIC_MITOCHONDRIAL",True
B5FRL4,Elongation factor P--(R)-beta-lysine ligase,protein,439851,Salmonella dublin (strain CT_02021853),Salmonella dublin (strain CT_02021853),epmA,325,PTHR42918:SF6,ELONGATION FACTOR P--(R)-BETA-LYSINE LIGASE,True
B5FUF3,Lysine--tRNA ligase,protein,439851,Salmonella dublin (strain CT_02021853),Salmonella dublin (strain CT_02021853),lysS,505,PTHR42918:SF15,"LYSINE--TRNA LIGASE, CHLOROPLASTIC_MITOCHONDRIAL",True
B5QXG7,Lysine--tRNA ligase,protein,550537,Salmonella enteritidis PT4 (strain P125109),Salmonella enteritidis PT4 (strain P125109),lysS,505,PTHR42918:SF15,"LYSINE--TRNA LIGASE, CHLOROPLASTIC_MITOCHONDRIAL",True
B5R019,Elongation factor P--(R)-beta-lysine ligase,protein,550537,Salmonella enteritidis PT4 (strain P125109),Salmonella enteritidis PT4 (strain P125109),epmA,325,PTHR42918:SF6,ELONGATION FACTOR P--(R)-BETA-LYSINE LIGASE,True
B5R9A5,Elongation factor P--(R)-beta-lysine ligase,protein,550538,Salmonella gallinarum (strain 287/91 / NCTC 13346),Salmonella gallinarum (strain 287/91 / NCTC 13346),epmA,325,PTHR42918:SF6,ELONGATION FACTOR P--(R)-BETA-LYSINE LIGASE,True
B5RE01,Lysine--tRNA ligase,protein,550538,Salmonella gallinarum (strain 287/91 / NCTC 13346),Salmonella gallinarum (strain 287/91 / NCTC 13346),lysS,505,PTHR42918:SF15,"LYSINE--TRNA LIGASE, CHLOROPLASTIC_MITOCHONDRIAL",True
B5XKG9,Lysine--tRNA ligase,protein,471876,Streptococcus pyogenes serotype M49 (strain NZ131),Streptococcus pyogenes serotype M49 (strain NZ131),lysS,497,PTHR42918:SF15,"LYSINE--TRNA LIGASE, CHLOROPLASTIC_MITOCHONDRIAL",True
B5Y345,Elongation factor P--(R)-beta-lysine ligase,protein,507522,Klebsiella variicola (strain 342),Klebsiella variicola (strain 342),epmA,325,PTHR42918:SF6,ELONGATION FACTOR P--(R)-BETA-LYSINE LIGASE,True
B5Z2G6,Elongation factor P--(R)-beta-lysine ligase,protein,444450,Escherichia coli O157:H7 (strain EC4115 / EHEC),Escherichia coli O157:H7 (strain EC4115 / EHEC),epmA,325,PTHR42918:SF6,ELONGATION FACTOR P--(R)-BETA-LYSINE LIGASE,True
B5Z9V6,Lysine--tRNA ligase,protein,563041,Helicobacter pylori (strain G27),Helicobacter pylori (strain G27),lysS,501,PTHR42918:SF15,"LYSINE--TRNA LIGASE, CHLOROPLASTIC_MITOCHONDRIAL",True
B5ZAP2,Lysine--tRNA ligase,protein,565575,Ureaplasma urealyticum serovar 10 (strain ATCC 33699 / Western),Ureaplasma urealyticum serovar 10 (strain ATCC 33699 / Western),lysS,493,PTHR42918:SF15,"LYSINE--TRNA LIGASE, CHLOROPLASTIC_MITOCHONDRIAL",True
B5ZQW5,Lysine--tRNA ligase,protein,395492,Rhizobium leguminosarum bv. trifolii (strain WSM2304),Rhizobium leguminosarum bv. trifolii (strain WSM2304),lysS,497,PTHR42918:SF15,"LYSINE--TRNA LIGASE, CHLOROPLASTIC_MITOCHONDRIAL",True
B6EMX2,Lysine--tRNA ligase,protein,316275,Aliivibrio salmonicida (strain LFI1238),Aliivibrio salmonicida (strain LFI1238),lysS,501,PTHR42918:SF15,"LYSINE--TRNA LIGASE, CHLOROPLASTIC_MITOCHONDRIAL",True
B6I264,Elongation factor P--(R)-beta-lysine ligase,protein,409438,Escherichia coli (strain SE11),Escherichia coli (strain SE11),epmA,325,PTHR42918:SF6,ELONGATION FACTOR P--(R)-BETA-LYSINE LIGASE,True
B6J1P6,Lysine--tRNA ligase,protein,434923,Coxiella burnetii (strain CbuG_Q212),Coxiella burnetii (strain CbuG_Q212),lysS,498,PTHR42918:SF15,"LYSINE--TRNA LIGASE, CHLOROPLASTIC_MITOCHONDRIAL",True
B6J8K2,Lysine--tRNA ligase,protein,434924,Coxiella burnetii (strain CbuK_Q154),Coxiella burnetii (strain CbuK_Q154),lysS,498,PTHR42918:SF15,"LYSINE--TRNA LIGASE, CHLOROPLASTIC_MITOCHONDRIAL",True
B6JPT1,Lysine--tRNA ligase,protein,570508,Helicobacter pylori (strain P12),Helicobacter pylori (strain P12),lysS,501,PTHR42918:SF15,"LYSINE--TRNA LIGASE, CHLOROPLASTIC_MITOCHONDRIAL",True
B6YRR7,Lysine--tRNA ligase,protein,511995,Azobacteroides pseudotrichonymphae genomovar. CFP2,Azobacteroides pseudotrichonymphae genomovar. CFP2,lysS,500,PTHR42918:SF15,"LYSINE--TRNA LIGASE, CHLOROPLASTIC_MITOCHONDRIAL",True
B7GXW0,Lysine--tRNA ligase,protein,557600,Acinetobacter baumannii (strain AB307-0294),Acinetobacter baumannii (strain AB307-0294),lysS,509,PTHR42918:SF15,"LYSINE--TRNA LIGASE, CHLOROPLASTIC_MITOCHONDRIAL",True
B7HJ16,Lysine--tRNA ligase,protein,405532,Bacillus cereus (strain B4264),Bacillus cereus (strain B4264),lysS,499,PTHR42918:SF15,"LYSINE--TRNA LIGASE, CHLOROPLASTIC_MITOCHONDRIAL",True
B7HPY8,Lysine--tRNA ligase,protein,405534,Bacillus cereus (strain AH187),Bacillus cereus (strain AH187),lysS,499,PTHR42918:SF15,"LYSINE--TRNA LIGASE, CHLOROPLASTIC_MITOCHONDRIAL",True
