id,name,entry_type,source_tax_id,source_tax_name,full_tax_name,gene,length,subfamily,subfamily_name,in_alphafold
Q9HJ26,DNA ligase,protein,273075,Thermoplasma acidophilum (strain ATCC 25905 / DSM 1728 / JCM 9062 / NBRC 15155 / AMRC-C165),Thermoplasma acidophilum (strain ATCC 25905 / DSM 1728 / JCM 9062 / NBRC 15155 / AMRC-C165),lig,588,PTHR45674:SF4,DNA LIGASE 1,True
Q9HR35,DNA ligase,protein,64091,Halobacterium salinarum (strain ATCC 700922 / JCM 11081 / NRC-1),Halobacterium salinarum (strain ATCC 700922 / JCM 11081 / NRC-1),lig,561,PTHR45674:SF7,DNA LIGASE,True
Q9JHY8,DNA ligase 1,protein,10116,Rattus norvegicus,Rattus norvegicus (Rat),Lig1,918,PTHR45674:SF4,DNA LIGASE 1,True
Q9P9K9,DNA ligase,protein,523848,Saccharolobus shibatae (strain ATCC 51178 / DSM 5389 / JCM 8931 / NBRC 15437 / B12),Saccharolobus shibatae (strain ATCC 51178 / DSM 5389 / JCM 8931 / NBRC 15437 / B12),lig,601,PTHR45674:SF4,DNA LIGASE 1,True
Q9W1H4,DNA ligase 1,protein,7227,Drosophila melanogaster,Drosophila melanogaster (Fruit fly),DNAlig1,747,PTHR45674:SF4,DNA LIGASE 1,True
Q9YD18,DNA ligase,protein,272557,Aeropyrum pernix (strain ATCC 700893 / DSM 11879 / JCM 9820 / NBRC 100138 / K1),Aeropyrum pernix (strain ATCC 700893 / DSM 11879 / JCM 9820 / NBRC 100138 / K1),lig,602,PTHR45674:SF4,DNA LIGASE 1,True
Q9YMV2,DNA ligase,protein,10449,Lymantria dispar multicapsid nuclear polyhedrosis virus,Lymantria dispar multicapsid nuclear polyhedrosis virus (LdMNPV),LIG,548,PTHR45674:SF9,DNA LIGASE 3,True
