id,name,entry_type,source_tax_id,source_tax_name,full_tax_name,gene,length,subfamily,subfamily_name,in_alphafold
A0A7H0DNE6,DNA ligase,protein,10244,Monkeypox virus,Monkeypox virus (MPXV),OPG180,559,PTHR45674:SF9,DNA LIGASE 3,False
A0B7F9,DNA ligase,protein,349307,Methanothrix thermoacetophila (strain DSM 6194 / JCM 14653 / NBRC 101360 / PT),Methanothrix thermoacetophila (strain DSM 6194 / JCM 14653 / NBRC 101360 / PT),lig,552,PTHR45674:SF7,DNA LIGASE,True
A0PTC0,Probable DNA ligase,protein,362242,Mycobacterium ulcerans (strain Agy99),Mycobacterium ulcerans (strain Agy99),lig,513,PTHR45674:SF13,DNA LIGASE-RELATED,True
A0QJL0,Probable DNA ligase,protein,243243,Mycobacterium avium (strain 104),Mycobacterium avium (strain 104),lig,526,PTHR45674:SF13,DNA LIGASE-RELATED,True
A0QUP1,DNA ligase B,protein,246196,Mycolicibacterium smegmatis (strain ATCC 700084 / mc(2)155),Mycolicibacterium smegmatis (strain ATCC 700084 / mc(2)155),ligB,509,PTHR45674:SF13,DNA LIGASE-RELATED,True
A0R5T2,DNA ligase C1,protein,246196,Mycolicibacterium smegmatis (strain ATCC 700084 / mc(2)155),Mycolicibacterium smegmatis (strain ATCC 700084 / mc(2)155),ligC,348,PTHR45674:SF4,DNA LIGASE 1,True
A0R5T3,DNA ligase C2,protein,246196,Mycolicibacterium smegmatis (strain ATCC 700084 / mc(2)155),Mycolicibacterium smegmatis (strain ATCC 700084 / mc(2)155),ligC2,354,PTHR45674:SF4,DNA LIGASE 1,True
A0RWD6,DNA ligase,protein,414004,Cenarchaeum symbiosum (strain A),Cenarchaeum symbiosum (strain A),lig,589,PTHR45674:SF4,DNA LIGASE 1,True
A1KN60,Probable DNA ligase,protein,410289,Mycobacterium bovis (strain BCG / Pasteur 1173P2),Mycobacterium bovis (strain BCG / Pasteur 1173P2),lig,507,PTHR45674:SF13,DNA LIGASE-RELATED,True
A1RTK4,DNA ligase,protein,384616,Pyrobaculum islandicum (strain DSM 4184 / JCM 9189 / GEO3),Pyrobaculum islandicum (strain DSM 4184 / JCM 9189 / GEO3),lig,584,PTHR45674:SF4,DNA LIGASE 1,True
A1RXA6,DNA ligase 1,protein,368408,Thermofilum pendens (strain DSM 2475 / Hrk 5),Thermofilum pendens (strain DSM 2475 / Hrk 5),lig1,531,PTHR45674:SF7,DNA LIGASE,True
A1RY72,DNA ligase 2,protein,368408,Thermofilum pendens (strain DSM 2475 / Hrk 5),Thermofilum pendens (strain DSM 2475 / Hrk 5),lig2,601,PTHR45674:SF4,DNA LIGASE 1,True
A1SKL2,Probable DNA ligase,protein,196162,Nocardioides sp. (strain ATCC BAA-499 / JS614),Nocardioides sp. (strain ATCC BAA-499 / JS614),lig,509,PTHR45674:SF13,DNA LIGASE-RELATED,True
A1T6P2,Probable DNA ligase,protein,350058,Mycolicibacterium vanbaalenii (strain DSM 7251 / JCM 13017 / BCRC 16820 / KCTC 9966 / NRRL B-24157 / PYR-1),Mycolicibacterium vanbaalenii (strain DSM 7251 / JCM 13017 / BCRC 16820 / KCTC 9966 / NRRL B-24157 / PYR-1),lig,534,PTHR45674:SF13,DNA LIGASE-RELATED,True
A1UDY9,Probable DNA ligase,protein,189918,Mycobacterium sp. (strain KMS),Mycobacterium sp. (strain KMS),lig,520,PTHR45674:SF13,DNA LIGASE-RELATED,True
A2BJX6,DNA ligase,protein,415426,Hyperthermus butylicus (strain DSM 5456 / JCM 9403 / PLM1-5),Hyperthermus butylicus (strain DSM 5456 / JCM 9403 / PLM1-5),lig,608,PTHR45674:SF4,DNA LIGASE 1,True
A2SR38,DNA ligase,protein,410358,Methanocorpusculum labreanum (strain ATCC 43576 / DSM 4855 / Z),Methanocorpusculum labreanum (strain ATCC 43576 / DSM 4855 / Z),lig,546,PTHR45674:SF7,DNA LIGASE,True
A3CWP1,DNA ligase,protein,368407,Methanoculleus marisnigri (strain ATCC 35101 / DSM 1498 / JR1),Methanoculleus marisnigri (strain ATCC 35101 / DSM 1498 / JR1),lig,548,PTHR45674:SF7,DNA LIGASE,True
A3DP49,DNA ligase,protein,399550,Staphylothermus marinus (strain ATCC 43588 / DSM 3639 / JCM 9404 / F1),Staphylothermus marinus (strain ATCC 43588 / DSM 3639 / JCM 9404 / F1),lig,597,PTHR45674:SF4,DNA LIGASE 1,True
A3MS62,DNA ligase,protein,410359,Pyrobaculum calidifontis (strain DSM 21063 / JCM 11548 / VA1),Pyrobaculum calidifontis (strain DSM 21063 / JCM 11548 / VA1),lig,583,PTHR45674:SF4,DNA LIGASE 1,True
A3PXE2,Probable DNA ligase,protein,164757,Mycobacterium sp. (strain JLS),Mycobacterium sp. (strain JLS),lig,520,PTHR45674:SF13,DNA LIGASE-RELATED,True
A4F870,Probable DNA ligase,protein,405948,Saccharopolyspora erythraea (strain ATCC 11635 / DSM 40517 / JCM 4748 / NBRC 13426 / NCIMB 8594 / NRRL 2338),Saccharopolyspora erythraea (strain ATCC 11635 / DSM 40517 / JCM 4748 / NBRC 13426 / NCIMB 8594 / NRRL 2338),lig,510,PTHR45674:SF13,DNA LIGASE-RELATED,True
A4FY19,DNA ligase,protein,402880,Methanococcus maripaludis (strain C5 / ATCC BAA-1333),Methanococcus maripaludis (strain C5 / ATCC BAA-1333),lig,573,PTHR45674:SF7,DNA LIGASE,True
A4TDS2,Probable DNA ligase,protein,350054,Mycolicibacterium gilvum (strain PYR-GCK),Mycolicibacterium gilvum (strain PYR-GCK),lig,511,PTHR45674:SF13,DNA LIGASE-RELATED,True
A4WH24,DNA ligase,protein,340102,Pyrobaculum arsenaticum (strain DSM 13514 / JCM 11321 / PZ6),Pyrobaculum arsenaticum (strain DSM 13514 / JCM 11321 / PZ6),lig,584,PTHR45674:SF4,DNA LIGASE 1,True
A4YD25,DNA ligase,protein,399549,Metallosphaera sedula (strain ATCC 51363 / DSM 5348 / JCM 9185 / NBRC 15509 / TH2),Metallosphaera sedula (strain ATCC 51363 / DSM 5348 / JCM 9185 / NBRC 15509 / TH2),lig,598,PTHR45674:SF4,DNA LIGASE 1,True
A5U776,Probable DNA ligase,protein,419947,Mycobacterium tuberculosis (strain ATCC 25177 / H37Ra),Mycobacterium tuberculosis (strain ATCC 25177 / H37Ra),lig,507,PTHR45674:SF13,DNA LIGASE-RELATED,True
A5UKX2,DNA ligase,protein,420247,Methanobrevibacter smithii (strain ATCC 35061 / DSM 861 / OCM 144 / PS),Methanobrevibacter smithii (strain ATCC 35061 / DSM 861 / OCM 144 / PS),lig,551,PTHR45674:SF7,DNA LIGASE,True
A6UNY0,DNA ligase,protein,406327,Methanococcus vannielii (strain ATCC 35089 / DSM 1224 / JCM 13029 / OCM 148 / SB),Methanococcus vannielii (strain ATCC 35089 / DSM 1224 / JCM 13029 / OCM 148 / SB),lig,573,PTHR45674:SF7,DNA LIGASE,True
A6UVC4,DNA ligase,protein,419665,Methanococcus aeolicus (strain ATCC BAA-1280 / DSM 17508 / OCM 812 / Nankai-3),Methanococcus aeolicus (strain ATCC BAA-1280 / DSM 17508 / OCM 812 / Nankai-3),lig,562,PTHR45674:SF7,DNA LIGASE,True
A6VFQ9,DNA ligase,protein,426368,Methanococcus maripaludis (strain C7 / ATCC BAA-1331),Methanococcus maripaludis (strain C7 / ATCC BAA-1331),lig,573,PTHR45674:SF7,DNA LIGASE,True
A6WG40,Probable DNA ligase,protein,266940,Kineococcus radiotolerans (strain ATCC BAA-149 / DSM 14245 / SRS30216),Kineococcus radiotolerans (strain ATCC BAA-149 / DSM 14245 / SRS30216),lig,503,PTHR45674:SF13,DNA LIGASE-RELATED,True
A7HID3,Probable DNA ligase,protein,404589,Anaeromyxobacter sp. (strain Fw109-5),Anaeromyxobacter sp. (strain Fw109-5),lig,519,PTHR45674:SF13,DNA LIGASE-RELATED,True
A7IAA9,DNA ligase,protein,456442,Methanoregula boonei (strain DSM 21154 / JCM 14090 / 6A8),Methanoregula boonei (strain DSM 21154 / JCM 14090 / 6A8),lig,550,PTHR45674:SF7,DNA LIGASE,True
A8AB20,DNA ligase,protein,453591,Ignicoccus hospitalis (strain KIN4/I / DSM 18386 / JCM 14125),Ignicoccus hospitalis (strain KIN4/I / DSM 18386 / JCM 14125),lig,594,PTHR45674:SF4,DNA LIGASE 1,True
A8MDU6,DNA ligase,protein,397948,Caldivirga maquilingensis (strain ATCC 700844 / DSM 13496 / JCM 10307 / IC-167),Caldivirga maquilingensis (strain ATCC 700844 / DSM 13496 / JCM 10307 / IC-167),lig,603,PTHR45674:SF4,DNA LIGASE 1,True
A9A3K1,DNA ligase,protein,436308,Nitrosopumilus maritimus (strain SCM1),Nitrosopumilus maritimus (strain SCM1),lig,588,PTHR45674:SF4,DNA LIGASE 1,True
A9AAX4,DNA ligase,protein,444158,Methanococcus maripaludis (strain C6 / ATCC BAA-1332),Methanococcus maripaludis (strain C6 / ATCC BAA-1332),lig,573,PTHR45674:SF7,DNA LIGASE,True
A9GU24,Probable DNA ligase,protein,448385,Sorangium cellulosum (strain So ce56),Sorangium cellulosum (strain So ce56),lig,533,PTHR45674:SF13,DNA LIGASE-RELATED,True
B0R4C9,DNA ligase,protein,478009,Halobacterium salinarum (strain ATCC 29341 / DSM 671 / R1),Halobacterium salinarum (strain ATCC 29341 / DSM 671 / R1),lig,561,PTHR45674:SF7,DNA LIGASE,True
B1L3K8,DNA ligase 1,protein,374847,Korarchaeum cryptofilum (strain OPF8),Korarchaeum cryptofilum (strain OPF8),lig1,541,PTHR45674:SF7,DNA LIGASE,True
B1L3V2,DNA ligase 2,protein,374847,Korarchaeum cryptofilum (strain OPF8),Korarchaeum cryptofilum (strain OPF8),lig2,594,PTHR45674:SF4,DNA LIGASE 1,True
B1W5J2,Probable DNA ligase,protein,455632,Streptomyces griseus subsp. griseus (strain JCM 4626 / CBS 651.72 / NBRC 13350 / KCC S-0626 / ISP 5235),Streptomyces griseus subsp. griseus (strain JCM 4626 / CBS 651.72 / NBRC 13350 / KCC S-0626 / ISP 5235),lig,511,PTHR45674:SF13,DNA LIGASE-RELATED,True
B1YA52,DNA ligase,protein,444157,Pyrobaculum neutrophilum (strain DSM 2338 / JCM 9278 / NBRC 100436 / V24Sta),Pyrobaculum neutrophilum (strain DSM 2338 / JCM 9278 / NBRC 100436 / V24Sta),lig,584,PTHR45674:SF4,DNA LIGASE 1,True
B1ZZL9,Probable DNA ligase,protein,452637,Opitutus terrae (strain DSM 11246 / JCM 15787 / PB90-1),Opitutus terrae (strain DSM 11246 / JCM 15787 / PB90-1),lig,1017,PTHR45674:SF13,DNA LIGASE-RELATED,True
B2HHE1,Probable DNA ligase,protein,216594,Mycobacterium marinum (strain ATCC BAA-535 / M),Mycobacterium marinum (strain ATCC BAA-535 / M),lig,513,PTHR45674:SF13,DNA LIGASE-RELATED,True
B4UIS1,Probable DNA ligase,protein,447217,Anaeromyxobacter sp. (strain K),Anaeromyxobacter sp. (strain K),lig,513,PTHR45674:SF13,DNA LIGASE-RELATED,True
B5YD88,Probable DNA ligase,protein,309799,Dictyoglomus thermophilum (strain ATCC 35947 / DSM 3960 / H-6-12),Dictyoglomus thermophilum (strain ATCC 35947 / DSM 3960 / H-6-12),lig,582,PTHR45674:SF4,DNA LIGASE 1,True
B6YTR4,DNA ligase,protein,523850,Thermococcus onnurineus (strain NA1),Thermococcus onnurineus (strain NA1),lig,562,PTHR45674:SF7,DNA LIGASE,True
B8DZX8,Probable DNA ligase,protein,515635,Dictyoglomus turgidum (strain DSM 6724 / Z-1310),Dictyoglomus turgidum (strain DSM 6724 / Z-1310),lig,582,PTHR45674:SF4,DNA LIGASE 1,True
B8GGB8,DNA ligase,protein,521011,Methanosphaerula palustris (strain ATCC BAA-1556 / DSM 19958 / E1-9c),Methanosphaerula palustris (strain ATCC BAA-1556 / DSM 19958 / E1-9c),lig,556,PTHR45674:SF7,DNA LIGASE,True
B8HCE1,Probable DNA ligase,protein,452863,Pseudarthrobacter chlorophenolicus (strain ATCC 700700 / DSM 12829 / CIP 107037 / JCM 12360 / KCTC 9906 / NCIMB 13794 / A6),Pseudarthrobacter chlorophenolicus (strain ATCC 700700 / DSM 12829 / CIP 107037 / JCM 12360 / KCTC 9906 / NCIMB 13794 / A6),lig,507,PTHR45674:SF13,DNA LIGASE-RELATED,True
B8JBM1,Probable DNA ligase,protein,455488,Anaeromyxobacter dehalogenans (strain ATCC BAA-258 / DSM 21875 / 2CP-1),Anaeromyxobacter dehalogenans (strain ATCC BAA-258 / DSM 21875 / 2CP-1),lig,513,PTHR45674:SF13,DNA LIGASE-RELATED,True
B9LUZ9,DNA ligase,protein,416348,Halorubrum lacusprofundi (strain ATCC 49239 / DSM 5036 / JCM 8891 / ACAM 34),Halorubrum lacusprofundi (strain ATCC 49239 / DSM 5036 / JCM 8891 / ACAM 34),lig,594,PTHR45674:SF7,DNA LIGASE,True
C0QSL7,Probable DNA ligase,protein,123214,Persephonella marina (strain DSM 14350 / EX-H1),Persephonella marina (strain DSM 14350 / EX-H1),lig,582,PTHR45674:SF4,DNA LIGASE 1,True
C1AGI1,Probable DNA ligase,protein,561275,Mycobacterium bovis (strain BCG / Tokyo 172 / ATCC 35737 / TMC 1019),Mycobacterium bovis (strain BCG / Tokyo 172 / ATCC 35737 / TMC 1019),lig,507,PTHR45674:SF13,DNA LIGASE-RELATED,True
C1AX87,Probable DNA ligase,protein,632772,Rhodococcus opacus (strain B4),Rhodococcus opacus (strain B4),lig,503,PTHR45674:SF13,DNA LIGASE-RELATED,True
C3MJ14,DNA ligase,protein,429572,Saccharolobus islandicus (strain L.S.2.15 / Lassen #1),Saccharolobus islandicus (strain L.S.2.15 / Lassen #1),lig,601,PTHR45674:SF4,DNA LIGASE 1,True
C3MYD2,DNA ligase,protein,427317,Saccharolobus islandicus (strain M.14.25 / Kamchatka #1),Saccharolobus islandicus (strain M.14.25 / Kamchatka #1),lig,601,PTHR45674:SF4,DNA LIGASE 1,True
C3MZR1,DNA ligase,protein,427318,Saccharolobus islandicus (strain M.16.27),Saccharolobus islandicus (strain M.16.27),lig,601,PTHR45674:SF4,DNA LIGASE 1,True
C3N834,DNA ligase,protein,439386,Saccharolobus islandicus (strain Y.G.57.14 / Yellowstone #1),Saccharolobus islandicus (strain Y.G.57.14 / Yellowstone #1),lig,601,PTHR45674:SF4,DNA LIGASE 1,True
C3NF77,DNA ligase,protein,419942,Saccharolobus islandicus (strain Y.N.15.51 / Yellowstone #2),Saccharolobus islandicus (strain Y.N.15.51 / Yellowstone #2),lig,601,PTHR45674:SF4,DNA LIGASE 1,True
C4KIZ2,DNA ligase,protein,426118,Saccharolobus islandicus (strain M.16.4 / Kamchatka #3),Saccharolobus islandicus (strain M.16.4 / Kamchatka #3),lig,601,PTHR45674:SF4,DNA LIGASE 1,True
C5BW79,Probable DNA ligase,protein,471853,Beutenbergia cavernae (strain ATCC BAA-8 / DSM 12333 / CCUG 43141 / JCM 11478 / NBRC 16432 / NCIMB 13614 / HKI 0122),Beutenbergia cavernae (strain ATCC BAA-8 / DSM 12333 / CCUG 43141 / JCM 11478 / NBRC 16432 / NCIMB 13614 / HKI 0122),lig,512,PTHR45674:SF13,DNA LIGASE-RELATED,True
D2CJS7,DNA ligase,protein,53426,Sulfophobococcus zilligii,Sulfophobococcus zilligii,lig,606,PTHR45674:SF4,DNA LIGASE 1,True
D4GYZ4,DNA ligase,protein,309800,Haloferax volcanii (strain ATCC 29605 / DSM 3757 / JCM 8879 / NBRC 14742 / NCIMB 2012 / VKM B-1768 / DS2),Haloferax volcanii (strain ATCC 29605 / DSM 3757 / JCM 8879 / NBRC 14742 / NCIMB 2012 / VKM B-1768 / DS2),lig,585,PTHR45674:SF7,DNA LIGASE,True
F4HPZ9,DNA ligase 6,protein,3702,Arabidopsis thaliana,Arabidopsis thaliana (Mouse-ear cress),LIG6,1396,PTHR45674:SF9,DNA LIGASE 3,True
L0TDE1,DNA ligase C,protein,83332,Mycobacterium tuberculosis (strain ATCC 25618 / H37Rv),Mycobacterium tuberculosis (strain ATCC 25618 / H37Rv),ligC,358,PTHR45674:SF4,DNA LIGASE 1,True
O29632,DNA ligase,protein,224325,Archaeoglobus fulgidus (strain ATCC 49558 / DSM 4304 / JCM 9628 / NBRC 100126 / VC-16),Archaeoglobus fulgidus (strain ATCC 49558 / DSM 4304 / JCM 9628 / NBRC 100126 / VC-16),lig,555,PTHR45674:SF7,DNA LIGASE,True
O31917,SPbeta prophage-derived DNA ligase-like protein LigB,protein,224308,Bacillus subtilis (strain 168),Bacillus subtilis (strain 168),ligB,270,PTHR45674:SF4,DNA LIGASE 1,True
O57250,DNA ligase,protein,126794,Vaccinia virus (strain Ankara),Vaccinia virus (strain Ankara) (VACV),OPG180,552,PTHR45674:SF9,DNA LIGASE 3,False
O59288,DNA ligase,protein,70601,Pyrococcus horikoshii (strain ATCC 700860 / DSM 12428 / JCM 9974 / NBRC 100139 / OT-3),Pyrococcus horikoshii (strain ATCC 700860 / DSM 12428 / JCM 9974 / NBRC 100139 / OT-3),lig,559,PTHR45674:SF7,DNA LIGASE,True
O67398,Probable DNA ligase,protein,224324,Aquifex aeolicus (strain VF5),Aquifex aeolicus (strain VF5),lig,584,PTHR45674:SF4,DNA LIGASE 1,True
O93723,DNA ligase,protein,178306,Pyrobaculum aerophilum (strain ATCC 51768 / DSM 7523 / JCM 9630 / CIP 104966 / NBRC 100827 / IM2),Pyrobaculum aerophilum (strain ATCC 51768 / DSM 7523 / JCM 9630 / CIP 104966 / NBRC 100827 / IM2),lig,584,PTHR45674:SF4,DNA LIGASE 1,True
P04819,DNA ligase 1,protein,559292,Saccharomyces cerevisiae (strain ATCC 204508 / S288c),Saccharomyces cerevisiae (strain ATCC 204508 / S288c) (Baker's yeast),CDC9,755,PTHR45674:SF4,DNA LIGASE 1,True
P0CL74,DNA ligase,protein,29292,Pyrococcus abyssi,Pyrococcus abyssi,lig,559,PTHR45674:SF7,DNA LIGASE,True
P0CL75,DNA ligase,protein,272844,Pyrococcus abyssi (strain GE5 / Orsay),Pyrococcus abyssi (strain GE5 / Orsay),lig,559,PTHR45674:SF7,DNA LIGASE,True
P0DOO3,DNA ligase,protein,587200,Variola virus (isolate Human/India/Ind3/1967),Variola virus (isolate Human/India/Ind3/1967) (VARV),OPG180,552,PTHR45674:SF9,DNA LIGASE 3,True
P0DOO4,DNA ligase,protein,10255,Variola virus,Variola virus,OPG180,552,PTHR45674:SF9,DNA LIGASE 3,False
P12000,DNA ligase 1,protein,284812,Schizosaccharomyces pombe (strain 972 / ATCC 24843),Schizosaccharomyces pombe (strain 972 / ATCC 24843) (Fission yeast),cdc17,768,PTHR45674:SF4,DNA LIGASE 1,True
P16272,DNA ligase,protein,10254,Vaccinia virus (strain Western Reserve),Vaccinia virus (strain Western Reserve) (VACV),OPG180,552,PTHR45674:SF9,DNA LIGASE 3,True
P18858,DNA ligase 1,protein,9606,Homo sapiens,Homo sapiens (Human),LIG1,919,PTHR45674:SF4,DNA LIGASE 1,True
P20492,DNA ligase,protein,10249,Vaccinia virus (strain Copenhagen),Vaccinia virus (strain Copenhagen) (VACV),OPG180,552,PTHR45674:SF9,DNA LIGASE 3,False
P37913,DNA ligase 1,protein,10090,Mus musculus,Mus musculus (Mouse),Lig1,916,PTHR45674:SF4,DNA LIGASE 1,True
P49916,DNA ligase 3,protein,9606,Homo sapiens,Homo sapiens (Human),LIG3,1009,PTHR45674:SF9,DNA LIGASE 3,True
P51892,DNA ligase 1,protein,8355,Xenopus laevis,Xenopus laevis (African clawed frog),lig1,1070,PTHR45674:SF4,DNA LIGASE 1,True
P54875,DNA ligase,protein,145262,Methanothermobacter thermautotrophicus,Methanothermobacter thermautotrophicus,lig,557,PTHR45674:SF7,DNA LIGASE,True
P56709,DNA ligase,protein,186497,Pyrococcus furiosus (strain ATCC 43587 / DSM 3638 / JCM 8422 / Vc1),Pyrococcus furiosus (strain ATCC 43587 / DSM 3638 / JCM 8422 / Vc1),lig,561,PTHR45674:SF7,DNA LIGASE,True
P97386,DNA ligase 3,protein,10090,Mus musculus,Mus musculus (Mouse),Lig3,1015,PTHR45674:SF9,DNA LIGASE 3,True
P9WNV4,DNA ligase B,protein,83331,Mycobacterium tuberculosis (strain CDC 1551 / Oshkosh),Mycobacterium tuberculosis (strain CDC 1551 / Oshkosh),ligB,507,PTHR45674:SF13,DNA LIGASE-RELATED,True
P9WNV5,DNA ligase B,protein,83332,Mycobacterium tuberculosis (strain ATCC 25618 / H37Rv),Mycobacterium tuberculosis (strain ATCC 25618 / H37Rv),ligB,507,PTHR45674:SF13,DNA LIGASE-RELATED,True
Q02093,DNA ligase,protein,2283,Acidianus ambivalens,Acidianus ambivalens,lig,600,PTHR45674:SF4,DNA LIGASE 1,True
Q0SG75,Probable DNA ligase,protein,101510,Rhodococcus jostii (strain RHA1),Rhodococcus jostii (strain RHA1),lig,503,PTHR45674:SF13,DNA LIGASE-RELATED,True
Q0W0X1,DNA ligase,protein,351160,Methanocella arvoryzae (strain DSM 22066 / NBRC 105507 / MRE50),Methanocella arvoryzae (strain DSM 22066 / NBRC 105507 / MRE50),lig,568,PTHR45674:SF7,DNA LIGASE,True
Q12X08,DNA ligase,protein,259564,Methanococcoides burtonii (strain DSM 6242 / NBRC 107633 / OCM 468 / ACE-M),Methanococcoides burtonii (strain DSM 6242 / NBRC 107633 / OCM 468 / ACE-M),lig,567,PTHR45674:SF7,DNA LIGASE,True
Q18GX5,DNA ligase 2,protein,362976,Haloquadratum walsbyi (strain DSM 16790 / HBSQ001),Haloquadratum walsbyi (strain DSM 16790 / HBSQ001),lig2,618,PTHR45674:SF7,DNA LIGASE,True
Q18HT7,DNA ligase 1,protein,362976,Haloquadratum walsbyi (strain DSM 16790 / HBSQ001),Haloquadratum walsbyi (strain DSM 16790 / HBSQ001),lig1,618,PTHR45674:SF7,DNA LIGASE,True
Q1BB26,Probable DNA ligase,protein,164756,Mycobacterium sp. (strain MCS),Mycobacterium sp. (strain MCS),lig,520,PTHR45674:SF13,DNA LIGASE-RELATED,True
Q1II25,Probable DNA ligase,protein,204669,Koribacter versatilis (strain Ellin345),Koribacter versatilis (strain Ellin345),lig,576,PTHR45674:SF4,DNA LIGASE 1,True
Q27474,DNA ligase 1,protein,6239,Caenorhabditis elegans,Caenorhabditis elegans,lig-1,773,PTHR45674:SF4,DNA LIGASE 1,True
Q2FTH4,DNA ligase,protein,323259,Methanospirillum hungatei JF-1 (strain ATCC 27890 / DSM 864 / NBRC 100397 / JF-1),Methanospirillum hungatei JF-1 (strain ATCC 27890 / DSM 864 / NBRC 100397 / JF-1),lig,547,PTHR45674:SF7,DNA LIGASE,True
Q2IH69,Probable DNA ligase,protein,290397,Anaeromyxobacter dehalogenans (strain 2CP-C),Anaeromyxobacter dehalogenans (strain 2CP-C),lig,513,PTHR45674:SF13,DNA LIGASE-RELATED,True
Q2NHF9,DNA ligase,protein,339860,Methanosphaera stadtmanae (strain ATCC 43021 / DSM 3091 / JCM 11832 / MCB-3),Methanosphaera stadtmanae (strain ATCC 43021 / DSM 3091 / JCM 11832 / MCB-3),lig,557,PTHR45674:SF7,DNA LIGASE,True
Q3IPX0,DNA ligase,protein,348780,Natronomonas pharaonis (strain ATCC 35678 / DSM 2160 / CIP 103997 / JCM 8858 / NBRC 14720 / NCIMB 2260 / Gabara),Natronomonas pharaonis (strain ATCC 35678 / DSM 2160 / CIP 103997 / JCM 8858 / NBRC 14720 / NCIMB 2260 / Gabara),lig,548,PTHR45674:SF7,DNA LIGASE,True
Q42572,DNA ligase 1,protein,3702,Arabidopsis thaliana,Arabidopsis thaliana (Mouse-ear cress),LIG1,790,PTHR45674:SF4,DNA LIGASE 1,True
Q46BA3,DNA ligase 2,protein,269797,Methanosarcina barkeri (strain Fusaro / DSM 804),Methanosarcina barkeri (strain Fusaro / DSM 804),lig2,568,PTHR45674:SF7,DNA LIGASE,True
Q46C04,DNA ligase 1,protein,269797,Methanosarcina barkeri (strain Fusaro / DSM 804),Methanosarcina barkeri (strain Fusaro / DSM 804),lig1,549,PTHR45674:SF4,DNA LIGASE 1,True
Q4JAM1,DNA ligase,protein,330779,Sulfolobus acidocaldarius (strain ATCC 33909 / DSM 639 / JCM 8929 / NBRC 15157 / NCIMB 11770),Sulfolobus acidocaldarius (strain ATCC 33909 / DSM 639 / JCM 8929 / NBRC 15157 / NCIMB 11770),lig,598,PTHR45674:SF4,DNA LIGASE 1,True
Q50566,DNA ligase,protein,187420,Methanothermobacter thermautotrophicus (strain ATCC 29096 / DSM 1053 / JCM 10044 / NBRC 100330 / Delta H),Methanothermobacter thermautotrophicus (strain ATCC 29096 / DSM 1053 / JCM 10044 / NBRC 100330 / Delta H),lig,561,PTHR45674:SF7,DNA LIGASE,True
Q54QM4,DNA ligase 3,protein,44689,Dictyostelium discoideum,Dictyostelium discoideum (Social amoeba),lig3,1175,PTHR45674:SF9,DNA LIGASE 3,True
Q57635,DNA ligase,protein,243232,Methanocaldococcus jannaschii (strain ATCC 43067 / DSM 2661 / JAL-1 / JCM 10045 / NBRC 100440),Methanocaldococcus jannaschii (strain ATCC 43067 / DSM 2661 / JAL-1 / JCM 10045 / NBRC 100440),lig,573,PTHR45674:SF7,DNA LIGASE,True
Q5V4R0,DNA ligase,protein,272569,Haloarcula marismortui (strain ATCC 43049 / DSM 3752 / JCM 8966 / VKM B-1809),Haloarcula marismortui (strain ATCC 43049 / DSM 3752 / JCM 8966 / VKM B-1809),lig,554,PTHR45674:SF7,DNA LIGASE,True
Q5YNY7,Probable DNA ligase,protein,247156,Nocardia farcinica (strain IFM 10152),Nocardia farcinica (strain IFM 10152),lig,523,PTHR45674:SF13,DNA LIGASE-RELATED,True
Q67480,DNA ligase,protein,928301,Fowlpox virus (strain NVSL),Fowlpox virus (strain NVSL) (FPV),LIG,564,PTHR45674:SF9,DNA LIGASE 3,True
Q6L195,DNA ligase,protein,1122961,Picrophilus torridus (strain ATCC 700027 / DSM 9790 / JCM 10055 / NBRC 100828 / KAW 2/3),Picrophilus torridus (strain ATCC 700027 / DSM 9790 / JCM 10055 / NBRC 100828 / KAW 2/3),lig,585,PTHR45674:SF4,DNA LIGASE 1,True
Q6LYM1,DNA ligase,protein,267377,Methanococcus maripaludis (strain DSM 14266 / JCM 13030 / NBRC 101832 / S2 / LL),Methanococcus maripaludis (strain DSM 14266 / JCM 13030 / NBRC 101832 / S2 / LL),lig,573,PTHR45674:SF7,DNA LIGASE,True
Q73V97,Probable DNA ligase,protein,262316,Mycolicibacterium paratuberculosis (strain ATCC BAA-968 / K-10),Mycolicibacterium paratuberculosis (strain ATCC BAA-968 / K-10),lig,519,PTHR45674:SF13,DNA LIGASE-RELATED,True
Q74M64,DNA ligase,protein,228908,Nanoarchaeum equitans (strain Kin4-M),Nanoarchaeum equitans (strain Kin4-M),lig,567,PTHR45674:SF7,DNA LIGASE,True
Q7TTR7,Probable DNA ligase,protein,233413,Mycobacterium bovis (strain ATCC BAA-935 / AF2122/97),Mycobacterium bovis (strain ATCC BAA-935 / AF2122/97),lig,507,PTHR45674:SF13,DNA LIGASE-RELATED,True
Q826P6,Probable DNA ligase,protein,227882,Streptomyces avermitilis (strain ATCC 31267 / DSM 46492 / JCM 5070 / NBRC 14893 / NCIMB 12804 / NRRL 8165 / MA-4680),Streptomyces avermitilis (strain ATCC 31267 / DSM 46492 / JCM 5070 / NBRC 14893 / NCIMB 12804 / NRRL 8165 / MA-4680),lig,512,PTHR45674:SF13,DNA LIGASE-RELATED,True
Q869E1,DNA ligase 1,protein,44689,Dictyostelium discoideum,Dictyostelium discoideum (Social amoeba),lig1,1192,PTHR45674:SF4,DNA LIGASE 1,True
Q8PTK1,DNA ligase 2,protein,192952,Methanosarcina mazei (strain ATCC BAA-159 / DSM 3647 / Goe1 / Go1 / JCM 11833 / OCM 88),Methanosarcina mazei (strain ATCC BAA-159 / DSM 3647 / Goe1 / Go1 / JCM 11833 / OCM 88),lig2,568,PTHR45674:SF7,DNA LIGASE,True
Q8PVR7,DNA ligase 1,protein,192952,Methanosarcina mazei (strain ATCC BAA-159 / DSM 3647 / Goe1 / Go1 / JCM 11833 / OCM 88),Methanosarcina mazei (strain ATCC BAA-159 / DSM 3647 / Goe1 / Go1 / JCM 11833 / OCM 88),lig1,579,PTHR45674:SF4,DNA LIGASE 1,True
Q8TMT1,DNA ligase 2,protein,188937,Methanosarcina acetivorans (strain ATCC 35395 / DSM 2834 / JCM 12185 / C2A),Methanosarcina acetivorans (strain ATCC 35395 / DSM 2834 / JCM 12185 / C2A),lig2,568,PTHR45674:SF7,DNA LIGASE,True
Q8TSR7,DNA ligase 1,protein,188937,Methanosarcina acetivorans (strain ATCC 35395 / DSM 2834 / JCM 12185 / C2A),Methanosarcina acetivorans (strain ATCC 35395 / DSM 2834 / JCM 12185 / C2A),lig1,580,PTHR45674:SF4,DNA LIGASE 1,True
Q8TWN3,DNA ligase,protein,190192,Methanopyrus kandleri (strain AV19 / DSM 6324 / JCM 9639 / NBRC 100938),Methanopyrus kandleri (strain AV19 / DSM 6324 / JCM 9639 / NBRC 100938),lig,559,PTHR45674:SF7,DNA LIGASE,True
Q976G4,DNA ligase,protein,273063,Sulfurisphaera tokodaii (strain DSM 16993 / JCM 10545 / NBRC 100140 / 7),Sulfurisphaera tokodaii (strain DSM 16993 / JCM 10545 / NBRC 100140 / 7),lig,600,PTHR45674:SF4,DNA LIGASE 1,True
Q979A1,DNA ligase,protein,273116,Thermoplasma volcanium (strain ATCC 51530 / DSM 4299 / JCM 9571 / NBRC 15438 / GSS1),Thermoplasma volcanium (strain ATCC 51530 / DSM 4299 / JCM 9571 / NBRC 15438 / GSS1),lig,588,PTHR45674:SF4,DNA LIGASE 1,True
Q980T8,DNA ligase,protein,273057,Saccharolobus solfataricus (strain ATCC 35092 / DSM 1617 / JCM 11322 / P2),Saccharolobus solfataricus (strain ATCC 35092 / DSM 1617 / JCM 11322 / P2),lig,601,PTHR45674:SF4,DNA LIGASE 1,True
Q9C1W9,DNA ligase 3,protein,284812,Schizosaccharomyces pombe (strain 972 / ATCC 24843),Schizosaccharomyces pombe (strain 972 / ATCC 24843) (Fission yeast),adl1,774,PTHR45674:SF9,DNA LIGASE 3,True
Q9FCB1,Probable DNA ligase,protein,100226,Streptomyces coelicolor (strain ATCC BAA-471 / A3(2) / M145),Streptomyces coelicolor (strain ATCC BAA-471 / A3(2) / M145),lig,512,PTHR45674:SF13,DNA LIGASE-RELATED,True
Q9HH07,DNA ligase,protein,46540,Thermococcus fumicolans,Thermococcus fumicolans,lig,559,PTHR45674:SF7,DNA LIGASE,True
Q9HHC4,DNA ligase,protein,69014,Thermococcus kodakarensis (strain ATCC BAA-918 / JCM 12380 / KOD1),Thermococcus kodakarensis (strain ATCC BAA-918 / JCM 12380 / KOD1),lig,559,PTHR45674:SF7,DNA LIGASE,True
