id,name,entry_type,source_tax_id,source_tax_name,full_tax_name,gene,length,subfamily,subfamily_name,in_alphafold
A5VPI9,GTP pyrophosphokinase rsh,protein,444178,Brucella ovis (strain ATCC 25840 / 63/290 / NCTC 10512),Brucella ovis (strain ATCC 25840 / 63/290 / NCTC 10512),rsh,750,PTHR21262:SF36,BIFUNCTIONAL (P)PPGPP SYNTHASE_HYDROLASE SPOT,True
O34098,"Guanosine-3',5'-bis(diphosphate) 3'-pyrophosphohydrolase",protein,2133,Spiroplasma citri,Spiroplasma citri,spoT,749,PTHR21262:SF31,GTP PYROPHOSPHOKINASE,True
O51216,"Guanosine-3',5'-bis(diphosphate) 3'-pyrophosphohydrolase",protein,224326,Borreliella burgdorferi (strain ATCC 35210 / DSM 4680 / CIP 102532 / B31),Borreliella burgdorferi (strain ATCC 35210 / DSM 4680 / CIP 102532 / B31),spoT,667,PTHR21262:SF31,GTP PYROPHOSPHOKINASE,True
O52177,GTP pyrophosphokinase,protein,34,Myxococcus xanthus,Myxococcus xanthus,relA,757,PTHR21262:SF36,BIFUNCTIONAL (P)PPGPP SYNTHASE_HYDROLASE SPOT,True
O54408,GTP pyrophosphokinase,protein,224308,Bacillus subtilis (strain 168),Bacillus subtilis (strain 168),relA,734,PTHR21262:SF31,GTP PYROPHOSPHOKINASE,True
O67012,"Guanosine-3',5'-bis(diphosphate) 3'-pyrophosphohydrolase",protein,224324,Aquifex aeolicus (strain VF5),Aquifex aeolicus (strain VF5),spoT,696,PTHR21262:SF31,GTP PYROPHOSPHOKINASE,True
O85709,GTP pyrophosphokinase,protein,1890,Streptomyces antibioticus,Streptomyces antibioticus,relA,841,PTHR21262:SF31,GTP PYROPHOSPHOKINASE,True
O87331,GTP pyrophosphokinase,protein,196627,Corynebacterium glutamicum (strain ATCC 13032 / DSM 20300 / JCM 1318 / BCRC 11384 / CCUG 27702 / LMG 3730 / NBRC 12168 / NCIMB 10025 / NRRL B-2784 / 534),Corynebacterium glutamicum (strain ATCC 13032 / DSM 20300 / JCM 1318 / BCRC 11384 / CCUG 27702 / LMG 3730 / NBRC 12168 / NCIMB 10025 / NRRL B-2784 / 534),relA,760,PTHR21262:SF31,GTP PYROPHOSPHOKINASE,True
P0A0E9,GTP pyrophosphokinase,protein,196620,Staphylococcus aureus (strain MW2),Staphylococcus aureus (strain MW2),relA,736,PTHR21262:SF31,GTP PYROPHOSPHOKINASE,True
P0A0F0,GTP pyrophosphokinase,protein,1280,Staphylococcus aureus,Staphylococcus aureus,relA,736,PTHR21262:SF31,GTP PYROPHOSPHOKINASE,True
P0AG20,GTP pyrophosphokinase,protein,83333,Escherichia coli (strain K12),Escherichia coli (strain K12),relA,744,PTHR21262:SF31,GTP PYROPHOSPHOKINASE,True
P0AG21,GTP pyrophosphokinase,protein,199310,Escherichia coli O6:H1 (strain CFT073 / ATCC 700928 / UPEC),Escherichia coli O6:H1 (strain CFT073 / ATCC 700928 / UPEC),relA,744,PTHR21262:SF31,GTP PYROPHOSPHOKINASE,True
P0AG22,GTP pyrophosphokinase,protein,83334,Escherichia coli O157:H7,Escherichia coli O157:H7,relA,744,PTHR21262:SF31,GTP PYROPHOSPHOKINASE,True
P0AG23,GTP pyrophosphokinase,protein,623,Shigella flexneri,Shigella flexneri,relA,744,PTHR21262:SF31,GTP PYROPHOSPHOKINASE,True
P0AG24,Bifunctional (p)ppGpp synthase/hydrolase SpoT,protein,83333,Escherichia coli (strain K12),Escherichia coli (strain K12),spoT,702,PTHR21262:SF36,BIFUNCTIONAL (P)PPGPP SYNTHASE_HYDROLASE SPOT,True
P0AG25,"Guanosine-3',5'-bis(diphosphate) 3'-pyrophosphohydrolase",protein,83334,Escherichia coli O157:H7,Escherichia coli O157:H7,spoT,702,PTHR21262:SF36,BIFUNCTIONAL (P)PPGPP SYNTHASE_HYDROLASE SPOT,True
P0AG26,"Guanosine-3',5'-bis(diphosphate) 3'-pyrophosphohydrolase",protein,623,Shigella flexneri,Shigella flexneri,spoT,702,PTHR21262:SF36,BIFUNCTIONAL (P)PPGPP SYNTHASE_HYDROLASE SPOT,True
P43811,"Guanosine-3',5'-bis(diphosphate) 3'-pyrophosphohydrolase",protein,71421,Haemophilus influenzae (strain ATCC 51907 / DSM 11121 / KW20 / Rd),Haemophilus influenzae (strain ATCC 51907 / DSM 11121 / KW20 / Rd),spoT,677,PTHR21262:SF36,BIFUNCTIONAL (P)PPGPP SYNTHASE_HYDROLASE SPOT,True
P44644,GTP pyrophosphokinase,protein,71421,Haemophilus influenzae (strain ATCC 51907 / DSM 11121 / KW20 / Rd),Haemophilus influenzae (strain ATCC 51907 / DSM 11121 / KW20 / Rd),relA,743,PTHR21262:SF31,GTP PYROPHOSPHOKINASE,True
P47520,"Probable guanosine-3',5'-bis(diphosphate) 3'-pyrophosphohydrolase",protein,243273,Mycoplasmoides genitalium (strain ATCC 33530 / DSM 19775 / NCTC 10195 / G37),Mycoplasmoides genitalium (strain ATCC 33530 / DSM 19775 / NCTC 10195 / G37),spoT,720,PTHR21262:SF31,GTP PYROPHOSPHOKINASE,True
P52560,GTP pyrophosphokinase,protein,100226,Streptomyces coelicolor (strain ATCC BAA-471 / A3(2) / M145),Streptomyces coelicolor (strain ATCC BAA-471 / A3(2) / M145),relA,847,PTHR21262:SF31,GTP PYROPHOSPHOKINASE,True
P55133,GTP pyrophosphokinase,protein,314292,Photobacterium angustum (strain S14 / CCUG 15956),Photobacterium angustum (strain S14 / CCUG 15956),relA,744,PTHR21262:SF31,GTP PYROPHOSPHOKINASE,True
P66015,Probable GTP pyrophosphokinase,protein,233413,Mycobacterium bovis (strain ATCC BAA-935 / AF2122/97),Mycobacterium bovis (strain ATCC BAA-935 / AF2122/97),relA,790,PTHR21262:SF31,GTP PYROPHOSPHOKINASE,True
P74007,"Probable guanosine-3',5'-bis(diphosphate) 3'-pyrophosphohydrolase",protein,1111708,Synechocystis sp. (strain ATCC 27184 / PCC 6803 / Kazusa),Synechocystis sp. (strain ATCC 27184 / PCC 6803 / Kazusa),spoT,760,PTHR21262:SF31,GTP PYROPHOSPHOKINASE,True
P75386,"Probable guanosine-3',5'-bis(diphosphate) 3'-pyrophosphohydrolase",protein,272634,Mycoplasmoides pneumoniae (strain ATCC 29342 / M129 / Subtype 1),Mycoplasmoides pneumoniae (strain ATCC 29342 / M129 / Subtype 1),spoT,733,PTHR21262:SF31,GTP PYROPHOSPHOKINASE,True
P9WHG8,Bifunctional (p)ppGpp synthase/hydrolase RelA,protein,83331,Mycobacterium tuberculosis (strain CDC 1551 / Oshkosh),Mycobacterium tuberculosis (strain CDC 1551 / Oshkosh),relA,738,PTHR21262:SF31,GTP PYROPHOSPHOKINASE,True
P9WHG9,Bifunctional (p)ppGpp synthase/hydrolase RelA,protein,83332,Mycobacterium tuberculosis (strain ATCC 25618 / H37Rv),Mycobacterium tuberculosis (strain ATCC 25618 / H37Rv),relA,738,PTHR21262:SF31,GTP PYROPHOSPHOKINASE,True
Q2YN11,GTP pyrophosphokinase rsh,protein,359391,Brucella abortus (strain 2308),Brucella abortus (strain 2308),rsh,750,PTHR21262:SF36,BIFUNCTIONAL (P)PPGPP SYNTHASE_HYDROLASE SPOT,True
Q49640,Probable GTP pyrophosphokinase,protein,272631,Mycobacterium leprae (strain TN),Mycobacterium leprae (strain TN),relA,787,PTHR21262:SF31,GTP PYROPHOSPHOKINASE,True
Q54089,Bifunctional (p)ppGpp synthase/hydrolase RelA,protein,119602,Streptococcus dysgalactiae subsp. equisimilis,Streptococcus dysgalactiae subsp. equisimilis,relA,739,PTHR21262:SF31,GTP PYROPHOSPHOKINASE,True
Q57E90,GTP pyrophosphokinase rsh,protein,262698,Brucella abortus biovar 1 (strain 9-941),Brucella abortus biovar 1 (strain 9-941),rsh,750,PTHR21262:SF36,BIFUNCTIONAL (P)PPGPP SYNTHASE_HYDROLASE SPOT,True
Q5HNR8,GTP pyrophosphokinase,protein,176279,Staphylococcus epidermidis (strain ATCC 35984 / DSM 28319 / BCRC 17069 / CCUG 31568 / BM 3577 / RP62A),Staphylococcus epidermidis (strain ATCC 35984 / DSM 28319 / BCRC 17069 / CCUG 31568 / BM 3577 / RP62A),relA,729,PTHR21262:SF31,GTP PYROPHOSPHOKINASE,True
Q67UU0,"Probable GTP diphosphokinase RSH3, chloroplastic",protein,39947,Oryza sativa subsp. japonica,Oryza sativa subsp. japonica (Rice),RSH3,708,PTHR21262:SF0,"GTP DIPHOSPHOKINASE RSH3, CHLOROPLASTIC-RELATED",True
Q6ATB2,"GTP diphosphokinase CRSH2, chloroplastic",protein,39947,Oryza sativa subsp. japonica,Oryza sativa subsp. japonica (Rice),CRSH2,559,PTHR21262:SF12,"GTP DIPHOSPHOKINASE CRSH, CHLOROPLASTIC-RELATED",True
Q6ATB4,"GTP diphosphokinase CRSH1, chloroplastic",protein,39947,Oryza sativa subsp. japonica,Oryza sativa subsp. japonica (Rice),CRSH1,583,PTHR21262:SF12,"GTP DIPHOSPHOKINASE CRSH, CHLOROPLASTIC-RELATED",True
Q6G8T5,GTP pyrophosphokinase,protein,282459,Staphylococcus aureus (strain MSSA476),Staphylococcus aureus (strain MSSA476),relA,736,PTHR21262:SF31,GTP PYROPHOSPHOKINASE,True
Q6GG70,GTP pyrophosphokinase,protein,282458,Staphylococcus aureus (strain MRSA252),Staphylococcus aureus (strain MRSA252),relA,736,PTHR21262:SF31,GTP PYROPHOSPHOKINASE,True
Q75IS2,"GTP diphosphokinase CRSH3, chloroplastic",protein,39947,Oryza sativa subsp. japonica,Oryza sativa subsp. japonica (Rice),CRSH3,578,PTHR21262:SF12,"GTP DIPHOSPHOKINASE CRSH, CHLOROPLASTIC-RELATED",True
Q7XAP4,"Probable GTP diphosphokinase RSH2, chloroplastic",protein,39947,Oryza sativa subsp. japonica,Oryza sativa subsp. japonica (Rice),RSH2,718,PTHR21262:SF34,"GTP DIPHOSPHOKINASE RSH2, CHLOROPLASTIC-RELATED",True
Q84R11,"Probable GTP diphosphokinase CRSH, chloroplastic",protein,3702,Arabidopsis thaliana,Arabidopsis thaliana (Mouse-ear cress),CRSH,583,PTHR21262:SF12,"GTP DIPHOSPHOKINASE CRSH, CHLOROPLASTIC-RELATED",True
Q8CS97,GTP pyrophosphokinase,protein,176280,Staphylococcus epidermidis (strain ATCC 12228 / FDA PCI 1200),Staphylococcus epidermidis (strain ATCC 12228 / FDA PCI 1200),relA,729,PTHR21262:SF31,GTP PYROPHOSPHOKINASE,True
Q8CY42,GTP pyrophosphokinase rsh,protein,204722,Brucella suis biovar 1 (strain 1330),Brucella suis biovar 1 (strain 1330),rsh,750,PTHR21262:SF36,BIFUNCTIONAL (P)PPGPP SYNTHASE_HYDROLASE SPOT,True
Q8YG65,GTP pyrophosphokinase rsh,protein,224914,Brucella melitensis biotype 1 (strain ATCC 23456 / CCUG 17765 / NCTC 10094 / 16M),Brucella melitensis biotype 1 (strain ATCC 23456 / CCUG 17765 / NCTC 10094 / 16M),rsh,750,PTHR21262:SF36,BIFUNCTIONAL (P)PPGPP SYNTHASE_HYDROLASE SPOT,True
Q931Q4,GTP pyrophosphokinase,protein,158878,Staphylococcus aureus (strain Mu50 / ATCC 700699),Staphylococcus aureus (strain Mu50 / ATCC 700699),relA,736,PTHR21262:SF31,GTP PYROPHOSPHOKINASE,True
Q99TL8,GTP pyrophosphokinase,protein,158879,Staphylococcus aureus (strain N315),Staphylococcus aureus (strain N315),relA,736,PTHR21262:SF31,GTP PYROPHOSPHOKINASE,True
Q9KNM2,"Guanosine-3',5'-bis(diphosphate) 3'-pyrophosphohydrolase",protein,243277,Vibrio cholerae serotype O1 (strain ATCC 39315 / El Tor Inaba N16961),Vibrio cholerae serotype O1 (strain ATCC 39315 / El Tor Inaba N16961),spoT,705,PTHR21262:SF36,BIFUNCTIONAL (P)PPGPP SYNTHASE_HYDROLASE SPOT,True
Q9LVJ3,"Probable GTP diphosphokinase RSH2, chloroplastic",protein,3702,Arabidopsis thaliana,Arabidopsis thaliana (Mouse-ear cress),RSH2,709,PTHR21262:SF33,"GTP DIPHOSPHOKINASE RSH2, CHLOROPLASTIC-RELATED",True
Q9M5P5,"Probable GTP diphosphokinase RSH3, chloroplastic",protein,3702,Arabidopsis thaliana,Arabidopsis thaliana (Mouse-ear cress),RSH3,712,PTHR21262:SF0,"GTP DIPHOSPHOKINASE RSH3, CHLOROPLASTIC-RELATED",True
Q9M5P6,"Probable GTP diphosphokinase RSH2, chloroplastic",protein,3702,Arabidopsis thaliana,Arabidopsis thaliana (Mouse-ear cress),RSH2,710,PTHR21262:SF33,"GTP DIPHOSPHOKINASE RSH2, CHLOROPLASTIC-RELATED",True
Q9SYH1,"Probable GTP diphosphokinase RSH3, chloroplastic",protein,3702,Arabidopsis thaliana,Arabidopsis thaliana (Mouse-ear cress),RSH3,715,PTHR21262:SF0,"GTP DIPHOSPHOKINASE RSH3, CHLOROPLASTIC-RELATED",True
