id,name,entry_type,source_tax_id,source_tax_name,full_tax_name,gene,length,subfamily,subfamily_name,in_alphafold
A6QLA4,Methionine aminopeptidase 1,protein,9913,Bos taurus,Bos taurus (Bovine),METAP1,386,PTHR43330:SF7,METHIONINE AMINOPEPTIDASE 1,True
O34484,Methionine aminopeptidase 2,protein,224308,Bacillus subtilis (strain 168),Bacillus subtilis (strain 168),mapB,249,PTHR43330:SF13,METHIONINE AMINOPEPTIDASE 2,True
O51132,Methionine aminopeptidase,protein,224326,Borreliella burgdorferi (strain ATCC 35210 / DSM 4680 / CIP 102532 / B31),Borreliella burgdorferi (strain ATCC 35210 / DSM 4680 / CIP 102532 / B31),map,251,PTHR43330:SF27,METHIONINE AMINOPEPTIDASE,True
O52353,Methionine aminopeptidase,protein,710127,Mycoplasmoides gallisepticum (strain R(low / passage 15 / clone 2)),Mycoplasmoides gallisepticum (strain R(low / passage 15 / clone 2)),map,250,PTHR43330:SF27,METHIONINE AMINOPEPTIDASE,True
O59730,Methionine aminopeptidase 1,protein,284812,Schizosaccharomyces pombe (strain 972 / ATCC 24843),Schizosaccharomyces pombe (strain 972 / ATCC 24843) (Fission yeast),fma1,379,PTHR43330:SF7,METHIONINE AMINOPEPTIDASE 1,True
O66489,Methionine aminopeptidase,protein,224324,Aquifex aeolicus (strain VF5),Aquifex aeolicus (strain VF5),map,258,PTHR43330:SF27,METHIONINE AMINOPEPTIDASE,True
O83814,Methionine aminopeptidase,protein,243276,Treponema pallidum (strain DSM 117211 / Nichols),Treponema pallidum (strain DSM 117211 / Nichols),map,255,PTHR43330:SF27,METHIONINE AMINOPEPTIDASE,True
O84859,Methionine aminopeptidase,protein,272561,Chlamydia trachomatis serovar D (strain ATCC VR-885 / DSM 19411 / UW-3/Cx),Chlamydia trachomatis serovar D (strain ATCC VR-885 / DSM 19411 / UW-3/Cx),map,291,PTHR43330:SF27,METHIONINE AMINOPEPTIDASE,True
P0A078,Methionine aminopeptidase,protein,158878,Staphylococcus aureus (strain Mu50 / ATCC 700699),Staphylococcus aureus (strain Mu50 / ATCC 700699),map,252,PTHR43330:SF13,METHIONINE AMINOPEPTIDASE 2,True
P0A079,Methionine aminopeptidase,protein,196620,Staphylococcus aureus (strain MW2),Staphylococcus aureus (strain MW2),map,252,PTHR43330:SF13,METHIONINE AMINOPEPTIDASE 2,True
P0A080,Methionine aminopeptidase,protein,418127,Staphylococcus aureus (strain Mu3 / ATCC 700698),Staphylococcus aureus (strain Mu3 / ATCC 700698),map,252,PTHR43330:SF13,METHIONINE AMINOPEPTIDASE 2,True
P0A1X6,Methionine aminopeptidase,protein,99287,Salmonella typhimurium (strain LT2 / SGSC1412 / ATCC 700720),Salmonella typhimurium (strain LT2 / SGSC1412 / ATCC 700720),map,264,PTHR43330:SF27,METHIONINE AMINOPEPTIDASE,True
P0A1X7,Methionine aminopeptidase,protein,90370,Salmonella typhi,Salmonella typhi,map,264,PTHR43330:SF27,METHIONINE AMINOPEPTIDASE,True
P0A5J3,Methionine aminopeptidase,protein,233413,Mycobacterium bovis (strain ATCC BAA-935 / AF2122/97),Mycobacterium bovis (strain ATCC BAA-935 / AF2122/97),map,285,PTHR43330:SF16,METHIONINE AMINOPEPTIDASE 2,True
P0AE18,Methionine aminopeptidase,protein,83333,Escherichia coli (strain K12),Escherichia coli (strain K12),map,264,PTHR43330:SF27,METHIONINE AMINOPEPTIDASE,True
P0AE19,Methionine aminopeptidase,protein,199310,Escherichia coli O6:H1 (strain CFT073 / ATCC 700928 / UPEC),Escherichia coli O6:H1 (strain CFT073 / ATCC 700928 / UPEC),map,264,PTHR43330:SF27,METHIONINE AMINOPEPTIDASE,True
P0AE20,Methionine aminopeptidase,protein,83334,Escherichia coli O157:H7,Escherichia coli O157:H7,map,264,PTHR43330:SF27,METHIONINE AMINOPEPTIDASE,True
P0AE21,Methionine aminopeptidase,protein,623,Shigella flexneri,Shigella flexneri,map,264,PTHR43330:SF27,METHIONINE AMINOPEPTIDASE,True
P19994,Methionine aminopeptidase 1,protein,224308,Bacillus subtilis (strain 168),Bacillus subtilis (strain 168),map,248,PTHR43330:SF27,METHIONINE AMINOPEPTIDASE,True
P33111,Uncharacterized protein in adk 3'region,protein,1270,Micrococcus luteus,Micrococcus luteus,,84,PTHR43330:SF27,METHIONINE AMINOPEPTIDASE,True
P44421,Methionine aminopeptidase,protein,71421,Haemophilus influenzae (strain ATCC 51907 / DSM 11121 / KW20 / Rd),Haemophilus influenzae (strain ATCC 51907 / DSM 11121 / KW20 / Rd),map,268,PTHR43330:SF27,METHIONINE AMINOPEPTIDASE,True
P47418,Methionine aminopeptidase,protein,243273,Mycoplasmoides genitalium (strain ATCC 33530 / DSM 19775 / NCTC 10195 / G37),Mycoplasmoides genitalium (strain ATCC 33530 / DSM 19775 / NCTC 10195 / G37),map,248,PTHR43330:SF27,METHIONINE AMINOPEPTIDASE,True
P50614,Methionine aminopeptidase,protein,195102,Clostridium perfringens (strain 13 / Type A),Clostridium perfringens (strain 13 / Type A),map,249,PTHR43330:SF27,METHIONINE AMINOPEPTIDASE,True
P53579,Methionine aminopeptidase A,protein,1111708,Synechocystis sp. (strain ATCC 27184 / PCC 6803 / Kazusa),Synechocystis sp. (strain ATCC 27184 / PCC 6803 / Kazusa),slr0918,253,PTHR43330:SF27,METHIONINE AMINOPEPTIDASE,True
P53580,Methionine aminopeptidase B,protein,1111708,Synechocystis sp. (strain ATCC 27184 / PCC 6803 / Kazusa),Synechocystis sp. (strain ATCC 27184 / PCC 6803 / Kazusa),slr0786,274,PTHR43330:SF27,METHIONINE AMINOPEPTIDASE,True
P53581,Methionine aminopeptidase C,protein,1111708,Synechocystis sp. (strain ATCC 27184 / PCC 6803 / Kazusa),Synechocystis sp. (strain ATCC 27184 / PCC 6803 / Kazusa),sll0555,305,PTHR43330:SF27,METHIONINE AMINOPEPTIDASE,True
P53582,Methionine aminopeptidase 1,protein,9606,Homo sapiens,Homo sapiens (Human),METAP1,386,PTHR43330:SF7,METHIONINE AMINOPEPTIDASE 1,True
P56102,Methionine aminopeptidase,protein,85962,Helicobacter pylori (strain ATCC 700392 / 26695),Helicobacter pylori (strain ATCC 700392 / 26695),map,253,PTHR43330:SF27,METHIONINE AMINOPEPTIDASE,True
P57324,Methionine aminopeptidase,protein,107806,Buchnera aphidicola subsp. Acyrthosiphon pisum (strain APS),Buchnera aphidicola subsp. Acyrthosiphon pisum (strain APS),map,264,PTHR43330:SF27,METHIONINE AMINOPEPTIDASE,True
P69000,Methionine aminopeptidase,protein,272562,Clostridium acetobutylicum (strain ATCC 824 / DSM 792 / JCM 1419 / IAM 19013 / LMG 5710 / NBRC 13948 / NRRL B-527 / VKM B-1787 / 2291 / W),Clostridium acetobutylicum (strain ATCC 824 / DSM 792 / JCM 1419 / IAM 19013 / LMG 5710 / NBRC 13948 / NRRL B-527 / VKM B-1787 / 2291 / W),map,250,PTHR43330:SF27,METHIONINE AMINOPEPTIDASE,True
P99121,Methionine aminopeptidase,protein,158879,Staphylococcus aureus (strain N315),Staphylococcus aureus (strain N315),map,252,PTHR43330:SF13,METHIONINE AMINOPEPTIDASE 2,True
P9WK18,Methionine aminopeptidase 2,protein,83331,Mycobacterium tuberculosis (strain CDC 1551 / Oshkosh),Mycobacterium tuberculosis (strain CDC 1551 / Oshkosh),map,285,PTHR43330:SF16,METHIONINE AMINOPEPTIDASE 2,True
P9WK19,Methionine aminopeptidase 2,protein,83332,Mycobacterium tuberculosis (strain ATCC 25618 / H37Rv),Mycobacterium tuberculosis (strain ATCC 25618 / H37Rv),map,285,PTHR43330:SF16,METHIONINE AMINOPEPTIDASE 2,True
P9WK20,Methionine aminopeptidase 1,protein,83331,Mycobacterium tuberculosis (strain CDC 1551 / Oshkosh),Mycobacterium tuberculosis (strain CDC 1551 / Oshkosh),map-1,266,PTHR43330:SF27,METHIONINE AMINOPEPTIDASE,True
P9WK21,Methionine aminopeptidase 1,protein,83332,Mycobacterium tuberculosis (strain ATCC 25618 / H37Rv),Mycobacterium tuberculosis (strain ATCC 25618 / H37Rv),map-1,266,PTHR43330:SF27,METHIONINE AMINOPEPTIDASE,True
Q01662,Methionine aminopeptidase 1,protein,559292,Saccharomyces cerevisiae (strain ATCC 204508 / S288c),Saccharomyces cerevisiae (strain ATCC 204508 / S288c) (Baker's yeast),MAP1,387,PTHR43330:SF7,METHIONINE AMINOPEPTIDASE 1,True
Q11132,Methionine aminopeptidase,protein,272634,Mycoplasmoides pneumoniae (strain ATCC 29342 / M129 / Subtype 1),Mycoplasmoides pneumoniae (strain ATCC 29342 / M129 / Subtype 1),map,248,PTHR43330:SF27,METHIONINE AMINOPEPTIDASE,True
Q4QRK0,Methionine aminopeptidase 1,protein,7955,Danio rerio,Danio rerio (Zebrafish),metap1,386,PTHR43330:SF7,METHIONINE AMINOPEPTIDASE 1,True
Q4VBS4,"Methionine aminopeptidase 1D, mitochondrial",protein,7955,Danio rerio,Danio rerio (Zebrafish),metap1d,338,PTHR43330:SF8,"METHIONINE AMINOPEPTIDASE 1D, MITOCHONDRIAL",True
Q54VU7,"Methionine aminopeptidase 1D, mitochondrial",protein,44689,Dictyostelium discoideum,Dictyostelium discoideum (Social amoeba),metap1d,404,PTHR43330:SF26,"METHIONINE AMINOPEPTIDASE 1D, MITOCHONDRIAL",True
Q54WU3,Methionine aminopeptidase 1,protein,44689,Dictyostelium discoideum,Dictyostelium discoideum (Social amoeba),metap1,367,PTHR43330:SF7,METHIONINE AMINOPEPTIDASE 1,True
Q59509,Methionine aminopeptidase,protein,340047,Mycoplasma capricolum subsp. capricolum (strain California kid / ATCC 27343 / NCTC 10154),Mycoplasma capricolum subsp. capricolum (strain California kid / ATCC 27343 / NCTC 10154),map,251,PTHR43330:SF27,METHIONINE AMINOPEPTIDASE,True
Q5HEN6,Methionine aminopeptidase,protein,93062,Staphylococcus aureus (strain COL),Staphylococcus aureus (strain COL),map,252,PTHR43330:SF13,METHIONINE AMINOPEPTIDASE 2,True
Q5HN46,Methionine aminopeptidase,protein,176279,Staphylococcus epidermidis (strain ATCC 35984 / DSM 28319 / BCRC 17069 / CCUG 31568 / BM 3577 / RP62A),Staphylococcus epidermidis (strain ATCC 35984 / DSM 28319 / BCRC 17069 / CCUG 31568 / BM 3577 / RP62A),map,251,PTHR43330:SF13,METHIONINE AMINOPEPTIDASE 2,True
Q5I0A0,Methionine aminopeptidase 1,protein,8364,Xenopus tropicalis,Xenopus tropicalis (Western clawed frog),metap1,385,PTHR43330:SF7,METHIONINE AMINOPEPTIDASE 1,True
Q5RBF3,Methionine aminopeptidase 1,protein,9601,Pongo abelii,Pongo abelii (Sumatran orangutan),METAP1,386,PTHR43330:SF7,METHIONINE AMINOPEPTIDASE 1,True
Q5ZIM5,Methionine aminopeptidase 1,protein,9031,Gallus gallus,Gallus gallus (Chicken),METAP1,385,PTHR43330:SF7,METHIONINE AMINOPEPTIDASE 1,True
Q6G846,Methionine aminopeptidase,protein,282459,Staphylococcus aureus (strain MSSA476),Staphylococcus aureus (strain MSSA476),map,252,PTHR43330:SF13,METHIONINE AMINOPEPTIDASE 2,True
Q6GFG9,Methionine aminopeptidase,protein,282458,Staphylococcus aureus (strain MRSA252),Staphylococcus aureus (strain MRSA252),map,252,PTHR43330:SF13,METHIONINE AMINOPEPTIDASE 2,True
Q6UB28,"Methionine aminopeptidase 1D, mitochondrial",protein,9606,Homo sapiens,Homo sapiens (Human),METAP1D,335,PTHR43330:SF8,"METHIONINE AMINOPEPTIDASE 1D, MITOCHONDRIAL",True
Q7ZWV9,Methionine aminopeptidase 1,protein,8355,Xenopus laevis,Xenopus laevis (African clawed frog),metap1,385,PTHR43330:SF7,METHIONINE AMINOPEPTIDASE 1,True
Q89AP3,Methionine aminopeptidase,protein,224915,Buchnera aphidicola subsp. Baizongia pistaciae (strain Bp),Buchnera aphidicola subsp. Baizongia pistaciae (strain Bp),map,266,PTHR43330:SF27,METHIONINE AMINOPEPTIDASE,True
Q8BP48,Methionine aminopeptidase 1,protein,10090,Mus musculus,Mus musculus (Mouse),Metap1,386,PTHR43330:SF7,METHIONINE AMINOPEPTIDASE 1,True
Q8CRU9,Methionine aminopeptidase,protein,176280,Staphylococcus epidermidis (strain ATCC 12228 / FDA PCI 1200),Staphylococcus epidermidis (strain ATCC 12228 / FDA PCI 1200),map,251,PTHR43330:SF13,METHIONINE AMINOPEPTIDASE 2,True
Q8IJP2,Methionine aminopeptidase 1b,protein,36329,Plasmodium falciparum (isolate 3D7),Plasmodium falciparum (isolate 3D7),METAP1b,517,PTHR43330:SF7,METHIONINE AMINOPEPTIDASE 1,True
Q8K9T1,Methionine aminopeptidase,protein,198804,Buchnera aphidicola subsp. Schizaphis graminum (strain Sg),Buchnera aphidicola subsp. Schizaphis graminum (strain Sg),map,261,PTHR43330:SF27,METHIONINE AMINOPEPTIDASE,True
Q9CPW9,"Methionine aminopeptidase 1D, mitochondrial",protein,10090,Mus musculus,Mus musculus (Mouse),Metap1d,335,PTHR43330:SF8,"METHIONINE AMINOPEPTIDASE 1D, MITOCHONDRIAL",True
Q9FV50,"Methionine aminopeptidase 1D, chloroplastic/mitochondrial",protein,3702,Arabidopsis thaliana,Arabidopsis thaliana (Mouse-ear cress),MAP1D,350,PTHR43330:SF8,"METHIONINE AMINOPEPTIDASE 1D, MITOCHONDRIAL",True
Q9FV51,"Methionine aminopeptidase 1C, chloroplastic/mitochondrial",protein,3702,Arabidopsis thaliana,Arabidopsis thaliana (Mouse-ear cress),MAP1C,344,PTHR43330:SF21,"METHIONINE AMINOPEPTIDASE 1C, CHLOROPLASTIC_MITOCHONDRIAL",True
Q9FV52,"Methionine aminopeptidase 1B, chloroplastic",protein,3702,Arabidopsis thaliana,Arabidopsis thaliana (Mouse-ear cress),MAP1B,369,PTHR43330:SF1,"METHIONINE AMINOPEPTIDASE 1B, CHLOROPLASTIC",True
Q9PL68,Methionine aminopeptidase,protein,243161,Chlamydia muridarum (strain MoPn / Nigg),Chlamydia muridarum (strain MoPn / Nigg),map,291,PTHR43330:SF27,METHIONINE AMINOPEPTIDASE,True
Q9SLN5,Methionine aminopeptidase 1A,protein,3702,Arabidopsis thaliana,Arabidopsis thaliana (Mouse-ear cress),MAP1A,398,PTHR43330:SF7,METHIONINE AMINOPEPTIDASE 1,True
Q9Z6Q0,Methionine aminopeptidase,protein,83558,Chlamydia pneumoniae,Chlamydia pneumoniae,map,291,PTHR43330:SF27,METHIONINE AMINOPEPTIDASE,True
Q9Z9J4,Methionine aminopeptidase,protein,272558,Halalkalibacterium halodurans (strain ATCC BAA-125 / DSM 18197 / FERM 7344 / JCM 9153 / C-125),Halalkalibacterium halodurans (strain ATCC BAA-125 / DSM 18197 / FERM 7344 / JCM 9153 / C-125),map,248,PTHR43330:SF27,METHIONINE AMINOPEPTIDASE,True
Q9ZCD3,Methionine aminopeptidase,protein,272947,Rickettsia prowazekii (strain Madrid E),Rickettsia prowazekii (strain Madrid E),map,259,PTHR43330:SF11,PEPTIDASE M24 DOMAIN-CONTAINING PROTEIN,True
Q9ZJT0,Methionine aminopeptidase,protein,85963,Helicobacter pylori (strain J99 / ATCC 700824),Helicobacter pylori (strain J99 / ATCC 700824),map,253,PTHR43330:SF27,METHIONINE AMINOPEPTIDASE,True
