id,name,entry_type,source_tax_id,source_tax_name,full_tax_name,gene,length,subfamily,subfamily_name,in_alphafold
Q0B2K2,NAD(P)H dehydrogenase (quinone),protein,339670,Burkholderia ambifaria (strain ATCC BAA-244 / DSM 16087 / CCUG 44356 / LMG 19182 / AMMD),Burkholderia ambifaria (strain ATCC BAA-244 / DSM 16087 / CCUG 44356 / LMG 19182 / AMMD),Bamb_6077,200,PTHR30546:SF23,FLAVOPROTEIN-LIKE PROTEIN YCP4-RELATED,True
Q0T630,NAD(P)H dehydrogenase (quinone),protein,373384,Shigella flexneri serotype 5b (strain 8401),Shigella flexneri serotype 5b (strain 8401),SFV_1016,198,PTHR30546:SF23,FLAVOPROTEIN-LIKE PROTEIN YCP4-RELATED,True
Q0TJ63,NAD(P)H dehydrogenase (quinone),protein,362663,Escherichia coli O6:K15:H31 (strain 536 / UPEC),Escherichia coli O6:K15:H31 (strain 536 / UPEC),ECP_1003,198,PTHR30546:SF23,FLAVOPROTEIN-LIKE PROTEIN YCP4-RELATED,True
Q11IN8,NAD(P)H dehydrogenase (quinone),protein,266779,Chelativorans sp. (strain BNC1),Chelativorans sp. (strain BNC1),Meso_1341,199,PTHR30546:SF23,FLAVOPROTEIN-LIKE PROTEIN YCP4-RELATED,True
Q12335,Protoplast secreted protein 2,protein,559292,Saccharomyces cerevisiae (strain ATCC 204508 / S288c),Saccharomyces cerevisiae (strain ATCC 204508 / S288c) (Baker's yeast),PST2,198,PTHR30546:SF23,FLAVOPROTEIN-LIKE PROTEIN YCP4-RELATED,True
Q130C0,NAD(P)H dehydrogenase (quinone),protein,316057,Rhodopseudomonas palustris (strain BisB5),Rhodopseudomonas palustris (strain BisB5),RPD_4352,199,PTHR30546:SF23,FLAVOPROTEIN-LIKE PROTEIN YCP4-RELATED,True
Q1BIC1,NAD(P)H dehydrogenase (quinone),protein,331271,Burkholderia orbicola (strain AU 1054),Burkholderia orbicola (strain AU 1054),Bcen_5766,200,PTHR30546:SF23,FLAVOPROTEIN-LIKE PROTEIN YCP4-RELATED,True
Q1C8L9,NAD(P)H dehydrogenase (quinone),protein,360102,Yersinia pestis bv. Antiqua (strain Antiqua),Yersinia pestis bv. Antiqua (strain Antiqua),YPA_1236,199,PTHR30546:SF23,FLAVOPROTEIN-LIKE PROTEIN YCP4-RELATED,True
Q1CHD6,NAD(P)H dehydrogenase (quinone),protein,377628,Yersinia pestis bv. Antiqua (strain Nepal516),Yersinia pestis bv. Antiqua (strain Nepal516),YPN_2266,199,PTHR30546:SF23,FLAVOPROTEIN-LIKE PROTEIN YCP4-RELATED,True
Q1LFW3,NAD(P)H dehydrogenase (quinone),protein,266264,Cupriavidus metallidurans (strain ATCC 43123 / DSM 2839 / NBRC 102507 / CH34),Cupriavidus metallidurans (strain ATCC 43123 / DSM 2839 / NBRC 102507 / CH34),Rmet_4096,199,PTHR30546:SF23,FLAVOPROTEIN-LIKE PROTEIN YCP4-RELATED,True
Q1MHW6,NAD(P)H dehydrogenase (quinone),protein,216596,Rhizobium johnstonii (strain DSM 114642 / LMG 32736 / 3841),Rhizobium johnstonii (strain DSM 114642 / LMG 32736 / 3841),RL1951,198,PTHR30546:SF23,FLAVOPROTEIN-LIKE PROTEIN YCP4-RELATED,True
Q1QYF4,NAD(P)H dehydrogenase (quinone),protein,290398,Chromohalobacter israelensis (strain ATCC BAA-138 / DSM 3043 / CIP 106854 / NCIMB 13768 / 1H11),Chromohalobacter israelensis (strain ATCC BAA-138 / DSM 3043 / CIP 106854 / NCIMB 13768 / 1H11),Csal_1148,201,PTHR30546:SF23,FLAVOPROTEIN-LIKE PROTEIN YCP4-RELATED,True
Q1RDL3,NAD(P)H dehydrogenase (quinone),protein,364106,Escherichia coli (strain UTI89 / UPEC),Escherichia coli (strain UTI89 / UPEC),UTI89_C1067,198,PTHR30546:SF23,FLAVOPROTEIN-LIKE PROTEIN YCP4-RELATED,True
Q21B81,NAD(P)H dehydrogenase (quinone),protein,316056,Rhodopseudomonas palustris (strain BisB18),Rhodopseudomonas palustris (strain BisB18),RPC_0784,199,PTHR30546:SF23,FLAVOPROTEIN-LIKE PROTEIN YCP4-RELATED,True
Q2IRH1,NAD(P)H dehydrogenase (quinone),protein,316058,Rhodopseudomonas palustris (strain HaA2),Rhodopseudomonas palustris (strain HaA2),RPB_4506,199,PTHR30546:SF23,FLAVOPROTEIN-LIKE PROTEIN YCP4-RELATED,True
Q2LPM7,NAD(P)H dehydrogenase (quinone),protein,56780,Syntrophus aciditrophicus (strain SB),Syntrophus aciditrophicus (strain SB),SYNAS_03520,203,PTHR30546:SF23,FLAVOPROTEIN-LIKE PROTEIN YCP4-RELATED,True
Q2RXG7,NAD(P)H dehydrogenase (quinone),protein,269796,Rhodospirillum rubrum (strain ATCC 11170 / ATH 1.1.1 / DSM 467 / LMG 4362 / NCIMB 8255 / S1),Rhodospirillum rubrum (strain ATCC 11170 / ATH 1.1.1 / DSM 467 / LMG 4362 / NCIMB 8255 / S1),Rru_A0373,202,PTHR30546:SF23,FLAVOPROTEIN-LIKE PROTEIN YCP4-RELATED,True
Q2YQ23,NAD(P)H dehydrogenase (quinone),protein,359391,Brucella abortus (strain 2308),Brucella abortus (strain 2308),BAB1_1070,199,PTHR30546:SF23,FLAVOPROTEIN-LIKE PROTEIN YCP4-RELATED,True
Q31GW8,NAD(P)H dehydrogenase (quinone),protein,317025,Hydrogenovibrio crunogenus (strain DSM 25203 / XCL-2),Hydrogenovibrio crunogenus (strain DSM 25203 / XCL-2),Tcr_1010,201,PTHR30546:SF23,FLAVOPROTEIN-LIKE PROTEIN YCP4-RELATED,True
Q32HQ6,NAD(P)H dehydrogenase (quinone),protein,300267,Shigella dysenteriae serotype 1 (strain Sd197),Shigella dysenteriae serotype 1 (strain Sd197),SDY_0980,198,PTHR30546:SF23,FLAVOPROTEIN-LIKE PROTEIN YCP4-RELATED,True
Q39LI8,NAD(P)H dehydrogenase (quinone),protein,482957,Burkholderia lata (strain ATCC 17760 / DSM 23089 / LMG 22485 / NCIMB 9086 / R18194 / 383),Burkholderia lata (strain ATCC 17760 / DSM 23089 / LMG 22485 / NCIMB 9086 / R18194 / 383),Bcep18194_C7634,200,PTHR30546:SF23,FLAVOPROTEIN-LIKE PROTEIN YCP4-RELATED,True
Q39XL1,NAD(P)H dehydrogenase (quinone),protein,269799,Geobacter metallireducens (strain ATCC 53774 / DSM 7210 / GS-15),Geobacter metallireducens (strain ATCC 53774 / DSM 7210 / GS-15),Gmet_0771,203,PTHR30546:SF23,FLAVOPROTEIN-LIKE PROTEIN YCP4-RELATED,True
Q3J8H5,NAD(P)H dehydrogenase (quinone),protein,323261,Nitrosococcus oceani (strain ATCC 19707 / BCRC 17464 / JCM 30415 / NCIMB 11848 / C-107),Nitrosococcus oceani (strain ATCC 19707 / BCRC 17464 / JCM 30415 / NCIMB 11848 / C-107),Noc_2414,200,PTHR30546:SF23,FLAVOPROTEIN-LIKE PROTEIN YCP4-RELATED,True
Q3SU01,NAD(P)H dehydrogenase (quinone),protein,323098,Nitrobacter winogradskyi (strain ATCC 25391 / DSM 10237 / CIP 104748 / NCIMB 11846 / Nb-255),Nitrobacter winogradskyi (strain ATCC 25391 / DSM 10237 / CIP 104748 / NCIMB 11846 / Nb-255),Nwi_0978,199,PTHR30546:SF23,FLAVOPROTEIN-LIKE PROTEIN YCP4-RELATED,True
Q3Z3B7,NAD(P)H dehydrogenase (quinone),protein,300269,Shigella sonnei (strain Ss046),Shigella sonnei (strain Ss046),SSON_1014,201,PTHR30546:SF23,FLAVOPROTEIN-LIKE PROTEIN YCP4-RELATED,True
Q46B88,NAD(P)H dehydrogenase (quinone),protein,269797,Methanosarcina barkeri (strain Fusaro / DSM 804),Methanosarcina barkeri (strain Fusaro / DSM 804),Mbar_A1914,208,PTHR30546:SF23,FLAVOPROTEIN-LIKE PROTEIN YCP4-RELATED,True
Q57D82,NAD(P)H dehydrogenase (quinone),protein,262698,Brucella abortus biovar 1 (strain 9-941),Brucella abortus biovar 1 (strain 9-941),BruAb1_1054,199,PTHR30546:SF23,FLAVOPROTEIN-LIKE PROTEIN YCP4-RELATED,True
Q59Y37,NAD(P)H quinone oxidoreductase PST2,protein,237561,Candida albicans (strain SC5314 / ATCC MYA-2876),Candida albicans (strain SC5314 / ATCC MYA-2876) (Yeast),PST2,201,PTHR30546:SF23,FLAVOPROTEIN-LIKE PROTEIN YCP4-RELATED,True
Q5P5L5,NAD(P)H dehydrogenase (quinone),protein,76114,Aromatoleum aromaticum (strain DSM 19018 / LMG 30748 / EbN1),Aromatoleum aromaticum (strain DSM 19018 / LMG 30748 / EbN1),AZOSEA12720,207,PTHR30546:SF23,FLAVOPROTEIN-LIKE PROTEIN YCP4-RELATED,True
Q5PG91,NAD(P)H dehydrogenase (quinone),protein,295319,Salmonella paratyphi A (strain ATCC 9150 / SARB42),Salmonella paratyphi A (strain ATCC 9150 / SARB42),SPA1731,198,PTHR30546:SF23,FLAVOPROTEIN-LIKE PROTEIN YCP4-RELATED,True
Q66BP3,NAD(P)H dehydrogenase (quinone),protein,273123,Yersinia pseudotuberculosis serotype I (strain IP32953),Yersinia pseudotuberculosis serotype I (strain IP32953),YPTB1728,199,PTHR30546:SF23,FLAVOPROTEIN-LIKE PROTEIN YCP4-RELATED,True
Q6NBB9,NAD(P)H dehydrogenase (quinone),protein,258594,Rhodopseudomonas palustris (strain ATCC BAA-98 / CGA009),Rhodopseudomonas palustris (strain ATCC BAA-98 / CGA009),RPA0909,199,PTHR30546:SF23,FLAVOPROTEIN-LIKE PROTEIN YCP4-RELATED,True
Q6NQE2,Probable NAD(P)H dehydrogenase (quinone) FQR1-like 1,protein,3702,Arabidopsis thaliana,Arabidopsis thaliana (Mouse-ear cress),At4g27270,205,PTHR30546:SF46,NAD(P)H DEHYDROGENASE (QUINONE) FQR1-LIKE 1-RELATED,True
Q74F05,NAD(P)H dehydrogenase (quinone),protein,243231,Geobacter sulfurreducens (strain ATCC 51573 / DSM 12127 / PCA),Geobacter sulfurreducens (strain ATCC 51573 / DSM 12127 / PCA),GSU0804,203,PTHR30546:SF23,FLAVOPROTEIN-LIKE PROTEIN YCP4-RELATED,True
Q7N5I5,NAD(P)H dehydrogenase (quinone),protein,243265,Photorhabdus laumondii subsp. laumondii (strain DSM 15139 / CIP 105565 / TT01),Photorhabdus laumondii subsp. laumondii (strain DSM 15139 / CIP 105565 / TT01),plu1964,199,PTHR30546:SF23,FLAVOPROTEIN-LIKE PROTEIN YCP4-RELATED,True
Q89D74,NAD(P)H dehydrogenase (quinone),protein,224911,Bradyrhizobium diazoefficiens (strain JCM 10833 / BCRC 13528 / IAM 13628 / NBRC 14792 / USDA 110),Bradyrhizobium diazoefficiens (strain JCM 10833 / BCRC 13528 / IAM 13628 / NBRC 14792 / USDA 110),blr7568,199,PTHR30546:SF23,FLAVOPROTEIN-LIKE PROTEIN YCP4-RELATED,True
Q8G0P0,NAD(P)H dehydrogenase (quinone),protein,204722,Brucella suis biovar 1 (strain 1330),Brucella suis biovar 1 (strain 1330),BR1049,199,PTHR30546:SF23,FLAVOPROTEIN-LIKE PROTEIN YCP4-RELATED,True
Q8PUV4,NAD(P)H dehydrogenase (quinone),protein,192952,Methanosarcina mazei (strain ATCC BAA-159 / DSM 3647 / Goe1 / Go1 / JCM 11833 / OCM 88),Methanosarcina mazei (strain ATCC BAA-159 / DSM 3647 / Goe1 / Go1 / JCM 11833 / OCM 88),MM_2224,209,PTHR30546:SF23,FLAVOPROTEIN-LIKE PROTEIN YCP4-RELATED,True
Q8X4B4,NAD(P)H dehydrogenase (quinone),protein,83334,Escherichia coli O157:H7,Escherichia coli O157:H7,Z1423/Z1504,198,PTHR30546:SF23,FLAVOPROTEIN-LIKE PROTEIN YCP4-RELATED,True
Q8YH68,NAD(P)H dehydrogenase (quinone),protein,224914,Brucella melitensis biotype 1 (strain ATCC 23456 / CCUG 17765 / NCTC 10094 / 16M),Brucella melitensis biotype 1 (strain ATCC 23456 / CCUG 17765 / NCTC 10094 / 16M),BMEI0936,199,PTHR30546:SF23,FLAVOPROTEIN-LIKE PROTEIN YCP4-RELATED,True
Q8Z7N9,NAD(P)H dehydrogenase (quinone),protein,90370,Salmonella typhi,Salmonella typhi,STY1155,198,PTHR30546:SF23,FLAVOPROTEIN-LIKE PROTEIN YCP4-RELATED,True
Q8ZF61,NAD(P)H dehydrogenase (quinone),protein,632,Yersinia pestis,Yersinia pestis,YPO1857,199,PTHR30546:SF23,FLAVOPROTEIN-LIKE PROTEIN YCP4-RELATED,True
Q8ZQ40,NAD(P)H dehydrogenase (quinone),protein,99287,Salmonella typhimurium (strain LT2 / SGSC1412 / ATCC 700720),Salmonella typhimurium (strain LT2 / SGSC1412 / ATCC 700720),STM1119,198,PTHR30546:SF23,FLAVOPROTEIN-LIKE PROTEIN YCP4-RELATED,True
Q92PU3,NAD(P)H dehydrogenase (quinone) 1,protein,266834,Rhizobium meliloti (strain 1021),Rhizobium meliloti (strain 1021) (Ensifer meliloti),R01635,199,PTHR30546:SF23,FLAVOPROTEIN-LIKE PROTEIN YCP4-RELATED,True
Q92Y27,NAD(P)H dehydrogenase (quinone) 3,protein,266834,Rhizobium meliloti (strain 1021),Rhizobium meliloti (strain 1021) (Ensifer meliloti),RA1061,212,PTHR30546:SF23,FLAVOPROTEIN-LIKE PROTEIN YCP4-RELATED,True
Q930L2,NAD(P)H dehydrogenase (quinone) 2,protein,266834,Rhizobium meliloti (strain 1021),Rhizobium meliloti (strain 1021) (Ensifer meliloti),RA0183,202,PTHR30546:SF23,FLAVOPROTEIN-LIKE PROTEIN YCP4-RELATED,True
Q9AA17,NAD(P)H dehydrogenase (quinone),protein,190650,Caulobacter vibrioides (strain ATCC 19089 / CIP 103742 / CB 15),Caulobacter vibrioides (strain ATCC 19089 / CIP 103742 / CB 15),CC_0791,199,PTHR30546:SF23,FLAVOPROTEIN-LIKE PROTEIN YCP4-RELATED,True
Q9AYU0,Quinone-oxidoreductase QR2,protein,64093,Triphysaria versicolor,Triphysaria versicolor (Yellow owl's clover),,205,PTHR30546:SF56,NAD(P)H DEHYDROGENASE (QUINONE),True
Q9I509,NAD(P)H dehydrogenase (quinone),protein,208964,Pseudomonas aeruginosa (strain ATCC 15692 / DSM 22644 / CIP 104116 / JCM 14847 / LMG 12228 / 1C / PRS 101 / PAO1),Pseudomonas aeruginosa (strain ATCC 15692 / DSM 22644 / CIP 104116 / JCM 14847 / LMG 12228 / 1C / PRS 101 / PAO1),PA0949,198,PTHR30546:SF23,FLAVOPROTEIN-LIKE PROTEIN YCP4-RELATED,True
Q9LSQ5,NAD(P)H dehydrogenase (quinone) FQR1,protein,3702,Arabidopsis thaliana,Arabidopsis thaliana (Mouse-ear cress),FQR1,204,PTHR30546:SF23,FLAVOPROTEIN-LIKE PROTEIN YCP4-RELATED,True
Q9LUX9,Probable NAD(P)H dehydrogenase (quinone) FQR1-like 3,protein,3702,Arabidopsis thaliana,Arabidopsis thaliana (Mouse-ear cress),At5g58800,207,PTHR30546:SF25,NAD(P)H DEHYDROGENASE (QUINONE) FQR1-LIKE 3-RELATED,True
Q9RYU4,NAD(P)H dehydrogenase (quinone),protein,243230,Deinococcus radiodurans (strain ATCC 13939 / DSM 20539 / JCM 16871 / CCUG 27074 / LMG 4051 / NBRC 15346 / NCIMB 9279 / VKM B-1422 / R1),Deinococcus radiodurans (strain ATCC 13939 / DSM 20539 / JCM 16871 / CCUG 27074 / LMG 4051 / NBRC 15346 / NCIMB 9279 / VKM B-1422 / R1),DR_A0214,200,PTHR30546:SF23,FLAVOPROTEIN-LIKE PROTEIN YCP4-RELATED,True
Q9XBR5,NAD(P)H dehydrogenase (quinone),protein,264203,Zymomonas mobilis subsp. mobilis (strain ATCC 31821 / ZM4 / CP4),Zymomonas mobilis subsp. mobilis (strain ATCC 31821 / ZM4 / CP4),trpR,200,PTHR30546:SF23,FLAVOPROTEIN-LIKE PROTEIN YCP4-RELATED,True
