id,name,entry_type,source_tax_id,source_tax_name,full_tax_name,gene,length,subfamily,subfamily_name,in_alphafold
A0A0H2ZDT7,Flavodoxin FldP,protein,208963,Pseudomonas aeruginosa (strain UCBPP-PA14),Pseudomonas aeruginosa (strain UCBPP-PA14),fldP,184,PTHR30546:SF23,FLAVOPROTEIN-LIKE PROTEIN YCP4-RELATED,True
A0A1D8PHR5,NAD(P)H quinone oxidoreductase PST1,protein,237561,Candida albicans (strain SC5314 / ATCC MYA-2876),Candida albicans (strain SC5314 / ATCC MYA-2876) (Yeast),PST1,198,PTHR30546:SF23,FLAVOPROTEIN-LIKE PROTEIN YCP4-RELATED,True
A0A1D8PT02,NAD(P)H quinone oxidoreductase PST3,protein,237561,Candida albicans (strain SC5314 / ATCC MYA-2876),Candida albicans (strain SC5314 / ATCC MYA-2876) (Yeast),PST3,199,PTHR30546:SF23,FLAVOPROTEIN-LIKE PROTEIN YCP4-RELATED,True
A0A1D8PT03,NAD(P)H quinone oxidoreductase YCP4,protein,237561,Candida albicans (strain SC5314 / ATCC MYA-2876),Candida albicans (strain SC5314 / ATCC MYA-2876) (Yeast),YCP4,288,PTHR30546:SF23,FLAVOPROTEIN-LIKE PROTEIN YCP4-RELATED,True
A0KCF0,NAD(P)H dehydrogenase (quinone),protein,331272,Burkholderia cenocepacia (strain HI2424),Burkholderia cenocepacia (strain HI2424),Bcen2424_6131,200,PTHR30546:SF23,FLAVOPROTEIN-LIKE PROTEIN YCP4-RELATED,True
A0LNQ8,NAD(P)H dehydrogenase (quinone),protein,335543,Syntrophobacter fumaroxidans (strain DSM 10017 / MPOB),Syntrophobacter fumaroxidans (strain DSM 10017 / MPOB),Sfum_3387,204,PTHR30546:SF23,FLAVOPROTEIN-LIKE PROTEIN YCP4-RELATED,True
A1A9Q9,NAD(P)H dehydrogenase (quinone),protein,405955,Escherichia coli O1:K1 / APEC,Escherichia coli O1:K1 / APEC,Ecok1_09050,198,PTHR30546:SF23,FLAVOPROTEIN-LIKE PROTEIN YCP4-RELATED,True
A1BAT3,NAD(P)H dehydrogenase (quinone),protein,318586,Paracoccus denitrificans (strain Pd 1222),Paracoccus denitrificans (strain Pd 1222),Pden_4564,208,PTHR30546:SF23,FLAVOPROTEIN-LIKE PROTEIN YCP4-RELATED,True
A1JMU2,NAD(P)H dehydrogenase (quinone),protein,393305,Yersinia enterocolitica serotype O:8 / biotype 1B (strain NCTC 13174 / 8081),Yersinia enterocolitica serotype O:8 / biotype 1B (strain NCTC 13174 / 8081),YE1941,199,PTHR30546:SF23,FLAVOPROTEIN-LIKE PROTEIN YCP4-RELATED,True
A1K9S9,NAD(P)H dehydrogenase (quinone),protein,418699,Azoarcus sp. (strain BH72),Azoarcus sp. (strain BH72),azo2968,199,PTHR30546:SF23,FLAVOPROTEIN-LIKE PROTEIN YCP4-RELATED,True
A1U5D9,NAD(P)H dehydrogenase (quinone),protein,351348,Marinobacter nauticus (strain ATCC 700491 / DSM 11845 / VT8),Marinobacter nauticus (strain ATCC 700491 / DSM 11845 / VT8),Maqu_3134,199,PTHR30546:SF23,FLAVOPROTEIN-LIKE PROTEIN YCP4-RELATED,True
A1WUN2,NAD(P)H dehydrogenase (quinone),protein,349124,Halorhodospira halophila (strain DSM 244 / SL1),Halorhodospira halophila (strain DSM 244 / SL1),Hhal_0608,198,PTHR30546:SF23,FLAVOPROTEIN-LIKE PROTEIN YCP4-RELATED,True
A4JT91,NAD(P)H dehydrogenase (quinone),protein,269482,Burkholderia vietnamiensis (strain G4 / LMG 22486),Burkholderia vietnamiensis (strain G4 / LMG 22486),Bcep1808_6600,200,PTHR30546:SF23,FLAVOPROTEIN-LIKE PROTEIN YCP4-RELATED,True
A4TK49,NAD(P)H dehydrogenase (quinone),protein,386656,Yersinia pestis (strain Pestoides F),Yersinia pestis (strain Pestoides F),YPDSF_1268,199,PTHR30546:SF23,FLAVOPROTEIN-LIKE PROTEIN YCP4-RELATED,True
A4W916,NAD(P)H dehydrogenase (quinone),protein,399742,Enterobacter sp. (strain 638),Enterobacter sp. (strain 638),Ent638_1516,198,PTHR30546:SF23,FLAVOPROTEIN-LIKE PROTEIN YCP4-RELATED,True
A4Z0W6,NAD(P)H dehydrogenase (quinone),protein,114615,Bradyrhizobium sp. (strain ORS 278),Bradyrhizobium sp. (strain ORS 278),BRADO6142,199,PTHR30546:SF23,FLAVOPROTEIN-LIKE PROTEIN YCP4-RELATED,True
A5ECG6,NAD(P)H dehydrogenase (quinone),protein,288000,Bradyrhizobium sp. (strain BTAi1 / ATCC BAA-1182),Bradyrhizobium sp. (strain BTAi1 / ATCC BAA-1182),BBta_1650,199,PTHR30546:SF23,FLAVOPROTEIN-LIKE PROTEIN YCP4-RELATED,True
A5G020,NAD(P)H dehydrogenase (quinone),protein,349163,Acidiphilium cryptum (strain JF-5),Acidiphilium cryptum (strain JF-5),Acry_2002,199,PTHR30546:SF23,FLAVOPROTEIN-LIKE PROTEIN YCP4-RELATED,True
A5G4G8,NAD(P)H dehydrogenase (quinone),protein,351605,Geotalea uraniireducens (strain Rf4),Geotalea uraniireducens (strain Rf4),Gura_2508,203,PTHR30546:SF23,FLAVOPROTEIN-LIKE PROTEIN YCP4-RELATED,True
A5VA47,NAD(P)H dehydrogenase (quinone),protein,392499,Rhizorhabdus wittichii (strain DSM 6014 / CCUG 31198 / JCM 15750 / NBRC 105917 / EY 4224 / RW1),Rhizorhabdus wittichii (strain DSM 6014 / CCUG 31198 / JCM 15750 / NBRC 105917 / EY 4224 / RW1),Swit_2810,199,PTHR30546:SF23,FLAVOPROTEIN-LIKE PROTEIN YCP4-RELATED,True
A5VQI8,NAD(P)H dehydrogenase (quinone),protein,444178,Brucella ovis (strain ATCC 25840 / 63/290 / NCTC 10512),Brucella ovis (strain ATCC 25840 / 63/290 / NCTC 10512),BOV_1014,199,PTHR30546:SF23,FLAVOPROTEIN-LIKE PROTEIN YCP4-RELATED,True
A6W2V6,NAD(P)H dehydrogenase (quinone),protein,400668,Marinomonas sp. (strain MWYL1),Marinomonas sp. (strain MWYL1),Mmwyl1_4139,198,PTHR30546:SF23,FLAVOPROTEIN-LIKE PROTEIN YCP4-RELATED,True
A6X0U8,NAD(P)H dehydrogenase (quinone),protein,439375,Brucella anthropi (strain ATCC 49188 / DSM 6882 / CCUG 24695 / JCM 21032 / LMG 3331 / NBRC 15819 / NCTC 12168 / Alc 37),Brucella anthropi (strain ATCC 49188 / DSM 6882 / CCUG 24695 / JCM 21032 / LMG 3331 / NBRC 15819 / NCTC 12168 / Alc 37),Oant_2136,199,PTHR30546:SF23,FLAVOPROTEIN-LIKE PROTEIN YCP4-RELATED,True
A7FJ02,NAD(P)H dehydrogenase (quinone),protein,349747,Yersinia pseudotuberculosis serotype O:1b (strain IP 31758),Yersinia pseudotuberculosis serotype O:1b (strain IP 31758),YpsIP31758_2261,199,PTHR30546:SF23,FLAVOPROTEIN-LIKE PROTEIN YCP4-RELATED,True
A7HVA3,NAD(P)H dehydrogenase (quinone),protein,402881,Parvibaculum lavamentivorans (strain DS-1 / DSM 13023 / NCIMB 13966),Parvibaculum lavamentivorans (strain DS-1 / DSM 13023 / NCIMB 13966),Plav_2222,203,PTHR30546:SF23,FLAVOPROTEIN-LIKE PROTEIN YCP4-RELATED,True
A7IE31,NAD(P)H dehydrogenase (quinone),protein,78245,Xanthobacter autotrophicus (strain ATCC BAA-1158 / Py2),Xanthobacter autotrophicus (strain ATCC BAA-1158 / Py2),Xaut_1023,199,PTHR30546:SF23,FLAVOPROTEIN-LIKE PROTEIN YCP4-RELATED,True
A7ZKA9,NAD(P)H dehydrogenase (quinone),protein,331111,Escherichia coli O139:H28 (strain E24377A / ETEC),Escherichia coli O139:H28 (strain E24377A / ETEC),EcE24377A_1122,198,PTHR30546:SF23,FLAVOPROTEIN-LIKE PROTEIN YCP4-RELATED,True
A7ZYV7,NAD(P)H dehydrogenase (quinone),protein,331112,Escherichia coli O9:H4 (strain HS),Escherichia coli O9:H4 (strain HS),EcHS_A1117,198,PTHR30546:SF23,FLAVOPROTEIN-LIKE PROTEIN YCP4-RELATED,True
A8AI59,NAD(P)H dehydrogenase (quinone),protein,290338,Citrobacter koseri (strain ATCC BAA-895 / CDC 4225-83 / SGSC4696),Citrobacter koseri (strain ATCC BAA-895 / CDC 4225-83 / SGSC4696),CKO_02047,198,PTHR30546:SF23,FLAVOPROTEIN-LIKE PROTEIN YCP4-RELATED,True
A8GCS6,NAD(P)H dehydrogenase (quinone),protein,399741,Serratia proteamaculans (strain 568),Serratia proteamaculans (strain 568),Spro_1813,199,PTHR30546:SF23,FLAVOPROTEIN-LIKE PROTEIN YCP4-RELATED,True
A8HRS7,NAD(P)H dehydrogenase (quinone),protein,438753,Azorhizobium caulinodans (strain ATCC 43989 / DSM 5975 / JCM 20966 / LMG 6465 / NBRC 14845 / NCIMB 13405 / ORS 571),Azorhizobium caulinodans (strain ATCC 43989 / DSM 5975 / JCM 20966 / LMG 6465 / NBRC 14845 / NCIMB 13405 / ORS 571),AZC_4089,199,PTHR30546:SF23,FLAVOPROTEIN-LIKE PROTEIN YCP4-RELATED,True
A9AT43,NAD(P)H dehydrogenase (quinone),protein,395019,Burkholderia multivorans (strain ATCC 17616 / 249),Burkholderia multivorans (strain ATCC 17616 / 249),Bmul_6057,200,PTHR30546:SF23,FLAVOPROTEIN-LIKE PROTEIN YCP4-RELATED,True
A9HFY5,NAD(P)H dehydrogenase (quinone),protein,272568,Gluconacetobacter diazotrophicus (strain ATCC 49037 / DSM 5601 / CCUG 37298 / CIP 103539 / LMG 7603 / PAl5),Gluconacetobacter diazotrophicus (strain ATCC 49037 / DSM 5601 / CCUG 37298 / CIP 103539 / LMG 7603 / PAl5),GDI1484,199,PTHR30546:SF23,FLAVOPROTEIN-LIKE PROTEIN YCP4-RELATED,True
A9M560,NAD(P)H dehydrogenase (quinone),protein,483179,Brucella canis (strain ATCC 23365 / NCTC 10854 / RM-666),Brucella canis (strain ATCC 23365 / NCTC 10854 / RM-666),BCAN_A1063,199,PTHR30546:SF23,FLAVOPROTEIN-LIKE PROTEIN YCP4-RELATED,True
A9MH45,NAD(P)H dehydrogenase (quinone),protein,41514,Salmonella arizonae (strain ATCC BAA-731 / CDC346-86 / RSK2980),Salmonella arizonae (strain ATCC BAA-731 / CDC346-86 / RSK2980),SARI_01881,198,PTHR30546:SF23,FLAVOPROTEIN-LIKE PROTEIN YCP4-RELATED,True
A9N6R4,NAD(P)H dehydrogenase (quinone),protein,1016998,Salmonella paratyphi B (strain ATCC BAA-1250 / SPB7),Salmonella paratyphi B (strain ATCC BAA-1250 / SPB7),SPAB_02430,198,PTHR30546:SF23,FLAVOPROTEIN-LIKE PROTEIN YCP4-RELATED,True
A9R7R8,NAD(P)H dehydrogenase (quinone),protein,349746,Yersinia pestis bv. Antiqua (strain Angola),Yersinia pestis bv. Antiqua (strain Angola),YpAngola_A2043,199,PTHR30546:SF23,FLAVOPROTEIN-LIKE PROTEIN YCP4-RELATED,True
A9VY95,NAD(P)H dehydrogenase (quinone),protein,419610,Methylorubrum extorquens (strain PA1),Methylorubrum extorquens (strain PA1),Mext_4280,199,PTHR30546:SF23,FLAVOPROTEIN-LIKE PROTEIN YCP4-RELATED,True
B0CGJ9,NAD(P)H dehydrogenase (quinone),protein,470137,Brucella suis (strain ATCC 23445 / NCTC 10510),Brucella suis (strain ATCC 23445 / NCTC 10510),BSUIS_A1092,199,PTHR30546:SF23,FLAVOPROTEIN-LIKE PROTEIN YCP4-RELATED,True
B0SZC3,NAD(P)H dehydrogenase (quinone),protein,366602,Caulobacter sp. (strain K31),Caulobacter sp. (strain K31),Caul_4332,199,PTHR30546:SF23,FLAVOPROTEIN-LIKE PROTEIN YCP4-RELATED,True
B0UFU2,NAD(P)H dehydrogenase (quinone),protein,426117,Methylobacterium sp. (strain 4-46),Methylobacterium sp. (strain 4-46),M446_2368,199,PTHR30546:SF23,FLAVOPROTEIN-LIKE PROTEIN YCP4-RELATED,True
B1IV93,NAD(P)H dehydrogenase (quinone),protein,481805,Escherichia coli (strain ATCC 8739 / DSM 1576 / NBRC 3972 / NCIMB 8545 / WDCM 00012 / Crooks),Escherichia coli (strain ATCC 8739 / DSM 1576 / NBRC 3972 / NCIMB 8545 / WDCM 00012 / Crooks),EcolC_2591,198,PTHR30546:SF23,FLAVOPROTEIN-LIKE PROTEIN YCP4-RELATED,True
B1JNA9,NAD(P)H dehydrogenase (quinone),protein,502800,Yersinia pseudotuberculosis serotype O:3 (strain YPIII),Yersinia pseudotuberculosis serotype O:3 (strain YPIII),YPK_2363,199,PTHR30546:SF23,FLAVOPROTEIN-LIKE PROTEIN YCP4-RELATED,True
B1KBY1,NAD(P)H dehydrogenase (quinone),protein,406425,Burkholderia orbicola (strain MC0-3),Burkholderia orbicola (strain MC0-3),Bcenmc03_6613,200,PTHR30546:SF23,FLAVOPROTEIN-LIKE PROTEIN YCP4-RELATED,True
B1LJ00,NAD(P)H dehydrogenase (quinone),protein,439855,Escherichia coli (strain SMS-3-5 / SECEC),Escherichia coli (strain SMS-3-5 / SECEC),EcSMS35_2120,198,PTHR30546:SF23,FLAVOPROTEIN-LIKE PROTEIN YCP4-RELATED,True
B1LY35,NAD(P)H dehydrogenase (quinone),protein,426355,Methylobacterium radiotolerans (strain ATCC 27329 / DSM 1819 / JCM 2831 / NBRC 15690 / NCIMB 10815 / 0-1),Methylobacterium radiotolerans (strain ATCC 27329 / DSM 1819 / JCM 2831 / NBRC 15690 / NCIMB 10815 / 0-1),Mrad2831_3831,200,PTHR30546:SF23,FLAVOPROTEIN-LIKE PROTEIN YCP4-RELATED,True
B1X9C5,NAD(P)H dehydrogenase (quinone),protein,316385,Escherichia coli (strain K12 / DH10B),Escherichia coli (strain K12 / DH10B),ECDH10B_1076,198,PTHR30546:SF23,FLAVOPROTEIN-LIKE PROTEIN YCP4-RELATED,True
B1Z3G9,NAD(P)H dehydrogenase (quinone),protein,398577,Burkholderia ambifaria (strain MC40-6),Burkholderia ambifaria (strain MC40-6),BamMC406_5841,200,PTHR30546:SF23,FLAVOPROTEIN-LIKE PROTEIN YCP4-RELATED,True
B1ZJX9,NAD(P)H dehydrogenase (quinone),protein,441620,Methylorubrum populi (strain ATCC BAA-705 / NCIMB 13946 / BJ001),Methylorubrum populi (strain ATCC BAA-705 / NCIMB 13946 / BJ001),Mpop_4797,199,PTHR30546:SF23,FLAVOPROTEIN-LIKE PROTEIN YCP4-RELATED,True
B2IEF8,NAD(P)H dehydrogenase (quinone),protein,395963,Beijerinckia indica subsp. indica (strain ATCC 9039 / DSM 1715 / NCIMB 8712),Beijerinckia indica subsp. indica (strain ATCC 9039 / DSM 1715 / NCIMB 8712),Bind_1932,199,PTHR30546:SF23,FLAVOPROTEIN-LIKE PROTEIN YCP4-RELATED,True
B2JML0,NAD(P)H dehydrogenase (quinone),protein,391038,Paraburkholderia phymatum (strain DSM 17167 / CIP 108236 / LMG 21445 / STM815),Paraburkholderia phymatum (strain DSM 17167 / CIP 108236 / LMG 21445 / STM815),Bphy_3669,199,PTHR30546:SF23,FLAVOPROTEIN-LIKE PROTEIN YCP4-RELATED,True
B2K198,NAD(P)H dehydrogenase (quinone),protein,502801,Yersinia pseudotuberculosis serotype IB (strain PB1/+),Yersinia pseudotuberculosis serotype IB (strain PB1/+),YPTS_1860,199,PTHR30546:SF23,FLAVOPROTEIN-LIKE PROTEIN YCP4-RELATED,True
B2S5Q9,NAD(P)H dehydrogenase (quinone),protein,430066,Brucella abortus (strain S19),Brucella abortus (strain S19),BAbS19_I09910,199,PTHR30546:SF23,FLAVOPROTEIN-LIKE PROTEIN YCP4-RELATED,True
B2T8L2,NAD(P)H dehydrogenase (quinone),protein,398527,Paraburkholderia phytofirmans (strain DSM 17436 / LMG 22146 / PsJN),Paraburkholderia phytofirmans (strain DSM 17436 / LMG 22146 / PsJN),Bphyt_6351,200,PTHR30546:SF23,FLAVOPROTEIN-LIKE PROTEIN YCP4-RELATED,True
B3E9H6,NAD(P)H dehydrogenase (quinone),protein,398767,Trichlorobacter lovleyi (strain ATCC BAA-1151 / DSM 17278 / SZ),Trichlorobacter lovleyi (strain ATCC BAA-1151 / DSM 17278 / SZ),Glov_0105,204,PTHR30546:SF23,FLAVOPROTEIN-LIKE PROTEIN YCP4-RELATED,True
B3QFA1,NAD(P)H dehydrogenase (quinone),protein,395960,Rhodopseudomonas palustris (strain TIE-1),Rhodopseudomonas palustris (strain TIE-1),Rpal_0979,199,PTHR30546:SF23,FLAVOPROTEIN-LIKE PROTEIN YCP4-RELATED,True
B4EPK7,NAD(P)H dehydrogenase (quinone),protein,216591,Burkholderia cenocepacia (strain ATCC BAA-245 / DSM 16553 / LMG 16656 / NCTC 13227 / J2315 / CF5610),Burkholderia cenocepacia (strain ATCC BAA-245 / DSM 16553 / LMG 16656 / NCTC 13227 / J2315 / CF5610),BceJ2315_63650,200,PTHR30546:SF23,FLAVOPROTEIN-LIKE PROTEIN YCP4-RELATED,True
B4T2V2,NAD(P)H dehydrogenase (quinone),protein,423368,Salmonella newport (strain SL254),Salmonella newport (strain SL254),SNSL254_A1214,198,PTHR30546:SF23,FLAVOPROTEIN-LIKE PROTEIN YCP4-RELATED,True
B4TEP2,NAD(P)H dehydrogenase (quinone),protein,454169,Salmonella heidelberg (strain SL476),Salmonella heidelberg (strain SL476),SeHA_C1229,198,PTHR30546:SF23,FLAVOPROTEIN-LIKE PROTEIN YCP4-RELATED,True
B4TSN0,NAD(P)H dehydrogenase (quinone),protein,439843,Salmonella schwarzengrund (strain CVM19633),Salmonella schwarzengrund (strain CVM19633),SeSA_A1183,198,PTHR30546:SF23,FLAVOPROTEIN-LIKE PROTEIN YCP4-RELATED,True
B5BBG6,NAD(P)H dehydrogenase (quinone),protein,554290,Salmonella paratyphi A (strain AKU_12601),Salmonella paratyphi A (strain AKU_12601),SSPA1609,198,PTHR30546:SF23,FLAVOPROTEIN-LIKE PROTEIN YCP4-RELATED,True
B5EMU4,NAD(P)H dehydrogenase (quinone),protein,380394,Acidithiobacillus ferrooxidans (strain ATCC 53993 / BNL-5-31),Acidithiobacillus ferrooxidans (strain ATCC 53993 / BNL-5-31),Lferr_0620,200,PTHR30546:SF23,FLAVOPROTEIN-LIKE PROTEIN YCP4-RELATED,True
B5F202,NAD(P)H dehydrogenase (quinone),protein,454166,Salmonella agona (strain SL483),Salmonella agona (strain SL483),SeAg_B1078,198,PTHR30546:SF23,FLAVOPROTEIN-LIKE PROTEIN YCP4-RELATED,True
B5FR47,NAD(P)H dehydrogenase (quinone),protein,439851,Salmonella dublin (strain CT_02021853),Salmonella dublin (strain CT_02021853),SeD_A1194,198,PTHR30546:SF23,FLAVOPROTEIN-LIKE PROTEIN YCP4-RELATED,True
B5R056,NAD(P)H dehydrogenase (quinone),protein,550537,Salmonella enteritidis PT4 (strain P125109),Salmonella enteritidis PT4 (strain P125109),SEN0983,198,PTHR30546:SF23,FLAVOPROTEIN-LIKE PROTEIN YCP4-RELATED,True
B5R6H0,NAD(P)H dehydrogenase (quinone),protein,550538,Salmonella gallinarum (strain 287/91 / NCTC 13346),Salmonella gallinarum (strain 287/91 / NCTC 13346),SG1008,198,PTHR30546:SF23,FLAVOPROTEIN-LIKE PROTEIN YCP4-RELATED,True
B5XXP0,NAD(P)H dehydrogenase (quinone),protein,507522,Klebsiella variicola (strain 342),Klebsiella variicola (strain 342),KPK_3530,198,PTHR30546:SF23,FLAVOPROTEIN-LIKE PROTEIN YCP4-RELATED,True
B5YU47,NAD(P)H dehydrogenase (quinone),protein,444450,Escherichia coli O157:H7 (strain EC4115 / EHEC),Escherichia coli O157:H7 (strain EC4115 / EHEC),ECH74115_1242,198,PTHR30546:SF23,FLAVOPROTEIN-LIKE PROTEIN YCP4-RELATED,True
B6I980,NAD(P)H dehydrogenase (quinone),protein,409438,Escherichia coli (strain SE11),Escherichia coli (strain SE11),ECSE_1066,198,PTHR30546:SF23,FLAVOPROTEIN-LIKE PROTEIN YCP4-RELATED,True
B6ITN1,NAD(P)H dehydrogenase (quinone),protein,414684,Rhodospirillum centenum (strain ATCC 51521 / SW),Rhodospirillum centenum (strain ATCC 51521 / SW),RC1_1936,200,PTHR30546:SF23,FLAVOPROTEIN-LIKE PROTEIN YCP4-RELATED,True
B6JBZ6,NAD(P)H dehydrogenase (quinone),protein,504832,Afipia carboxidovorans (strain ATCC 49405 / DSM 1227 / KCTC 32145 / OM5),Afipia carboxidovorans (strain ATCC 49405 / DSM 1227 / KCTC 32145 / OM5),OCAR_5077,199,PTHR30546:SF23,FLAVOPROTEIN-LIKE PROTEIN YCP4-RELATED,True
B7J4K3,NAD(P)H dehydrogenase (quinone),protein,243159,Acidithiobacillus ferrooxidans (strain ATCC 23270 / DSM 14882 / CIP 104768 / NCIMB 8455),Acidithiobacillus ferrooxidans (strain ATCC 23270 / DSM 14882 / CIP 104768 / NCIMB 8455),AFE_0460,200,PTHR30546:SF23,FLAVOPROTEIN-LIKE PROTEIN YCP4-RELATED,True
B7KQ28,NAD(P)H dehydrogenase (quinone),protein,440085,Methylorubrum extorquens (strain CM4 / NCIMB 13688),Methylorubrum extorquens (strain CM4 / NCIMB 13688),Mchl_4647,199,PTHR30546:SF23,FLAVOPROTEIN-LIKE PROTEIN YCP4-RELATED,True
B7LFB3,NAD(P)H dehydrogenase (quinone),protein,585055,Escherichia coli (strain 55989 / EAEC),Escherichia coli (strain 55989 / EAEC),EC55989_1114,198,PTHR30546:SF23,FLAVOPROTEIN-LIKE PROTEIN YCP4-RELATED,True
B7LP27,NAD(P)H dehydrogenase (quinone),protein,585054,Escherichia fergusonii (strain ATCC 35469 / DSM 13698 / CCUG 18766 / IAM 14443 / JCM 21226 / LMG 7866 / NBRC 102419 / NCTC 12128 / CDC 0568-73),Escherichia fergusonii (strain ATCC 35469 / DSM 13698 / CCUG 18766 / IAM 14443 / JCM 21226 / LMG 7866 / NBRC 102419 / NCTC 12128 / CDC 0568-73),EFER_1155,198,PTHR30546:SF23,FLAVOPROTEIN-LIKE PROTEIN YCP4-RELATED,True
B7M8Y8,NAD(P)H dehydrogenase (quinone),protein,585034,Escherichia coli O8 (strain IAI1),Escherichia coli O8 (strain IAI1),ECIAI1_1048,198,PTHR30546:SF23,FLAVOPROTEIN-LIKE PROTEIN YCP4-RELATED,True
B7MIE9,NAD(P)H dehydrogenase (quinone),protein,585035,Escherichia coli O45:K1 (strain S88 / ExPEC),Escherichia coli O45:K1 (strain S88 / ExPEC),ECS88_1018,198,PTHR30546:SF23,FLAVOPROTEIN-LIKE PROTEIN YCP4-RELATED,True
B7N3F9,NAD(P)H dehydrogenase (quinone),protein,585056,Escherichia coli O17:K52:H18 (strain UMN026 / ExPEC),Escherichia coli O17:K52:H18 (strain UMN026 / ExPEC),ECUMN_1186,198,PTHR30546:SF23,FLAVOPROTEIN-LIKE PROTEIN YCP4-RELATED,True
B7NLC1,NAD(P)H dehydrogenase (quinone),protein,585057,Escherichia coli O7:K1 (strain IAI39 / ExPEC),Escherichia coli O7:K1 (strain IAI39 / ExPEC),ECIAI39_2150,198,PTHR30546:SF23,FLAVOPROTEIN-LIKE PROTEIN YCP4-RELATED,True
B7UNY7,NAD(P)H dehydrogenase (quinone),protein,574521,Escherichia coli O127:H6 (strain E2348/69 / EPEC),Escherichia coli O127:H6 (strain E2348/69 / EPEC),E2348C_1055,198,PTHR30546:SF23,FLAVOPROTEIN-LIKE PROTEIN YCP4-RELATED,True
B8EMJ5,NAD(P)H dehydrogenase (quinone),protein,395965,Methylocella silvestris (strain DSM 15510 / CIP 108128 / LMG 27833 / NCIMB 13906 / BL2),Methylocella silvestris (strain DSM 15510 / CIP 108128 / LMG 27833 / NCIMB 13906 / BL2),Msil_3216,199,PTHR30546:SF23,FLAVOPROTEIN-LIKE PROTEIN YCP4-RELATED,True
B8H1H5,NAD(P)H dehydrogenase (quinone),protein,565050,Caulobacter vibrioides (strain NA1000 / CB15N),Caulobacter vibrioides (strain NA1000 / CB15N),CCNA_00833,199,PTHR30546:SF23,FLAVOPROTEIN-LIKE PROTEIN YCP4-RELATED,True
B9JEB9,NAD(P)H dehydrogenase (quinone),protein,311403,Rhizobium rhizogenes (strain K84 / ATCC BAA-868),Rhizobium rhizogenes (strain K84 / ATCC BAA-868),Arad_2057,199,PTHR30546:SF23,FLAVOPROTEIN-LIKE PROTEIN YCP4-RELATED,True
B9M4V3,NAD(P)H dehydrogenase (quinone),protein,316067,Geotalea daltonii (strain DSM 22248 / JCM 15807 / FRC-32),Geotalea daltonii (strain DSM 22248 / JCM 15807 / FRC-32),Geob_3294,205,PTHR30546:SF23,FLAVOPROTEIN-LIKE PROTEIN YCP4-RELATED,True
B9M9X5,NAD(P)H dehydrogenase (quinone),protein,535289,Acidovorax ebreus (strain TPSY),Acidovorax ebreus (strain TPSY),Dtpsy_0057,200,PTHR30546:SF23,FLAVOPROTEIN-LIKE PROTEIN YCP4-RELATED,True
C0Q886,NAD(P)H dehydrogenase (quinone),protein,476213,Salmonella paratyphi C (strain RKS4594),Salmonella paratyphi C (strain RKS4594),SPC_2630,198,PTHR30546:SF23,FLAVOPROTEIN-LIKE PROTEIN YCP4-RELATED,True
C0RJ23,NAD(P)H dehydrogenase (quinone),protein,546272,Brucella melitensis biotype 2 (strain ATCC 23457),Brucella melitensis biotype 2 (strain ATCC 23457),BMEA_A1089,199,PTHR30546:SF23,FLAVOPROTEIN-LIKE PROTEIN YCP4-RELATED,True
C1DFX8,NAD(P)H dehydrogenase (quinone),protein,322710,Azotobacter vinelandii (strain DJ / ATCC BAA-1303),Azotobacter vinelandii (strain DJ / ATCC BAA-1303),Avin_00380,198,PTHR30546:SF23,FLAVOPROTEIN-LIKE PROTEIN YCP4-RELATED,True
C1I202,p-benzoquinone reductase,protein,165468,Pseudomonas sp. (strain WBC-3),Pseudomonas sp. (strain WBC-3),pnpB,207,PTHR30546:SF23,FLAVOPROTEIN-LIKE PROTEIN YCP4-RELATED,True
C3MCH2,NAD(P)H dehydrogenase (quinone),protein,394,Sinorhizobium fredii (strain NBRC 101917 / NGR234),Sinorhizobium fredii (strain NBRC 101917 / NGR234),NGR_c14790,199,PTHR30546:SF23,FLAVOPROTEIN-LIKE PROTEIN YCP4-RELATED,True
C4L7R5,NAD(P)H dehydrogenase (quinone),protein,595494,Tolumonas auensis (strain DSM 9187 / NBRC 110442 / TA 4),Tolumonas auensis (strain DSM 9187 / NBRC 110442 / TA 4),Tola_0084,199,PTHR30546:SF23,FLAVOPROTEIN-LIKE PROTEIN YCP4-RELATED,True
C4XGC2,NAD(P)H dehydrogenase (quinone),protein,573370,Solidesulfovibrio magneticus (strain ATCC 700980 / DSM 13731 / RS-1),Solidesulfovibrio magneticus (strain ATCC 700980 / DSM 13731 / RS-1),DMR_02110,203,PTHR30546:SF23,FLAVOPROTEIN-LIKE PROTEIN YCP4-RELATED,True
C4ZQD2,NAD(P)H dehydrogenase (quinone),protein,595496,Escherichia coli (strain K12 / MC4100 / BW2952),Escherichia coli (strain K12 / MC4100 / BW2952),BWG_0858,198,PTHR30546:SF23,FLAVOPROTEIN-LIKE PROTEIN YCP4-RELATED,True
O23207,Probable NAD(P)H dehydrogenase (quinone) FQR1-like 2,protein,3702,Arabidopsis thaliana,Arabidopsis thaliana (Mouse-ear cress),At4g36750,273,PTHR30546:SF3,NAD(P)H DEHYDROGENASE (QUINONE) FQR1-LIKE 2-RELATED,True
O29904,NAD(P)H dehydrogenase (quinone),protein,224325,Archaeoglobus fulgidus (strain ATCC 49558 / DSM 4304 / JCM 9628 / NBRC 100126 / VC-16),Archaeoglobus fulgidus (strain ATCC 49558 / DSM 4304 / JCM 9628 / NBRC 100126 / VC-16),AF_0343,191,PTHR30546:SF23,FLAVOPROTEIN-LIKE PROTEIN YCP4-RELATED,True
O67866,Flavodoxin,protein,224324,Aquifex aeolicus (strain VF5),Aquifex aeolicus (strain VF5),fldA,185,PTHR30546:SF23,FLAVOPROTEIN-LIKE PROTEIN YCP4-RELATED,True
P0A8G6,NAD(P)H dehydrogenase (quinone),protein,83333,Escherichia coli (strain K12),Escherichia coli (strain K12),wrbA,198,PTHR30546:SF23,FLAVOPROTEIN-LIKE PROTEIN YCP4-RELATED,True
P0A8G7,NAD(P)H dehydrogenase (quinone),protein,199310,Escherichia coli O6:H1 (strain CFT073 / ATCC 700928 / UPEC),Escherichia coli O6:H1 (strain CFT073 / ATCC 700928 / UPEC),c1140,198,PTHR30546:SF23,FLAVOPROTEIN-LIKE PROTEIN YCP4-RELATED,True
P0A8G8,NAD(P)H dehydrogenase (quinone),protein,623,Shigella flexneri,Shigella flexneri,SF1008,198,PTHR30546:SF23,FLAVOPROTEIN-LIKE PROTEIN YCP4-RELATED,True
P18855,Flavodoxin,protein,169679,Clostridium saccharobutylicum,Clostridium saccharobutylicum,floX,160,PTHR30546:SF23,FLAVOPROTEIN-LIKE PROTEIN YCP4-RELATED,True
P25349,Flavoprotein-like protein YCP4,protein,559292,Saccharomyces cerevisiae (strain ATCC 204508 / S288c),Saccharomyces cerevisiae (strain ATCC 204508 / S288c) (Baker's yeast),YCP4,247,PTHR30546:SF23,FLAVOPROTEIN-LIKE PROTEIN YCP4-RELATED,True
P30821,P25 protein,protein,284812,Schizosaccharomyces pombe (strain 972 / ATCC 24843),Schizosaccharomyces pombe (strain 972 / ATCC 24843) (Fission yeast),obr1,202,PTHR30546:SF23,FLAVOPROTEIN-LIKE PROTEIN YCP4-RELATED,True
P38234,Protein RFS1,protein,559292,Saccharomyces cerevisiae (strain ATCC 204508 / S288c),Saccharomyces cerevisiae (strain ATCC 204508 / S288c) (Baker's yeast),RFS1,210,PTHR30546:SF23,FLAVOPROTEIN-LIKE PROTEIN YCP4-RELATED,True
P42058,Minor allergen Alt a 7,protein,5599,Alternaria alternata,Alternaria alternata (Alternaria rot fungus),ALTA7,204,PTHR30546:SF23,FLAVOPROTEIN-LIKE PROTEIN YCP4-RELATED,True
P42059,Minor allergen Cla h 7,protein,29918,Cladosporium herbarum,Cladosporium herbarum,CLAH7,204,PTHR30546:SF23,FLAVOPROTEIN-LIKE PROTEIN YCP4-RELATED,True
P54586,Uncharacterized protein YhcB,protein,224308,Bacillus subtilis (strain 168),Bacillus subtilis (strain 168),yhcB,176,PTHR30546:SF23,FLAVOPROTEIN-LIKE PROTEIN YCP4-RELATED,True
P58795,NAD(P)H dehydrogenase (quinone),protein,176299,Agrobacterium fabrum (strain C58 / ATCC 33970),Agrobacterium fabrum (strain C58 / ATCC 33970),Atu1728,199,PTHR30546:SF23,FLAVOPROTEIN-LIKE PROTEIN YCP4-RELATED,True
P58796,NAD(P)H dehydrogenase (quinone),protein,188937,Methanosarcina acetivorans (strain ATCC 35395 / DSM 2834 / JCM 12185 / C2A),Methanosarcina acetivorans (strain ATCC 35395 / DSM 2834 / JCM 12185 / C2A),MA_1189,209,PTHR30546:SF23,FLAVOPROTEIN-LIKE PROTEIN YCP4-RELATED,True
Q07TR7,NAD(P)H dehydrogenase (quinone),protein,316055,Rhodopseudomonas palustris (strain BisA53),Rhodopseudomonas palustris (strain BisA53),RPE_0710,199,PTHR30546:SF23,FLAVOPROTEIN-LIKE PROTEIN YCP4-RELATED,True
Q0A961,NAD(P)H dehydrogenase (quinone),protein,187272,Alkalilimnicola ehrlichii (strain ATCC BAA-1101 / DSM 17681 / MLHE-1),Alkalilimnicola ehrlichii (strain ATCC BAA-1101 / DSM 17681 / MLHE-1),Mlg_1277,199,PTHR30546:SF23,FLAVOPROTEIN-LIKE PROTEIN YCP4-RELATED,True
