id,name,entry_type,source_tax_id,source_tax_name,full_tax_name,gene,length,subfamily,subfamily_name,in_alphafold
A0A0H2ZF87,tRNA (cytidine/uridine/adenosine-2'-O-)-methyltransferase TrmJ,protein,208963,Pseudomonas aeruginosa (strain UCBPP-PA14),Pseudomonas aeruginosa (strain UCBPP-PA14),trmJ,257,PTHR42786:SF2,TRNA (CYTIDINE_URIDINE-2'-O-)-METHYLTRANSFERASE TRMJ,True
A1AE69,tRNA (cytidine/uridine-2'-O-)-methyltransferase TrmJ,protein,405955,Escherichia coli O1:K1 / APEC,Escherichia coli O1:K1 / APEC,trmJ,246,PTHR42786:SF2,TRNA (CYTIDINE_URIDINE-2'-O-)-METHYLTRANSFERASE TRMJ,True
A1JKQ0,tRNA (cytidine/uridine-2'-O-)-methyltransferase TrmJ,protein,393305,Yersinia enterocolitica serotype O:8 / biotype 1B (strain NCTC 13174 / 8081),Yersinia enterocolitica serotype O:8 / biotype 1B (strain NCTC 13174 / 8081),trmJ,257,PTHR42786:SF2,TRNA (CYTIDINE_URIDINE-2'-O-)-METHYLTRANSFERASE TRMJ,True
A4TMV6,tRNA (cytidine/uridine-2'-O-)-methyltransferase TrmJ,protein,386656,Yersinia pestis (strain Pestoides F),Yersinia pestis (strain Pestoides F),trmJ,257,PTHR42786:SF2,TRNA (CYTIDINE_URIDINE-2'-O-)-METHYLTRANSFERASE TRMJ,True
A6TCF3,tRNA (cytidine/uridine-2'-O-)-methyltransferase TrmJ,protein,272620,Klebsiella pneumoniae subsp. pneumoniae (strain ATCC 700721 / MGH 78578),Klebsiella pneumoniae subsp. pneumoniae (strain ATCC 700721 / MGH 78578),trmJ,244,PTHR42786:SF2,TRNA (CYTIDINE_URIDINE-2'-O-)-METHYLTRANSFERASE TRMJ,True
A7MGX5,tRNA (cytidine/uridine-2'-O-)-methyltransferase TrmJ,protein,290339,Cronobacter sakazakii (strain ATCC BAA-894),Cronobacter sakazakii (strain ATCC BAA-894),trmJ,245,PTHR42786:SF2,TRNA (CYTIDINE_URIDINE-2'-O-)-METHYLTRANSFERASE TRMJ,True
A8AD50,tRNA (cytidine/uridine-2'-O-)-methyltransferase TrmJ,protein,290338,Citrobacter koseri (strain ATCC BAA-895 / CDC 4225-83 / SGSC4696),Citrobacter koseri (strain ATCC BAA-895 / CDC 4225-83 / SGSC4696),trmJ,243,PTHR42786:SF2,TRNA (CYTIDINE_URIDINE-2'-O-)-METHYLTRANSFERASE TRMJ,True
P0AE01,tRNA (cytidine/uridine-2'-O-)-methyltransferase TrmJ,protein,83333,Escherichia coli (strain K12),Escherichia coli (strain K12),trmJ,246,PTHR42786:SF2,TRNA (CYTIDINE_URIDINE-2'-O-)-METHYLTRANSFERASE TRMJ,True
P0AE02,tRNA (cytidine/uridine-2'-O-)-methyltransferase TrmJ,protein,199310,Escherichia coli O6:H1 (strain CFT073 / ATCC 700928 / UPEC),Escherichia coli O6:H1 (strain CFT073 / ATCC 700928 / UPEC),trmJ,246,PTHR42786:SF2,TRNA (CYTIDINE_URIDINE-2'-O-)-METHYLTRANSFERASE TRMJ,True
P0AE03,tRNA (cytidine/uridine-2'-O-)-methyltransferase TrmJ,protein,623,Shigella flexneri,Shigella flexneri,trmJ,246,PTHR42786:SF2,TRNA (CYTIDINE_URIDINE-2'-O-)-METHYLTRANSFERASE TRMJ,True
P37005,Uncharacterized tRNA/rRNA methyltransferase LasT,protein,83333,Escherichia coli (strain K12),Escherichia coli (strain K12),lasT,228,PTHR42786:SF1,TRNA (CYTIDINE_URIDINE-2'-O-)-METHYLTRANSFERASE TRMJ,True
P37006,Uncharacterized tRNA/rRNA methyltransferase LasT,protein,615,Serratia marcescens,Serratia marcescens,lasT,196,PTHR42786:SF1,TRNA (CYTIDINE_URIDINE-2'-O-)-METHYLTRANSFERASE TRMJ,True
P44676,Uncharacterized tRNA/rRNA methyltransferase HI_0380,protein,71421,Haemophilus influenzae (strain ATCC 51907 / DSM 11121 / KW20 / Rd),Haemophilus influenzae (strain ATCC 51907 / DSM 11121 / KW20 / Rd),HI_0380,241,PTHR42786:SF2,TRNA (CYTIDINE_URIDINE-2'-O-)-METHYLTRANSFERASE TRMJ,True
P66974,tRNA (cytidine/uridine-2'-O-)-methyltransferase TrmJ,protein,99287,Salmonella typhimurium (strain LT2 / SGSC1412 / ATCC 700720),Salmonella typhimurium (strain LT2 / SGSC1412 / ATCC 700720),trmJ,243,PTHR42786:SF2,TRNA (CYTIDINE_URIDINE-2'-O-)-METHYLTRANSFERASE TRMJ,True
P66975,tRNA (cytidine/uridine-2'-O-)-methyltransferase TrmJ,protein,90370,Salmonella typhi,Salmonella typhi,trmJ,243,PTHR42786:SF2,TRNA (CYTIDINE_URIDINE-2'-O-)-METHYLTRANSFERASE TRMJ,True
Q0T1Y7,tRNA (cytidine/uridine-2'-O-)-methyltransferase TrmJ,protein,373384,Shigella flexneri serotype 5b (strain 8401),Shigella flexneri serotype 5b (strain 8401),trmJ,246,PTHR42786:SF2,TRNA (CYTIDINE_URIDINE-2'-O-)-METHYLTRANSFERASE TRMJ,True
Q0TEV3,tRNA (cytidine/uridine-2'-O-)-methyltransferase TrmJ,protein,362663,Escherichia coli O6:K15:H31 (strain 536 / UPEC),Escherichia coli O6:K15:H31 (strain 536 / UPEC),trmJ,246,PTHR42786:SF2,TRNA (CYTIDINE_URIDINE-2'-O-)-METHYLTRANSFERASE TRMJ,True
Q1C5G8,tRNA (cytidine/uridine-2'-O-)-methyltransferase TrmJ,protein,360102,Yersinia pestis bv. Antiqua (strain Antiqua),Yersinia pestis bv. Antiqua (strain Antiqua),trmJ,257,PTHR42786:SF2,TRNA (CYTIDINE_URIDINE-2'-O-)-METHYLTRANSFERASE TRMJ,True
Q1CKB1,tRNA (cytidine/uridine-2'-O-)-methyltransferase TrmJ,protein,377628,Yersinia pestis bv. Antiqua (strain Nepal516),Yersinia pestis bv. Antiqua (strain Nepal516),trmJ,257,PTHR42786:SF2,TRNA (CYTIDINE_URIDINE-2'-O-)-METHYLTRANSFERASE TRMJ,True
Q1R8K0,tRNA (cytidine/uridine-2'-O-)-methyltransferase TrmJ,protein,364106,Escherichia coli (strain UTI89 / UPEC),Escherichia coli (strain UTI89 / UPEC),trmJ,246,PTHR42786:SF2,TRNA (CYTIDINE_URIDINE-2'-O-)-METHYLTRANSFERASE TRMJ,True
Q2NS29,tRNA (cytidine/uridine-2'-O-)-methyltransferase TrmJ,protein,343509,Sodalis glossinidius (strain morsitans),Sodalis glossinidius (strain morsitans),trmJ,255,PTHR42786:SF2,TRNA (CYTIDINE_URIDINE-2'-O-)-METHYLTRANSFERASE TRMJ,True
Q31XV8,tRNA (cytidine/uridine-2'-O-)-methyltransferase TrmJ,protein,300268,Shigella boydii serotype 4 (strain Sb227),Shigella boydii serotype 4 (strain Sb227),trmJ,246,PTHR42786:SF2,TRNA (CYTIDINE_URIDINE-2'-O-)-METHYLTRANSFERASE TRMJ,True
Q32D32,tRNA (cytidine/uridine-2'-O-)-methyltransferase TrmJ,protein,300267,Shigella dysenteriae serotype 1 (strain Sd197),Shigella dysenteriae serotype 1 (strain Sd197),trmJ,245,PTHR42786:SF2,TRNA (CYTIDINE_URIDINE-2'-O-)-METHYLTRANSFERASE TRMJ,True
Q3YZ20,tRNA (cytidine/uridine-2'-O-)-methyltransferase TrmJ,protein,300269,Shigella sonnei (strain Ss046),Shigella sonnei (strain Ss046),trmJ,245,PTHR42786:SF2,TRNA (CYTIDINE_URIDINE-2'-O-)-METHYLTRANSFERASE TRMJ,True
Q4JB16,tRNA (cytidine-2'-O-)-methyltransferase TrmJ,protein,330779,Sulfolobus acidocaldarius (strain ATCC 33909 / DSM 639 / JCM 8929 / NBRC 15157 / NCIMB 11770),Sulfolobus acidocaldarius (strain ATCC 33909 / DSM 639 / JCM 8929 / NBRC 15157 / NCIMB 11770),trmJ,235,PTHR42786:SF2,TRNA (CYTIDINE_URIDINE-2'-O-)-METHYLTRANSFERASE TRMJ,True
Q57LG7,tRNA (cytidine/uridine-2'-O-)-methyltransferase TrmJ,protein,321314,Salmonella choleraesuis (strain SC-B67),Salmonella choleraesuis (strain SC-B67),trmJ,243,PTHR42786:SF2,TRNA (CYTIDINE_URIDINE-2'-O-)-METHYLTRANSFERASE TRMJ,True
Q58871,tRNA (cytidine-2'-O-)-methyltransferase TrmJ,protein,243232,Methanocaldococcus jannaschii (strain ATCC 43067 / DSM 2661 / JAL-1 / JCM 10045 / NBRC 100440),Methanocaldococcus jannaschii (strain ATCC 43067 / DSM 2661 / JAL-1 / JCM 10045 / NBRC 100440),trmJ,230,PTHR42786:SF2,TRNA (CYTIDINE_URIDINE-2'-O-)-METHYLTRANSFERASE TRMJ,True
Q5PNG3,tRNA (cytidine/uridine-2'-O-)-methyltransferase TrmJ,protein,295319,Salmonella paratyphi A (strain ATCC 9150 / SARB42),Salmonella paratyphi A (strain ATCC 9150 / SARB42),trmJ,243,PTHR42786:SF2,TRNA (CYTIDINE_URIDINE-2'-O-)-METHYLTRANSFERASE TRMJ,True
Q667X9,tRNA (cytidine/uridine-2'-O-)-methyltransferase TrmJ,protein,273123,Yersinia pseudotuberculosis serotype I (strain IP32953),Yersinia pseudotuberculosis serotype I (strain IP32953),trmJ,257,PTHR42786:SF2,TRNA (CYTIDINE_URIDINE-2'-O-)-METHYLTRANSFERASE TRMJ,True
Q6D257,tRNA (cytidine/uridine-2'-O-)-methyltransferase TrmJ,protein,218491,Pectobacterium atrosepticum (strain SCRI 1043 / ATCC BAA-672),Pectobacterium atrosepticum (strain SCRI 1043 / ATCC BAA-672),trmJ,241,PTHR42786:SF2,TRNA (CYTIDINE_URIDINE-2'-O-)-METHYLTRANSFERASE TRMJ,True
Q7CJN8,tRNA (cytidine/uridine-2'-O-)-methyltransferase TrmJ,protein,632,Yersinia pestis,Yersinia pestis,trmJ,257,PTHR42786:SF2,TRNA (CYTIDINE_URIDINE-2'-O-)-METHYLTRANSFERASE TRMJ,True
Q7N222,tRNA (cytidine/uridine-2'-O-)-methyltransferase TrmJ,protein,243265,Photorhabdus laumondii subsp. laumondii (strain DSM 15139 / CIP 105565 / TT01),Photorhabdus laumondii subsp. laumondii (strain DSM 15139 / CIP 105565 / TT01),trmJ,241,PTHR42786:SF2,TRNA (CYTIDINE_URIDINE-2'-O-)-METHYLTRANSFERASE TRMJ,True
Q8XA83,tRNA (cytidine/uridine-2'-O-)-methyltransferase TrmJ,protein,83334,Escherichia coli O157:H7,Escherichia coli O157:H7,trmJ,245,PTHR42786:SF2,TRNA (CYTIDINE_URIDINE-2'-O-)-METHYLTRANSFERASE TRMJ,True
