id,name,entry_type,source_tax_id,source_tax_name,full_tax_name,gene,length,subfamily,subfamily_name,in_alphafold
A3LZM4,Methylated-DNA--protein-cysteine methyltransferase,protein,322104,Scheffersomyces stipitis (strain ATCC 58785 / CBS 6054 / NBRC 10063 / NRRL Y-11545),Scheffersomyces stipitis (strain ATCC 58785 / CBS 6054 / NBRC 10063 / NRRL Y-11545) (Yeast),MGT1,194,PTHR10815:SF13,METHYLATED-DNA--PROTEIN-CYSTEINE METHYLTRANSFERASE,True
A4YH39,Methylated-DNA--protein-cysteine methyltransferase,protein,399549,Metallosphaera sedula (strain ATCC 51363 / DSM 5348 / JCM 9185 / NBRC 15509 / TH2),Metallosphaera sedula (strain ATCC 51363 / DSM 5348 / JCM 9185 / NBRC 15509 / TH2),ogt,156,PTHR10815:SF13,METHYLATED-DNA--PROTEIN-CYSTEINE METHYLTRANSFERASE,True
A5E7M8,Methylated-DNA--protein-cysteine methyltransferase,protein,379508,Lodderomyces elongisporus (strain ATCC 11503 / CBS 2605 / JCM 1781 / NBRC 1676 / NRRL YB-4239),Lodderomyces elongisporus (strain ATCC 11503 / CBS 2605 / JCM 1781 / NBRC 1676 / NRRL YB-4239) (Yeast),MGT1,201,PTHR10815:SF13,METHYLATED-DNA--PROTEIN-CYSTEINE METHYLTRANSFERASE,True
A6ZXD3,Methylated-DNA--protein-cysteine methyltransferase,protein,307796,Saccharomyces cerevisiae (strain YJM789),Saccharomyces cerevisiae (strain YJM789) (Baker's yeast),MGT1,188,PTHR10815:SF13,METHYLATED-DNA--PROTEIN-CYSTEINE METHYLTRANSFERASE,True
C3MKT6,Methylated-DNA--protein-cysteine methyltransferase,protein,429572,Saccharolobus islandicus (strain L.S.2.15 / Lassen #1),Saccharolobus islandicus (strain L.S.2.15 / Lassen #1),ogt,151,PTHR10815:SF13,METHYLATED-DNA--PROTEIN-CYSTEINE METHYLTRANSFERASE,True
C3MUC6,Methylated-DNA--protein-cysteine methyltransferase,protein,427317,Saccharolobus islandicus (strain M.14.25 / Kamchatka #1),Saccharolobus islandicus (strain M.14.25 / Kamchatka #1),ogt,151,PTHR10815:SF13,METHYLATED-DNA--PROTEIN-CYSTEINE METHYLTRANSFERASE,True
C3N1B4,Methylated-DNA--protein-cysteine methyltransferase,protein,427318,Saccharolobus islandicus (strain M.16.27),Saccharolobus islandicus (strain M.16.27),ogt,151,PTHR10815:SF13,METHYLATED-DNA--PROTEIN-CYSTEINE METHYLTRANSFERASE,True
C3N9B4,Methylated-DNA--protein-cysteine methyltransferase,protein,439386,Saccharolobus islandicus (strain Y.G.57.14 / Yellowstone #1),Saccharolobus islandicus (strain Y.G.57.14 / Yellowstone #1),ogt,151,PTHR10815:SF13,METHYLATED-DNA--PROTEIN-CYSTEINE METHYLTRANSFERASE,True
C3NMY2,Methylated-DNA--protein-cysteine methyltransferase,protein,419942,Saccharolobus islandicus (strain Y.N.15.51 / Yellowstone #2),Saccharolobus islandicus (strain Y.N.15.51 / Yellowstone #2),ogt,151,PTHR10815:SF13,METHYLATED-DNA--PROTEIN-CYSTEINE METHYLTRANSFERASE,True
C4KKV8,Methylated-DNA--protein-cysteine methyltransferase,protein,426118,Saccharolobus islandicus (strain M.16.4 / Kamchatka #3),Saccharolobus islandicus (strain M.16.4 / Kamchatka #3),ogt,151,PTHR10815:SF13,METHYLATED-DNA--PROTEIN-CYSTEINE METHYLTRANSFERASE,True
O26715,Methylated-DNA--protein-cysteine methyltransferase,protein,187420,Methanothermobacter thermautotrophicus (strain ATCC 29096 / DSM 1053 / JCM 10044 / NBRC 100330 / Delta H),Methanothermobacter thermautotrophicus (strain ATCC 29096 / DSM 1053 / JCM 10044 / NBRC 100330 / Delta H),ogt,176,PTHR10815:SF5,METHYLATED-DNA--PROTEIN-CYSTEINE METHYLTRANSFERASE,True
O27970,Methylated-DNA--protein-cysteine methyltransferase,protein,224325,Archaeoglobus fulgidus (strain ATCC 49558 / DSM 4304 / JCM 9628 / NBRC 100126 / VC-16),Archaeoglobus fulgidus (strain ATCC 49558 / DSM 4304 / JCM 9628 / NBRC 100126 / VC-16),ogt,147,PTHR10815:SF13,METHYLATED-DNA--PROTEIN-CYSTEINE METHYLTRANSFERASE,True
O93728,Methylated-DNA--protein-cysteine methyltransferase,protein,178306,Pyrobaculum aerophilum (strain ATCC 51768 / DSM 7523 / JCM 9630 / CIP 104966 / NBRC 100827 / IM2),Pyrobaculum aerophilum (strain ATCC 51768 / DSM 7523 / JCM 9630 / CIP 104966 / NBRC 100827 / IM2),ogt,148,PTHR10815:SF13,METHYLATED-DNA--PROTEIN-CYSTEINE METHYLTRANSFERASE,True
P06134,Bifunctional transcriptional activator/DNA repair enzyme Ada,protein,83333,Escherichia coli (strain K12),Escherichia coli (strain K12),ada,354,PTHR10815:SF14,BIFUNCTIONAL TRANSCRIPTIONAL ACTIVATOR_DNA REPAIR ENZYME ADA,True
P0A2U0,Methylated-DNA--protein-cysteine methyltransferase,protein,99287,Salmonella typhimurium (strain LT2 / SGSC1412 / ATCC 700720),Salmonella typhimurium (strain LT2 / SGSC1412 / ATCC 700720),ogt,171,PTHR10815:SF5,METHYLATED-DNA--PROTEIN-CYSTEINE METHYLTRANSFERASE,True
P0A2U1,Methylated-DNA--protein-cysteine methyltransferase,protein,90370,Salmonella typhi,Salmonella typhi,ogt,171,PTHR10815:SF5,METHYLATED-DNA--PROTEIN-CYSTEINE METHYLTRANSFERASE,True
P0A697,Methylated-DNA--protein-cysteine methyltransferase,protein,233413,Mycobacterium bovis (strain ATCC BAA-935 / AF2122/97),Mycobacterium bovis (strain ATCC BAA-935 / AF2122/97),ogt,165,PTHR10815:SF5,METHYLATED-DNA--PROTEIN-CYSTEINE METHYLTRANSFERASE,True
P0AFH0,Methylated-DNA--protein-cysteine methyltransferase,protein,83333,Escherichia coli (strain K12),Escherichia coli (strain K12),ogt,171,PTHR10815:SF5,METHYLATED-DNA--PROTEIN-CYSTEINE METHYLTRANSFERASE,True
P0AFH1,Methylated-DNA--protein-cysteine methyltransferase,protein,623,Shigella flexneri,Shigella flexneri,ogt,171,PTHR10815:SF5,METHYLATED-DNA--PROTEIN-CYSTEINE METHYLTRANSFERASE,True
P11742,"Methylated-DNA--protein-cysteine methyltransferase, constitutive",protein,224308,Bacillus subtilis (strain 168),Bacillus subtilis (strain 168),ogt,165,PTHR10815:SF5,METHYLATED-DNA--PROTEIN-CYSTEINE METHYLTRANSFERASE,True
P19220,"Methylated-DNA--protein-cysteine methyltransferase, inducible",protein,224308,Bacillus subtilis (strain 168),Bacillus subtilis (strain 168),adaB,179,PTHR10815:SF12,"METHYLATED-DNA--PROTEIN-CYSTEINE METHYLTRANSFERASE, INDUCIBLE",True
P26188,Methylated-DNA--protein-cysteine methyltransferase,protein,559292,Saccharomyces cerevisiae (strain ATCC 204508 / S288c),Saccharomyces cerevisiae (strain ATCC 204508 / S288c) (Baker's yeast),MGT1,188,PTHR10815:SF13,METHYLATED-DNA--PROTEIN-CYSTEINE METHYLTRANSFERASE,True
P26189,Regulatory protein ada,protein,99287,Salmonella typhimurium (strain LT2 / SGSC1412 / ATCC 700720),Salmonella typhimurium (strain LT2 / SGSC1412 / ATCC 700720),ada,353,PTHR10815:SF14,BIFUNCTIONAL TRANSCRIPTIONAL ACTIVATOR_DNA REPAIR ENZYME ADA,True
P44687,Methylated-DNA--protein-cysteine methyltransferase,protein,71421,Haemophilus influenzae (strain ATCC 51907 / DSM 11121 / KW20 / Rd),Haemophilus influenzae (strain ATCC 51907 / DSM 11121 / KW20 / Rd),ogt,179,PTHR10815:SF5,METHYLATED-DNA--PROTEIN-CYSTEINE METHYLTRANSFERASE,True
P52982,Methylated-DNA--protein-cysteine methyltransferase,protein,272631,Mycobacterium leprae (strain TN),Mycobacterium leprae (strain TN),ogt,165,PTHR10815:SF5,METHYLATED-DNA--PROTEIN-CYSTEINE METHYLTRANSFERASE,True
P9WJW4,Methylated-DNA--protein-cysteine methyltransferase,protein,83331,Mycobacterium tuberculosis (strain CDC 1551 / Oshkosh),Mycobacterium tuberculosis (strain CDC 1551 / Oshkosh),ogt,165,PTHR10815:SF5,METHYLATED-DNA--PROTEIN-CYSTEINE METHYLTRANSFERASE,True
P9WJW5,Methylated-DNA--protein-cysteine methyltransferase,protein,83332,Mycobacterium tuberculosis (strain ATCC 25618 / H37Rv),Mycobacterium tuberculosis (strain ATCC 25618 / H37Rv),ogt,165,PTHR10815:SF5,METHYLATED-DNA--PROTEIN-CYSTEINE METHYLTRANSFERASE,True
Q46EW4,Methylated-DNA--protein-cysteine methyltransferase,protein,269797,Methanosarcina barkeri (strain Fusaro / DSM 804),Methanosarcina barkeri (strain Fusaro / DSM 804),ogt,158,PTHR10815:SF5,METHYLATED-DNA--PROTEIN-CYSTEINE METHYLTRANSFERASE,True
Q4J9C6,Methylated-DNA--protein-cysteine methyltransferase,protein,330779,Sulfolobus acidocaldarius (strain ATCC 33909 / DSM 639 / JCM 8929 / NBRC 15157 / NCIMB 11770),Sulfolobus acidocaldarius (strain ATCC 33909 / DSM 639 / JCM 8929 / NBRC 15157 / NCIMB 11770),ogt,155,PTHR10815:SF13,METHYLATED-DNA--PROTEIN-CYSTEINE METHYLTRANSFERASE,True
Q5A0Y8,Methylated-DNA--protein-cysteine methyltransferase,protein,237561,Candida albicans (strain SC5314 / ATCC MYA-2876),Candida albicans (strain SC5314 / ATCC MYA-2876) (Yeast),MGT1,175,PTHR10815:SF13,METHYLATED-DNA--PROTEIN-CYSTEINE METHYLTRANSFERASE,True
Q5SI16,DNA base-flipping protein,protein,300852,Thermus thermophilus (strain ATCC 27634 / DSM 579 / HB8),Thermus thermophilus (strain ATCC 27634 / DSM 579 / HB8),TTHA1564,147,PTHR10815:SF13,METHYLATED-DNA--PROTEIN-CYSTEINE METHYLTRANSFERASE,True
Q5UNU9,Probable methylated-DNA--protein-cysteine methyltransferase,protein,212035,Acanthamoeba polyphaga mimivirus,Acanthamoeba polyphaga mimivirus (APMV),MGMT,149,PTHR10815:SF13,METHYLATED-DNA--PROTEIN-CYSTEINE METHYLTRANSFERASE,False
Q6BVY4,Methylated-DNA--protein-cysteine methyltransferase,protein,284592,Debaryomyces hansenii (strain ATCC 36239 / CBS 767 / BCRC 21394 / JCM 1990 / NBRC 0083 / IGC 2968),Debaryomyces hansenii (strain ATCC 36239 / CBS 767 / BCRC 21394 / JCM 1990 / NBRC 0083 / IGC 2968) (Yeast),MGT1,191,PTHR10815:SF13,METHYLATED-DNA--PROTEIN-CYSTEINE METHYLTRANSFERASE,True
Q6CPW2,Methylated-DNA--protein-cysteine methyltransferase,protein,284590,Kluyveromyces lactis (strain ATCC 8585 / CBS 2359 / DSM 70799 / NBRC 1267 / NRRL Y-1140 / WM37),Kluyveromyces lactis (strain ATCC 8585 / CBS 2359 / DSM 70799 / NBRC 1267 / NRRL Y-1140 / WM37) (Yeast),MGT1,189,PTHR10815:SF13,METHYLATED-DNA--PROTEIN-CYSTEINE METHYLTRANSFERASE,True
Q6FNR0,Methylated-DNA--protein-cysteine methyltransferase,protein,284593,Candida glabrata (strain ATCC 2001 / BCRC 20586 / JCM 3761 / NBRC 0622 / NRRL Y-65 / CBS 138),Candida glabrata (strain ATCC 2001 / BCRC 20586 / JCM 3761 / NBRC 0622 / NRRL Y-65 / CBS 138) (Yeast),MGT1,207,PTHR10815:SF13,METHYLATED-DNA--PROTEIN-CYSTEINE METHYLTRANSFERASE,True
Q8PY44,Methylated-DNA--protein-cysteine methyltransferase,protein,192952,Methanosarcina mazei (strain ATCC BAA-159 / DSM 3647 / Goe1 / Go1 / JCM 11833 / OCM 88),Methanosarcina mazei (strain ATCC BAA-159 / DSM 3647 / Goe1 / Go1 / JCM 11833 / OCM 88),ogt,158,PTHR10815:SF5,METHYLATED-DNA--PROTEIN-CYSTEINE METHYLTRANSFERASE,True
Q8TI34,Methylated-DNA--protein-cysteine methyltransferase,protein,188937,Methanosarcina acetivorans (strain ATCC 35395 / DSM 2834 / JCM 12185 / C2A),Methanosarcina acetivorans (strain ATCC 35395 / DSM 2834 / JCM 12185 / C2A),ogt,156,PTHR10815:SF5,METHYLATED-DNA--PROTEIN-CYSTEINE METHYLTRANSFERASE,True
Q8TZ11,Methylated-DNA--protein-cysteine methyltransferase,protein,190192,Methanopyrus kandleri (strain AV19 / DSM 6324 / JCM 9639 / NBRC 100938),Methanopyrus kandleri (strain AV19 / DSM 6324 / JCM 9639 / NBRC 100938),ogt,131,PTHR10815:SF13,METHYLATED-DNA--PROTEIN-CYSTEINE METHYLTRANSFERASE,True
Q973C7,Methylated-DNA--protein-cysteine methyltransferase,protein,273063,Sulfurisphaera tokodaii (strain DSM 16993 / JCM 10545 / NBRC 100140 / 7),Sulfurisphaera tokodaii (strain DSM 16993 / JCM 10545 / NBRC 100140 / 7),ogt,156,PTHR10815:SF13,METHYLATED-DNA--PROTEIN-CYSTEINE METHYLTRANSFERASE,True
Q97VW7,Methylated-DNA--protein-cysteine methyltransferase,protein,273057,Saccharolobus solfataricus (strain ATCC 35092 / DSM 1617 / JCM 11322 / P2),Saccharolobus solfataricus (strain ATCC 35092 / DSM 1617 / JCM 11322 / P2),ogt,151,PTHR10815:SF13,METHYLATED-DNA--PROTEIN-CYSTEINE METHYLTRANSFERASE,True
Q9ZET8,Methylated-DNA--protein-cysteine methyltransferase,protein,262316,Mycolicibacterium paratuberculosis (strain ATCC BAA-968 / K-10),Mycolicibacterium paratuberculosis (strain ATCC BAA-968 / K-10),ogt,165,PTHR10815:SF5,METHYLATED-DNA--PROTEIN-CYSTEINE METHYLTRANSFERASE,True
