id,name,entry_type,source_tax_id,source_tax_name,full_tax_name,gene,length,subfamily,subfamily_name,in_alphafold
Q5PHB6,NH(3)-dependent NAD(+) synthetase,protein,295319,Salmonella paratyphi A (strain ATCC 9150 / SARB42),Salmonella paratyphi A (strain ATCC 9150 / SARB42),nadE,275,PTHR23090:SF7,NH(3)-DEPENDENT NAD(+) SYNTHETASE,True
Q5XAM5,NH(3)-dependent NAD(+) synthetase,protein,286636,Streptococcus pyogenes serotype M6 (strain ATCC BAA-946 / MGAS10394),Streptococcus pyogenes serotype M6 (strain ATCC BAA-946 / MGAS10394),nadE,274,PTHR23090:SF7,NH(3)-DEPENDENT NAD(+) SYNTHETASE,True
Q5YRN0,NH(3)-dependent NAD(+) synthetase,protein,247156,Nocardia farcinica (strain IFM 10152),Nocardia farcinica (strain IFM 10152),nadE,274,PTHR23090:SF7,NH(3)-DEPENDENT NAD(+) SYNTHETASE,True
Q5ZMA6,Glutamine-dependent NAD(+) synthetase,protein,9031,Gallus gallus,Gallus gallus (Chicken),NADSYN1,707,PTHR23090:SF9,GLUTAMINE-DEPENDENT NAD(+) SYNTHETASE,True
Q62CU8,NH(3)-dependent NAD(+) synthetase,protein,243160,Burkholderia mallei (strain ATCC 23344),Burkholderia mallei (strain ATCC 23344),nadE,284,PTHR23090:SF7,NH(3)-DEPENDENT NAD(+) SYNTHETASE,True
Q63CG2,NH(3)-dependent NAD(+) synthetase,protein,288681,Bacillus cereus (strain ZK / E33L),Bacillus cereus (strain ZK / E33L),nadE,272,PTHR23090:SF7,NH(3)-DEPENDENT NAD(+) SYNTHETASE,True
Q63K83,NH(3)-dependent NAD(+) synthetase,protein,272560,Burkholderia pseudomallei (strain K96243),Burkholderia pseudomallei (strain K96243),nadE,284,PTHR23090:SF7,NH(3)-DEPENDENT NAD(+) SYNTHETASE,True
Q65NN6,NH(3)-dependent NAD(+) synthetase,protein,279010,Bacillus licheniformis (strain ATCC 14580 / DSM 13 / JCM 2505 / CCUG 7422 / NBRC 12200 / NCIMB 9375 / NCTC 10341 / NRRL NRS-1264 / Gibson 46),Bacillus licheniformis (strain ATCC 14580 / DSM 13 / JCM 2505 / CCUG 7422 / NBRC 12200 / NCIMB 9375 / NCTC 10341 / NRRL NRS-1264 / Gibson 46),nadE,272,PTHR23090:SF7,NH(3)-DEPENDENT NAD(+) SYNTHETASE,True
Q65RB5,NH(3)-dependent NAD(+) synthetase,protein,221988,Mannheimia succiniciproducens (strain KCTC 0769BP / MBEL55E),Mannheimia succiniciproducens (strain KCTC 0769BP / MBEL55E),nadE,250,PTHR23090:SF7,NH(3)-DEPENDENT NAD(+) SYNTHETASE,True
Q6AER9,NH(3)-dependent NAD(+) synthetase,protein,281090,Leifsonia xyli subsp. xyli (strain CTCB07),Leifsonia xyli subsp. xyli (strain CTCB07),nadE,279,PTHR23090:SF7,NH(3)-DEPENDENT NAD(+) SYNTHETASE,True
Q6D4H8,NH(3)-dependent NAD(+) synthetase,protein,218491,Pectobacterium atrosepticum (strain SCRI 1043 / ATCC BAA-672),Pectobacterium atrosepticum (strain SCRI 1043 / ATCC BAA-672),nadE,274,PTHR23090:SF7,NH(3)-DEPENDENT NAD(+) SYNTHETASE,True
Q6F0U4,NH(3)-dependent NAD(+) synthetase,protein,265311,Mesoplasma florum (strain ATCC 33453 / NBRC 100688 / NCTC 11704 / L1),Mesoplasma florum (strain ATCC 33453 / NBRC 100688 / NCTC 11704 / L1),nadE,244,PTHR23090:SF7,NH(3)-DEPENDENT NAD(+) SYNTHETASE,True
Q6F8K4,Glutamine-dependent NAD(+) synthetase,protein,62977,Acinetobacter baylyi (strain ATCC 33305 / BD413 / ADP1),Acinetobacter baylyi (strain ATCC 33305 / BD413 / ADP1),nadE,541,PTHR23090:SF9,GLUTAMINE-DEPENDENT NAD(+) SYNTHETASE,True
Q6G820,NH(3)-dependent NAD(+) synthetase,protein,282459,Staphylococcus aureus (strain MSSA476),Staphylococcus aureus (strain MSSA476),nadE,273,PTHR23090:SF7,NH(3)-DEPENDENT NAD(+) SYNTHETASE,True
Q6GFE4,NH(3)-dependent NAD(+) synthetase,protein,282458,Staphylococcus aureus (strain MRSA252),Staphylococcus aureus (strain MRSA252),nadE,273,PTHR23090:SF7,NH(3)-DEPENDENT NAD(+) SYNTHETASE,True
Q6HJW8,NH(3)-dependent NAD(+) synthetase,protein,281309,Bacillus thuringiensis subsp. konkukian (strain 97-27),Bacillus thuringiensis subsp. konkukian (strain 97-27),nadE,272,PTHR23090:SF7,NH(3)-DEPENDENT NAD(+) SYNTHETASE,True
Q6IA69,Glutamine-dependent NAD(+) synthetase,protein,9606,Homo sapiens,Homo sapiens (Human),NADSYN1,706,PTHR23090:SF9,GLUTAMINE-DEPENDENT NAD(+) SYNTHETASE,True
Q6L0D1,NH(3)-dependent NAD(+) synthetase,protein,1122961,Picrophilus torridus (strain ATCC 700027 / DSM 9790 / JCM 10055 / NBRC 100828 / KAW 2/3),Picrophilus torridus (strain ATCC 700027 / DSM 9790 / JCM 10055 / NBRC 100828 / KAW 2/3),nadE,249,PTHR23090:SF9,GLUTAMINE-DEPENDENT NAD(+) SYNTHETASE,True
Q6LIU7,NH(3)-dependent NAD(+) synthetase,protein,298386,Photobacterium profundum (strain SS9),Photobacterium profundum (strain SS9),nadE,278,PTHR23090:SF7,NH(3)-DEPENDENT NAD(+) SYNTHETASE,True
Q711T7,Glutamine-dependent NAD(+) synthetase,protein,10090,Mus musculus,Mus musculus (Mouse),Nadsyn1,725,PTHR23090:SF9,GLUTAMINE-DEPENDENT NAD(+) SYNTHETASE,True
Q720Y0,NH(3)-dependent NAD(+) synthetase,protein,265669,Listeria monocytogenes serotype 4b (strain F2365),Listeria monocytogenes serotype 4b (strain F2365),nadE,274,PTHR23090:SF7,NH(3)-DEPENDENT NAD(+) SYNTHETASE,True
Q739R5,NH(3)-dependent NAD(+) synthetase,protein,222523,Bacillus cereus (strain ATCC 10987 / NRS 248),Bacillus cereus (strain ATCC 10987 / NRS 248),nadE,272,PTHR23090:SF7,NH(3)-DEPENDENT NAD(+) SYNTHETASE,True
Q74I36,NH(3)-dependent NAD(+) synthetase,protein,257314,Lactobacillus johnsonii (strain CNCM I-12250 / La1 / NCC 533),Lactobacillus johnsonii (strain CNCM I-12250 / La1 / NCC 533),nadE,277,PTHR23090:SF7,NH(3)-DEPENDENT NAD(+) SYNTHETASE,True
Q7MAJ5,NH(3)-dependent NAD(+) synthetase,protein,273121,Wolinella succinogenes (strain ATCC 29543 / DSM 1740 / CCUG 13145 / JCM 31913 / LMG 7466 / NCTC 11488 / FDC 602W),Wolinella succinogenes (strain ATCC 29543 / DSM 1740 / CCUG 13145 / JCM 31913 / LMG 7466 / NCTC 11488 / FDC 602W),nadE,257,PTHR23090:SF9,GLUTAMINE-DEPENDENT NAD(+) SYNTHETASE,True
Q7MFB0,NH(3)-dependent NAD(+) synthetase,protein,196600,Vibrio vulnificus (strain YJ016),Vibrio vulnificus (strain YJ016),nadE,276,PTHR23090:SF7,NH(3)-DEPENDENT NAD(+) SYNTHETASE,True
Q7VHF9,NH(3)-dependent NAD(+) synthetase,protein,235279,Helicobacter hepaticus (strain ATCC 51449 / 3B1),Helicobacter hepaticus (strain ATCC 51449 / 3B1),nadE,274,PTHR23090:SF9,GLUTAMINE-DEPENDENT NAD(+) SYNTHETASE,True
Q812E8,Glutamine-dependent NAD(+) synthetase,protein,10116,Rattus norvegicus,Rattus norvegicus (Rat),Nadsyn1,725,PTHR23090:SF9,GLUTAMINE-DEPENDENT NAD(+) SYNTHETASE,True
Q81EI2,NH(3)-dependent NAD(+) synthetase,protein,226900,Bacillus cereus (strain ATCC 14579 / DSM 31 / CCUG 7414 / JCM 2152 / NBRC 15305 / NCIMB 9373 / NCTC 2599 / NRRL B-3711),Bacillus cereus (strain ATCC 14579 / DSM 31 / CCUG 7414 / JCM 2152 / NBRC 15305 / NCIMB 9373 / NCTC 2599 / NRRL B-3711),nadE,272,PTHR23090:SF7,NH(3)-DEPENDENT NAD(+) SYNTHETASE,True
Q81RP3,NH(3)-dependent NAD(+) synthetase,protein,1392,Bacillus anthracis,Bacillus anthracis (anthrax bacterium),nadE,272,PTHR23090:SF7,NH(3)-DEPENDENT NAD(+) SYNTHETASE,True
Q830Y9,NH(3)-dependent NAD(+) synthetase,protein,226185,Enterococcus faecalis (strain ATCC 700802 / V583),Enterococcus faecalis (strain ATCC 700802 / V583),nadE,275,PTHR23090:SF7,NH(3)-DEPENDENT NAD(+) SYNTHETASE,True
Q83GA8,NH(3)-dependent NAD(+) synthetase,protein,203267,Tropheryma whipplei (strain Twist),Tropheryma whipplei (strain Twist) (Whipple's bacillus),nadE,271,PTHR23090:SF7,NH(3)-DEPENDENT NAD(+) SYNTHETASE,True
Q83HW8,NH(3)-dependent NAD(+) synthetase,protein,218496,Tropheryma whipplei (strain TW08/27),Tropheryma whipplei (strain TW08/27) (Whipple's bacillus),nadE,271,PTHR23090:SF7,NH(3)-DEPENDENT NAD(+) SYNTHETASE,True
Q83RG5,NH(3)-dependent NAD(+) synthetase,protein,623,Shigella flexneri,Shigella flexneri,nadE,275,PTHR23090:SF7,NH(3)-DEPENDENT NAD(+) SYNTHETASE,True
Q87D47,Glutamine-dependent NAD(+) synthetase,protein,183190,Xylella fastidiosa (strain Temecula1 / ATCC 700964),Xylella fastidiosa (strain Temecula1 / ATCC 700964),nadE,545,PTHR23090:SF9,GLUTAMINE-DEPENDENT NAD(+) SYNTHETASE,True
Q87J41,NH(3)-dependent NAD(+) synthetase,protein,223926,Vibrio parahaemolyticus serotype O3:K6 (strain RIMD 2210633),Vibrio parahaemolyticus serotype O3:K6 (strain RIMD 2210633),nadE,276,PTHR23090:SF7,NH(3)-DEPENDENT NAD(+) SYNTHETASE,True
Q87VL4,NH(3)-dependent NAD(+) synthetase,protein,223283,Pseudomonas syringae pv. tomato (strain ATCC BAA-871 / DC3000),Pseudomonas syringae pv. tomato (strain ATCC BAA-871 / DC3000),nadE,275,PTHR23090:SF7,NH(3)-DEPENDENT NAD(+) SYNTHETASE,True
Q88DF6,NH(3)-dependent NAD(+) synthetase,protein,160488,Pseudomonas putida (strain ATCC 47054 / DSM 6125 / CFBP 8728 / NCIMB 11950 / KT2440),Pseudomonas putida (strain ATCC 47054 / DSM 6125 / CFBP 8728 / NCIMB 11950 / KT2440),nadE,275,PTHR23090:SF7,NH(3)-DEPENDENT NAD(+) SYNTHETASE,True
Q88Z14,NH(3)-dependent NAD(+) synthetase,protein,220668,Lactiplantibacillus plantarum (strain ATCC BAA-793 / NCIMB 8826 / WCFS1),Lactiplantibacillus plantarum (strain ATCC BAA-793 / NCIMB 8826 / WCFS1),nadE,275,PTHR23090:SF7,NH(3)-DEPENDENT NAD(+) SYNTHETASE,True
Q8CNP1,NH(3)-dependent NAD(+) synthetase,protein,176280,Staphylococcus epidermidis (strain ATCC 12228 / FDA PCI 1200),Staphylococcus epidermidis (strain ATCC 12228 / FDA PCI 1200),nadE,275,PTHR23090:SF7,NH(3)-DEPENDENT NAD(+) SYNTHETASE,True
Q8CWY4,NH(3)-dependent NAD(+) synthetase,protein,210007,Streptococcus mutans serotype c (strain ATCC 700610 / UA159),Streptococcus mutans serotype c (strain ATCC 700610 / UA159),nadE,274,PTHR23090:SF7,NH(3)-DEPENDENT NAD(+) SYNTHETASE,True
Q8D3T7,NH(3)-dependent NAD(+) synthetase,protein,216895,Vibrio vulnificus (strain CMCP6),Vibrio vulnificus (strain CMCP6),nadE,276,PTHR23090:SF7,NH(3)-DEPENDENT NAD(+) SYNTHETASE,True
Q8E1Q7,NH(3)-dependent NAD(+) synthetase,protein,208435,Streptococcus agalactiae serotype V (strain ATCC BAA-611 / 2603 V/R),Streptococcus agalactiae serotype V (strain ATCC BAA-611 / 2603 V/R),nadE,273,PTHR23090:SF7,NH(3)-DEPENDENT NAD(+) SYNTHETASE,True
Q8E771,NH(3)-dependent NAD(+) synthetase,protein,211110,Streptococcus agalactiae serotype III (strain NEM316),Streptococcus agalactiae serotype III (strain NEM316),nadE,273,PTHR23090:SF7,NH(3)-DEPENDENT NAD(+) SYNTHETASE,True
Q8EFF2,NH(3)-dependent NAD(+) synthetase,protein,211586,Shewanella oneidensis (strain ATCC 700550 / JCM 31522 / CIP 106686 / LMG 19005 / NCIMB 14063 / MR-1),Shewanella oneidensis (strain ATCC 700550 / JCM 31522 / CIP 106686 / LMG 19005 / NCIMB 14063 / MR-1),nadE,276,PTHR23090:SF7,NH(3)-DEPENDENT NAD(+) SYNTHETASE,True
Q8ET75,NH(3)-dependent NAD(+) synthetase,protein,221109,Oceanobacillus iheyensis (strain DSM 14371 / CIP 107618 / JCM 11309 / KCTC 3954 / HTE831),Oceanobacillus iheyensis (strain DSM 14371 / CIP 107618 / JCM 11309 / KCTC 3954 / HTE831),nadE,275,PTHR23090:SF7,NH(3)-DEPENDENT NAD(+) SYNTHETASE,True
Q8EWK9,NH(3)-dependent NAD(+) synthetase,protein,272633,Malacoplasma penetrans (strain HF-2),Malacoplasma penetrans (strain HF-2),nadE,243,PTHR23090:SF9,GLUTAMINE-DEPENDENT NAD(+) SYNTHETASE,True
Q8FH06,NH(3)-dependent NAD(+) synthetase,protein,199310,Escherichia coli O6:H1 (strain CFT073 / ATCC 700928 / UPEC),Escherichia coli O6:H1 (strain CFT073 / ATCC 700928 / UPEC),nadE,275,PTHR23090:SF7,NH(3)-DEPENDENT NAD(+) SYNTHETASE,True
Q8FMS2,NH(3)-dependent NAD(+) synthetase,protein,196164,Corynebacterium efficiens (strain DSM 44549 / YS-314 / AJ 12310 / JCM 11189 / NBRC 100395),Corynebacterium efficiens (strain DSM 44549 / YS-314 / AJ 12310 / JCM 11189 / NBRC 100395),nadE,277,PTHR23090:SF7,NH(3)-DEPENDENT NAD(+) SYNTHETASE,True
Q8K9W7,NH(3)-dependent NAD(+) synthetase,protein,198804,Buchnera aphidicola subsp. Schizaphis graminum (strain Sg),Buchnera aphidicola subsp. Schizaphis graminum (strain Sg),nadE,268,PTHR23090:SF7,NH(3)-DEPENDENT NAD(+) SYNTHETASE,True
Q8KEX2,NH(3)-dependent NAD(+) synthetase,protein,194439,Chlorobaculum tepidum (strain ATCC 49652 / DSM 12025 / NBRC 103806 / TLS),Chlorobaculum tepidum (strain ATCC 49652 / DSM 12025 / NBRC 103806 / TLS),nadE,277,PTHR23090:SF9,GLUTAMINE-DEPENDENT NAD(+) SYNTHETASE,True
Q8NMN7,NH(3)-dependent NAD(+) synthetase,protein,196627,Corynebacterium glutamicum (strain ATCC 13032 / DSM 20300 / JCM 1318 / BCRC 11384 / CCUG 27702 / LMG 3730 / NBRC 12168 / NCIMB 10025 / NRRL B-2784 / 534),Corynebacterium glutamicum (strain ATCC 13032 / DSM 20300 / JCM 1318 / BCRC 11384 / CCUG 27702 / LMG 3730 / NBRC 12168 / NCIMB 10025 / NRRL B-2784 / 534),nadE,277,PTHR23090:SF7,NH(3)-DEPENDENT NAD(+) SYNTHETASE,True
Q8NZY8,NH(3)-dependent NAD(+) synthetase,protein,186103,Streptococcus pyogenes serotype M18 (strain MGAS8232),Streptococcus pyogenes serotype M18 (strain MGAS8232),nadE,274,PTHR23090:SF7,NH(3)-DEPENDENT NAD(+) SYNTHETASE,True
Q8PZP6,NH(3)-dependent NAD(+) synthetase,protein,192952,Methanosarcina mazei (strain ATCC BAA-159 / DSM 3647 / Goe1 / Go1 / JCM 11833 / OCM 88),Methanosarcina mazei (strain ATCC BAA-159 / DSM 3647 / Goe1 / Go1 / JCM 11833 / OCM 88),nadE,256,PTHR23090:SF9,GLUTAMINE-DEPENDENT NAD(+) SYNTHETASE,True
Q8REA7,NH(3)-dependent NAD(+) synthetase,protein,190304,Fusobacterium nucleatum subsp. nucleatum (strain ATCC 25586 / DSM 15643 / BCRC 10681 / CIP 101130 / JCM 8532 / KCTC 2640 / LMG 13131 / VPI 4355),Fusobacterium nucleatum subsp. nucleatum (strain ATCC 25586 / DSM 15643 / BCRC 10681 / CIP 101130 / JCM 8532 / KCTC 2640 / LMG 13131 / VPI 4355),nadE,258,PTHR23090:SF9,GLUTAMINE-DEPENDENT NAD(+) SYNTHETASE,True
Q8TK88,NH(3)-dependent NAD(+) synthetase,protein,188937,Methanosarcina acetivorans (strain ATCC 35395 / DSM 2834 / JCM 12185 / C2A),Methanosarcina acetivorans (strain ATCC 35395 / DSM 2834 / JCM 12185 / C2A),nadE,256,PTHR23090:SF9,GLUTAMINE-DEPENDENT NAD(+) SYNTHETASE,True
Q8TVH1,NH(3)-dependent NAD(+) synthetase,protein,190192,Methanopyrus kandleri (strain AV19 / DSM 6324 / JCM 9639 / NBRC 100938),Methanopyrus kandleri (strain AV19 / DSM 6324 / JCM 9639 / NBRC 100938),nadE,284,PTHR23090:SF9,GLUTAMINE-DEPENDENT NAD(+) SYNTHETASE,True
Q8U4I9,NH(3)-dependent NAD(+) synthetase,protein,186497,Pyrococcus furiosus (strain ATCC 43587 / DSM 3638 / JCM 8422 / Vc1),Pyrococcus furiosus (strain ATCC 43587 / DSM 3638 / JCM 8422 / Vc1),nadE,257,PTHR23090:SF9,GLUTAMINE-DEPENDENT NAD(+) SYNTHETASE,True
Q8XDZ9,NH(3)-dependent NAD(+) synthetase,protein,83334,Escherichia coli O157:H7,Escherichia coli O157:H7,nadE,275,PTHR23090:SF7,NH(3)-DEPENDENT NAD(+) SYNTHETASE,True
Q8Y825,NH(3)-dependent NAD(+) synthetase,protein,169963,Listeria monocytogenes serovar 1/2a (strain ATCC BAA-679 / EGD-e),Listeria monocytogenes serovar 1/2a (strain ATCC BAA-679 / EGD-e),nadE,274,PTHR23090:SF7,NH(3)-DEPENDENT NAD(+) SYNTHETASE,True
Q8Z6G6,NH(3)-dependent NAD(+) synthetase,protein,90370,Salmonella typhi,Salmonella typhi,nadE,275,PTHR23090:SF7,NH(3)-DEPENDENT NAD(+) SYNTHETASE,True
Q8ZPU5,NH(3)-dependent NAD(+) synthetase,protein,99287,Salmonella typhimurium (strain LT2 / SGSC1412 / ATCC 700720),Salmonella typhimurium (strain LT2 / SGSC1412 / ATCC 700720),nadE,275,PTHR23090:SF7,NH(3)-DEPENDENT NAD(+) SYNTHETASE,True
Q8ZXL4,NH(3)-dependent NAD(+) synthetase,protein,178306,Pyrobaculum aerophilum (strain ATCC 51768 / DSM 7523 / JCM 9630 / CIP 104966 / NBRC 100827 / IM2),Pyrobaculum aerophilum (strain ATCC 51768 / DSM 7523 / JCM 9630 / CIP 104966 / NBRC 100827 / IM2),nadE,267,PTHR23090:SF9,GLUTAMINE-DEPENDENT NAD(+) SYNTHETASE,True
Q92CU3,NH(3)-dependent NAD(+) synthetase,protein,272626,Listeria innocua serovar 6a (strain ATCC BAA-680 / CLIP 11262),Listeria innocua serovar 6a (strain ATCC BAA-680 / CLIP 11262),nadE,274,PTHR23090:SF7,NH(3)-DEPENDENT NAD(+) SYNTHETASE,True
Q92TY6,NH(3)-dependent NAD(+) synthetase,protein,266834,Rhizobium meliloti (strain 1021),Rhizobium meliloti (strain 1021) (Ensifer meliloti),nadE,334,PTHR23090:SF9,GLUTAMINE-DEPENDENT NAD(+) SYNTHETASE,True
Q96YL5,NH(3)-dependent NAD(+) synthetase,protein,273063,Sulfurisphaera tokodaii (strain DSM 16993 / JCM 10545 / NBRC 100140 / 7),Sulfurisphaera tokodaii (strain DSM 16993 / JCM 10545 / NBRC 100140 / 7),nadE,279,PTHR23090:SF9,GLUTAMINE-DEPENDENT NAD(+) SYNTHETASE,True
Q979W4,NH(3)-dependent NAD(+) synthetase,protein,273116,Thermoplasma volcanium (strain ATCC 51530 / DSM 4299 / JCM 9571 / NBRC 15438 / GSS1),Thermoplasma volcanium (strain ATCC 51530 / DSM 4299 / JCM 9571 / NBRC 15438 / GSS1),nadE,242,PTHR23090:SF9,GLUTAMINE-DEPENDENT NAD(+) SYNTHETASE,True
Q97WN9,NH(3)-dependent NAD(+) synthetase,protein,273057,Saccharolobus solfataricus (strain ATCC 35092 / DSM 1617 / JCM 11322 / P2),Saccharolobus solfataricus (strain ATCC 35092 / DSM 1617 / JCM 11322 / P2),nadE,278,PTHR23090:SF9,GLUTAMINE-DEPENDENT NAD(+) SYNTHETASE,True
Q988H0,NH(3)-dependent NAD(+) synthetase,protein,266835,Mesorhizobium japonicum (strain LMG 29417 / CECT 9101 / MAFF 303099),Mesorhizobium japonicum (strain LMG 29417 / CECT 9101 / MAFF 303099),nadE,319,PTHR23090:SF9,GLUTAMINE-DEPENDENT NAD(+) SYNTHETASE,True
Q98PU6,NH(3)-dependent NAD(+) synthetase,protein,272635,Mycoplasmopsis pulmonis (strain UAB CTIP),Mycoplasmopsis pulmonis (strain UAB CTIP),nadE,257,PTHR23090:SF9,GLUTAMINE-DEPENDENT NAD(+) SYNTHETASE,True
Q99YK9,NH(3)-dependent NAD(+) synthetase,protein,301447,Streptococcus pyogenes serotype M1,Streptococcus pyogenes serotype M1,nadE,274,PTHR23090:SF7,NH(3)-DEPENDENT NAD(+) SYNTHETASE,True
Q9C723,Glutamine-dependent NAD(+) synthetase,protein,3702,Arabidopsis thaliana,Arabidopsis thaliana (Mouse-ear cress),At1g55090,725,PTHR23090:SF9,GLUTAMINE-DEPENDENT NAD(+) SYNTHETASE,True
Q9CBZ6,Glutamine-dependent NAD(+) synthetase,protein,272631,Mycobacterium leprae (strain TN),Mycobacterium leprae (strain TN),nadE,680,PTHR23090:SF9,GLUTAMINE-DEPENDENT NAD(+) SYNTHETASE,True
Q9CGJ4,NH(3)-dependent NAD(+) synthetase,protein,272623,Lactococcus lactis subsp. lactis (strain IL1403),Lactococcus lactis subsp. lactis (strain IL1403),nadE,274,PTHR23090:SF7,NH(3)-DEPENDENT NAD(+) SYNTHETASE,True
Q9HJR8,NH(3)-dependent NAD(+) synthetase,protein,273075,Thermoplasma acidophilum (strain ATCC 25905 / DSM 1728 / JCM 9062 / NBRC 15155 / AMRC-C165),Thermoplasma acidophilum (strain ATCC 25905 / DSM 1728 / JCM 9062 / NBRC 15155 / AMRC-C165),nadE,241,PTHR23090:SF9,GLUTAMINE-DEPENDENT NAD(+) SYNTHETASE,True
Q9HNM7,NH(3)-dependent NAD(+) synthetase,protein,64091,Halobacterium salinarum (strain ATCC 700922 / JCM 11081 / NRC-1),Halobacterium salinarum (strain ATCC 700922 / JCM 11081 / NRC-1),nadE,268,PTHR23090:SF9,GLUTAMINE-DEPENDENT NAD(+) SYNTHETASE,True
Q9HUP3,NH(3)-dependent NAD(+) synthetase,protein,208964,Pseudomonas aeruginosa (strain ATCC 15692 / DSM 22644 / CIP 104116 / JCM 14847 / LMG 12228 / 1C / PRS 101 / PAO1),Pseudomonas aeruginosa (strain ATCC 15692 / DSM 22644 / CIP 104116 / JCM 14847 / LMG 12228 / 1C / PRS 101 / PAO1),nadE,275,PTHR23090:SF7,NH(3)-DEPENDENT NAD(+) SYNTHETASE,True
Q9KAK2,NH(3)-dependent NAD(+) synthetase,protein,272558,Halalkalibacterium halodurans (strain ATCC BAA-125 / DSM 18197 / FERM 7344 / JCM 9153 / C-125),Halalkalibacterium halodurans (strain ATCC BAA-125 / DSM 18197 / FERM 7344 / JCM 9153 / C-125),nadE,272,PTHR23090:SF7,NH(3)-DEPENDENT NAD(+) SYNTHETASE,True
Q9KMW1,NH(3)-dependent NAD(+) synthetase,protein,243277,Vibrio cholerae serotype O1 (strain ATCC 39315 / El Tor Inaba N16961),Vibrio cholerae serotype O1 (strain ATCC 39315 / El Tor Inaba N16961),nadE,276,PTHR23090:SF7,NH(3)-DEPENDENT NAD(+) SYNTHETASE,True
Q9PC24,Glutamine-dependent NAD(+) synthetase,protein,160492,Xylella fastidiosa (strain 9a5c),Xylella fastidiosa (strain 9a5c),nadE,545,PTHR23090:SF9,GLUTAMINE-DEPENDENT NAD(+) SYNTHETASE,True
Q9PPB0,NH(3)-dependent NAD(+) synthetase,protein,192222,Campylobacter jejuni subsp. jejuni serotype O:2 (strain ATCC 700819 / NCTC 11168),Campylobacter jejuni subsp. jejuni serotype O:2 (strain ATCC 700819 / NCTC 11168),nadE,246,PTHR23090:SF9,GLUTAMINE-DEPENDENT NAD(+) SYNTHETASE,True
Q9RJM5,NH(3)-dependent NAD(+) synthetase,protein,100226,Streptomyces coelicolor (strain ATCC BAA-471 / A3(2) / M145),Streptomyces coelicolor (strain ATCC BAA-471 / A3(2) / M145),nadE,276,PTHR23090:SF7,NH(3)-DEPENDENT NAD(+) SYNTHETASE,True
Q9RYV5,NH(3)-dependent NAD(+) synthetase,protein,243230,Deinococcus radiodurans (strain ATCC 13939 / DSM 20539 / JCM 16871 / CCUG 27074 / LMG 4051 / NBRC 15346 / NCIMB 9279 / VKM B-1422 / R1),Deinococcus radiodurans (strain ATCC 13939 / DSM 20539 / JCM 16871 / CCUG 27074 / LMG 4051 / NBRC 15346 / NCIMB 9279 / VKM B-1422 / R1),nadE,287,PTHR23090:SF7,NH(3)-DEPENDENT NAD(+) SYNTHETASE,True
Q9V2A9,NH(3)-dependent NAD(+) synthetase,protein,272844,Pyrococcus abyssi (strain GE5 / Orsay),Pyrococcus abyssi (strain GE5 / Orsay),nadE,257,PTHR23090:SF9,GLUTAMINE-DEPENDENT NAD(+) SYNTHETASE,True
Q9VYA0,Glutamine-dependent NAD(+) synthetase,protein,7227,Drosophila melanogaster,Drosophila melanogaster (Fruit fly),Nadsyn,787,PTHR23090:SF9,GLUTAMINE-DEPENDENT NAD(+) SYNTHETASE,True
Q9WZB3,NH(3)-dependent NAD(+) synthetase,protein,243274,Thermotoga maritima (strain ATCC 43589 / DSM 3109 / JCM 10099 / NBRC 100826 / MSB8),Thermotoga maritima (strain ATCC 43589 / DSM 3109 / JCM 10099 / NBRC 100826 / MSB8),nadE1,281,PTHR23090:SF9,GLUTAMINE-DEPENDENT NAD(+) SYNTHETASE,True
Q9X0Y0,Glutamine-dependent NAD(+) synthetase,protein,243274,Thermotoga maritima (strain ATCC 43589 / DSM 3109 / JCM 10099 / NBRC 100826 / MSB8),Thermotoga maritima (strain ATCC 43589 / DSM 3109 / JCM 10099 / NBRC 100826 / MSB8),nadE2,576,PTHR23090:SF9,GLUTAMINE-DEPENDENT NAD(+) SYNTHETASE,True
Q9YAI1,NH(3)-dependent NAD(+) synthetase,protein,272557,Aeropyrum pernix (strain ATCC 700893 / DSM 11879 / JCM 9820 / NBRC 100138 / K1),Aeropyrum pernix (strain ATCC 700893 / DSM 11879 / JCM 9820 / NBRC 100138 / K1),nadE,286,PTHR23090:SF9,GLUTAMINE-DEPENDENT NAD(+) SYNTHETASE,True
Q9ZMB0,NH(3)-dependent NAD(+) synthetase,protein,85963,Helicobacter pylori (strain J99 / ATCC 700824),Helicobacter pylori (strain J99 / ATCC 700824),nadE,260,PTHR23090:SF9,GLUTAMINE-DEPENDENT NAD(+) SYNTHETASE,True
