id,name,entry_type,source_tax_id,source_tax_name,full_tax_name,gene,length,subfamily,subfamily_name,in_alphafold
A0A0H2X6L3,Glutamine-dependent NAD(+) synthetase,protein,314565,Xanthomonas campestris pv. campestris (strain 8004),Xanthomonas campestris pv. campestris (strain 8004),nadE,552,PTHR23090:SF9,GLUTAMINE-DEPENDENT NAD(+) SYNTHETASE,True
A0AHK4,NH(3)-dependent NAD(+) synthetase,protein,386043,Listeria welshimeri serovar 6b (strain ATCC 35897 / DSM 20650 / CCUG 15529 / CIP 8149 / NCTC 11857 / SLCC 5334 / V8),Listeria welshimeri serovar 6b (strain ATCC 35897 / DSM 20650 / CCUG 15529 / CIP 8149 / NCTC 11857 / SLCC 5334 / V8),nadE,274,PTHR23090:SF7,NH(3)-DEPENDENT NAD(+) SYNTHETASE,True
A0B2Y5,NH(3)-dependent NAD(+) synthetase,protein,331272,Burkholderia cenocepacia (strain HI2424),Burkholderia cenocepacia (strain HI2424),nadE,282,PTHR23090:SF7,NH(3)-DEPENDENT NAD(+) SYNTHETASE,True
A0RCZ8,NH(3)-dependent NAD(+) synthetase,protein,412694,Bacillus thuringiensis (strain Al Hakam),Bacillus thuringiensis (strain Al Hakam),nadE,272,PTHR23090:SF7,NH(3)-DEPENDENT NAD(+) SYNTHETASE,True
A1ABS1,NH(3)-dependent NAD(+) synthetase,protein,405955,Escherichia coli O1:K1 / APEC,Escherichia coli O1:K1 / APEC,nadE,275,PTHR23090:SF7,NH(3)-DEPENDENT NAD(+) SYNTHETASE,True
A1BEN4,NH(3)-dependent NAD(+) synthetase,protein,290317,Chlorobium phaeobacteroides (strain DSM 266 / SMG 266 / 2430),Chlorobium phaeobacteroides (strain DSM 266 / SMG 266 / 2430),nadE,277,PTHR23090:SF9,GLUTAMINE-DEPENDENT NAD(+) SYNTHETASE,True
A1RIQ6,NH(3)-dependent NAD(+) synthetase,protein,351745,Shewanella sp. (strain W3-18-1),Shewanella sp. (strain W3-18-1),nadE,276,PTHR23090:SF7,NH(3)-DEPENDENT NAD(+) SYNTHETASE,True
A1S5V3,NH(3)-dependent NAD(+) synthetase,protein,326297,Shewanella amazonensis (strain ATCC BAA-1098 / SB2B),Shewanella amazonensis (strain ATCC BAA-1098 / SB2B),nadE,276,PTHR23090:SF7,NH(3)-DEPENDENT NAD(+) SYNTHETASE,True
A1SZH7,NH(3)-dependent NAD(+) synthetase,protein,357804,Psychromonas ingrahamii (strain DSM 17664 / CCUG 51855 / 37),Psychromonas ingrahamii (strain DSM 17664 / CCUG 51855 / 37),nadE,276,PTHR23090:SF7,NH(3)-DEPENDENT NAD(+) SYNTHETASE,True
A1UW43,NH(3)-dependent NAD(+) synthetase,protein,320388,Burkholderia mallei (strain SAVP1),Burkholderia mallei (strain SAVP1),nadE,284,PTHR23090:SF7,NH(3)-DEPENDENT NAD(+) SYNTHETASE,True
A1VZF8,NH(3)-dependent NAD(+) synthetase,protein,354242,Campylobacter jejuni subsp. jejuni serotype O:23/36 (strain 81-176),Campylobacter jejuni subsp. jejuni serotype O:23/36 (strain 81-176),nadE,246,PTHR23090:SF9,GLUTAMINE-DEPENDENT NAD(+) SYNTHETASE,True
A2BLB9,NH(3)-dependent NAD(+) synthetase,protein,415426,Hyperthermus butylicus (strain DSM 5456 / JCM 9403 / PLM1-5),Hyperthermus butylicus (strain DSM 5456 / JCM 9403 / PLM1-5),nadE,276,PTHR23090:SF9,GLUTAMINE-DEPENDENT NAD(+) SYNTHETASE,True
A2RD51,NH(3)-dependent NAD(+) synthetase,protein,160491,Streptococcus pyogenes serotype M5 (strain Manfredo),Streptococcus pyogenes serotype M5 (strain Manfredo),nadE,274,PTHR23090:SF7,NH(3)-DEPENDENT NAD(+) SYNTHETASE,True
A2RL82,NH(3)-dependent NAD(+) synthetase,protein,416870,Lactococcus lactis subsp. cremoris (strain MG1363),Lactococcus lactis subsp. cremoris (strain MG1363),nadE,274,PTHR23090:SF7,NH(3)-DEPENDENT NAD(+) SYNTHETASE,True
A2RXU4,NH(3)-dependent NAD(+) synthetase,protein,412022,Burkholderia mallei (strain NCTC 10229),Burkholderia mallei (strain NCTC 10229),nadE,284,PTHR23090:SF7,NH(3)-DEPENDENT NAD(+) SYNTHETASE,True
A2YII8,Glutamine-dependent NAD(+) synthetase,protein,39946,Oryza sativa subsp. indica,Oryza sativa subsp. indica (Rice),OsI_25032,735,PTHR23090:SF9,GLUTAMINE-DEPENDENT NAD(+) SYNTHETASE,True
A3CPY9,NH(3)-dependent NAD(+) synthetase,protein,388919,Streptococcus sanguinis (strain SK36),Streptococcus sanguinis (strain SK36),nadE,274,PTHR23090:SF7,NH(3)-DEPENDENT NAD(+) SYNTHETASE,True
A3D5M3,NH(3)-dependent NAD(+) synthetase,protein,325240,Shewanella baltica (strain OS155 / ATCC BAA-1091),Shewanella baltica (strain OS155 / ATCC BAA-1091),nadE,276,PTHR23090:SF7,NH(3)-DEPENDENT NAD(+) SYNTHETASE,True
A3DP41,NH(3)-dependent NAD(+) synthetase,protein,399550,Staphylothermus marinus (strain ATCC 43588 / DSM 3639 / JCM 9404 / F1),Staphylothermus marinus (strain ATCC 43588 / DSM 3639 / JCM 9404 / F1),nadE,275,PTHR23090:SF9,GLUTAMINE-DEPENDENT NAD(+) SYNTHETASE,True
A3MF00,NH(3)-dependent NAD(+) synthetase,protein,320389,Burkholderia mallei (strain NCTC 10247),Burkholderia mallei (strain NCTC 10247),nadE,284,PTHR23090:SF7,NH(3)-DEPENDENT NAD(+) SYNTHETASE,True
A3P6S9,NH(3)-dependent NAD(+) synthetase,protein,357348,Burkholderia pseudomallei (strain 1106a),Burkholderia pseudomallei (strain 1106a),nadE,284,PTHR23090:SF7,NH(3)-DEPENDENT NAD(+) SYNTHETASE,True
A4QGT5,NH(3)-dependent NAD(+) synthetase,protein,340322,Corynebacterium glutamicum (strain R),Corynebacterium glutamicum (strain R),nadE,277,PTHR23090:SF7,NH(3)-DEPENDENT NAD(+) SYNTHETASE,True
A4SFG4,NH(3)-dependent NAD(+) synthetase,protein,290318,Chlorobium phaeovibrioides (strain DSM 265 / 1930),Chlorobium phaeovibrioides (strain DSM 265 / 1930),nadE,277,PTHR23090:SF9,GLUTAMINE-DEPENDENT NAD(+) SYNTHETASE,True
A4VKK4,NH(3)-dependent NAD(+) synthetase,protein,379731,Stutzerimonas stutzeri (strain A1501),Stutzerimonas stutzeri (strain A1501),nadE,275,PTHR23090:SF7,NH(3)-DEPENDENT NAD(+) SYNTHETASE,True
A4VX00,NH(3)-dependent NAD(+) synthetase,protein,391295,Streptococcus suis (strain 05ZYH33),Streptococcus suis (strain 05ZYH33),nadE,274,PTHR23090:SF7,NH(3)-DEPENDENT NAD(+) SYNTHETASE,True
A4W3A3,NH(3)-dependent NAD(+) synthetase,protein,391296,Streptococcus suis (strain 98HAH33),Streptococcus suis (strain 98HAH33),nadE,274,PTHR23090:SF7,NH(3)-DEPENDENT NAD(+) SYNTHETASE,True
A4W9K3,NH(3)-dependent NAD(+) synthetase,protein,399742,Enterobacter sp. (strain 638),Enterobacter sp. (strain 638),nadE,275,PTHR23090:SF7,NH(3)-DEPENDENT NAD(+) SYNTHETASE,True
A4XS59,NH(3)-dependent NAD(+) synthetase,protein,399739,Ectopseudomonas mendocina (strain ymp),Ectopseudomonas mendocina (strain ymp),nadE,275,PTHR23090:SF7,NH(3)-DEPENDENT NAD(+) SYNTHETASE,True
A4Y7T2,NH(3)-dependent NAD(+) synthetase,protein,319224,Shewanella putrefaciens (strain CN-32 / ATCC BAA-453),Shewanella putrefaciens (strain CN-32 / ATCC BAA-453),nadE,276,PTHR23090:SF7,NH(3)-DEPENDENT NAD(+) SYNTHETASE,True
A5EYT7,NH(3)-dependent NAD(+) synthetase,protein,345073,Vibrio cholerae serotype O1 (strain ATCC 39541 / Classical Ogawa 395 / O395),Vibrio cholerae serotype O1 (strain ATCC 39541 / Classical Ogawa 395 / O395),nadE,276,PTHR23090:SF7,NH(3)-DEPENDENT NAD(+) SYNTHETASE,True
A5G7Y9,NH(3)-dependent NAD(+) synthetase,protein,351605,Geotalea uraniireducens (strain Rf4),Geotalea uraniireducens (strain Rf4),nadE,273,PTHR23090:SF9,GLUTAMINE-DEPENDENT NAD(+) SYNTHETASE,True
A5IU80,NH(3)-dependent NAD(+) synthetase,protein,359786,Staphylococcus aureus (strain JH9),Staphylococcus aureus (strain JH9),nadE,273,PTHR23090:SF7,NH(3)-DEPENDENT NAD(+) SYNTHETASE,True
A5VI81,NH(3)-dependent NAD(+) synthetase,protein,557436,Limosilactobacillus reuteri (strain DSM 20016),Limosilactobacillus reuteri (strain DSM 20016),nadE,275,PTHR23090:SF7,NH(3)-DEPENDENT NAD(+) SYNTHETASE,True
A5W9Q7,NH(3)-dependent NAD(+) synthetase,protein,351746,Pseudomonas putida (strain ATCC 700007 / DSM 6899 / JCM 31910 / BCRC 17059 / LMG 24140 / F1),Pseudomonas putida (strain ATCC 700007 / DSM 6899 / JCM 31910 / BCRC 17059 / LMG 24140 / F1),nadE,275,PTHR23090:SF7,NH(3)-DEPENDENT NAD(+) SYNTHETASE,True
A6QIE0,NH(3)-dependent NAD(+) synthetase,protein,426430,Staphylococcus aureus (strain Newman),Staphylococcus aureus (strain Newman),nadE,273,PTHR23090:SF7,NH(3)-DEPENDENT NAD(+) SYNTHETASE,True
A6TQC4,NH(3)-dependent NAD(+) synthetase,protein,293826,Alkaliphilus metalliredigens (strain QYMF),Alkaliphilus metalliredigens (strain QYMF),nadE,247,PTHR23090:SF7,NH(3)-DEPENDENT NAD(+) SYNTHETASE,True
A6U318,NH(3)-dependent NAD(+) synthetase,protein,359787,Staphylococcus aureus (strain JH1),Staphylococcus aureus (strain JH1),nadE,273,PTHR23090:SF7,NH(3)-DEPENDENT NAD(+) SYNTHETASE,True
A6UUS4,NH(3)-dependent NAD(+) synthetase,protein,419665,Methanococcus aeolicus (strain ATCC BAA-1280 / DSM 17508 / OCM 812 / Nankai-3),Methanococcus aeolicus (strain ATCC BAA-1280 / DSM 17508 / OCM 812 / Nankai-3),nadE,254,PTHR23090:SF9,GLUTAMINE-DEPENDENT NAD(+) SYNTHETASE,True
A6VD32,NH(3)-dependent NAD(+) synthetase,protein,381754,Pseudomonas paraeruginosa (strain DSM 24068 / PA7),Pseudomonas paraeruginosa (strain DSM 24068 / PA7),nadE,275,PTHR23090:SF7,NH(3)-DEPENDENT NAD(+) SYNTHETASE,True
A6WPH7,NH(3)-dependent NAD(+) synthetase,protein,402882,Shewanella baltica (strain OS185),Shewanella baltica (strain OS185),nadE,276,PTHR23090:SF7,NH(3)-DEPENDENT NAD(+) SYNTHETASE,True
A7GNW5,NH(3)-dependent NAD(+) synthetase,protein,315749,Bacillus cytotoxicus (strain DSM 22905 / CIP 110041 / 391-98 / NVH 391-98),Bacillus cytotoxicus (strain DSM 22905 / CIP 110041 / 391-98 / NVH 391-98),nadE,272,PTHR23090:SF7,NH(3)-DEPENDENT NAD(+) SYNTHETASE,True
A7H439,NH(3)-dependent NAD(+) synthetase,protein,360109,Campylobacter jejuni subsp. doylei (strain ATCC BAA-1458 / RM4099 / 269.97),Campylobacter jejuni subsp. doylei (strain ATCC BAA-1458 / RM4099 / 269.97),nadE,246,PTHR23090:SF9,GLUTAMINE-DEPENDENT NAD(+) SYNTHETASE,True
A7I243,NH(3)-dependent NAD(+) synthetase,protein,360107,Campylobacter hominis (strain ATCC BAA-381 / DSM 21671 / CCUG 45161 / LMG 19568 / NCTC 13146 / CH001A),Campylobacter hominis (strain ATCC BAA-381 / DSM 21671 / CCUG 45161 / LMG 19568 / NCTC 13146 / CH001A),nadE,247,PTHR23090:SF9,GLUTAMINE-DEPENDENT NAD(+) SYNTHETASE,True
A7IAS7,NH(3)-dependent NAD(+) synthetase,protein,456442,Methanoregula boonei (strain DSM 21154 / JCM 14090 / 6A8),Methanoregula boonei (strain DSM 21154 / JCM 14090 / 6A8),nadE,248,PTHR23090:SF9,GLUTAMINE-DEPENDENT NAD(+) SYNTHETASE,True
A7MNW9,NH(3)-dependent NAD(+) synthetase,protein,290339,Cronobacter sakazakii (strain ATCC BAA-894),Cronobacter sakazakii (strain ATCC BAA-894),nadE,275,PTHR23090:SF7,NH(3)-DEPENDENT NAD(+) SYNTHETASE,True
A7N654,NH(3)-dependent NAD(+) synthetase,protein,2902295,Vibrio campbellii (strain ATCC BAA-1116),Vibrio campbellii (strain ATCC BAA-1116),nadE,276,PTHR23090:SF7,NH(3)-DEPENDENT NAD(+) SYNTHETASE,True
A7X442,NH(3)-dependent NAD(+) synthetase,protein,418127,Staphylococcus aureus (strain Mu3 / ATCC 700698),Staphylococcus aureus (strain Mu3 / ATCC 700698),nadE,273,PTHR23090:SF7,NH(3)-DEPENDENT NAD(+) SYNTHETASE,True
A7Z159,NH(3)-dependent NAD(+) synthetase,protein,326423,Bacillus velezensis (strain DSM 23117 / BGSC 10A6 / LMG 26770 / FZB42),Bacillus velezensis (strain DSM 23117 / BGSC 10A6 / LMG 26770 / FZB42),nadE,272,PTHR23090:SF7,NH(3)-DEPENDENT NAD(+) SYNTHETASE,True
A7ZMK7,NH(3)-dependent NAD(+) synthetase,protein,331111,Escherichia coli O139:H28 (strain E24377A / ETEC),Escherichia coli O139:H28 (strain E24377A / ETEC),nadE,275,PTHR23090:SF7,NH(3)-DEPENDENT NAD(+) SYNTHETASE,True
A8A0T1,NH(3)-dependent NAD(+) synthetase,protein,331112,Escherichia coli O9:H4 (strain HS),Escherichia coli O9:H4 (strain HS),nadE,275,PTHR23090:SF7,NH(3)-DEPENDENT NAD(+) SYNTHETASE,True
A8AHD1,NH(3)-dependent NAD(+) synthetase,protein,290338,Citrobacter koseri (strain ATCC BAA-895 / CDC 4225-83 / SGSC4696),Citrobacter koseri (strain ATCC BAA-895 / CDC 4225-83 / SGSC4696),nadE,276,PTHR23090:SF7,NH(3)-DEPENDENT NAD(+) SYNTHETASE,True
A8AVT9,NH(3)-dependent NAD(+) synthetase,protein,467705,Streptococcus gordonii (strain Challis / ATCC 35105 / BCRC 15272 / CH1 / DL1 / V288),Streptococcus gordonii (strain Challis / ATCC 35105 / BCRC 15272 / CH1 / DL1 / V288),nadE,274,PTHR23090:SF7,NH(3)-DEPENDENT NAD(+) SYNTHETASE,True
A8F9S0,NH(3)-dependent NAD(+) synthetase,protein,315750,Bacillus pumilus (strain SAFR-032),Bacillus pumilus (strain SAFR-032),nadE,273,PTHR23090:SF7,NH(3)-DEPENDENT NAD(+) SYNTHETASE,True
A8FLM3,NH(3)-dependent NAD(+) synthetase,protein,407148,Campylobacter jejuni subsp. jejuni serotype O:6 (strain 81116 / NCTC 11828),Campylobacter jejuni subsp. jejuni serotype O:6 (strain 81116 / NCTC 11828),nadE,246,PTHR23090:SF9,GLUTAMINE-DEPENDENT NAD(+) SYNTHETASE,True
A8FU90,NH(3)-dependent NAD(+) synthetase,protein,425104,Shewanella sediminis (strain HAW-EB3),Shewanella sediminis (strain HAW-EB3),nadE,276,PTHR23090:SF7,NH(3)-DEPENDENT NAD(+) SYNTHETASE,True
A8H3E4,NH(3)-dependent NAD(+) synthetase,protein,398579,Shewanella pealeana (strain ATCC 700345 / ANG-SQ1),Shewanella pealeana (strain ATCC 700345 / ANG-SQ1),nadE,276,PTHR23090:SF7,NH(3)-DEPENDENT NAD(+) SYNTHETASE,True
A8MHN7,NH(3)-dependent NAD(+) synthetase,protein,350688,Alkaliphilus oremlandii (strain OhILAs),Alkaliphilus oremlandii (strain OhILAs),nadE,250,PTHR23090:SF9,GLUTAMINE-DEPENDENT NAD(+) SYNTHETASE,True
A8Z2S7,NH(3)-dependent NAD(+) synthetase,protein,451516,Staphylococcus aureus (strain USA300 / TCH1516),Staphylococcus aureus (strain USA300 / TCH1516),nadE,273,PTHR23090:SF7,NH(3)-DEPENDENT NAD(+) SYNTHETASE,True
A9L564,NH(3)-dependent NAD(+) synthetase,protein,399599,Shewanella baltica (strain OS195),Shewanella baltica (strain OS195),nadE,276,PTHR23090:SF7,NH(3)-DEPENDENT NAD(+) SYNTHETASE,True
A9MFF4,NH(3)-dependent NAD(+) synthetase,protein,41514,Salmonella arizonae (strain ATCC BAA-731 / CDC346-86 / RSK2980),Salmonella arizonae (strain ATCC BAA-731 / CDC346-86 / RSK2980),nadE,275,PTHR23090:SF7,NH(3)-DEPENDENT NAD(+) SYNTHETASE,True
A9N269,NH(3)-dependent NAD(+) synthetase,protein,1016998,Salmonella paratyphi B (strain ATCC BAA-1250 / SPB7),Salmonella paratyphi B (strain ATCC BAA-1250 / SPB7),nadE,275,PTHR23090:SF7,NH(3)-DEPENDENT NAD(+) SYNTHETASE,True
A9VRQ8,NH(3)-dependent NAD(+) synthetase,protein,315730,Bacillus mycoides (strain KBAB4),Bacillus mycoides (strain KBAB4),nadE,272,PTHR23090:SF7,NH(3)-DEPENDENT NAD(+) SYNTHETASE,True
B0KKX4,NH(3)-dependent NAD(+) synthetase,protein,76869,Pseudomonas putida (strain GB-1),Pseudomonas putida (strain GB-1),nadE,275,PTHR23090:SF7,NH(3)-DEPENDENT NAD(+) SYNTHETASE,True
B0R6W9,NH(3)-dependent NAD(+) synthetase,protein,478009,Halobacterium salinarum (strain ATCC 29341 / DSM 671 / R1),Halobacterium salinarum (strain ATCC 29341 / DSM 671 / R1),nadE,268,PTHR23090:SF9,GLUTAMINE-DEPENDENT NAD(+) SYNTHETASE,True
B0S1S2,NH(3)-dependent NAD(+) synthetase,protein,334413,Finegoldia magna (strain ATCC 29328 / DSM 20472 / WAL 2508),Finegoldia magna (strain ATCC 29328 / DSM 20472 / WAL 2508),nadE,241,PTHR23090:SF9,GLUTAMINE-DEPENDENT NAD(+) SYNTHETASE,True
B0TK55,NH(3)-dependent NAD(+) synthetase,protein,458817,Shewanella halifaxensis (strain HAW-EB4),Shewanella halifaxensis (strain HAW-EB4),nadE,276,PTHR23090:SF7,NH(3)-DEPENDENT NAD(+) SYNTHETASE,True
B1HTT1,NH(3)-dependent NAD(+) synthetase,protein,444177,Lysinibacillus sphaericus (strain C3-41),Lysinibacillus sphaericus (strain C3-41),nadE,274,PTHR23090:SF7,NH(3)-DEPENDENT NAD(+) SYNTHETASE,True
B1ICL9,NH(3)-dependent NAD(+) synthetase,protein,487214,Streptococcus pneumoniae (strain Hungary19A-6),Streptococcus pneumoniae (strain Hungary19A-6),nadE,274,PTHR23090:SF7,NH(3)-DEPENDENT NAD(+) SYNTHETASE,True
B1IPJ0,NH(3)-dependent NAD(+) synthetase,protein,481805,Escherichia coli (strain ATCC 8739 / DSM 1576 / NBRC 3972 / NCIMB 8545 / WDCM 00012 / Crooks),Escherichia coli (strain ATCC 8739 / DSM 1576 / NBRC 3972 / NCIMB 8545 / WDCM 00012 / Crooks),nadE,275,PTHR23090:SF7,NH(3)-DEPENDENT NAD(+) SYNTHETASE,True
B1J649,NH(3)-dependent NAD(+) synthetase,protein,390235,Pseudomonas putida (strain W619),Pseudomonas putida (strain W619),nadE,275,PTHR23090:SF7,NH(3)-DEPENDENT NAD(+) SYNTHETASE,True
B1K5T6,NH(3)-dependent NAD(+) synthetase,protein,406425,Burkholderia orbicola (strain MC0-3),Burkholderia orbicola (strain MC0-3),nadE,282,PTHR23090:SF7,NH(3)-DEPENDENT NAD(+) SYNTHETASE,True
B1KJ47,NH(3)-dependent NAD(+) synthetase,protein,392500,Shewanella woodyi (strain ATCC 51908 / MS32),Shewanella woodyi (strain ATCC 51908 / MS32),nadE,276,PTHR23090:SF7,NH(3)-DEPENDENT NAD(+) SYNTHETASE,True
B1LDZ1,NH(3)-dependent NAD(+) synthetase,protein,439855,Escherichia coli (strain SMS-3-5 / SECEC),Escherichia coli (strain SMS-3-5 / SECEC),nadE,275,PTHR23090:SF7,NH(3)-DEPENDENT NAD(+) SYNTHETASE,True
B1ME26,NH(3)-dependent NAD(+) synthetase,protein,561007,Mycobacteroides abscessus (strain ATCC 19977 / DSM 44196 / CCUG 20993 / CIP 104536 / JCM 13569 / NCTC 13031 / TMC 1543 / L948),Mycobacteroides abscessus (strain ATCC 19977 / DSM 44196 / CCUG 20993 / CIP 104536 / JCM 13569 / NCTC 13031 / TMC 1543 / L948),nadE,273,PTHR23090:SF7,NH(3)-DEPENDENT NAD(+) SYNTHETASE,True
B1XGK1,NH(3)-dependent NAD(+) synthetase,protein,316385,Escherichia coli (strain K12 / DH10B),Escherichia coli (strain K12 / DH10B),nadE,275,PTHR23090:SF7,NH(3)-DEPENDENT NAD(+) SYNTHETASE,True
B1YJ94,NH(3)-dependent NAD(+) synthetase,protein,262543,Exiguobacterium sibiricum (strain DSM 17290 / CCUG 55495 / CIP 109462 / JCM 13490 / 255-15),Exiguobacterium sibiricum (strain DSM 17290 / CCUG 55495 / CIP 109462 / JCM 13490 / 255-15),nadE,271,PTHR23090:SF7,NH(3)-DEPENDENT NAD(+) SYNTHETASE,True
B1Z0R0,NH(3)-dependent NAD(+) synthetase,protein,398577,Burkholderia ambifaria (strain MC40-6),Burkholderia ambifaria (strain MC40-6),nadE,282,PTHR23090:SF7,NH(3)-DEPENDENT NAD(+) SYNTHETASE,True
B2G5Q7,NH(3)-dependent NAD(+) synthetase,protein,557433,Limosilactobacillus reuteri subsp. reuteri (strain JCM 1112),Limosilactobacillus reuteri subsp. reuteri (strain JCM 1112),nadE,275,PTHR23090:SF7,NH(3)-DEPENDENT NAD(+) SYNTHETASE,True
B2GA98,NH(3)-dependent NAD(+) synthetase,protein,334390,Limosilactobacillus fermentum (strain NBRC 3956 / LMG 18251),Limosilactobacillus fermentum (strain NBRC 3956 / LMG 18251),nadE,276,PTHR23090:SF7,NH(3)-DEPENDENT NAD(+) SYNTHETASE,True
B2IQN8,NH(3)-dependent NAD(+) synthetase,protein,516950,Streptococcus pneumoniae (strain CGSP14),Streptococcus pneumoniae (strain CGSP14),nadE,274,PTHR23090:SF7,NH(3)-DEPENDENT NAD(+) SYNTHETASE,True
B2TDV9,NH(3)-dependent NAD(+) synthetase,protein,398527,Paraburkholderia phytofirmans (strain DSM 17436 / LMG 22146 / PsJN),Paraburkholderia phytofirmans (strain DSM 17436 / LMG 22146 / PsJN),nadE,286,PTHR23090:SF7,NH(3)-DEPENDENT NAD(+) SYNTHETASE,True
B2U3C0,NH(3)-dependent NAD(+) synthetase,protein,344609,Shigella boydii serotype 18 (strain CDC 3083-94 / BS512),Shigella boydii serotype 18 (strain CDC 3083-94 / BS512),nadE,275,PTHR23090:SF7,NH(3)-DEPENDENT NAD(+) SYNTHETASE,True
B2USG0,NH(3)-dependent NAD(+) synthetase,protein,512562,Helicobacter pylori (strain Shi470),Helicobacter pylori (strain Shi470),nadE,260,PTHR23090:SF9,GLUTAMINE-DEPENDENT NAD(+) SYNTHETASE,True
B2VEK0,NH(3)-dependent NAD(+) synthetase,protein,465817,Erwinia tasmaniensis (strain DSM 17950 / CFBP 7177 / CIP 109463 / NCPPB 4357 / Et1/99),Erwinia tasmaniensis (strain DSM 17950 / CFBP 7177 / CIP 109463 / NCPPB 4357 / Et1/99),nadE,275,PTHR23090:SF7,NH(3)-DEPENDENT NAD(+) SYNTHETASE,True
B3E4K8,NH(3)-dependent NAD(+) synthetase,protein,398767,Trichlorobacter lovleyi (strain ATCC BAA-1151 / DSM 17278 / SZ),Trichlorobacter lovleyi (strain ATCC BAA-1151 / DSM 17278 / SZ),nadE,273,PTHR23090:SF9,GLUTAMINE-DEPENDENT NAD(+) SYNTHETASE,True
B3ELE3,NH(3)-dependent NAD(+) synthetase,protein,331678,Chlorobium phaeobacteroides (strain BS1),Chlorobium phaeobacteroides (strain BS1),nadE,277,PTHR23090:SF9,GLUTAMINE-DEPENDENT NAD(+) SYNTHETASE,True
B3QM51,NH(3)-dependent NAD(+) synthetase,protein,517417,Chlorobaculum parvum (strain DSM 263 / NCIMB 8327),Chlorobaculum parvum (strain DSM 263 / NCIMB 8327),nadE,277,PTHR23090:SF9,GLUTAMINE-DEPENDENT NAD(+) SYNTHETASE,True
B3W8T2,NH(3)-dependent NAD(+) synthetase,protein,543734,Lacticaseibacillus casei (strain BL23),Lacticaseibacillus casei (strain BL23),nadE,275,PTHR23090:SF7,NH(3)-DEPENDENT NAD(+) SYNTHETASE,True
B4EIP2,NH(3)-dependent NAD(+) synthetase,protein,216591,Burkholderia cenocepacia (strain ATCC BAA-245 / DSM 16553 / LMG 16656 / NCTC 13227 / J2315 / CF5610),Burkholderia cenocepacia (strain ATCC BAA-245 / DSM 16553 / LMG 16656 / NCTC 13227 / J2315 / CF5610),nadE,282,PTHR23090:SF7,NH(3)-DEPENDENT NAD(+) SYNTHETASE,True
B4SEZ8,NH(3)-dependent NAD(+) synthetase,protein,324925,Pelodictyon phaeoclathratiforme (strain DSM 5477 / BU-1),Pelodictyon phaeoclathratiforme (strain DSM 5477 / BU-1),nadE,277,PTHR23090:SF9,GLUTAMINE-DEPENDENT NAD(+) SYNTHETASE,True
B4T4K7,NH(3)-dependent NAD(+) synthetase,protein,423368,Salmonella newport (strain SL254),Salmonella newport (strain SL254),nadE,275,PTHR23090:SF7,NH(3)-DEPENDENT NAD(+) SYNTHETASE,True
B4TGE8,NH(3)-dependent NAD(+) synthetase,protein,454169,Salmonella heidelberg (strain SL476),Salmonella heidelberg (strain SL476),nadE,275,PTHR23090:SF7,NH(3)-DEPENDENT NAD(+) SYNTHETASE,True
B4TUC9,NH(3)-dependent NAD(+) synthetase,protein,439843,Salmonella schwarzengrund (strain CVM19633),Salmonella schwarzengrund (strain CVM19633),nadE,275,PTHR23090:SF7,NH(3)-DEPENDENT NAD(+) SYNTHETASE,True
B4U4I9,NH(3)-dependent NAD(+) synthetase,protein,552526,Streptococcus equi subsp. zooepidemicus (strain MGCS10565),Streptococcus equi subsp. zooepidemicus (strain MGCS10565),nadE,274,PTHR23090:SF7,NH(3)-DEPENDENT NAD(+) SYNTHETASE,True
B5BA65,NH(3)-dependent NAD(+) synthetase,protein,554290,Salmonella paratyphi A (strain AKU_12601),Salmonella paratyphi A (strain AKU_12601),nadE,275,PTHR23090:SF7,NH(3)-DEPENDENT NAD(+) SYNTHETASE,True
B5E5S7,NH(3)-dependent NAD(+) synthetase,protein,512566,Streptococcus pneumoniae serotype 19F (strain G54),Streptococcus pneumoniae serotype 19F (strain G54),nadE,274,PTHR23090:SF7,NH(3)-DEPENDENT NAD(+) SYNTHETASE,True
B5ETZ2,NH(3)-dependent NAD(+) synthetase,protein,388396,Aliivibrio fischeri (strain MJ11),Aliivibrio fischeri (strain MJ11),nadE,276,PTHR23090:SF7,NH(3)-DEPENDENT NAD(+) SYNTHETASE,True
B5F7I4,NH(3)-dependent NAD(+) synthetase,protein,454166,Salmonella agona (strain SL483),Salmonella agona (strain SL483),nadE,275,PTHR23090:SF7,NH(3)-DEPENDENT NAD(+) SYNTHETASE,True
B5FJD0,NH(3)-dependent NAD(+) synthetase,protein,439851,Salmonella dublin (strain CT_02021853),Salmonella dublin (strain CT_02021853),nadE,275,PTHR23090:SF7,NH(3)-DEPENDENT NAD(+) SYNTHETASE,True
B5QWI3,NH(3)-dependent NAD(+) synthetase,protein,550537,Salmonella enteritidis PT4 (strain P125109),Salmonella enteritidis PT4 (strain P125109),nadE,275,PTHR23090:SF7,NH(3)-DEPENDENT NAD(+) SYNTHETASE,True
B5RAZ4,NH(3)-dependent NAD(+) synthetase,protein,550538,Salmonella gallinarum (strain 287/91 / NCTC 13346),Salmonella gallinarum (strain 287/91 / NCTC 13346),nadE,275,PTHR23090:SF7,NH(3)-DEPENDENT NAD(+) SYNTHETASE,True
B5Y8Q4,NH(3)-dependent NAD(+) synthetase,protein,309798,Coprothermobacter proteolyticus (strain ATCC 35245 / DSM 5265 / OCM 4 / BT),Coprothermobacter proteolyticus (strain ATCC 35245 / DSM 5265 / OCM 4 / BT),nadE,296,PTHR23090:SF9,GLUTAMINE-DEPENDENT NAD(+) SYNTHETASE,True
B5YQ27,NH(3)-dependent NAD(+) synthetase,protein,444450,Escherichia coli O157:H7 (strain EC4115 / EHEC),Escherichia coli O157:H7 (strain EC4115 / EHEC),nadE,275,PTHR23090:SF7,NH(3)-DEPENDENT NAD(+) SYNTHETASE,True
B5ZA97,NH(3)-dependent NAD(+) synthetase,protein,563041,Helicobacter pylori (strain G27),Helicobacter pylori (strain G27),nadE,260,PTHR23090:SF9,GLUTAMINE-DEPENDENT NAD(+) SYNTHETASE,True
B6ERM8,NH(3)-dependent NAD(+) synthetase,protein,316275,Aliivibrio salmonicida (strain LFI1238),Aliivibrio salmonicida (strain LFI1238),nadE,276,PTHR23090:SF7,NH(3)-DEPENDENT NAD(+) SYNTHETASE,True
B6IBG0,NH(3)-dependent NAD(+) synthetase,protein,409438,Escherichia coli (strain SE11),Escherichia coli (strain SE11),nadE,275,PTHR23090:SF7,NH(3)-DEPENDENT NAD(+) SYNTHETASE,True
B6JKQ6,NH(3)-dependent NAD(+) synthetase,protein,570508,Helicobacter pylori (strain P12),Helicobacter pylori (strain P12),nadE,260,PTHR23090:SF9,GLUTAMINE-DEPENDENT NAD(+) SYNTHETASE,True
B7HJC1,NH(3)-dependent NAD(+) synthetase,protein,405532,Bacillus cereus (strain B4264),Bacillus cereus (strain B4264),nadE,272,PTHR23090:SF7,NH(3)-DEPENDENT NAD(+) SYNTHETASE,True
B7HND7,NH(3)-dependent NAD(+) synthetase,protein,405534,Bacillus cereus (strain AH187),Bacillus cereus (strain AH187),nadE,272,PTHR23090:SF7,NH(3)-DEPENDENT NAD(+) SYNTHETASE,True
B7ITB1,NH(3)-dependent NAD(+) synthetase,protein,405531,Bacillus cereus (strain G9842),Bacillus cereus (strain G9842),nadE,272,PTHR23090:SF7,NH(3)-DEPENDENT NAD(+) SYNTHETASE,True
B7JKI8,NH(3)-dependent NAD(+) synthetase,protein,405535,Bacillus cereus (strain AH820),Bacillus cereus (strain AH820),nadE,272,PTHR23090:SF7,NH(3)-DEPENDENT NAD(+) SYNTHETASE,True
B7L6L4,NH(3)-dependent NAD(+) synthetase,protein,585055,Escherichia coli (strain 55989 / EAEC),Escherichia coli (strain 55989 / EAEC),nadE,275,PTHR23090:SF7,NH(3)-DEPENDENT NAD(+) SYNTHETASE,True
B7LQ52,NH(3)-dependent NAD(+) synthetase,protein,585054,Escherichia fergusonii (strain ATCC 35469 / DSM 13698 / CCUG 18766 / IAM 14443 / JCM 21226 / LMG 7866 / NBRC 102419 / NCTC 12128 / CDC 0568-73),Escherichia fergusonii (strain ATCC 35469 / DSM 13698 / CCUG 18766 / IAM 14443 / JCM 21226 / LMG 7866 / NBRC 102419 / NCTC 12128 / CDC 0568-73),nadE,275,PTHR23090:SF7,NH(3)-DEPENDENT NAD(+) SYNTHETASE,True
B7M1F2,NH(3)-dependent NAD(+) synthetase,protein,585034,Escherichia coli O8 (strain IAI1),Escherichia coli O8 (strain IAI1),nadE,275,PTHR23090:SF7,NH(3)-DEPENDENT NAD(+) SYNTHETASE,True
B7MAV1,NH(3)-dependent NAD(+) synthetase,protein,585035,Escherichia coli O45:K1 (strain S88 / ExPEC),Escherichia coli O45:K1 (strain S88 / ExPEC),nadE,275,PTHR23090:SF7,NH(3)-DEPENDENT NAD(+) SYNTHETASE,True
B7MVL9,NH(3)-dependent NAD(+) synthetase,protein,585397,Escherichia coli O81 (strain ED1a),Escherichia coli O81 (strain ED1a),nadE,275,PTHR23090:SF7,NH(3)-DEPENDENT NAD(+) SYNTHETASE,True
