id,name,entry_type,source_tax_id,source_tax_name,full_tax_name,gene,length,subfamily,subfamily_name,in_alphafold
A1CNW8,Protein ssh4,protein,344612,Aspergillus clavatus (strain ATCC 1007 / CBS 513.65 / DSM 816 / NCTC 3887 / NRRL 1 / QM 1276 / 107),Aspergillus clavatus (strain ATCC 1007 / CBS 513.65 / DSM 816 / NCTC 3887 / NRRL 1 / QM 1276 / 107),ssh4,511,,,True
A1D1S7,Protein ssh4,protein,331117,Neosartorya fischeri (strain ATCC 1020 / DSM 3700 / CBS 544.65 / FGSC A1164 / JCM 1740 / NRRL 181 / WB 181),Neosartorya fischeri (strain ATCC 1020 / DSM 3700 / CBS 544.65 / FGSC A1164 / JCM 1740 / NRRL 181 / WB 181),ssh4,507,,,True
A1L252,Ran-binding protein 9,protein,7955,Danio rerio,Danio rerio (Zebrafish),ranbp9,597,,,True
A3KMV8,Ran-binding protein 10,protein,9913,Bos taurus,Bos taurus (Bovine),RANBP10,620,,,True
A6S3E0,Protein ssh4,protein,332648,Botryotinia fuckeliana (strain B05.10),Botryotinia fuckeliana (strain B05.10) (Noble rot fungus),ssh4,537,,,True
A6ZZJ6,Protein SSH4,protein,307796,Saccharomyces cerevisiae (strain YJM789),Saccharomyces cerevisiae (strain YJM789) (Baker's yeast),SSH4,579,,,True
A7EQ00,Protein ssh4,protein,665079,Sclerotinia sclerotiorum (strain ATCC 18683 / 1980 / Ss-1),Sclerotinia sclerotiorum (strain ATCC 18683 / 1980 / Ss-1) (White mold),ssh4,523,,,True
A7SWD3,Glucose-induced degradation protein 8 homolog,protein,45351,Nematostella vectensis,Nematostella vectensis (Starlet sea anemone),v1g247787,225,,,True
A7TE03,Protein SSH4,protein,436907,Vanderwaltozyma polyspora (strain ATCC 22028 / DSM 70294 / BCRC 21397 / CBS 2163 / NBRC 10782 / NRRL Y-8283 / UCD 57-17),Vanderwaltozyma polyspora (strain ATCC 22028 / DSM 70294 / BCRC 21397 / CBS 2163 / NBRC 10782 / NRRL Y-8283 / UCD 57-17),SSH4,556,,,True
E7FGY2,Glucose-induced degradation protein 8-B homolog,protein,7955,Danio rerio,Danio rerio (Zebrafish),gid8b,229,,,True
F4HYD7,Ran-binding protein M homolog,protein,3702,Arabidopsis thaliana,Arabidopsis thaliana (Mouse-ear cress),RANBPM,467,,,True
O74497,SPRY domain-containing protein C285.10c,protein,284812,Schizosaccharomyces pombe (strain 972 / ATCC 24843),Schizosaccharomyces pombe (strain 972 / ATCC 24843) (Fission yeast),SPCC285.10c,382,,,True
O94712,GID complex subunit 1,protein,284812,Schizosaccharomyces pombe (strain 972 / ATCC 24843),Schizosaccharomyces pombe (strain 972 / ATCC 24843) (Fission yeast),gid1,483,,,True
P32343,Protein SSH4,protein,559292,Saccharomyces cerevisiae (strain ATCC 204508 / S288c),Saccharomyces cerevisiae (strain ATCC 204508 / S288c) (Baker's yeast),SSH4,579,,,True
P40208,GID complex subunit 8,protein,559292,Saccharomyces cerevisiae (strain ATCC 204508 / S288c),Saccharomyces cerevisiae (strain ATCC 204508 / S288c) (Baker's yeast),GID8,455,,,True
P53076,GID complex subunit 1,protein,559292,Saccharomyces cerevisiae (strain ATCC 204508 / S288c),Saccharomyces cerevisiae (strain ATCC 204508 / S288c) (Baker's yeast),VID30,958,,,True
P69566,Ran-binding protein 9,protein,10090,Mus musculus,Mus musculus (Mouse),Ranbp9,653,,,True
Q03212,Protein EAR1,protein,559292,Saccharomyces cerevisiae (strain ATCC 204508 / S288c),Saccharomyces cerevisiae (strain ATCC 204508 / S288c) (Baker's yeast),EAR1,550,,,True
Q10446,GID complex subunit 8,protein,284812,Schizosaccharomyces pombe (strain 972 / ATCC 24843),Schizosaccharomyces pombe (strain 972 / ATCC 24843) (Fission yeast),gid8,240,,,True
Q1E2D2,Protein SSH4,protein,246410,Coccidioides immitis (strain RS),Coccidioides immitis (strain RS) (Valley fever fungus),SSH4,494,,,True
Q1LUS8,Ran-binding protein 10,protein,7955,Danio rerio,Danio rerio (Zebrafish),ranbp10,604,,,True
Q28FM1,Ran-binding protein 9,protein,8364,Xenopus tropicalis,Xenopus tropicalis (Western clawed frog),ranbp9,548,,,True
Q32L52,Glucose-induced degradation protein 8 homolog,protein,9913,Bos taurus,Bos taurus (Bovine),GID8,228,,,True
Q4WRW0,Protein ssh4,protein,330879,Aspergillus fumigatus (strain ATCC MYA-4609 / CBS 101355 / FGSC A1100 / Af293),Aspergillus fumigatus (strain ATCC MYA-4609 / CBS 101355 / FGSC A1100 / Af293),ssh4,507,,,True
Q4Z8K6,Ran-binding proteins 9/10 homolog,protein,7227,Drosophila melanogaster,Drosophila melanogaster (Fruit fly),RanBPM,962,,,True
Q54X16,Glucose-induced degradation protein 8 homolog,protein,44689,Dictyostelium discoideum,Dictyostelium discoideum (Social amoeba),DDB_G0279265,228,,,True
Q5RBR6,SPRY domain-containing protein 3,protein,9601,Pongo abelii,Pongo abelii (Sumatran orangutan),SPRYD3,442,,,True
Q5ZKQ7,Glucose-induced degradation protein 8 homolog,protein,9031,Gallus gallus,Gallus gallus (Chicken),GID8,228,,,True
Q6CVE0,Protein SSH4,protein,284590,Kluyveromyces lactis (strain ATCC 8585 / CBS 2359 / DSM 70799 / NBRC 1267 / NRRL Y-1140 / WM37),Kluyveromyces lactis (strain ATCC 8585 / CBS 2359 / DSM 70799 / NBRC 1267 / NRRL Y-1140 / WM37) (Yeast),SSH4,542,,,True
Q6FJG2,Protein SSH4,protein,284593,Candida glabrata (strain ATCC 2001 / BCRC 20586 / JCM 3761 / NBRC 0622 / NRRL Y-65 / CBS 138),Candida glabrata (strain ATCC 2001 / BCRC 20586 / JCM 3761 / NBRC 0622 / NRRL Y-65 / CBS 138) (Yeast),SSH4,587,,,True
Q6PC55,Glucose-induced degradation protein 8-A homolog,protein,7955,Danio rerio,Danio rerio (Zebrafish),gid8a,228,,,True
Q6VN19,Ran-binding protein 10,protein,10090,Mus musculus,Mus musculus (Mouse),Ranbp10,620,,,True
Q6VN20,Ran-binding protein 10,protein,9606,Homo sapiens,Homo sapiens (Human),RANBP10,620,,,True
Q84WK5,Protein GID8 homolog,protein,3702,Arabidopsis thaliana,Arabidopsis thaliana (Mouse-ear cress),GID8,243,,,True
Q8NCJ5,SPRY domain-containing protein 3,protein,9606,Homo sapiens,Homo sapiens (Human),SPRYD3,442,,,True
Q96S59,Ran-binding protein 9,protein,9606,Homo sapiens,Homo sapiens (Human),RANBP9,729,,,True
Q96UB6,Protein ssh4,protein,367110,Neurospora crassa (strain ATCC 24698 / 74-OR23-1A / CBS 708.71 / DSM 1257 / FGSC 987),Neurospora crassa (strain ATCC 24698 / 74-OR23-1A / CBS 708.71 / DSM 1257 / FGSC 987),ssh4,503,,,True
Q9D7M1,Glucose-induced degradation protein 8 homolog,protein,10090,Mus musculus,Mus musculus (Mouse),Gid8,228,,,True
Q9NWU2,Glucose-induced degradation protein 8 homolog,protein,9606,Homo sapiens,Homo sapiens (Human),GID8,228,,,True
Q9PTY5,Ran-binding protein 9,protein,8355,Xenopus laevis,Xenopus laevis (African clawed frog),ranbp9,548,,,True
