id,name,entry_type,source_tax_id,source_tax_name,full_tax_name,gene,length,subfamily,subfamily_name,in_alphafold
P38298,Alkaline ceramidase YPC1,protein,559292,Saccharomyces cerevisiae (strain ATCC 204508 / S288c),Saccharomyces cerevisiae (strain ATCC 204508 / S288c) (Baker's yeast),YPC1,316,PTHR46187:SF3,ALKALINE CERAMIDASE 3,True
Q02896,Alkaline ceramidase YDC1,protein,559292,Saccharomyces cerevisiae (strain ATCC 204508 / S288c),Saccharomyces cerevisiae (strain ATCC 204508 / S288c) (Baker's yeast),YDC1,317,PTHR46187:SF3,ALKALINE CERAMIDASE 3,True
Q55DQ0,Putative alkaline ceramidase dcd3B,protein,44689,Dictyostelium discoideum,Dictyostelium discoideum (Social amoeba),dcd3B,285,PTHR46187:SF2,ALKALINE CERAMIDASE DCD3B-RELATED,True
Q6TMJ1,Putative alkaline ceramidase dcd3A,protein,44689,Dictyostelium discoideum,Dictyostelium discoideum (Social amoeba),dcd3A,288,PTHR46187:SF3,ALKALINE CERAMIDASE 3,True
Q9D099,Alkaline ceramidase 3,protein,10090,Mus musculus,Mus musculus (Mouse),Acer3,267,PTHR46187:SF3,ALKALINE CERAMIDASE 3,True
Q9NUN7,Alkaline ceramidase 3,protein,9606,Homo sapiens,Homo sapiens (Human),ACER3,267,PTHR46187:SF3,ALKALINE CERAMIDASE 3,True
