id,name,entry_type,source_tax_id,source_tax_name,full_tax_name,gene,length,subfamily,subfamily_name,in_alphafold
A0KRH2,Phosphoenolpyruvate carboxykinase (ATP),protein,94122,Shewanella sp. (strain ANA-3),Shewanella sp. (strain ANA-3),pckA,513,PTHR30031:SF0,PHOSPHOENOLPYRUVATE CARBOXYKINASE (ATP),True
A0LXJ9,Phosphoenolpyruvate carboxykinase (ATP),protein,411154,Christiangramia forsetii (strain DSM 17595 / CGMCC 1.15422 / KT0803),Christiangramia forsetii (strain DSM 17595 / CGMCC 1.15422 / KT0803),pckA,532,PTHR30031:SF0,PHOSPHOENOLPYRUVATE CARBOXYKINASE (ATP),True
A0RJZ8,Phosphoenolpyruvate carboxykinase (ATP),protein,412694,Bacillus thuringiensis (strain Al Hakam),Bacillus thuringiensis (strain Al Hakam),pckA,528,PTHR30031:SF0,PHOSPHOENOLPYRUVATE CARBOXYKINASE (ATP),True
A1AGS9,Phosphoenolpyruvate carboxykinase (ATP),protein,405955,Escherichia coli O1:K1 / APEC,Escherichia coli O1:K1 / APEC,pckA,540,PTHR30031:SF0,PHOSPHOENOLPYRUVATE CARBOXYKINASE (ATP),True
A1AV24,Phosphoenolpyruvate carboxykinase (ATP),protein,338966,Pelobacter propionicus (strain DSM 2379 / NBRC 103807 / OttBd1),Pelobacter propionicus (strain DSM 2379 / NBRC 103807 / OttBd1),pckA,530,PTHR30031:SF0,PHOSPHOENOLPYRUVATE CARBOXYKINASE (ATP),True
A1B5Z2,Phosphoenolpyruvate carboxykinase (ATP),protein,318586,Paracoccus denitrificans (strain Pd 1222),Paracoccus denitrificans (strain Pd 1222),pckA,532,PTHR30031:SF0,PHOSPHOENOLPYRUVATE CARBOXYKINASE (ATP),True
A1JSE7,Phosphoenolpyruvate carboxykinase (ATP),protein,393305,Yersinia enterocolitica serotype O:8 / biotype 1B (strain NCTC 13174 / 8081),Yersinia enterocolitica serotype O:8 / biotype 1B (strain NCTC 13174 / 8081),pckA,539,PTHR30031:SF0,PHOSPHOENOLPYRUVATE CARBOXYKINASE (ATP),True
A1RPC2,Phosphoenolpyruvate carboxykinase (ATP),protein,351745,Shewanella sp. (strain W3-18-1),Shewanella sp. (strain W3-18-1),pckA,513,PTHR30031:SF0,PHOSPHOENOLPYRUVATE CARBOXYKINASE (ATP),True
A1S1X0,Phosphoenolpyruvate carboxykinase (ATP),protein,326297,Shewanella amazonensis (strain ATCC BAA-1098 / SB2B),Shewanella amazonensis (strain ATCC BAA-1098 / SB2B),pckA,513,PTHR30031:SF0,PHOSPHOENOLPYRUVATE CARBOXYKINASE (ATP),True
A1U754,Phosphoenolpyruvate carboxykinase (ATP),protein,351348,Marinobacter nauticus (strain ATCC 700491 / DSM 11845 / VT8),Marinobacter nauticus (strain ATCC 700491 / DSM 11845 / VT8),pckA,511,PTHR30031:SF0,PHOSPHOENOLPYRUVATE CARBOXYKINASE (ATP),True
A1VZR5,Phosphoenolpyruvate carboxykinase (ATP),protein,354242,Campylobacter jejuni subsp. jejuni serotype O:23/36 (strain 81-176),Campylobacter jejuni subsp. jejuni serotype O:23/36 (strain 81-176),pckA,524,PTHR30031:SF0,PHOSPHOENOLPYRUVATE CARBOXYKINASE (ATP),True
A3DAB2,Phosphoenolpyruvate carboxykinase (ATP),protein,325240,Shewanella baltica (strain OS155 / ATCC BAA-1091),Shewanella baltica (strain OS155 / ATCC BAA-1091),pckA,513,PTHR30031:SF0,PHOSPHOENOLPYRUVATE CARBOXYKINASE (ATP),True
A3N0G0,Phosphoenolpyruvate carboxykinase (ATP),protein,416269,Actinobacillus pleuropneumoniae serotype 5b (strain L20),Actinobacillus pleuropneumoniae serotype 5b (strain L20),pckA,536,PTHR30031:SF0,PHOSPHOENOLPYRUVATE CARBOXYKINASE (ATP),True
A3PGG3,Phosphoenolpyruvate carboxykinase (ATP),protein,349101,Cereibacter sphaeroides (strain ATCC 17029 / ATH 2.4.9),Cereibacter sphaeroides (strain ATCC 17029 / ATH 2.4.9),pckA,532,PTHR30031:SF0,PHOSPHOENOLPYRUVATE CARBOXYKINASE (ATP),True
A3QJ41,Phosphoenolpyruvate carboxykinase (ATP),protein,323850,Shewanella loihica (strain ATCC BAA-1088 / PV-4),Shewanella loihica (strain ATCC BAA-1088 / PV-4),pckA,513,PTHR30031:SF0,PHOSPHOENOLPYRUVATE CARBOXYKINASE (ATP),True
A4IRZ2,Phosphoenolpyruvate carboxykinase (ATP),protein,420246,Geobacillus thermodenitrificans (strain NG80-2),Geobacillus thermodenitrificans (strain NG80-2),pckA,528,PTHR30031:SF0,PHOSPHOENOLPYRUVATE CARBOXYKINASE (ATP),True
A4TGS8,Phosphoenolpyruvate carboxykinase (ATP),protein,386656,Yersinia pestis (strain Pestoides F),Yersinia pestis (strain Pestoides F),pckA,539,PTHR30031:SF0,PHOSPHOENOLPYRUVATE CARBOXYKINASE (ATP),True
A4WFJ1,Phosphoenolpyruvate carboxykinase (ATP),protein,399742,Enterobacter sp. (strain 638),Enterobacter sp. (strain 638),pckA,538,PTHR30031:SF0,PHOSPHOENOLPYRUVATE CARBOXYKINASE (ATP),True
A4WVP0,Phosphoenolpyruvate carboxykinase (ATP),protein,349102,Cereibacter sphaeroides (strain ATCC 17025 / ATH 2.4.3),Cereibacter sphaeroides (strain ATCC 17025 / ATH 2.4.3),pckA,532,PTHR30031:SF0,PHOSPHOENOLPYRUVATE CARBOXYKINASE (ATP),True
A4XP75,Phosphoenolpyruvate carboxykinase (ATP),protein,399739,Ectopseudomonas mendocina (strain ymp),Ectopseudomonas mendocina (strain ymp),pckA,513,PTHR30031:SF0,PHOSPHOENOLPYRUVATE CARBOXYKINASE (ATP),True
A4YBE7,Phosphoenolpyruvate carboxykinase (ATP),protein,319224,Shewanella putrefaciens (strain CN-32 / ATCC BAA-453),Shewanella putrefaciens (strain CN-32 / ATCC BAA-453),pckA,513,PTHR30031:SF0,PHOSPHOENOLPYRUVATE CARBOXYKINASE (ATP),True
A4YL90,Phosphoenolpyruvate carboxykinase (ATP),protein,114615,Bradyrhizobium sp. (strain ORS 278),Bradyrhizobium sp. (strain ORS 278),pckA,537,PTHR30031:SF0,PHOSPHOENOLPYRUVATE CARBOXYKINASE (ATP),True
A5EST5,Phosphoenolpyruvate carboxykinase (ATP),protein,288000,Bradyrhizobium sp. (strain BTAi1 / ATCC BAA-1182),Bradyrhizobium sp. (strain BTAi1 / ATCC BAA-1182),pckA,537,PTHR30031:SF0,PHOSPHOENOLPYRUVATE CARBOXYKINASE (ATP),True
A5F4Q4,Phosphoenolpyruvate carboxykinase (ATP),protein,345073,Vibrio cholerae serotype O1 (strain ATCC 39541 / Classical Ogawa 395 / O395),Vibrio cholerae serotype O1 (strain ATCC 39541 / Classical Ogawa 395 / O395),pckA,542,PTHR30031:SF0,PHOSPHOENOLPYRUVATE CARBOXYKINASE (ATP),True
A5FK68,Phosphoenolpyruvate carboxykinase (ATP),protein,376686,Flavobacterium johnsoniae (strain ATCC 17061 / DSM 2064 / JCM 8514 / BCRC 14874 / CCUG 350202 / NBRC 14942 / NCIMB 11054 / UW101),Flavobacterium johnsoniae (strain ATCC 17061 / DSM 2064 / JCM 8514 / BCRC 14874 / CCUG 350202 / NBRC 14942 / NCIMB 11054 / UW101),pckA,534,PTHR30031:SF0,PHOSPHOENOLPYRUVATE CARBOXYKINASE (ATP),True
A5GBF9,Phosphoenolpyruvate carboxykinase (ATP),protein,351605,Geotalea uraniireducens (strain Rf4),Geotalea uraniireducens (strain Rf4),pckA,530,PTHR30031:SF0,PHOSPHOENOLPYRUVATE CARBOXYKINASE (ATP),True
A5ITV7,Phosphoenolpyruvate carboxykinase (ATP),protein,359786,Staphylococcus aureus (strain JH9),Staphylococcus aureus (strain JH9),pckA,530,PTHR30031:SF0,PHOSPHOENOLPYRUVATE CARBOXYKINASE (ATP),True
A5UDR5,Phosphoenolpyruvate carboxykinase (ATP),protein,374930,Haemophilus influenzae (strain PittEE),Haemophilus influenzae (strain PittEE),pckA,538,PTHR30031:SF0,PHOSPHOENOLPYRUVATE CARBOXYKINASE (ATP),True
A5UHW1,Phosphoenolpyruvate carboxykinase (ATP),protein,374931,Haemophilus influenzae (strain PittGG),Haemophilus influenzae (strain PittGG),pckA,538,PTHR30031:SF0,PHOSPHOENOLPYRUVATE CARBOXYKINASE (ATP),True
A5VX32,Phosphoenolpyruvate carboxykinase (ATP),protein,351746,Pseudomonas putida (strain ATCC 700007 / DSM 6899 / JCM 31910 / BCRC 17059 / LMG 24140 / F1),Pseudomonas putida (strain ATCC 700007 / DSM 6899 / JCM 31910 / BCRC 17059 / LMG 24140 / F1),pckA,513,PTHR30031:SF0,PHOSPHOENOLPYRUVATE CARBOXYKINASE (ATP),True
A6LFQ4,Phosphoenolpyruvate carboxykinase (ATP),protein,435591,Parabacteroides distasonis (strain ATCC 8503 / DSM 20701 / CIP 104284 / JCM 5825 / NCTC 11152),Parabacteroides distasonis (strain ATCC 8503 / DSM 20701 / CIP 104284 / JCM 5825 / NCTC 11152),pckA,535,PTHR30031:SF0,PHOSPHOENOLPYRUVATE CARBOXYKINASE (ATP),True
A6Q102,Phosphoenolpyruvate carboxykinase (ATP),protein,387092,Nitratiruptor sp. (strain SB155-2),Nitratiruptor sp. (strain SB155-2),pckA,525,PTHR30031:SF0,PHOSPHOENOLPYRUVATE CARBOXYKINASE (ATP),True
A6QHX1,Phosphoenolpyruvate carboxykinase (ATP),protein,426430,Staphylococcus aureus (strain Newman),Staphylococcus aureus (strain Newman),pckA,530,PTHR30031:SF0,PHOSPHOENOLPYRUVATE CARBOXYKINASE (ATP),True
A6U2Q2,Phosphoenolpyruvate carboxykinase (ATP),protein,359787,Staphylococcus aureus (strain JH1),Staphylococcus aureus (strain JH1),pckA,530,PTHR30031:SF0,PHOSPHOENOLPYRUVATE CARBOXYKINASE (ATP),True
A6UEJ7,Phosphoenolpyruvate carboxykinase (ATP),protein,366394,Sinorhizobium medicae (strain WSM419),Sinorhizobium medicae (strain WSM419),pckA,536,PTHR30031:SF0,PHOSPHOENOLPYRUVATE CARBOXYKINASE (ATP),True
A6VDW7,Phosphoenolpyruvate carboxykinase (ATP),protein,381754,Pseudomonas paraeruginosa (strain DSM 24068 / PA7),Pseudomonas paraeruginosa (strain DSM 24068 / PA7),pckA,513,PTHR30031:SF0,PHOSPHOENOLPYRUVATE CARBOXYKINASE (ATP),True
A6VKV4,Phosphoenolpyruvate carboxykinase (ATP),protein,339671,Actinobacillus succinogenes (strain ATCC 55618 / DSM 22257 / CCUG 43843 / 130Z),Actinobacillus succinogenes (strain ATCC 55618 / DSM 22257 / CCUG 43843 / 130Z),pckA,538,PTHR30031:SF0,PHOSPHOENOLPYRUVATE CARBOXYKINASE (ATP),True
A6WHM7,Phosphoenolpyruvate carboxykinase (ATP),protein,402882,Shewanella baltica (strain OS185),Shewanella baltica (strain OS185),pckA,513,PTHR30031:SF0,PHOSPHOENOLPYRUVATE CARBOXYKINASE (ATP),True
A6WX47,Phosphoenolpyruvate carboxykinase (ATP),protein,439375,Brucella anthropi (strain ATCC 49188 / DSM 6882 / CCUG 24695 / JCM 21032 / LMG 3331 / NBRC 15819 / NCTC 12168 / Alc 37),Brucella anthropi (strain ATCC 49188 / DSM 6882 / CCUG 24695 / JCM 21032 / LMG 3331 / NBRC 15819 / NCTC 12168 / Alc 37),pckA,536,PTHR30031:SF0,PHOSPHOENOLPYRUVATE CARBOXYKINASE (ATP),True
A7FNU8,Phosphoenolpyruvate carboxykinase (ATP),protein,349747,Yersinia pseudotuberculosis serotype O:1b (strain IP 31758),Yersinia pseudotuberculosis serotype O:1b (strain IP 31758),pckA,539,PTHR30031:SF0,PHOSPHOENOLPYRUVATE CARBOXYKINASE (ATP),True
A7GU41,Phosphoenolpyruvate carboxykinase (ATP),protein,315749,Bacillus cytotoxicus (strain DSM 22905 / CIP 110041 / 391-98 / NVH 391-98),Bacillus cytotoxicus (strain DSM 22905 / CIP 110041 / 391-98 / NVH 391-98),pckA,528,PTHR30031:SF0,PHOSPHOENOLPYRUVATE CARBOXYKINASE (ATP),True
A7H3B9,Phosphoenolpyruvate carboxykinase (ATP),protein,360109,Campylobacter jejuni subsp. doylei (strain ATCC BAA-1458 / RM4099 / 269.97),Campylobacter jejuni subsp. doylei (strain ATCC BAA-1458 / RM4099 / 269.97),pckA,524,PTHR30031:SF0,PHOSPHOENOLPYRUVATE CARBOXYKINASE (ATP),True
A7HP99,Phosphoenolpyruvate carboxykinase (ATP),protein,402881,Parvibaculum lavamentivorans (strain DS-1 / DSM 13023 / NCIMB 13966),Parvibaculum lavamentivorans (strain DS-1 / DSM 13023 / NCIMB 13966),pckA,537,PTHR30031:SF0,PHOSPHOENOLPYRUVATE CARBOXYKINASE (ATP),True
A7MGC5,Phosphoenolpyruvate carboxykinase (ATP),protein,290339,Cronobacter sakazakii (strain ATCC BAA-894),Cronobacter sakazakii (strain ATCC BAA-894),pckA,539,PTHR30031:SF0,PHOSPHOENOLPYRUVATE CARBOXYKINASE (ATP),True
A7MZB2,Phosphoenolpyruvate carboxykinase (ATP),protein,2902295,Vibrio campbellii (strain ATCC BAA-1116),Vibrio campbellii (strain ATCC BAA-1116),pckA,542,PTHR30031:SF0,PHOSPHOENOLPYRUVATE CARBOXYKINASE (ATP),True
A7X3N3,Phosphoenolpyruvate carboxykinase (ATP),protein,418127,Staphylococcus aureus (strain Mu3 / ATCC 700698),Staphylococcus aureus (strain Mu3 / ATCC 700698),pckA,530,PTHR30031:SF0,PHOSPHOENOLPYRUVATE CARBOXYKINASE (ATP),True
A7Z7Z0,Phosphoenolpyruvate carboxykinase (ATP),protein,326423,Bacillus velezensis (strain DSM 23117 / BGSC 10A6 / LMG 26770 / FZB42),Bacillus velezensis (strain DSM 23117 / BGSC 10A6 / LMG 26770 / FZB42),pckA,527,PTHR30031:SF0,PHOSPHOENOLPYRUVATE CARBOXYKINASE (ATP),True
A7ZST1,Phosphoenolpyruvate carboxykinase (ATP),protein,331111,Escherichia coli O139:H28 (strain E24377A / ETEC),Escherichia coli O139:H28 (strain E24377A / ETEC),pckA,540,PTHR30031:SF0,PHOSPHOENOLPYRUVATE CARBOXYKINASE (ATP),True
A8A5L1,Phosphoenolpyruvate carboxykinase (ATP),protein,331112,Escherichia coli O9:H4 (strain HS),Escherichia coli O9:H4 (strain HS),pckA,540,PTHR30031:SF0,PHOSPHOENOLPYRUVATE CARBOXYKINASE (ATP),True
A8AQV7,Phosphoenolpyruvate carboxykinase (ATP),protein,290338,Citrobacter koseri (strain ATCC BAA-895 / CDC 4225-83 / SGSC4696),Citrobacter koseri (strain ATCC BAA-895 / CDC 4225-83 / SGSC4696),pckA,539,PTHR30031:SF0,PHOSPHOENOLPYRUVATE CARBOXYKINASE (ATP),True
A8FGH8,Phosphoenolpyruvate carboxykinase (ATP),protein,315750,Bacillus pumilus (strain SAFR-032),Bacillus pumilus (strain SAFR-032),pckA,528,PTHR30031:SF0,PHOSPHOENOLPYRUVATE CARBOXYKINASE (ATP),True
A8FLY1,Phosphoenolpyruvate carboxykinase (ATP),protein,407148,Campylobacter jejuni subsp. jejuni serotype O:6 (strain 81116 / NCTC 11828),Campylobacter jejuni subsp. jejuni serotype O:6 (strain 81116 / NCTC 11828),pckA,524,PTHR30031:SF0,PHOSPHOENOLPYRUVATE CARBOXYKINASE (ATP),True
A8G1J1,Phosphoenolpyruvate carboxykinase (ATP),protein,425104,Shewanella sediminis (strain HAW-EB3),Shewanella sediminis (strain HAW-EB3),pckA,513,PTHR30031:SF0,PHOSPHOENOLPYRUVATE CARBOXYKINASE (ATP),True
A8GYT2,Phosphoenolpyruvate carboxykinase (ATP),protein,398579,Shewanella pealeana (strain ATCC 700345 / ANG-SQ1),Shewanella pealeana (strain ATCC 700345 / ANG-SQ1),pckA,513,PTHR30031:SF0,PHOSPHOENOLPYRUVATE CARBOXYKINASE (ATP),True
A8ILP8,Phosphoenolpyruvate carboxykinase (ATP),protein,438753,Azorhizobium caulinodans (strain ATCC 43989 / DSM 5975 / JCM 20966 / LMG 6465 / NBRC 14845 / NCIMB 13405 / ORS 571),Azorhizobium caulinodans (strain ATCC 43989 / DSM 5975 / JCM 20966 / LMG 6465 / NBRC 14845 / NCIMB 13405 / ORS 571),pckA,537,PTHR30031:SF0,PHOSPHOENOLPYRUVATE CARBOXYKINASE (ATP),True
A8LLF2,Phosphoenolpyruvate carboxykinase (ATP),protein,398580,Dinoroseobacter shibae (strain DSM 16493 / NCIMB 14021 / DFL 12),Dinoroseobacter shibae (strain DSM 16493 / NCIMB 14021 / DFL 12),pckA,532,PTHR30031:SF0,PHOSPHOENOLPYRUVATE CARBOXYKINASE (ATP),True
A8MEV2,Phosphoenolpyruvate carboxykinase (ATP),protein,350688,Alkaliphilus oremlandii (strain OhILAs),Alkaliphilus oremlandii (strain OhILAs),pckA,526,PTHR30031:SF0,PHOSPHOENOLPYRUVATE CARBOXYKINASE (ATP),True
A8Z4L3,Phosphoenolpyruvate carboxykinase (ATP),protein,451516,Staphylococcus aureus (strain USA300 / TCH1516),Staphylococcus aureus (strain USA300 / TCH1516),pckA,530,PTHR30031:SF0,PHOSPHOENOLPYRUVATE CARBOXYKINASE (ATP),True
A9KDE5,Phosphoenolpyruvate carboxykinase (ATP),protein,434922,Coxiella burnetii (strain Dugway 5J108-111),Coxiella burnetii (strain Dugway 5J108-111),pckA,517,PTHR30031:SF0,PHOSPHOENOLPYRUVATE CARBOXYKINASE (ATP),True
A9KVC7,Phosphoenolpyruvate carboxykinase (ATP),protein,399599,Shewanella baltica (strain OS195),Shewanella baltica (strain OS195),pckA,513,PTHR30031:SF0,PHOSPHOENOLPYRUVATE CARBOXYKINASE (ATP),True
A9M9S3,Phosphoenolpyruvate carboxykinase (ATP),protein,483179,Brucella canis (strain ATCC 23365 / NCTC 10854 / RM-666),Brucella canis (strain ATCC 23365 / NCTC 10854 / RM-666),pckA,536,PTHR30031:SF0,PHOSPHOENOLPYRUVATE CARBOXYKINASE (ATP),True
A9MMC5,Phosphoenolpyruvate carboxykinase (ATP),protein,41514,Salmonella arizonae (strain ATCC BAA-731 / CDC346-86 / RSK2980),Salmonella arizonae (strain ATCC BAA-731 / CDC346-86 / RSK2980),pckA,539,PTHR30031:SF0,PHOSPHOENOLPYRUVATE CARBOXYKINASE (ATP),True
A9MT72,Phosphoenolpyruvate carboxykinase (ATP),protein,1016998,Salmonella paratyphi B (strain ATCC BAA-1250 / SPB7),Salmonella paratyphi B (strain ATCC BAA-1250 / SPB7),pckA,539,PTHR30031:SF0,PHOSPHOENOLPYRUVATE CARBOXYKINASE (ATP),True
A9NBT9,Phosphoenolpyruvate carboxykinase (ATP),protein,360115,Coxiella burnetii (strain RSA 331 / Henzerling II),Coxiella burnetii (strain RSA 331 / Henzerling II),pckA,517,PTHR30031:SF0,PHOSPHOENOLPYRUVATE CARBOXYKINASE (ATP),True
A9R4C2,Phosphoenolpyruvate carboxykinase (ATP),protein,349746,Yersinia pestis bv. Antiqua (strain Angola),Yersinia pestis bv. Antiqua (strain Angola),pckA,539,PTHR30031:SF0,PHOSPHOENOLPYRUVATE CARBOXYKINASE (ATP),True
A9VLC7,Phosphoenolpyruvate carboxykinase (ATP),protein,315730,Bacillus mycoides (strain KBAB4),Bacillus mycoides (strain KBAB4),pckA,528,PTHR30031:SF0,PHOSPHOENOLPYRUVATE CARBOXYKINASE (ATP),True
A9W382,Phosphoenolpyruvate carboxykinase (ATP),protein,419610,Methylorubrum extorquens (strain PA1),Methylorubrum extorquens (strain PA1),pckA,539,PTHR30031:SF0,PHOSPHOENOLPYRUVATE CARBOXYKINASE (ATP),True
B0BP80,Phosphoenolpyruvate carboxykinase (ATP),protein,434271,Actinobacillus pleuropneumoniae serotype 3 (strain JL03),Actinobacillus pleuropneumoniae serotype 3 (strain JL03),pckA,536,PTHR30031:SF0,PHOSPHOENOLPYRUVATE CARBOXYKINASE (ATP),True
B0KI05,Phosphoenolpyruvate carboxykinase (ATP),protein,76869,Pseudomonas putida (strain GB-1),Pseudomonas putida (strain GB-1),pckA,513,PTHR30031:SF0,PHOSPHOENOLPYRUVATE CARBOXYKINASE (ATP),True
B0SFJ3,Phosphoenolpyruvate carboxykinase (ATP),protein,355278,Leptospira biflexa serovar Patoc (strain Patoc 1 / Ames),Leptospira biflexa serovar Patoc (strain Patoc 1 / Ames),pckA,530,PTHR30031:SF0,PHOSPHOENOLPYRUVATE CARBOXYKINASE (ATP),True
B0SPF0,Phosphoenolpyruvate carboxykinase (ATP),protein,456481,Leptospira biflexa serovar Patoc (strain Patoc 1 / ATCC 23582 / Paris),Leptospira biflexa serovar Patoc (strain Patoc 1 / ATCC 23582 / Paris),pckA,530,PTHR30031:SF0,PHOSPHOENOLPYRUVATE CARBOXYKINASE (ATP),True
B0TMY0,Phosphoenolpyruvate carboxykinase (ATP),protein,458817,Shewanella halifaxensis (strain HAW-EB4),Shewanella halifaxensis (strain HAW-EB4),pckA,513,PTHR30031:SF0,PHOSPHOENOLPYRUVATE CARBOXYKINASE (ATP),True
B0UFE2,Phosphoenolpyruvate carboxykinase (ATP),protein,426117,Methylobacterium sp. (strain 4-46),Methylobacterium sp. (strain 4-46),pckA,536,PTHR30031:SF0,PHOSPHOENOLPYRUVATE CARBOXYKINASE (ATP),True
B0UWS7,Phosphoenolpyruvate carboxykinase (ATP),protein,228400,Histophilus somni (strain 2336),Histophilus somni (strain 2336),pckA,538,PTHR30031:SF0,PHOSPHOENOLPYRUVATE CARBOXYKINASE (ATP),True
B1HXZ6,Phosphoenolpyruvate carboxykinase (ATP),protein,444177,Lysinibacillus sphaericus (strain C3-41),Lysinibacillus sphaericus (strain C3-41),pckA,528,PTHR30031:SF0,PHOSPHOENOLPYRUVATE CARBOXYKINASE (ATP),True
B1IP62,Phosphoenolpyruvate carboxykinase (ATP),protein,481805,Escherichia coli (strain ATCC 8739 / DSM 1576 / NBRC 3972 / NCIMB 8545 / WDCM 00012 / Crooks),Escherichia coli (strain ATCC 8739 / DSM 1576 / NBRC 3972 / NCIMB 8545 / WDCM 00012 / Crooks),pckA,540,PTHR30031:SF0,PHOSPHOENOLPYRUVATE CARBOXYKINASE (ATP),True
B1JET1,Phosphoenolpyruvate carboxykinase (ATP),protein,390235,Pseudomonas putida (strain W619),Pseudomonas putida (strain W619),pckA,513,PTHR30031:SF0,PHOSPHOENOLPYRUVATE CARBOXYKINASE (ATP),True
B1JI04,Phosphoenolpyruvate carboxykinase (ATP),protein,502800,Yersinia pseudotuberculosis serotype O:3 (strain YPIII),Yersinia pseudotuberculosis serotype O:3 (strain YPIII),pckA,539,PTHR30031:SF0,PHOSPHOENOLPYRUVATE CARBOXYKINASE (ATP),True
B1KN33,Phosphoenolpyruvate carboxykinase (ATP),protein,392500,Shewanella woodyi (strain ATCC 51908 / MS32),Shewanella woodyi (strain ATCC 51908 / MS32),pckA,513,PTHR30031:SF0,PHOSPHOENOLPYRUVATE CARBOXYKINASE (ATP),True
B1LHK1,Phosphoenolpyruvate carboxykinase (ATP),protein,439855,Escherichia coli (strain SMS-3-5 / SECEC),Escherichia coli (strain SMS-3-5 / SECEC),pckA,540,PTHR30031:SF0,PHOSPHOENOLPYRUVATE CARBOXYKINASE (ATP),True
B1M6N5,Phosphoenolpyruvate carboxykinase (ATP),protein,426355,Methylobacterium radiotolerans (strain ATCC 27329 / DSM 1819 / JCM 2831 / NBRC 15690 / NCIMB 10815 / 0-1),Methylobacterium radiotolerans (strain ATCC 27329 / DSM 1819 / JCM 2831 / NBRC 15690 / NCIMB 10815 / 0-1),pckA,539,PTHR30031:SF0,PHOSPHOENOLPYRUVATE CARBOXYKINASE (ATP),True
B1X750,Phosphoenolpyruvate carboxykinase (ATP),protein,316385,Escherichia coli (strain K12 / DH10B),Escherichia coli (strain K12 / DH10B),pckA,540,PTHR30031:SF0,PHOSPHOENOLPYRUVATE CARBOXYKINASE (ATP),True
B1ZG99,Phosphoenolpyruvate carboxykinase (ATP),protein,441620,Methylorubrum populi (strain ATCC BAA-705 / NCIMB 13946 / BJ001),Methylorubrum populi (strain ATCC BAA-705 / NCIMB 13946 / BJ001),pckA,539,PTHR30031:SF0,PHOSPHOENOLPYRUVATE CARBOXYKINASE (ATP),True
B2K5U8,Phosphoenolpyruvate carboxykinase (ATP),protein,502801,Yersinia pseudotuberculosis serotype IB (strain PB1/+),Yersinia pseudotuberculosis serotype IB (strain PB1/+),pckA,539,PTHR30031:SF0,PHOSPHOENOLPYRUVATE CARBOXYKINASE (ATP),True
B2RHV8,Phosphoenolpyruvate carboxykinase (ATP),protein,431947,Porphyromonas gingivalis (strain ATCC 33277 / DSM 20709 / CIP 103683 / JCM 12257 / NCTC 11834 / 2561),Porphyromonas gingivalis (strain ATCC 33277 / DSM 20709 / CIP 103683 / JCM 12257 / NCTC 11834 / 2561),pckA,535,PTHR30031:SF0,PHOSPHOENOLPYRUVATE CARBOXYKINASE (ATP),True
B2U3L1,Phosphoenolpyruvate carboxykinase (ATP),protein,344609,Shigella boydii serotype 18 (strain CDC 3083-94 / BS512),Shigella boydii serotype 18 (strain CDC 3083-94 / BS512),pckA,540,PTHR30031:SF0,PHOSPHOENOLPYRUVATE CARBOXYKINASE (ATP),True
B2VJU9,Phosphoenolpyruvate carboxykinase (ATP),protein,465817,Erwinia tasmaniensis (strain DSM 17950 / CFBP 7177 / CIP 109463 / NCPPB 4357 / Et1/99),Erwinia tasmaniensis (strain DSM 17950 / CFBP 7177 / CIP 109463 / NCPPB 4357 / Et1/99),pckA,539,PTHR30031:SF0,PHOSPHOENOLPYRUVATE CARBOXYKINASE (ATP),True
B3ET45,Phosphoenolpyruvate carboxykinase (ATP),protein,452471,Amoebophilus asiaticus (strain 5a2),Amoebophilus asiaticus (strain 5a2),pckA,520,PTHR30031:SF0,PHOSPHOENOLPYRUVATE CARBOXYKINASE (ATP),True
B3H1D9,Phosphoenolpyruvate carboxykinase (ATP),protein,537457,Actinobacillus pleuropneumoniae serotype 7 (strain AP76),Actinobacillus pleuropneumoniae serotype 7 (strain AP76),pckA,536,PTHR30031:SF0,PHOSPHOENOLPYRUVATE CARBOXYKINASE (ATP),True
B3PWH4,Phosphoenolpyruvate carboxykinase (ATP),protein,491916,Rhizobium etli (strain CIAT 652),Rhizobium etli (strain CIAT 652),pckA,536,PTHR30031:SF0,PHOSPHOENOLPYRUVATE CARBOXYKINASE (ATP),True
B3Q999,Phosphoenolpyruvate carboxykinase (ATP),protein,395960,Rhodopseudomonas palustris (strain TIE-1),Rhodopseudomonas palustris (strain TIE-1),pckA,537,PTHR30031:SF0,PHOSPHOENOLPYRUVATE CARBOXYKINASE (ATP),True
B4F025,Phosphoenolpyruvate carboxykinase (ATP),protein,529507,Proteus mirabilis (strain HI4320),Proteus mirabilis (strain HI4320),pckA,539,PTHR30031:SF0,PHOSPHOENOLPYRUVATE CARBOXYKINASE (ATP),True
B4SVK3,Phosphoenolpyruvate carboxykinase (ATP),protein,423368,Salmonella newport (strain SL254),Salmonella newport (strain SL254),pckA,539,PTHR30031:SF0,PHOSPHOENOLPYRUVATE CARBOXYKINASE (ATP),True
B4TKS6,Phosphoenolpyruvate carboxykinase (ATP),protein,454169,Salmonella heidelberg (strain SL476),Salmonella heidelberg (strain SL476),pckA,539,PTHR30031:SF0,PHOSPHOENOLPYRUVATE CARBOXYKINASE (ATP),True
B4TY59,Phosphoenolpyruvate carboxykinase (ATP),protein,439843,Salmonella schwarzengrund (strain CVM19633),Salmonella schwarzengrund (strain CVM19633),pckA,539,PTHR30031:SF0,PHOSPHOENOLPYRUVATE CARBOXYKINASE (ATP),True
B5BHF8,Phosphoenolpyruvate carboxykinase (ATP),protein,554290,Salmonella paratyphi A (strain AKU_12601),Salmonella paratyphi A (strain AKU_12601),pckA,539,PTHR30031:SF0,PHOSPHOENOLPYRUVATE CARBOXYKINASE (ATP),True
B5F8L6,Phosphoenolpyruvate carboxykinase (ATP),protein,454166,Salmonella agona (strain SL483),Salmonella agona (strain SL483),pckA,539,PTHR30031:SF0,PHOSPHOENOLPYRUVATE CARBOXYKINASE (ATP),True
B5FCE7,Phosphoenolpyruvate carboxykinase (ATP),protein,388396,Aliivibrio fischeri (strain MJ11),Aliivibrio fischeri (strain MJ11),pckA,540,PTHR30031:SF0,PHOSPHOENOLPYRUVATE CARBOXYKINASE (ATP),True
B5FJS1,Phosphoenolpyruvate carboxykinase (ATP),protein,439851,Salmonella dublin (strain CT_02021853),Salmonella dublin (strain CT_02021853),pckA,539,PTHR30031:SF0,PHOSPHOENOLPYRUVATE CARBOXYKINASE (ATP),True
B5R360,Phosphoenolpyruvate carboxykinase (ATP),protein,550537,Salmonella enteritidis PT4 (strain P125109),Salmonella enteritidis PT4 (strain P125109),pckA,539,PTHR30031:SF0,PHOSPHOENOLPYRUVATE CARBOXYKINASE (ATP),True
B5R7L4,Phosphoenolpyruvate carboxykinase (ATP),protein,550538,Salmonella gallinarum (strain 287/91 / NCTC 13346),Salmonella gallinarum (strain 287/91 / NCTC 13346),pckA,539,PTHR30031:SF0,PHOSPHOENOLPYRUVATE CARBOXYKINASE (ATP),True
B5X574,Phosphoenolpyruvate carboxykinase (ATP) 2,protein,3702,Arabidopsis thaliana,Arabidopsis thaliana (Mouse-ear cress),PCK2,670,PTHR30031:SF25,PHOSPHOENOLPYRUVATE CARBOXYKINASE (ATP) 2,True
B5YTV3,Phosphoenolpyruvate carboxykinase (ATP),protein,444450,Escherichia coli O157:H7 (strain EC4115 / EHEC),Escherichia coli O157:H7 (strain EC4115 / EHEC),pckA,540,PTHR30031:SF0,PHOSPHOENOLPYRUVATE CARBOXYKINASE (ATP),True
B5ZV86,Phosphoenolpyruvate carboxykinase (ATP),protein,395492,Rhizobium leguminosarum bv. trifolii (strain WSM2304),Rhizobium leguminosarum bv. trifolii (strain WSM2304),pckA,536,PTHR30031:SF0,PHOSPHOENOLPYRUVATE CARBOXYKINASE (ATP),True
B6EGP7,Phosphoenolpyruvate carboxykinase (ATP),protein,316275,Aliivibrio salmonicida (strain LFI1238),Aliivibrio salmonicida (strain LFI1238),pckA,541,PTHR30031:SF0,PHOSPHOENOLPYRUVATE CARBOXYKINASE (ATP),True
B6I2W3,Phosphoenolpyruvate carboxykinase (ATP),protein,409438,Escherichia coli (strain SE11),Escherichia coli (strain SE11),pckA,540,PTHR30031:SF0,PHOSPHOENOLPYRUVATE CARBOXYKINASE (ATP),True
B6J3V5,Phosphoenolpyruvate carboxykinase (ATP),protein,434923,Coxiella burnetii (strain CbuG_Q212),Coxiella burnetii (strain CbuG_Q212),pckA,517,PTHR30031:SF0,PHOSPHOENOLPYRUVATE CARBOXYKINASE (ATP),True
B6J6M2,Phosphoenolpyruvate carboxykinase (ATP),protein,434924,Coxiella burnetii (strain CbuK_Q154),Coxiella burnetii (strain CbuK_Q154),pckA,517,PTHR30031:SF0,PHOSPHOENOLPYRUVATE CARBOXYKINASE (ATP),True
B6JJT0,Phosphoenolpyruvate carboxykinase (ATP),protein,504832,Afipia carboxidovorans (strain ATCC 49405 / DSM 1227 / KCTC 32145 / OM5),Afipia carboxidovorans (strain ATCC 49405 / DSM 1227 / KCTC 32145 / OM5),pckA,538,PTHR30031:SF0,PHOSPHOENOLPYRUVATE CARBOXYKINASE (ATP),True
B6YRN4,Phosphoenolpyruvate carboxykinase (ATP),protein,511995,Azobacteroides pseudotrichonymphae genomovar. CFP2,Azobacteroides pseudotrichonymphae genomovar. CFP2,pckA,530,PTHR30031:SF0,PHOSPHOENOLPYRUVATE CARBOXYKINASE (ATP),True
