id,name,entry_type,source_tax_id,source_tax_name,full_tax_name,gene,length,subfamily,subfamily_name,in_alphafold
B7H9C8,Phosphoenolpyruvate carboxykinase (ATP),protein,405532,Bacillus cereus (strain B4264),Bacillus cereus (strain B4264),pckA,528,PTHR30031:SF0,PHOSPHOENOLPYRUVATE CARBOXYKINASE (ATP),True
B7HSV7,Phosphoenolpyruvate carboxykinase (ATP),protein,405534,Bacillus cereus (strain AH187),Bacillus cereus (strain AH187),pckA,528,PTHR30031:SF0,PHOSPHOENOLPYRUVATE CARBOXYKINASE (ATP),True
B7IL29,Phosphoenolpyruvate carboxykinase (ATP),protein,405531,Bacillus cereus (strain G9842),Bacillus cereus (strain G9842),pckA,528,PTHR30031:SF0,PHOSPHOENOLPYRUVATE CARBOXYKINASE (ATP),True
B7JT33,Phosphoenolpyruvate carboxykinase (ATP),protein,405535,Bacillus cereus (strain AH820),Bacillus cereus (strain AH820),pckA,528,PTHR30031:SF0,PHOSPHOENOLPYRUVATE CARBOXYKINASE (ATP),True
B7KVW8,Phosphoenolpyruvate carboxykinase (ATP),protein,440085,Methylorubrum extorquens (strain CM4 / NCIMB 13688),Methylorubrum extorquens (strain CM4 / NCIMB 13688),pckA,539,PTHR30031:SF0,PHOSPHOENOLPYRUVATE CARBOXYKINASE (ATP),True
B7L4T1,Phosphoenolpyruvate carboxykinase (ATP),protein,585055,Escherichia coli (strain 55989 / EAEC),Escherichia coli (strain 55989 / EAEC),pckA,540,PTHR30031:SF0,PHOSPHOENOLPYRUVATE CARBOXYKINASE (ATP),True
B7LSA4,Phosphoenolpyruvate carboxykinase (ATP),protein,585054,Escherichia fergusonii (strain ATCC 35469 / DSM 13698 / CCUG 18766 / IAM 14443 / JCM 21226 / LMG 7866 / NBRC 102419 / NCTC 12128 / CDC 0568-73),Escherichia fergusonii (strain ATCC 35469 / DSM 13698 / CCUG 18766 / IAM 14443 / JCM 21226 / LMG 7866 / NBRC 102419 / NCTC 12128 / CDC 0568-73),pckA,540,PTHR30031:SF0,PHOSPHOENOLPYRUVATE CARBOXYKINASE (ATP),True
B7M1V7,Phosphoenolpyruvate carboxykinase (ATP),protein,585034,Escherichia coli O8 (strain IAI1),Escherichia coli O8 (strain IAI1),pckA,540,PTHR30031:SF0,PHOSPHOENOLPYRUVATE CARBOXYKINASE (ATP),True
B7MDM9,Phosphoenolpyruvate carboxykinase (ATP),protein,585035,Escherichia coli O45:K1 (strain S88 / ExPEC),Escherichia coli O45:K1 (strain S88 / ExPEC),pckA,540,PTHR30031:SF0,PHOSPHOENOLPYRUVATE CARBOXYKINASE (ATP),True
B7N136,Phosphoenolpyruvate carboxykinase (ATP),protein,585397,Escherichia coli O81 (strain ED1a),Escherichia coli O81 (strain ED1a),pckA,540,PTHR30031:SF0,PHOSPHOENOLPYRUVATE CARBOXYKINASE (ATP),True
B7NE08,Phosphoenolpyruvate carboxykinase (ATP),protein,585056,Escherichia coli O17:K52:H18 (strain UMN026 / ExPEC),Escherichia coli O17:K52:H18 (strain UMN026 / ExPEC),pckA,540,PTHR30031:SF0,PHOSPHOENOLPYRUVATE CARBOXYKINASE (ATP),True
B7NMG6,Phosphoenolpyruvate carboxykinase (ATP),protein,585057,Escherichia coli O7:K1 (strain IAI39 / ExPEC),Escherichia coli O7:K1 (strain IAI39 / ExPEC),pckA,540,PTHR30031:SF0,PHOSPHOENOLPYRUVATE CARBOXYKINASE (ATP),True
B7UKA7,Phosphoenolpyruvate carboxykinase (ATP),protein,574521,Escherichia coli O127:H6 (strain E2348/69 / EPEC),Escherichia coli O127:H6 (strain E2348/69 / EPEC),pckA,540,PTHR30031:SF0,PHOSPHOENOLPYRUVATE CARBOXYKINASE (ATP),True
B7V3T9,Phosphoenolpyruvate carboxykinase (ATP),protein,557722,Pseudomonas aeruginosa (strain LESB58),Pseudomonas aeruginosa (strain LESB58),pckA,513,PTHR30031:SF0,PHOSPHOENOLPYRUVATE CARBOXYKINASE (ATP),True
B7VHF2,Phosphoenolpyruvate carboxykinase (ATP),protein,575788,Vibrio atlanticus (strain LGP32),Vibrio atlanticus (strain LGP32),pckA,541,PTHR30031:SF0,PHOSPHOENOLPYRUVATE CARBOXYKINASE (ATP),True
B8CH32,Phosphoenolpyruvate carboxykinase (ATP),protein,225849,Shewanella piezotolerans (strain WP3 / JCM 13877),Shewanella piezotolerans (strain WP3 / JCM 13877),pckA,513,PTHR30031:SF0,PHOSPHOENOLPYRUVATE CARBOXYKINASE (ATP),True
B8E3X7,Phosphoenolpyruvate carboxykinase (ATP),protein,407976,Shewanella baltica (strain OS223),Shewanella baltica (strain OS223),pckA,513,PTHR30031:SF0,PHOSPHOENOLPYRUVATE CARBOXYKINASE (ATP),True
B8F4W1,Phosphoenolpyruvate carboxykinase (ATP),protein,557723,Glaesserella parasuis serovar 5 (strain SH0165),Glaesserella parasuis serovar 5 (strain SH0165),pckA,536,PTHR30031:SF0,PHOSPHOENOLPYRUVATE CARBOXYKINASE (ATP),True
B8IMT2,Phosphoenolpyruvate carboxykinase (ATP),protein,460265,Methylobacterium nodulans (strain LMG 21967 / CNCM I-2342 / ORS 2060),Methylobacterium nodulans (strain LMG 21967 / CNCM I-2342 / ORS 2060),pckA,536,PTHR30031:SF0,PHOSPHOENOLPYRUVATE CARBOXYKINASE (ATP),True
B9DN20,Phosphoenolpyruvate carboxykinase (ATP),protein,396513,Staphylococcus carnosus (strain TM300),Staphylococcus carnosus (strain TM300),pckA,530,PTHR30031:SF0,PHOSPHOENOLPYRUVATE CARBOXYKINASE (ATP),True
B9J266,Phosphoenolpyruvate carboxykinase (ATP),protein,361100,Bacillus cereus (strain Q1),Bacillus cereus (strain Q1),pckA,528,PTHR30031:SF0,PHOSPHOENOLPYRUVATE CARBOXYKINASE (ATP),True
B9JG59,Phosphoenolpyruvate carboxykinase (ATP),protein,311403,Rhizobium rhizogenes (strain K84 / ATCC BAA-868),Rhizobium rhizogenes (strain K84 / ATCC BAA-868),pckA,536,PTHR30031:SF0,PHOSPHOENOLPYRUVATE CARBOXYKINASE (ATP),True
B9JXX4,Phosphoenolpyruvate carboxykinase (ATP),protein,311402,Allorhizobium ampelinum (strain ATCC BAA-846 / DSM 112012 / S4),Allorhizobium ampelinum (strain ATCC BAA-846 / DSM 112012 / S4),pckA,536,PTHR30031:SF0,PHOSPHOENOLPYRUVATE CARBOXYKINASE (ATP),True
B9KD79,Phosphoenolpyruvate carboxykinase (ATP),protein,306263,Campylobacter lari (strain RM2100 / D67 / ATCC BAA-1060),Campylobacter lari (strain RM2100 / D67 / ATCC BAA-1060),pckA,524,PTHR30031:SF0,PHOSPHOENOLPYRUVATE CARBOXYKINASE (ATP),True
C0Q0H5,Phosphoenolpyruvate carboxykinase (ATP),protein,476213,Salmonella paratyphi C (strain RKS4594),Salmonella paratyphi C (strain RKS4594),pckA,539,PTHR30031:SF0,PHOSPHOENOLPYRUVATE CARBOXYKINASE (ATP),True
C0ZL09,Phosphoenolpyruvate carboxykinase (ATP),protein,358681,Brevibacillus brevis (strain 47 / JCM 6285 / NBRC 100599),Brevibacillus brevis (strain 47 / JCM 6285 / NBRC 100599),pckA,527,PTHR30031:SF0,PHOSPHOENOLPYRUVATE CARBOXYKINASE (ATP),True
C1EW38,Phosphoenolpyruvate carboxykinase (ATP),protein,572264,Bacillus cereus (strain 03BB102),Bacillus cereus (strain 03BB102),pckA,528,PTHR30031:SF0,PHOSPHOENOLPYRUVATE CARBOXYKINASE (ATP),True
C3K4J5,Phosphoenolpyruvate carboxykinase (ATP),protein,216595,Pseudomonas fluorescens (strain SBW25),Pseudomonas fluorescens (strain SBW25),pckA,513,PTHR30031:SF0,PHOSPHOENOLPYRUVATE CARBOXYKINASE (ATP),True
C3LSG5,Phosphoenolpyruvate carboxykinase (ATP),protein,579112,Vibrio cholerae serotype O1 (strain M66-2),Vibrio cholerae serotype O1 (strain M66-2),pckA,542,PTHR30031:SF0,PHOSPHOENOLPYRUVATE CARBOXYKINASE (ATP),True
C3PCC6,Phosphoenolpyruvate carboxykinase (ATP),protein,592021,Bacillus anthracis (strain A0248),Bacillus anthracis (strain A0248),pckA,528,PTHR30031:SF0,PHOSPHOENOLPYRUVATE CARBOXYKINASE (ATP),True
C4K3J5,Phosphoenolpyruvate carboxykinase (ATP),protein,572265,Hamiltonella defensa subsp. Acyrthosiphon pisum (strain 5AT),Hamiltonella defensa subsp. Acyrthosiphon pisum (strain 5AT),pckA,539,PTHR30031:SF0,PHOSPHOENOLPYRUVATE CARBOXYKINASE (ATP),True
C4Z0Q6,Phosphoenolpyruvate carboxykinase (ATP),protein,515620,Lachnospira eligens (strain ATCC 27750 / DSM 3376 / VPI C15-48 / C15-B4),Lachnospira eligens (strain ATCC 27750 / DSM 3376 / VPI C15-48 / C15-B4),pckA,534,PTHR30031:SF0,PHOSPHOENOLPYRUVATE CARBOXYKINASE (ATP),True
C4ZBL1,Phosphoenolpyruvate carboxykinase (ATP),protein,515619,Agathobacter rectalis (strain ATCC 33656 / DSM 3377 / JCM 17463 / KCTC 5835 / VPI 0990),Agathobacter rectalis (strain ATCC 33656 / DSM 3377 / JCM 17463 / KCTC 5835 / VPI 0990),pckA,534,PTHR30031:SF0,PHOSPHOENOLPYRUVATE CARBOXYKINASE (ATP),True
C4ZUQ8,Phosphoenolpyruvate carboxykinase (ATP),protein,595496,Escherichia coli (strain K12 / MC4100 / BW2952),Escherichia coli (strain K12 / MC4100 / BW2952),pckA,540,PTHR30031:SF0,PHOSPHOENOLPYRUVATE CARBOXYKINASE (ATP),True
C5BGS4,Phosphoenolpyruvate carboxykinase (ATP),protein,634503,Edwardsiella ictaluri (strain 93-146),Edwardsiella ictaluri (strain 93-146),pckA,539,PTHR30031:SF0,PHOSPHOENOLPYRUVATE CARBOXYKINASE (ATP),True
C6DGE8,Phosphoenolpyruvate carboxykinase (ATP),protein,561230,Pectobacterium carotovorum subsp. carotovorum (strain PC1),Pectobacterium carotovorum subsp. carotovorum (strain PC1),pckA,539,PTHR30031:SF0,PHOSPHOENOLPYRUVATE CARBOXYKINASE (ATP),True
C6E0Y2,Phosphoenolpyruvate carboxykinase (ATP),protein,443144,Geobacter sp. (strain M21),Geobacter sp. (strain M21),pckA,529,PTHR30031:SF0,PHOSPHOENOLPYRUVATE CARBOXYKINASE (ATP),True
O09460,Phosphoenolpyruvate carboxykinase (ATP),protein,13335,Anaerobiospirillum succiniciproducens,Anaerobiospirillum succiniciproducens,pckA,532,PTHR30031:SF0,PHOSPHOENOLPYRUVATE CARBOXYKINASE (ATP),True
O13434,Phosphoenolpyruvate carboxykinase (ATP),protein,5476,Candida albicans,Candida albicans (Yeast),PCK1,553,PTHR30031:SF0,PHOSPHOENOLPYRUVATE CARBOXYKINASE (ATP),False
O43112,Phosphoenolpyruvate carboxykinase (ATP),protein,284590,Kluyveromyces lactis (strain ATCC 8585 / CBS 2359 / DSM 70799 / NBRC 1267 / NRRL Y-1140 / WM37),Kluyveromyces lactis (strain ATCC 8585 / CBS 2359 / DSM 70799 / NBRC 1267 / NRRL Y-1140 / WM37) (Yeast),PCK1,543,PTHR30031:SF0,PHOSPHOENOLPYRUVATE CARBOXYKINASE (ATP),True
O83023,Phosphoenolpyruvate carboxykinase (ATP),protein,971,Selenomonas ruminantium,Selenomonas ruminantium,pckA,539,PTHR30031:SF0,PHOSPHOENOLPYRUVATE CARBOXYKINASE (ATP),True
P0A0B3,Phosphoenolpyruvate carboxykinase (ATP),protein,158878,Staphylococcus aureus (strain Mu50 / ATCC 700699),Staphylococcus aureus (strain Mu50 / ATCC 700699),pckA,530,PTHR30031:SF0,PHOSPHOENOLPYRUVATE CARBOXYKINASE (ATP),True
P0C1S4,Phosphoenolpyruvate carboxykinase (ATP),protein,1280,Staphylococcus aureus,Staphylococcus aureus,pckA,530,PTHR30031:SF0,PHOSPHOENOLPYRUVATE CARBOXYKINASE (ATP),True
P10963,Phosphoenolpyruvate carboxykinase (ATP),protein,559292,Saccharomyces cerevisiae (strain ATCC 204508 / S288c),Saccharomyces cerevisiae (strain ATCC 204508 / S288c) (Baker's yeast),PCK1,549,PTHR30031:SF0,PHOSPHOENOLPYRUVATE CARBOXYKINASE (ATP),True
P13735,"Phosphoenolpyruvate carboxykinase (ATP), glycosomal",protein,5702,Trypanosoma brucei brucei,Trypanosoma brucei brucei,,472,PTHR30031:SF0,PHOSPHOENOLPYRUVATE CARBOXYKINASE (ATP),True
P22259,Phosphoenolpyruvate carboxykinase (ATP),protein,83333,Escherichia coli (strain K12),Escherichia coli (strain K12),pckA,540,PTHR30031:SF0,PHOSPHOENOLPYRUVATE CARBOXYKINASE (ATP),True
P41033,Phosphoenolpyruvate carboxykinase (ATP),protein,99287,Salmonella typhimurium (strain LT2 / SGSC1412 / ATCC 700720),Salmonella typhimurium (strain LT2 / SGSC1412 / ATCC 700720),pckA,538,PTHR30031:SF0,PHOSPHOENOLPYRUVATE CARBOXYKINASE (ATP),True
P42066,Phosphoenolpyruvate carboxykinase (ATP),protein,3659,Cucumis sativus,Cucumis sativus (Cucumber),PCK,670,PTHR30031:SF28,PHOSPHOENOLPYRUVATE CARBOXYKINASE (ATP),True
P43085,Phosphoenolpyruvate carboxykinase (ATP),protein,266834,Rhizobium meliloti (strain 1021),Rhizobium meliloti (strain 1021) (Ensifer meliloti),pckA,536,PTHR30031:SF0,PHOSPHOENOLPYRUVATE CARBOXYKINASE (ATP),True
P43086,Phosphoenolpyruvate carboxykinase (ATP),protein,394,Sinorhizobium fredii (strain NBRC 101917 / NGR234),Sinorhizobium fredii (strain NBRC 101917 / NGR234),pckA,536,PTHR30031:SF0,PHOSPHOENOLPYRUVATE CARBOXYKINASE (ATP),True
P43923,Phosphoenolpyruvate carboxykinase (ATP),protein,71421,Haemophilus influenzae (strain ATCC 51907 / DSM 11121 / KW20 / Rd),Haemophilus influenzae (strain ATCC 51907 / DSM 11121 / KW20 / Rd),pckA,538,PTHR30031:SF0,PHOSPHOENOLPYRUVATE CARBOXYKINASE (ATP),True
P49292,Phosphoenolpyruvate carboxykinase (ATP) 1,protein,37563,Urochloa panicoides,Urochloa panicoides (Panic liverseed grass),PCK1,624,PTHR30031:SF0,PHOSPHOENOLPYRUVATE CARBOXYKINASE (ATP),True
P51058,"Phosphoenolpyruvate carboxykinase (ATP), glycosomal",protein,5693,Trypanosoma cruzi,Trypanosoma cruzi,PEPCK,472,PTHR30031:SF0,PHOSPHOENOLPYRUVATE CARBOXYKINASE (ATP),True
P54418,Phosphoenolpyruvate carboxykinase (ATP),protein,224308,Bacillus subtilis (strain 168),Bacillus subtilis (strain 168),pckA,527,PTHR30031:SF0,PHOSPHOENOLPYRUVATE CARBOXYKINASE (ATP),True
P99128,Phosphoenolpyruvate carboxykinase (ATP),protein,158879,Staphylococcus aureus (strain N315),Staphylococcus aureus (strain N315),pckA,530,PTHR30031:SF0,PHOSPHOENOLPYRUVATE CARBOXYKINASE (ATP),True
Q02EH2,Phosphoenolpyruvate carboxykinase (ATP),protein,208963,Pseudomonas aeruginosa (strain UCBPP-PA14),Pseudomonas aeruginosa (strain UCBPP-PA14),pckA,513,PTHR30031:SF0,PHOSPHOENOLPYRUVATE CARBOXYKINASE (ATP),True
Q07TF9,Phosphoenolpyruvate carboxykinase (ATP),protein,316055,Rhodopseudomonas palustris (strain BisA53),Rhodopseudomonas palustris (strain BisA53),pckA,537,PTHR30031:SF0,PHOSPHOENOLPYRUVATE CARBOXYKINASE (ATP),True
Q089V1,Phosphoenolpyruvate carboxykinase (ATP),protein,318167,Shewanella frigidimarina (strain NCIMB 400),Shewanella frigidimarina (strain NCIMB 400),pckA,513,PTHR30031:SF0,PHOSPHOENOLPYRUVATE CARBOXYKINASE (ATP),True
Q0AQP4,Phosphoenolpyruvate carboxykinase (ATP),protein,394221,Maricaulis maris (strain MCS10),Maricaulis maris (strain MCS10),pckA,537,PTHR30031:SF0,PHOSPHOENOLPYRUVATE CARBOXYKINASE (ATP),True
Q0HNY4,Phosphoenolpyruvate carboxykinase (ATP),protein,60480,Shewanella sp. (strain MR-4),Shewanella sp. (strain MR-4),pckA,513,PTHR30031:SF0,PHOSPHOENOLPYRUVATE CARBOXYKINASE (ATP),True
Q0I0F2,Phosphoenolpyruvate carboxykinase (ATP),protein,60481,Shewanella sp. (strain MR-7),Shewanella sp. (strain MR-7),pckA,513,PTHR30031:SF0,PHOSPHOENOLPYRUVATE CARBOXYKINASE (ATP),True
Q0I554,Phosphoenolpyruvate carboxykinase (ATP),protein,205914,Histophilus somni (strain 129Pt),Histophilus somni (strain 129Pt),pckA,538,PTHR30031:SF0,PHOSPHOENOLPYRUVATE CARBOXYKINASE (ATP),True
Q0SZR5,Phosphoenolpyruvate carboxykinase (ATP),protein,373384,Shigella flexneri serotype 5b (strain 8401),Shigella flexneri serotype 5b (strain 8401),pckA,540,PTHR30031:SF0,PHOSPHOENOLPYRUVATE CARBOXYKINASE (ATP),True
Q0TC64,Phosphoenolpyruvate carboxykinase (ATP),protein,362663,Escherichia coli O6:K15:H31 (strain 536 / UPEC),Escherichia coli O6:K15:H31 (strain 536 / UPEC),pckA,540,PTHR30031:SF0,PHOSPHOENOLPYRUVATE CARBOXYKINASE (ATP),True
Q11CK2,Phosphoenolpyruvate carboxykinase (ATP),protein,266779,Chelativorans sp. (strain BNC1),Chelativorans sp. (strain BNC1),pckA,536,PTHR30031:SF0,PHOSPHOENOLPYRUVATE CARBOXYKINASE (ATP),True
Q12T12,Phosphoenolpyruvate carboxykinase (ATP),protein,318161,Shewanella denitrificans (strain OS217 / ATCC BAA-1090 / DSM 15013),Shewanella denitrificans (strain OS217 / ATCC BAA-1090 / DSM 15013),pckA,513,PTHR30031:SF0,PHOSPHOENOLPYRUVATE CARBOXYKINASE (ATP),True
Q13E86,Phosphoenolpyruvate carboxykinase (ATP),protein,316057,Rhodopseudomonas palustris (strain BisB5),Rhodopseudomonas palustris (strain BisB5),pckA,537,PTHR30031:SF0,PHOSPHOENOLPYRUVATE CARBOXYKINASE (ATP),True
Q16AH6,Phosphoenolpyruvate carboxykinase (ATP),protein,375451,Roseobacter denitrificans (strain ATCC 33942 / OCh 114),Roseobacter denitrificans (strain ATCC 33942 / OCh 114) (Erythrobacter sp. (strain OCh 114)),pckA,532,PTHR30031:SF0,PHOSPHOENOLPYRUVATE CARBOXYKINASE (ATP),True
Q1AY78,Phosphoenolpyruvate carboxykinase (ATP),protein,266117,Rubrobacter xylanophilus (strain DSM 9941 / JCM 11954 / NBRC 16129 / PRD-1),Rubrobacter xylanophilus (strain DSM 9941 / JCM 11954 / NBRC 16129 / PRD-1),pckA,532,PTHR30031:SF0,PHOSPHOENOLPYRUVATE CARBOXYKINASE (ATP),True
Q1C2M9,Phosphoenolpyruvate carboxykinase (ATP),protein,360102,Yersinia pestis bv. Antiqua (strain Antiqua),Yersinia pestis bv. Antiqua (strain Antiqua),pckA,539,PTHR30031:SF0,PHOSPHOENOLPYRUVATE CARBOXYKINASE (ATP),True
Q1CCM6,Phosphoenolpyruvate carboxykinase (ATP),protein,377628,Yersinia pestis bv. Antiqua (strain Nepal516),Yersinia pestis bv. Antiqua (strain Nepal516),pckA,539,PTHR30031:SF0,PHOSPHOENOLPYRUVATE CARBOXYKINASE (ATP),True
Q1GDU2,Phosphoenolpyruvate carboxykinase (ATP),protein,292414,Ruegeria sp. (strain TM1040),Ruegeria sp. (strain TM1040),pckA,532,PTHR30031:SF0,PHOSPHOENOLPYRUVATE CARBOXYKINASE (ATP),True
Q1IGK1,Phosphoenolpyruvate carboxykinase (ATP),protein,384676,Pseudomonas entomophila (strain L48),Pseudomonas entomophila (strain L48),pckA,513,PTHR30031:SF0,PHOSPHOENOLPYRUVATE CARBOXYKINASE (ATP),True
Q1IZ41,Phosphoenolpyruvate carboxykinase (ATP),protein,319795,Deinococcus geothermalis (strain DSM 11300 / CIP 105573 / AG-3a),Deinococcus geothermalis (strain DSM 11300 / CIP 105573 / AG-3a),pckA,529,PTHR30031:SF0,PHOSPHOENOLPYRUVATE CARBOXYKINASE (ATP),True
Q1LU72,Phosphoenolpyruvate carboxykinase (ATP),protein,374463,Baumannia cicadellinicola subsp. Homalodisca coagulata,Baumannia cicadellinicola subsp. Homalodisca coagulata,pckA,538,PTHR30031:SF0,PHOSPHOENOLPYRUVATE CARBOXYKINASE (ATP),True
Q1MNG2,Phosphoenolpyruvate carboxykinase (ATP),protein,216596,Rhizobium johnstonii (strain DSM 114642 / LMG 32736 / 3841),Rhizobium johnstonii (strain DSM 114642 / LMG 32736 / 3841),pckA,536,PTHR30031:SF0,PHOSPHOENOLPYRUVATE CARBOXYKINASE (ATP),True
Q1QR12,Phosphoenolpyruvate carboxykinase (ATP),protein,323097,Nitrobacter hamburgensis (strain DSM 10229 / NCIMB 13809 / X14),Nitrobacter hamburgensis (strain DSM 10229 / NCIMB 13809 / X14),pckA,538,PTHR30031:SF0,PHOSPHOENOLPYRUVATE CARBOXYKINASE (ATP),True
Q21BR2,Phosphoenolpyruvate carboxykinase (ATP),protein,316056,Rhodopseudomonas palustris (strain BisB18),Rhodopseudomonas palustris (strain BisB18),pckA,537,PTHR30031:SF0,PHOSPHOENOLPYRUVATE CARBOXYKINASE (ATP),True
Q2FFV5,Phosphoenolpyruvate carboxykinase (ATP),protein,367830,Staphylococcus aureus (strain USA300),Staphylococcus aureus (strain USA300),pckA,530,PTHR30031:SF0,PHOSPHOENOLPYRUVATE CARBOXYKINASE (ATP),True
Q2G1W2,Phosphoenolpyruvate carboxykinase (ATP),protein,93061,Staphylococcus aureus (strain NCTC 8325 / PS 47),Staphylococcus aureus (strain NCTC 8325 / PS 47),pckA,530,PTHR30031:SF0,PHOSPHOENOLPYRUVATE CARBOXYKINASE (ATP),True
Q2G480,Phosphoenolpyruvate carboxykinase (ATP),protein,279238,Novosphingobium aromaticivorans (strain ATCC 700278 / DSM 12444 / CCUG 56034 / CIP 105152 / NBRC 16084 / F199),Novosphingobium aromaticivorans (strain ATCC 700278 / DSM 12444 / CCUG 56034 / CIP 105152 / NBRC 16084 / F199),pckA,534,PTHR30031:SF0,PHOSPHOENOLPYRUVATE CARBOXYKINASE (ATP),True
Q2J2Y8,Phosphoenolpyruvate carboxykinase (ATP),protein,316058,Rhodopseudomonas palustris (strain HaA2),Rhodopseudomonas palustris (strain HaA2),pckA,537,PTHR30031:SF0,PHOSPHOENOLPYRUVATE CARBOXYKINASE (ATP),True
Q2KE66,Phosphoenolpyruvate carboxykinase (ATP),protein,347834,Rhizobium etli (strain ATCC 51251 / DSM 11541 / JCM 21823 / NBRC 15573 / CFN 42),Rhizobium etli (strain ATCC 51251 / DSM 11541 / JCM 21823 / NBRC 15573 / CFN 42),pckA,536,PTHR30031:SF0,PHOSPHOENOLPYRUVATE CARBOXYKINASE (ATP),True
Q2NQI3,Phosphoenolpyruvate carboxykinase (ATP),protein,343509,Sodalis glossinidius (strain morsitans),Sodalis glossinidius (strain morsitans),pckA,539,PTHR30031:SF0,PHOSPHOENOLPYRUVATE CARBOXYKINASE (ATP),True
Q2RH96,Phosphoenolpyruvate carboxykinase (ATP) 2,protein,264732,Moorella thermoacetica (strain ATCC 39073 / JCM 9320),Moorella thermoacetica (strain ATCC 39073 / JCM 9320),pckA2,526,PTHR30031:SF0,PHOSPHOENOLPYRUVATE CARBOXYKINASE (ATP),True
Q2RKS7,Phosphoenolpyruvate carboxykinase (ATP) 1,protein,264732,Moorella thermoacetica (strain ATCC 39073 / JCM 9320),Moorella thermoacetica (strain ATCC 39073 / JCM 9320),pckA1,525,PTHR30031:SF0,PHOSPHOENOLPYRUVATE CARBOXYKINASE (ATP),True
Q2S008,Phosphoenolpyruvate carboxykinase (ATP) 2,protein,309807,Salinibacter ruber (strain DSM 13855 / M31),Salinibacter ruber (strain DSM 13855 / M31),pckA2,530,PTHR30031:SF0,PHOSPHOENOLPYRUVATE CARBOXYKINASE (ATP),True
Q2S1I3,Phosphoenolpyruvate carboxykinase (ATP) 1,protein,309807,Salinibacter ruber (strain DSM 13855 / M31),Salinibacter ruber (strain DSM 13855 / M31),pckA1,535,PTHR30031:SF0,PHOSPHOENOLPYRUVATE CARBOXYKINASE (ATP),True
Q2SPF9,Phosphoenolpyruvate carboxykinase (ATP),protein,349521,Hahella chejuensis (strain KCTC 2396),Hahella chejuensis (strain KCTC 2396),pckA,511,PTHR30031:SF0,PHOSPHOENOLPYRUVATE CARBOXYKINASE (ATP),True
Q2YTK0,Phosphoenolpyruvate carboxykinase (ATP),protein,273036,Staphylococcus aureus (strain bovine RF122 / ET3-1),Staphylococcus aureus (strain bovine RF122 / ET3-1),pckA,530,PTHR30031:SF0,PHOSPHOENOLPYRUVATE CARBOXYKINASE (ATP),True
Q30PV8,Phosphoenolpyruvate carboxykinase (ATP),protein,326298,Sulfurimonas denitrificans (strain ATCC 33889 / DSM 1251),Sulfurimonas denitrificans (strain ATCC 33889 / DSM 1251),pckA,528,PTHR30031:SF0,PHOSPHOENOLPYRUVATE CARBOXYKINASE (ATP),True
Q31VN1,Phosphoenolpyruvate carboxykinase (ATP),protein,300268,Shigella boydii serotype 4 (strain Sb227),Shigella boydii serotype 4 (strain Sb227),pckA,540,PTHR30031:SF0,PHOSPHOENOLPYRUVATE CARBOXYKINASE (ATP),True
Q32AL7,Phosphoenolpyruvate carboxykinase (ATP),protein,300267,Shigella dysenteriae serotype 1 (strain Sd197),Shigella dysenteriae serotype 1 (strain Sd197),pckA,540,PTHR30031:SF0,PHOSPHOENOLPYRUVATE CARBOXYKINASE (ATP),True
Q39QU2,Phosphoenolpyruvate carboxykinase (ATP),protein,269799,Geobacter metallireducens (strain ATCC 53774 / DSM 7210 / GS-15),Geobacter metallireducens (strain ATCC 53774 / DSM 7210 / GS-15),pckA,530,PTHR30031:SF0,PHOSPHOENOLPYRUVATE CARBOXYKINASE (ATP),True
Q3ILP3,Phosphoenolpyruvate carboxykinase (ATP),protein,326442,Pseudoalteromonas translucida (strain TAC 125),Pseudoalteromonas translucida (strain TAC 125),pckA,513,PTHR30031:SF0,PHOSPHOENOLPYRUVATE CARBOXYKINASE (ATP),True
Q3J5V6,Phosphoenolpyruvate carboxykinase (ATP),protein,272943,Cereibacter sphaeroides (strain ATCC 17023 / DSM 158 / JCM 6121 / CCUG 31486 / LMG 2827 / NBRC 12203 / NCIMB 8253 / ATH 2.4.1.),Cereibacter sphaeroides (strain ATCC 17023 / DSM 158 / JCM 6121 / CCUG 31486 / LMG 2827 / NBRC 12203 / NCIMB 8253 / ATH 2.4.1.),pckA,532,PTHR30031:SF0,PHOSPHOENOLPYRUVATE CARBOXYKINASE (ATP),True
Q3KJP4,Phosphoenolpyruvate carboxykinase (ATP),protein,205922,Pseudomonas fluorescens (strain Pf0-1),Pseudomonas fluorescens (strain Pf0-1),pckA,513,PTHR30031:SF0,PHOSPHOENOLPYRUVATE CARBOXYKINASE (ATP),True
Q3SVS4,Phosphoenolpyruvate carboxykinase (ATP),protein,323098,Nitrobacter winogradskyi (strain ATCC 25391 / DSM 10237 / CIP 104748 / NCIMB 11846 / Nb-255),Nitrobacter winogradskyi (strain ATCC 25391 / DSM 10237 / CIP 104748 / NCIMB 11846 / Nb-255),pckA,538,PTHR30031:SF0,PHOSPHOENOLPYRUVATE CARBOXYKINASE (ATP),True
Q3YWM2,Phosphoenolpyruvate carboxykinase (ATP),protein,300269,Shigella sonnei (strain Ss046),Shigella sonnei (strain Ss046),pckA,540,PTHR30031:SF0,PHOSPHOENOLPYRUVATE CARBOXYKINASE (ATP),True
Q47VD0,Phosphoenolpyruvate carboxykinase (ATP),protein,167879,Colwellia psychrerythraea (strain 34H / ATCC BAA-681),Colwellia psychrerythraea (strain 34H / ATCC BAA-681),pckA,536,PTHR30031:SF0,PHOSPHOENOLPYRUVATE CARBOXYKINASE (ATP),True
Q48BY7,Phosphoenolpyruvate carboxykinase (ATP),protein,264730,Pseudomonas savastanoi pv. phaseolicola (strain 1448A / Race 6),Pseudomonas savastanoi pv. phaseolicola (strain 1448A / Race 6),pckA,514,PTHR30031:SF0,PHOSPHOENOLPYRUVATE CARBOXYKINASE (ATP),True
Q49YL7,Phosphoenolpyruvate carboxykinase (ATP),protein,342451,Staphylococcus saprophyticus subsp. saprophyticus (strain ATCC 15305 / DSM 20229 / NCIMB 8711 / NCTC 7292 / S-41),Staphylococcus saprophyticus subsp. saprophyticus (strain ATCC 15305 / DSM 20229 / NCIMB 8711 / NCTC 7292 / S-41),pckA,529,PTHR30031:SF0,PHOSPHOENOLPYRUVATE CARBOXYKINASE (ATP),True
Q4KK03,Phosphoenolpyruvate carboxykinase (ATP),protein,220664,Pseudomonas fluorescens (strain ATCC BAA-477 / NRRL B-23932 / Pf-5),Pseudomonas fluorescens (strain ATCC BAA-477 / NRRL B-23932 / Pf-5),pckA,514,PTHR30031:SF0,PHOSPHOENOLPYRUVATE CARBOXYKINASE (ATP),True
Q4L7C9,Phosphoenolpyruvate carboxykinase (ATP),protein,279808,Staphylococcus haemolyticus (strain JCSC1435),Staphylococcus haemolyticus (strain JCSC1435),pckA,530,PTHR30031:SF0,PHOSPHOENOLPYRUVATE CARBOXYKINASE (ATP),True
Q4QM91,Phosphoenolpyruvate carboxykinase (ATP),protein,281310,Haemophilus influenzae (strain 86-028NP),Haemophilus influenzae (strain 86-028NP),pckA,538,PTHR30031:SF0,PHOSPHOENOLPYRUVATE CARBOXYKINASE (ATP),True
Q500D1,Phosphoenolpyruvate carboxykinase (ATP),protein,205918,Pseudomonas syringae pv. syringae (strain B728a),Pseudomonas syringae pv. syringae (strain B728a),pckA,514,PTHR30031:SF0,PHOSPHOENOLPYRUVATE CARBOXYKINASE (ATP),True
Q57IX4,Phosphoenolpyruvate carboxykinase (ATP),protein,321314,Salmonella choleraesuis (strain SC-B67),Salmonella choleraesuis (strain SC-B67),pckA,539,PTHR30031:SF0,PHOSPHOENOLPYRUVATE CARBOXYKINASE (ATP),True
Q5E1X3,Phosphoenolpyruvate carboxykinase (ATP),protein,312309,Aliivibrio fischeri (strain ATCC 700601 / ES114),Aliivibrio fischeri (strain ATCC 700601 / ES114),pckA,537,PTHR30031:SF0,PHOSPHOENOLPYRUVATE CARBOXYKINASE (ATP),True
Q5HEY8,Phosphoenolpyruvate carboxykinase (ATP),protein,93062,Staphylococcus aureus (strain COL),Staphylococcus aureus (strain COL),pckA,530,PTHR30031:SF0,PHOSPHOENOLPYRUVATE CARBOXYKINASE (ATP),True
Q5HNB7,Phosphoenolpyruvate carboxykinase (ATP),protein,176279,Staphylococcus epidermidis (strain ATCC 35984 / DSM 28319 / BCRC 17069 / CCUG 31568 / BM 3577 / RP62A),Staphylococcus epidermidis (strain ATCC 35984 / DSM 28319 / BCRC 17069 / CCUG 31568 / BM 3577 / RP62A),pckA,530,PTHR30031:SF0,PHOSPHOENOLPYRUVATE CARBOXYKINASE (ATP),True
Q5HUM7,Phosphoenolpyruvate carboxykinase (ATP),protein,195099,Campylobacter jejuni (strain RM1221),Campylobacter jejuni (strain RM1221),pckA,524,PTHR30031:SF0,PHOSPHOENOLPYRUVATE CARBOXYKINASE (ATP),True
Q5KW01,Phosphoenolpyruvate carboxykinase (ATP),protein,235909,Geobacillus kaustophilus (strain HTA426),Geobacillus kaustophilus (strain HTA426),pckA,528,PTHR30031:SF0,PHOSPHOENOLPYRUVATE CARBOXYKINASE (ATP),True
