id,name,entry_type,source_tax_id,source_tax_name,full_tax_name,gene,length,subfamily,subfamily_name,in_alphafold
Q5L7N5,Phosphoenolpyruvate carboxykinase (ATP),protein,272559,Bacteroides fragilis (strain ATCC 25285 / DSM 2151 / CCUG 4856 / JCM 11019 / LMG 10263 / NCTC 9343 / Onslow / VPI 2553 / EN-2),Bacteroides fragilis (strain ATCC 25285 / DSM 2151 / CCUG 4856 / JCM 11019 / LMG 10263 / NCTC 9343 / Onslow / VPI 2553 / EN-2),pckA,535,PTHR30031:SF0,PHOSPHOENOLPYRUVATE CARBOXYKINASE (ATP),True
Q5LVJ2,Phosphoenolpyruvate carboxykinase (ATP),protein,246200,Ruegeria pomeroyi (strain ATCC 700808 / DSM 15171 / DSS-3),Ruegeria pomeroyi (strain ATCC 700808 / DSM 15171 / DSS-3),pckA,532,PTHR30031:SF0,PHOSPHOENOLPYRUVATE CARBOXYKINASE (ATP),True
Q5PLX8,Phosphoenolpyruvate carboxykinase (ATP),protein,295319,Salmonella paratyphi A (strain ATCC 9150 / SARB42),Salmonella paratyphi A (strain ATCC 9150 / SARB42),pckA,539,PTHR30031:SF0,PHOSPHOENOLPYRUVATE CARBOXYKINASE (ATP),True
Q5QUN4,Phosphoenolpyruvate carboxykinase (ATP),protein,283942,Idiomarina loihiensis (strain ATCC BAA-735 / DSM 15497 / L2-TR),Idiomarina loihiensis (strain ATCC BAA-735 / DSM 15497 / L2-TR),pckA,533,PTHR30031:SF0,PHOSPHOENOLPYRUVATE CARBOXYKINASE (ATP),True
Q5SLL5,Phosphoenolpyruvate carboxykinase (ATP),protein,300852,Thermus thermophilus (strain ATCC 27634 / DSM 579 / HB8),Thermus thermophilus (strain ATCC 27634 / DSM 579 / HB8),pckA,529,PTHR30031:SF0,PHOSPHOENOLPYRUVATE CARBOXYKINASE (ATP),True
Q5WDZ7,Phosphoenolpyruvate carboxykinase (ATP),protein,66692,Shouchella clausii (strain KSM-K16),Shouchella clausii (strain KSM-K16),pckA,527,PTHR30031:SF0,PHOSPHOENOLPYRUVATE CARBOXYKINASE (ATP),True
Q632S4,Phosphoenolpyruvate carboxykinase (ATP),protein,288681,Bacillus cereus (strain ZK / E33L),Bacillus cereus (strain ZK / E33L),pckA,528,PTHR30031:SF0,PHOSPHOENOLPYRUVATE CARBOXYKINASE (ATP),True
Q64MV4,Phosphoenolpyruvate carboxykinase (ATP),protein,295405,Bacteroides fragilis (strain YCH46),Bacteroides fragilis (strain YCH46),pckA,535,PTHR30031:SF0,PHOSPHOENOLPYRUVATE CARBOXYKINASE (ATP),True
Q65FV7,Phosphoenolpyruvate carboxykinase (ATP),protein,279010,Bacillus licheniformis (strain ATCC 14580 / DSM 13 / JCM 2505 / CCUG 7422 / NBRC 12200 / NCIMB 9375 / NCTC 10341 / NRRL NRS-1264 / Gibson 46),Bacillus licheniformis (strain ATCC 14580 / DSM 13 / JCM 2505 / CCUG 7422 / NBRC 12200 / NCIMB 9375 / NCTC 10341 / NRRL NRS-1264 / Gibson 46),pckA,527,PTHR30031:SF0,PHOSPHOENOLPYRUVATE CARBOXYKINASE (ATP),True
Q65Q60,Phosphoenolpyruvate carboxykinase (ATP),protein,221988,Mannheimia succiniciproducens (strain KCTC 0769BP / MBEL55E),Mannheimia succiniciproducens (strain KCTC 0769BP / MBEL55E),pckA,538,PTHR30031:SF0,PHOSPHOENOLPYRUVATE CARBOXYKINASE (ATP),True
Q664K7,Phosphoenolpyruvate carboxykinase (ATP),protein,273123,Yersinia pseudotuberculosis serotype I (strain IP32953),Yersinia pseudotuberculosis serotype I (strain IP32953),pckA,539,PTHR30031:SF0,PHOSPHOENOLPYRUVATE CARBOXYKINASE (ATP),True
Q6CZP5,Phosphoenolpyruvate carboxykinase (ATP),protein,218491,Pectobacterium atrosepticum (strain SCRI 1043 / ATCC BAA-672),Pectobacterium atrosepticum (strain SCRI 1043 / ATCC BAA-672),pckA,539,PTHR30031:SF0,PHOSPHOENOLPYRUVATE CARBOXYKINASE (ATP),True
Q6FRR0,Phosphoenolpyruvate carboxykinase (ATP),protein,284593,Candida glabrata (strain ATCC 2001 / BCRC 20586 / JCM 3761 / NBRC 0622 / NRRL Y-65 / CBS 138),Candida glabrata (strain ATCC 2001 / BCRC 20586 / JCM 3761 / NBRC 0622 / NRRL Y-65 / CBS 138) (Yeast),PCK1,544,PTHR30031:SF0,PHOSPHOENOLPYRUVATE CARBOXYKINASE (ATP),True
Q6G8E2,Phosphoenolpyruvate carboxykinase (ATP),protein,282459,Staphylococcus aureus (strain MSSA476),Staphylococcus aureus (strain MSSA476),pckA,530,PTHR30031:SF0,PHOSPHOENOLPYRUVATE CARBOXYKINASE (ATP),True
Q6GFR5,Phosphoenolpyruvate carboxykinase (ATP),protein,282458,Staphylococcus aureus (strain MRSA252),Staphylococcus aureus (strain MRSA252),pckA,530,PTHR30031:SF0,PHOSPHOENOLPYRUVATE CARBOXYKINASE (ATP),True
Q6HCB3,Phosphoenolpyruvate carboxykinase (ATP),protein,281309,Bacillus thuringiensis subsp. konkukian (strain 97-27),Bacillus thuringiensis subsp. konkukian (strain 97-27),pckA,528,PTHR30031:SF0,PHOSPHOENOLPYRUVATE CARBOXYKINASE (ATP),True
Q6LLS2,Phosphoenolpyruvate carboxykinase (ATP),protein,298386,Photobacterium profundum (strain SS9),Photobacterium profundum (strain SS9),pckA,530,PTHR30031:SF0,PHOSPHOENOLPYRUVATE CARBOXYKINASE (ATP),True
Q72GY7,Phosphoenolpyruvate carboxykinase (ATP),protein,262724,Thermus thermophilus (strain ATCC BAA-163 / DSM 7039 / HB27),Thermus thermophilus (strain ATCC BAA-163 / DSM 7039 / HB27),pckA,529,PTHR30031:SF0,PHOSPHOENOLPYRUVATE CARBOXYKINASE (ATP),True
Q72VT0,Phosphoenolpyruvate carboxykinase (ATP),protein,267671,Leptospira interrogans serogroup Icterohaemorrhagiae serovar copenhageni (strain Fiocruz L1-130),Leptospira interrogans serogroup Icterohaemorrhagiae serovar copenhageni (strain Fiocruz L1-130),pckA,530,PTHR30031:SF0,PHOSPHOENOLPYRUVATE CARBOXYKINASE (ATP),True
Q72YV4,Phosphoenolpyruvate carboxykinase (ATP),protein,222523,Bacillus cereus (strain ATCC 10987 / NRS 248),Bacillus cereus (strain ATCC 10987 / NRS 248),pckA,528,PTHR30031:SF0,PHOSPHOENOLPYRUVATE CARBOXYKINASE (ATP),True
Q753M0,Phosphoenolpyruvate carboxykinase (ATP),protein,284811,Eremothecium gossypii (strain ATCC 10895 / CBS 109.51 / FGSC 9923 / NRRL Y-1056),Eremothecium gossypii (strain ATCC 10895 / CBS 109.51 / FGSC 9923 / NRRL Y-1056) (Yeast),PCK1,541,PTHR30031:SF0,PHOSPHOENOLPYRUVATE CARBOXYKINASE (ATP),True
Q75JD5,Phosphoenolpyruvate carboxykinase (ATP),protein,44689,Dictyostelium discoideum,Dictyostelium discoideum (Social amoeba),pckA,562,PTHR30031:SF0,PHOSPHOENOLPYRUVATE CARBOXYKINASE (ATP),True
Q7MQ03,Phosphoenolpyruvate carboxykinase (ATP),protein,196600,Vibrio vulnificus (strain YJ016),Vibrio vulnificus (strain YJ016),pckA,542,PTHR30031:SF0,PHOSPHOENOLPYRUVATE CARBOXYKINASE (ATP),True
Q7MU78,Phosphoenolpyruvate carboxykinase (ATP),protein,242619,Porphyromonas gingivalis (strain ATCC BAA-308 / W83),Porphyromonas gingivalis (strain ATCC BAA-308 / W83),pckA,535,PTHR30031:SF0,PHOSPHOENOLPYRUVATE CARBOXYKINASE (ATP),True
Q7NA45,Phosphoenolpyruvate carboxykinase (ATP),protein,243265,Photorhabdus laumondii subsp. laumondii (strain DSM 15139 / CIP 105565 / TT01),Photorhabdus laumondii subsp. laumondii (strain DSM 15139 / CIP 105565 / TT01),pckA,539,PTHR30031:SF0,PHOSPHOENOLPYRUVATE CARBOXYKINASE (ATP),True
Q7RVS9,Phosphoenolpyruvate carboxykinase (ATP),protein,367110,Neurospora crassa (strain ATCC 24698 / 74-OR23-1A / CBS 708.71 / DSM 1257 / FGSC 987),Neurospora crassa (strain ATCC 24698 / 74-OR23-1A / CBS 708.71 / DSM 1257 / FGSC 987),acu-6,605,PTHR30031:SF0,PHOSPHOENOLPYRUVATE CARBOXYKINASE (ATP),True
Q7VLT3,Phosphoenolpyruvate carboxykinase (ATP),protein,233412,Haemophilus ducreyi (strain 35000HP / ATCC 700724),Haemophilus ducreyi (strain 35000HP / ATCC 700724),pckA,538,PTHR30031:SF0,PHOSPHOENOLPYRUVATE CARBOXYKINASE (ATP),True
Q816Q7,Phosphoenolpyruvate carboxykinase (ATP),protein,226900,Bacillus cereus (strain ATCC 14579 / DSM 31 / CCUG 7414 / JCM 2152 / NBRC 15305 / NCIMB 9373 / NCTC 2599 / NRRL B-3711),Bacillus cereus (strain ATCC 14579 / DSM 31 / CCUG 7414 / JCM 2152 / NBRC 15305 / NCIMB 9373 / NCTC 2599 / NRRL B-3711),pckA,528,PTHR30031:SF0,PHOSPHOENOLPYRUVATE CARBOXYKINASE (ATP),True
Q81KH8,Phosphoenolpyruvate carboxykinase (ATP),protein,1392,Bacillus anthracis,Bacillus anthracis,pckA,528,PTHR30031:SF0,PHOSPHOENOLPYRUVATE CARBOXYKINASE (ATP),True
Q83A19,Phosphoenolpyruvate carboxykinase (ATP),protein,227377,Coxiella burnetii (strain RSA 493 / Nine Mile phase I),Coxiella burnetii (strain RSA 493 / Nine Mile phase I),pckA,517,PTHR30031:SF0,PHOSPHOENOLPYRUVATE CARBOXYKINASE (ATP),True
Q83J96,Phosphoenolpyruvate carboxykinase (ATP),protein,623,Shigella flexneri,Shigella flexneri,pckA,540,PTHR30031:SF0,PHOSPHOENOLPYRUVATE CARBOXYKINASE (ATP),True
Q87TE1,Phosphoenolpyruvate carboxykinase (ATP),protein,223926,Vibrio parahaemolyticus serotype O3:K6 (strain RIMD 2210633),Vibrio parahaemolyticus serotype O3:K6 (strain RIMD 2210633),pckA,542,PTHR30031:SF0,PHOSPHOENOLPYRUVATE CARBOXYKINASE (ATP),True
Q88AZ4,Phosphoenolpyruvate carboxykinase (ATP),protein,223283,Pseudomonas syringae pv. tomato (strain ATCC BAA-871 / DC3000),Pseudomonas syringae pv. tomato (strain ATCC BAA-871 / DC3000),pckA,514,PTHR30031:SF0,PHOSPHOENOLPYRUVATE CARBOXYKINASE (ATP),True
Q89BK7,Phosphoenolpyruvate carboxykinase (ATP),protein,224911,Bradyrhizobium diazoefficiens (strain JCM 10833 / BCRC 13528 / IAM 13628 / NBRC 14792 / USDA 110),Bradyrhizobium diazoefficiens (strain JCM 10833 / BCRC 13528 / IAM 13628 / NBRC 14792 / USDA 110),pckA,538,PTHR30031:SF0,PHOSPHOENOLPYRUVATE CARBOXYKINASE (ATP),True
Q8A414,Phosphoenolpyruvate carboxykinase (ATP),protein,226186,Bacteroides thetaiotaomicron (strain ATCC 29148 / DSM 2079 / JCM 5827 / CCUG 10774 / NCTC 10582 / VPI-5482 / E50),Bacteroides thetaiotaomicron (strain ATCC 29148 / DSM 2079 / JCM 5827 / CCUG 10774 / NCTC 10582 / VPI-5482 / E50),pckA,535,PTHR30031:SF0,PHOSPHOENOLPYRUVATE CARBOXYKINASE (ATP),True
Q8CS25,Phosphoenolpyruvate carboxykinase (ATP),protein,176280,Staphylococcus epidermidis (strain ATCC 12228 / FDA PCI 1200),Staphylococcus epidermidis (strain ATCC 12228 / FDA PCI 1200),pckA,530,PTHR30031:SF0,PHOSPHOENOLPYRUVATE CARBOXYKINASE (ATP),True
Q8D1X9,Phosphoenolpyruvate carboxykinase (ATP),protein,36870,Wigglesworthia glossinidia brevipalpis,Wigglesworthia glossinidia brevipalpis,pckA,541,PTHR30031:SF0,PHOSPHOENOLPYRUVATE CARBOXYKINASE (ATP),True
Q8DDS6,Phosphoenolpyruvate carboxykinase (ATP),protein,216895,Vibrio vulnificus (strain CMCP6),Vibrio vulnificus (strain CMCP6),pckA,542,PTHR30031:SF0,PHOSPHOENOLPYRUVATE CARBOXYKINASE (ATP),True
Q8EKD3,Phosphoenolpyruvate carboxykinase (ATP),protein,211586,Shewanella oneidensis (strain ATCC 700550 / JCM 31522 / CIP 106686 / LMG 19005 / NCIMB 14063 / MR-1),Shewanella oneidensis (strain ATCC 700550 / JCM 31522 / CIP 106686 / LMG 19005 / NCIMB 14063 / MR-1),pckA,513,PTHR30031:SF0,PHOSPHOENOLPYRUVATE CARBOXYKINASE (ATP),True
Q8EP04,Phosphoenolpyruvate carboxykinase (ATP),protein,221109,Oceanobacillus iheyensis (strain DSM 14371 / CIP 107618 / JCM 11309 / KCTC 3954 / HTE831),Oceanobacillus iheyensis (strain DSM 14371 / CIP 107618 / JCM 11309 / KCTC 3954 / HTE831),pckA,527,PTHR30031:SF0,PHOSPHOENOLPYRUVATE CARBOXYKINASE (ATP),True
Q8F9E4,Phosphoenolpyruvate carboxykinase (ATP),protein,189518,Leptospira interrogans serogroup Icterohaemorrhagiae serovar Lai (strain 56601),Leptospira interrogans serogroup Icterohaemorrhagiae serovar Lai (strain 56601),pckA,530,PTHR30031:SF0,PHOSPHOENOLPYRUVATE CARBOXYKINASE (ATP),True
Q8FCU4,Phosphoenolpyruvate carboxykinase (ATP),protein,199310,Escherichia coli O6:H1 (strain CFT073 / ATCC 700928 / UPEC),Escherichia coli O6:H1 (strain CFT073 / ATCC 700928 / UPEC),pckA,540,PTHR30031:SF0,PHOSPHOENOLPYRUVATE CARBOXYKINASE (ATP),True
Q8FY05,Phosphoenolpyruvate carboxykinase (ATP),protein,204722,Brucella suis biovar 1 (strain 1330),Brucella suis biovar 1 (strain 1330),pckA,536,PTHR30031:SF0,PHOSPHOENOLPYRUVATE CARBOXYKINASE (ATP),True
Q8NVZ8,Phosphoenolpyruvate carboxykinase (ATP),protein,196620,Staphylococcus aureus (strain MW2),Staphylococcus aureus (strain MW2),pckA,530,PTHR30031:SF0,PHOSPHOENOLPYRUVATE CARBOXYKINASE (ATP),True
Q8R943,Phosphoenolpyruvate carboxykinase (ATP),protein,273068,Caldanaerobacter subterraneus subsp. tengcongensis (strain DSM 15242 / JCM 11007 / NBRC 100824 / MB4),Caldanaerobacter subterraneus subsp. tengcongensis (strain DSM 15242 / JCM 11007 / NBRC 100824 / MB4),pckA,521,PTHR30031:SF0,PHOSPHOENOLPYRUVATE CARBOXYKINASE (ATP),True
Q8REI2,Phosphoenolpyruvate carboxykinase (ATP),protein,190304,Fusobacterium nucleatum subsp. nucleatum (strain ATCC 25586 / DSM 15643 / BCRC 10681 / CIP 101130 / JCM 8532 / KCTC 2640 / LMG 13131 / VPI 4355),Fusobacterium nucleatum subsp. nucleatum (strain ATCC 25586 / DSM 15643 / BCRC 10681 / CIP 101130 / JCM 8532 / KCTC 2640 / LMG 13131 / VPI 4355),pckA,525,PTHR30031:SF0,PHOSPHOENOLPYRUVATE CARBOXYKINASE (ATP),True
Q8UJ94,Phosphoenolpyruvate carboxykinase (ATP),protein,176299,Agrobacterium fabrum (strain C58 / ATCC 33970),Agrobacterium fabrum (strain C58 / ATCC 33970),pckA,536,PTHR30031:SF0,PHOSPHOENOLPYRUVATE CARBOXYKINASE (ATP),True
Q8X733,Phosphoenolpyruvate carboxykinase (ATP),protein,83334,Escherichia coli O157:H7,Escherichia coli O157:H7,pckA,540,PTHR30031:SF0,PHOSPHOENOLPYRUVATE CARBOXYKINASE (ATP),True
Q8YE41,Phosphoenolpyruvate carboxykinase (ATP),protein,224914,Brucella melitensis biotype 1 (strain ATCC 23456 / CCUG 17765 / NCTC 10094 / 16M),Brucella melitensis biotype 1 (strain ATCC 23456 / CCUG 17765 / NCTC 10094 / 16M),pckA,536,PTHR30031:SF0,PHOSPHOENOLPYRUVATE CARBOXYKINASE (ATP),True
Q8Z216,Phosphoenolpyruvate carboxykinase (ATP),protein,90370,Salmonella typhi,Salmonella typhi,pckA,539,PTHR30031:SF0,PHOSPHOENOLPYRUVATE CARBOXYKINASE (ATP),True
Q8ZJG9,Phosphoenolpyruvate carboxykinase (ATP),protein,632,Yersinia pestis,Yersinia pestis,pckA,539,PTHR30031:SF0,PHOSPHOENOLPYRUVATE CARBOXYKINASE (ATP),True
Q96UL8,Phosphoenolpyruvate carboxykinase (ATP),protein,227321,Emericella nidulans (strain FGSC A4 / ATCC 38163 / CBS 112.46 / NRRL 194 / M139),Emericella nidulans (strain FGSC A4 / ATCC 38163 / CBS 112.46 / NRRL 194 / M139),acuF,600,PTHR30031:SF0,PHOSPHOENOLPYRUVATE CARBOXYKINASE (ATP),True
Q98CL7,Phosphoenolpyruvate carboxykinase (ATP),protein,266835,Mesorhizobium japonicum (strain LMG 29417 / CECT 9101 / MAFF 303099),Mesorhizobium japonicum (strain LMG 29417 / CECT 9101 / MAFF 303099),pckA,536,PTHR30031:SF0,PHOSPHOENOLPYRUVATE CARBOXYKINASE (ATP),True
Q9CKR4,Phosphoenolpyruvate carboxykinase (ATP),protein,272843,Pasteurella multocida (strain Pm70),Pasteurella multocida (strain Pm70),pckA,538,PTHR30031:SF0,PHOSPHOENOLPYRUVATE CARBOXYKINASE (ATP),True
Q9HTZ7,Phosphoenolpyruvate carboxykinase (ATP),protein,208964,Pseudomonas aeruginosa (strain ATCC 15692 / DSM 22644 / CIP 104116 / JCM 14847 / LMG 12228 / 1C / PRS 101 / PAO1),Pseudomonas aeruginosa (strain ATCC 15692 / DSM 22644 / CIP 104116 / JCM 14847 / LMG 12228 / 1C / PRS 101 / PAO1),pckA,513,PTHR30031:SF0,PHOSPHOENOLPYRUVATE CARBOXYKINASE (ATP),True
Q9K7Q7,Phosphoenolpyruvate carboxykinase (ATP),protein,272558,Halalkalibacterium halodurans (strain ATCC BAA-125 / DSM 18197 / FERM 7344 / JCM 9153 / C-125),Halalkalibacterium halodurans (strain ATCC BAA-125 / DSM 18197 / FERM 7344 / JCM 9153 / C-125),pckA,527,PTHR30031:SF0,PHOSPHOENOLPYRUVATE CARBOXYKINASE (ATP),True
Q9KNK0,Phosphoenolpyruvate carboxykinase (ATP),protein,243277,Vibrio cholerae serotype O1 (strain ATCC 39315 / El Tor Inaba N16961),Vibrio cholerae serotype O1 (strain ATCC 39315 / El Tor Inaba N16961),pckA,542,PTHR30031:SF0,PHOSPHOENOLPYRUVATE CARBOXYKINASE (ATP),True
Q9PP01,Phosphoenolpyruvate carboxykinase (ATP),protein,192222,Campylobacter jejuni subsp. jejuni serotype O:2 (strain ATCC 700819 / NCTC 11168),Campylobacter jejuni subsp. jejuni serotype O:2 (strain ATCC 700819 / NCTC 11168),pckA,524,PTHR30031:SF0,PHOSPHOENOLPYRUVATE CARBOXYKINASE (ATP),True
Q9RVP6,Phosphoenolpyruvate carboxykinase (ATP),protein,243230,Deinococcus radiodurans (strain ATCC 13939 / DSM 20539 / JCM 16871 / CCUG 27074 / LMG 4051 / NBRC 15346 / NCIMB 9279 / VKM B-1422 / R1),Deinococcus radiodurans (strain ATCC 13939 / DSM 20539 / JCM 16871 / CCUG 27074 / LMG 4051 / NBRC 15346 / NCIMB 9279 / VKM B-1422 / R1),pckA,466,PTHR30031:SF0,PHOSPHOENOLPYRUVATE CARBOXYKINASE (ATP),True
Q9SLZ0,Phosphoenolpyruvate carboxykinase (ATP),protein,4577,Zea mays,Zea mays (Maize),,666,PTHR30031:SF0,PHOSPHOENOLPYRUVATE CARBOXYKINASE (ATP),True
Q9T074,Phosphoenolpyruvate carboxykinase (ATP) 1,protein,3702,Arabidopsis thaliana,Arabidopsis thaliana (Mouse-ear cress),PCK1,671,PTHR30031:SF0,PHOSPHOENOLPYRUVATE CARBOXYKINASE (ATP),True
Q9XFA2,Phosphoenolpyruvate carboxykinase (ATP) 2,protein,37563,Urochloa panicoides,Urochloa panicoides (Panic liverseed grass),PCK2,626,PTHR30031:SF0,PHOSPHOENOLPYRUVATE CARBOXYKINASE (ATP),True
Q9ZNH4,Phosphoenolpyruvate carboxykinase (ATP),protein,258594,Rhodopseudomonas palustris (strain ATCC BAA-98 / CGA009),Rhodopseudomonas palustris (strain ATCC BAA-98 / CGA009),pckA,537,PTHR30031:SF0,PHOSPHOENOLPYRUVATE CARBOXYKINASE (ATP),True
