id,name,entry_type,source_tax_id,source_tax_name,full_tax_name,gene,length,subfamily,subfamily_name,in_alphafold
P59320,Acetylornithine aminotransferase,protein,211586,Shewanella oneidensis (strain ATCC 700550 / JCM 31522 / CIP 106686 / LMG 19005 / NCIMB 14063 / MR-1),Shewanella oneidensis (strain ATCC 700550 / JCM 31522 / CIP 106686 / LMG 19005 / NCIMB 14063 / MR-1),argD,405,PTHR11986:SF113,SUCCINYLORNITHINE TRANSAMINASE,True
P59321,Acetylornithine/succinyldiaminopimelate aminotransferase,protein,623,Shigella flexneri,Shigella flexneri,argD,406,PTHR11986:SF122,ACETYLORNITHINE_SUCCINYLDIAMINOPIMELATE AMINOTRANSFERASE,True
P59322,Acetylornithine aminotransferase,protein,197221,Thermosynechococcus vestitus (strain NIES-2133 / IAM M-273 / BP-1),Thermosynechococcus vestitus (strain NIES-2133 / IAM M-273 / BP-1),argD,412,PTHR11986:SF79,"ACETYLORNITHINE AMINOTRANSFERASE, MITOCHONDRIAL",True
P59323,Acetylornithine aminotransferase,protein,216895,Vibrio vulnificus (strain CMCP6),Vibrio vulnificus (strain CMCP6),argD,403,PTHR11986:SF113,SUCCINYLORNITHINE TRANSAMINASE,True
P59324,Acetylornithine/succinyldiaminopimelate aminotransferase,protein,632,Yersinia pestis,Yersinia pestis,argD,405,PTHR11986:SF122,ACETYLORNITHINE_SUCCINYLDIAMINOPIMELATE AMINOTRANSFERASE,True
P60295,Ornithine aminotransferase 1,protein,158878,Staphylococcus aureus (strain Mu50 / ATCC 700699),Staphylococcus aureus (strain Mu50 / ATCC 700699),rocD1,394,PTHR11986:SF18,"ORNITHINE AMINOTRANSFERASE, MITOCHONDRIAL",True
P60296,Ornithine aminotransferase 1,protein,158879,Staphylococcus aureus (strain N315),Staphylococcus aureus (strain N315),rocD1,394,PTHR11986:SF18,"ORNITHINE AMINOTRANSFERASE, MITOCHONDRIAL",True
P60297,Ornithine aminotransferase 2,protein,158878,Staphylococcus aureus (strain Mu50 / ATCC 700699),Staphylococcus aureus (strain Mu50 / ATCC 700699),rocD2,396,PTHR11986:SF18,"ORNITHINE AMINOTRANSFERASE, MITOCHONDRIAL",True
P60298,Ornithine aminotransferase 2,protein,158879,Staphylococcus aureus (strain N315),Staphylococcus aureus (strain N315),rocD2,396,PTHR11986:SF18,"ORNITHINE AMINOTRANSFERASE, MITOCHONDRIAL",True
P60299,Ornithine aminotransferase 2,protein,196620,Staphylococcus aureus (strain MW2),Staphylococcus aureus (strain MW2),rocD2,396,PTHR11986:SF18,"ORNITHINE AMINOTRANSFERASE, MITOCHONDRIAL",True
P63505,4-aminobutyrate aminotransferase,protein,233413,Mycobacterium bovis (strain ATCC BAA-935 / AF2122/97),Mycobacterium bovis (strain ATCC BAA-935 / AF2122/97),gabT,449,,,True
P63566,Acetylornithine aminotransferase,protein,224914,Brucella melitensis biotype 1 (strain ATCC 23456 / CCUG 17765 / NCTC 10094 / 16M),Brucella melitensis biotype 1 (strain ATCC 23456 / CCUG 17765 / NCTC 10094 / 16M),argD,403,PTHR11986:SF113,SUCCINYLORNITHINE TRANSAMINASE,True
P63567,Acetylornithine aminotransferase,protein,204722,Brucella suis biovar 1 (strain 1330),Brucella suis biovar 1 (strain 1330),argD,403,PTHR11986:SF113,SUCCINYLORNITHINE TRANSAMINASE,True
P63569,Acetylornithine aminotransferase,protein,233413,Mycobacterium bovis (strain ATCC BAA-935 / AF2122/97),Mycobacterium bovis (strain ATCC BAA-935 / AF2122/97),argD,400,PTHR11986:SF79,"ACETYLORNITHINE AMINOTRANSFERASE, MITOCHONDRIAL",True
P73133,Acetylornithine aminotransferase,protein,1111708,Synechocystis sp. (strain ATCC 27184 / PCC 6803 / Kazusa),Synechocystis sp. (strain ATCC 27184 / PCC 6803 / Kazusa),argD,429,PTHR11986:SF79,"ACETYLORNITHINE AMINOTRANSFERASE, MITOCHONDRIAL",True
P77581,Succinylornithine transaminase,protein,83333,Escherichia coli (strain K12),Escherichia coli (strain K12),astC,406,PTHR11986:SF113,SUCCINYLORNITHINE TRANSAMINASE,True
P94427,Probable 4-aminobutyrate aminotransferase,protein,224308,Bacillus subtilis (strain 168),Bacillus subtilis (strain 168),gabT,436,PTHR11986:SF58,LEUCINE_METHIONINE RACEMASE,True
P9WPZ6,Acetylornithine aminotransferase,protein,83331,Mycobacterium tuberculosis (strain CDC 1551 / Oshkosh),Mycobacterium tuberculosis (strain CDC 1551 / Oshkosh),argD,400,PTHR11986:SF79,"ACETYLORNITHINE AMINOTRANSFERASE, MITOCHONDRIAL",True
P9WPZ7,Acetylornithine aminotransferase,protein,83332,Mycobacterium tuberculosis (strain ATCC 25618 / H37Rv),Mycobacterium tuberculosis (strain ATCC 25618 / H37Rv),argD,400,PTHR11986:SF79,"ACETYLORNITHINE AMINOTRANSFERASE, MITOCHONDRIAL",True
P9WQ78,4-aminobutyrate aminotransferase,protein,83331,Mycobacterium tuberculosis (strain CDC 1551 / Oshkosh),Mycobacterium tuberculosis (strain CDC 1551 / Oshkosh),gabT,449,,,True
P9WQ79,4-aminobutyrate aminotransferase,protein,83332,Mycobacterium tuberculosis (strain ATCC 25618 / H37Rv),Mycobacterium tuberculosis (strain ATCC 25618 / H37Rv),gabT,449,,,True
Q07805,Ornithine aminotransferase,protein,5836,Plasmodium falciparum (isolate CDC / Honduras),Plasmodium falciparum (isolate CDC / Honduras),OAT,414,PTHR11986:SF18,"ORNITHINE AMINOTRANSFERASE, MITOCHONDRIAL",True
Q07907,Acetylornithine aminotransferase,protein,1422,Geobacillus stearothermophilus,Geobacillus stearothermophilus,argD,385,PTHR11986:SF79,"ACETYLORNITHINE AMINOTRANSFERASE, MITOCHONDRIAL",True
Q0T0J2,Putrescine aminotransferase,protein,373384,Shigella flexneri serotype 5b (strain 8401),Shigella flexneri serotype 5b (strain 8401),patA,459,PTHR11986:SF112,PUTRESCINE AMINOTRANSFERASE,True
Q0TD34,Putrescine aminotransferase,protein,362663,Escherichia coli O6:K15:H31 (strain 536 / UPEC),Escherichia coli O6:K15:H31 (strain 536 / UPEC),patA,459,PTHR11986:SF112,PUTRESCINE AMINOTRANSFERASE,True
Q0TH82,Succinylornithine transaminase,protein,362663,Escherichia coli O6:K15:H31 (strain 536 / UPEC),Escherichia coli O6:K15:H31 (strain 536 / UPEC),astC,406,PTHR11986:SF113,SUCCINYLORNITHINE TRANSAMINASE,True
Q10174,Uncharacterized aminotransferase C27F1.05c,protein,284812,Schizosaccharomyces pombe (strain 972 / ATCC 24843),Schizosaccharomyces pombe (strain 972 / ATCC 24843) (Fission yeast),SPAC27F1.05c,484,PTHR11986:SF79,"ACETYLORNITHINE AMINOTRANSFERASE, MITOCHONDRIAL",True
Q10G56,"Ornithine aminotransferase, mitochondrial",protein,39947,Oryza sativa subsp. japonica,Oryza sativa subsp. japonica (Rice),OAT,473,PTHR11986:SF18,"ORNITHINE AMINOTRANSFERASE, MITOCHONDRIAL",True
Q18040,"Probable ornithine aminotransferase, mitochondrial",protein,6239,Caenorhabditis elegans,Caenorhabditis elegans,oatr-1,422,PTHR11986:SF18,"ORNITHINE AMINOTRANSFERASE, MITOCHONDRIAL",True
Q1C8B1,Succinylornithine transaminase,protein,360102,Yersinia pestis bv. Antiqua (strain Antiqua),Yersinia pestis bv. Antiqua (strain Antiqua),astC,414,PTHR11986:SF113,SUCCINYLORNITHINE TRANSAMINASE,True
Q1R6Q7,Putrescine aminotransferase,protein,364106,Escherichia coli (strain UTI89 / UPEC),Escherichia coli (strain UTI89 / UPEC),patA,459,PTHR11986:SF112,PUTRESCINE AMINOTRANSFERASE,True
Q1RB45,Succinylornithine transaminase,protein,364106,Escherichia coli (strain UTI89 / UPEC),Escherichia coli (strain UTI89 / UPEC),astC,406,PTHR11986:SF113,SUCCINYLORNITHINE TRANSAMINASE,True
Q31WW1,Putrescine aminotransferase,protein,300268,Shigella boydii serotype 4 (strain Sb227),Shigella boydii serotype 4 (strain Sb227),patA,459,PTHR11986:SF112,PUTRESCINE AMINOTRANSFERASE,True
Q321P0,Succinylornithine transaminase,protein,300268,Shigella boydii serotype 4 (strain Sb227),Shigella boydii serotype 4 (strain Sb227),astC,406,PTHR11986:SF113,SUCCINYLORNITHINE TRANSAMINASE,True
Q3YXH0,Putrescine aminotransferase,protein,300269,Shigella sonnei (strain Ss046),Shigella sonnei (strain Ss046),patA,459,PTHR11986:SF112,PUTRESCINE AMINOTRANSFERASE,True
Q3Z295,Succinylornithine transaminase,protein,300269,Shigella sonnei (strain Ss046),Shigella sonnei (strain Ss046),astC,406,PTHR11986:SF113,SUCCINYLORNITHINE TRANSAMINASE,True
Q3ZCF5,"Ornithine aminotransferase, mitochondrial",protein,9913,Bos taurus,Bos taurus (Bovine),OAT,439,PTHR11986:SF18,"ORNITHINE AMINOTRANSFERASE, MITOCHONDRIAL",True
Q49W96,Ornithine aminotransferase 2,protein,342451,Staphylococcus saprophyticus subsp. saprophyticus (strain ATCC 15305 / DSM 20229 / NCIMB 8711 / NCTC 7292 / S-41),Staphylococcus saprophyticus subsp. saprophyticus (strain ATCC 15305 / DSM 20229 / NCIMB 8711 / NCTC 7292 / S-41),rocD2,396,PTHR11986:SF18,"ORNITHINE AMINOTRANSFERASE, MITOCHONDRIAL",True
Q4A0N2,Ornithine aminotransferase 1,protein,342451,Staphylococcus saprophyticus subsp. saprophyticus (strain ATCC 15305 / DSM 20229 / NCIMB 8711 / NCTC 7292 / S-41),Staphylococcus saprophyticus subsp. saprophyticus (strain ATCC 15305 / DSM 20229 / NCIMB 8711 / NCTC 7292 / S-41),rocD1,394,PTHR11986:SF18,"ORNITHINE AMINOTRANSFERASE, MITOCHONDRIAL",True
Q4JAP8,[LysW]-aminoadipate semialdehyde/glutamate semialdehyde transaminase,protein,330779,Sulfolobus acidocaldarius (strain ATCC 33909 / DSM 639 / JCM 8929 / NBRC 15157 / NCIMB 11770),Sulfolobus acidocaldarius (strain ATCC 33909 / DSM 639 / JCM 8929 / NBRC 15157 / NCIMB 11770),lysJ,387,PTHR11986:SF79,"ACETYLORNITHINE AMINOTRANSFERASE, MITOCHONDRIAL",True
Q4XWV5,Ornithine aminotransferase,protein,31271,Plasmodium chabaudi chabaudi,Plasmodium chabaudi chabaudi,OAT,414,PTHR11986:SF18,"ORNITHINE AMINOTRANSFERASE, MITOCHONDRIAL",True
Q54JP5,Probable ornithine aminotransferase,protein,44689,Dictyostelium discoideum,Dictyostelium discoideum (Social amoeba),oatA,416,PTHR11986:SF18,"ORNITHINE AMINOTRANSFERASE, MITOCHONDRIAL",True
Q55DT8,"Probable acetylornithine aminotransferase, mitochondrial",protein,44689,Dictyostelium discoideum,Dictyostelium discoideum (Social amoeba),argD,453,PTHR11986:SF79,"ACETYLORNITHINE AMINOTRANSFERASE, MITOCHONDRIAL",True
Q57JP1,Putrescine aminotransferase,protein,321314,Salmonella choleraesuis (strain SC-B67),Salmonella choleraesuis (strain SC-B67),patA,459,PTHR11986:SF112,PUTRESCINE AMINOTRANSFERASE,True
Q57PX9,Succinylornithine transaminase,protein,321314,Salmonella choleraesuis (strain SC-B67),Salmonella choleraesuis (strain SC-B67),astC,408,PTHR11986:SF113,SUCCINYLORNITHINE TRANSAMINASE,True
Q58131,Acetylornithine aminotransferase,protein,243232,Methanocaldococcus jannaschii (strain ATCC 43067 / DSM 2661 / JAL-1 / JCM 10045 / NBRC 100440),Methanocaldococcus jannaschii (strain ATCC 43067 / DSM 2661 / JAL-1 / JCM 10045 / NBRC 100440),argD,398,PTHR11986:SF79,"ACETYLORNITHINE AMINOTRANSFERASE, MITOCHONDRIAL",True
Q59282,Acetylornithine aminotransferase,protein,196627,Corynebacterium glutamicum (strain ATCC 13032 / DSM 20300 / JCM 1318 / BCRC 11384 / CCUG 27702 / LMG 3730 / NBRC 12168 / NCIMB 10025 / NRRL B-2784 / 534),Corynebacterium glutamicum (strain ATCC 13032 / DSM 20300 / JCM 1318 / BCRC 11384 / CCUG 27702 / LMG 3730 / NBRC 12168 / NCIMB 10025 / NRRL B-2784 / 534),argD,391,PTHR11986:SF79,"ACETYLORNITHINE AMINOTRANSFERASE, MITOCHONDRIAL",True
Q59928,Acetylornithine aminotransferase,protein,210007,Streptococcus mutans serotype c (strain ATCC 700610 / UA159),Streptococcus mutans serotype c (strain ATCC 700610 / UA159),argD,379,PTHR11986:SF79,"ACETYLORNITHINE AMINOTRANSFERASE, MITOCHONDRIAL",True
Q5HHC8,Ornithine aminotransferase 2,protein,93062,Staphylococcus aureus (strain COL),Staphylococcus aureus (strain COL),rocD2,396,PTHR11986:SF18,"ORNITHINE AMINOTRANSFERASE, MITOCHONDRIAL",True
Q5HJI8,Ornithine aminotransferase 1,protein,93062,Staphylococcus aureus (strain COL),Staphylococcus aureus (strain COL),rocD1,394,PTHR11986:SF18,"ORNITHINE AMINOTRANSFERASE, MITOCHONDRIAL",True
Q5HP24,Acetylornithine aminotransferase,protein,176279,Staphylococcus epidermidis (strain ATCC 35984 / DSM 28319 / BCRC 17069 / CCUG 31568 / BM 3577 / RP62A),Staphylococcus epidermidis (strain ATCC 35984 / DSM 28319 / BCRC 17069 / CCUG 31568 / BM 3577 / RP62A),argD,375,PTHR11986:SF79,"ACETYLORNITHINE AMINOTRANSFERASE, MITOCHONDRIAL",True
Q5HQK4,Ornithine aminotransferase,protein,176279,Staphylococcus epidermidis (strain ATCC 35984 / DSM 28319 / BCRC 17069 / CCUG 31568 / BM 3577 / RP62A),Staphylococcus epidermidis (strain ATCC 35984 / DSM 28319 / BCRC 17069 / CCUG 31568 / BM 3577 / RP62A),rocD,396,PTHR11986:SF18,"ORNITHINE AMINOTRANSFERASE, MITOCHONDRIAL",True
Q5JEW1,Ornithine aminotransferase,protein,69014,Thermococcus kodakarensis (strain ATCC BAA-918 / JCM 12380 / KOD1),Thermococcus kodakarensis (strain ATCC BAA-918 / JCM 12380 / KOD1),TK2101,445,PTHR11986:SF58,LEUCINE_METHIONINE RACEMASE,True
Q5JFW3,Putative [LysW]-aminoadipate semialdehyde/glutamate semialdehyde transaminase,protein,69014,Thermococcus kodakarensis (strain ATCC BAA-918 / JCM 12380 / KOD1),Thermococcus kodakarensis (strain ATCC BAA-918 / JCM 12380 / KOD1),lysJ,362,PTHR11986:SF79,"ACETYLORNITHINE AMINOTRANSFERASE, MITOCHONDRIAL",True
Q5JGG6,Leucine/methionine racemase,protein,69014,Thermococcus kodakarensis (strain ATCC BAA-918 / JCM 12380 / KOD1),Thermococcus kodakarensis (strain ATCC BAA-918 / JCM 12380 / KOD1),TK1211,443,PTHR11986:SF58,LEUCINE_METHIONINE RACEMASE,True
Q5PC95,Putrescine aminotransferase,protein,295319,Salmonella paratyphi A (strain ATCC 9150 / SARB42),Salmonella paratyphi A (strain ATCC 9150 / SARB42),patA,459,PTHR11986:SF112,PUTRESCINE AMINOTRANSFERASE,True
Q5PHC8,Succinylornithine transaminase,protein,295319,Salmonella paratyphi A (strain ATCC 9150 / SARB42),Salmonella paratyphi A (strain ATCC 9150 / SARB42),astC,408,PTHR11986:SF113,SUCCINYLORNITHINE TRANSAMINASE,True
Q5SHH5,[LysW]-aminoadipate semialdehyde transaminase,protein,300852,Thermus thermophilus (strain ATCC 27634 / DSM 579 / HB8),Thermus thermophilus (strain ATCC 27634 / DSM 579 / HB8),lysJ,395,PTHR11986:SF79,"ACETYLORNITHINE AMINOTRANSFERASE, MITOCHONDRIAL",True
Q5W267,Aminotransferase PigE,protein,104623,Serratia sp. (strain ATCC 39006),Serratia sp. (strain ATCC 39006),pigE,853,PTHR11986:SF121,BLR3010 PROTEIN,True
Q66B21,Succinylornithine transaminase,protein,273123,Yersinia pseudotuberculosis serotype I (strain IP32953),Yersinia pseudotuberculosis serotype I (strain IP32953),astC,414,PTHR11986:SF113,SUCCINYLORNITHINE TRANSAMINASE,True
Q6BUP9,"Acetylornithine aminotransferase, mitochondrial",protein,284592,Debaryomyces hansenii (strain ATCC 36239 / CBS 767 / BCRC 21394 / JCM 1990 / NBRC 0083 / IGC 2968),Debaryomyces hansenii (strain ATCC 36239 / CBS 767 / BCRC 21394 / JCM 1990 / NBRC 0083 / IGC 2968) (Yeast),ARG8,466,PTHR11986:SF79,"ACETYLORNITHINE AMINOTRANSFERASE, MITOCHONDRIAL",True
Q6C846,"Acetylornithine aminotransferase, mitochondrial",protein,284591,Yarrowia lipolytica (strain CLIB 122 / E 150),Yarrowia lipolytica (strain CLIB 122 / E 150) (Yeast),ARG8,411,PTHR11986:SF79,"ACETYLORNITHINE AMINOTRANSFERASE, MITOCHONDRIAL",True
Q6CWC1,Ornithine aminotransferase,protein,284590,Kluyveromyces lactis (strain ATCC 8585 / CBS 2359 / DSM 70799 / NBRC 1267 / NRRL Y-1140 / WM37),Kluyveromyces lactis (strain ATCC 8585 / CBS 2359 / DSM 70799 / NBRC 1267 / NRRL Y-1140 / WM37) (Yeast),CAR2,437,PTHR11986:SF18,"ORNITHINE AMINOTRANSFERASE, MITOCHONDRIAL",True
Q6D6Y6,Putrescine aminotransferase,protein,218491,Pectobacterium atrosepticum (strain SCRI 1043 / ATCC BAA-672),Pectobacterium atrosepticum (strain SCRI 1043 / ATCC BAA-672),patA,468,PTHR11986:SF112,PUTRESCINE AMINOTRANSFERASE,True
Q6FXA4,"Acetylornithine aminotransferase, mitochondrial",protein,284593,Candida glabrata (strain ATCC 2001 / BCRC 20586 / JCM 3761 / NBRC 0622 / NRRL Y-65 / CBS 138),Candida glabrata (strain ATCC 2001 / BCRC 20586 / JCM 3761 / NBRC 0622 / NRRL Y-65 / CBS 138) (Yeast),ARG8,427,PTHR11986:SF79,"ACETYLORNITHINE AMINOTRANSFERASE, MITOCHONDRIAL",True
Q6GAW9,Ornithine aminotransferase 2,protein,282459,Staphylococcus aureus (strain MSSA476),Staphylococcus aureus (strain MSSA476),rocD2,396,PTHR11986:SF18,"ORNITHINE AMINOTRANSFERASE, MITOCHONDRIAL",True
Q6GCU1,Ornithine aminotransferase 1,protein,282459,Staphylococcus aureus (strain MSSA476),Staphylococcus aureus (strain MSSA476),rocD1,394,PTHR11986:SF18,"ORNITHINE AMINOTRANSFERASE, MITOCHONDRIAL",True
Q6GID1,Ornithine aminotransferase 2,protein,282458,Staphylococcus aureus (strain MRSA252),Staphylococcus aureus (strain MRSA252),rocD2,396,PTHR11986:SF18,"ORNITHINE AMINOTRANSFERASE, MITOCHONDRIAL",True
Q6GKC1,Ornithine aminotransferase 1,protein,282458,Staphylococcus aureus (strain MRSA252),Staphylococcus aureus (strain MRSA252),rocD1,394,PTHR11986:SF18,"ORNITHINE AMINOTRANSFERASE, MITOCHONDRIAL",True
Q6LFH8,Ornithine aminotransferase,protein,36329,Plasmodium falciparum (isolate 3D7),Plasmodium falciparum (isolate 3D7),OAT,414,PTHR11986:SF18,"ORNITHINE AMINOTRANSFERASE, MITOCHONDRIAL",True
Q71Z79,Acetylornithine aminotransferase,protein,265669,Listeria monocytogenes serotype 4b (strain F2365),Listeria monocytogenes serotype 4b (strain F2365),argD,386,PTHR11986:SF79,"ACETYLORNITHINE AMINOTRANSFERASE, MITOCHONDRIAL",True
Q72RH8,Acetylornithine aminotransferase,protein,267671,Leptospira interrogans serogroup Icterohaemorrhagiae serovar copenhageni (strain Fiocruz L1-130),Leptospira interrogans serogroup Icterohaemorrhagiae serovar copenhageni (strain Fiocruz L1-130),argD,406,PTHR11986:SF79,"ACETYLORNITHINE AMINOTRANSFERASE, MITOCHONDRIAL",True
Q75AW1,"Acetylornithine aminotransferase, mitochondrial",protein,284811,Eremothecium gossypii (strain ATCC 10895 / CBS 109.51 / FGSC 9923 / NRRL Y-1056),Eremothecium gossypii (strain ATCC 10895 / CBS 109.51 / FGSC 9923 / NRRL Y-1056) (Yeast),ARG8,423,PTHR11986:SF79,"ACETYLORNITHINE AMINOTRANSFERASE, MITOCHONDRIAL",True
Q7MAE6,Acetylornithine aminotransferase,protein,273121,Wolinella succinogenes (strain ATCC 29543 / DSM 1740 / CCUG 13145 / JCM 31913 / LMG 7466 / NCTC 11488 / FDC 602W),Wolinella succinogenes (strain ATCC 29543 / DSM 1740 / CCUG 13145 / JCM 31913 / LMG 7466 / NCTC 11488 / FDC 602W),argD,393,PTHR11986:SF79,"ACETYLORNITHINE AMINOTRANSFERASE, MITOCHONDRIAL",True
Q7MH19,Acetylornithine aminotransferase,protein,196600,Vibrio vulnificus (strain YJ016),Vibrio vulnificus (strain YJ016),argD,403,PTHR11986:SF113,SUCCINYLORNITHINE TRANSAMINASE,True
Q7N2G7,Succinylornithine transaminase,protein,243265,Photorhabdus laumondii subsp. laumondii (strain DSM 15139 / CIP 105565 / TT01),Photorhabdus laumondii subsp. laumondii (strain DSM 15139 / CIP 105565 / TT01),astC,402,PTHR11986:SF113,SUCCINYLORNITHINE TRANSAMINASE,True
Q7N9E5,Acetylornithine/succinyldiaminopimelate aminotransferase,protein,243265,Photorhabdus laumondii subsp. laumondii (strain DSM 15139 / CIP 105565 / TT01),Photorhabdus laumondii subsp. laumondii (strain DSM 15139 / CIP 105565 / TT01),argD,403,PTHR11986:SF122,ACETYLORNITHINE_SUCCINYLDIAMINOPIMELATE AMINOTRANSFERASE,True
Q7NN66,Acetylornithine aminotransferase,protein,251221,Gloeobacter violaceus (strain ATCC 29082 / PCC 7421),Gloeobacter violaceus (strain ATCC 29082 / PCC 7421),argD,400,PTHR11986:SF79,"ACETYLORNITHINE AMINOTRANSFERASE, MITOCHONDRIAL",True
Q7RT90,Ornithine aminotransferase,protein,73239,Plasmodium yoelii yoelii,Plasmodium yoelii yoelii,OAT,414,PTHR11986:SF18,"ORNITHINE AMINOTRANSFERASE, MITOCHONDRIAL",True
Q7SI94,[LysW]-aminoadipate semialdehyde/glutamate semialdehyde transaminase,protein,273057,Saccharolobus solfataricus (strain ATCC 35092 / DSM 1617 / JCM 11322 / P2),Saccharolobus solfataricus (strain ATCC 35092 / DSM 1617 / JCM 11322 / P2),lysJ,388,PTHR11986:SF79,"ACETYLORNITHINE AMINOTRANSFERASE, MITOCHONDRIAL",True
Q7U5R5,Acetylornithine aminotransferase,protein,84588,Parasynechococcus marenigrum (strain WH8102),Parasynechococcus marenigrum (strain WH8102),argD,420,PTHR11986:SF79,"ACETYLORNITHINE AMINOTRANSFERASE, MITOCHONDRIAL",True
Q7V0G0,Acetylornithine aminotransferase,protein,59919,Prochlorococcus marinus subsp. pastoris (strain CCMP1986 / NIES-2087 / MED4),Prochlorococcus marinus subsp. pastoris (strain CCMP1986 / NIES-2087 / MED4),argD,415,PTHR11986:SF79,"ACETYLORNITHINE AMINOTRANSFERASE, MITOCHONDRIAL",True
Q7V8L1,Acetylornithine aminotransferase,protein,74547,Prochlorococcus marinus (strain MIT 9313),Prochlorococcus marinus (strain MIT 9313),argD,418,PTHR11986:SF79,"ACETYLORNITHINE AMINOTRANSFERASE, MITOCHONDRIAL",True
Q7VAS9,Acetylornithine aminotransferase,protein,167539,Prochlorococcus marinus (strain SARG / CCMP1375 / SS120),Prochlorococcus marinus (strain SARG / CCMP1375 / SS120),argD,419,PTHR11986:SF79,"ACETYLORNITHINE AMINOTRANSFERASE, MITOCHONDRIAL",True
Q7VMS5,Acetylornithine aminotransferase,protein,233412,Haemophilus ducreyi (strain 35000HP / ATCC 700724),Haemophilus ducreyi (strain 35000HP / ATCC 700724),argD,393,PTHR11986:SF79,"ACETYLORNITHINE AMINOTRANSFERASE, MITOCHONDRIAL",True
Q7VSA0,Ornithine aminotransferase,protein,257313,Bordetella pertussis (strain Tohama I / ATCC BAA-589 / NCTC 13251),Bordetella pertussis (strain Tohama I / ATCC BAA-589 / NCTC 13251),rocD,411,PTHR11986:SF18,"ORNITHINE AMINOTRANSFERASE, MITOCHONDRIAL",True
Q7VSH3,Acetylornithine aminotransferase 2,protein,257313,Bordetella pertussis (strain Tohama I / ATCC BAA-589 / NCTC 13251),Bordetella pertussis (strain Tohama I / ATCC BAA-589 / NCTC 13251),argD2,396,PTHR11986:SF79,"ACETYLORNITHINE AMINOTRANSFERASE, MITOCHONDRIAL",True
Q7VTJ7,Acetylornithine aminotransferase 1,protein,257313,Bordetella pertussis (strain Tohama I / ATCC BAA-589 / NCTC 13251),Bordetella pertussis (strain Tohama I / ATCC BAA-589 / NCTC 13251),argD1,393,PTHR11986:SF79,"ACETYLORNITHINE AMINOTRANSFERASE, MITOCHONDRIAL",True
Q7W1E4,Ornithine aminotransferase,protein,257311,Bordetella parapertussis (strain 12822 / ATCC BAA-587 / NCTC 13253),Bordetella parapertussis (strain 12822 / ATCC BAA-587 / NCTC 13253),rocD,411,PTHR11986:SF18,"ORNITHINE AMINOTRANSFERASE, MITOCHONDRIAL",True
Q7W2N9,Acetylornithine aminotransferase 2,protein,257311,Bordetella parapertussis (strain 12822 / ATCC BAA-587 / NCTC 13253),Bordetella parapertussis (strain 12822 / ATCC BAA-587 / NCTC 13253),argD2,396,PTHR11986:SF79,"ACETYLORNITHINE AMINOTRANSFERASE, MITOCHONDRIAL",True
Q7W7H6,Acetylornithine aminotransferase 1,protein,257311,Bordetella parapertussis (strain 12822 / ATCC BAA-587 / NCTC 13253),Bordetella parapertussis (strain 12822 / ATCC BAA-587 / NCTC 13253),argD1,393,PTHR11986:SF79,"ACETYLORNITHINE AMINOTRANSFERASE, MITOCHONDRIAL",True
Q7WDN7,Acetylornithine aminotransferase 2,protein,257310,Bordetella bronchiseptica (strain ATCC BAA-588 / NCTC 13252 / RB50),Bordetella bronchiseptica (strain ATCC BAA-588 / NCTC 13252 / RB50),argD2,396,PTHR11986:SF79,"ACETYLORNITHINE AMINOTRANSFERASE, MITOCHONDRIAL",True
Q7WKW5,Acetylornithine aminotransferase 1,protein,257310,Bordetella bronchiseptica (strain ATCC BAA-588 / NCTC 13252 / RB50),Bordetella bronchiseptica (strain ATCC BAA-588 / NCTC 13252 / RB50),argD1,393,PTHR11986:SF79,"ACETYLORNITHINE AMINOTRANSFERASE, MITOCHONDRIAL",True
Q7WP51,Ornithine aminotransferase,protein,257310,Bordetella bronchiseptica (strain ATCC BAA-588 / NCTC 13252 / RB50),Bordetella bronchiseptica (strain ATCC BAA-588 / NCTC 13252 / RB50),rocD,411,PTHR11986:SF18,"ORNITHINE AMINOTRANSFERASE, MITOCHONDRIAL",True
Q818W2,Acetylornithine aminotransferase,protein,226900,Bacillus cereus (strain ATCC 14579 / DSM 31 / CCUG 7414 / JCM 2152 / NBRC 15305 / NCIMB 9373 / NCTC 2599 / NRRL B-3711),Bacillus cereus (strain ATCC 14579 / DSM 31 / CCUG 7414 / JCM 2152 / NBRC 15305 / NCIMB 9373 / NCTC 2599 / NRRL B-3711),argD,386,PTHR11986:SF79,"ACETYLORNITHINE AMINOTRANSFERASE, MITOCHONDRIAL",True
Q81GP2,Ornithine aminotransferase,protein,226900,Bacillus cereus (strain ATCC 14579 / DSM 31 / CCUG 7414 / JCM 2152 / NBRC 15305 / NCIMB 9373 / NCTC 2599 / NRRL B-3711),Bacillus cereus (strain ATCC 14579 / DSM 31 / CCUG 7414 / JCM 2152 / NBRC 15305 / NCIMB 9373 / NCTC 2599 / NRRL B-3711),rocD,396,PTHR11986:SF18,"ORNITHINE AMINOTRANSFERASE, MITOCHONDRIAL",True
Q81M98,Acetylornithine aminotransferase,protein,1392,Bacillus anthracis,Bacillus anthracis,argD,386,PTHR11986:SF79,"ACETYLORNITHINE AMINOTRANSFERASE, MITOCHONDRIAL",True
Q81TV3,Ornithine aminotransferase,protein,1392,Bacillus anthracis,Bacillus anthracis,rocD,396,PTHR11986:SF18,"ORNITHINE AMINOTRANSFERASE, MITOCHONDRIAL",True
Q828A3,Acetylornithine aminotransferase,protein,227882,Streptomyces avermitilis (strain ATCC 31267 / DSM 46492 / JCM 5070 / NBRC 14893 / NCIMB 12804 / NRRL 8165 / MA-4680),Streptomyces avermitilis (strain ATCC 31267 / DSM 46492 / JCM 5070 / NBRC 14893 / NCIMB 12804 / NRRL 8165 / MA-4680),argD,403,PTHR11986:SF79,"ACETYLORNITHINE AMINOTRANSFERASE, MITOCHONDRIAL",True
Q82UP3,Acetylornithine aminotransferase,protein,228410,Nitrosomonas europaea (strain ATCC 19718 / CIP 103999 / KCTC 2705 / NBRC 14298),Nitrosomonas europaea (strain ATCC 19718 / CIP 103999 / KCTC 2705 / NBRC 14298),argD,393,PTHR11986:SF79,"ACETYLORNITHINE AMINOTRANSFERASE, MITOCHONDRIAL",True
Q83JJ8,Putrescine aminotransferase,protein,623,Shigella flexneri,Shigella flexneri,patA,459,PTHR11986:SF112,PUTRESCINE AMINOTRANSFERASE,True
Q87DM8,Acetylornithine aminotransferase,protein,183190,Xylella fastidiosa (strain Temecula1 / ATCC 700964),Xylella fastidiosa (strain Temecula1 / ATCC 700964),argD,411,PTHR11986:SF113,SUCCINYLORNITHINE TRANSAMINASE,True
Q87L20,Acetylornithine aminotransferase,protein,223926,Vibrio parahaemolyticus serotype O3:K6 (strain RIMD 2210633),Vibrio parahaemolyticus serotype O3:K6 (strain RIMD 2210633),argD,403,PTHR11986:SF113,SUCCINYLORNITHINE TRANSAMINASE,True
Q882K8,Acetylornithine aminotransferase 2,protein,223283,Pseudomonas syringae pv. tomato (strain ATCC BAA-871 / DC3000),Pseudomonas syringae pv. tomato (strain ATCC BAA-871 / DC3000),argD2,400,PTHR11986:SF79,"ACETYLORNITHINE AMINOTRANSFERASE, MITOCHONDRIAL",True
Q885K0,Acetylornithine aminotransferase 1,protein,223283,Pseudomonas syringae pv. tomato (strain ATCC BAA-871 / DC3000),Pseudomonas syringae pv. tomato (strain ATCC BAA-871 / DC3000),argD1,405,PTHR11986:SF113,SUCCINYLORNITHINE TRANSAMINASE,True
Q88FI7,2-aminoadipate transaminase,protein,160488,Pseudomonas putida (strain ATCC 47054 / DSM 6125 / CFBP 8728 / NCIMB 11950 / KT2440),Pseudomonas putida (strain ATCC 47054 / DSM 6125 / CFBP 8728 / NCIMB 11950 / KT2440),PP_4108,416,PTHR11986:SF58,LEUCINE_METHIONINE RACEMASE,True
