id,name,entry_type,source_tax_id,source_tax_name,full_tax_name,gene,length,subfamily,subfamily_name,in_alphafold
A0A0J9X1Q5,Aminotransferase PigE,protein,1327989,Serratia sp. (strain FS14),Serratia sp. (strain FS14),pigE,853,PTHR11986:SF121,BLR3010 PROTEIN,True
A0QYS9,Acetylornithine aminotransferase,protein,246196,Mycolicibacterium smegmatis (strain ATCC 700084 / mc(2)155),Mycolicibacterium smegmatis (strain ATCC 700084 / mc(2)155),argD,390,PTHR11986:SF79,"ACETYLORNITHINE AMINOTRANSFERASE, MITOCHONDRIAL",True
A1ABS9,Succinylornithine transaminase,protein,405955,Escherichia coli O1:K1 / APEC,Escherichia coli O1:K1 / APEC,astC,406,PTHR11986:SF113,SUCCINYLORNITHINE TRANSAMINASE,True
A1AFZ3,Putrescine aminotransferase,protein,405955,Escherichia coli O1:K1 / APEC,Escherichia coli O1:K1 / APEC,patA,459,PTHR11986:SF112,PUTRESCINE AMINOTRANSFERASE,True
A1JS45,Succinylornithine transaminase,protein,393305,Yersinia enterocolitica serotype O:8 / biotype 1B (strain NCTC 13174 / 8081),Yersinia enterocolitica serotype O:8 / biotype 1B (strain NCTC 13174 / 8081),astC,414,PTHR11986:SF113,SUCCINYLORNITHINE TRANSAMINASE,True
A4WEQ6,Putrescine aminotransferase,protein,399742,Enterobacter sp. (strain 638),Enterobacter sp. (strain 638),patA,459,PTHR11986:SF112,PUTRESCINE AMINOTRANSFERASE,True
A6TEB2,Putrescine aminotransferase,protein,272620,Klebsiella pneumoniae subsp. pneumoniae (strain ATCC 700721 / MGH 78578),Klebsiella pneumoniae subsp. pneumoniae (strain ATCC 700721 / MGH 78578),patA,459,PTHR11986:SF112,PUTRESCINE AMINOTRANSFERASE,True
A7FIL6,Succinylornithine transaminase,protein,349747,Yersinia pseudotuberculosis serotype O:1b (strain IP 31758),Yersinia pseudotuberculosis serotype O:1b (strain IP 31758),astC,414,PTHR11986:SF113,SUCCINYLORNITHINE TRANSAMINASE,True
A7MIU0,Putrescine aminotransferase,protein,290339,Cronobacter sakazakii (strain ATCC BAA-894),Cronobacter sakazakii (strain ATCC BAA-894),patA,465,PTHR11986:SF112,PUTRESCINE AMINOTRANSFERASE,True
A7ZML6,Succinylornithine transaminase,protein,331111,Escherichia coli O139:H28 (strain E24377A / ETEC),Escherichia coli O139:H28 (strain E24377A / ETEC),astC,406,PTHR11986:SF113,SUCCINYLORNITHINE TRANSAMINASE,True
A7ZRV6,Putrescine aminotransferase,protein,331111,Escherichia coli O139:H28 (strain E24377A / ETEC),Escherichia coli O139:H28 (strain E24377A / ETEC),patA,459,PTHR11986:SF112,PUTRESCINE AMINOTRANSFERASE,True
A8A0U0,Succinylornithine transaminase,protein,331112,Escherichia coli O9:H4 (strain HS),Escherichia coli O9:H4 (strain HS),astC,406,PTHR11986:SF113,SUCCINYLORNITHINE TRANSAMINASE,True
A8A4N0,Putrescine aminotransferase,protein,331112,Escherichia coli O9:H4 (strain HS),Escherichia coli O9:H4 (strain HS),patA,459,PTHR11986:SF112,PUTRESCINE AMINOTRANSFERASE,True
A8AHE0,Succinylornithine transaminase,protein,290338,Citrobacter koseri (strain ATCC BAA-895 / CDC 4225-83 / SGSC4696),Citrobacter koseri (strain ATCC BAA-895 / CDC 4225-83 / SGSC4696),astC,406,PTHR11986:SF113,SUCCINYLORNITHINE TRANSAMINASE,True
A8APX8,Putrescine aminotransferase,protein,290338,Citrobacter koseri (strain ATCC BAA-895 / CDC 4225-83 / SGSC4696),Citrobacter koseri (strain ATCC BAA-895 / CDC 4225-83 / SGSC4696),patA,459,PTHR11986:SF112,PUTRESCINE AMINOTRANSFERASE,True
A9MPU4,Putrescine aminotransferase,protein,41514,Salmonella arizonae (strain ATCC BAA-731 / CDC346-86 / RSK2980),Salmonella arizonae (strain ATCC BAA-731 / CDC346-86 / RSK2980),patA,459,PTHR11986:SF112,PUTRESCINE AMINOTRANSFERASE,True
A9N278,Succinylornithine transaminase,protein,1016998,Salmonella paratyphi B (strain ATCC BAA-1250 / SPB7),Salmonella paratyphi B (strain ATCC BAA-1250 / SPB7),astC,408,PTHR11986:SF113,SUCCINYLORNITHINE TRANSAMINASE,True
A9N5Z8,Putrescine aminotransferase,protein,1016998,Salmonella paratyphi B (strain ATCC BAA-1250 / SPB7),Salmonella paratyphi B (strain ATCC BAA-1250 / SPB7),patA,459,PTHR11986:SF112,PUTRESCINE AMINOTRANSFERASE,True
A9QZ63,Succinylornithine transaminase,protein,349746,Yersinia pestis bv. Antiqua (strain Angola),Yersinia pestis bv. Antiqua (strain Angola),astC,414,PTHR11986:SF113,SUCCINYLORNITHINE TRANSAMINASE,True
B1IPI2,Succinylornithine transaminase,protein,481805,Escherichia coli (strain ATCC 8739 / DSM 1576 / NBRC 3972 / NCIMB 8545 / WDCM 00012 / Crooks),Escherichia coli (strain ATCC 8739 / DSM 1576 / NBRC 3972 / NCIMB 8545 / WDCM 00012 / Crooks),astC,406,PTHR11986:SF113,SUCCINYLORNITHINE TRANSAMINASE,True
B1IRP4,Putrescine aminotransferase,protein,481805,Escherichia coli (strain ATCC 8739 / DSM 1576 / NBRC 3972 / NCIMB 8545 / WDCM 00012 / Crooks),Escherichia coli (strain ATCC 8739 / DSM 1576 / NBRC 3972 / NCIMB 8545 / WDCM 00012 / Crooks),patA,459,PTHR11986:SF112,PUTRESCINE AMINOTRANSFERASE,True
B1LDY3,Succinylornithine transaminase,protein,439855,Escherichia coli (strain SMS-3-5 / SECEC),Escherichia coli (strain SMS-3-5 / SECEC),astC,406,PTHR11986:SF113,SUCCINYLORNITHINE TRANSAMINASE,True
B1LF65,Putrescine aminotransferase,protein,439855,Escherichia coli (strain SMS-3-5 / SECEC),Escherichia coli (strain SMS-3-5 / SECEC),patA,459,PTHR11986:SF112,PUTRESCINE AMINOTRANSFERASE,True
B1XG77,Putrescine aminotransferase,protein,316385,Escherichia coli (strain K12 / DH10B),Escherichia coli (strain K12 / DH10B),patA,459,PTHR11986:SF112,PUTRESCINE AMINOTRANSFERASE,True
B1XGK9,Succinylornithine transaminase,protein,316385,Escherichia coli (strain K12 / DH10B),Escherichia coli (strain K12 / DH10B),astC,406,PTHR11986:SF113,SUCCINYLORNITHINE TRANSAMINASE,True
B2U3D0,Succinylornithine transaminase,protein,344609,Shigella boydii serotype 18 (strain CDC 3083-94 / BS512),Shigella boydii serotype 18 (strain CDC 3083-94 / BS512),astC,406,PTHR11986:SF113,SUCCINYLORNITHINE TRANSAMINASE,True
B4T3Z4,Succinylornithine transaminase,protein,423368,Salmonella newport (strain SL254),Salmonella newport (strain SL254),astC,408,PTHR11986:SF113,SUCCINYLORNITHINE TRANSAMINASE,True
B4T688,Putrescine aminotransferase,protein,423368,Salmonella newport (strain SL254),Salmonella newport (strain SL254),patA,459,PTHR11986:SF112,PUTRESCINE AMINOTRANSFERASE,True
B4TGE0,Succinylornithine transaminase,protein,454169,Salmonella heidelberg (strain SL476),Salmonella heidelberg (strain SL476),astC,408,PTHR11986:SF113,SUCCINYLORNITHINE TRANSAMINASE,True
B4TIU6,Putrescine aminotransferase,protein,454169,Salmonella heidelberg (strain SL476),Salmonella heidelberg (strain SL476),patA,459,PTHR11986:SF112,PUTRESCINE AMINOTRANSFERASE,True
B4TVV2,Putrescine aminotransferase,protein,439843,Salmonella schwarzengrund (strain CVM19633),Salmonella schwarzengrund (strain CVM19633),patA,459,PTHR11986:SF112,PUTRESCINE AMINOTRANSFERASE,True
B5BA72,Succinylornithine transaminase,protein,554290,Salmonella paratyphi A (strain AKU_12601),Salmonella paratyphi A (strain AKU_12601),astC,408,PTHR11986:SF113,SUCCINYLORNITHINE TRANSAMINASE,True
B5BG29,Putrescine aminotransferase,protein,554290,Salmonella paratyphi A (strain AKU_12601),Salmonella paratyphi A (strain AKU_12601),patA,459,PTHR11986:SF112,PUTRESCINE AMINOTRANSFERASE,True
B5F6B4,Putrescine aminotransferase,protein,454166,Salmonella agona (strain SL483),Salmonella agona (strain SL483),patA,459,PTHR11986:SF112,PUTRESCINE AMINOTRANSFERASE,True
B5F846,Succinylornithine transaminase,protein,454166,Salmonella agona (strain SL483),Salmonella agona (strain SL483),astC,408,PTHR11986:SF113,SUCCINYLORNITHINE TRANSAMINASE,True
B5FHV3,Putrescine aminotransferase,protein,439851,Salmonella dublin (strain CT_02021853),Salmonella dublin (strain CT_02021853),patA,459,PTHR11986:SF112,PUTRESCINE AMINOTRANSFERASE,True
B5FJD8,Succinylornithine transaminase,protein,439851,Salmonella dublin (strain CT_02021853),Salmonella dublin (strain CT_02021853),astC,408,PTHR11986:SF113,SUCCINYLORNITHINE TRANSAMINASE,True
B5QWJ0,Succinylornithine transaminase,protein,550537,Salmonella enteritidis PT4 (strain P125109),Salmonella enteritidis PT4 (strain P125109),astC,408,PTHR11986:SF113,SUCCINYLORNITHINE TRANSAMINASE,True
B5QZ53,Putrescine aminotransferase,protein,550537,Salmonella enteritidis PT4 (strain P125109),Salmonella enteritidis PT4 (strain P125109),patA,459,PTHR11986:SF112,PUTRESCINE AMINOTRANSFERASE,True
B5RB01,Succinylornithine transaminase,protein,550538,Salmonella gallinarum (strain 287/91 / NCTC 13346),Salmonella gallinarum (strain 287/91 / NCTC 13346),astC,408,PTHR11986:SF113,SUCCINYLORNITHINE TRANSAMINASE,True
B5REH5,Putrescine aminotransferase,protein,550538,Salmonella gallinarum (strain 287/91 / NCTC 13346),Salmonella gallinarum (strain 287/91 / NCTC 13346),patA,459,PTHR11986:SF112,PUTRESCINE AMINOTRANSFERASE,True
B5XTY7,Putrescine aminotransferase,protein,507522,Klebsiella pneumoniae (strain 342),Klebsiella pneumoniae (strain 342),patA,459,PTHR11986:SF112,PUTRESCINE AMINOTRANSFERASE,True
B5YQ35,Succinylornithine transaminase,protein,444450,Escherichia coli O157:H7 (strain EC4115 / EHEC),Escherichia coli O157:H7 (strain EC4115 / EHEC),astC,406,PTHR11986:SF113,SUCCINYLORNITHINE TRANSAMINASE,True
B5YRB3,Putrescine aminotransferase,protein,444450,Escherichia coli O157:H7 (strain EC4115 / EHEC),Escherichia coli O157:H7 (strain EC4115 / EHEC),patA,459,PTHR11986:SF112,PUTRESCINE AMINOTRANSFERASE,True
B6I445,Putrescine aminotransferase,protein,409438,Escherichia coli (strain SE11),Escherichia coli (strain SE11),patA,459,PTHR11986:SF112,PUTRESCINE AMINOTRANSFERASE,True
B6IBG8,Succinylornithine transaminase,protein,409438,Escherichia coli (strain SE11),Escherichia coli (strain SE11),astC,406,PTHR11986:SF113,SUCCINYLORNITHINE TRANSAMINASE,True
B7L6M2,Succinylornithine transaminase,protein,585055,Escherichia coli (strain 55989 / EAEC),Escherichia coli (strain 55989 / EAEC),astC,406,PTHR11986:SF113,SUCCINYLORNITHINE TRANSAMINASE,True
B7LH08,Putrescine aminotransferase,protein,585055,Escherichia coli (strain 55989 / EAEC),Escherichia coli (strain 55989 / EAEC),patA,459,PTHR11986:SF112,PUTRESCINE AMINOTRANSFERASE,True
B7LQ44,Succinylornithine transaminase,protein,585054,Escherichia fergusonii (strain ATCC 35469 / DSM 13698 / CCUG 18766 / IAM 14443 / JCM 21226 / LMG 7866 / NBRC 102419 / NCTC 12128 / CDC 0568-73),Escherichia fergusonii (strain ATCC 35469 / DSM 13698 / CCUG 18766 / IAM 14443 / JCM 21226 / LMG 7866 / NBRC 102419 / NCTC 12128 / CDC 0568-73),astC,406,PTHR11986:SF113,SUCCINYLORNITHINE TRANSAMINASE,True
B7LQF8,Putrescine aminotransferase,protein,585054,Escherichia fergusonii (strain ATCC 35469 / DSM 13698 / CCUG 18766 / IAM 14443 / JCM 21226 / LMG 7866 / NBRC 102419 / NCTC 12128 / CDC 0568-73),Escherichia fergusonii (strain ATCC 35469 / DSM 13698 / CCUG 18766 / IAM 14443 / JCM 21226 / LMG 7866 / NBRC 102419 / NCTC 12128 / CDC 0568-73),patA,459,PTHR11986:SF112,PUTRESCINE AMINOTRANSFERASE,True
B7LZM2,Putrescine aminotransferase,protein,585034,Escherichia coli O8 (strain IAI1),Escherichia coli O8 (strain IAI1),patA,459,PTHR11986:SF112,PUTRESCINE AMINOTRANSFERASE,True
B7M1G0,Succinylornithine transaminase,protein,585034,Escherichia coli O8 (strain IAI1),Escherichia coli O8 (strain IAI1),astC,406,PTHR11986:SF113,SUCCINYLORNITHINE TRANSAMINASE,True
B7MAV9,Succinylornithine transaminase,protein,585035,Escherichia coli O45:K1 (strain S88 / ExPEC),Escherichia coli O45:K1 (strain S88 / ExPEC),astC,406,PTHR11986:SF113,SUCCINYLORNITHINE TRANSAMINASE,True
B7MB08,Putrescine aminotransferase,protein,585035,Escherichia coli O45:K1 (strain S88 / ExPEC),Escherichia coli O45:K1 (strain S88 / ExPEC),patA,459,PTHR11986:SF112,PUTRESCINE AMINOTRANSFERASE,True
B7MVM7,Succinylornithine transaminase,protein,585397,Escherichia coli O81 (strain ED1a),Escherichia coli O81 (strain ED1a),astC,406,PTHR11986:SF113,SUCCINYLORNITHINE TRANSAMINASE,True
B7N0M2,Putrescine aminotransferase,protein,585397,Escherichia coli O81 (strain ED1a),Escherichia coli O81 (strain ED1a),patA,459,PTHR11986:SF112,PUTRESCINE AMINOTRANSFERASE,True
B7N584,Succinylornithine transaminase,protein,585056,Escherichia coli O17:K52:H18 (strain UMN026 / ExPEC),Escherichia coli O17:K52:H18 (strain UMN026 / ExPEC),astC,406,PTHR11986:SF113,SUCCINYLORNITHINE TRANSAMINASE,True
B7ND61,Putrescine aminotransferase,protein,585056,Escherichia coli O17:K52:H18 (strain UMN026 / ExPEC),Escherichia coli O17:K52:H18 (strain UMN026 / ExPEC),patA,459,PTHR11986:SF112,PUTRESCINE AMINOTRANSFERASE,True
B7NJT8,Putrescine aminotransferase,protein,585057,Escherichia coli O7:K1 (strain IAI39 / ExPEC),Escherichia coli O7:K1 (strain IAI39 / ExPEC),patA,459,PTHR11986:SF112,PUTRESCINE AMINOTRANSFERASE,True
B7NT29,Succinylornithine transaminase,protein,585057,Escherichia coli O7:K1 (strain IAI39 / ExPEC),Escherichia coli O7:K1 (strain IAI39 / ExPEC),astC,406,PTHR11986:SF113,SUCCINYLORNITHINE TRANSAMINASE,True
B7UIY0,Putrescine aminotransferase,protein,574521,Escherichia coli O127:H6 (strain E2348/69 / EPEC),Escherichia coli O127:H6 (strain E2348/69 / EPEC),patA,459,PTHR11986:SF112,PUTRESCINE AMINOTRANSFERASE,True
B7USC9,Succinylornithine transaminase,protein,574521,Escherichia coli O127:H6 (strain E2348/69 / EPEC),Escherichia coli O127:H6 (strain E2348/69 / EPEC),astC,406,PTHR11986:SF113,SUCCINYLORNITHINE TRANSAMINASE,True
B9DIU0,Ornithine aminotransferase,protein,396513,Staphylococcus carnosus (strain TM300),Staphylococcus carnosus (strain TM300),rocD,396,PTHR11986:SF18,"ORNITHINE AMINOTRANSFERASE, MITOCHONDRIAL",True
B9EAM9,Ornithine aminotransferase,protein,458233,Macrococcus caseolyticus (strain JCSC5402),Macrococcus caseolyticus (strain JCSC5402),rocD,397,PTHR11986:SF18,"ORNITHINE AMINOTRANSFERASE, MITOCHONDRIAL",True
B9ITF9,Ornithine aminotransferase,protein,361100,Bacillus cereus (strain Q1),Bacillus cereus (strain Q1),rocD,396,PTHR11986:SF18,"ORNITHINE AMINOTRANSFERASE, MITOCHONDRIAL",True
C0PYZ1,Putrescine aminotransferase,protein,476213,Salmonella paratyphi C (strain RKS4594),Salmonella paratyphi C (strain RKS4594),patA,459,PTHR11986:SF112,PUTRESCINE AMINOTRANSFERASE,True
C0Q6X9,Succinylornithine transaminase,protein,476213,Salmonella paratyphi C (strain RKS4594),Salmonella paratyphi C (strain RKS4594),astC,408,PTHR11986:SF113,SUCCINYLORNITHINE TRANSAMINASE,True
C0ZBR4,Ornithine aminotransferase,protein,358681,Brevibacillus brevis (strain 47 / JCM 6285 / NBRC 100599),Brevibacillus brevis (strain 47 / JCM 6285 / NBRC 100599),rocD,399,PTHR11986:SF18,"ORNITHINE AMINOTRANSFERASE, MITOCHONDRIAL",True
C1EL61,Ornithine aminotransferase,protein,572264,Bacillus cereus (strain 03BB102),Bacillus cereus (strain 03BB102),rocD,396,PTHR11986:SF18,"ORNITHINE AMINOTRANSFERASE, MITOCHONDRIAL",True
C3LBX0,Ornithine aminotransferase,protein,568206,Bacillus anthracis (strain CDC 684 / NRRL 3495),Bacillus anthracis (strain CDC 684 / NRRL 3495),rocD,396,PTHR11986:SF18,"ORNITHINE AMINOTRANSFERASE, MITOCHONDRIAL",True
C3P3K3,Ornithine aminotransferase,protein,592021,Bacillus anthracis (strain A0248),Bacillus anthracis (strain A0248),rocD,396,PTHR11986:SF18,"ORNITHINE AMINOTRANSFERASE, MITOCHONDRIAL",True
C4L2E7,Ornithine aminotransferase,protein,360911,Exiguobacterium sp. (strain ATCC BAA-1283 / AT1b),Exiguobacterium sp. (strain ATCC BAA-1283 / AT1b),rocD,400,PTHR11986:SF18,"ORNITHINE AMINOTRANSFERASE, MITOCHONDRIAL",True
C4ZQY9,Putrescine aminotransferase,protein,595496,Escherichia coli (strain K12 / MC4100 / BW2952),Escherichia coli (strain K12 / MC4100 / BW2952),patA,459,PTHR11986:SF112,PUTRESCINE AMINOTRANSFERASE,True
C4ZZA4,Succinylornithine transaminase,protein,595496,Escherichia coli (strain K12 / MC4100 / BW2952),Escherichia coli (strain K12 / MC4100 / BW2952),astC,406,PTHR11986:SF113,SUCCINYLORNITHINE TRANSAMINASE,True
C5D6R2,Ornithine aminotransferase,protein,471223,Geobacillus sp. (strain WCH70),Geobacillus sp. (strain WCH70),rocD,398,PTHR11986:SF18,"ORNITHINE AMINOTRANSFERASE, MITOCHONDRIAL",True
H3ZR39,Leucine/methionine racemase,protein,523849,Thermococcus litoralis (strain ATCC 51850 / DSM 5473 / JCM 8560 / NS-C),Thermococcus litoralis (strain ATCC 51850 / DSM 5473 / JCM 8560 / NS-C),OCC_10945,443,PTHR11986:SF58,LEUCINE_METHIONINE RACEMASE,True
M1GRN3,Isoleucine 2-epimerase,protein,1581,Lentilactobacillus buchneri,Lentilactobacillus buchneri,,450,PTHR11986:SF58,LEUCINE_METHIONINE RACEMASE,True
O04866,"Acetylornithine aminotransferase, mitochondrial",protein,3517,Alnus glutinosa,Alnus glutinosa (European alder),AG118,451,PTHR11986:SF79,"ACETYLORNITHINE AMINOTRANSFERASE, MITOCHONDRIAL",True
O08321,Acetylornithine aminotransferase,protein,220668,Lactiplantibacillus plantarum (strain ATCC BAA-793 / NCIMB 8826 / WCFS1),Lactiplantibacillus plantarum (strain ATCC BAA-793 / NCIMB 8826 / WCFS1),argD,389,PTHR11986:SF79,"ACETYLORNITHINE AMINOTRANSFERASE, MITOCHONDRIAL",True
O14433,"Acetylornithine aminotransferase, mitochondrial",protein,284590,Kluyveromyces lactis (strain ATCC 8585 / CBS 2359 / DSM 70799 / NBRC 1267 / NRRL Y-1140 / WM37),Kluyveromyces lactis (strain ATCC 8585 / CBS 2359 / DSM 70799 / NBRC 1267 / NRRL Y-1140 / WM37) (Yeast),ARG8,423,PTHR11986:SF79,"ACETYLORNITHINE AMINOTRANSFERASE, MITOCHONDRIAL",True
O27392,Acetylornithine aminotransferase,protein,187420,Methanothermobacter thermautotrophicus (strain ATCC 29096 / DSM 1053 / JCM 10044 / NBRC 100330 / Delta H),Methanothermobacter thermautotrophicus (strain ATCC 29096 / DSM 1053 / JCM 10044 / NBRC 100330 / Delta H),argD,390,PTHR11986:SF79,"ACETYLORNITHINE AMINOTRANSFERASE, MITOCHONDRIAL",True
O30156,Acetylornithine aminotransferase,protein,224325,Archaeoglobus fulgidus (strain ATCC 49558 / DSM 4304 / JCM 9628 / NBRC 100126 / VC-16),Archaeoglobus fulgidus (strain ATCC 49558 / DSM 4304 / JCM 9628 / NBRC 100126 / VC-16),argD,375,PTHR11986:SF79,"ACETYLORNITHINE AMINOTRANSFERASE, MITOCHONDRIAL",True
O30508,Succinylornithine transaminase/acetylornithine aminotransferase,protein,208964,Pseudomonas aeruginosa (strain ATCC 15692 / DSM 22644 / CIP 104116 / JCM 14847 / LMG 12228 / 1C / PRS 101 / PAO1),Pseudomonas aeruginosa (strain ATCC 15692 / DSM 22644 / CIP 104116 / JCM 14847 / LMG 12228 / 1C / PRS 101 / PAO1),aruC,406,PTHR11986:SF113,SUCCINYLORNITHINE TRANSAMINASE,True
O50131,Ornithine aminotransferase,protein,70601,Pyrococcus horikoshii (strain ATCC 700860 / DSM 12428 / JCM 9974 / NBRC 100139 / OT-3),Pyrococcus horikoshii (strain ATCC 700860 / DSM 12428 / JCM 9974 / NBRC 100139 / OT-3),PH1423,454,PTHR11986:SF58,LEUCINE_METHIONINE RACEMASE,True
O57878,Broad substrate specificity amino-acid racemase,protein,70601,Pyrococcus horikoshii (strain ATCC 700860 / DSM 12428 / JCM 9974 / NBRC 100139 / OT-3),Pyrococcus horikoshii (strain ATCC 700860 / DSM 12428 / JCM 9974 / NBRC 100139 / OT-3),PH0138,466,PTHR11986:SF58,LEUCINE_METHIONINE RACEMASE,True
O58478,Alanine/serine racemase,protein,70601,Pyrococcus horikoshii (strain ATCC 700860 / DSM 12428 / JCM 9974 / NBRC 100139 / OT-3),Pyrococcus horikoshii (strain ATCC 700860 / DSM 12428 / JCM 9974 / NBRC 100139 / OT-3),PH0782,474,PTHR11986:SF58,LEUCINE_METHIONINE RACEMASE,True
O59401,Putative [LysW]-aminoadipate semialdehyde/glutamate semialdehyde transaminase,protein,70601,Pyrococcus horikoshii (strain ATCC 700860 / DSM 12428 / JCM 9974 / NBRC 100139 / OT-3),Pyrococcus horikoshii (strain ATCC 700860 / DSM 12428 / JCM 9974 / NBRC 100139 / OT-3),lysJ,366,PTHR11986:SF79,"ACETYLORNITHINE AMINOTRANSFERASE, MITOCHONDRIAL",True
O66442,Acetylornithine aminotransferase,protein,224324,Aquifex aeolicus (strain VF5),Aquifex aeolicus (strain VF5),argD,376,PTHR11986:SF79,"ACETYLORNITHINE AMINOTRANSFERASE, MITOCHONDRIAL",True
O74548,"Probable acetylornithine aminotransferase, mitochondrial",protein,284812,Schizosaccharomyces pombe (strain 972 / ATCC 24843),Schizosaccharomyces pombe (strain 972 / ATCC 24843) (Fission yeast),arg1,441,PTHR11986:SF79,"ACETYLORNITHINE AMINOTRANSFERASE, MITOCHONDRIAL",True
P04181,"Ornithine aminotransferase, mitochondrial",protein,9606,Homo sapiens,Homo sapiens (Human),OAT,439,PTHR11986:SF18,"ORNITHINE AMINOTRANSFERASE, MITOCHONDRIAL",True
P04182,"Ornithine aminotransferase, mitochondrial",protein,10116,Rattus norvegicus,Rattus norvegicus (Rat),Oat,439,PTHR11986:SF18,"ORNITHINE AMINOTRANSFERASE, MITOCHONDRIAL",True
P07991,Ornithine aminotransferase,protein,559292,Saccharomyces cerevisiae (strain ATCC 204508 / S288c),Saccharomyces cerevisiae (strain ATCC 204508 / S288c) (Baker's yeast),CAR2,424,PTHR11986:SF18,"ORNITHINE AMINOTRANSFERASE, MITOCHONDRIAL",True
P18335,Acetylornithine/succinyldiaminopimelate aminotransferase,protein,83333,Escherichia coli (strain K12),Escherichia coli (strain K12),argD,406,PTHR11986:SF122,ACETYLORNITHINE_SUCCINYLDIAMINOPIMELATE AMINOTRANSFERASE,True
P18544,"Acetylornithine aminotransferase, mitochondrial",protein,559292,Saccharomyces cerevisiae (strain ATCC 204508 / S288c),Saccharomyces cerevisiae (strain ATCC 204508 / S288c) (Baker's yeast),ARG8,423,PTHR11986:SF79,"ACETYLORNITHINE AMINOTRANSFERASE, MITOCHONDRIAL",True
P22256,4-aminobutyrate aminotransferase GabT,protein,83333,Escherichia coli (strain K12),Escherichia coli (strain K12),gabT,426,,,True
P24087,Acetylornithine aminotransferase,protein,189518,Leptospira interrogans serogroup Icterohaemorrhagiae serovar Lai (strain 56601),Leptospira interrogans serogroup Icterohaemorrhagiae serovar Lai (strain 56601),argD,406,PTHR11986:SF79,"ACETYLORNITHINE AMINOTRANSFERASE, MITOCHONDRIAL",True
P29758,"Ornithine aminotransferase, mitochondrial",protein,10090,Mus musculus,Mus musculus (Mouse),Oat,439,PTHR11986:SF18,"ORNITHINE AMINOTRANSFERASE, MITOCHONDRIAL",True
P30268,Uncharacterized aminotransferase BpOF4_10225,protein,398511,Alkalihalophilus pseudofirmus (strain ATCC BAA-2126 / JCM 17055 / OF4),Alkalihalophilus pseudofirmus (strain ATCC BAA-2126 / JCM 17055 / OF4),BpOF4_10225,445,,,True
P30900,Acetylornithine aminotransferase,protein,272942,Rhodobacter capsulatus (strain ATCC BAA-309 / NBRC 16581 / SB1003),Rhodobacter capsulatus (strain ATCC BAA-309 / NBRC 16581 / SB1003),argD,393,PTHR11986:SF113,SUCCINYLORNITHINE TRANSAMINASE,True
P31893,Ornithine aminotransferase,protein,3918,Vigna aconitifolia,Vigna aconitifolia (Moth bean),,426,PTHR11986:SF18,"ORNITHINE AMINOTRANSFERASE, MITOCHONDRIAL",True
P36839,Acetylornithine aminotransferase,protein,224308,Bacillus subtilis (strain 168),Bacillus subtilis (strain 168),argD,385,PTHR11986:SF79,"ACETYLORNITHINE AMINOTRANSFERASE, MITOCHONDRIAL",True
P38021,Ornithine aminotransferase,protein,224308,Bacillus subtilis (strain 168),Bacillus subtilis (strain 168),rocD,401,PTHR11986:SF18,"ORNITHINE AMINOTRANSFERASE, MITOCHONDRIAL",True
P40732,Acetylornithine/succinyldiaminopimelate aminotransferase,protein,99287,Salmonella typhimurium (strain LT2 / SGSC1412 / ATCC 700720),Salmonella typhimurium (strain LT2 / SGSC1412 / ATCC 700720),argD,405,PTHR11986:SF122,ACETYLORNITHINE_SUCCINYLDIAMINOPIMELATE AMINOTRANSFERASE,True
P40829,4-aminobutyrate aminotransferase,protein,272631,Mycobacterium leprae (strain TN),Mycobacterium leprae (strain TN),gabT,446,,,True
P42588,Putrescine aminotransferase,protein,83333,Escherichia coli (strain K12),Escherichia coli (strain K12),patA,459,PTHR11986:SF112,PUTRESCINE AMINOTRANSFERASE,True
P49724,"Ornithine aminotransferase, mitochondrial",protein,7217,Drosophila ananassae,Drosophila ananassae (Fruit fly),Oat,432,PTHR11986:SF18,"ORNITHINE AMINOTRANSFERASE, MITOCHONDRIAL",True
P50457,4-aminobutyrate aminotransferase PuuE,protein,83333,Escherichia coli (strain K12),Escherichia coli (strain K12),puuE,421,PTHR11986:SF58,LEUCINE_METHIONINE RACEMASE,True
P54752,Acetylornithine aminotransferase,protein,103690,Nostoc sp. (strain PCC 7120 / SAG 25.82 / UTEX 2576),Nostoc sp. (strain PCC 7120 / SAG 25.82 / UTEX 2576),argD,427,PTHR11986:SF79,"ACETYLORNITHINE AMINOTRANSFERASE, MITOCHONDRIAL",True
P56969,Uncharacterized aminotransferase AF_1815,protein,224325,Archaeoglobus fulgidus (strain ATCC 49558 / DSM 4304 / JCM 9628 / NBRC 100126 / VC-16),Archaeoglobus fulgidus (strain ATCC 49558 / DSM 4304 / JCM 9628 / NBRC 100126 / VC-16),AF_1815,424,PTHR11986:SF79,"ACETYLORNITHINE AMINOTRANSFERASE, MITOCHONDRIAL",True
P57600,Acetylornithine/succinyldiaminopimelate aminotransferase,protein,107806,Buchnera aphidicola subsp. Acyrthosiphon pisum (strain APS),Buchnera aphidicola subsp. Acyrthosiphon pisum (strain APS),argD,408,PTHR11986:SF113,SUCCINYLORNITHINE TRANSAMINASE,True
P59086,Acetylornithine/succinyldiaminopimelate aminotransferase,protein,198804,Buchnera aphidicola subsp. Schizaphis graminum (strain Sg),Buchnera aphidicola subsp. Schizaphis graminum (strain Sg),argD,404,PTHR11986:SF113,SUCCINYLORNITHINE TRANSAMINASE,True
P59315,Acetylornithine aminotransferase,protein,206672,Bifidobacterium longum (strain NCC 2705),Bifidobacterium longum (strain NCC 2705),argD,431,PTHR11986:SF79,"ACETYLORNITHINE AMINOTRANSFERASE, MITOCHONDRIAL",True
P59316,Acetylornithine aminotransferase,protein,194439,Chlorobaculum tepidum (strain ATCC 49652 / DSM 12025 / NBRC 103806 / TLS),Chlorobaculum tepidum (strain ATCC 49652 / DSM 12025 / NBRC 103806 / TLS),argD,400,PTHR11986:SF79,"ACETYLORNITHINE AMINOTRANSFERASE, MITOCHONDRIAL",True
P59317,Acetylornithine/succinyldiaminopimelate aminotransferase,protein,199310,Escherichia coli O6:H1 (strain CFT073 / ATCC 700928 / UPEC),Escherichia coli O6:H1 (strain CFT073 / ATCC 700928 / UPEC),argD,406,PTHR11986:SF122,ACETYLORNITHINE_SUCCINYLDIAMINOPIMELATE AMINOTRANSFERASE,True
P59318,Acetylornithine aminotransferase,protein,34,Myxococcus xanthus,Myxococcus xanthus,argD,401,PTHR11986:SF79,"ACETYLORNITHINE AMINOTRANSFERASE, MITOCHONDRIAL",True
P59319,Acetylornithine aminotransferase,protein,160488,Pseudomonas putida (strain ATCC 47054 / DSM 6125 / CFBP 8728 / NCIMB 11950 / KT2440),Pseudomonas putida (strain ATCC 47054 / DSM 6125 / CFBP 8728 / NCIMB 11950 / KT2440),argD,406,PTHR11986:SF113,SUCCINYLORNITHINE TRANSAMINASE,True
