id,name,entry_type,source_tax_id,source_tax_name,full_tax_name,gene,length,subfamily,subfamily_name,in_alphafold
Q88RB9,5-aminovalerate aminotransferase DavT,protein,160488,Pseudomonas putida (strain ATCC 47054 / DSM 6125 / CFBP 8728 / NCIMB 11950 / KT2440),Pseudomonas putida (strain ATCC 47054 / DSM 6125 / CFBP 8728 / NCIMB 11950 / KT2440),davT,425,PTHR11986:SF58,LEUCINE_METHIONINE RACEMASE,True
Q89LG2,Acetylornithine aminotransferase 2,protein,224911,Bradyrhizobium diazoefficiens (strain JCM 10833 / BCRC 13528 / IAM 13628 / NBRC 14792 / USDA 110),Bradyrhizobium diazoefficiens (strain JCM 10833 / BCRC 13528 / IAM 13628 / NBRC 14792 / USDA 110),argD2,398,PTHR11986:SF79,"ACETYLORNITHINE AMINOTRANSFERASE, MITOCHONDRIAL",True
Q89RB7,Ornithine aminotransferase,protein,224911,Bradyrhizobium diazoefficiens (strain JCM 10833 / BCRC 13528 / IAM 13628 / NBRC 14792 / USDA 110),Bradyrhizobium diazoefficiens (strain JCM 10833 / BCRC 13528 / IAM 13628 / NBRC 14792 / USDA 110),rocD,404,PTHR11986:SF18,"ORNITHINE AMINOTRANSFERASE, MITOCHONDRIAL",True
Q89VE9,Acetylornithine aminotransferase 1,protein,224911,Bradyrhizobium diazoefficiens (strain JCM 10833 / BCRC 13528 / IAM 13628 / NBRC 14792 / USDA 110),Bradyrhizobium diazoefficiens (strain JCM 10833 / BCRC 13528 / IAM 13628 / NBRC 14792 / USDA 110),argD1,405,PTHR11986:SF113,SUCCINYLORNITHINE TRANSAMINASE,True
Q8CSG1,Acetylornithine aminotransferase,protein,176280,Staphylococcus epidermidis (strain ATCC 12228 / FDA PCI 1200),Staphylococcus epidermidis (strain ATCC 12228 / FDA PCI 1200),argD,375,PTHR11986:SF79,"ACETYLORNITHINE AMINOTRANSFERASE, MITOCHONDRIAL",True
Q8CT82,Ornithine aminotransferase,protein,176280,Staphylococcus epidermidis (strain ATCC 12228 / FDA PCI 1200),Staphylococcus epidermidis (strain ATCC 12228 / FDA PCI 1200),rocD,396,PTHR11986:SF18,"ORNITHINE AMINOTRANSFERASE, MITOCHONDRIAL",True
Q8CUM9,Acetylornithine aminotransferase,protein,221109,Oceanobacillus iheyensis (strain DSM 14371 / CIP 107618 / JCM 11309 / KCTC 3954 / HTE831),Oceanobacillus iheyensis (strain DSM 14371 / CIP 107618 / JCM 11309 / KCTC 3954 / HTE831),argD,399,PTHR11986:SF79,"ACETYLORNITHINE AMINOTRANSFERASE, MITOCHONDRIAL",True
Q8D0D7,Succinylornithine transaminase,protein,632,Yersinia pestis,Yersinia pestis,astC,414,PTHR11986:SF113,SUCCINYLORNITHINE TRANSAMINASE,True
Q8EP32,Ornithine aminotransferase,protein,221109,Oceanobacillus iheyensis (strain DSM 14371 / CIP 107618 / JCM 11309 / KCTC 3954 / HTE831),Oceanobacillus iheyensis (strain DSM 14371 / CIP 107618 / JCM 11309 / KCTC 3954 / HTE831),rocD,398,PTHR11986:SF18,"ORNITHINE AMINOTRANSFERASE, MITOCHONDRIAL",True
Q8FDF5,Putrescine aminotransferase,protein,199310,Escherichia coli O6:H1 (strain CFT073 / ATCC 700928 / UPEC),Escherichia coli O6:H1 (strain CFT073 / ATCC 700928 / UPEC),patA,459,PTHR11986:SF112,PUTRESCINE AMINOTRANSFERASE,True
Q8FGZ9,Succinylornithine transaminase,protein,199310,Escherichia coli O6:H1 (strain CFT073 / ATCC 700928 / UPEC),Escherichia coli O6:H1 (strain CFT073 / ATCC 700928 / UPEC),astC,406,PTHR11986:SF113,SUCCINYLORNITHINE TRANSAMINASE,True
Q8FTN2,Acetylornithine aminotransferase,protein,196164,Corynebacterium efficiens (strain DSM 44549 / YS-314 / AJ 12310 / JCM 11189 / NBRC 100395),Corynebacterium efficiens (strain DSM 44549 / YS-314 / AJ 12310 / JCM 11189 / NBRC 100395),argD,402,PTHR11986:SF79,"ACETYLORNITHINE AMINOTRANSFERASE, MITOCHONDRIAL",True
Q8NYM5,Ornithine aminotransferase 1,protein,196620,Staphylococcus aureus (strain MW2),Staphylococcus aureus (strain MW2),rocD1,394,PTHR11986:SF18,"ORNITHINE AMINOTRANSFERASE, MITOCHONDRIAL",True
Q8P5Q4,Acetylornithine aminotransferase,protein,190485,Xanthomonas campestris pv. campestris (strain ATCC 33913 / DSM 3586 / NCPPB 528 / LMG 568 / P 25),Xanthomonas campestris pv. campestris (strain ATCC 33913 / DSM 3586 / NCPPB 528 / LMG 568 / P 25),argD,408,PTHR11986:SF113,SUCCINYLORNITHINE TRANSAMINASE,True
Q8PH31,Acetylornithine aminotransferase,protein,190486,Xanthomonas axonopodis pv. citri (strain 306),Xanthomonas axonopodis pv. citri (strain 306),argD,408,PTHR11986:SF113,SUCCINYLORNITHINE TRANSAMINASE,True
Q8PX16,Acetylornithine aminotransferase,protein,192952,Methanosarcina mazei (strain ATCC BAA-159 / DSM 3647 / Goe1 / Go1 / JCM 11833 / OCM 88),Methanosarcina mazei (strain ATCC BAA-159 / DSM 3647 / Goe1 / Go1 / JCM 11833 / OCM 88),argD,395,PTHR11986:SF79,"ACETYLORNITHINE AMINOTRANSFERASE, MITOCHONDRIAL",True
Q8R7C1,Acetylornithine aminotransferase,protein,273068,Caldanaerobacter subterraneus subsp. tengcongensis (strain DSM 15242 / JCM 11007 / NBRC 100824 / MB4),Caldanaerobacter subterraneus subsp. tengcongensis (strain DSM 15242 / JCM 11007 / NBRC 100824 / MB4),argD,393,PTHR11986:SF79,"ACETYLORNITHINE AMINOTRANSFERASE, MITOCHONDRIAL",True
Q8TUE8,Acetylornithine aminotransferase,protein,188937,Methanosarcina acetivorans (strain ATCC 35395 / DSM 2834 / JCM 12185 / C2A),Methanosarcina acetivorans (strain ATCC 35395 / DSM 2834 / JCM 12185 / C2A),argD,395,PTHR11986:SF79,"ACETYLORNITHINE AMINOTRANSFERASE, MITOCHONDRIAL",True
Q8TUZ5,Acetylornithine aminotransferase,protein,190192,Methanopyrus kandleri (strain AV19 / DSM 6324 / JCM 9639 / NBRC 100938),Methanopyrus kandleri (strain AV19 / DSM 6324 / JCM 9639 / NBRC 100938),argD,389,PTHR11986:SF79,"ACETYLORNITHINE AMINOTRANSFERASE, MITOCHONDRIAL",True
Q8U0B4,Putative [LysW]-aminoadipate semialdehyde/glutamate semialdehyde transaminase,protein,186497,Pyrococcus furiosus (strain ATCC 43587 / DSM 3638 / JCM 8422 / Vc1),Pyrococcus furiosus (strain ATCC 43587 / DSM 3638 / JCM 8422 / Vc1),lysJ,366,PTHR11986:SF79,"ACETYLORNITHINE AMINOTRANSFERASE, MITOCHONDRIAL",True
Q8UI71,Acetylornithine aminotransferase,protein,176299,Agrobacterium fabrum (strain C58 / ATCC 33970),Agrobacterium fabrum (strain C58 / ATCC 33970),argD,399,PTHR11986:SF113,SUCCINYLORNITHINE TRANSAMINASE,True
Q8X4S6,Acetylornithine/succinyldiaminopimelate aminotransferase,protein,83334,Escherichia coli O157:H7,Escherichia coli O157:H7,argD,406,PTHR11986:SF122,ACETYLORNITHINE_SUCCINYLDIAMINOPIMELATE AMINOTRANSFERASE,True
Q8X598,Succinylornithine transaminase,protein,83334,Escherichia coli O157:H7,Escherichia coli O157:H7,astC,406,PTHR11986:SF113,SUCCINYLORNITHINE TRANSAMINASE,True
Q8XAN1,Putrescine aminotransferase,protein,83334,Escherichia coli O157:H7,Escherichia coli O157:H7,patA,459,PTHR11986:SF112,PUTRESCINE AMINOTRANSFERASE,True
Q8XWN8,Acetylornithine aminotransferase,protein,267608,Ralstonia nicotianae (strain ATCC BAA-1114 / GMI1000),Ralstonia nicotianae (strain ATCC BAA-1114 / GMI1000),argD,399,PTHR11986:SF79,"ACETYLORNITHINE AMINOTRANSFERASE, MITOCHONDRIAL",True
Q8Y6U4,Acetylornithine aminotransferase,protein,169963,Listeria monocytogenes serovar 1/2a (strain ATCC BAA-679 / EGD-e),Listeria monocytogenes serovar 1/2a (strain ATCC BAA-679 / EGD-e),argD,386,PTHR11986:SF79,"ACETYLORNITHINE AMINOTRANSFERASE, MITOCHONDRIAL",True
Q8Z1Z3,Acetylornithine/succinyldiaminopimelate aminotransferase,protein,90370,Salmonella typhi,Salmonella typhi,argD,405,PTHR11986:SF122,ACETYLORNITHINE_SUCCINYLDIAMINOPIMELATE AMINOTRANSFERASE,True
Q8Z3L9,Putrescine aminotransferase,protein,90370,Salmonella typhi,Salmonella typhi,patA,459,PTHR11986:SF112,PUTRESCINE AMINOTRANSFERASE,True
Q8Z6F9,Succinylornithine transaminase,protein,90370,Salmonella typhi,Salmonella typhi,astC,408,PTHR11986:SF113,SUCCINYLORNITHINE TRANSAMINASE,True
Q8ZLX7,Putrescine aminotransferase,protein,99287,Salmonella typhimurium (strain LT2 / SGSC1412 / ATCC 700720),Salmonella typhimurium (strain LT2 / SGSC1412 / ATCC 700720),patA,459,PTHR11986:SF112,PUTRESCINE AMINOTRANSFERASE,True
Q8ZPV2,Succinylornithine transaminase,protein,99287,Salmonella typhimurium (strain LT2 / SGSC1412 / ATCC 700720),Salmonella typhimurium (strain LT2 / SGSC1412 / ATCC 700720),astC,408,PTHR11986:SF113,SUCCINYLORNITHINE TRANSAMINASE,True
Q8ZV07,Putative [LysW]-aminoadipate semialdehyde/glutamate semialdehyde transaminase,protein,178306,Pyrobaculum aerophilum (strain ATCC 51768 / DSM 7523 / JCM 9630 / CIP 104966 / NBRC 100827 / IM2),Pyrobaculum aerophilum (strain ATCC 51768 / DSM 7523 / JCM 9630 / CIP 104966 / NBRC 100827 / IM2),lysJ,383,PTHR11986:SF79,"ACETYLORNITHINE AMINOTRANSFERASE, MITOCHONDRIAL",True
Q92413,Ornithine aminotransferase,protein,227321,Emericella nidulans (strain FGSC A4 / ATCC 38163 / CBS 112.46 / NRRL 194 / M139),Emericella nidulans (strain FGSC A4 / ATCC 38163 / CBS 112.46 / NRRL 194 / M139),otaA,454,PTHR11986:SF18,"ORNITHINE AMINOTRANSFERASE, MITOCHONDRIAL",True
Q92BC0,Acetylornithine aminotransferase,protein,272626,Listeria innocua serovar 6a (strain ATCC BAA-680 / CLIP 11262),Listeria innocua serovar 6a (strain ATCC BAA-680 / CLIP 11262),argD,384,PTHR11986:SF79,"ACETYLORNITHINE AMINOTRANSFERASE, MITOCHONDRIAL",True
Q92SA0,Acetylornithine aminotransferase,protein,266834,Rhizobium meliloti (strain 1021),Rhizobium meliloti (strain 1021) (Ensifer meliloti),argD,399,PTHR11986:SF113,SUCCINYLORNITHINE TRANSAMINASE,True
Q93R93,[LysW]-aminoadipate semialdehyde transaminase,protein,262724,Thermus thermophilus (strain ATCC BAA-163 / DSM 7039 / HB27),Thermus thermophilus (strain ATCC BAA-163 / DSM 7039 / HB27),lysJ,395,PTHR11986:SF79,"ACETYLORNITHINE AMINOTRANSFERASE, MITOCHONDRIAL",True
Q976K0,[LysW]-aminoadipate semialdehyde/glutamate semialdehyde transaminase,protein,273063,Sulfurisphaera tokodaii (strain DSM 16993 / JCM 10545 / NBRC 100140 / 7),Sulfurisphaera tokodaii (strain DSM 16993 / JCM 10545 / NBRC 100140 / 7),lysJ,387,PTHR11986:SF79,"ACETYLORNITHINE AMINOTRANSFERASE, MITOCHONDRIAL",True
Q97GH9,Acetylornithine aminotransferase,protein,272562,Clostridium acetobutylicum (strain ATCC 824 / DSM 792 / JCM 1419 / IAM 19013 / LMG 5710 / NBRC 13948 / NRRL B-527 / VKM B-1787 / 2291 / W),Clostridium acetobutylicum (strain ATCC 824 / DSM 792 / JCM 1419 / IAM 19013 / LMG 5710 / NBRC 13948 / NRRL B-527 / VKM B-1787 / 2291 / W),argD,387,PTHR11986:SF79,"ACETYLORNITHINE AMINOTRANSFERASE, MITOCHONDRIAL",True
Q98BB7,Acetylornithine aminotransferase,protein,266835,Mesorhizobium japonicum (strain LMG 29417 / CECT 9101 / MAFF 303099),Mesorhizobium japonicum (strain LMG 29417 / CECT 9101 / MAFF 303099),argD,399,PTHR11986:SF113,SUCCINYLORNITHINE TRANSAMINASE,True
Q9A652,Acetylornithine aminotransferase 2,protein,190650,Caulobacter vibrioides (strain ATCC 19089 / CIP 103742 / CB 15),Caulobacter vibrioides (strain ATCC 19089 / CIP 103742 / CB 15),argD2,405,PTHR11986:SF113,SUCCINYLORNITHINE TRANSAMINASE,True
Q9AAL3,Acetylornithine aminotransferase 1,protein,190650,Caulobacter vibrioides (strain ATCC 19089 / CIP 103742 / CB 15),Caulobacter vibrioides (strain ATCC 19089 / CIP 103742 / CB 15),argD1,392,PTHR11986:SF113,SUCCINYLORNITHINE TRANSAMINASE,True
Q9CC12,Acetylornithine aminotransferase,protein,272631,Mycobacterium leprae (strain TN),Mycobacterium leprae (strain TN),argD,404,PTHR11986:SF79,"ACETYLORNITHINE AMINOTRANSFERASE, MITOCHONDRIAL",True
Q9CHD3,Acetylornithine aminotransferase,protein,272623,Lactococcus lactis subsp. lactis (strain IL1403),Lactococcus lactis subsp. lactis (strain IL1403),argD,377,PTHR11986:SF79,"ACETYLORNITHINE AMINOTRANSFERASE, MITOCHONDRIAL",True
Q9CNT1,Acetylornithine aminotransferase,protein,272843,Pasteurella multocida (strain Pm70),Pasteurella multocida (strain Pm70),argD,398,PTHR11986:SF113,SUCCINYLORNITHINE TRANSAMINASE,True
Q9FNK4,"Ornithine aminotransferase, mitochondrial",protein,3702,Arabidopsis thaliana,Arabidopsis thaliana (Mouse-ear cress),DELTA-OAT,475,PTHR11986:SF18,"ORNITHINE AMINOTRANSFERASE, MITOCHONDRIAL",True
Q9I6M4,5-aminovalerate aminotransferase DavT,protein,208964,Pseudomonas aeruginosa (strain ATCC 15692 / DSM 22644 / CIP 104116 / JCM 14847 / LMG 12228 / 1C / PRS 101 / PAO1),Pseudomonas aeruginosa (strain ATCC 15692 / DSM 22644 / CIP 104116 / JCM 14847 / LMG 12228 / 1C / PRS 101 / PAO1),davT,426,PTHR11986:SF58,LEUCINE_METHIONINE RACEMASE,True
Q9JTX9,Acetylornithine aminotransferase,protein,122587,Neisseria meningitidis serogroup A / serotype 4A (strain DSM 15465 / Z2491),Neisseria meningitidis serogroup A / serotype 4A (strain DSM 15465 / Z2491),argD,397,PTHR11986:SF113,SUCCINYLORNITHINE TRANSAMINASE,True
Q9JYY4,Acetylornithine aminotransferase,protein,122586,Neisseria meningitidis serogroup B (strain ATCC BAA-335 / MC58),Neisseria meningitidis serogroup B (strain ATCC BAA-335 / MC58),argD,398,PTHR11986:SF113,SUCCINYLORNITHINE TRANSAMINASE,True
Q9K5Z2,Ornithine aminotransferase,protein,272558,Halalkalibacterium halodurans (strain ATCC BAA-125 / DSM 18197 / FERM 7344 / JCM 9153 / C-125),Halalkalibacterium halodurans (strain ATCC BAA-125 / DSM 18197 / FERM 7344 / JCM 9153 / C-125),rocD,398,PTHR11986:SF18,"ORNITHINE AMINOTRANSFERASE, MITOCHONDRIAL",True
Q9K8V5,Acetylornithine aminotransferase,protein,272558,Halalkalibacterium halodurans (strain ATCC BAA-125 / DSM 18197 / FERM 7344 / JCM 9153 / C-125),Halalkalibacterium halodurans (strain ATCC BAA-125 / DSM 18197 / FERM 7344 / JCM 9153 / C-125),argD,384,PTHR11986:SF79,"ACETYLORNITHINE AMINOTRANSFERASE, MITOCHONDRIAL",True
Q9KNW2,Acetylornithine aminotransferase,protein,243277,Vibrio cholerae serotype O1 (strain ATCC 39315 / El Tor Inaba N16961),Vibrio cholerae serotype O1 (strain ATCC 39315 / El Tor Inaba N16961),argD,403,PTHR11986:SF113,SUCCINYLORNITHINE TRANSAMINASE,True
Q9L1A4,Acetylornithine aminotransferase,protein,100226,Streptomyces coelicolor (strain ATCC BAA-471 / A3(2) / M145),Streptomyces coelicolor (strain ATCC BAA-471 / A3(2) / M145),argD,402,PTHR11986:SF79,"ACETYLORNITHINE AMINOTRANSFERASE, MITOCHONDRIAL",True
Q9LCS5,Acetylornithine aminotransferase,protein,1901,Streptomyces clavuligerus,Streptomyces clavuligerus,argD,400,PTHR11986:SF79,"ACETYLORNITHINE AMINOTRANSFERASE, MITOCHONDRIAL",True
Q9M8M7,"Acetylornithine aminotransferase, chloroplastic/mitochondrial",protein,3702,Arabidopsis thaliana,Arabidopsis thaliana (Mouse-ear cress),WIN1,457,PTHR11986:SF79,"ACETYLORNITHINE AMINOTRANSFERASE, MITOCHONDRIAL",True
Q9P3I3,"Acetylornithine aminotransferase, mitochondrial",protein,367110,Neurospora crassa (strain ATCC 24698 / 74-OR23-1A / CBS 708.71 / DSM 1257 / FGSC 987),Neurospora crassa (strain ATCC 24698 / 74-OR23-1A / CBS 708.71 / DSM 1257 / FGSC 987),arg-8,461,PTHR11986:SF79,"ACETYLORNITHINE AMINOTRANSFERASE, MITOCHONDRIAL",True
Q9P7L5,Ornithine aminotransferase car2,protein,284812,Schizosaccharomyces pombe (strain 972 / ATCC 24843),Schizosaccharomyces pombe (strain 972 / ATCC 24843) (Fission yeast),car2,438,PTHR11986:SF18,"ORNITHINE AMINOTRANSFERASE, MITOCHONDRIAL",True
Q9PDF2,Acetylornithine aminotransferase,protein,160492,Xylella fastidiosa (strain 9a5c),Xylella fastidiosa (strain 9a5c),argD,411,PTHR11986:SF113,SUCCINYLORNITHINE TRANSAMINASE,True
Q9PIR7,Acetylornithine aminotransferase,protein,192222,Campylobacter jejuni subsp. jejuni serotype O:2 (strain ATCC 700819 / NCTC 11168),Campylobacter jejuni subsp. jejuni serotype O:2 (strain ATCC 700819 / NCTC 11168),argD,393,PTHR11986:SF79,"ACETYLORNITHINE AMINOTRANSFERASE, MITOCHONDRIAL",True
Q9RW75,[LysW]-aminoadipate semialdehyde transaminase,protein,243230,Deinococcus radiodurans (strain ATCC 13939 / DSM 20539 / JCM 16871 / CCUG 27074 / LMG 4051 / NBRC 15346 / NCIMB 9279 / VKM B-1422 / R1),Deinococcus radiodurans (strain ATCC 13939 / DSM 20539 / JCM 16871 / CCUG 27074 / LMG 4051 / NBRC 15346 / NCIMB 9279 / VKM B-1422 / R1),lysJ,429,PTHR11986:SF79,"ACETYLORNITHINE AMINOTRANSFERASE, MITOCHONDRIAL",True
Q9V1I4,Putative [LysW]-aminoadipate semialdehyde/glutamate semialdehyde transaminase,protein,272844,Pyrococcus abyssi (strain GE5 / Orsay),Pyrococcus abyssi (strain GE5 / Orsay),lysJ,364,PTHR11986:SF79,"ACETYLORNITHINE AMINOTRANSFERASE, MITOCHONDRIAL",True
Q9VW26,"Ornithine aminotransferase, mitochondrial",protein,7227,Drosophila melanogaster,Drosophila melanogaster (Fruit fly),Oat,431,PTHR11986:SF18,"ORNITHINE AMINOTRANSFERASE, MITOCHONDRIAL",True
Q9X2A5,Acetylornithine aminotransferase,protein,243274,Thermotoga maritima (strain ATCC 43589 / DSM 3109 / JCM 10099 / NBRC 100826 / MSB8),Thermotoga maritima (strain ATCC 43589 / DSM 3109 / JCM 10099 / NBRC 100826 / MSB8),argD,385,PTHR11986:SF79,"ACETYLORNITHINE AMINOTRANSFERASE, MITOCHONDRIAL",True
Q9YBY6,Putative [LysW]-aminoadipate semialdehyde/glutamate semialdehyde transaminase,protein,272557,Aeropyrum pernix (strain ATCC 700893 / DSM 11879 / JCM 9820 / NBRC 100138 / K1),Aeropyrum pernix (strain ATCC 700893 / DSM 11879 / JCM 9820 / NBRC 100138 / K1),lysJ,388,PTHR11986:SF79,"ACETYLORNITHINE AMINOTRANSFERASE, MITOCHONDRIAL",True
Q9ZJ10,Acetylornithine aminotransferase,protein,1390,Bacillus amyloliquefaciens,Bacillus amyloliquefaciens,argD,229,PTHR11986:SF79,"ACETYLORNITHINE AMINOTRANSFERASE, MITOCHONDRIAL",True
