GENE PRODUCT DB	GENE PRODUCT ID	SYMBOL	QUALIFIER	GO TERM	GO NAME	GO ASPECT	ECO ID	GO EVIDENCE CODE	REFERENCE	WITH/FROM	TAXON ID	TAXON NAME	ASSIGNED BY	GENE NAME	DATE
UniProtKB	Q88RV5	PP_0024	located_in	GO:0005886	plasma membrane	cellular_component	ECO:0000501	IEA	GO_REF:0000120	UniProtKB-SubCell:SL-0037|PANTHER:PTN001252483	160488	Pseudomonas putida (strain ATCC 47054 / DSM 6125 / CFBP 8728 / NCIMB 11950 / KT2440)	UniProt	Membrane-associated metal-dependent hydrolase	20260616
UniProtKB	Q88RV5	PP_0024	involved_in	GO:0009244	lipopolysaccharide core region biosynthetic process	biological_process	ECO:0007826	IEA	GO_REF:0000118	PANTHER:PTN001252483	160488	Pseudomonas putida (strain ATCC 47054 / DSM 6125 / CFBP 8728 / NCIMB 11950 / KT2440)	TreeGrafter	Membrane-associated metal-dependent hydrolase	20260616
UniProtKB	Q88RV5	PP_0024	located_in	GO:0016020	membrane	cellular_component	ECO:0000256	IEA	GO_REF:0000002	InterPro:IPR012549	160488	Pseudomonas putida (strain ATCC 47054 / DSM 6125 / CFBP 8728 / NCIMB 11950 / KT2440)	InterPro	Membrane-associated metal-dependent hydrolase	20260616
UniProtKB	Q88RV5	PP_0024	enables	GO:0016772	transferase activity, transferring phosphorus-containing groups	molecular_function	ECO:0000256	IEA	GO_REF:0000002	InterPro:IPR040423	160488	Pseudomonas putida (strain ATCC 47054 / DSM 6125 / CFBP 8728 / NCIMB 11950 / KT2440)	InterPro	Membrane-associated metal-dependent hydrolase	20260616
UniProtKB	Q88RV5	PP_0024	enables	GO:0016776	phosphotransferase activity, phosphate group as acceptor	molecular_function	ECO:0007826	IEA	GO_REF:0000118	PANTHER:PTN001252483	160488	Pseudomonas putida (strain ATCC 47054 / DSM 6125 / CFBP 8728 / NCIMB 11950 / KT2440)	TreeGrafter	Membrane-associated metal-dependent hydrolase	20260616
