id,name,entry_type,source_tax_id,source_tax_name,full_tax_name,gene,length,subfamily,subfamily_name,in_alphafold
Q4W9B8,ATP-dependent 6-phosphofructokinase,protein,330879,Aspergillus fumigatus (strain ATCC MYA-4609 / CBS 101355 / FGSC A1100 / Af293),Aspergillus fumigatus (strain ATCC MYA-4609 / CBS 101355 / FGSC A1100 / Af293),pfkA,808,PTHR13697:SF4,ATP-DEPENDENT 6-PHOSPHOFRUCTOKINASE,True
Q55988,ATP-dependent 6-phosphofructokinase 2,protein,1111708,Synechocystis sp. (strain ATCC 27184 / PCC 6803 / Kazusa),Synechocystis sp. (strain ATCC 27184 / PCC 6803 / Kazusa),pfkA2,384,PTHR13697:SF52,ATP-DEPENDENT 6-PHOSPHOFRUCTOKINASE 3,True
Q57HF3,ATP-dependent 6-phosphofructokinase,protein,321314,Salmonella choleraesuis (strain SC-B67),Salmonella choleraesuis (strain SC-B67),pfkA,320,PTHR13697:SF4,ATP-DEPENDENT 6-PHOSPHOFRUCTOKINASE,True
Q59126,Pyrophosphate--fructose 6-phosphate 1-phosphotransferase,protein,1814,Amycolatopsis methanolica,Amycolatopsis methanolica,pfp,341,PTHR13697:SF52,ATP-DEPENDENT 6-PHOSPHOFRUCTOKINASE 3,True
Q59214,ATP-dependent 6-phosphofructokinase,protein,1468,Paenibacillus macquariensis,Paenibacillus macquariensis,pfkA,322,PTHR13697:SF4,ATP-DEPENDENT 6-PHOSPHOFRUCTOKINASE,True
Q5E2B1,ATP-dependent 6-phosphofructokinase,protein,312309,Aliivibrio fischeri (strain ATCC 700601 / ES114),Aliivibrio fischeri (strain ATCC 700601 / ES114),pfkA,320,PTHR13697:SF4,ATP-DEPENDENT 6-PHOSPHOFRUCTOKINASE,True
Q5FKG6,ATP-dependent 6-phosphofructokinase,protein,272621,Lactobacillus acidophilus (strain ATCC 700396 / NCK56 / N2 / NCFM),Lactobacillus acidophilus (strain ATCC 700396 / NCK56 / N2 / NCFM),pfkA,320,PTHR13697:SF4,ATP-DEPENDENT 6-PHOSPHOFRUCTOKINASE,True
Q5HF75,ATP-dependent 6-phosphofructokinase,protein,93062,Staphylococcus aureus (strain COL),Staphylococcus aureus (strain COL),pfkA,322,PTHR13697:SF4,ATP-DEPENDENT 6-PHOSPHOFRUCTOKINASE,True
Q5HNK6,ATP-dependent 6-phosphofructokinase,protein,176279,Staphylococcus epidermidis (strain ATCC 35984 / DSM 28319 / BCRC 17069 / CCUG 31568 / BM 3577 / RP62A),Staphylococcus epidermidis (strain ATCC 35984 / DSM 28319 / BCRC 17069 / CCUG 31568 / BM 3577 / RP62A),pfkA,322,PTHR13697:SF4,ATP-DEPENDENT 6-PHOSPHOFRUCTOKINASE,True
Q5KWB1,ATP-dependent 6-phosphofructokinase,protein,235909,Geobacillus kaustophilus (strain HTA426),Geobacillus kaustophilus (strain HTA426),pfkA,319,PTHR13697:SF4,ATP-DEPENDENT 6-PHOSPHOFRUCTOKINASE,True
Q5PIR6,ATP-dependent 6-phosphofructokinase,protein,295319,Salmonella paratyphi A (strain ATCC 9150 / SARB42),Salmonella paratyphi A (strain ATCC 9150 / SARB42),pfkA,320,PTHR13697:SF4,ATP-DEPENDENT 6-PHOSPHOFRUCTOKINASE,True
Q5R636,"ATP-dependent 6-phosphofructokinase, platelet type",protein,9601,Pongo abelii,Pongo abelii (Sumatran orangutan),PFKP,784,PTHR13697:SF5,"ATP-DEPENDENT 6-PHOSPHOFRUCTOKINASE, PLATELET TYPE",True
Q5R7V5,"ATP-dependent 6-phosphofructokinase, liver type",protein,9601,Pongo abelii,Pongo abelii (Sumatran orangutan),PFKL,780,PTHR13697:SF14,"ATP-DEPENDENT 6-PHOSPHOFRUCTOKINASE, LIVER TYPE",True
Q5RAG9,"ATP-dependent 6-phosphofructokinase, muscle type",protein,9601,Pongo abelii,Pongo abelii (Sumatran orangutan),PFKM,780,PTHR13697:SF59,"ATP-DEPENDENT 6-PHOSPHOFRUCTOKINASE, MUSCLE TYPE",True
Q5WEF6,ATP-dependent 6-phosphofructokinase,protein,66692,Shouchella clausii (strain KSM-K16),Shouchella clausii (strain KSM-K16),pfkA,319,PTHR13697:SF4,ATP-DEPENDENT 6-PHOSPHOFRUCTOKINASE,True
Q5XBV2,ATP-dependent 6-phosphofructokinase,protein,286636,Streptococcus pyogenes serotype M6 (strain ATCC BAA-946 / MGAS10394),Streptococcus pyogenes serotype M6 (strain ATCC BAA-946 / MGAS10394),pfkA,337,PTHR13697:SF4,ATP-DEPENDENT 6-PHOSPHOFRUCTOKINASE,True
Q601D3,ATP-dependent 6-phosphofructokinase,protein,295358,Mesomycoplasma hyopneumoniae (strain 232),Mesomycoplasma hyopneumoniae (strain 232),pfkA,322,PTHR13697:SF4,ATP-DEPENDENT 6-PHOSPHOFRUCTOKINASE,True
Q60HD9,"ATP-dependent 6-phosphofructokinase, muscle type",protein,9541,Macaca fascicularis,Macaca fascicularis (Crab-eating macaque),PFKM,780,PTHR13697:SF59,"ATP-DEPENDENT 6-PHOSPHOFRUCTOKINASE, MUSCLE TYPE",True
Q633J8,ATP-dependent 6-phosphofructokinase,protein,288681,Bacillus cereus (strain ZK / E33L),Bacillus cereus (strain ZK / E33L),pfkA,319,PTHR13697:SF4,ATP-DEPENDENT 6-PHOSPHOFRUCTOKINASE,True
Q65G82,ATP-dependent 6-phosphofructokinase,protein,279010,Bacillus licheniformis (strain ATCC 14580 / DSM 13 / JCM 2505 / CCUG 7422 / NBRC 12200 / NCIMB 9375 / NCTC 10341 / NRRL NRS-1264 / Gibson 46),Bacillus licheniformis (strain ATCC 14580 / DSM 13 / JCM 2505 / CCUG 7422 / NBRC 12200 / NCIMB 9375 / NCTC 10341 / NRRL NRS-1264 / Gibson 46),pfkA,319,PTHR13697:SF4,ATP-DEPENDENT 6-PHOSPHOFRUCTOKINASE,True
Q65VM6,ATP-dependent 6-phosphofructokinase,protein,221988,Mannheimia succiniciproducens (strain KCTC 0769BP / MBEL55E),Mannheimia succiniciproducens (strain KCTC 0769BP / MBEL55E),pfkA,321,PTHR13697:SF4,ATP-DEPENDENT 6-PHOSPHOFRUCTOKINASE,True
Q66GA8,ATP-dependent 6-phosphofructokinase,protein,273123,Yersinia pseudotuberculosis serotype I (strain IP32953),Yersinia pseudotuberculosis serotype I (strain IP32953),pfkA,327,PTHR13697:SF4,ATP-DEPENDENT 6-PHOSPHOFRUCTOKINASE,True
Q6CZ46,ATP-dependent 6-phosphofructokinase,protein,218491,Pectobacterium atrosepticum (strain SCRI 1043 / ATCC BAA-672),Pectobacterium atrosepticum (strain SCRI 1043 / ATCC BAA-672),pfkA,320,PTHR13697:SF4,ATP-DEPENDENT 6-PHOSPHOFRUCTOKINASE,True
Q6G8M8,ATP-dependent 6-phosphofructokinase,protein,282459,Staphylococcus aureus (strain MSSA476),Staphylococcus aureus (strain MSSA476),pfkA,322,PTHR13697:SF4,ATP-DEPENDENT 6-PHOSPHOFRUCTOKINASE,True
Q6GG08,ATP-dependent 6-phosphofructokinase,protein,282458,Staphylococcus aureus (strain MRSA252),Staphylococcus aureus (strain MRSA252),pfkA,322,PTHR13697:SF4,ATP-DEPENDENT 6-PHOSPHOFRUCTOKINASE,True
Q6HCT3,ATP-dependent 6-phosphofructokinase,protein,281309,Bacillus thuringiensis subsp. konkukian (strain 97-27),Bacillus thuringiensis subsp. konkukian (strain 97-27),pfkA,319,PTHR13697:SF4,ATP-DEPENDENT 6-PHOSPHOFRUCTOKINASE,True
Q6KHX0,ATP-dependent 6-phosphofructokinase,protein,267748,Mycoplasma mobile (strain ATCC 43663 / 163K / NCTC 11711),Mycoplasma mobile (strain ATCC 43663 / 163K / NCTC 11711),pfkA,325,PTHR13697:SF4,ATP-DEPENDENT 6-PHOSPHOFRUCTOKINASE,True
Q6LVK2,ATP-dependent 6-phosphofructokinase,protein,298386,Photobacterium profundum (strain SS9),Photobacterium profundum (strain SS9),pfkA,320,PTHR13697:SF4,ATP-DEPENDENT 6-PHOSPHOFRUCTOKINASE,True
Q71Z96,ATP-dependent 6-phosphofructokinase,protein,265669,Listeria monocytogenes serotype 4b (strain F2365),Listeria monocytogenes serotype 4b (strain F2365),pfkA,319,PTHR13697:SF4,ATP-DEPENDENT 6-PHOSPHOFRUCTOKINASE,True
Q72H98,ATP-dependent 6-phosphofructokinase,protein,262724,Thermus thermophilus (strain ATCC BAA-163 / DSM 7039 / HB27),Thermus thermophilus (strain ATCC BAA-163 / DSM 7039 / HB27),pfkA,322,PTHR13697:SF4,ATP-DEPENDENT 6-PHOSPHOFRUCTOKINASE,True
Q72ZD8,ATP-dependent 6-phosphofructokinase,protein,222523,Bacillus cereus (strain ATCC 10987 / NRS 248),Bacillus cereus (strain ATCC 10987 / NRS 248),pfkA,319,PTHR13697:SF4,ATP-DEPENDENT 6-PHOSPHOFRUCTOKINASE,True
Q74JM8,ATP-dependent 6-phosphofructokinase,protein,257314,Lactobacillus johnsonii (strain CNCM I-12250 / La1 / NCC 533),Lactobacillus johnsonii (strain CNCM I-12250 / La1 / NCC 533),pfkA,319,PTHR13697:SF4,ATP-DEPENDENT 6-PHOSPHOFRUCTOKINASE,True
Q7M9C2,ATP-dependent 6-phosphofructokinase,protein,273121,Wolinella succinogenes (strain ATCC 29543 / DSM 1740 / CCUG 13145 / JCM 31913 / LMG 7466 / NCTC 11488 / FDC 602W),Wolinella succinogenes (strain ATCC 29543 / DSM 1740 / CCUG 13145 / JCM 31913 / LMG 7466 / NCTC 11488 / FDC 602W),pfkA,319,PTHR13697:SF4,ATP-DEPENDENT 6-PHOSPHOFRUCTOKINASE,True
Q7MGW6,ATP-dependent 6-phosphofructokinase,protein,196600,Vibrio vulnificus (strain YJ016),Vibrio vulnificus (strain YJ016),pfkA,320,PTHR13697:SF4,ATP-DEPENDENT 6-PHOSPHOFRUCTOKINASE,True
Q7VRK9,ATP-dependent 6-phosphofructokinase,protein,203907,Blochmanniella floridana,Blochmanniella floridana,pfkA,320,PTHR13697:SF4,ATP-DEPENDENT 6-PHOSPHOFRUCTOKINASE,True
Q817F3,ATP-dependent 6-phosphofructokinase,protein,226900,Bacillus cereus (strain ATCC 14579 / DSM 31 / CCUG 7414 / JCM 2152 / NBRC 15305 / NCIMB 9373 / NCTC 2599 / NRRL B-3711),Bacillus cereus (strain ATCC 14579 / DSM 31 / CCUG 7414 / JCM 2152 / NBRC 15305 / NCIMB 9373 / NCTC 2599 / NRRL B-3711),pfkA,319,PTHR13697:SF4,ATP-DEPENDENT 6-PHOSPHOFRUCTOKINASE,True
Q81KZ0,ATP-dependent 6-phosphofructokinase,protein,1392,Bacillus anthracis,Bacillus anthracis (anthrax bacterium),pfkA,319,PTHR13697:SF4,ATP-DEPENDENT 6-PHOSPHOFRUCTOKINASE,True
Q836R3,ATP-dependent 6-phosphofructokinase,protein,226185,Enterococcus faecalis (strain ATCC 700802 / V583),Enterococcus faecalis (strain ATCC 700802 / V583),pfkA,320,PTHR13697:SF4,ATP-DEPENDENT 6-PHOSPHOFRUCTOKINASE,True
Q83EH9,ATP-dependent 6-phosphofructokinase,protein,227377,Coxiella burnetii (strain RSA 493 / Nine Mile phase I),Coxiella burnetii (strain RSA 493 / Nine Mile phase I),pfkA,326,PTHR13697:SF4,ATP-DEPENDENT 6-PHOSPHOFRUCTOKINASE,True
Q867C9,"ATP-dependent 6-phosphofructokinase, muscle type",protein,9796,Equus caballus,Equus caballus (Horse),PFKM,780,PTHR13697:SF59,"ATP-DEPENDENT 6-PHOSPHOFRUCTOKINASE, MUSCLE TYPE",True
Q87KX0,ATP-dependent 6-phosphofructokinase,protein,223926,Vibrio parahaemolyticus serotype O3:K6 (strain RIMD 2210633),Vibrio parahaemolyticus serotype O3:K6 (strain RIMD 2210633),pfkA,320,PTHR13697:SF4,ATP-DEPENDENT 6-PHOSPHOFRUCTOKINASE,True
Q88VY1,ATP-dependent 6-phosphofructokinase,protein,220668,Lactiplantibacillus plantarum (strain ATCC BAA-793 / NCIMB 8826 / WCFS1),Lactiplantibacillus plantarum (strain ATCC BAA-793 / NCIMB 8826 / WCFS1),pfkA,320,PTHR13697:SF4,ATP-DEPENDENT 6-PHOSPHOFRUCTOKINASE,True
Q890Z2,ATP-dependent 6-phosphofructokinase,protein,212717,Clostridium tetani (strain Massachusetts / E88),Clostridium tetani (strain Massachusetts / E88),pfkA,319,PTHR13697:SF4,ATP-DEPENDENT 6-PHOSPHOFRUCTOKINASE,True
Q8A2E9,ATP-dependent 6-phosphofructokinase 3,protein,226186,Bacteroides thetaiotaomicron (strain ATCC 29148 / DSM 2079 / JCM 5827 / CCUG 10774 / NCTC 10582 / VPI-5482 / E50),Bacteroides thetaiotaomicron (strain ATCC 29148 / DSM 2079 / JCM 5827 / CCUG 10774 / NCTC 10582 / VPI-5482 / E50),pfkA3,336,PTHR13697:SF52,ATP-DEPENDENT 6-PHOSPHOFRUCTOKINASE 3,True
Q8A624,ATP-dependent 6-phosphofructokinase 2,protein,226186,Bacteroides thetaiotaomicron (strain ATCC 29148 / DSM 2079 / JCM 5827 / CCUG 10774 / NCTC 10582 / VPI-5482 / E50),Bacteroides thetaiotaomicron (strain ATCC 29148 / DSM 2079 / JCM 5827 / CCUG 10774 / NCTC 10582 / VPI-5482 / E50),pfkA2,326,PTHR13697:SF4,ATP-DEPENDENT 6-PHOSPHOFRUCTOKINASE,True
Q8A8R5,ATP-dependent 6-phosphofructokinase 1,protein,226186,Bacteroides thetaiotaomicron (strain ATCC 29148 / DSM 2079 / JCM 5827 / CCUG 10774 / NCTC 10582 / VPI-5482 / E50),Bacteroides thetaiotaomicron (strain ATCC 29148 / DSM 2079 / JCM 5827 / CCUG 10774 / NCTC 10582 / VPI-5482 / E50),pfkA1,327,PTHR13697:SF4,ATP-DEPENDENT 6-PHOSPHOFRUCTOKINASE,True
Q8CS68,ATP-dependent 6-phosphofructokinase,protein,176280,Staphylococcus epidermidis (strain ATCC 12228 / FDA PCI 1200),Staphylococcus epidermidis (strain ATCC 12228 / FDA PCI 1200),pfkA,322,PTHR13697:SF4,ATP-DEPENDENT 6-PHOSPHOFRUCTOKINASE,True
Q8DCY1,ATP-dependent 6-phosphofructokinase,protein,216895,Vibrio vulnificus (strain CMCP6),Vibrio vulnificus (strain CMCP6),pfkA,320,PTHR13697:SF4,ATP-DEPENDENT 6-PHOSPHOFRUCTOKINASE,True
Q8DJB1,ATP-dependent 6-phosphofructokinase,protein,197221,Thermosynechococcus vestitus (strain NIES-2133 / IAM M-273 / BP-1),Thermosynechococcus vestitus (strain NIES-2133 / IAM M-273 / BP-1),pfkA,369,PTHR13697:SF52,ATP-DEPENDENT 6-PHOSPHOFRUCTOKINASE 3,True
Q8DQ85,ATP-dependent 6-phosphofructokinase,protein,171101,Streptococcus pneumoniae (strain ATCC BAA-255 / R6),Streptococcus pneumoniae (strain ATCC BAA-255 / R6),pfkA,335,PTHR13697:SF4,ATP-DEPENDENT 6-PHOSPHOFRUCTOKINASE,True
Q8DTX6,ATP-dependent 6-phosphofructokinase,protein,210007,Streptococcus mutans serotype c (strain ATCC 700610 / UA159),Streptococcus mutans serotype c (strain ATCC 700610 / UA159),pfkA,337,PTHR13697:SF4,ATP-DEPENDENT 6-PHOSPHOFRUCTOKINASE,True
Q8EPD6,ATP-dependent 6-phosphofructokinase,protein,221109,Oceanobacillus iheyensis (strain DSM 14371 / CIP 107618 / JCM 11309 / KCTC 3954 / HTE831),Oceanobacillus iheyensis (strain DSM 14371 / CIP 107618 / JCM 11309 / KCTC 3954 / HTE831),pfkA,319,PTHR13697:SF4,ATP-DEPENDENT 6-PHOSPHOFRUCTOKINASE,True
Q8EVH2,Probable ATP-dependent 6-phosphofructokinase,protein,272633,Malacoplasma penetrans (strain HF-2),Malacoplasma penetrans (strain HF-2),pfkA,322,PTHR13697:SF4,ATP-DEPENDENT 6-PHOSPHOFRUCTOKINASE,True
Q8FBD0,ATP-dependent 6-phosphofructokinase isozyme 1,protein,199310,Escherichia coli O6:H1 (strain CFT073 / ATCC 700928 / UPEC),Escherichia coli O6:H1 (strain CFT073 / ATCC 700928 / UPEC),pfkA,320,PTHR13697:SF4,ATP-DEPENDENT 6-PHOSPHOFRUCTOKINASE,True
Q8GNC1,ATP-dependent 6-phosphofructokinase,protein,233412,Haemophilus ducreyi (strain 35000HP / ATCC 700724),Haemophilus ducreyi (strain 35000HP / ATCC 700724),pfkA,324,PTHR13697:SF4,ATP-DEPENDENT 6-PHOSPHOFRUCTOKINASE,True
Q8K9N0,ATP-dependent 6-phosphofructokinase,protein,198804,Buchnera aphidicola subsp. Schizaphis graminum (strain Sg),Buchnera aphidicola subsp. Schizaphis graminum (strain Sg),pfkA,320,PTHR13697:SF4,ATP-DEPENDENT 6-PHOSPHOFRUCTOKINASE,True
Q8NJU8,ATP-dependent 6-phosphofructokinase subunit alpha,protein,4922,Komagataella pastoris,Komagataella pastoris (Yeast),PFK1,989,PTHR13697:SF57,ATP-DEPENDENT 6-PHOSPHOFRUCTOKINASE SUBUNIT ALPHA,True
Q8NR14,ATP-dependent 6-phosphofructokinase,protein,196627,Corynebacterium glutamicum (strain ATCC 13032 / DSM 20300 / JCM 1318 / BCRC 11384 / CCUG 27702 / LMG 3730 / NBRC 12168 / NCIMB 10025 / NRRL B-2784 / 534),Corynebacterium glutamicum (strain ATCC 13032 / DSM 20300 / JCM 1318 / BCRC 11384 / CCUG 27702 / LMG 3730 / NBRC 12168 / NCIMB 10025 / NRRL B-2784 / 534),pfkA,346,PTHR13697:SF52,ATP-DEPENDENT 6-PHOSPHOFRUCTOKINASE 3,True
Q8P0S6,ATP-dependent 6-phosphofructokinase,protein,186103,Streptococcus pyogenes serotype M18 (strain MGAS8232),Streptococcus pyogenes serotype M18 (strain MGAS8232),pfkA,337,PTHR13697:SF4,ATP-DEPENDENT 6-PHOSPHOFRUCTOKINASE,True
Q8R914,ATP-dependent 6-phosphofructokinase,protein,273068,Caldanaerobacter subterraneus subsp. tengcongensis (strain DSM 15242 / JCM 11007 / NBRC 100824 / MB4),Caldanaerobacter subterraneus subsp. tengcongensis (strain DSM 15242 / JCM 11007 / NBRC 100824 / MB4),pfkA,321,PTHR13697:SF4,ATP-DEPENDENT 6-PHOSPHOFRUCTOKINASE,True
Q8RG98,ATP-dependent 6-phosphofructokinase,protein,190304,Fusobacterium nucleatum subsp. nucleatum (strain ATCC 25586 / DSM 15643 / BCRC 10681 / CIP 101130 / JCM 8532 / KCTC 2640 / LMG 13131 / VPI 4355),Fusobacterium nucleatum subsp. nucleatum (strain ATCC 25586 / DSM 15643 / BCRC 10681 / CIP 101130 / JCM 8532 / KCTC 2640 / LMG 13131 / VPI 4355),pfkA,322,PTHR13697:SF4,ATP-DEPENDENT 6-PHOSPHOFRUCTOKINASE,True
Q8RQN5,ATP-dependent 6-phosphofructokinase,protein,196164,Corynebacterium efficiens (strain DSM 44549 / YS-314 / AJ 12310 / JCM 11189 / NBRC 100395),Corynebacterium efficiens (strain DSM 44549 / YS-314 / AJ 12310 / JCM 11189 / NBRC 100395),pfkA,346,PTHR13697:SF52,ATP-DEPENDENT 6-PHOSPHOFRUCTOKINASE 3,True
Q8TGA0,ATP-dependent 6-phosphofructokinase subunit beta,protein,4922,Komagataella pastoris,Komagataella pastoris (Yeast),PFK2,941,PTHR13697:SF4,ATP-DEPENDENT 6-PHOSPHOFRUCTOKINASE,True
Q8XL57,ATP-dependent 6-phosphofructokinase 2,protein,195102,Clostridium perfringens (strain 13 / Type A),Clostridium perfringens (strain 13 / Type A),pfkA2,366,PTHR13697:SF52,ATP-DEPENDENT 6-PHOSPHOFRUCTOKINASE 3,True
Q8XNH2,ATP-dependent 6-phosphofructokinase 1,protein,195102,Clostridium perfringens (strain 13 / Type A),Clostridium perfringens (strain 13 / Type A),pfkA1,319,PTHR13697:SF4,ATP-DEPENDENT 6-PHOSPHOFRUCTOKINASE,True
Q8Y6W0,ATP-dependent 6-phosphofructokinase,protein,169963,Listeria monocytogenes serovar 1/2a (strain ATCC BAA-679 / EGD-e),Listeria monocytogenes serovar 1/2a (strain ATCC BAA-679 / EGD-e),pfkA,319,PTHR13697:SF4,ATP-DEPENDENT 6-PHOSPHOFRUCTOKINASE,True
Q8YKG3,ATP-dependent 6-phosphofructokinase 1,protein,103690,Nostoc sp. (strain PCC 7120 / SAG 25.82 / UTEX 2576),Nostoc sp. (strain PCC 7120 / SAG 25.82 / UTEX 2576),pfkA1,359,PTHR13697:SF52,ATP-DEPENDENT 6-PHOSPHOFRUCTOKINASE 3,True
Q8YVR1,ATP-dependent 6-phosphofructokinase 2,protein,103690,Nostoc sp. (strain PCC 7120 / SAG 25.82 / UTEX 2576),Nostoc sp. (strain PCC 7120 / SAG 25.82 / UTEX 2576),pfkA2,357,PTHR13697:SF52,ATP-DEPENDENT 6-PHOSPHOFRUCTOKINASE 3,True
Q8ZJL6,ATP-dependent 6-phosphofructokinase,protein,632,Yersinia pestis,Yersinia pestis,pfkA,327,PTHR13697:SF4,ATP-DEPENDENT 6-PHOSPHOFRUCTOKINASE,True
Q92448,ATP-dependent 6-phosphofructokinase subunit alpha,protein,644223,Komagataella phaffii (strain GS115 / ATCC 20864),Komagataella phaffii (strain GS115 / ATCC 20864) (Yeast),PFK1,989,PTHR13697:SF57,ATP-DEPENDENT 6-PHOSPHOFRUCTOKINASE SUBUNIT ALPHA,True
Q92BE4,ATP-dependent 6-phosphofructokinase,protein,272626,Listeria innocua serovar 6a (strain ATCC BAA-680 / CLIP 11262),Listeria innocua serovar 6a (strain ATCC BAA-680 / CLIP 11262),pfkA,319,PTHR13697:SF4,ATP-DEPENDENT 6-PHOSPHOFRUCTOKINASE,True
Q93LR4,ATP-dependent 6-phosphofructokinase,protein,1421,Lysinibacillus sphaericus,Lysinibacillus sphaericus,pfkA,319,PTHR13697:SF4,ATP-DEPENDENT 6-PHOSPHOFRUCTOKINASE,True
Q97RC6,ATP-dependent 6-phosphofructokinase,protein,170187,Streptococcus pneumoniae serotype 4 (strain ATCC BAA-334 / TIGR4),Streptococcus pneumoniae serotype 4 (strain ATCC BAA-334 / TIGR4),pfkA,335,PTHR13697:SF4,ATP-DEPENDENT 6-PHOSPHOFRUCTOKINASE,True
Q98PW8,ATP-dependent 6-phosphofructokinase,protein,272635,Mycoplasmopsis pulmonis (strain UAB CTIP),Mycoplasmopsis pulmonis (strain UAB CTIP),pfkA,326,PTHR13697:SF4,ATP-DEPENDENT 6-PHOSPHOFRUCTOKINASE,True
Q99ZD0,ATP-dependent 6-phosphofructokinase,protein,301447,Streptococcus pyogenes serotype M1,Streptococcus pyogenes serotype M1,pfkA,337,PTHR13697:SF4,ATP-DEPENDENT 6-PHOSPHOFRUCTOKINASE,True
Q9AGC0,Pyrophosphate--fructose 6-phosphate 1-phosphotransferase,protein,713604,Amycolatopsis mediterranei (strain S699),Amycolatopsis mediterranei (strain S699),pfp,341,PTHR13697:SF52,ATP-DEPENDENT 6-PHOSPHOFRUCTOKINASE 3,True
Q9CPH2,ATP-dependent 6-phosphofructokinase,protein,272843,Pasteurella multocida (strain Pm70),Pasteurella multocida (strain Pm70),pfkA,321,PTHR13697:SF4,ATP-DEPENDENT 6-PHOSPHOFRUCTOKINASE,True
Q9FC99,ATP-dependent 6-phosphofructokinase 3,protein,100226,Streptomyces coelicolor (strain ATCC BAA-471 / A3(2) / M145),Streptomyces coelicolor (strain ATCC BAA-471 / A3(2) / M145),pfkA3,341,PTHR13697:SF52,ATP-DEPENDENT 6-PHOSPHOFRUCTOKINASE 3,True
Q9HGZ0,ATP-dependent 6-phosphofructokinase 2,protein,510516,Aspergillus oryzae (strain ATCC 42149 / RIB 40),Aspergillus oryzae (strain ATCC 42149 / RIB 40) (Yellow koji mold),pfkB,775,PTHR13697:SF4,ATP-DEPENDENT 6-PHOSPHOFRUCTOKINASE,True
Q9HGZ1,ATP-dependent 6-phosphofructokinase 1,protein,510516,Aspergillus oryzae (strain ATCC 42149 / RIB 40),Aspergillus oryzae (strain ATCC 42149 / RIB 40) (Yellow koji mold),pfkA,785,PTHR13697:SF4,ATP-DEPENDENT 6-PHOSPHOFRUCTOKINASE,True
Q9K843,ATP-dependent 6-phosphofructokinase,protein,272558,Halalkalibacterium halodurans (strain ATCC BAA-125 / DSM 18197 / FERM 7344 / JCM 9153 / C-125),Halalkalibacterium halodurans (strain ATCC BAA-125 / DSM 18197 / FERM 7344 / JCM 9153 / C-125),pfkA,319,PTHR13697:SF4,ATP-DEPENDENT 6-PHOSPHOFRUCTOKINASE,True
Q9KH71,Pyrophosphate--fructose 6-phosphate 1-phosphotransferase,protein,14,Dictyoglomus thermophilum,Dictyoglomus thermophilum,pfp,346,PTHR13697:SF52,ATP-DEPENDENT 6-PHOSPHOFRUCTOKINASE 3,True
Q9KNP2,ATP-dependent 6-phosphofructokinase,protein,243277,Vibrio cholerae serotype O1 (strain ATCC 39315 / El Tor Inaba N16961),Vibrio cholerae serotype O1 (strain ATCC 39315 / El Tor Inaba N16961),pfkA,320,PTHR13697:SF4,ATP-DEPENDENT 6-PHOSPHOFRUCTOKINASE,True
Q9L1L8,ATP-dependent 6-phosphofructokinase 2,protein,100226,Streptomyces coelicolor (strain ATCC BAA-471 / A3(2) / M145),Streptomyces coelicolor (strain ATCC BAA-471 / A3(2) / M145),pfkA2,341,PTHR13697:SF52,ATP-DEPENDENT 6-PHOSPHOFRUCTOKINASE 3,True
Q9L9E3,ATP-dependent 6-phosphofructokinase,protein,1308,Streptococcus thermophilus,Streptococcus thermophilus,pfkA,339,PTHR13697:SF4,ATP-DEPENDENT 6-PHOSPHOFRUCTOKINASE,True
Q9PQV8,Probable ATP-dependent 6-phosphofructokinase,protein,273119,Ureaplasma parvum serovar 3 (strain ATCC 700970),Ureaplasma parvum serovar 3 (strain ATCC 700970),pfkA,321,PTHR13697:SF4,ATP-DEPENDENT 6-PHOSPHOFRUCTOKINASE,True
Q9RWN1,ATP-dependent 6-phosphofructokinase,protein,243230,Deinococcus radiodurans (strain ATCC 13939 / DSM 20539 / JCM 16871 / CCUG 27074 / LMG 4051 / NBRC 15346 / NCIMB 9279 / VKM B-1422 / R1),Deinococcus radiodurans (strain ATCC 13939 / DSM 20539 / JCM 16871 / CCUG 27074 / LMG 4051 / NBRC 15346 / NCIMB 9279 / VKM B-1422 / R1),pfkA,329,PTHR13697:SF4,ATP-DEPENDENT 6-PHOSPHOFRUCTOKINASE,True
Q9TZL8,ATP-dependent 6-phosphofructokinase 1,protein,6239,Caenorhabditis elegans,Caenorhabditis elegans,pfk-1.1,814,PTHR13697:SF4,ATP-DEPENDENT 6-PHOSPHOFRUCTOKINASE,True
Q9WUA3,"ATP-dependent 6-phosphofructokinase, platelet type",protein,10090,Mus musculus,Mus musculus (Mouse),Pfkp,784,PTHR13697:SF5,"ATP-DEPENDENT 6-PHOSPHOFRUCTOKINASE, PLATELET TYPE",True
Q9WY52,ATP-dependent 6-phosphofructokinase,protein,243274,Thermotoga maritima (strain ATCC 43589 / DSM 3109 / JCM 10099 / NBRC 100826 / MSB8),Thermotoga maritima (strain ATCC 43589 / DSM 3109 / JCM 10099 / NBRC 100826 / MSB8),pfkA,319,PTHR13697:SF4,ATP-DEPENDENT 6-PHOSPHOFRUCTOKINASE,True
Q9Z6C3,ATP-dependent 6-phosphofructokinase,protein,550,Enterobacter cloacae,Enterobacter cloacae,pfkA,320,PTHR13697:SF4,ATP-DEPENDENT 6-PHOSPHOFRUCTOKINASE,True
