id,name,entry_type,source_tax_id,source_tax_name,full_tax_name,gene,length,subfamily,subfamily_name,in_alphafold
A0AJ20,ATP-dependent 6-phosphofructokinase,protein,386043,Listeria welshimeri serovar 6b (strain ATCC 35897 / DSM 20650 / CCUG 15529 / CIP 8149 / NCTC 11857 / SLCC 5334 / V8),Listeria welshimeri serovar 6b (strain ATCC 35897 / DSM 20650 / CCUG 15529 / CIP 8149 / NCTC 11857 / SLCC 5334 / V8),pfkA,319,PTHR13697:SF4,ATP-DEPENDENT 6-PHOSPHOFRUCTOKINASE,True
A0PYC8,ATP-dependent 6-phosphofructokinase,protein,386415,Clostridium novyi (strain NT),Clostridium novyi (strain NT),pfkA,319,PTHR13697:SF4,ATP-DEPENDENT 6-PHOSPHOFRUCTOKINASE,True
A0RJJ6,ATP-dependent 6-phosphofructokinase,protein,412694,Bacillus thuringiensis (strain Al Hakam),Bacillus thuringiensis (strain Al Hakam),pfkA,319,PTHR13697:SF4,ATP-DEPENDENT 6-PHOSPHOFRUCTOKINASE,True
A1A4J1,"ATP-dependent 6-phosphofructokinase, liver type",protein,9913,Bos taurus,Bos taurus (Bovine),PFKL,780,PTHR13697:SF14,"ATP-DEPENDENT 6-PHOSPHOFRUCTOKINASE, LIVER TYPE",True
A1JHZ3,ATP-dependent 6-phosphofructokinase,protein,393305,Yersinia enterocolitica serotype O:8 / biotype 1B (strain NCTC 13174 / 8081),Yersinia enterocolitica serotype O:8 / biotype 1B (strain NCTC 13174 / 8081),pfkA,331,PTHR13697:SF4,ATP-DEPENDENT 6-PHOSPHOFRUCTOKINASE,True
A2RE65,ATP-dependent 6-phosphofructokinase,protein,160491,Streptococcus pyogenes serotype M5 (strain Manfredo),Streptococcus pyogenes serotype M5 (strain Manfredo),pfkA,337,PTHR13697:SF4,ATP-DEPENDENT 6-PHOSPHOFRUCTOKINASE,True
A2RKA2,ATP-dependent 6-phosphofructokinase,protein,416870,Lactococcus lactis subsp. cremoris (strain MG1363),Lactococcus lactis subsp. cremoris (strain MG1363),pfkA,340,PTHR13697:SF4,ATP-DEPENDENT 6-PHOSPHOFRUCTOKINASE,True
A3CM69,ATP-dependent 6-phosphofructokinase,protein,388919,Streptococcus sanguinis (strain SK36),Streptococcus sanguinis (strain SK36),pfkA,336,PTHR13697:SF4,ATP-DEPENDENT 6-PHOSPHOFRUCTOKINASE,True
A3N1C8,ATP-dependent 6-phosphofructokinase,protein,416269,Actinobacillus pleuropneumoniae serotype 5b (strain L20),Actinobacillus pleuropneumoniae serotype 5b (strain L20),pfkA,324,PTHR13697:SF4,ATP-DEPENDENT 6-PHOSPHOFRUCTOKINASE,True
A4TSA7,ATP-dependent 6-phosphofructokinase,protein,386656,Yersinia pestis (strain Pestoides F),Yersinia pestis (strain Pestoides F),pfkA,327,PTHR13697:SF4,ATP-DEPENDENT 6-PHOSPHOFRUCTOKINASE,True
A4VTS0,ATP-dependent 6-phosphofructokinase,protein,391295,Streptococcus suis (strain 05ZYH33),Streptococcus suis (strain 05ZYH33),pfkA,336,PTHR13697:SF4,ATP-DEPENDENT 6-PHOSPHOFRUCTOKINASE,True
A4WG81,ATP-dependent 6-phosphofructokinase,protein,399742,Enterobacter sp. (strain 638),Enterobacter sp. (strain 638),pfkA,320,PTHR13697:SF4,ATP-DEPENDENT 6-PHOSPHOFRUCTOKINASE,True
A5I798,ATP-dependent 6-phosphofructokinase,protein,441771,Clostridium botulinum (strain Hall / ATCC 3502 / NCTC 13319 / Type A),Clostridium botulinum (strain Hall / ATCC 3502 / NCTC 13319 / Type A),pfkA,319,PTHR13697:SF4,ATP-DEPENDENT 6-PHOSPHOFRUCTOKINASE,True
A5IKL2,ATP-dependent 6-phosphofructokinase,protein,390874,Thermotoga petrophila (strain ATCC BAA-488 / DSM 13995 / JCM 10881 / RKU-1),Thermotoga petrophila (strain ATCC BAA-488 / DSM 13995 / JCM 10881 / RKU-1),pfkA,319,PTHR13697:SF4,ATP-DEPENDENT 6-PHOSPHOFRUCTOKINASE,True
A5ITM2,ATP-dependent 6-phosphofructokinase,protein,359786,Staphylococcus aureus (strain JH9),Staphylococcus aureus (strain JH9),pfkA,322,PTHR13697:SF4,ATP-DEPENDENT 6-PHOSPHOFRUCTOKINASE,True
A5UD89,ATP-dependent 6-phosphofructokinase,protein,374930,Haemophilus influenzae (strain PittEE),Haemophilus influenzae (strain PittEE),pfkA,321,PTHR13697:SF4,ATP-DEPENDENT 6-PHOSPHOFRUCTOKINASE,True
A6QAB4,ATP-dependent 6-phosphofructokinase,protein,387093,Sulfurovum sp. (strain NBC37-1),Sulfurovum sp. (strain NBC37-1),pfkA,327,PTHR13697:SF4,ATP-DEPENDENT 6-PHOSPHOFRUCTOKINASE,True
A6QHN3,ATP-dependent 6-phosphofructokinase,protein,426430,Staphylococcus aureus (strain Newman),Staphylococcus aureus (strain Newman),pfkA,322,PTHR13697:SF4,ATP-DEPENDENT 6-PHOSPHOFRUCTOKINASE,True
A6TGB8,ATP-dependent 6-phosphofructokinase,protein,272620,Klebsiella pneumoniae subsp. pneumoniae (strain ATCC 700721 / MGH 78578),Klebsiella pneumoniae subsp. pneumoniae (strain ATCC 700721 / MGH 78578),pfkA,320,PTHR13697:SF4,ATP-DEPENDENT 6-PHOSPHOFRUCTOKINASE,True
A6TVD3,ATP-dependent 6-phosphofructokinase,protein,293826,Alkaliphilus metalliredigens (strain QYMF),Alkaliphilus metalliredigens (strain QYMF),pfkA,319,PTHR13697:SF4,ATP-DEPENDENT 6-PHOSPHOFRUCTOKINASE,True
A6U2G5,ATP-dependent 6-phosphofructokinase,protein,359787,Staphylococcus aureus (strain JH1),Staphylococcus aureus (strain JH1),pfkA,322,PTHR13697:SF4,ATP-DEPENDENT 6-PHOSPHOFRUCTOKINASE,True
A6VM63,ATP-dependent 6-phosphofructokinase,protein,339671,Actinobacillus succinogenes (strain ATCC 55618 / DSM 22257 / CCUG 43843 / 130Z),Actinobacillus succinogenes (strain ATCC 55618 / DSM 22257 / CCUG 43843 / 130Z),pfkA,321,PTHR13697:SF4,ATP-DEPENDENT 6-PHOSPHOFRUCTOKINASE,True
A7FCW1,ATP-dependent 6-phosphofructokinase,protein,349747,Yersinia pseudotuberculosis serotype O:1b (strain IP 31758),Yersinia pseudotuberculosis serotype O:1b (strain IP 31758),pfkA,327,PTHR13697:SF4,ATP-DEPENDENT 6-PHOSPHOFRUCTOKINASE,True
A7FYW7,ATP-dependent 6-phosphofructokinase,protein,441770,Clostridium botulinum (strain ATCC 19397 / Type A),Clostridium botulinum (strain ATCC 19397 / Type A),pfkA,319,PTHR13697:SF4,ATP-DEPENDENT 6-PHOSPHOFRUCTOKINASE,True
A7GIW9,ATP-dependent 6-phosphofructokinase,protein,441772,Clostridium botulinum (strain Langeland / NCTC 10281 / Type F),Clostridium botulinum (strain Langeland / NCTC 10281 / Type F),pfkA,319,PTHR13697:SF4,ATP-DEPENDENT 6-PHOSPHOFRUCTOKINASE,True
A7GTP4,ATP-dependent 6-phosphofructokinase,protein,315749,Bacillus cytotoxicus (strain DSM 22905 / CIP 110041 / 391-98 / NVH 391-98),Bacillus cytotoxicus (strain DSM 22905 / CIP 110041 / 391-98 / NVH 391-98),pfkA,319,PTHR13697:SF4,ATP-DEPENDENT 6-PHOSPHOFRUCTOKINASE,True
A7MQ83,ATP-dependent 6-phosphofructokinase,protein,290339,Cronobacter sakazakii (strain ATCC BAA-894),Cronobacter sakazakii (strain ATCC BAA-894),pfkA,320,PTHR13697:SF4,ATP-DEPENDENT 6-PHOSPHOFRUCTOKINASE,True
A7MX59,ATP-dependent 6-phosphofructokinase,protein,2902295,Vibrio campbellii (strain ATCC BAA-1116),Vibrio campbellii (strain ATCC BAA-1116),pfkA,320,PTHR13697:SF4,ATP-DEPENDENT 6-PHOSPHOFRUCTOKINASE,True
A7Z7K6,ATP-dependent 6-phosphofructokinase,protein,326423,Bacillus velezensis (strain DSM 23117 / BGSC 10A6 / LMG 26770 / FZB42),Bacillus velezensis (strain DSM 23117 / BGSC 10A6 / LMG 26770 / FZB42),pfkA,319,PTHR13697:SF4,ATP-DEPENDENT 6-PHOSPHOFRUCTOKINASE,True
A7ZUC9,ATP-dependent 6-phosphofructokinase isozyme 1,protein,331111,Escherichia coli O139:H28 (strain E24377A / ETEC),Escherichia coli O139:H28 (strain E24377A / ETEC),pfkA,320,PTHR13697:SF4,ATP-DEPENDENT 6-PHOSPHOFRUCTOKINASE,True
A8A720,ATP-dependent 6-phosphofructokinase isozyme 1,protein,331112,Escherichia coli O9:H4 (strain HS),Escherichia coli O9:H4 (strain HS),pfkA,320,PTHR13697:SF4,ATP-DEPENDENT 6-PHOSPHOFRUCTOKINASE,True
A8AL13,ATP-dependent 6-phosphofructokinase,protein,290338,Citrobacter koseri (strain ATCC BAA-895 / CDC 4225-83 / SGSC4696),Citrobacter koseri (strain ATCC BAA-895 / CDC 4225-83 / SGSC4696),pfkA,320,PTHR13697:SF4,ATP-DEPENDENT 6-PHOSPHOFRUCTOKINASE,True
A8AXW1,ATP-dependent 6-phosphofructokinase,protein,467705,Streptococcus gordonii (strain Challis / ATCC 35105 / BCRC 15272 / CH1 / DL1 / V288),Streptococcus gordonii (strain Challis / ATCC 35105 / BCRC 15272 / CH1 / DL1 / V288),pfkA,336,PTHR13697:SF4,ATP-DEPENDENT 6-PHOSPHOFRUCTOKINASE,True
A8FG55,ATP-dependent 6-phosphofructokinase,protein,315750,Bacillus pumilus (strain SAFR-032),Bacillus pumilus (strain SAFR-032),pfkA,319,PTHR13697:SF4,ATP-DEPENDENT 6-PHOSPHOFRUCTOKINASE,True
A8GLB0,ATP-dependent 6-phosphofructokinase,protein,399741,Serratia proteamaculans (strain 568),Serratia proteamaculans (strain 568),pfkA,320,PTHR13697:SF4,ATP-DEPENDENT 6-PHOSPHOFRUCTOKINASE,True
A8MLY0,ATP-dependent 6-phosphofructokinase,protein,350688,Alkaliphilus oremlandii (strain OhILAs),Alkaliphilus oremlandii (strain OhILAs),pfkA,319,PTHR13697:SF4,ATP-DEPENDENT 6-PHOSPHOFRUCTOKINASE,True
A8YV22,ATP-dependent 6-phosphofructokinase,protein,405566,Lactobacillus helveticus (strain DPC 4571),Lactobacillus helveticus (strain DPC 4571),pfkA,320,PTHR13697:SF4,ATP-DEPENDENT 6-PHOSPHOFRUCTOKINASE,True
A8Z2L4,ATP-dependent 6-phosphofructokinase,protein,451516,Staphylococcus aureus (strain USA300 / TCH1516),Staphylococcus aureus (strain USA300 / TCH1516),pfkA,322,PTHR13697:SF4,ATP-DEPENDENT 6-PHOSPHOFRUCTOKINASE,True
A9MI50,ATP-dependent 6-phosphofructokinase,protein,41514,Salmonella arizonae (strain ATCC BAA-731 / CDC346-86 / RSK2980),Salmonella arizonae (strain ATCC BAA-731 / CDC346-86 / RSK2980),pfkA,320,PTHR13697:SF4,ATP-DEPENDENT 6-PHOSPHOFRUCTOKINASE,True
A9MZE7,ATP-dependent 6-phosphofructokinase,protein,1016998,Salmonella paratyphi B (strain ATCC BAA-1250 / SPB7),Salmonella paratyphi B (strain ATCC BAA-1250 / SPB7),pfkA,320,PTHR13697:SF4,ATP-DEPENDENT 6-PHOSPHOFRUCTOKINASE,True
A9R6A3,ATP-dependent 6-phosphofructokinase,protein,349746,Yersinia pestis bv. Antiqua (strain Angola),Yersinia pestis bv. Antiqua (strain Angola),pfkA,327,PTHR13697:SF4,ATP-DEPENDENT 6-PHOSPHOFRUCTOKINASE,True
A9VJR1,ATP-dependent 6-phosphofructokinase,protein,315730,Bacillus mycoides (strain KBAB4),Bacillus mycoides (strain KBAB4),pfkA,319,PTHR13697:SF4,ATP-DEPENDENT 6-PHOSPHOFRUCTOKINASE,True
A9WCU2,ATP-dependent 6-phosphofructokinase,protein,324602,Chloroflexus aurantiacus (strain ATCC 29366 / DSM 635 / J-10-fl),Chloroflexus aurantiacus (strain ATCC 29366 / DSM 635 / J-10-fl),pfkA,356,PTHR13697:SF52,ATP-DEPENDENT 6-PHOSPHOFRUCTOKINASE 3,True
B0BQ64,ATP-dependent 6-phosphofructokinase,protein,434271,Actinobacillus pleuropneumoniae serotype 3 (strain JL03),Actinobacillus pleuropneumoniae serotype 3 (strain JL03),pfkA,324,PTHR13697:SF4,ATP-DEPENDENT 6-PHOSPHOFRUCTOKINASE,True
B0K6L2,ATP-dependent 6-phosphofructokinase,protein,399726,Thermoanaerobacter sp. (strain X514),Thermoanaerobacter sp. (strain X514),pfkA,321,PTHR13697:SF4,ATP-DEPENDENT 6-PHOSPHOFRUCTOKINASE,True
B0K7U7,ATP-dependent 6-phosphofructokinase,protein,340099,Thermoanaerobacter pseudethanolicus (strain ATCC 33223 / 39E),Thermoanaerobacter pseudethanolicus (strain ATCC 33223 / 39E),pfkA,321,PTHR13697:SF4,ATP-DEPENDENT 6-PHOSPHOFRUCTOKINASE,True
B0S230,ATP-dependent 6-phosphofructokinase,protein,334413,Finegoldia magna (strain ATCC 29328 / DSM 20472 / WAL 2508),Finegoldia magna (strain ATCC 29328 / DSM 20472 / WAL 2508),pfkA,319,PTHR13697:SF4,ATP-DEPENDENT 6-PHOSPHOFRUCTOKINASE,True
B0UW05,ATP-dependent 6-phosphofructokinase,protein,228400,Histophilus somni (strain 2336),Histophilus somni (strain 2336),pfkA,321,PTHR13697:SF4,ATP-DEPENDENT 6-PHOSPHOFRUCTOKINASE,True
B1IB66,ATP-dependent 6-phosphofructokinase,protein,487214,Streptococcus pneumoniae (strain Hungary19A-6),Streptococcus pneumoniae (strain Hungary19A-6),pfkA,335,PTHR13697:SF4,ATP-DEPENDENT 6-PHOSPHOFRUCTOKINASE,True
B1IFV9,ATP-dependent 6-phosphofructokinase,protein,498213,Clostridium botulinum (strain Okra / Type B1),Clostridium botulinum (strain Okra / Type B1),pfkA,319,PTHR13697:SF4,ATP-DEPENDENT 6-PHOSPHOFRUCTOKINASE,True
B1IVG3,ATP-dependent 6-phosphofructokinase isozyme 1,protein,481805,Escherichia coli (strain ATCC 8739 / DSM 1576 / NBRC 3972 / NCIMB 8545 / WDCM 00012 / Crooks),Escherichia coli (strain ATCC 8739 / DSM 1576 / NBRC 3972 / NCIMB 8545 / WDCM 00012 / Crooks),pfkA,320,PTHR13697:SF4,ATP-DEPENDENT 6-PHOSPHOFRUCTOKINASE,True
B1JQU4,ATP-dependent 6-phosphofructokinase,protein,502800,Yersinia pseudotuberculosis serotype O:3 (strain YPIII),Yersinia pseudotuberculosis serotype O:3 (strain YPIII),pfkA,327,PTHR13697:SF4,ATP-DEPENDENT 6-PHOSPHOFRUCTOKINASE,True
B1L266,ATP-dependent 6-phosphofructokinase,protein,498214,Clostridium botulinum (strain Loch Maree / Type A3),Clostridium botulinum (strain Loch Maree / Type A3),pfkA,319,PTHR13697:SF4,ATP-DEPENDENT 6-PHOSPHOFRUCTOKINASE,True
B1L9U3,ATP-dependent 6-phosphofructokinase,protein,126740,Thermotoga sp. (strain RQ2),Thermotoga sp. (strain RQ2),pfkA,319,PTHR13697:SF4,ATP-DEPENDENT 6-PHOSPHOFRUCTOKINASE,True
B1LNL9,ATP-dependent 6-phosphofructokinase isozyme 1,protein,439855,Escherichia coli (strain SMS-3-5 / SECEC),Escherichia coli (strain SMS-3-5 / SECEC),pfkA,320,PTHR13697:SF4,ATP-DEPENDENT 6-PHOSPHOFRUCTOKINASE,True
B1XB82,ATP-dependent 6-phosphofructokinase isozyme 1,protein,316385,Escherichia coli (strain K12 / DH10B),Escherichia coli (strain K12 / DH10B),pfkA,320,PTHR13697:SF4,ATP-DEPENDENT 6-PHOSPHOFRUCTOKINASE,True
B2A6Y0,ATP-dependent 6-phosphofructokinase,protein,457570,Natranaerobius thermophilus (strain ATCC BAA-1301 / DSM 18059 / JW/NM-WN-LF),Natranaerobius thermophilus (strain ATCC BAA-1301 / DSM 18059 / JW/NM-WN-LF),pfkA,319,PTHR13697:SF4,ATP-DEPENDENT 6-PHOSPHOFRUCTOKINASE,True
B2IP53,ATP-dependent 6-phosphofructokinase,protein,516950,Streptococcus pneumoniae (strain CGSP14),Streptococcus pneumoniae (strain CGSP14),pfkA,335,PTHR13697:SF4,ATP-DEPENDENT 6-PHOSPHOFRUCTOKINASE,True
B2JZA3,ATP-dependent 6-phosphofructokinase,protein,502801,Yersinia pseudotuberculosis serotype IB (strain PB1/+),Yersinia pseudotuberculosis serotype IB (strain PB1/+),pfkA,327,PTHR13697:SF4,ATP-DEPENDENT 6-PHOSPHOFRUCTOKINASE,True
B2TQR6,ATP-dependent 6-phosphofructokinase,protein,935198,Clostridium botulinum (strain Eklund 17B / Type B),Clostridium botulinum (strain Eklund 17B / Type B),pfkA,320,PTHR13697:SF4,ATP-DEPENDENT 6-PHOSPHOFRUCTOKINASE,True
B2TVQ8,ATP-dependent 6-phosphofructokinase isozyme 1,protein,344609,Shigella boydii serotype 18 (strain CDC 3083-94 / BS512),Shigella boydii serotype 18 (strain CDC 3083-94 / BS512),pfkA,320,PTHR13697:SF4,ATP-DEPENDENT 6-PHOSPHOFRUCTOKINASE,True
B2UZX8,ATP-dependent 6-phosphofructokinase,protein,508767,Clostridium botulinum (strain Alaska E43 / Type E3),Clostridium botulinum (strain Alaska E43 / Type E3),pfkA,320,PTHR13697:SF4,ATP-DEPENDENT 6-PHOSPHOFRUCTOKINASE,True
B2V7W7,ATP-dependent 6-phosphofructokinase,protein,436114,Sulfurihydrogenibium sp. (strain YO3AOP1),Sulfurihydrogenibium sp. (strain YO3AOP1),pfkA,324,PTHR13697:SF4,ATP-DEPENDENT 6-PHOSPHOFRUCTOKINASE,True
B2VF62,ATP-dependent 6-phosphofructokinase,protein,465817,Erwinia tasmaniensis (strain DSM 17950 / CFBP 7177 / CIP 109463 / NCPPB 4357 / Et1/99),Erwinia tasmaniensis (strain DSM 17950 / CFBP 7177 / CIP 109463 / NCPPB 4357 / Et1/99),pfkA,320,PTHR13697:SF4,ATP-DEPENDENT 6-PHOSPHOFRUCTOKINASE,True
B3GY11,ATP-dependent 6-phosphofructokinase,protein,537457,Actinobacillus pleuropneumoniae serotype 7 (strain AP76),Actinobacillus pleuropneumoniae serotype 7 (strain AP76),pfkA,324,PTHR13697:SF4,ATP-DEPENDENT 6-PHOSPHOFRUCTOKINASE,True
B3WE64,ATP-dependent 6-phosphofructokinase,protein,543734,Lacticaseibacillus casei (strain BL23),Lacticaseibacillus casei (strain BL23),pfkA,319,PTHR13697:SF4,ATP-DEPENDENT 6-PHOSPHOFRUCTOKINASE,True
B4T049,ATP-dependent 6-phosphofructokinase,protein,423368,Salmonella newport (strain SL254),Salmonella newport (strain SL254),pfkA,320,PTHR13697:SF4,ATP-DEPENDENT 6-PHOSPHOFRUCTOKINASE,True
B4TCK0,ATP-dependent 6-phosphofructokinase,protein,454169,Salmonella heidelberg (strain SL476),Salmonella heidelberg (strain SL476),pfkA,320,PTHR13697:SF4,ATP-DEPENDENT 6-PHOSPHOFRUCTOKINASE,True
B4TPS6,ATP-dependent 6-phosphofructokinase,protein,439843,Salmonella schwarzengrund (strain CVM19633),Salmonella schwarzengrund (strain CVM19633),pfkA,320,PTHR13697:SF4,ATP-DEPENDENT 6-PHOSPHOFRUCTOKINASE,True
B4U2M2,ATP-dependent 6-phosphofructokinase,protein,552526,Streptococcus equi subsp. zooepidemicus (strain MGCS10565),Streptococcus equi subsp. zooepidemicus (strain MGCS10565),pfkA,337,PTHR13697:SF4,ATP-DEPENDENT 6-PHOSPHOFRUCTOKINASE,True
B5BJI2,ATP-dependent 6-phosphofructokinase,protein,554290,Salmonella paratyphi A (strain AKU_12601),Salmonella paratyphi A (strain AKU_12601),pfkA,320,PTHR13697:SF4,ATP-DEPENDENT 6-PHOSPHOFRUCTOKINASE,True
B5E3Z8,ATP-dependent 6-phosphofructokinase,protein,512566,Streptococcus pneumoniae serotype 19F (strain G54),Streptococcus pneumoniae serotype 19F (strain G54),pfkA,335,PTHR13697:SF4,ATP-DEPENDENT 6-PHOSPHOFRUCTOKINASE,True
B5F0P6,ATP-dependent 6-phosphofructokinase,protein,454166,Salmonella agona (strain SL483),Salmonella agona (strain SL483),pfkA,320,PTHR13697:SF4,ATP-DEPENDENT 6-PHOSPHOFRUCTOKINASE,True
B5FBT1,ATP-dependent 6-phosphofructokinase,protein,388396,Aliivibrio fischeri (strain MJ11),Aliivibrio fischeri (strain MJ11),pfkA,320,PTHR13697:SF4,ATP-DEPENDENT 6-PHOSPHOFRUCTOKINASE,True
B5FPR2,ATP-dependent 6-phosphofructokinase,protein,439851,Salmonella dublin (strain CT_02021853),Salmonella dublin (strain CT_02021853),pfkA,320,PTHR13697:SF4,ATP-DEPENDENT 6-PHOSPHOFRUCTOKINASE,True
B5QWZ5,ATP-dependent 6-phosphofructokinase,protein,550537,Salmonella enteritidis PT4 (strain P125109),Salmonella enteritidis PT4 (strain P125109),pfkA,320,PTHR13697:SF4,ATP-DEPENDENT 6-PHOSPHOFRUCTOKINASE,True
B5RFA9,ATP-dependent 6-phosphofructokinase,protein,550538,Salmonella gallinarum (strain 287/91 / NCTC 13346),Salmonella gallinarum (strain 287/91 / NCTC 13346),pfkA,320,PTHR13697:SF4,ATP-DEPENDENT 6-PHOSPHOFRUCTOKINASE,True
B5XLV6,ATP-dependent 6-phosphofructokinase,protein,471876,Streptococcus pyogenes serotype M49 (strain NZ131),Streptococcus pyogenes serotype M49 (strain NZ131),pfkA,337,PTHR13697:SF4,ATP-DEPENDENT 6-PHOSPHOFRUCTOKINASE,True
B5XZ40,ATP-dependent 6-phosphofructokinase,protein,507522,Klebsiella variicola (strain 342),Klebsiella variicola (strain 342),pfkA,320,PTHR13697:SF4,ATP-DEPENDENT 6-PHOSPHOFRUCTOKINASE,True
B5YZ53,ATP-dependent 6-phosphofructokinase isozyme 1,protein,444450,Escherichia coli O157:H7 (strain EC4115 / EHEC),Escherichia coli O157:H7 (strain EC4115 / EHEC),pfkA,320,PTHR13697:SF4,ATP-DEPENDENT 6-PHOSPHOFRUCTOKINASE,True
B6EMS4,ATP-dependent 6-phosphofructokinase,protein,316275,Aliivibrio salmonicida (strain LFI1238),Aliivibrio salmonicida (strain LFI1238),pfkA,320,PTHR13697:SF4,ATP-DEPENDENT 6-PHOSPHOFRUCTOKINASE,True
B6I4Q8,ATP-dependent 6-phosphofructokinase isozyme 1,protein,409438,Escherichia coli (strain SE11),Escherichia coli (strain SE11),pfkA,320,PTHR13697:SF4,ATP-DEPENDENT 6-PHOSPHOFRUCTOKINASE,True
B7GGT1,ATP-dependent 6-phosphofructokinase,protein,491915,Anoxybacillus flavithermus (strain DSM 21510 / WK1),Anoxybacillus flavithermus (strain DSM 21510 / WK1),pfkA,319,PTHR13697:SF4,ATP-DEPENDENT 6-PHOSPHOFRUCTOKINASE,True
B7HFB3,ATP-dependent 6-phosphofructokinase,protein,405532,Bacillus cereus (strain B4264),Bacillus cereus (strain B4264),pfkA,319,PTHR13697:SF4,ATP-DEPENDENT 6-PHOSPHOFRUCTOKINASE,True
B7HRN9,ATP-dependent 6-phosphofructokinase,protein,405534,Bacillus cereus (strain AH187),Bacillus cereus (strain AH187),pfkA,319,PTHR13697:SF4,ATP-DEPENDENT 6-PHOSPHOFRUCTOKINASE,True
B7IJZ8,ATP-dependent 6-phosphofructokinase,protein,405531,Bacillus cereus (strain G9842),Bacillus cereus (strain G9842),pfkA,319,PTHR13697:SF4,ATP-DEPENDENT 6-PHOSPHOFRUCTOKINASE,True
B7JRX2,ATP-dependent 6-phosphofructokinase,protein,405535,Bacillus cereus (strain AH820),Bacillus cereus (strain AH820),pfkA,319,PTHR13697:SF4,ATP-DEPENDENT 6-PHOSPHOFRUCTOKINASE,True
B7LA13,ATP-dependent 6-phosphofructokinase isozyme 1,protein,585055,Escherichia coli (strain 55989 / EAEC),Escherichia coli (strain 55989 / EAEC),pfkA,320,PTHR13697:SF4,ATP-DEPENDENT 6-PHOSPHOFRUCTOKINASE,True
B7LVC9,ATP-dependent 6-phosphofructokinase,protein,585054,Escherichia fergusonii (strain ATCC 35469 / DSM 13698 / CCUG 18766 / IAM 14443 / JCM 21226 / LMG 7866 / NBRC 102419 / NCTC 12128 / CDC 0568-73),Escherichia fergusonii (strain ATCC 35469 / DSM 13698 / CCUG 18766 / IAM 14443 / JCM 21226 / LMG 7866 / NBRC 102419 / NCTC 12128 / CDC 0568-73),pfkA,320,PTHR13697:SF4,ATP-DEPENDENT 6-PHOSPHOFRUCTOKINASE,True
B7M6W7,ATP-dependent 6-phosphofructokinase isozyme 1,protein,585034,Escherichia coli O8 (strain IAI1),Escherichia coli O8 (strain IAI1),pfkA,320,PTHR13697:SF4,ATP-DEPENDENT 6-PHOSPHOFRUCTOKINASE,True
B7MI48,ATP-dependent 6-phosphofructokinase isozyme 1,protein,585035,Escherichia coli O45:K1 (strain S88 / ExPEC),Escherichia coli O45:K1 (strain S88 / ExPEC),pfkA,320,PTHR13697:SF4,ATP-DEPENDENT 6-PHOSPHOFRUCTOKINASE,True
B7N2Q7,ATP-dependent 6-phosphofructokinase isozyme 1,protein,585397,Escherichia coli O81 (strain ED1a),Escherichia coli O81 (strain ED1a),pfkA,320,PTHR13697:SF4,ATP-DEPENDENT 6-PHOSPHOFRUCTOKINASE,True
B7NFL3,ATP-dependent 6-phosphofructokinase isozyme 1,protein,585056,Escherichia coli O17:K52:H18 (strain UMN026 / ExPEC),Escherichia coli O17:K52:H18 (strain UMN026 / ExPEC),pfkA,320,PTHR13697:SF4,ATP-DEPENDENT 6-PHOSPHOFRUCTOKINASE,True
B7NU91,ATP-dependent 6-phosphofructokinase isozyme 1,protein,585057,Escherichia coli O7:K1 (strain IAI39 / ExPEC),Escherichia coli O7:K1 (strain IAI39 / ExPEC),pfkA,320,PTHR13697:SF4,ATP-DEPENDENT 6-PHOSPHOFRUCTOKINASE,True
B7UNN6,ATP-dependent 6-phosphofructokinase isozyme 1,protein,574521,Escherichia coli O127:H6 (strain E2348/69 / EPEC),Escherichia coli O127:H6 (strain E2348/69 / EPEC),pfkA,320,PTHR13697:SF4,ATP-DEPENDENT 6-PHOSPHOFRUCTOKINASE,True
B8D1K5,ATP-dependent 6-phosphofructokinase,protein,373903,Halothermothrix orenii (strain H 168 / OCM 544 / DSM 9562),Halothermothrix orenii (strain H 168 / OCM 544 / DSM 9562),pfkA,332,PTHR13697:SF4,ATP-DEPENDENT 6-PHOSPHOFRUCTOKINASE,True
B8D7J8,ATP-dependent 6-phosphofructokinase,protein,561501,Buchnera aphidicola subsp. Acyrthosiphon pisum (strain Tuc7),Buchnera aphidicola subsp. Acyrthosiphon pisum (strain Tuc7),pfkA,320,PTHR13697:SF4,ATP-DEPENDENT 6-PHOSPHOFRUCTOKINASE,True
B8D996,ATP-dependent 6-phosphofructokinase,protein,563178,Buchnera aphidicola subsp. Acyrthosiphon pisum (strain 5A),Buchnera aphidicola subsp. Acyrthosiphon pisum (strain 5A),pfkA,320,PTHR13697:SF4,ATP-DEPENDENT 6-PHOSPHOFRUCTOKINASE,True
B8DHH7,ATP-dependent 6-phosphofructokinase,protein,552536,Listeria monocytogenes serotype 4a (strain HCC23),Listeria monocytogenes serotype 4a (strain HCC23),pfkA,319,PTHR13697:SF4,ATP-DEPENDENT 6-PHOSPHOFRUCTOKINASE,True
B8F8G9,ATP-dependent 6-phosphofructokinase,protein,557723,Glaesserella parasuis serovar 5 (strain SH0165),Glaesserella parasuis serovar 5 (strain SH0165),pfkA,321,PTHR13697:SF4,ATP-DEPENDENT 6-PHOSPHOFRUCTOKINASE,True
B8GAA4,ATP-dependent 6-phosphofructokinase,protein,326427,Chloroflexus aggregans (strain MD-66 / DSM 9485),Chloroflexus aggregans (strain MD-66 / DSM 9485),pfkA,356,PTHR13697:SF52,ATP-DEPENDENT 6-PHOSPHOFRUCTOKINASE 3,True
B8ZNU0,ATP-dependent 6-phosphofructokinase,protein,561276,Streptococcus pneumoniae (strain ATCC 700669 / Spain 23F-1),Streptococcus pneumoniae (strain ATCC 700669 / Spain 23F-1),pfkA,335,PTHR13697:SF4,ATP-DEPENDENT 6-PHOSPHOFRUCTOKINASE,True
B9DN94,ATP-dependent 6-phosphofructokinase,protein,396513,Staphylococcus carnosus (strain TM300),Staphylococcus carnosus (strain TM300),pfkA,322,PTHR13697:SF4,ATP-DEPENDENT 6-PHOSPHOFRUCTOKINASE,True
B9DSA4,ATP-dependent 6-phosphofructokinase,protein,218495,Streptococcus uberis (strain ATCC BAA-854 / 0140J),Streptococcus uberis (strain ATCC BAA-854 / 0140J),pfkA,337,PTHR13697:SF4,ATP-DEPENDENT 6-PHOSPHOFRUCTOKINASE,True
B9E7A4,ATP-dependent 6-phosphofructokinase,protein,458233,Macrococcoides caseolyticum (strain JCSC5402),Macrococcoides caseolyticum (strain JCSC5402),pfkA,319,PTHR13697:SF4,ATP-DEPENDENT 6-PHOSPHOFRUCTOKINASE,True
B9J099,ATP-dependent 6-phosphofructokinase,protein,361100,Bacillus cereus (strain Q1),Bacillus cereus (strain Q1),pfkA,319,PTHR13697:SF4,ATP-DEPENDENT 6-PHOSPHOFRUCTOKINASE,True
B9K6R9,ATP-dependent 6-phosphofructokinase,protein,309803,Thermotoga neapolitana (strain ATCC 49049 / DSM 4359 / NBRC 107923 / NS-E),Thermotoga neapolitana (strain ATCC 49049 / DSM 4359 / NBRC 107923 / NS-E),pfkA,319,PTHR13697:SF4,ATP-DEPENDENT 6-PHOSPHOFRUCTOKINASE,True
B9LHK4,ATP-dependent 6-phosphofructokinase,protein,480224,Chloroflexus aurantiacus (strain ATCC 29364 / DSM 637 / Y-400-fl),Chloroflexus aurantiacus (strain ATCC 29364 / DSM 637 / Y-400-fl),pfkA,356,PTHR13697:SF52,ATP-DEPENDENT 6-PHOSPHOFRUCTOKINASE 3,True
C0M8V6,ATP-dependent 6-phosphofructokinase,protein,553482,Streptococcus equi subsp. equi (strain 4047),Streptococcus equi subsp. equi (strain 4047),pfkA,337,PTHR13697:SF4,ATP-DEPENDENT 6-PHOSPHOFRUCTOKINASE,True
C0MGJ9,ATP-dependent 6-phosphofructokinase,protein,553483,Streptococcus equi subsp. zooepidemicus (strain H70),Streptococcus equi subsp. zooepidemicus (strain H70),pfkA,337,PTHR13697:SF4,ATP-DEPENDENT 6-PHOSPHOFRUCTOKINASE,True
C0Q414,ATP-dependent 6-phosphofructokinase,protein,476213,Salmonella paratyphi C (strain RKS4594),Salmonella paratyphi C (strain RKS4594),pfkA,320,PTHR13697:SF4,ATP-DEPENDENT 6-PHOSPHOFRUCTOKINASE,True
C0QQX4,ATP-dependent 6-phosphofructokinase,protein,123214,Persephonella marina (strain DSM 14350 / EX-H1),Persephonella marina (strain DSM 14350 / EX-H1),pfkA,324,PTHR13697:SF4,ATP-DEPENDENT 6-PHOSPHOFRUCTOKINASE,True
C0Z7W7,ATP-dependent 6-phosphofructokinase,protein,358681,Brevibacillus brevis (strain 47 / JCM 6285 / NBRC 100599),Brevibacillus brevis (strain 47 / JCM 6285 / NBRC 100599),pfkA,319,PTHR13697:SF4,ATP-DEPENDENT 6-PHOSPHOFRUCTOKINASE,True
C1C6M8,ATP-dependent 6-phosphofructokinase,protein,488221,Streptococcus pneumoniae (strain 70585),Streptococcus pneumoniae (strain 70585),pfkA,335,PTHR13697:SF4,ATP-DEPENDENT 6-PHOSPHOFRUCTOKINASE,True
C1CDP4,ATP-dependent 6-phosphofructokinase,protein,488222,Streptococcus pneumoniae (strain JJA),Streptococcus pneumoniae (strain JJA),pfkA,335,PTHR13697:SF4,ATP-DEPENDENT 6-PHOSPHOFRUCTOKINASE,True
