id,name,entry_type,source_tax_id,source_tax_name,full_tax_name,gene,length,subfamily,subfamily_name,in_alphafold
C1CJY4,ATP-dependent 6-phosphofructokinase,protein,488223,Streptococcus pneumoniae (strain P1031),Streptococcus pneumoniae (strain P1031),pfkA,335,PTHR13697:SF4,ATP-DEPENDENT 6-PHOSPHOFRUCTOKINASE,True
C1CRZ7,ATP-dependent 6-phosphofructokinase,protein,487213,Streptococcus pneumoniae (strain Taiwan19F-14),Streptococcus pneumoniae (strain Taiwan19F-14),pfkA,335,PTHR13697:SF4,ATP-DEPENDENT 6-PHOSPHOFRUCTOKINASE,True
C1EUU3,ATP-dependent 6-phosphofructokinase,protein,572264,Bacillus cereus (strain 03BB102),Bacillus cereus (strain 03BB102),pfkA,319,PTHR13697:SF4,ATP-DEPENDENT 6-PHOSPHOFRUCTOKINASE,True
C1FM55,ATP-dependent 6-phosphofructokinase,protein,536232,Clostridium botulinum (strain Kyoto / Type A2),Clostridium botulinum (strain Kyoto / Type A2),pfkA,319,PTHR13697:SF4,ATP-DEPENDENT 6-PHOSPHOFRUCTOKINASE,True
C1KVL8,ATP-dependent 6-phosphofructokinase,protein,568819,Listeria monocytogenes serotype 4b (strain CLIP80459),Listeria monocytogenes serotype 4b (strain CLIP80459),pfkA,319,PTHR13697:SF4,ATP-DEPENDENT 6-PHOSPHOFRUCTOKINASE,True
C3KV06,ATP-dependent 6-phosphofructokinase,protein,515621,Clostridium botulinum (strain 657 / Type Ba4),Clostridium botulinum (strain 657 / Type Ba4),pfkA,319,PTHR13697:SF4,ATP-DEPENDENT 6-PHOSPHOFRUCTOKINASE,True
C3L8X8,ATP-dependent 6-phosphofructokinase,protein,568206,Bacillus anthracis (strain CDC 684 / NRRL 3495),Bacillus anthracis (strain CDC 684 / NRRL 3495),pfkA,319,PTHR13697:SF4,ATP-DEPENDENT 6-PHOSPHOFRUCTOKINASE,True
C3PAI8,ATP-dependent 6-phosphofructokinase,protein,592021,Bacillus anthracis (strain A0248),Bacillus anthracis (strain A0248),pfkA,319,PTHR13697:SF4,ATP-DEPENDENT 6-PHOSPHOFRUCTOKINASE,True
C4K7E1,ATP-dependent 6-phosphofructokinase,protein,572265,Hamiltonella defensa subsp. Acyrthosiphon pisum (strain 5AT),Hamiltonella defensa subsp. Acyrthosiphon pisum (strain 5AT),pfkA,327,PTHR13697:SF4,ATP-DEPENDENT 6-PHOSPHOFRUCTOKINASE,True
C4LEQ5,ATP-dependent 6-phosphofructokinase,protein,595494,Tolumonas auensis (strain DSM 9187 / NBRC 110442 / TA 4),Tolumonas auensis (strain DSM 9187 / NBRC 110442 / TA 4),pfkA,320,PTHR13697:SF4,ATP-DEPENDENT 6-PHOSPHOFRUCTOKINASE,True
C4QXA5,ATP-dependent 6-phosphofructokinase subunit beta,protein,644223,Komagataella phaffii (strain GS115 / ATCC 20864),Komagataella phaffii (strain GS115 / ATCC 20864) (Yeast),PFK2,941,PTHR13697:SF4,ATP-DEPENDENT 6-PHOSPHOFRUCTOKINASE,True
C5A083,ATP-dependent 6-phosphofructokinase isozyme 1,protein,595496,Escherichia coli (strain K12 / MC4100 / BW2952),Escherichia coli (strain K12 / MC4100 / BW2952),pfkA,320,PTHR13697:SF4,ATP-DEPENDENT 6-PHOSPHOFRUCTOKINASE,True
C5BC26,ATP-dependent 6-phosphofructokinase,protein,634503,Edwardsiella ictaluri (strain 93-146),Edwardsiella ictaluri (strain 93-146),pfkA,320,PTHR13697:SF4,ATP-DEPENDENT 6-PHOSPHOFRUCTOKINASE,True
C5BNR1,ATP-dependent 6-phosphofructokinase,protein,377629,Teredinibacter turnerae (strain ATCC 39867 / T7901),Teredinibacter turnerae (strain ATCC 39867 / T7901),pfkA,320,PTHR13697:SF4,ATP-DEPENDENT 6-PHOSPHOFRUCTOKINASE,True
C5D663,ATP-dependent 6-phosphofructokinase,protein,471223,Geobacillus sp. (strain WCH70),Geobacillus sp. (strain WCH70),pfkA,319,PTHR13697:SF4,ATP-DEPENDENT 6-PHOSPHOFRUCTOKINASE,True
C6DHK2,ATP-dependent 6-phosphofructokinase,protein,561230,Pectobacterium carotovorum subsp. carotovorum (strain PC1),Pectobacterium carotovorum subsp. carotovorum (strain PC1),pfkA,320,PTHR13697:SF4,ATP-DEPENDENT 6-PHOSPHOFRUCTOKINASE,True
D7GCU5,ATP-dependent 6-phosphofructokinase,protein,754252,Propionibacterium freudenreichii subsp. shermanii (strain ATCC 9614 / DSM 4902 / CIP 103027 / NCIMB 8099 / CIRM-BIA1),Propionibacterium freudenreichii subsp. shermanii (strain ATCC 9614 / DSM 4902 / CIP 103027 / NCIMB 8099 / CIRM-BIA1),pfkA,373,PTHR13697:SF52,ATP-DEPENDENT 6-PHOSPHOFRUCTOKINASE 3,True
E0RTD9,ATP-dependent 6-phosphofructokinase,protein,665571,Winmispira thermophila (strain ATCC 49972 / DSM 6192 / RI 19.B1),Winmispira thermophila (strain ATCC 49972 / DSM 6192 / RI 19.B1),pfkA,366,PTHR13697:SF52,ATP-DEPENDENT 6-PHOSPHOFRUCTOKINASE 3,True
G4RK16,Pyrophosphate--fructose 6-phosphate 1-phosphotransferase,protein,768679,Thermoproteus tenax (strain ATCC 35583 / DSM 2078 / JCM 9277 / NBRC 100435 / Kra 1),Thermoproteus tenax (strain ATCC 35583 / DSM 2078 / JCM 9277 / NBRC 100435 / Kra 1),pfp,337,PTHR13697:SF52,ATP-DEPENDENT 6-PHOSPHOFRUCTOKINASE 3,True
O08308,ATP-dependent 6-phosphofructokinase,protein,272562,Clostridium acetobutylicum (strain ATCC 824 / DSM 792 / JCM 1419 / IAM 19013 / LMG 5710 / NBRC 13948 / NRRL B-527 / VKM B-1787 / 2291 / W),Clostridium acetobutylicum (strain ATCC 824 / DSM 792 / JCM 1419 / IAM 19013 / LMG 5710 / NBRC 13948 / NRRL B-527 / VKM B-1787 / 2291 / W),pfkA,319,PTHR13697:SF4,ATP-DEPENDENT 6-PHOSPHOFRUCTOKINASE,True
O08333,Pyrophosphate--fructose 6-phosphate 1-phosphotransferase,protein,100226,Streptomyces coelicolor (strain ATCC BAA-471 / A3(2) / M145),Streptomyces coelicolor (strain ATCC BAA-471 / A3(2) / M145),pfkA1,342,PTHR13697:SF52,ATP-DEPENDENT 6-PHOSPHOFRUCTOKINASE 3,True
O33106,ATP-dependent 6-phosphofructokinase,protein,272631,Mycobacterium leprae (strain TN),Mycobacterium leprae (strain TN),pfkA,343,PTHR13697:SF52,ATP-DEPENDENT 6-PHOSPHOFRUCTOKINASE 3,True
O34529,ATP-dependent 6-phosphofructokinase,protein,224308,Bacillus subtilis (strain 168),Bacillus subtilis (strain 168),pfkA,319,PTHR13697:SF4,ATP-DEPENDENT 6-PHOSPHOFRUCTOKINASE,True
O42938,ATP-dependent 6-phosphofructokinase,protein,284812,Schizosaccharomyces pombe (strain 972 / ATCC 24843),Schizosaccharomyces pombe (strain 972 / ATCC 24843) (Fission yeast),pfk1,942,PTHR13697:SF4,ATP-DEPENDENT 6-PHOSPHOFRUCTOKINASE,True
O67605,ATP-dependent 6-phosphofructokinase,protein,224324,Aquifex aeolicus (strain VF5),Aquifex aeolicus (strain VF5),pfkA,321,PTHR13697:SF4,ATP-DEPENDENT 6-PHOSPHOFRUCTOKINASE,True
O94200,ATP-dependent 6-phosphofructokinase subunit beta,protein,5476,Candida albicans,Candida albicans (Yeast),PFK2,946,PTHR13697:SF4,ATP-DEPENDENT 6-PHOSPHOFRUCTOKINASE,True
O94201,ATP-dependent 6-phosphofructokinase subunit alpha,protein,5476,Candida albicans,Candida albicans (Yeast),PFK1,987,PTHR13697:SF57,ATP-DEPENDENT 6-PHOSPHOFRUCTOKINASE SUBUNIT ALPHA,True
P00511,"ATP-dependent 6-phosphofructokinase, muscle type",protein,9986,Oryctolagus cuniculus,Oryctolagus cuniculus (Rabbit),PFKM,780,PTHR13697:SF59,"ATP-DEPENDENT 6-PHOSPHOFRUCTOKINASE, MUSCLE TYPE",True
P00512,ATP-dependent 6-phosphofructokinase,protein,1422,Geobacillus stearothermophilus,Geobacillus stearothermophilus,pfkA,319,PTHR13697:SF4,ATP-DEPENDENT 6-PHOSPHOFRUCTOKINASE,True
P08237,"ATP-dependent 6-phosphofructokinase, muscle type",protein,9606,Homo sapiens,Homo sapiens (Human),PFKM,780,PTHR13697:SF59,"ATP-DEPENDENT 6-PHOSPHOFRUCTOKINASE, MUSCLE TYPE",True
P0A796,ATP-dependent 6-phosphofructokinase isozyme 1,protein,83333,Escherichia coli (strain K12),Escherichia coli (strain K12),pfkA,320,PTHR13697:SF4,ATP-DEPENDENT 6-PHOSPHOFRUCTOKINASE,True
P0A797,ATP-dependent 6-phosphofructokinase isozyme 1,protein,83334,Escherichia coli O157:H7,Escherichia coli O157:H7,pfkA,320,PTHR13697:SF4,ATP-DEPENDENT 6-PHOSPHOFRUCTOKINASE,True
P0A798,ATP-dependent 6-phosphofructokinase isozyme 1,protein,623,Shigella flexneri,Shigella flexneri,pfkA,320,PTHR13697:SF4,ATP-DEPENDENT 6-PHOSPHOFRUCTOKINASE,True
P0DD02,ATP-dependent 6-phosphofructokinase,protein,198466,Streptococcus pyogenes serotype M3 (strain ATCC BAA-595 / MGAS315),Streptococcus pyogenes serotype M3 (strain ATCC BAA-595 / MGAS315),pfkA,337,PTHR13697:SF4,ATP-DEPENDENT 6-PHOSPHOFRUCTOKINASE,True
P0DD03,ATP-dependent 6-phosphofructokinase,protein,193567,Streptococcus pyogenes serotype M3 (strain SSI-1),Streptococcus pyogenes serotype M3 (strain SSI-1),pfkA,337,PTHR13697:SF4,ATP-DEPENDENT 6-PHOSPHOFRUCTOKINASE,True
P0DOB5,ATP-dependent 6-phosphofructokinase,protein,272623,Lactococcus lactis subsp. lactis (strain IL1403),Lactococcus lactis subsp. lactis (strain IL1403),pfkA,340,PTHR13697:SF4,ATP-DEPENDENT 6-PHOSPHOFRUCTOKINASE,True
P0DOB6,ATP-dependent 6-phosphofructokinase,protein,1360,Lactococcus lactis subsp. lactis,Lactococcus lactis subsp. lactis,pfkA,340,PTHR13697:SF4,ATP-DEPENDENT 6-PHOSPHOFRUCTOKINASE,True
P0DOB7,ATP-dependent 6-phosphofructokinase,protein,1360,Lactococcus lactis subsp. lactis,Lactococcus lactis subsp. lactis,pfkA,340,PTHR13697:SF4,ATP-DEPENDENT 6-PHOSPHOFRUCTOKINASE,True
P12382,"ATP-dependent 6-phosphofructokinase, liver type",protein,10090,Mus musculus,Mus musculus (Mouse),Pfkl,780,PTHR13697:SF14,"ATP-DEPENDENT 6-PHOSPHOFRUCTOKINASE, LIVER TYPE",True
P16861,ATP-dependent 6-phosphofructokinase subunit alpha,protein,559292,Saccharomyces cerevisiae (strain ATCC 204508 / S288c),Saccharomyces cerevisiae (strain ATCC 204508 / S288c) (Baker's yeast),PFK1,987,PTHR13697:SF57,ATP-DEPENDENT 6-PHOSPHOFRUCTOKINASE SUBUNIT ALPHA,True
P16862,ATP-dependent 6-phosphofructokinase subunit beta,protein,559292,Saccharomyces cerevisiae (strain ATCC 204508 / S288c),Saccharomyces cerevisiae (strain ATCC 204508 / S288c) (Baker's yeast),PFK2,959,PTHR13697:SF4,ATP-DEPENDENT 6-PHOSPHOFRUCTOKINASE,True
P17858,"ATP-dependent 6-phosphofructokinase, liver type",protein,9606,Homo sapiens,Homo sapiens (Human),PFKL,780,PTHR13697:SF14,"ATP-DEPENDENT 6-PHOSPHOFRUCTOKINASE, LIVER TYPE",True
P20275,ATP-dependent 6-phosphofructokinase,protein,2133,Spiroplasma citri,Spiroplasma citri,pfkA,327,PTHR13697:SF4,ATP-DEPENDENT 6-PHOSPHOFRUCTOKINASE,True
P21777,ATP-dependent 6-phosphofructokinase 1,protein,300852,Thermus thermophilus (strain ATCC 27634 / DSM 579 / HB8),Thermus thermophilus (strain ATCC 27634 / DSM 579 / HB8),pfkA,322,PTHR13697:SF4,ATP-DEPENDENT 6-PHOSPHOFRUCTOKINASE,True
P30835,"ATP-dependent 6-phosphofructokinase, liver type",protein,10116,Rattus norvegicus,Rattus norvegicus (Rat),Pfkl,780,PTHR13697:SF14,"ATP-DEPENDENT 6-PHOSPHOFRUCTOKINASE, LIVER TYPE",True
P43863,ATP-dependent 6-phosphofructokinase,protein,71421,Haemophilus influenzae (strain ATCC 51907 / DSM 11121 / KW20 / Rd),Haemophilus influenzae (strain ATCC 51907 / DSM 11121 / KW20 / Rd),pfkA,321,PTHR13697:SF4,ATP-DEPENDENT 6-PHOSPHOFRUCTOKINASE,True
P47457,Probable ATP-dependent 6-phosphofructokinase,protein,243273,Mycoplasmoides genitalium (strain ATCC 33530 / DSM 19775 / NCTC 10195 / G37),Mycoplasmoides genitalium (strain ATCC 33530 / DSM 19775 / NCTC 10195 / G37),pfkA,323,PTHR13697:SF4,ATP-DEPENDENT 6-PHOSPHOFRUCTOKINASE,True
P47857,"ATP-dependent 6-phosphofructokinase, muscle type",protein,10090,Mus musculus,Mus musculus (Mouse),Pfkm,780,PTHR13697:SF59,"ATP-DEPENDENT 6-PHOSPHOFRUCTOKINASE, MUSCLE TYPE",True
P47858,"ATP-dependent 6-phosphofructokinase, muscle type",protein,10116,Rattus norvegicus,Rattus norvegicus (Rat),Pfkm,780,PTHR13697:SF59,"ATP-DEPENDENT 6-PHOSPHOFRUCTOKINASE, MUSCLE TYPE",True
P47859,"ATP-dependent 6-phosphofructokinase, platelet type",protein,9986,Oryctolagus cuniculus,Oryctolagus cuniculus (Rabbit),PFKP,791,PTHR13697:SF5,"ATP-DEPENDENT 6-PHOSPHOFRUCTOKINASE, PLATELET TYPE",True
P47860,"ATP-dependent 6-phosphofructokinase, platelet type",protein,10116,Rattus norvegicus,Rattus norvegicus (Rat),Pfkp,788,PTHR13697:SF5,"ATP-DEPENDENT 6-PHOSPHOFRUCTOKINASE, PLATELET TYPE",True
P52034,ATP-dependent 6-phosphofructokinase,protein,7227,Drosophila melanogaster,Drosophila melanogaster (Fruit fly),Pfk,788,PTHR13697:SF4,ATP-DEPENDENT 6-PHOSPHOFRUCTOKINASE,True
P52784,"ATP-dependent 6-phosphofructokinase, muscle type",protein,9615,Canis lupus familiaris,Canis lupus familiaris (Dog),PFKM,782,PTHR13697:SF59,"ATP-DEPENDENT 6-PHOSPHOFRUCTOKINASE, MUSCLE TYPE",True
P57391,ATP-dependent 6-phosphofructokinase,protein,107806,Buchnera aphidicola subsp. Acyrthosiphon pisum (strain APS),Buchnera aphidicola subsp. Acyrthosiphon pisum (strain APS),pfkA,320,PTHR13697:SF4,ATP-DEPENDENT 6-PHOSPHOFRUCTOKINASE,True
P59563,ATP-dependent 6-phosphofructokinase,protein,224915,Buchnera aphidicola subsp. Baizongia pistaciae (strain Bp),Buchnera aphidicola subsp. Baizongia pistaciae (strain Bp),pfkA,320,PTHR13697:SF4,ATP-DEPENDENT 6-PHOSPHOFRUCTOKINASE,True
P59680,ATP-dependent 6-phosphofructokinase,protein,284591,Yarrowia lipolytica (strain CLIB 122 / E 150),Yarrowia lipolytica (strain CLIB 122 / E 150) (Yeast),PFK1,953,PTHR13697:SF4,ATP-DEPENDENT 6-PHOSPHOFRUCTOKINASE,True
P65691,ATP-dependent 6-phosphofructokinase,protein,233413,Mycobacterium bovis (strain ATCC BAA-935 / AF2122/97),Mycobacterium bovis (strain ATCC BAA-935 / AF2122/97),pfkA,343,PTHR13697:SF52,ATP-DEPENDENT 6-PHOSPHOFRUCTOKINASE 3,True
P65692,ATP-dependent 6-phosphofructokinase,protein,99287,Salmonella typhimurium (strain LT2 / SGSC1412 / ATCC 700720),Salmonella typhimurium (strain LT2 / SGSC1412 / ATCC 700720),pfkA,320,PTHR13697:SF4,ATP-DEPENDENT 6-PHOSPHOFRUCTOKINASE,True
P65693,ATP-dependent 6-phosphofructokinase,protein,90370,Salmonella typhi,Salmonella typhi,pfkA,320,PTHR13697:SF4,ATP-DEPENDENT 6-PHOSPHOFRUCTOKINASE,True
P65694,ATP-dependent 6-phosphofructokinase,protein,158878,Staphylococcus aureus (strain Mu50 / ATCC 700699),Staphylococcus aureus (strain Mu50 / ATCC 700699),pfkA,322,PTHR13697:SF4,ATP-DEPENDENT 6-PHOSPHOFRUCTOKINASE,True
P65695,ATP-dependent 6-phosphofructokinase,protein,196620,Staphylococcus aureus (strain MW2),Staphylococcus aureus (strain MW2),pfkA,322,PTHR13697:SF4,ATP-DEPENDENT 6-PHOSPHOFRUCTOKINASE,True
P65696,ATP-dependent 6-phosphofructokinase,protein,211110,Streptococcus agalactiae serotype III (strain NEM316),Streptococcus agalactiae serotype III (strain NEM316),pfkA,340,PTHR13697:SF4,ATP-DEPENDENT 6-PHOSPHOFRUCTOKINASE,True
P65697,ATP-dependent 6-phosphofructokinase,protein,208435,Streptococcus agalactiae serotype V (strain ATCC BAA-611 / 2603 V/R),Streptococcus agalactiae serotype V (strain ATCC BAA-611 / 2603 V/R),pfkA,340,PTHR13697:SF4,ATP-DEPENDENT 6-PHOSPHOFRUCTOKINASE,True
P72830,ATP-dependent 6-phosphofructokinase 1,protein,1111708,Synechocystis sp. (strain ATCC 27184 / PCC 6803 / Kazusa),Synechocystis sp. (strain ATCC 27184 / PCC 6803 / Kazusa),pfkA1,361,PTHR13697:SF52,ATP-DEPENDENT 6-PHOSPHOFRUCTOKINASE 3,True
P75476,Probable ATP-dependent 6-phosphofructokinase,protein,272634,Mycoplasmoides pneumoniae (strain ATCC 29342 / M129 / Subtype 1),Mycoplasmoides pneumoniae (strain ATCC 29342 / M129 / Subtype 1),pfkA,328,PTHR13697:SF4,ATP-DEPENDENT 6-PHOSPHOFRUCTOKINASE,True
P78985,ATP-dependent 6-phosphofructokinase,protein,5061,Aspergillus niger,Aspergillus niger,pfkA,783,PTHR13697:SF4,ATP-DEPENDENT 6-PHOSPHOFRUCTOKINASE,True
P80019,ATP-dependent 6-phosphofructokinase,protein,1585,Lactobacillus delbrueckii subsp. bulgaricus,Lactobacillus delbrueckii subsp. bulgaricus,pfkA,319,PTHR13697:SF4,ATP-DEPENDENT 6-PHOSPHOFRUCTOKINASE,True
P90521,ATP-dependent 6-phosphofructokinase,protein,44689,Dictyostelium discoideum,Dictyostelium discoideum (Social amoeba),pfkA,834,PTHR13697:SF4,ATP-DEPENDENT 6-PHOSPHOFRUCTOKINASE,True
P99165,ATP-dependent 6-phosphofructokinase,protein,158879,Staphylococcus aureus (strain N315),Staphylococcus aureus (strain N315),pfkA,322,PTHR13697:SF4,ATP-DEPENDENT 6-PHOSPHOFRUCTOKINASE,True
P9WID6,ATP-dependent 6-phosphofructokinase,protein,83331,Mycobacterium tuberculosis (strain CDC 1551 / Oshkosh),Mycobacterium tuberculosis (strain CDC 1551 / Oshkosh),pfkA,343,PTHR13697:SF52,ATP-DEPENDENT 6-PHOSPHOFRUCTOKINASE 3,True
P9WID7,ATP-dependent 6-phosphofructokinase,protein,83332,Mycobacterium tuberculosis (strain ATCC 25618 / H37Rv),Mycobacterium tuberculosis (strain ATCC 25618 / H37Rv),pfkA,343,PTHR13697:SF52,ATP-DEPENDENT 6-PHOSPHOFRUCTOKINASE 3,True
Q01813,"ATP-dependent 6-phosphofructokinase, platelet type",protein,9606,Homo sapiens,Homo sapiens (Human),PFKP,784,PTHR13697:SF5,"ATP-DEPENDENT 6-PHOSPHOFRUCTOKINASE, PLATELET TYPE",True
Q02YK5,ATP-dependent 6-phosphofructokinase,protein,272622,Lactococcus lactis subsp. cremoris (strain SK11),Lactococcus lactis subsp. cremoris (strain SK11),pfkA,340,PTHR13697:SF4,ATP-DEPENDENT 6-PHOSPHOFRUCTOKINASE,True
Q03215,ATP-dependent 6-phosphofructokinase subunit alpha,protein,284590,Kluyveromyces lactis (strain ATCC 8585 / CBS 2359 / DSM 70799 / NBRC 1267 / NRRL Y-1140 / WM37),Kluyveromyces lactis (strain ATCC 8585 / CBS 2359 / DSM 70799 / NBRC 1267 / NRRL Y-1140 / WM37) (Yeast),PFK1,992,PTHR13697:SF57,ATP-DEPENDENT 6-PHOSPHOFRUCTOKINASE SUBUNIT ALPHA,True
Q03216,ATP-dependent 6-phosphofructokinase subunit beta,protein,284590,Kluyveromyces lactis (strain ATCC 8585 / CBS 2359 / DSM 70799 / NBRC 1267 / NRRL Y-1140 / WM37),Kluyveromyces lactis (strain ATCC 8585 / CBS 2359 / DSM 70799 / NBRC 1267 / NRRL Y-1140 / WM37) (Yeast),PFK2,938,PTHR13697:SF4,ATP-DEPENDENT 6-PHOSPHOFRUCTOKINASE,True
Q039I0,ATP-dependent 6-phosphofructokinase,protein,321967,Lacticaseibacillus paracasei (strain ATCC 334 / BCRC 17002 / CCUG 31169 / CIP 107868 / KCTC 3260 / NRRL B-441),Lacticaseibacillus paracasei (strain ATCC 334 / BCRC 17002 / CCUG 31169 / CIP 107868 / KCTC 3260 / NRRL B-441),pfkA,319,PTHR13697:SF4,ATP-DEPENDENT 6-PHOSPHOFRUCTOKINASE,True
Q03F74,ATP-dependent 6-phosphofructokinase,protein,278197,Pediococcus pentosaceus (strain ATCC 25745 / CCUG 21536 / LMG 10740 / 183-1w),Pediococcus pentosaceus (strain ATCC 25745 / CCUG 21536 / LMG 10740 / 183-1w),pfkA,322,PTHR13697:SF4,ATP-DEPENDENT 6-PHOSPHOFRUCTOKINASE,True
Q03KB7,ATP-dependent 6-phosphofructokinase,protein,322159,Streptococcus thermophilus (strain ATCC BAA-491 / LMD-9),Streptococcus thermophilus (strain ATCC BAA-491 / LMD-9),pfkA,339,PTHR13697:SF4,ATP-DEPENDENT 6-PHOSPHOFRUCTOKINASE,True
Q043V2,ATP-dependent 6-phosphofructokinase,protein,324831,Lactobacillus gasseri (strain ATCC 33323 / DSM 20243 / BCRC 14619 / CIP 102991 / JCM 1131 / KCTC 3163 / NCIMB 11718 / NCTC 13722 / AM63),Lactobacillus gasseri (strain ATCC 33323 / DSM 20243 / BCRC 14619 / CIP 102991 / JCM 1131 / KCTC 3163 / NCIMB 11718 / NCTC 13722 / AM63),pfkA,319,PTHR13697:SF4,ATP-DEPENDENT 6-PHOSPHOFRUCTOKINASE,True
Q04L24,ATP-dependent 6-phosphofructokinase,protein,373153,Streptococcus pneumoniae serotype 2 (strain D39 / NCTC 7466),Streptococcus pneumoniae serotype 2 (strain D39 / NCTC 7466),pfkA,335,PTHR13697:SF4,ATP-DEPENDENT 6-PHOSPHOFRUCTOKINASE,True
Q057P0,ATP-dependent 6-phosphofructokinase,protein,372461,Buchnera aphidicola subsp. Cinara cedri (strain Cc),Buchnera aphidicola subsp. Cinara cedri (strain Cc),pfkA,320,PTHR13697:SF4,ATP-DEPENDENT 6-PHOSPHOFRUCTOKINASE,True
Q0I267,ATP-dependent 6-phosphofructokinase,protein,205914,Histophilus somni (strain 129Pt),Histophilus somni (strain 129Pt),pfkA,321,PTHR13697:SF4,ATP-DEPENDENT 6-PHOSPHOFRUCTOKINASE,True
Q0IIG5,"ATP-dependent 6-phosphofructokinase, muscle type",protein,9913,Bos taurus,Bos taurus (Bovine),PFKM,779,PTHR13697:SF59,"ATP-DEPENDENT 6-PHOSPHOFRUCTOKINASE, MUSCLE TYPE",True
Q0TAE8,ATP-dependent 6-phosphofructokinase isozyme 1,protein,362663,Escherichia coli O6:K15:H31 (strain 536 / UPEC),Escherichia coli O6:K15:H31 (strain 536 / UPEC),pfkA,320,PTHR13697:SF4,ATP-DEPENDENT 6-PHOSPHOFRUCTOKINASE,True
Q11RE2,ATP-dependent 6-phosphofructokinase,protein,269798,Cytophaga hutchinsonii (strain ATCC 33406 / DSM 1761 / CIP 103989 / NBRC 15051 / NCIMB 9469 / D465),Cytophaga hutchinsonii (strain ATCC 33406 / DSM 1761 / CIP 103989 / NBRC 15051 / NCIMB 9469 / D465),pfkA,328,PTHR13697:SF4,ATP-DEPENDENT 6-PHOSPHOFRUCTOKINASE,True
Q180P4,ATP-dependent 6-phosphofructokinase,protein,272563,Clostridioides difficile (strain 630),Clostridioides difficile (strain 630),pfkA,319,PTHR13697:SF4,ATP-DEPENDENT 6-PHOSPHOFRUCTOKINASE,True
Q1C297,ATP-dependent 6-phosphofructokinase,protein,360102,Yersinia pestis bv. Antiqua (strain Antiqua),Yersinia pestis bv. Antiqua (strain Antiqua),pfkA,327,PTHR13697:SF4,ATP-DEPENDENT 6-PHOSPHOFRUCTOKINASE,True
Q1CD33,ATP-dependent 6-phosphofructokinase,protein,377628,Yersinia pestis bv. Antiqua (strain Nepal516),Yersinia pestis bv. Antiqua (strain Nepal516),pfkA,327,PTHR13697:SF4,ATP-DEPENDENT 6-PHOSPHOFRUCTOKINASE,True
Q1J694,ATP-dependent 6-phosphofructokinase,protein,370554,Streptococcus pyogenes serotype M4 (strain MGAS10750),Streptococcus pyogenes serotype M4 (strain MGAS10750),pfkA,337,PTHR13697:SF4,ATP-DEPENDENT 6-PHOSPHOFRUCTOKINASE,True
Q1JBF7,ATP-dependent 6-phosphofructokinase,protein,370553,Streptococcus pyogenes serotype M12 (strain MGAS2096),Streptococcus pyogenes serotype M12 (strain MGAS2096),pfkA,337,PTHR13697:SF4,ATP-DEPENDENT 6-PHOSPHOFRUCTOKINASE,True
Q1JGH6,ATP-dependent 6-phosphofructokinase,protein,370552,Streptococcus pyogenes serotype M2 (strain MGAS10270),Streptococcus pyogenes serotype M2 (strain MGAS10270),pfkA,337,PTHR13697:SF4,ATP-DEPENDENT 6-PHOSPHOFRUCTOKINASE,True
Q1JLD9,ATP-dependent 6-phosphofructokinase,protein,370551,Streptococcus pyogenes serotype M12 (strain MGAS9429),Streptococcus pyogenes serotype M12 (strain MGAS9429),pfkA,337,PTHR13697:SF4,ATP-DEPENDENT 6-PHOSPHOFRUCTOKINASE,True
Q1LTT2,ATP-dependent 6-phosphofructokinase,protein,374463,Baumannia cicadellinicola subsp. Homalodisca coagulata,Baumannia cicadellinicola subsp. Homalodisca coagulata,pfkA,320,PTHR13697:SF4,ATP-DEPENDENT 6-PHOSPHOFRUCTOKINASE,True
Q1WTT3,ATP-dependent 6-phosphofructokinase,protein,362948,Ligilactobacillus salivarius (strain UCC118),Ligilactobacillus salivarius (strain UCC118),pfkA,320,PTHR13697:SF4,ATP-DEPENDENT 6-PHOSPHOFRUCTOKINASE,True
Q27483,ATP-dependent 6-phosphofructokinase 2,protein,6239,Caenorhabditis elegans,Caenorhabditis elegans,pfk-1.2,756,PTHR13697:SF8,ATP-DEPENDENT 6-PHOSPHOFRUCTOKINASE 2,True
Q27543,ATP-dependent 6-phosphofructokinase,protein,6837,Calanus finmarchicus,Calanus finmarchicus,PFK,184,PTHR13697:SF4,ATP-DEPENDENT 6-PHOSPHOFRUCTOKINASE,True
Q27665,ATP-dependent 6-phosphofructokinase,protein,6289,Haemonchus contortus,Haemonchus contortus (Barber pole worm),PFK,789,PTHR13697:SF4,ATP-DEPENDENT 6-PHOSPHOFRUCTOKINASE,True
Q27778,ATP-dependent 6-phosphofructokinase,protein,6183,Schistosoma mansoni,Schistosoma mansoni (Blood fluke),PFK,781,PTHR13697:SF4,ATP-DEPENDENT 6-PHOSPHOFRUCTOKINASE,True
Q2FXM8,ATP-dependent 6-phosphofructokinase,protein,93061,Staphylococcus aureus (strain NCTC 8325 / PS 47),Staphylococcus aureus (strain NCTC 8325 / PS 47),pfkA,322,PTHR13697:SF4,ATP-DEPENDENT 6-PHOSPHOFRUCTOKINASE,True
Q2HYU2,"ATP-dependent 6-phosphofructokinase, muscle type",protein,9823,Sus scrofa,Sus scrofa (Pig),PFKM,780,PTHR13697:SF59,"ATP-DEPENDENT 6-PHOSPHOFRUCTOKINASE, MUSCLE TYPE",True
Q2NQX2,ATP-dependent 6-phosphofructokinase,protein,343509,Sodalis glossinidius (strain morsitans),Sodalis glossinidius (strain morsitans),pfkA,320,PTHR13697:SF4,ATP-DEPENDENT 6-PHOSPHOFRUCTOKINASE,True
Q2SSQ6,ATP-dependent 6-phosphofructokinase,protein,340047,Mycoplasma capricolum subsp. capricolum (strain California kid / ATCC 27343 / NCTC 10154),Mycoplasma capricolum subsp. capricolum (strain California kid / ATCC 27343 / NCTC 10154),pfkA,326,PTHR13697:SF4,ATP-DEPENDENT 6-PHOSPHOFRUCTOKINASE,True
Q2YTE2,ATP-dependent 6-phosphofructokinase,protein,273036,Staphylococcus aureus (strain bovine RF122 / ET3-1),Staphylococcus aureus (strain bovine RF122 / ET3-1),pfkA,322,PTHR13697:SF4,ATP-DEPENDENT 6-PHOSPHOFRUCTOKINASE,True
Q30T53,ATP-dependent 6-phosphofructokinase,protein,326298,Sulfurimonas denitrificans (strain ATCC 33889 / DSM 1251),Sulfurimonas denitrificans (strain ATCC 33889 / DSM 1251),pfkA,319,PTHR13697:SF4,ATP-DEPENDENT 6-PHOSPHOFRUCTOKINASE,True
Q31U74,ATP-dependent 6-phosphofructokinase isozyme 1,protein,300268,Shigella boydii serotype 4 (strain Sb227),Shigella boydii serotype 4 (strain Sb227),pfkA,320,PTHR13697:SF4,ATP-DEPENDENT 6-PHOSPHOFRUCTOKINASE,True
Q32A80,ATP-dependent 6-phosphofructokinase isozyme 1,protein,300267,Shigella dysenteriae serotype 1 (strain Sd197),Shigella dysenteriae serotype 1 (strain Sd197),pfkA,320,PTHR13697:SF4,ATP-DEPENDENT 6-PHOSPHOFRUCTOKINASE,True
Q3K1E6,ATP-dependent 6-phosphofructokinase,protein,205921,Streptococcus agalactiae serotype Ia (strain ATCC 27591 / A909 / CDC SS700),Streptococcus agalactiae serotype Ia (strain ATCC 27591 / A909 / CDC SS700),pfkA,340,PTHR13697:SF4,ATP-DEPENDENT 6-PHOSPHOFRUCTOKINASE,True
Q3M8N2,ATP-dependent 6-phosphofructokinase,protein,240292,Trichormus variabilis (strain ATCC 29413 / PCC 7937),Trichormus variabilis (strain ATCC 29413 / PCC 7937),pfkA,357,PTHR13697:SF52,ATP-DEPENDENT 6-PHOSPHOFRUCTOKINASE 3,True
Q3YV62,ATP-dependent 6-phosphofructokinase isozyme 1,protein,300269,Shigella sonnei (strain Ss046),Shigella sonnei (strain Ss046),pfkA,320,PTHR13697:SF4,ATP-DEPENDENT 6-PHOSPHOFRUCTOKINASE,True
Q48T86,ATP-dependent 6-phosphofructokinase,protein,319701,Streptococcus pyogenes serotype M28 (strain MGAS6180),Streptococcus pyogenes serotype M28 (strain MGAS6180),pfkA,337,PTHR13697:SF4,ATP-DEPENDENT 6-PHOSPHOFRUCTOKINASE,True
Q4A8Q3,ATP-dependent 6-phosphofructokinase,protein,262722,Mesomycoplasma hyopneumoniae (strain 7448),Mesomycoplasma hyopneumoniae (strain 7448),pfkA,322,PTHR13697:SF4,ATP-DEPENDENT 6-PHOSPHOFRUCTOKINASE,True
Q4AAM2,ATP-dependent 6-phosphofructokinase,protein,262719,Mesomycoplasma hyopneumoniae (strain J / ATCC 25934 / NCTC 10110),Mesomycoplasma hyopneumoniae (strain J / ATCC 25934 / NCTC 10110),pfkA,322,PTHR13697:SF4,ATP-DEPENDENT 6-PHOSPHOFRUCTOKINASE,True
Q4MVY3,ATP-dependent 6-phosphofructokinase,protein,1396,Bacillus cereus,Bacillus cereus,pfkA,319,PTHR13697:SF4,ATP-DEPENDENT 6-PHOSPHOFRUCTOKINASE,True
Q4QLS8,ATP-dependent 6-phosphofructokinase,protein,281310,Haemophilus influenzae (strain 86-028NP),Haemophilus influenzae (strain 86-028NP),pfkA,321,PTHR13697:SF4,ATP-DEPENDENT 6-PHOSPHOFRUCTOKINASE,True
